id,title,abstract,authors,categories,date
http://arxiv.org/abs/1507.07094v3,Unknown sparsity in compressed sensing: Denoising and inference,"The theory of Compressed Sensing (CS) asserts that an unknown signal
$x\in\mathbb{R}^p$ can be accurately recovered from an underdetermined set of
$n$ linear measurements with $n\ll p$, provided that $x$ is sufficiently
sparse. However, in applications, the degree of sparsity $\|x\|_0$ is typically
unknown, and the problem of directly estimating $\|x\|_0$ has been a
longstanding gap between theory and practice. A closely related issue is that
$\|x\|_0$ is a highly idealized measure of sparsity, and for real signals with
entries not equal to 0, the value $\|x\|_0=p$ is not a useful description of
compressibility. In our previous conference paper [Lop13] that examined these
problems, we considered an alternative measure of ""soft"" sparsity,
$\|x\|_1^2/\|x\|_2^2$, and designed a procedure to estimate
$\|x\|_1^2/\|x\|_2^2$ that does not rely on sparsity assumptions.
  The present work offers a new deconvolution-based method for estimating
unknown sparsity, which has wider applicability and sharper theoretical
guarantees. In particular, we introduce a family of entropy-based sparsity
measures $s_q(x):=\big(\frac{\|x\|_q}{\|x\|_1}\big)^{\frac{q}{1-q}}$
parameterized by $q\in[0,\infty]$. This family interpolates between
$\|x\|_0=s_0(x)$ and $\|x\|_1^2/\|x\|_2^2=s_2(x)$ as $q$ ranges over $[0,2]$.
For any $q\in (0,2]\setminus\{1\}$, we propose an estimator $\hat{s}_q(x)$
whose relative error converges at the dimension-free rate of $1/\sqrt{n}$, even
when $p/n\to\infty$. Our main results also describe the limiting distribution
of $\hat{s}_q(x)$, as well as some connections to Basis Pursuit Denosing, the
Lasso, deterministic measurement matrices, and inference problems in CS.",['Miles E. Lopes'],"['cs.IT', 'math.IT', 'math.ST', 'stat.ME', 'stat.ML', 'stat.TH']",2015-07-25 11:17:03+00:00
http://arxiv.org/abs/1507.06977v4,String and Membrane Gaussian Processes,"In this paper we introduce a novel framework for making exact nonparametric
Bayesian inference on latent functions, that is particularly suitable for Big
Data tasks. Firstly, we introduce a class of stochastic processes we refer to
as string Gaussian processes (string GPs), which are not to be mistaken for
Gaussian processes operating on text. We construct string GPs so that their
finite-dimensional marginals exhibit suitable local conditional independence
structures, which allow for scalable, distributed, and flexible nonparametric
Bayesian inference, without resorting to approximations, and while ensuring
some mild global regularity constraints. Furthermore, string GP priors
naturally cope with heterogeneous input data, and the gradient of the learned
latent function is readily available for explanatory analysis. Secondly, we
provide some theoretical results relating our approach to the standard GP
paradigm. In particular, we prove that some string GPs are Gaussian processes,
which provides a complementary global perspective on our framework. Finally, we
derive a scalable and distributed MCMC scheme for supervised learning tasks
under string GP priors. The proposed MCMC scheme has computational time
complexity $\mathcal{O}(N)$ and memory requirement $\mathcal{O}(dN)$, where $N$
is the data size and $d$ the dimension of the input space. We illustrate the
efficacy of the proposed approach on several synthetic and real-world datasets,
including a dataset with $6$ millions input points and $8$ attributes.","['Yves-Laurent Kom Samo', 'Stephen Roberts']","['stat.ML', '60G15']",2015-07-24 19:53:47+00:00
http://arxiv.org/abs/1507.06970v2,Perturbed Iterate Analysis for Asynchronous Stochastic Optimization,"We introduce and analyze stochastic optimization methods where the input to
each gradient update is perturbed by bounded noise. We show that this framework
forms the basis of a unified approach to analyze asynchronous implementations
of stochastic optimization algorithms.In this framework, asynchronous
stochastic optimization algorithms can be thought of as serial methods
operating on noisy inputs. Using our perturbed iterate framework, we provide
new analyses of the Hogwild! algorithm and asynchronous stochastic coordinate
descent, that are simpler than earlier analyses, remove many assumptions of
previous models, and in some cases yield improved upper bounds on the
convergence rates. We proceed to apply our framework to develop and analyze
KroMagnon: a novel, parallel, sparse stochastic variance-reduced gradient
(SVRG) algorithm. We demonstrate experimentally on a 16-core machine that the
sparse and parallel version of SVRG is in some cases more than four orders of
magnitude faster than the standard SVRG algorithm.","['Horia Mania', 'Xinghao Pan', 'Dimitris Papailiopoulos', 'Benjamin Recht', 'Kannan Ramchandran', 'Michael I. Jordan']","['stat.ML', 'cs.DC', 'cs.DS', 'cs.LG', 'math.OC', '65K10, 65Y05, 68W10, 68W20']",2015-07-24 19:36:13+00:00
http://arxiv.org/abs/1507.06947v1,Fast and Accurate Recurrent Neural Network Acoustic Models for Speech Recognition,"We have recently shown that deep Long Short-Term Memory (LSTM) recurrent
neural networks (RNNs) outperform feed forward deep neural networks (DNNs) as
acoustic models for speech recognition. More recently, we have shown that the
performance of sequence trained context dependent (CD) hidden Markov model
(HMM) acoustic models using such LSTM RNNs can be equaled by sequence trained
phone models initialized with connectionist temporal classification (CTC). In
this paper, we present techniques that further improve performance of LSTM RNN
acoustic models for large vocabulary speech recognition. We show that frame
stacking and reduced frame rate lead to more accurate models and faster
decoding. CD phone modeling leads to further improvements. We also present
initial results for LSTM RNN models outputting words directly.","['Haşim Sak', 'Andrew Senior', 'Kanishka Rao', 'Françoise Beaufays']","['cs.CL', 'cs.LG', 'cs.NE', 'stat.ML']",2015-07-24 18:28:32+00:00
http://arxiv.org/abs/1507.06802v1,Implicitly Constrained Semi-Supervised Least Squares Classification,"We introduce a novel semi-supervised version of the least squares classifier.
This implicitly constrained least squares (ICLS) classifier minimizes the
squared loss on the labeled data among the set of parameters implied by all
possible labelings of the unlabeled data. Unlike other discriminative
semi-supervised methods, our approach does not introduce explicit additional
assumptions into the objective function, but leverages implicit assumptions
already present in the choice of the supervised least squares classifier. We
show this approach can be formulated as a quadratic programming problem and its
solution can be found using a simple gradient descent procedure. We prove that,
in a certain way, our method never leads to performance worse than the
supervised classifier. Experimental results corroborate this theoretical result
in the multidimensional case on benchmark datasets, also in terms of the error
rate.","['Jesse H. Krijthe', 'Marco Loog']","['stat.ML', 'cs.LG']",2015-07-24 10:39:44+00:00
http://arxiv.org/abs/1507.06763v2,Differentially Private Analysis of Outliers,"This paper investigates differentially private analysis of distance-based
outliers. The problem of outlier detection is to find a small number of
instances that are apparently distant from the remaining instances. On the
other hand, the objective of differential privacy is to conceal presence (or
absence) of any particular instance. Outlier detection and privacy protection
are thus intrinsically conflicting tasks. In this paper, instead of reporting
outliers detected, we present two types of differentially private queries that
help to understand behavior of outliers. One is the query to count outliers,
which reports the number of outliers that appear in a given subspace. Our
formal analysis on the exact global sensitivity of outlier counts reveals that
regular global sensitivity based method can make the outputs too noisy,
particularly when the dimensionality of the given subspace is high. Noting that
the counts of outliers are typically expected to be relatively small compared
to the number of data, we introduce a mechanism based on the smooth upper bound
of the local sensitivity. The other is the query to discovery top-$h$ subspaces
containing a large number of outliers. This task can be naively achieved by
issuing count queries to each subspace in turn. However, the variation of
subspaces can grow exponentially in the data dimensionality. This can cause
serious consumption of the privacy budget. For this task, we propose an
exponential mechanism with a customized score function for subspace discovery.
To the best of our knowledge, this study is the first trial to ensure
differential privacy for distance-based outlier analysis. We demonstrated our
methods with synthesized datasets and real datasets. The experimental results
show that out method achieve better utility compared to the global sensitivity
based methods.","['Rina Okada', 'Kazuto Fukuchi', 'Kazuya Kakizaki', 'Jun Sakuma']","['stat.ML', 'cs.CR', 'cs.LG']",2015-07-24 07:30:49+00:00
http://arxiv.org/abs/1507.06759v2,"Variational Bayesian strategies for high-dimensional, stochastic design problems","This paper is concerned with a lesser-studied problem in the context of
model-based, uncertainty quantification (UQ), that of
optimization/design/control under uncertainty. The solution of such problems is
hindered not only by the usual difficulties encountered in UQ tasks (e.g. the
high computational cost of each forward simulation, the large number of random
variables) but also by the need to solve a nonlinear optimization problem
involving large numbers of design variables and potentially constraints. We
propose a framework that is suitable for a large class of such problems and is
based on the idea of recasting them as probabilistic inference tasks. To that
end, we propose a Variational Bayesian (VB) formulation and an iterative
VB-Expectation-Maximization scheme that is also capable of identifying a
low-dimensional set of directions in the design space, along which, the
objective exhibits the largest sensitivity.
  We demonstrate the validity of the proposed approach in the context of two
numerical examples involving $\mathcal{O}(10^3)$ random and design variables.
In all cases considered the cost of the computations in terms of calls to the
forward model was of the order $\mathcal{O}(10^2)$. The accuracy of the
approximations provided is assessed by appropriate information-theoretic
metrics.",['Phaedon-Stelios Koutsourelakis'],"['stat.CO', 'math.NA', 'stat.ML']",2015-07-24 07:00:32+00:00
http://arxiv.org/abs/1507.06738v2,Linear Contextual Bandits with Knapsacks,"We consider the linear contextual bandit problem with resource consumption,
in addition to reward generation. In each round, the outcome of pulling an arm
is a reward as well as a vector of resource consumptions. The expected values
of these outcomes depend linearly on the context of that arm. The
budget/capacity constraints require that the total consumption doesn't exceed
the budget for each resource. The objective is once again to maximize the total
reward. This problem turns out to be a common generalization of classic linear
contextual bandits (linContextual), bandits with knapsacks (BwK), and the
online stochastic packing problem (OSPP). We present algorithms with
near-optimal regret bounds for this problem. Our bounds compare favorably to
results on the unstructured version of the problem where the relation between
the contexts and the outcomes could be arbitrary, but the algorithm only
competes against a fixed set of policies accessible through an optimization
oracle. We combine techniques from the work on linContextual, BwK, and OSPP in
a nontrivial manner while also tackling new difficulties that are not present
in any of these special cases.","['Shipra Agrawal', 'Nikhil R. Devanur']","['cs.LG', 'math.OC', 'stat.ML']",2015-07-24 04:24:22+00:00
http://arxiv.org/abs/1507.06683v1,Clustering of Modal Valued Symbolic Data,"Symbolic Data Analysis is based on special descriptions of data - symbolic
objects (SO). Such descriptions preserve more detailed information about units
and their clusters than the usual representations with mean values. A special
kind of symbolic object is a representation with frequency or probability
distributions (modal values). This representation enables us to consider in the
clustering process the variables of all measurement types at the same time. In
the paper a clustering criterion function for SOs is proposed such that the
representative of each cluster is again composed of distributions of variables'
values over the cluster. The corresponding leaders clustering method is based
on this result. It is also shown that for the corresponding agglomerative
hierarchical method a generalized Ward's formula holds. Both methods are
compatible - they are solving the same clustering optimization problem. The
leaders method efficiently solves clustering problems with large number of
units; while the agglomerative method can be applied alone on the smaller data
set, or it could be applied on leaders, obtained with compatible
nonhierarchical clustering method. Such a combination of two compatible methods
enables us to decide upon the right number of clusters on the basis of the
corresponding dendrogram. The proposed methods were applied on different data
sets. In the paper, some results of clustering of ESS data are presented.","['Vladimir Batagelj', 'Nataša Kejžar', 'Simona Korenjak-Černe']","['stat.ML', '62H30, 91C20, 62-07, 68T10']",2015-07-23 21:07:11+00:00
http://arxiv.org/abs/1507.06682v2,Supervised Collective Classification for Crowdsourcing,"Crowdsourcing utilizes the wisdom of crowds for collective classification via
information (e.g., labels of an item) provided by labelers. Current
crowdsourcing algorithms are mainly unsupervised methods that are unaware of
the quality of crowdsourced data. In this paper, we propose a supervised
collective classification algorithm that aims to identify reliable labelers
from the training data (e.g., items with known labels). The reliability (i.e.,
weighting factor) of each labeler is determined via a saddle point algorithm.
The results on several crowdsourced data show that supervised methods can
achieve better classification accuracy than unsupervised methods, and our
proposed method outperforms other algorithms.","['Pin-Yu Chen', 'Chia-Wei Lien', 'Fu-Jen Chu', 'Pai-Shun Ting', 'Shin-Ming Cheng']","['cs.SI', 'cs.LG', 'stat.ML']",2015-07-23 21:02:33+00:00
http://arxiv.org/abs/1507.06615v1,Optimal Learning Rates for Localized SVMs,"One of the limiting factors of using support vector machines (SVMs) in large
scale applications are their super-linear computational requirements in terms
of the number of training samples. To address this issue, several approaches
that train SVMs on many small chunks of large data sets separately have been
proposed in the literature. So far, however, almost all these approaches have
only been empirically investigated. In addition, their motivation was always
based on computational requirements. In this work, we consider a localized SVM
approach based upon a partition of the input space. For this local SVM, we
derive a general oracle inequality. Then we apply this oracle inequality to
least squares regression using Gaussian kernels and deduce local learning rates
that are essentially minimax optimal under some standard smoothness assumptions
on the regression function. This gives the first motivation for using local
SVMs that is not based on computational requirements but on theoretical
predictions on the generalization performance. We further introduce a
data-dependent parameter selection method for our local SVM approach and show
that this method achieves the same learning rates as before. Finally, we
present some larger scale experiments for our localized SVM showing that it
achieves essentially the same test performance as a global SVM for a fraction
of the computational requirements. In addition, it turns out that the
computational requirements for the local SVMs are similar to those of a vanilla
random chunk approach, while the achieved test errors are significantly better.","['Mona Eberts', 'Ingo Steinwart']",['stat.ML'],2015-07-23 19:03:48+00:00
http://arxiv.org/abs/1507.06580v1,Multi-scale exploration of convex functions and bandit convex optimization,"We construct a new map from a convex function to a distribution on its
domain, with the property that this distribution is a multi-scale exploration
of the function. We use this map to solve a decade-old open problem in
adversarial bandit convex optimization by showing that the minimax regret for
this problem is $\tilde{O}(\mathrm{poly}(n) \sqrt{T})$, where $n$ is the
dimension and $T$ the number of rounds. This bound is obtained by studying the
dual Bayesian maximin regret via the information ratio analysis of Russo and
Van Roy, and then using the multi-scale exploration to solve the Bayesian
problem.","['Sébastien Bubeck', 'Ronen Eldan']","['math.MG', 'cs.LG', 'math.OC', 'math.PR', 'stat.ML']",2015-07-23 17:32:49+00:00
http://arxiv.org/abs/1507.06535v1,Manitest: Are classifiers really invariant?,"Invariance to geometric transformations is a highly desirable property of
automatic classifiers in many image recognition tasks. Nevertheless, it is
unclear to which extent state-of-the-art classifiers are invariant to basic
transformations such as rotations and translations. This is mainly due to the
lack of general methods that properly measure such an invariance. In this
paper, we propose a rigorous and systematic approach for quantifying the
invariance to geometric transformations of any classifier. Our key idea is to
cast the problem of assessing a classifier's invariance as the computation of
geodesics along the manifold of transformed images. We propose the Manitest
method, built on the efficient Fast Marching algorithm to compute the
invariance of classifiers. Our new method quantifies in particular the
importance of data augmentation for learning invariance from data, and the
increased invariance of convolutional neural networks with depth. We foresee
that the proposed generic tool for measuring invariance to a large class of
geometric transformations and arbitrary classifiers will have many applications
for evaluating and comparing classifiers based on their invariance, and help
improving the invariance of existing classifiers.","['Alhussein Fawzi', 'Pascal Frossard']","['cs.CV', 'cs.LG', 'stat.ML']",2015-07-23 15:36:50+00:00
http://arxiv.org/abs/1507.06452v1,Dynamic Matrix Factorization with Priors on Unknown Values,"Advanced and effective collaborative filtering methods based on explicit
feedback assume that unknown ratings do not follow the same model as the
observed ones (\emph{not missing at random}). In this work, we build on this
assumption, and introduce a novel dynamic matrix factorization framework that
allows to set an explicit prior on unknown values. When new ratings, users, or
items enter the system, we can update the factorization in time independent of
the size of data (number of users, items and ratings). Hence, we can quickly
recommend items even to very recent users. We test our methods on three large
datasets, including two very sparse ones, in static and dynamic conditions. In
each case, we outrank state-of-the-art matrix factorization methods that do not
use a prior on unknown ratings.","['Robin Devooght', 'Nicolas Kourtellis', 'Amin Mantrach']","['stat.ML', 'cs.IR', 'cs.LG']",2015-07-23 11:39:58+00:00
http://arxiv.org/abs/1507.06411v1,Arbitrariness of peer review: A Bayesian analysis of the NIPS experiment,"The principle of peer review is central to the evaluation of research, by
ensuring that only high-quality items are funded or published. But peer review
has also received criticism, as the selection of reviewers may introduce biases
in the system. In 2014, the organizers of the ``Neural Information Processing
Systems\rq\rq{} conference conducted an experiment in which $10\%$ of submitted
manuscripts (166 items) went through the review process twice. Arbitrariness
was measured as the conditional probability for an accepted submission to get
rejected if examined by the second committee. This number was equal to $60\%$,
for a total acceptance rate equal to $22.5\%$. Here we present a Bayesian
analysis of those two numbers, by introducing a hidden parameter which measures
the probability that a submission meets basic quality criteria. The standard
quality criteria usually include novelty, clarity, reproducibility, correctness
and no form of misconduct, and are met by a large proportions of submitted
items. The Bayesian estimate for the hidden parameter was equal to $56\%$
($95\%$CI: $ I = (0.34, 0.83)$), and had a clear interpretation. The result
suggested the total acceptance rate should be increased in order to decrease
arbitrariness estimates in future review processes.",['Olivier Francois'],"['stat.OT', 'cs.DL', 'stat.ML']",2015-07-23 08:39:34+00:00
http://arxiv.org/abs/1507.06370v2,Sum-of-Squares Lower Bounds for Sparse PCA,"This paper establishes a statistical versus computational trade-off for
solving a basic high-dimensional machine learning problem via a basic convex
relaxation method. Specifically, we consider the {\em Sparse Principal
Component Analysis} (Sparse PCA) problem, and the family of {\em
Sum-of-Squares} (SoS, aka Lasserre/Parillo) convex relaxations. It was well
known that in large dimension $p$, a planted $k$-sparse unit vector can be {\em
in principle} detected using only $n \approx k\log p$ (Gaussian or Bernoulli)
samples, but all {\em efficient} (polynomial time) algorithms known require $n
\approx k^2$ samples. It was also known that this quadratic gap cannot be
improved by the the most basic {\em semi-definite} (SDP, aka spectral)
relaxation, equivalent to a degree-2 SoS algorithms. Here we prove that also
degree-4 SoS algorithms cannot improve this quadratic gap. This average-case
lower bound adds to the small collection of hardness results in machine
learning for this powerful family of convex relaxation algorithms. Moreover,
our design of moments (or ""pseudo-expectations"") for this lower bound is quite
different than previous lower bounds. Establishing lower bounds for higher
degree SoS algorithms for remains a challenging problem.","['Tengyu Ma', 'Avi Wigderson']","['cs.LG', 'cs.CC', 'math.ST', 'stat.CO', 'stat.ML', 'stat.TH']",2015-07-23 01:50:43+00:00
http://arxiv.org/abs/1507.06350v7,Admissibility of a posterior predictive decision rule,"Recent decades have seen an interest in prediction problems for which
Bayesian methodology has been used ubiquitously. Sampling from or approximating
the posterior predictive distribution in a Bayesian model allows one to make
inferential statements about potentially observable random quantities given
observed data. The purpose of this note is to use statistical decision theory
as a basis to justify the use of a posterior predictive distribution for making
a point prediction.",['Giri Gopalan'],['stat.ML'],2015-07-22 22:29:30+00:00
http://arxiv.org/abs/1507.06346v1,Evaluation of Spectral Learning for the Identification of Hidden Markov Models,"Hidden Markov models have successfully been applied as models of discrete
time series in many fields. Often, when applied in practice, the parameters of
these models have to be estimated. The currently predominating identification
methods, such as maximum-likelihood estimation and especially
expectation-maximization, are iterative and prone to have problems with local
minima. A non-iterative method employing a spectral subspace-like approach has
recently been proposed in the machine learning literature. This paper evaluates
the performance of this algorithm, and compares it to the performance of the
expectation-maximization algorithm, on a number of numerical examples. We find
that the performance is mixed; it successfully identifies some systems with
relatively few available observations, but fails completely for some systems
even when a large amount of observations is available. An open question is how
this discrepancy can be explained. We provide some indications that it could be
related to how well-conditioned some system parameters are.","['Robert Mattila', 'Cristian R. Rojas', 'Bo Wahlberg']","['stat.ML', 'cs.LG', 'math.OC']",2015-07-22 21:49:19+00:00
