id,title,abstract,authors,categories,date
http://arxiv.org/abs/1801.02149v1,Applying an Ensemble Learning Method for Improving Multi-label Classification Performance,"In recent years, multi-label classification problem has become a
controversial issue. In this kind of classification, each sample is associated
with a set of class labels. Ensemble approaches are supervised learning
algorithms in which an operator takes a number of learning algorithms, namely
base-level algorithms and combines their outcomes to make an estimation. The
simplest form of ensemble learning is to train the base-level algorithms on
random subsets of data and then let them vote for the most popular
classifications or average the predictions of the base-level algorithms. In
this study, an ensemble learning method is proposed for improving multi-label
classification evaluation criteria. We have compared our method with well-known
base-level algorithms on some data sets. Experiment results show the proposed
approach outperforms the base well-known classifiers for the multi-label
classification problem.","['Amirreza Mahdavi-Shahri', 'Mahboobeh Houshmand', 'Mahdi Yaghoobi', 'Mehrdad Jalali']","['cs.LG', 'stat.ML']",2018-01-07 06:43:46+00:00
http://arxiv.org/abs/1801.02125v2,Threshold Auto-Tuning Metric Learning,"It has been reported repeatedly that discriminative learning of distance
metric boosts the pattern recognition performance. A weak point of ITML-based
methods is that the distance threshold for similarity/dissimilarity constraints
must be determined manually and it is sensitive to generalization performance,
although the ITML-based methods enjoy an advantage that the Bregman projection
framework can be applied for optimization of distance metric. In this paper, we
present a new formulation of metric learning algorithm in which the distance
threshold is optimized together. Since the optimization is still in the Bregman
projection framework, the Dykstra algorithm can be applied for optimization. A
nonlinear equation has to be solved to project the solution onto a half-space
in each iteration. Na\""{i}ve method takes $O(LMn^{3})$ computational time to
solve the nonlinear equation. In this study, an efficient technique that can
solve the nonlinear equation in $O(Mn^{3})$ has been discovered. We have proved
that the root exists and is unique. We empirically show that the accuracy of
pattern recognition for the proposed metric learning algorithm is comparable to
the existing metric learning methods, yet the distance threshold is
automatically tuned for the proposed metric learning algorithm.","['Yuya Onuma', 'Rachelle Rivero', 'Tsuyoshi Kato']","['cs.LG', 'stat.ML']",2018-01-07 04:01:24+00:00
http://arxiv.org/abs/1801.02124v2,Competitive Multi-agent Inverse Reinforcement Learning with Sub-optimal Demonstrations,"This paper considers the problem of inverse reinforcement learning in
zero-sum stochastic games when expert demonstrations are known to be not
optimal. Compared to previous works that decouple agents in the game by
assuming optimality in expert strategies, we introduce a new objective function
that directly pits experts against Nash Equilibrium strategies, and we design
an algorithm to solve for the reward function in the context of inverse
reinforcement learning with deep neural networks as model approximations. In
our setting the model and algorithm do not decouple by agent. In order to find
Nash Equilibrium in large-scale games, we also propose an adversarial training
algorithm for zero-sum stochastic games, and show the theoretical appeal of
non-existence of local optima in its objective function. In our numerical
experiments, we demonstrate that our Nash Equilibrium and inverse reinforcement
learning algorithms address games that are not amenable to previous approaches
using tabular representations. Moreover, with sub-optimal expert demonstrations
our algorithms recover both reward functions and strategies with good quality.","['Xingyu Wang', 'Diego Klabjan']","['stat.ML', 'cs.LG']",2018-01-07 03:53:30+00:00
http://arxiv.org/abs/1801.02961v2,Representation Learning with Autoencoders for Electronic Health Records: A Comparative Study,"Increasing volume of Electronic Health Records (EHR) in recent years provides
great opportunities for data scientists to collaborate on different aspects of
healthcare research by applying advanced analytics to these EHR clinical data.
A key requirement however is obtaining meaningful insights from high
dimensional, sparse and complex clinical data. Data science approaches
typically address this challenge by performing feature learning in order to
build more reliable and informative feature representations from clinical data
followed by supervised learning. In this paper, we propose a predictive
modeling approach based on deep learning based feature representations and word
embedding techniques. Our method uses different deep architectures (stacked
sparse autoencoders, deep belief network, adversarial autoencoders and
variational autoencoders) for feature representation in higher-level
abstraction to obtain effective and robust features from EHRs, and then build
prediction models on top of them. Our approach is particularly useful when the
unlabeled data is abundant whereas labeled data is scarce. We investigate the
performance of representation learning through a supervised learning approach.
Our focus is to present a comparative study to evaluate the performance of
different deep architectures through supervised learning and provide insights
in the choice of deep feature representation techniques. Our experiments
demonstrate that for small data sets, stacked sparse autoencoder demonstrates a
superior generality performance in prediction due to sparsity regularization
whereas variational autoencoders outperform the competing approaches for large
data sets due to its capability of learning the representation distribution.","['Najibesadat Sadati', 'Milad Zafar Nezhad', 'Ratna Babu Chinnam', 'Dongxiao Zhu']","['cs.LG', 'stat.ML']",2018-01-06 23:17:24+00:00
http://arxiv.org/abs/1801.02013v3,Multiscale Sparse Microcanonical Models,"We study approximations of non-Gaussian stationary processes having long
range correlations with microcanonical models. These models are conditioned by
the empirical value of an energy vector, evaluated on a single realization.
Asymptotic properties of maximum entropy microcanonical and macrocanonical
processes and their convergence to Gibbs measures are reviewed. We show that
the Jacobian of the energy vector controls the entropy rate of microcanonical
processes.
  Sampling maximum entropy processes through MCMC algorithms require too many
operations when the number of constraints is large. We define microcanonical
gradient descent processes by transporting a maximum entropy measure with a
gradient descent algorithm which enforces the energy conditions. Convergence
and symmetries are analyzed. Approximations of non-Gaussian processes with long
range interactions are defined with multiscale energy vectors computed with
wavelet and scattering transforms. Sparsity properties are captured with $\bf
l^1$ norms. Approximations of Gaussian, Ising and point processes are studied,
as well as image and audio texture synthesis.","['Joan Bruna', 'Stephane Mallat']","['math-ph', 'math.MP', 'stat.ML']",2018-01-06 13:18:46+00:00
http://arxiv.org/abs/1801.01973v2,A Note on the Inception Score,"Deep generative models are powerful tools that have produced impressive
results in recent years. These advances have been for the most part empirically
driven, making it essential that we use high quality evaluation metrics. In
this paper, we provide new insights into the Inception Score, a recently
proposed and widely used evaluation metric for generative models, and
demonstrate that it fails to provide useful guidance when comparing models. We
discuss both suboptimalities of the metric itself and issues with its
application. Finally, we call for researchers to be more systematic and careful
when evaluating and comparing generative models, as the advancement of the
field depends upon it.","['Shane Barratt', 'Rishi Sharma']","['stat.ML', 'cs.LG']",2018-01-06 05:44:29+00:00
http://arxiv.org/abs/1801.01961v2,Compressive sensing adaptation for polynomial chaos expansions,"Basis adaptation in Homogeneous Chaos spaces rely on a suitable rotation of
the underlying Gaussian germ. Several rotations have been proposed in the
literature resulting in adaptations with different convergence properties. In
this paper we present a new adaptation mechanism that builds on compressive
sensing algorithms, resulting in a reduced polynomial chaos approximation with
optimal sparsity. The developed adaptation algorithm consists of a two-step
optimization procedure that computes the optimal coefficients and the input
projection matrix of a low dimensional chaos expansion with respect to an
optimally rotated basis. We demonstrate the attractive features of our
algorithm through several numerical examples including the application on
Large-Eddy Simulation (LES) calculations of turbulent combustion in a HIFiRE
scramjet engine.","['Panagiotis Tsilifis', 'Xun Huan', 'Cosmin Safta', 'Khachik Sargsyan', 'Guilhem Lacaze', 'Joseph C. Oefelein', 'Habib N. Najm', 'Roger G. Ghanem']",['stat.ML'],2018-01-06 03:52:52+00:00
http://arxiv.org/abs/1801.01953v1,Adversarial Perturbation Intensity Achieving Chosen Intra-Technique Transferability Level for Logistic Regression,"Machine Learning models have been shown to be vulnerable to adversarial
examples, ie. the manipulation of data by a attacker to defeat a defender's
classifier at test time. We present a novel probabilistic definition of
adversarial examples in perfect or limited knowledge setting using prior
probability distributions on the defender's classifier. Using the asymptotic
properties of the logistic regression, we derive a closed-form expression of
the intensity of any adversarial perturbation, in order to achieve a given
expected misclassification rate. This technique is relevant in a threat model
of known model specifications and unknown training data. To our knowledge, this
is the first method that allows an attacker to directly choose the probability
of attack success. We evaluate our approach on two real-world datasets.",['Martin Gubri'],"['stat.ML', 'cs.LG']",2018-01-06 01:37:30+00:00
http://arxiv.org/abs/1801.01952v4,Generating Neural Networks with Neural Networks,"Hypernetworks are neural networks that generate weights for another neural
network. We formulate the hypernetwork training objective as a compromise
between accuracy and diversity, where the diversity takes into account trivial
symmetry transformations of the target network. We explain how this simple
formulation generalizes variational inference. We use multi-layered perceptrons
to form the mapping from the low dimensional input random vector to the high
dimensional weight space, and demonstrate how to reduce the number of
parameters in this mapping by parameter sharing. We perform experiments and
show that the generated weights are diverse and lie on a non-trivial manifold.",['Lior Deutsch'],"['stat.ML', 'cs.LG']",2018-01-06 01:27:16+00:00
http://arxiv.org/abs/1801.01899v2,Clustering with Outlier Removal,"Cluster analysis and outlier detection are strongly coupled tasks in data
mining area. Cluster structure can be easily destroyed by few outliers; on the
contrary, outliers are defined by the concept of cluster, which are recognized
as the points belonging to none of the clusters. Unfortunately, most existing
studies do not notice the coupled relationship between these two task and
handle them separately. In light of this, we consider the joint cluster
analysis and outlier detection problem, and propose the Clustering with Outlier
Removal (COR) algorithm. Generally speaking, the original space is transformed
into the binary space via generating basic partitions in order to define
clusters. Then an objective function based Holoentropy is designed to enhance
the compactness of each cluster with a few outliers removed. With further
analyses on the objective function, only partial of the problem can be handled
by K-means optimization. To provide an integrated solution, an auxiliary binary
matrix is nontrivally introduced so that COR completely and efficiently solves
the challenging problem via a unified K-means-- with theoretical supports.
Extensive experimental results on numerous data sets in various domains
demonstrate the effectiveness and efficiency of COR significantly over
state-of-the-art methods in terms of cluster validity and outlier detection.
Some key factors in COR are further analyzed for practical use. Finally, an
application on flight trajectory is provided to demonstrate the effectiveness
of COR in the real-world scenario.","['Hongfu Liu', 'Jun Li', 'Yue Wu', 'Yun Fu']","['cs.LG', 'stat.ML']",2018-01-05 19:15:17+00:00
http://arxiv.org/abs/1801.01799v2,Closed-form Marginal Likelihood in Gamma-Poisson Matrix Factorization,"We present novel understandings of the Gamma-Poisson (GaP) model, a
probabilistic matrix factorization model for count data. We show that GaP can
be rewritten free of the score/activation matrix. This gives us new insights
about the estimation of the topic/dictionary matrix by maximum marginal
likelihood estimation. In particular, this explains the robustness of this
estimator to over-specified values of the factorization rank, especially its
ability to automatically prune irrelevant dictionary columns, as empirically
observed in previous work. The marginalization of the activation matrix leads
in turn to a new Monte Carlo Expectation-Maximization algorithm with favorable
properties.","['Louis Filstroff', 'Alberto Lumbreras', 'Cédric Févotte']","['stat.ML', 'cs.LG']",2018-01-05 15:50:39+00:00
http://arxiv.org/abs/1801.01750v1,Nonparametric Stochastic Contextual Bandits,"We analyze the $K$-armed bandit problem where the reward for each arm is a
noisy realization based on an observed context under mild nonparametric
assumptions. We attain tight results for top-arm identification and a sublinear
regret of $\widetilde{O}\Big(T^{\frac{1+D}{2+D}}\Big)$, where $D$ is the
context dimension, for a modified UCB algorithm that is simple to implement
($k$NN-UCB). We then give global intrinsic dimension dependent and ambient
dimension independent regret bounds. We also discuss recovering topological
structures within the context space based on expected bandit performance and
provide an extension to infinite-armed contextual bandits. Finally, we
experimentally show the improvement of our algorithm over existing multi-armed
bandit approaches for both simulated tasks and MNIST image classification.","['Melody Y. Guan', 'Heinrich Jiang']","['cs.LG', 'stat.ML']",2018-01-05 13:27:42+00:00
http://arxiv.org/abs/1801.01743v1,A relativistic extension of Hopfield neural networks via the mechanical analogy,"We propose a modification of the cost function of the Hopfield model whose
salient features shine in its Taylor expansion and result in more than pairwise
interactions with alternate signs, suggesting a unified framework for handling
both with deep learning and network pruning. In our analysis, we heavily rely
on the Hamilton-Jacobi correspondence relating the statistical model with a
mechanical system. In this picture, our model is nothing but the relativistic
extension of the original Hopfield model (whose cost function is a quadratic
form in the Mattis magnetization which mimics the non-relativistic Hamiltonian
for a free particle). We focus on the low-storage regime and solve the model
analytically by taking advantage of the mechanical analogy, thus obtaining a
complete characterization of the free energy and the associated
self-consistency equations in the thermodynamic limit. On the numerical side,
we test the performances of our proposal with MC simulations, showing that the
stability of spurious states (limiting the capabilities of the standard Hebbian
construction) is sensibly reduced due to presence of unlearning contributions
in this extended framework.","['Adriano Barra', 'Matteo Beccaria', 'Alberto Fachechi']","['cond-mat.dis-nn', 'cs.NE', 'stat.ML']",2018-01-05 12:57:18+00:00
http://arxiv.org/abs/1801.01708v1,Negative Binomial Matrix Factorization for Recommender Systems,"We introduce negative binomial matrix factorization (NBMF), a matrix
factorization technique specially designed for analyzing over-dispersed count
data. It can be viewed as an extension of Poisson matrix factorization (PF)
perturbed by a multiplicative term which models exposure. This term brings a
degree of freedom for controlling the dispersion, making NBMF more robust to
outliers. We show that NBMF allows to skip traditional pre-processing stages,
such as binarization, which lead to loss of information. Two estimation
approaches are presented: maximum likelihood and variational Bayes inference.
We test our model with a recommendation task and show its ability to predict
user tastes with better precision than PF.","['Olivier Gouvert', 'Thomas Oberlin', 'Cédric Févotte']","['cs.LG', 'cs.IR', 'stat.ML']",2018-01-05 11:00:46+00:00
http://arxiv.org/abs/1801.01649v2,Gauged Mini-Bucket Elimination for Approximate Inference,"Computing the partition function $Z$ of a discrete graphical model is a
fundamental inference challenge. Since this is computationally intractable,
variational approximations are often used in practice. Recently, so-called
gauge transformations were used to improve variational lower bounds on $Z$. In
this paper, we propose a new gauge-variational approach, termed WMBE-G, which
combines gauge transformations with the weighted mini-bucket elimination (WMBE)
method. WMBE-G can provide both upper and lower bounds on $Z$, and is easier to
optimize than the prior gauge-variational algorithm. We show that WMBE-G
strictly improves the earlier WMBE approximation for symmetric models including
Ising models with no magnetic field. Our experimental results demonstrate the
effectiveness of WMBE-G even for generic, nonsymmetric models.","['Sungsoo Ahn', 'Michael Chertkov', 'Jinwoo Shin', 'Adrian Weller']",['stat.ML'],2018-01-05 07:26:39+00:00
http://arxiv.org/abs/1801.01587v6,SpectralNet: Spectral Clustering using Deep Neural Networks,"Spectral clustering is a leading and popular technique in unsupervised data
analysis. Two of its major limitations are scalability and generalization of
the spectral embedding (i.e., out-of-sample-extension). In this paper we
introduce a deep learning approach to spectral clustering that overcomes the
above shortcomings. Our network, which we call SpectralNet, learns a map that
embeds input data points into the eigenspace of their associated graph
Laplacian matrix and subsequently clusters them. We train SpectralNet using a
procedure that involves constrained stochastic optimization. Stochastic
optimization allows it to scale to large datasets, while the constraints, which
are implemented using a special-purpose output layer, allow us to keep the
network output orthogonal. Moreover, the map learned by SpectralNet naturally
generalizes the spectral embedding to unseen data points. To further improve
the quality of the clustering, we replace the standard pairwise Gaussian
affinities with affinities leaned from unlabeled data using a Siamese network.
Additional improvement can be achieved by applying the network to code
representations produced, e.g., by standard autoencoders. Our end-to-end
learning procedure is fully unsupervised. In addition, we apply VC dimension
theory to derive a lower bound on the size of SpectralNet. State-of-the-art
clustering results are reported on the Reuters dataset. Our implementation is
publicly available at https://github.com/kstant0725/SpectralNet .","['Uri Shaham', 'Kelly Stanton', 'Henry Li', 'Boaz Nadler', 'Ronen Basri', 'Yuval Kluger']","['stat.ML', 'cs.LG']",2018-01-04 23:56:36+00:00
http://arxiv.org/abs/1801.01469v1,PHOENICS: A universal deep Bayesian optimizer,"In this work we introduce PHOENICS, a probabilistic global optimization
algorithm combining ideas from Bayesian optimization with concepts from
Bayesian kernel density estimation. We propose an inexpensive acquisition
function balancing the explorative and exploitative behavior of the algorithm.
This acquisition function enables intuitive sampling strategies for an
efficient parallel search of global minima. The performance of PHOENICS is
assessed via an exhaustive benchmark study on a set of 15 discrete,
quasi-discrete and continuous multidimensional functions. Unlike optimization
methods based on Gaussian processes (GP) and random forests (RF), we show that
PHOENICS is less sensitive to the nature of the co-domain, and outperforms GP
and RF optimizations. We illustrate the performance of PHOENICS on the
Oregonator, a difficult case-study describing a complex chemical reaction
network. We demonstrate that only PHOENICS was able to reproduce qualitatively
and quantitatively the target dynamic behavior of this nonlinear reaction
dynamics. We recommend PHOENICS for rapid optimization of scalar, possibly
non-convex, black-box unknown objective functions.","['Florian Häse', 'Loïc M. Roch', 'Christoph Kreisbeck', 'Alán Aspuru-Guzik']","['stat.ML', 'physics.chem-ph']",2018-01-04 17:40:31+00:00
http://arxiv.org/abs/1801.01467v1,Deep Reinforcement Learning based Optimal Control of Hot Water Systems,"Energy consumption for hot water production is a major draw in high
efficiency buildings. Optimizing this has typically been approached from a
thermodynamics perspective, decoupled from occupant influence. Furthermore,
optimization usually presupposes existence of a detailed dynamics model for the
hot water system. These assumptions lead to suboptimal energy efficiency in the
real world. In this paper, we present a novel reinforcement learning based
methodology which optimizes hot water production. The proposed methodology is
completely generalizable, and does not require an offline step or human domain
knowledge to build a model for the hot water vessel or the heating element.
Occupant preferences too are learnt on the fly. The proposed system is applied
to a set of 32 houses in the Netherlands where it reduces energy consumption
for hot water production by roughly 20% with no loss of occupant comfort.
Extrapolating, this translates to absolute savings of roughly 200 kWh for a
single household on an annual basis. This performance can be replicated to any
domestic hot water system and optimization objective, given that the fairly
minimal requirements on sensor data are met. With millions of hot water systems
operational worldwide, the proposed framework has the potential to reduce
energy consumption in existing and new systems on a multi Gigawatt-hour scale
in the years to come.","['Hussain Kazmi', 'Fahad Mehmood', 'Stefan Lodeweyckx', 'Johan Driesen']","['cs.SY', 'stat.AP', 'stat.ML']",2018-01-04 17:37:50+00:00
http://arxiv.org/abs/1801.01423v3,Overcoming catastrophic forgetting with hard attention to the task,"Catastrophic forgetting occurs when a neural network loses the information
learned in a previous task after training on subsequent tasks. This problem
remains a hurdle for artificial intelligence systems with sequential learning
capabilities. In this paper, we propose a task-based hard attention mechanism
that preserves previous tasks' information without affecting the current task's
learning. A hard attention mask is learned concurrently to every task, through
stochastic gradient descent, and previous masks are exploited to condition such
learning. We show that the proposed mechanism is effective for reducing
catastrophic forgetting, cutting current rates by 45 to 80%. We also show that
it is robust to different hyperparameter choices, and that it offers a number
of monitoring capabilities. The approach features the possibility to control
both the stability and compactness of the learned knowledge, which we believe
makes it also attractive for online learning or network compression
applications.","['Joan Serrà', 'Dídac Surís', 'Marius Miron', 'Alexandros Karatzoglou']","['cs.LG', 'cs.AI', 'cs.NE', 'stat.ML']",2018-01-04 16:22:22+00:00
http://arxiv.org/abs/1801.01401v5,Demystifying MMD GANs,"We investigate the training and performance of generative adversarial
networks using the Maximum Mean Discrepancy (MMD) as critic, termed MMD GANs.
As our main theoretical contribution, we clarify the situation with bias in GAN
loss functions raised by recent work: we show that gradient estimators used in
the optimization process for both MMD GANs and Wasserstein GANs are unbiased,
but learning a discriminator based on samples leads to biased gradients for the
generator parameters. We also discuss the issue of kernel choice for the MMD
critic, and characterize the kernel corresponding to the energy distance used
for the Cramer GAN critic. Being an integral probability metric, the MMD
benefits from training strategies recently developed for Wasserstein GANs. In
experiments, the MMD GAN is able to employ a smaller critic network than the
Wasserstein GAN, resulting in a simpler and faster-training algorithm with
matching performance. We also propose an improved measure of GAN convergence,
the Kernel Inception Distance, and show how to use it to dynamically adapt
learning rates during GAN training.","['Mikołaj Bińkowski', 'Danica J. Sutherland', 'Michael Arbel', 'Arthur Gretton']","['stat.ML', 'cs.LG']",2018-01-04 15:25:26+00:00
