id,title,abstract,authors,categories,date
http://arxiv.org/abs/1801.05062v2,Multi-Label Learning from Medical Plain Text with Convolutional Residual Models,"Predicting diagnoses from Electronic Health Records (EHRs) is an important
medical application of multi-label learning. We propose a convolutional
residual model for multi-label classification from doctor notes in EHR data. A
given patient may have multiple diagnoses, and therefore multi-label learning
is required. We employ a Convolutional Neural Network (CNN) to encode plain
text into a fixed-length sentence embedding vector. Since diagnoses are
typically correlated, a deep residual network is employed on top of the CNN
encoder, to capture label (diagnosis) dependencies and incorporate information
directly from the encoded sentence vector. A real EHR dataset is considered,
and we compare the proposed model with several well-known baselines, to predict
diagnoses based on doctor notes. Experimental results demonstrate the
superiority of the proposed convolutional residual model.","['Xinyuan Zhang', 'Ricardo Henao', 'Zhe Gan', 'Yitong Li', 'Lawrence Carin']","['stat.ML', 'cs.LG', 'stat.AP']",2018-01-15 22:59:17+00:00
http://arxiv.org/abs/1801.05039v3,Global Convergence of Policy Gradient Methods for the Linear Quadratic Regulator,"Direct policy gradient methods for reinforcement learning and continuous
control problems are a popular approach for a variety of reasons: 1) they are
easy to implement without explicit knowledge of the underlying model 2) they
are an ""end-to-end"" approach, directly optimizing the performance metric of
interest 3) they inherently allow for richly parameterized policies. A notable
drawback is that even in the most basic continuous control problem (that of
linear quadratic regulators), these methods must solve a non-convex
optimization problem, where little is understood about their efficiency from
both computational and statistical perspectives. In contrast, system
identification and model based planning in optimal control theory have a much
more solid theoretical footing, where much is known with regards to their
computational and statistical properties. This work bridges this gap showing
that (model free) policy gradient methods globally converge to the optimal
solution and are efficient (polynomially so in relevant problem dependent
quantities) with regards to their sample and computational complexities.","['Maryam Fazel', 'Rong Ge', 'Sham M. Kakade', 'Mehran Mesbahi']","['cs.LG', 'stat.ML']",2018-01-15 21:40:50+00:00
http://arxiv.org/abs/1801.05007v1,Divide and Recombine for Large and Complex Data: Model Likelihood Functions using MCMC,"In Divide & Recombine (D&R), big data are divided into subsets, each analytic
method is applied to subsets, and the outputs are recombined. This enables deep
analysis and practical computational performance. An innovate D\&R procedure is
proposed to compute likelihood functions of data-model (DM) parameters for big
data. The likelihood-model (LM) is a parametric probability density function of
the DM parameters. The density parameters are estimated by fitting the density
to MCMC draws from each subset DM likelihood function, and then the fitted
densities are recombined. The procedure is illustrated using normal and
skew-normal LMs for the logistic regression DM.","['Qi Liu', 'Anindya Bhadra', 'William S. Cleveland']","['stat.ME', 'stat.ML']",2018-01-15 20:53:52+00:00
http://arxiv.org/abs/1801.04987v3,On the Complexity of the Weighted Fused Lasso,"The solution path of the 1D fused lasso for an $n$-dimensional input is
piecewise linear with $\mathcal{O}(n)$ segments (Hoefling et al. 2010 and
Tibshirani et al 2011). However, existing proofs of this bound do not hold for
the weighted fused lasso. At the same time, results for the generalized lasso,
of which the weighted fused lasso is a special case, allow $\Omega(3^n)$
segments (Mairal et al. 2012). In this paper, we prove that the number of
segments in the solution path of the weighted fused lasso is
$\mathcal{O}(n^2)$, and that, for some instances, it is $\Omega(n^2)$. We also
give a new, very simple, proof of the $\mathcal{O}(n)$ bound for the fused
lasso.","['Jose Bento', 'Ralph Furmaniak', 'Surjyendu Ray']","['cs.LG', 'cs.CC', 'math.OC', 'stat.ML']",2018-01-15 20:20:53+00:00
http://arxiv.org/abs/1801.04958v1,Topic Modeling on Health Journals with Regularized Variational Inference,"Topic modeling enables exploration and compact representation of a corpus.
The CaringBridge (CB) dataset is a massive collection of journals written by
patients and caregivers during a health crisis. Topic modeling on the CB
dataset, however, is challenging due to the asynchronous nature of multiple
authors writing about their health journeys. To overcome this challenge we
introduce the Dynamic Author-Persona topic model (DAP), a probabilistic
graphical model designed for temporal corpora with multiple authors. The
novelty of the DAP model lies in its representation of authors by a persona ---
where personas capture the propensity to write about certain topics over time.
Further, we present a regularized variational inference algorithm, which we use
to encourage the DAP model's personas to be distinct. Our results show
significant improvements over competing topic models --- particularly after
regularization, and highlight the DAP model's unique ability to capture common
journeys shared by different authors.","['Robert Giaquinto', 'Arindam Banerjee']","['cs.CL', 'cs.LG', 'stat.ML']",2018-01-15 19:23:21+00:00
http://arxiv.org/abs/1801.04929v1,"Generalizing, Decoding, and Optimizing Support Vector Machine Classification","The classification of complex data usually requires the composition of
processing steps. Here, a major challenge is the selection of optimal
algorithms for preprocessing and classification (including parameterizations).
Nowadays, parts of the optimization process are automized but expert knowledge
and manual work are still required. We present three steps to face this process
and ease the optimization. Namely, we take a theoretical view on classical
classifiers, provide an approach to interpret the classifier together with the
preprocessing, and integrate both into one framework which enables a
semiautomatic optimization of the processing chain and which interfaces
numerous algorithms.",['Mario Michael Krell'],"['cs.LG', 'cs.CV', 'stat.ML']",2018-01-15 16:49:52+00:00
http://arxiv.org/abs/1801.04856v1,Improving Orbit Prediction Accuracy through Supervised Machine Learning,"Due to the lack of information such as the space environment condition and
resident space objects' (RSOs') body characteristics, current orbit predictions
that are solely grounded on physics-based models may fail to achieve required
accuracy for collision avoidance and have led to satellite collisions already.
This paper presents a methodology to predict RSOs' trajectories with higher
accuracy than that of the current methods. Inspired by the machine learning
(ML) theory through which the models are learned based on large amounts of
observed data and the prediction is conducted without explicitly modeling space
objects and space environment, the proposed ML approach integrates
physics-based orbit prediction algorithms with a learning-based process that
focuses on reducing the prediction errors. Using a simulation-based space
catalog environment as the test bed, the paper demonstrates three types of
generalization capability for the proposed ML approach: 1) the ML model can be
used to improve the same RSO's orbit information that is not available during
the learning process but shares the same time interval as the training data; 2)
the ML model can be used to improve predictions of the same RSO at future
epochs; and 3) the ML model based on a RSO can be applied to other RSOs that
share some common features.","['Hao Peng', 'Xiaoli Bai']","['astro-ph.EP', 'cs.CE', 'cs.LG', 'stat.ML']",2018-01-15 15:56:36+00:00
http://arxiv.org/abs/1801.04813v1,Predicting Movie Genres Based on Plot Summaries,"This project explores several Machine Learning methods to predict movie
genres based on plot summaries. Naive Bayes, Word2Vec+XGBoost and Recurrent
Neural Networks are used for text classification, while K-binary
transformation, rank method and probabilistic classification with learned
probability threshold are employed for the multi-label problem involved in the
genre tagging task.Experiments with more than 250,000 movies show that
employing the Gated Recurrent Units (GRU) neural networks for the probabilistic
classification with learned probability threshold approach achieves the best
result on the test set. The model attains a Jaccard Index of 50.0%, a F-score
of 0.56, and a hit rate of 80.5%.",['Quan Hoang'],"['cs.CL', 'cs.LG', 'stat.ML']",2018-01-15 14:11:57+00:00
http://arxiv.org/abs/1801.04701v1,tau-FPL: Tolerance-Constrained Learning in Linear Time,"Learning a classifier with control on the false-positive rate plays a
critical role in many machine learning applications. Existing approaches either
introduce prior knowledge dependent label cost or tune parameters based on
traditional classifiers, which lack consistency in methodology because they do
not strictly adhere to the false-positive rate constraint. In this paper, we
propose a novel scoring-thresholding approach, tau-False Positive Learning
(tau-FPL) to address this problem. We show the scoring problem which takes the
false-positive rate tolerance into accounts can be efficiently solved in linear
time, also an out-of-bootstrap thresholding method can transform the learned
ranking function into a low false-positive classifier. Both theoretical
analysis and experimental results show superior performance of the proposed
tau-FPL over existing approaches.","['Ao Zhang', 'Nan Li', 'Jian Pu', 'Jun Wang', 'Junchi Yan', 'Hongyuan Zha']","['cs.LG', 'cs.AI', 'stat.ML']",2018-01-15 08:56:49+00:00
http://arxiv.org/abs/1801.04695v3,Sparsity-based Defense against Adversarial Attacks on Linear Classifiers,"Deep neural networks represent the state of the art in machine learning in a
growing number of fields, including vision, speech and natural language
processing. However, recent work raises important questions about the
robustness of such architectures, by showing that it is possible to induce
classification errors through tiny, almost imperceptible, perturbations.
Vulnerability to such ""adversarial attacks"", or ""adversarial examples"", has
been conjectured to be due to the excessive linearity of deep networks. In this
paper, we study this phenomenon in the setting of a linear classifier, and show
that it is possible to exploit sparsity in natural data to combat
$\ell_{\infty}$-bounded adversarial perturbations. Specifically, we demonstrate
the efficacy of a sparsifying front end via an ensemble averaged analysis, and
experimental results for the MNIST handwritten digit database. To the best of
our knowledge, this is the first work to show that sparsity provides a
theoretically rigorous framework for defense against adversarial attacks.","['Zhinus Marzi', 'Soorya Gopalakrishnan', 'Upamanyu Madhow', 'Ramtin Pedarsani']","['stat.ML', 'cs.IT', 'cs.LG', 'math.IT']",2018-01-15 08:18:33+00:00
http://arxiv.org/abs/1801.04693v1,Towards Imperceptible and Robust Adversarial Example Attacks against Neural Networks,"Machine learning systems based on deep neural networks, being able to produce
state-of-the-art results on various perception tasks, have gained mainstream
adoption in many applications. However, they are shown to be vulnerable to
adversarial example attack, which generates malicious output by adding slight
perturbations to the input. Previous adversarial example crafting methods,
however, use simple metrics to evaluate the distances between the original
examples and the adversarial ones, which could be easily detected by human
eyes. In addition, these attacks are often not robust due to the inevitable
noises and deviation in the physical world. In this work, we present a new
adversarial example attack crafting method, which takes the human perceptual
system into consideration and maximizes the noise tolerance of the crafted
adversarial example. Experimental results demonstrate the efficacy of the
proposed technique.","['Bo Luo', 'Yannan Liu', 'Lingxiao Wei', 'Qiang Xu']","['cs.LG', 'cs.CR', 'stat.ML']",2018-01-15 08:15:33+00:00
http://arxiv.org/abs/1801.04590v4,Frame-Recurrent Video Super-Resolution,"Recent advances in video super-resolution have shown that convolutional
neural networks combined with motion compensation are able to merge information
from multiple low-resolution (LR) frames to generate high-quality images.
Current state-of-the-art methods process a batch of LR frames to generate a
single high-resolution (HR) frame and run this scheme in a sliding window
fashion over the entire video, effectively treating the problem as a large
number of separate multi-frame super-resolution tasks. This approach has two
main weaknesses: 1) Each input frame is processed and warped multiple times,
increasing the computational cost, and 2) each output frame is estimated
independently conditioned on the input frames, limiting the system's ability to
produce temporally consistent results.
  In this work, we propose an end-to-end trainable frame-recurrent video
super-resolution framework that uses the previously inferred HR estimate to
super-resolve the subsequent frame. This naturally encourages temporally
consistent results and reduces the computational cost by warping only one image
in each step. Furthermore, due to its recurrent nature, the proposed method has
the ability to assimilate a large number of previous frames without increased
computational demands. Extensive evaluations and comparisons with previous
methods validate the strengths of our approach and demonstrate that the
proposed framework is able to significantly outperform the current state of the
art.","['Mehdi S. M. Sajjadi', 'Raviteja Vemulapalli', 'Matthew Brown']","['cs.CV', 'cs.AI', 'stat.ML']",2018-01-14 17:53:53+00:00
http://arxiv.org/abs/1801.04540v2,Fix your classifier: the marginal value of training the last weight layer,"Neural networks are commonly used as models for classification for a wide
variety of tasks. Typically, a learned affine transformation is placed at the
end of such models, yielding a per-class value used for classification. This
classifier can have a vast number of parameters, which grows linearly with the
number of possible classes, thus requiring increasingly more resources. In this
work we argue that this classifier can be fixed, up to a global scale constant,
with little or no loss of accuracy for most tasks, allowing memory and
computational benefits. Moreover, we show that by initializing the classifier
with a Hadamard matrix we can speed up inference as well. We discuss the
implications for current understanding of neural network models.","['Elad Hoffer', 'Itay Hubara', 'Daniel Soudry']","['cs.LG', 'cs.CV', 'stat.ML']",2018-01-14 12:00:43+00:00
http://arxiv.org/abs/1801.04510v2,Brain EEG Time Series Selection: A Novel Graph-Based Approach for Classification,"Brain Electroencephalography (EEG) classification is widely applied to
analyze cerebral diseases in recent years. Unfortunately, invalid/noisy EEGs
degrade the diagnosis performance and most previously developed methods ignore
the necessity of EEG selection for classification. To this end, this paper
proposes a novel maximum weight clique-based EEG selection approach, named
mwcEEGs, to map EEG selection to searching maximum similarity-weighted cliques
from an improved Fr\'{e}chet distance-weighted undirected EEG graph
simultaneously considering edge weights and vertex weights. Our mwcEEGs
improves the classification performance by selecting intra-clique pairwise
similar and inter-clique discriminative EEGs with similarity threshold
$\delta$. Experimental results demonstrate the algorithm effectiveness compared
with the state-of-the-art time series selection algorithms on real-world EEG
datasets.","['Chenglong Dai', 'Jia Wu', 'Dechang Pi', 'Lin Cui']","['cs.LG', 'q-bio.NC', 'stat.ML']",2018-01-14 04:51:22+00:00
http://arxiv.org/abs/1801.04503v2,Multivariate LSTM-FCNs for Time Series Classification,"Over the past decade, multivariate time series classification has received
great attention. We propose transforming the existing univariate time series
classification models, the Long Short Term Memory Fully Convolutional Network
(LSTM-FCN) and Attention LSTM-FCN (ALSTM-FCN), into a multivariate time series
classification model by augmenting the fully convolutional block with a
squeeze-and-excitation block to further improve accuracy. Our proposed models
outperform most state-of-the-art models while requiring minimum preprocessing.
The proposed models work efficiently on various complex multivariate time
series classification tasks such as activity recognition or action recognition.
Furthermore, the proposed models are highly efficient at test time and small
enough to deploy on memory constrained systems.","['Fazle Karim', 'Somshubra Majumdar', 'Houshang Darabi', 'Samuel Harford']","['cs.LG', 'stat.ML']",2018-01-14 03:00:53+00:00
http://arxiv.org/abs/1801.04378v2,Fairness in Supervised Learning: An Information Theoretic Approach,"Automated decision making systems are increasingly being used in real-world
applications. In these systems for the most part, the decision rules are
derived by minimizing the training error on the available historical data.
Therefore, if there is a bias related to a sensitive attribute such as gender,
race, religion, etc. in the data, say, due to cultural/historical
discriminatory practices against a certain demographic, the system could
continue discrimination in decisions by including the said bias in its decision
rule. We present an information theoretic framework for designing fair
predictors from data, which aim to prevent discrimination against a specified
sensitive attribute in a supervised learning setting. We use equalized odds as
the criterion for discrimination, which demands that the prediction should be
independent of the protected attribute conditioned on the actual label. To
ensure fairness and generalization simultaneously, we compress the data to an
auxiliary variable, which is used for the prediction task. This auxiliary
variable is chosen such that it is decontaminated from the discriminatory
attribute in the sense of equalized odds. The final predictor is obtained by
applying a Bayesian decision rule to the auxiliary variable.","['AmirEmad Ghassami', 'Sajad Khodadadian', 'Negar Kiyavash']","['cs.LG', 'cs.AI', 'cs.IT', 'math.IT', 'stat.ML']",2018-01-13 04:03:04+00:00
http://arxiv.org/abs/1801.04342v3,Combining Symbolic Expressions and Black-box Function Evaluations in Neural Programs,"Neural programming involves training neural networks to learn programs,
mathematics, or logic from data. Previous works have failed to achieve good
generalization performance, especially on problems and programs with high
complexity or on large domains. This is because they mostly rely either on
black-box function evaluations that do not capture the structure of the
program, or on detailed execution traces that are expensive to obtain, and
hence the training data has poor coverage of the domain under consideration. We
present a novel framework that utilizes black-box function evaluations, in
conjunction with symbolic expressions that define relationships between the
given functions. We employ tree LSTMs to incorporate the structure of the
symbolic expression trees. We use tree encoding for numbers present in function
evaluation data, based on their decimal representation. We present an
evaluation benchmark for this task to demonstrate our proposed model combines
symbolic reasoning and function evaluation in a fruitful manner, obtaining high
accuracies in our experiments. Our framework generalizes significantly better
to expressions of higher depth and is able to fill partial equations with valid
completions.","['Forough Arabshahi', 'Sameer Singh', 'Animashree Anandkumar']","['cs.LG', 'cs.AI', 'stat.ML']",2018-01-12 22:24:42+00:00
http://arxiv.org/abs/1801.04339v3,Estimating the Number of Connected Components in a Graph via Subgraph Sampling,"Learning properties of large graphs from samples has been an important
problem in statistical network analysis since the early work of Goodman
\cite{Goodman1949} and Frank \cite{Frank1978}. We revisit a problem formulated
by Frank \cite{Frank1978} of estimating the number of connected components in a
large graph based on the subgraph sampling model, in which we randomly sample a
subset of the vertices and observe the induced subgraph. The key question is
whether accurate estimation is achievable in the \emph{sublinear} regime where
only a vanishing fraction of the vertices are sampled. We show that it is
impossible if the parent graph is allowed to contain high-degree vertices or
long induced cycles. For the class of chordal graphs, where induced cycles of
length four or above are forbidden, we characterize the optimal sample
complexity within constant factors and construct linear-time estimators that
provably achieve these bounds. This significantly expands the scope of previous
results which have focused on unbiased estimators and special classes of graphs
such as forests or cliques.
  Both the construction and the analysis of the proposed methodology rely on
combinatorial properties of chordal graphs and identities of induced subgraph
counts. They, in turn, also play a key role in proving minimax lower bounds
based on construction of random instances of graphs with matching structures of
small subgraphs.","['Jason M. Klusowski', 'Yihong Wu']","['math.ST', 'cs.DM', 'cs.LG', 'stat.ML', 'stat.TH', '62D05, 62C20']",2018-01-12 22:13:48+00:00
http://arxiv.org/abs/1801.04295v1,"Generalization Error Bounds for Noisy, Iterative Algorithms","In statistical learning theory, generalization error is used to quantify the
degree to which a supervised machine learning algorithm may overfit to training
data. Recent work [Xu and Raginsky (2017)] has established a bound on the
generalization error of empirical risk minimization based on the mutual
information $I(S;W)$ between the algorithm input $S$ and the algorithm output
$W$, when the loss function is sub-Gaussian. We leverage these results to
derive generalization error bounds for a broad class of iterative algorithms
that are characterized by bounded, noisy updates with Markovian structure. Our
bounds are very general and are applicable to numerous settings of interest,
including stochastic gradient Langevin dynamics (SGLD) and variants of the
stochastic gradient Hamiltonian Monte Carlo (SGHMC) algorithm. Furthermore, our
error bounds hold for any output function computed over the path of iterates,
including the last iterate of the algorithm or the average of subsets of
iterates, and also allow for non-uniform sampling of data in successive updates
of the algorithm.","['Ankit Pensia', 'Varun Jog', 'Po-Ling Loh']","['cs.LG', 'cs.IT', 'math.IT', 'stat.ML']",2018-01-12 19:26:35+00:00
http://arxiv.org/abs/1801.04289v1,Asynchronous Stochastic Variational Inference,"Stochastic variational inference (SVI) employs stochastic optimization to
scale up Bayesian computation to massive data. Since SVI is at its core a
stochastic gradient-based algorithm, horizontal parallelism can be harnessed to
allow larger scale inference. We propose a lock-free parallel implementation
for SVI which allows distributed computations over multiple slaves in an
asynchronous style. We show that our implementation leads to linear speed-up
while guaranteeing an asymptotic ergodic convergence rate $O(1/\sqrt(T)$ )
given that the number of slaves is bounded by $\sqrt(T)$ ($T$ is the total
number of iterations). The implementation is done in a high-performance
computing (HPC) environment using message passing interface (MPI) for python
(MPI4py). The extensive empirical evaluation shows that our parallel SVI is
lossless, performing comparably well to its counterpart serial SVI with linear
speed-up.","['Saad Mohamad', 'Abdelhamid Bouchachia', 'Moamar Sayed-Mouchaweh']","['stat.ML', 'cs.DC', 'cs.LG']",2018-01-12 19:05:09+00:00
http://arxiv.org/abs/1801.05055v1,Toward Metric Indexes for Incremental Insertion and Querying,"In this work we explore the use of metric index structures, which accelerate
nearest neighbor queries, in the scenario where we need to interleave
insertions and queries during deployment. This use-case is inspired by a
real-life need in malware analysis triage, and is surprisingly understudied.
Existing literature tends to either focus on only final query efficiency, often
does not support incremental insertion, or does not support arbitrary distance
metrics. We modify and improve three algorithms to support our scenario of
incremental insertion and querying with arbitrary metrics, and evaluate them on
multiple datasets and distance metrics while varying the value of $k$ for the
desired number of nearest neighbors. In doing so we determine that our improved
Vantage-Point tree of Minimum-Variance performs best for this scenario.","['Edward Raff', 'Charles Nicholas']","['cs.DS', 'cs.DB', 'stat.ML']",2018-01-12 16:25:16+00:00
