id,title,abstract,authors,categories,date
http://arxiv.org/abs/1911.04362v1,To Populate is To Regulate,"We examine the effects of instantiating Lewis signaling games within a
population of speaker and listener agents with the aim of producing a set of
general and robust representations of unstructured pixel data. Preliminary
experiments suggest that the set of representations associated with languages
generated within a population outperform those generated between a single
speaker-listener pair on this objective, making a case for the adoption of
population-based approaches in emergent communication studies. Furthermore,
post-hoc analysis reveals that population-based learning induces a number of
novel factors to the conventional emergent communication setup, inviting a wide
range of future research questions regarding communication dynamics and the
flow of information within them.",['Nicole Fitzgerald'],"['cs.LG', 'cs.CL', 'stat.ML']",2019-11-06 23:51:45+00:00
http://arxiv.org/abs/1911.02682v1,Physics-Guided Architecture (PGA) of Neural Networks for Quantifying Uncertainty in Lake Temperature Modeling,"To simultaneously address the rising need of expressing uncertainties in deep
learning models along with producing model outputs which are consistent with
the known scientific knowledge, we propose a novel physics-guided architecture
(PGA) of neural networks in the context of lake temperature modeling where the
physical constraints are hard coded in the neural network architecture. This
allows us to integrate such models with state of the art uncertainty estimation
approaches such as Monte Carlo (MC) Dropout without sacrificing the physical
consistency of our results. We demonstrate the effectiveness of our approach in
ensuring better generalizability as well as physical consistency in MC
estimates over data collected from Lake Mendota in Wisconsin and Falling Creek
Reservoir in Virginia, even with limited training data. We further show that
our MC estimates correctly match the distribution of ground-truth observations,
thus making the PGA paradigm amenable to physically grounded uncertainty
quantification.","['Arka Daw', 'R. Quinn Thomas', 'Cayelan C. Carey', 'Jordan S. Read', 'Alison P. Appling', 'Anuj Karpatne']","['cs.LG', 'physics.comp-ph', 'stat.ML']",2019-11-06 23:47:14+00:00
http://arxiv.org/abs/1911.02681v3,Generalized Transformation-based Gradient,"The reparameterization trick has become one of the most useful tools in the
field of variational inference. However, the reparameterization trick is based
on the standardization transformation which restricts the scope of application
of this method to distributions that have tractable inverse cumulative
distribution functions or are expressible as deterministic transformations of
such distributions. In this paper, we generalized the reparameterization trick
by allowing a general transformation. We discover that the proposed model is a
special case of control variate indicating that the proposed model can combine
the advantages of CV and generalized reparameterization.","['Anbang Wu', 'Shuangxi Chen', 'Chunming Wu']","['cs.LG', 'math.OC', 'stat.ML']",2019-11-06 23:40:12+00:00
http://arxiv.org/abs/1911.02673v2,Towards the Use of Neural Networks for Influenza Prediction at Multiple Spatial Resolutions,"We introduce the use of a Gated Recurrent Unit (GRU) for influenza prediction
at the state- and city-level in the US, and experiment with the inclusion of
real-time flu-related Internet search data. We find that a GRU has lower
prediction error than current state-of-the-art methods for data-driven
influenza prediction at time horizons of over two weeks. In contrast with other
machine learning approaches, the inclusion of real-time Internet search data
does not improve GRU predictions.","['Emily L. Aiken', 'Andre T. Nguyen', 'Mauricio Santillana']","['cs.LG', 'cs.CY', 'stat.AP', 'stat.ML']",2019-11-06 23:14:53+00:00
http://arxiv.org/abs/1911.02660v1,What Do We Really Need? Degenerating U-Net on Retinal Vessel Segmentation,"Retinal vessel segmentation is an essential step for fundus image analysis.
With the recent advances of deep learning technologies, many convolutional
neural networks have been applied in this field, including the successful
U-Net. In this work, we firstly modify the U-Net with functional blocks aiming
to pursue higher performance. The absence of the expected performance boost
then lead us to dig into the opposite direction of shrinking the U-Net and
exploring the extreme conditions such that its segmentation performance is
maintained. Experiment series to simplify the network structure, reduce the
network size and restrict the training conditions are designed. Results show
that for retinal vessel segmentation on DRIVE database, U-Net does not
degenerate until surprisingly acute conditions: one level, one filter in
convolutional layers, and one training sample. This experimental discovery is
both counter-intuitive and worthwhile. Not only are the extremes of the U-Net
explored on a well-studied application, but also one intriguing warning is
raised for the research methodology which seeks for marginal performance
enhancement regardless of the resource cost.","['Weilin Fu', 'Katharina Breininger', 'Zhaoya Pan', 'Andreas Maier']","['eess.IV', 'cs.CV', 'cs.LG', 'stat.ML']",2019-11-06 22:49:55+00:00
http://arxiv.org/abs/1911.02656v1,Invariance and identifiability issues for word embeddings,"Word embeddings are commonly obtained as optimizers of a criterion function
$f$ of a text corpus, but assessed on word-task performance using a different
evaluation function $g$ of the test data. We contend that a possible source of
disparity in performance on tasks is the incompatibility between classes of
transformations that leave $f$ and $g$ invariant. In particular, word
embeddings defined by $f$ are not unique; they are defined only up to a class
of transformations to which $f$ is invariant, and this class is larger than the
class to which $g$ is invariant. One implication of this is that the apparent
superiority of one word embedding over another, as measured by word task
performance, may largely be a consequence of the arbitrary elements selected
from the respective solution sets. We provide a formal treatment of the above
identifiability issue, present some numerical examples, and discuss possible
resolutions.","['Rachel Carrington', 'Karthik Bharath', 'Simon Preston']","['stat.ML', 'cs.CL', 'cs.LG', 'stat.CO']",2019-11-06 22:41:04+00:00
http://arxiv.org/abs/1911.04336v1,Fair Meta-Learning: Learning How to Learn Fairly,"Data sets for fairness relevant tasks can lack examples or be biased
according to a specific label in a sensitive attribute. We demonstrate the
usefulness of weight based meta-learning approaches in such situations. For
models that can be trained through gradient descent, we demonstrate that there
are some parameter configurations that allow models to be optimized from a few
number of gradient steps and with minimal data which are both fair and
accurate. To learn such weight sets, we adapt the popular MAML algorithm to
Fair-MAML by the inclusion of a fairness regularization term. In practice,
Fair-MAML allows practitioners to train fair machine learning models from only
a few examples when data from related tasks is available. We empirically
exhibit the value of this technique by comparing to relevant baselines.","['Dylan Slack', 'Sorelle Friedler', 'Emile Givental']","['cs.LG', 'stat.ML']",2019-11-06 21:43:53+00:00
http://arxiv.org/abs/1911.02624v1,Data Generation for Neural Programming by Example,"Programming by example is the problem of synthesizing a program from a small
set of input / output pairs. Recent works applying machine learning methods to
this task show promise, but are typically reliant on generating synthetic
examples for training. A particular challenge lies in generating meaningful
sets of inputs and outputs, which well-characterize a given program and
accurately demonstrate its behavior. Where examples used for testing are
generated by the same method as training data then the performance of a model
may be partly reliant on this similarity. In this paper we introduce a novel
approach using an SMT solver to synthesize inputs which cover a diverse set of
behaviors for a given program. We carry out a case study comparing this method
to existing synthetic data generation procedures in the literature, and find
that data generated using our approach improves both the discriminatory power
of example sets and the ability of trained machine learning models to
generalize to unfamiliar data.","['Judith Clymo', 'Haik Manukian', 'Nathanaël Fijalkow', 'Adrià Gascón', 'Brooks Paige']","['cs.LG', 'cs.NE', 'cs.PL', 'stat.ML']",2019-11-06 20:57:03+00:00
http://arxiv.org/abs/1911.02623v1,Map Enhanced Route Travel Time Prediction using Deep Neural Networks,"Travel time estimation is a fundamental problem in transportation science
with extensive literature. The study of these techniques has intensified due to
availability of many publicly available large trip datasets. Recently developed
deep learning based models have improved the generality and performance and
have focused on estimating times for individual sub-trajectories and
aggregating them to predict the travel time of the entire trajectory. However,
these techniques ignore the road network information. In this work, we propose
and study techniques for incorporating road networks along with historical
trips' data into travel time prediction. We incorporate both node embeddings as
well as road distance into the existing model. Experiments on large real-world
benchmark datasets suggest improved performance, especially when the train data
is small. As expected, the proposed method performs better than the baseline
when there is a larger difference between road distance and Vincenty distance
between start and end points.","['Soumi Das', 'Rajath Nandan Kalava', 'Kolli Kiran Kumar', 'Akhil Kandregula', 'Kalpam Suhaas', 'Sourangshu Bhattacharya', 'Niloy Ganguly']","['cs.LG', 'stat.ML']",2019-11-06 20:52:02+00:00
http://arxiv.org/abs/1911.02613v1,Hyper-SAGNN: a self-attention based graph neural network for hypergraphs,"Graph representation learning for hypergraphs can be used to extract patterns
among higher-order interactions that are critically important in many real
world problems. Current approaches designed for hypergraphs, however, are
unable to handle different types of hypergraphs and are typically not generic
for various learning tasks. Indeed, models that can predict variable-sized
heterogeneous hyperedges have not been available. Here we develop a new
self-attention based graph neural network called Hyper-SAGNN applicable to
homogeneous and heterogeneous hypergraphs with variable hyperedge sizes. We
perform extensive evaluations on multiple datasets, including four benchmark
network datasets and two single-cell Hi-C datasets in genomics. We demonstrate
that Hyper-SAGNN significantly outperforms the state-of-the-art methods on
traditional tasks while also achieving great performance on a new task called
outsider identification. Hyper-SAGNN will be useful for graph representation
learning to uncover complex higher-order interactions in different
applications.","['Ruochi Zhang', 'Yuesong Zou', 'Jian Ma']","['cs.LG', 'stat.ML']",2019-11-06 20:10:24+00:00
http://arxiv.org/abs/1911.02590v1,Optimizing Millions of Hyperparameters by Implicit Differentiation,"We propose an algorithm for inexpensive gradient-based hyperparameter
optimization that combines the implicit function theorem (IFT) with efficient
inverse Hessian approximations. We present results about the relationship
between the IFT and differentiating through optimization, motivating our
algorithm. We use the proposed approach to train modern network architectures
with millions of weights and millions of hyper-parameters. For example, we
learn a data-augmentation network - where every weight is a hyperparameter
tuned for validation performance - outputting augmented training examples.
Jointly tuning weights and hyperparameters with our approach is only a few
times more costly in memory and compute than standard training.","['Jonathan Lorraine', 'Paul Vicol', 'David Duvenaud']","['cs.LG', 'stat.ML']",2019-11-06 19:04:16+00:00
http://arxiv.org/abs/1911.02549v2,MLPerf Inference Benchmark,"Machine-learning (ML) hardware and software system demand is burgeoning.
Driven by ML applications, the number of different ML inference systems has
exploded. Over 100 organizations are building ML inference chips, and the
systems that incorporate existing models span at least three orders of
magnitude in power consumption and five orders of magnitude in performance;
they range from embedded devices to data-center solutions. Fueling the hardware
are a dozen or more software frameworks and libraries. The myriad combinations
of ML hardware and ML software make assessing ML-system performance in an
architecture-neutral, representative, and reproducible manner challenging.
There is a clear need for industry-wide standard ML benchmarking and evaluation
criteria. MLPerf Inference answers that call. In this paper, we present our
benchmarking method for evaluating ML inference systems. Driven by more than 30
organizations as well as more than 200 ML engineers and practitioners, MLPerf
prescribes a set of rules and best practices to ensure comparability across
systems with wildly differing architectures. The first call for submissions
garnered more than 600 reproducible inference-performance measurements from 14
organizations, representing over 30 systems that showcase a wide range of
capabilities. The submissions attest to the benchmark's flexibility and
adaptability.","['Vijay Janapa Reddi', 'Christine Cheng', 'David Kanter', 'Peter Mattson', 'Guenther Schmuelling', 'Carole-Jean Wu', 'Brian Anderson', 'Maximilien Breughe', 'Mark Charlebois', 'William Chou', 'Ramesh Chukka', 'Cody Coleman', 'Sam Davis', 'Pan Deng', 'Greg Diamos', 'Jared Duke', 'Dave Fick', 'J. Scott Gardner', 'Itay Hubara', 'Sachin Idgunji', 'Thomas B. Jablin', 'Jeff Jiao', 'Tom St. John', 'Pankaj Kanwar', 'David Lee', 'Jeffery Liao', 'Anton Lokhmotov', 'Francisco Massa', 'Peng Meng', 'Paulius Micikevicius', 'Colin Osborne', 'Gennady Pekhimenko', 'Arun Tejusve Raghunath Rajan', 'Dilip Sequeira', 'Ashish Sirasao', 'Fei Sun', 'Hanlin Tang', 'Michael Thomson', 'Frank Wei', 'Ephrem Wu', 'Lingjie Xu', 'Koichi Yamada', 'Bing Yu', 'George Yuan', 'Aaron Zhong', 'Peizhao Zhang', 'Yuchen Zhou']","['cs.LG', 'cs.PF', 'stat.ML']",2019-11-06 18:43:10+00:00
http://arxiv.org/abs/1911.02536v2,Unsupervised Hierarchy Matching with Optimal Transport over Hyperbolic Spaces,"This paper focuses on the problem of unsupervised alignment of hierarchical
data such as ontologies or lexical databases. This is a problem that appears
across areas, from natural language processing to bioinformatics, and is
typically solved by appeal to outside knowledge bases and label-textual
similarity. In contrast, we approach the problem from a purely geometric
perspective: given only a vector-space representation of the items in the two
hierarchies, we seek to infer correspondences across them. Our work derives
from and interweaves hyperbolic-space representations for hierarchical data, on
one hand, and unsupervised word-alignment methods, on the other. We first
provide a set of negative results showing how and why Euclidean methods fail in
this hyperbolic setting. We then propose a novel approach based on optimal
transport over hyperbolic spaces, and show that it outperforms standard
embedding alignment techniques in various experiments on cross-lingual WordNet
alignment and ontology matching tasks.","['David Alvarez-Melis', 'Youssef Mroueh', 'Tommi S. Jaakkola']","['cs.LG', 'stat.ML']",2019-11-06 18:20:35+00:00
http://arxiv.org/abs/1911.02522v1,"Auptimizer -- an Extensible, Open-Source Framework for Hyperparameter Tuning","Tuning machine learning models at scale, especially finding the right
hyperparameter values, can be difficult and time-consuming. In addition to the
computational effort required, this process also requires some ancillary
efforts including engineering tasks (e.g., job scheduling) as well as more
mundane tasks (e.g., keeping track of the various parameters and associated
results). We present Auptimizer, a general Hyperparameter Optimization (HPO)
framework to help data scientists speed up model tuning and bookkeeping. With
Auptimizer, users can use all available computing resources in distributed
settings for model training. The user-friendly system design simplifies
creating, controlling, and tracking of a typical machine learning project. The
design also allows researchers to integrate new HPO algorithms. To demonstrate
its flexibility, we show how Auptimizer integrates a few major HPO techniques
(from random search to neural architecture search). The code is available at
https://github.com/LGE-ARC-AdvancedAI/auptimizer.","['Jiayi Liu', 'Samarth Tripathi', 'Unmesh Kurup', 'Mohak Shah']","['cs.LG', 'stat.ML']",2019-11-06 18:00:31+00:00
http://arxiv.org/abs/1911.02516v1,DC-S3GD: Delay-Compensated Stale-Synchronous SGD for Large-Scale Decentralized Neural Network Training,"Data parallelism has become the de facto standard for training Deep Neural
Network on multiple processing units. In this work we propose DC-S3GD, a
decentralized (without Parameter Server) stale-synchronous version of the
Delay-Compensated Asynchronous Stochastic Gradient Descent (DC-ASGD) algorithm.
In our approach, we allow for the overlap of computation and communication, and
compensate the inherent error with a first-order correction of the gradients.
We prove the effectiveness of our approach by training Convolutional Neural
Network with large batches and achieving state-of-the-art results.",['Alessandro Rigazzi'],"['cs.LG', 'cs.DC', 'stat.ML']",2019-11-06 17:54:56+00:00
http://arxiv.org/abs/1911.02508v2,Fooling LIME and SHAP: Adversarial Attacks on Post hoc Explanation Methods,"As machine learning black boxes are increasingly being deployed in domains
such as healthcare and criminal justice, there is growing emphasis on building
tools and techniques for explaining these black boxes in an interpretable
manner. Such explanations are being leveraged by domain experts to diagnose
systematic errors and underlying biases of black boxes. In this paper, we
demonstrate that post hoc explanations techniques that rely on input
perturbations, such as LIME and SHAP, are not reliable. Specifically, we
propose a novel scaffolding technique that effectively hides the biases of any
given classifier by allowing an adversarial entity to craft an arbitrary
desired explanation. Our approach can be used to scaffold any biased classifier
in such a way that its predictions on the input data distribution still remain
biased, but the post hoc explanations of the scaffolded classifier look
innocuous. Using extensive evaluation with multiple real-world datasets
(including COMPAS), we demonstrate how extremely biased (racist) classifiers
crafted by our framework can easily fool popular explanation techniques such as
LIME and SHAP into generating innocuous explanations which do not reflect the
underlying biases.","['Dylan Slack', 'Sophie Hilgard', 'Emily Jia', 'Sameer Singh', 'Himabindu Lakkaraju']","['cs.LG', 'cs.AI', 'stat.ML']",2019-11-06 17:52:20+00:00
http://arxiv.org/abs/1911.03362v2,"Domain, Translationese and Noise in Synthetic Data for Neural Machine Translation","The quality of neural machine translation can be improved by leveraging
additional monolingual resources to create synthetic training data. Source-side
monolingual data can be (forward-)translated into the target language for
self-training; target-side monolingual data can be back-translated. It has been
widely reported that back-translation delivers superior results, but could this
be due to artefacts in the test sets? We perform a case study using
French-English news translation task and separate test sets based on their
original languages. We show that forward translation delivers superior gains in
terms of BLEU on sentences that were originally in the source language,
complementing previous studies which show large improvements with
back-translation on sentences that were originally in the target language. To
better understand when and why forward and back-translation are effective, we
study the role of domains, translationese, and noise. While translationese
effects are well known to influence MT evaluation, we also find evidence that
news data from different languages shows subtle domain differences, which is
another explanation for varying performance on different portions of the test
set. We perform additional low-resource experiments which demonstrate that
forward translation is more sensitive to the quality of the initial translation
system than back-translation, and tends to perform worse in low-resource
settings.","['Nikolay Bogoychev', 'Rico Sennrich']","['cs.CL', 'cs.LG', 'stat.ML']",2019-11-06 17:30:57+00:00
http://arxiv.org/abs/1911.03224v3,"Assessing the Frontier: Active Learning, Model Accuracy, and Multi-objective Materials Discovery and Optimization","Discovering novel materials can be greatly accelerated by iterative machine
learning-informed proposal of candidates---active learning. However, standard
\emph{global-scope error} metrics for model quality are not predictive of
discovery performance, and can be misleading. We introduce the notion of
\emph{Pareto shell-scope error} to help judge the suitability of a model for
proposing material candidates. Further, through synthetic cases and a
thermoelectric dataset, we probe the relation between acquisition function
fidelity and active learning performance. Results suggest novel diagnostic
tools, as well as new insights for acquisition function design.","['Zachary del Rosario', 'Matthias Rupp', 'Yoolhee Kim', 'Erin Antono', 'Julia Ling']","['stat.ML', 'cs.LG', 'stat.ME']",2019-11-06 17:24:35+00:00
http://arxiv.org/abs/1911.02497v2,A Programmable Approach to Neural Network Compression,"Deep neural networks (DNNs) frequently contain far more weights, represented
at a higher precision, than are required for the specific task which they are
trained to perform. Consequently, they can often be compressed using techniques
such as weight pruning and quantization that reduce both the model size and
inference time without appreciable loss in accuracy. However, finding the best
compression strategy and corresponding target sparsity for a given DNN,
hardware platform, and optimization objective currently requires expensive,
frequently manual, trial-and-error experimentation. In this paper, we introduce
a programmable system for model compression called Condensa. Users
programmatically compose simple operators, in Python, to build more complex and
practically interesting compression strategies. Given a strategy and
user-provided objective (such as minimization of running time), Condensa uses a
novel Bayesian optimization-based algorithm to automatically infer desirable
sparsities. Our experiments on four real-world DNNs demonstrate memory
footprint and hardware runtime throughput improvements of 188x and 2.59x,
respectively, using at most ten samples per search. We have released a
reference implementation of Condensa at https://github.com/NVlabs/condensa.","['Vinu Joseph', 'Saurav Muralidharan', 'Animesh Garg', 'Michael Garland', 'Ganesh Gopalakrishnan']","['cs.LG', 'cs.CV', 'stat.ML']",2019-11-06 17:14:32+00:00
http://arxiv.org/abs/1911.02490v2,OpenML-Python: an extensible Python API for OpenML,"OpenML is an online platform for open science collaboration in machine
learning, used to share datasets and results of machine learning experiments.
In this paper we introduce OpenML-Python, a client API for Python, opening up
the OpenML platform for a wide range of Python-based tools. It provides easy
access to all datasets, tasks and experiments on OpenML from within Python. It
also provides functionality to conduct machine learning experiments, upload the
results to OpenML, and reproduce results which are stored on OpenML.
Furthermore, it comes with a scikit-learn plugin and a plugin mechanism to
easily integrate other machine learning libraries written in Python into the
OpenML ecosystem. Source code and documentation is available at
https://github.com/openml/openml-python/.","['Matthias Feurer', 'Jan N. van Rijn', 'Arlind Kadra', 'Pieter Gijsbers', 'Neeratyoy Mallik', 'Sahithya Ravi', 'Andreas Müller', 'Joaquin Vanschoren', 'Frank Hutter']","['cs.LG', 'stat.ML']",2019-11-06 16:59:30+00:00
http://arxiv.org/abs/1911.03959v4,Multi-Armed Bandits with Correlated Arms,"We consider a multi-armed bandit framework where the rewards obtained by
pulling different arms are correlated. We develop a unified approach to
leverage these reward correlations and present fundamental generalizations of
classic bandit algorithms to the correlated setting. We present a unified proof
technique to analyze the proposed algorithms. Rigorous analysis of C-UCB (the
correlated bandit version of Upper-confidence-bound) reveals that the algorithm
ends up pulling certain sub-optimal arms, termed as non-competitive, only O(1)
times, as opposed to the O(log T) pulls required by classic bandit algorithms
such as UCB, TS etc. We present regret-lower bound and show that when arms are
correlated through a latent random source, our algorithms obtain order-optimal
regret. We validate the proposed algorithms via experiments on the MovieLens
and Goodreads datasets, and show significant improvement over classical bandit
algorithms.","['Samarth Gupta', 'Shreyas Chaudhari', 'Gauri Joshi', 'Osman Yağan']","['stat.ML', 'cs.LG']",2019-11-06 16:56:46+00:00
