id,title,abstract,authors,categories,date
http://arxiv.org/abs/1710.06514v3,Robust importance-weighted cross-validation under sample selection bias,"Cross-validation under sample selection bias can, in principle, be done by
importance-weighting the empirical risk. However, the importance-weighted risk
estimator produces sub-optimal hyperparameter estimates in problem settings
where large weights arise with high probability. We study its sampling variance
as a function of the training data distribution and introduce a control variate
to increase its robustness to problematically large weights.","['Wouter M. Kouw', 'Jesse H. Krijthe', 'Marco Loog']","['cs.LG', 'stat.ML']",2017-10-17 22:10:07+00:00
http://arxiv.org/abs/1710.06487v3,Classification and Geometry of General Perceptual Manifolds,"Perceptual manifolds arise when a neural population responds to an ensemble
of sensory signals associated with different physical features (e.g.,
orientation, pose, scale, location, and intensity) of the same perceptual
object. Object recognition and discrimination requires classifying the
manifolds in a manner that is insensitive to variability within a manifold. How
neuronal systems give rise to invariant object classification and recognition
is a fundamental problem in brain theory as well as in machine learning. Here
we study the ability of a readout network to classify objects from their
perceptual manifold representations. We develop a statistical mechanical theory
for the linear classification of manifolds with arbitrary geometry revealing a
remarkable relation to the mathematics of conic decomposition. Novel
geometrical measures of manifold radius and manifold dimension are introduced
which can explain the classification capacity for manifolds of various
geometries. The general theory is demonstrated on a number of representative
manifolds, including L2 ellipsoids prototypical of strictly convex manifolds,
L1 balls representing polytopes consisting of finite sample points, and
orientation manifolds which arise from neurons tuned to respond to a continuous
angle variable, such as object orientation. The effects of label sparsity on
the classification capacity of manifolds are elucidated, revealing a scaling
relation between label sparsity and manifold radius. Theoretical predictions
are corroborated by numerical simulations using recently developed algorithms
to compute maximum margin solutions for manifold dichotomies. Our theory and
its extensions provide a powerful and rich framework for applying statistical
mechanics of linear classification to data arising from neuronal responses to
object stimuli, as well as to artificial deep networks trained for object
recognition tasks.","['SueYeon Chung', 'Daniel D. Lee', 'Haim Sompolinsky']","['cond-mat.dis-nn', 'cond-mat.stat-mech', 'cs.NE', 'q-bio.NC', 'stat.ML']",2017-10-17 20:06:25+00:00
http://arxiv.org/abs/1710.06462v3,S-Isomap++: Multi Manifold Learning from Streaming Data,"Manifold learning based methods have been widely used for non-linear
dimensionality reduction (NLDR). However, in many practical settings, the need
to process streaming data is a challenge for such methods, owing to the high
computational complexity involved. Moreover, most methods operate under the
assumption that the input data is sampled from a single manifold, embedded in a
high dimensional space. We propose a method for streaming NLDR when the
observed data is either sampled from multiple manifolds or irregularly sampled
from a single manifold. We show that existing NLDR methods, such as Isomap,
fail in such situations, primarily because they rely on smoothness and
continuity of the underlying manifold, which is violated in the scenarios
explored in this paper. However, the proposed algorithm is able to learn
effectively in presence of multiple, and potentially intersecting, manifolds,
while allowing for the input data to arrive as a massive stream.","['Suchismit Mahapatra', 'Varun Chandola']","['stat.ML', 'cs.LG']",2017-10-17 18:30:57+00:00
http://arxiv.org/abs/1710.06451v3,A Bayesian Perspective on Generalization and Stochastic Gradient Descent,"We consider two questions at the heart of machine learning; how can we
predict if a minimum will generalize to the test set, and why does stochastic
gradient descent find minima that generalize well? Our work responds to Zhang
et al. (2016), who showed deep neural networks can easily memorize randomly
labeled training data, despite generalizing well on real labels of the same
inputs. We show that the same phenomenon occurs in small linear models. These
observations are explained by the Bayesian evidence, which penalizes sharp
minima but is invariant to model parameterization. We also demonstrate that,
when one holds the learning rate fixed, there is an optimum batch size which
maximizes the test set accuracy. We propose that the noise introduced by small
mini-batches drives the parameters towards minima whose evidence is large.
Interpreting stochastic gradient descent as a stochastic differential equation,
we identify the ""noise scale"" $g = \epsilon (\frac{N}{B} - 1) \approx \epsilon
N/B$, where $\epsilon$ is the learning rate, $N$ the training set size and $B$
the batch size. Consequently the optimum batch size is proportional to both the
learning rate and the size of the training set, $B_{opt} \propto \epsilon N$.
We verify these predictions empirically.","['Samuel L. Smith', 'Quoc V. Le']","['cs.LG', 'cs.AI', 'stat.ML']",2017-10-17 18:08:04+00:00
http://arxiv.org/abs/1710.06382v2,Convergence diagnostics for stochastic gradient descent with constant step size,"Many iterative procedures in stochastic optimization exhibit a transient
phase followed by a stationary phase. During the transient phase the procedure
converges towards a region of interest, and during the stationary phase the
procedure oscillates in that region, commonly around a single point. In this
paper, we develop a statistical diagnostic test to detect such phase transition
in the context of stochastic gradient descent with constant learning rate. We
present theory and experiments suggesting that the region where the proposed
diagnostic is activated coincides with the convergence region. For a class of
loss functions, we derive a closed-form solution describing such region.
Finally, we suggest an application to speed up convergence of stochastic
gradient descent by halving the learning rate each time stationarity is
detected. This leads to a new variant of stochastic gradient descent, which in
many settings is comparable to state-of-art.","['Jerry Chee', 'Panos Toulis']","['stat.ML', 'cs.LG', 'math.ST', 'stat.CO', 'stat.TH']",2017-10-17 16:51:16+00:00
http://arxiv.org/abs/1710.06360v2,Good Arm Identification via Bandit Feedback,"We consider a novel stochastic multi-armed bandit problem called {\em good
arm identification} (GAI), where a good arm is defined as an arm with expected
reward greater than or equal to a given threshold. GAI is a pure-exploration
problem that a single agent repeats a process of outputting an arm as soon as
it is identified as a good one before confirming the other arms are actually
not good. The objective of GAI is to minimize the number of samples for each
process. We find that GAI faces a new kind of dilemma, the {\em
exploration-exploitation dilemma of confidence}, which is different difficulty
from the best arm identification. As a result, an efficient design of
algorithms for GAI is quite different from that for the best arm
identification. We derive a lower bound on the sample complexity of GAI that is
tight up to the logarithmic factor $\mathrm{O}(\log \frac{1}{\delta})$ for
acceptance error rate $\delta$. We also develop an algorithm whose sample
complexity almost matches the lower bound. We also confirm experimentally that
our proposed algorithm outperforms naive algorithms in synthetic settings based
on a conventional bandit problem and clinical trial researches for rheumatoid
arthritis.","['Hideaki Kano', 'Junya Honda', 'Kentaro Sakamaki', 'Kentaro Matsuura', 'Atsuyoshi Nakamura', 'Masashi Sugiyama']",['stat.ML'],2017-10-17 16:08:16+00:00
http://arxiv.org/abs/1710.06276v2,Smooth and Sparse Optimal Transport,"Entropic regularization is quickly emerging as a new standard in optimal
transport (OT). It enables to cast the OT computation as a differentiable and
unconstrained convex optimization problem, which can be efficiently solved
using the Sinkhorn algorithm. However, entropy keeps the transportation plan
strictly positive and therefore completely dense, unlike unregularized OT. This
lack of sparsity can be problematic in applications where the transportation
plan itself is of interest. In this paper, we explore regularizing the primal
and dual OT formulations with a strongly convex term, which corresponds to
relaxing the dual and primal constraints with smooth approximations. We show
how to incorporate squared $2$-norm and group lasso regularizations within that
framework, leading to sparse and group-sparse transportation plans. On the
theoretical side, we bound the approximation error introduced by regularizing
the primal and dual formulations. Our results suggest that, for the regularized
primal, the approximation error can often be smaller with squared $2$-norm than
with entropic regularization. We showcase our proposed framework on the task of
color transfer.","['Mathieu Blondel', 'Vivien Seguy', 'Antoine Rolet']","['stat.ML', 'cs.LG']",2017-10-17 13:42:37+00:00
http://arxiv.org/abs/1710.06273v2,Combinatorial Penalties: Which structures are preserved by convex relaxations?,"We consider the homogeneous and the non-homogeneous convex relaxations for
combinatorial penalty functions defined on support sets. Our study identifies
key differences in the tightness of the resulting relaxations through the
notion of the lower combinatorial envelope of a set-function along with new
necessary conditions for support identification. We then propose a general
adaptive estimator for convex monotone regularizers, and derive new sufficient
conditions for support recovery in the asymptotic setting.","['Marwa El Halabi', 'Francis Bach', 'Volkan Cevher']","['cs.LG', 'stat.ML']",2017-10-17 13:41:21+00:00
http://arxiv.org/abs/1710.06261v1,Convergence Rate of Riemannian Hamiltonian Monte Carlo and Faster Polytope Volume Computation,"We give the first rigorous proof of the convergence of Riemannian Hamiltonian
Monte Carlo, a general (and practical) method for sampling Gibbs distributions.
Our analysis shows that the rate of convergence is bounded in terms of natural
smoothness parameters of an associated Riemannian manifold. We then apply the
method with the manifold defined by the log barrier function to the problems of
(1) uniformly sampling a polytope and (2) computing its volume, the latter by
extending Gaussian cooling to the manifold setting. In both cases, the total
number of steps needed is O^{*}(mn^{\frac{2}{3}}), improving the state of the
art. A key ingredient of our analysis is a proof of an analog of the KLS
conjecture for Gibbs distributions over manifolds.","['Yin Tat Lee', 'Santosh S. Vempala']","['cs.DS', 'math.FA', 'stat.ML']",2017-10-17 13:30:27+00:00
http://arxiv.org/abs/1710.06234v1,Nonlinear Interference Mitigation via Deep Neural Networks,"A neural-network-based approach is presented to efficiently implement digital
backpropagation (DBP). For a 32x100 km fiber-optic link, the resulting
""learned"" DBP significantly reduces the complexity compared to conventional DBP
implementations.","['Christian Häger', 'Henry D. Pfister']","['cs.IT', 'math.IT', 'stat.ML']",2017-10-17 12:23:26+00:00
http://arxiv.org/abs/1710.06219v3,Learning to Warm-Start Bayesian Hyperparameter Optimization,"Hyperparameter optimization aims to find the optimal hyperparameter
configuration of a machine learning model, which provides the best performance
on a validation dataset. Manual search usually leads to get stuck in a local
hyperparameter configuration, and heavily depends on human intuition and
experience. A simple alternative of manual search is random/grid search on a
space of hyperparameters, which still undergoes extensive evaluations of
validation errors in order to find its best configuration. Bayesian
optimization that is a global optimization method for black-box functions is
now popular for hyperparameter optimization, since it greatly reduces the
number of validation error evaluations required, compared to random/grid
search. Bayesian optimization generally finds the best hyperparameter
configuration from random initialization without any prior knowledge. This
motivates us to let Bayesian optimization start from the configurations that
were successful on similar datasets, which are able to remarkably minimize the
number of evaluations. In this paper, we propose deep metric learning to learn
meta-features over datasets such that the similarity over them is effectively
measured by Euclidean distance between their associated meta-features. To this
end, we introduce a Siamese network composed of deep feature and meta-feature
extractors, where deep feature extractor provides a semantic representation of
each instance in a dataset and meta-feature extractor aggregates a set of deep
features to encode a single representation over a dataset. Then, our learned
meta-features are used to select a few datasets similar to the new dataset, so
that hyperparameters in similar datasets are adopted as initializations to
warm-start Bayesian hyperparameter optimization.","['Jungtaek Kim', 'Saehoon Kim', 'Seungjin Choi']","['stat.ML', 'cs.LG']",2017-10-17 11:34:32+00:00
http://arxiv.org/abs/1710.06202v2,Deep Gaussian Covariance Network,"The correlation length-scale next to the noise variance are the most used
hyperparameters for the Gaussian processes. Typically, stationary covariance
functions are used, which are only dependent on the distances between input
points and thus invariant to the translations in the input space. The
optimization of the hyperparameters is commonly done by maximizing the log
marginal likelihood. This works quite well, if the distances are uniform
distributed. In the case of a locally adapted or even sparse input space, the
prediction of a test point can be worse dependent of its position. A possible
solution to this, is the usage of a non-stationary covariance function, where
the hyperparameters are calculated by a deep neural network. So that the
correlation length scales and possibly the noise variance are dependent on the
test point. Furthermore, different types of covariance functions are trained
simultaneously, so that the Gaussian process prediction is an additive overlay
of different covariance matrices. The right covariance functions combination
and its hyperparameters are learned by the deep neural network. Additional, the
Gaussian process will be able to be trained by batches or online and so it can
handle arbitrarily large data sets. We call this framework Deep Gaussian
Covariance Network (DGCP). There are also further extensions to this framework
possible, for example sequentially dependent problems like time series or the
local mixture of experts. The basic framework and some extension possibilities
will be presented in this work. Moreover, a comparison to some recent state of
the art surrogate model methods will be performed, also for a time dependent
problem.","['Kevin Cremanns', 'Dirk Roos']","['cs.LG', 'stat.ML']",2017-10-17 10:57:21+00:00
http://arxiv.org/abs/1710.06169v4,Distill-and-Compare: Auditing Black-Box Models Using Transparent Model Distillation,"Black-box risk scoring models permeate our lives, yet are typically
proprietary or opaque. We propose Distill-and-Compare, a model distillation and
comparison approach to audit such models. To gain insight into black-box
models, we treat them as teachers, training transparent student models to mimic
the risk scores assigned by black-box models. We compare the student model
trained with distillation to a second un-distilled transparent model trained on
ground-truth outcomes, and use differences between the two models to gain
insight into the black-box model. Our approach can be applied in a realistic
setting, without probing the black-box model API. We demonstrate the approach
on four public data sets: COMPAS, Stop-and-Frisk, Chicago Police, and Lending
Club. We also propose a statistical test to determine if a data set is missing
key features used to train the black-box model. Our test finds that the
ProPublica data is likely missing key feature(s) used in COMPAS.","['Sarah Tan', 'Rich Caruana', 'Giles Hooker', 'Yin Lou']","['stat.ML', 'cs.AI', 'cs.LG']",2017-10-17 08:58:59+00:00
http://arxiv.org/abs/1710.06085v1,"On the challenges of learning with inference networks on sparse, high-dimensional data","We study parameter estimation in Nonlinear Factor Analysis (NFA) where the
generative model is parameterized by a deep neural network. Recent work has
focused on learning such models using inference (or recognition) networks; we
identify a crucial problem when modeling large, sparse, high-dimensional
datasets -- underfitting. We study the extent of underfitting, highlighting
that its severity increases with the sparsity of the data. We propose methods
to tackle it via iterative optimization inspired by stochastic variational
inference \citep{hoffman2013stochastic} and improvements in the sparse data
representation used for inference. The proposed techniques drastically improve
the ability of these powerful models to fit sparse data, achieving
state-of-the-art results on a benchmark text-count dataset and excellent
results on the task of top-N recommendation.","['Rahul G. Krishnan', 'Dawen Liang', 'Matthew Hoffman']","['stat.ML', 'cs.LG']",2017-10-17 04:17:07+00:00
http://arxiv.org/abs/1710.06081v3,Boosting Adversarial Attacks with Momentum,"Deep neural networks are vulnerable to adversarial examples, which poses
security concerns on these algorithms due to the potentially severe
consequences. Adversarial attacks serve as an important surrogate to evaluate
the robustness of deep learning models before they are deployed. However, most
of existing adversarial attacks can only fool a black-box model with a low
success rate. To address this issue, we propose a broad class of momentum-based
iterative algorithms to boost adversarial attacks. By integrating the momentum
term into the iterative process for attacks, our methods can stabilize update
directions and escape from poor local maxima during the iterations, resulting
in more transferable adversarial examples. To further improve the success rates
for black-box attacks, we apply momentum iterative algorithms to an ensemble of
models, and show that the adversarially trained models with a strong defense
ability are also vulnerable to our black-box attacks. We hope that the proposed
methods will serve as a benchmark for evaluating the robustness of various deep
models and defense methods. With this method, we won the first places in NIPS
2017 Non-targeted Adversarial Attack and Targeted Adversarial Attack
competitions.","['Yinpeng Dong', 'Fangzhou Liao', 'Tianyu Pang', 'Hang Su', 'Jun Zhu', 'Xiaolin Hu', 'Jianguo Li']","['cs.LG', 'stat.ML']",2017-10-17 04:03:04+00:00
http://arxiv.org/abs/1710.06078v1,Estimate exponential memory decay in Hidden Markov Model and its applications,"Inference in hidden Markov model has been challenging in terms of scalability
due to dependencies in the observation data. In this paper, we utilize the
inherent memory decay in hidden Markov models, such that the forward and
backward probabilities can be carried out with subsequences, enabling efficient
inference over long sequences of observations. We formulate this forward
filtering process in the setting of the random dynamical system and there exist
Lyapunov exponents in the i.i.d random matrices production. And the rate of the
memory decay is known as $\lambda_2-\lambda_1$, the gap of the top two Lyapunov
exponents almost surely. An efficient and accurate algorithm is proposed to
numerically estimate the gap after the soft-max parametrization. The length of
subsequences $B$ given the controlled error $\epsilon$ is
$B=\log(\epsilon)/(\lambda_2-\lambda_1)$. We theoretically prove the validity
of the algorithm and demonstrate the effectiveness with numerical examples. The
method developed here can be applied to widely used algorithms, such as
mini-batch stochastic gradient method. Moreover, the continuity of Lyapunov
spectrum ensures the estimated $B$ could be reused for the nearby parameter
during the inference.","['Felix X. -F. Ye', 'Yi-an Ma', 'Hong Qian']","['stat.ML', 'stat.ME']",2017-10-17 03:54:11+00:00
http://arxiv.org/abs/1710.06071v1,PubMed 200k RCT: a Dataset for Sequential Sentence Classification in Medical Abstracts,"We present PubMed 200k RCT, a new dataset based on PubMed for sequential
sentence classification. The dataset consists of approximately 200,000
abstracts of randomized controlled trials, totaling 2.3 million sentences. Each
sentence of each abstract is labeled with their role in the abstract using one
of the following classes: background, objective, method, result, or conclusion.
The purpose of releasing this dataset is twofold. First, the majority of
datasets for sequential short-text classification (i.e., classification of
short texts that appear in sequences) are small: we hope that releasing a new
large dataset will help develop more accurate algorithms for this task. Second,
from an application perspective, researchers need better tools to efficiently
skim through the literature. Automatically classifying each sentence in an
abstract would help researchers read abstracts more efficiently, especially in
fields where abstracts may be long, such as the medical field.","['Franck Dernoncourt', 'Ji Young Lee']","['cs.CL', 'cs.AI', 'stat.ML']",2017-10-17 03:22:00+00:00
http://arxiv.org/abs/1710.06034v4,Stochastic Variance Reduction for Policy Gradient Estimation,"Recent advances in policy gradient methods and deep learning have
demonstrated their applicability for complex reinforcement learning problems.
However, the variance of the performance gradient estimates obtained from the
simulation is often excessive, leading to poor sample efficiency. In this
paper, we apply the stochastic variance reduced gradient descent (SVRG) to
model-free policy gradient to significantly improve the sample-efficiency. The
SVRG estimation is incorporated into a trust-region Newton conjugate gradient
framework for the policy optimization. On several Mujoco tasks, our method
achieves significantly better performance compared to the state-of-the-art
model-free policy gradient methods in robotic continuous control such as trust
region policy optimization (TRPO)","['Tianbing Xu', 'Qiang Liu', 'Jian Peng']","['cs.LG', 'stat.ML']",2017-10-17 00:05:06+00:00
http://arxiv.org/abs/1710.06030v2,Linear Regression with Sparsely Permuted Data,"In regression analysis of multivariate data, it is tacitly assumed that
response and predictor variables in each observed response-predictor pair
correspond to the same entity or unit. In this paper, we consider the situation
of ""permuted data"" in which this basic correspondence has been lost. Several
recent papers have considered this situation without further assumptions on the
underlying permutation. In applications, the latter is often to known to have
additional structure that can be leveraged. Specifically, we herein consider
the common scenario of ""sparsely permuted data"" in which only a small fraction
of the data is affected by a mismatch between response and predictors. However,
an adverse effect already observed for sparsely permuted data is that the least
squares estimator as well as other estimators not accounting for such partial
mismatch are inconsistent. One approach studied in detail herein is to treat
permuted data as outliers which motivates the use of robust regression
formulations to estimate the regression parameter. The resulting estimate can
subsequently be used to recover the permutation. A notable benefit of the
proposed approach is its computational simplicity given the general lack of
procedures for the above problem that are both statistically sound and
computationally appealing.","['Martin Slawski', 'Emanuel Ben-David']","['math.ST', 'stat.ME', 'stat.ML', 'stat.TH']",2017-10-16 23:24:23+00:00
http://arxiv.org/abs/1710.06012v2,VAMPnets: Deep learning of molecular kinetics,"There is an increasing demand for computing the relevant structures,
equilibria and long-timescale kinetics of biomolecular processes, such as
protein-drug binding, from high-throughput molecular dynamics simulations.
Current methods employ transformation of simulated coordinates into structural
features, dimension reduction, clustering the dimension-reduced data, and
estimation of a Markov state model or related model of the interconversion
rates between molecular structures. This handcrafted approach demands a
substantial amount of modeling expertise, as poor decisions at any step will
lead to large modeling errors. Here we employ the variational approach for
Markov processes (VAMP) to develop a deep learning framework for molecular
kinetics using neural networks, dubbed VAMPnets. A VAMPnet encodes the entire
mapping from molecular coordinates to Markov states, thus combining the whole
data processing pipeline in a single end-to-end framework. Our method performs
equally or better than state-of-the art Markov modeling methods and provides
easily interpretable few-state kinetic models.","['Andreas Mardt', 'Luca Pasquali', 'Hao Wu', 'Frank Noé']","['stat.ML', 'physics.bio-ph', 'physics.chem-ph', 'physics.comp-ph']",2017-10-16 22:21:22+00:00
