id,title,abstract,authors,categories,date
http://arxiv.org/abs/1609.07165v1,Robust Confidence Intervals in High-Dimensional Left-Censored Regression,"This paper develops robust confidence intervals in high-dimensional and
left-censored regression. Type-I censored regression models are extremely
common in practice, where a competing event makes the variable of interest
unobservable. However, techniques developed for entirely observed data do not
directly apply to the censored observations. In this paper, we develop smoothed
estimating equations that augment the de-biasing method, such that the
resulting estimator is adaptive to censoring and is more robust to the
misspecification of the error distribution. We propose a unified class of
robust estimators, including Mallow's, Schweppe's and Hill-Ryan's one-step
estimator.
  In the ultra-high-dimensional setting, where the dimensionality can grow
exponentially with the sample size, we show that as long as the preliminary
estimator converges faster than $n^{-1/4}$, the one-step estimator inherits
asymptotic distribution of fully iterated version. Moreover, we show that the
size of the residuals of the Bahadur representation matches those of the simple
linear models, $s^{3/4 } (\log (p \vee n))^{3/4} / n^{1/4}$ -- that is, the
effects of censoring asymptotically disappear. Simulation studies demonstrate
that our method is adaptive to the censoring level and asymmetry in the error
distribution, and does not lose efficiency when the errors are from symmetric
distributions. Finally, we apply the developed method to a real data set from
the MAQC-II repository that is related to the HIV-1 study.","['Jelena Bradic', 'Jiaqi Guo']","['math.ST', 'stat.ME', 'stat.ML', 'stat.TH']",2016-09-22 21:09:43+00:00
http://arxiv.org/abs/1609.07093v3,Neural Photo Editing with Introspective Adversarial Networks,"The increasingly photorealistic sample quality of generative image models
suggests their feasibility in applications beyond image generation. We present
the Neural Photo Editor, an interface that leverages the power of generative
neural networks to make large, semantically coherent changes to existing
images. To tackle the challenge of achieving accurate reconstructions without
loss of feature quality, we introduce the Introspective Adversarial Network, a
novel hybridization of the VAE and GAN. Our model efficiently captures
long-range dependencies through use of a computational block based on
weight-shared dilated convolutions, and improves generalization performance
with Orthogonal Regularization, a novel weight regularization method. We
validate our contributions on CelebA, SVHN, and CIFAR-100, and produce samples
and reconstructions with high visual fidelity.","['Andrew Brock', 'Theodore Lim', 'J. M. Ritchie', 'Nick Weston']","['cs.LG', 'cs.CV', 'cs.NE', 'stat.ML']",2016-09-22 18:07:56+00:00
http://arxiv.org/abs/1609.07087v2,(Bandit) Convex Optimization with Biased Noisy Gradient Oracles,"Algorithms for bandit convex optimization and online learning often rely on
constructing noisy gradient estimates, which are then used in appropriately
adjusted first-order algorithms, replacing actual gradients. Depending on the
properties of the function to be optimized and the nature of ``noise'' in the
bandit feedback, the bias and variance of gradient estimates exhibit various
tradeoffs. In this paper we propose a novel framework that replaces the
specific gradient estimation methods with an abstract oracle. With the help of
the new framework we unify previous works, reproducing their results in a clean
and concise fashion, while, perhaps more importantly, the framework also allows
us to formally show that to achieve the optimal root-$n$ rate either the
algorithms that use existing gradient estimators, or the proof techniques used
to analyze them have to go beyond what exists today.","['Xiaowei Hu', 'Prashanth L. A.', 'András György', 'Csaba Szepesvári']","['cs.LG', 'stat.ML']",2016-09-22 17:56:38+00:00
http://arxiv.org/abs/1609.07072v1,The Many-Body Expansion Combined with Neural Networks,"Fragmentation methods such as the many-body expansion (MBE) are a common
strategy to model large systems by partitioning energies into a hierarchy of
decreasingly significant contributions. The number of fragments required for
chemical accuracy is still prohibitively expensive for ab-initio MBE to compete
with force field approximations for applications beyond single-point energies.
Alongside the MBE, empirical models of ab-initio potential energy surfaces have
improved, especially non-linear models based on neural networks (NN) which can
reproduce ab-initio potential energy surfaces rapidly and accurately. Although
they are fast, NNs suffer from their own curse of dimensionality; they must be
trained on a representative sample of chemical space. In this paper we examine
the synergy of the MBE and NN's, and explore their complementarity. The MBE
offers a systematic way to treat systems of arbitrary size and intelligently
sample chemical space. NN's reduce, by a factor in excess of $10^6$ the
computational overhead of the MBE and reproduce the accuracy of ab-initio
calculations without specialized force fields. We show they are remarkably
general, providing comparable accuracy with drastically different chemical
embeddings. To assess this we test a new chemical embedding which can be
inverted to predict molecules with desired properties.","['Kun Yao', 'John E. Herr', 'John Parkhill']","['physics.chem-ph', 'physics.comp-ph', 'stat.ML']",2016-09-22 17:09:47+00:00
http://arxiv.org/abs/1609.07060v1,An equivalence between high dimensional Bayes optimal inference and M-estimation,"When recovering an unknown signal from noisy measurements, the computational
difficulty of performing optimal Bayesian MMSE (minimum mean squared error)
inference often necessitates the use of maximum a posteriori (MAP) inference, a
special case of regularized M-estimation, as a surrogate. However, MAP is
suboptimal in high dimensions, when the number of unknown signal components is
similar to the number of measurements. In this work we demonstrate, when the
signal distribution and the likelihood function associated with the noise are
both log-concave, that optimal MMSE performance is asymptotically achievable
via another M-estimation procedure. This procedure involves minimizing convex
loss and regularizer functions that are nonlinearly smoothed versions of the
widely applied MAP optimization problem. Our findings provide a new heuristic
derivation and interpretation for recent optimal M-estimators found in the
setting of linear measurements and additive noise, and further extend these
results to nonlinear measurements with non-additive noise. We numerically
demonstrate superior performance of our optimal M-estimators relative to MAP.
Overall, at the heart of our work is the revelation of a remarkable equivalence
between two seemingly very different computational problems: namely that of
high dimensional Bayesian integration underlying MMSE inference, and high
dimensional convex optimization underlying M-estimation. In essence we show
that the former difficult integral may be computed by solving the latter,
simpler optimization problem.","['Madhu Advani', 'Surya Ganguli']","['stat.ML', 'cond-mat.dis-nn', 'math.ST', 'q-bio.NC', 'stat.TH']",2016-09-22 16:46:18+00:00
http://arxiv.org/abs/1609.07042v4,Pose-Selective Max Pooling for Measuring Similarity,"In this paper, we deal with two challenges for measuring the similarity of
the subject identities in practical video-based face recognition - the
variation of the head pose in uncontrolled environments and the computational
expense of processing videos. Since the frame-wise feature mean is unable to
characterize the pose diversity among frames, we define and preserve the
overall pose diversity and closeness in a video. Then, identity will be the
only source of variation across videos since the pose varies even within a
single video. Instead of simply using all the frames, we select those faces
whose pose point is closest to the centroid of the K-means cluster containing
that pose point. Then, we represent a video as a bag of frame-wise deep face
features while the number of features has been reduced from hundreds to K.
Since the video representation can well represent the identity, now we measure
the subject similarity between two videos as the max correlation among all
possible pairs in the two bags of features. On the official 5,000 video-pairs
of the YouTube Face dataset for face verification, our algorithm achieves a
comparable performance with VGG-face that averages over deep features of all
frames. Other vision tasks can also benefit from the generic idea of employing
geometric cues to improve the descriptiveness of deep features.","['Xiang Xiang', 'Trac D. Tran']","['cs.CV', 'cs.AI', 'cs.LG', 'stat.ML']",2016-09-22 15:59:38+00:00
http://arxiv.org/abs/1609.06942v1,Randomized Independent Component Analysis,"Independent component analysis (ICA) is a method for recovering statistically
independent signals from observations of unknown linear combinations of the
sources. Some of the most accurate ICA decomposition methods require searching
for the inverse transformation which minimizes different approximations of the
Mutual Information, a measure of statistical independence of random vectors.
Two such approximations are the Kernel Generalized Variance or the Kernel
Canonical Correlation which has been shown to reach the highest performance of
ICA methods. However, the computational effort necessary just for computing
these measures is cubic in the sample size. Hence, optimizing them becomes even
more computationally demanding, in terms of both space and time. Here, we
propose a couple of alternative novel measures based on randomized features of
the samples - the Randomized Generalized Variance and the Randomized Canonical
Correlation. The computational complexity of calculating the proposed
alternatives is linear in the sample size and provide a controllable
approximation of their Kernel-based non-random versions. We also show that
optimization of the proposed statistical properties yields a comparable
separation error at an order of magnitude faster compared to Kernel-based
measures.","['Matan Sela', 'Ron Kimmel']","['stat.ML', 'cs.LG', 'cs.SY', 'math.PR', 'math.ST', 'stat.TH']",2016-09-22 12:40:58+00:00
http://arxiv.org/abs/1610.01989v1,Regularized Dynamic Boltzmann Machine with Delay Pruning for Unsupervised Learning of Temporal Sequences,"We introduce Delay Pruning, a simple yet powerful technique to regularize
dynamic Boltzmann machines (DyBM). The recently introduced DyBM provides a
particularly structured Boltzmann machine, as a generative model of a
multi-dimensional time-series. This Boltzmann machine can have infinitely many
layers of units but allows exact inference and learning based on its
biologically motivated structure. DyBM uses the idea of conduction delays in
the form of fixed length first-in first-out (FIFO) queues, with a neuron
connected to another via this FIFO queue, and spikes from a pre-synaptic neuron
travel along the queue to the post-synaptic neuron with a constant period of
delay. Here, we present Delay Pruning as a mechanism to prune the lengths of
the FIFO queues (making them zero) by setting some delay lengths to one with a
fixed probability, and finally selecting the best performing model with fixed
delays. The uniqueness of structure and a non-sampling based learning rule in
DyBM, make the application of previously proposed regularization techniques
like Dropout or DropConnect difficult, leading to poor generalization. First,
we evaluate the performance of Delay Pruning to let DyBM learn a
multidimensional temporal sequence generated by a Markov chain. Finally, we
show the effectiveness of delay pruning in learning high dimensional sequences
using the moving MNIST dataset, and compare it with Dropout and DropConnect
methods.","['Sakyasingha Dasgupta', 'Takayuki Yoshizumi', 'Takayuki Osogami']","['cs.LG', 'cs.NE', 'stat.ML']",2016-09-22 10:04:59+00:00
http://arxiv.org/abs/1609.06864v2,A probabilistic network for the diagnosis of acute cardiopulmonary diseases,"In this paper, the development of a probabilistic network for the diagnosis
of acute cardiopulmonary diseases is presented. This paper is a draft version
of the article published after peer review in 2018
(https://doi.org/10.1002/bimj.201600206). A panel of expert physicians
collaborated to specify the qualitative part, that is a directed acyclic graph
defining a factorization of the joint probability distribution of domain
variables. The quantitative part, that is the set of all conditional
probability distributions defined by each factor, was estimated in the Bayesian
paradigm: we applied a special formal representation, characterized by a low
number of parameters and a parameterization intelligible for physicians,
elicited the joint prior distribution of parameters from medical experts, and
updated it by conditioning on a dataset of hospital patient records using
Markov Chain Monte Carlo simulation. Refinement was cyclically performed until
the probabilistic network provided satisfactory Concordance Index values for a
selection of acute diseases and reasonable inference on six fictitious patient
cases. The probabilistic network can be employed to perform medical diagnosis
on a total of 63 diseases (38 acute and 25 chronic) on the basis of up to 167
patient findings.","['Alessandro Magrini', 'Davide Luciani', 'Federico Mattia Stefanini']","['stat.ML', 'stat.AP', '62F15, 62P10']",2016-09-22 08:28:38+00:00
http://arxiv.org/abs/1609.06840v2,Exact Sampling from Determinantal Point Processes,"Determinantal point processes (DPPs) are an important concept in random
matrix theory and combinatorics. They have also recently attracted interest in
the study of numerical methods for machine learning, as they offer an elegant
""missing link"" between independent Monte Carlo sampling and deterministic
evaluation on regular grids, applicable to a general set of spaces. This is
helpful whenever an algorithm explores to reduce uncertainty, such as in active
learning, Bayesian optimization, reinforcement learning, and marginalization in
graphical models. To draw samples from a DPP in practice, existing literature
focuses on approximate schemes of low cost, or comparably inefficient exact
algorithms like rejection sampling. We point out that, for many settings of
relevance to machine learning, it is also possible to draw exact samples from
DPPs on continuous domains. We start from an intuitive example on the real
line, which is then generalized to multivariate real vector spaces. We also
compare to previously studied approximations, showing that exact sampling,
despite higher cost, can be preferable where precision is needed.","['Philipp Hennig', 'Roman Garnett']","['cs.LG', 'math.PR', 'stat.ML']",2016-09-22 07:06:28+00:00
http://arxiv.org/abs/1609.06831v1,Hawkes Processes with Stochastic Excitations,"We propose an extension to Hawkes processes by treating the levels of
self-excitation as a stochastic differential equation. Our new point process
allows better approximation in application domains where events and intensities
accelerate each other with correlated levels of contagion. We generalize a
recent algorithm for simulating draws from Hawkes processes whose levels of
excitation are stochastic processes, and propose a hybrid Markov chain Monte
Carlo approach for model fitting. Our sampling procedure scales linearly with
the number of required events and does not require stationarity of the point
process. A modular inference procedure consisting of a combination between
Gibbs and Metropolis Hastings steps is put forward. We recover expectation
maximization as a special case. Our general approach is illustrated for
contagion following geometric Brownian motion and exponential Langevin
dynamics.","['Young Lee', 'Kar Wai Lim', 'Cheng Soon Ong']","['cs.LG', 'stat.ML']",2016-09-22 06:18:20+00:00
http://arxiv.org/abs/1609.06826v1,Bibliographic Analysis with the Citation Network Topic Model,"Bibliographic analysis considers author's research areas, the citation
network and paper content among other things. In this paper, we combine these
three in a topic model that produces a bibliographic model of authors, topics
and documents using a non-parametric extension of a combination of the Poisson
mixed-topic link model and the author-topic model. We propose a novel and
efficient inference algorithm for the model to explore subsets of research
publications from CiteSeerX. Our model demonstrates improved performance in
both model fitting and a clustering task compared to several baselines.","['Kar Wai Lim', 'Wray Buntine']","['cs.DL', 'cs.LG', 'stat.ML']",2016-09-22 05:46:46+00:00
http://arxiv.org/abs/1609.06783v1,Nonparametric Bayesian Topic Modelling with the Hierarchical Pitman-Yor Processes,"The Dirichlet process and its extension, the Pitman-Yor process, are
stochastic processes that take probability distributions as a parameter. These
processes can be stacked up to form a hierarchical nonparametric Bayesian
model. In this article, we present efficient methods for the use of these
processes in this hierarchical context, and apply them to latent variable
models for text analytics. In particular, we propose a general framework for
designing these Bayesian models, which are called topic models in the computer
science community. We then propose a specific nonparametric Bayesian topic
model for modelling text from social media. We focus on tweets (posts on
Twitter) in this article due to their ease of access. We find that our
nonparametric model performs better than existing parametric models in both
goodness of fit and real world applications.","['Kar Wai Lim', 'Wray Buntine', 'Changyou Chen', 'Lan Du']","['stat.ML', 'cs.CL', 'cs.LG']",2016-09-22 00:10:16+00:00
http://arxiv.org/abs/1609.06764v3,Saturating Splines and Feature Selection,"We extend the adaptive regression spline model by incorporating saturation,
the natural requirement that a function extend as a constant outside a certain
range. We fit saturating splines to data using a convex optimization problem
over a space of measures, which we solve using an efficient algorithm based on
the conditional gradient method. Unlike many existing approaches, our algorithm
solves the original infinite-dimensional (for splines of degree at least two)
optimization problem without pre-specified knot locations. We then adapt our
algorithm to fit generalized additive models with saturating splines as
coordinate functions and show that the saturation requirement allows our model
to simultaneously perform feature selection and nonlinear function fitting.
Finally, we briefly sketch how the method can be extended to higher order
splines and to different requirements on the extension outside the data range.","['Nicholas Boyd', 'Trevor Hastie', 'Stephen Boyd', 'Benjamin Recht', 'Michael Jordan']",['stat.ML'],2016-09-21 21:57:25+00:00
http://arxiv.org/abs/1609.06575v2,Theoretical Evaluation of Feature Selection Methods based on Mutual Information,"Feature selection methods are usually evaluated by wrapping specific
classifiers and datasets in the evaluation process, resulting very often in
unfair comparisons between methods. In this work, we develop a theoretical
framework that allows obtaining the true feature ordering of two-dimensional
sequential forward feature selection methods based on mutual information, which
is independent of entropy or mutual information estimation methods,
classifiers, or datasets, and leads to an undoubtful comparison of the methods.
Moreover, the theoretical framework unveils problems intrinsic to some methods
that are otherwise difficult to detect, namely inconsistencies in the
construction of the objective function used to select the candidate features,
due to various types of indeterminations and to the possibility of the entropy
of continuous random variables taking null and negative values.","['Cláudia Pascoal', 'M. Rosário Oliveira', 'António Pacheco', 'Rui Valadas']","['stat.ML', 'cs.LG']",2016-09-21 14:23:15+00:00
http://arxiv.org/abs/1609.06533v1,On Data-Independent Properties for Density-Based Dissimilarity Measures in Hybrid Clustering,"Hybrid clustering combines partitional and hierarchical clustering for
computational effectiveness and versatility in cluster shape. In such
clustering, a dissimilarity measure plays a crucial role in the hierarchical
merging. The dissimilarity measure has great impact on the final clustering,
and data-independent properties are needed to choose the right dissimilarity
measure for the problem at hand. Properties for distance-based dissimilarity
measures have been studied for decades, but properties for density-based
dissimilarity measures have so far received little attention. Here, we propose
six data-independent properties to evaluate density-based dissimilarity
measures associated with hybrid clustering, regarding equality, orthogonality,
symmetry, outlier and noise observations, and light-tailed models for
heavy-tailed clusters. The significance of the properties is investigated, and
we study some well-known dissimilarity measures based on Shannon entropy,
misclassification rate, Bhattacharyya distance and Kullback-Leibler divergence
with respect to the proposed properties. As none of them satisfy all the
proposed properties, we introduce a new dissimilarity measure based on the
Kullback-Leibler information and show that it satisfies all proposed
properties. The effect of the proposed properties is also illustrated on
several real and simulated data sets.","['Kajsa Møllersen', 'Subhra S. Dhar', 'Fred Godtliebsen']","['stat.ML', 'cs.LG']",2016-09-21 12:46:09+00:00
http://arxiv.org/abs/1609.06532v1,"Bibliographic Analysis on Research Publications using Authors, Categorical Labels and the Citation Network","Bibliographic analysis considers the author's research areas, the citation
network and the paper content among other things. In this paper, we combine
these three in a topic model that produces a bibliographic model of authors,
topics and documents, using a nonparametric extension of a combination of the
Poisson mixed-topic link model and the author-topic model. This gives rise to
the Citation Network Topic Model (CNTM). We propose a novel and efficient
inference algorithm for the CNTM to explore subsets of research publications
from CiteSeerX. The publication datasets are organised into three corpora,
totalling to about 168k publications with about 62k authors. The queried
datasets are made available online. In three publicly available corpora in
addition to the queried datasets, our proposed model demonstrates an improved
performance in both model fitting and document clustering, compared to several
baselines. Moreover, our model allows extraction of additional useful knowledge
from the corpora, such as the visualisation of the author-topics network.
Additionally, we propose a simple method to incorporate supervision into topic
modelling to achieve further improvement on the clustering task.","['Kar Wai Lim', 'Wray Buntine']","['cs.DL', 'cs.LG', 'stat.ML']",2016-09-21 12:44:37+00:00
http://arxiv.org/abs/1609.06480v1,Network-regularized Sparse Logistic Regression Models for Clinical Risk Prediction and Biomarker Discovery,"Molecular profiling data (e.g., gene expression) has been used for clinical
risk prediction and biomarker discovery. However, it is necessary to integrate
other prior knowledge like biological pathways or gene interaction networks to
improve the predictive ability and biological interpretability of biomarkers.
Here, we first introduce a general regularized Logistic Regression (LR)
framework with regularized term $\lambda \|\bm{w}\|_1 +
\eta\bm{w}^T\bm{M}\bm{w}$, which can reduce to different penalties, including
Lasso, elastic net, and network-regularized terms with different $\bm{M}$. This
framework can be easily solved in a unified manner by a cyclic coordinate
descent algorithm which can avoid inverse matrix operation and accelerate the
computing speed. However, if those estimated $\bm{w}_i$ and $\bm{w}_j$ have
opposite signs, then the traditional network-regularized penalty may not
perform well. To address it, we introduce a novel network-regularized sparse LR
model with a new penalty $\lambda \|\bm{w}\|_1 + \eta|\bm{w}|^T\bm{M}|\bm{w}|$
to consider the difference between the absolute values of the coefficients. And
we develop two efficient algorithms to solve it. Finally, we test our methods
and compare them with the related ones using simulated and real data to show
their efficiency.","['Wenwen Min', 'Juan Liu', 'Shihua Zhang']","['q-bio.GN', 'cs.LG', 'stat.ML', 'J.3; H.2.8; G.1.6; I.5']",2016-09-21 09:47:32+00:00
http://arxiv.org/abs/1609.06957v1,Early Warning System for Seismic Events in Coal Mines Using Machine Learning,"This document describes an approach to the problem of predicting dangerous
seismic events in active coal mines up to 8 hours in advance. It was developed
as a part of the AAIA'16 Data Mining Challenge: Predicting Dangerous Seismic
Events in Active Coal Mines. The solutions presented consist of ensembles of
various predictive models trained on different sets of features. The best one
achieved a winning score of 0.939 AUC.","['Robert Bogucki', 'Jan Lasek', 'Jan Kanty Milczek', 'Michal Tadeusiak']","['cs.LG', 'stat.ML']",2016-09-21 09:35:56+00:00
