id,title,abstract,authors,categories,date
http://arxiv.org/abs/1902.05401v2,Improving Deep Image Clustering With Spatial Transformer Layers,"Image clustering is an important but challenging task in machine learning. As
in most image processing areas, the latest improvements came from models based
on the deep learning approach. However, classical deep learning methods have
problems to deal with spatial image transformations like scale and rotation. In
this paper, we propose the use of visual attention techniques to reduce this
problem in image clustering methods. We evaluate the combination of a deep
image clustering model called Deep Adaptive Clustering (DAC) with the Spatial
Transformer Networks (STN). The proposed model is evaluated in the datasets
MNIST and FashionMNIST and outperformed the baseline model.","['Thiago V. M. Souza', 'Cleber Zanchettin']","['cs.CV', 'cs.LG', 'stat.ML']",2019-02-09 01:56:24+00:00
http://arxiv.org/abs/1902.03336v2,Nonlinear Discovery of Slow Molecular Modes using State-Free Reversible VAMPnets,"The success of enhanced sampling molecular simulations that accelerate along
collective variables (CVs) is predicated on the availability of variables
coincident with the slow collective motions governing the long-time
conformational dynamics of a system. It is challenging to intuit these slow CVs
for all but the simplest molecular systems, and their data-driven discovery
directly from molecular simulation trajectories has been a central focus of the
molecular simulation community to both unveil the important physical mechanisms
and to drive enhanced sampling. In this work, we introduce state-free
reversible VAMPnets (SRV) as a deep learning architecture that learns nonlinear
CV approximants to the leading slow eigenfunctions of the spectral
decomposition of the transfer operator that evolves equilibrium-scaled
probability distributions through time. Orthogonality of the learned CVs is
naturally imposed within network training without added regularization. The CVs
are inherently explicit and differentiable functions of the input coordinates
making them well-suited to use in enhanced sampling calculations. We
demonstrate the utility of SRVs in capturing parsimonious nonlinear
representations of complex system dynamics in applications to 1D and 2D toy
systems where the true eigenfunctions are exactly calculable and to molecular
dynamics simulations of alanine dipeptide and the WW domain protein.","['Wei Chen', 'Hythem Sidky', 'Andrew L Ferguson']","['stat.ML', 'cs.LG', 'physics.bio-ph']",2019-02-09 00:17:47+00:00
http://arxiv.org/abs/1902.03327v1,Censored Quantile Regression Forests,"Random forests are powerful non-parametric regression method but are severely
limited in their usage in the presence of randomly censored observations, and
naively applied can exhibit poor predictive performance due to the incurred
biases. Based on a local adaptive representation of random forests, we develop
its regression adjustment for randomly censored regression quantile models.
Regression adjustment is based on new estimating equations that adapt to
censoring and lead to quantile score whenever the data do not exhibit
censoring. The proposed procedure named censored quantile regression forest,
allows us to estimate quantiles of time-to-event without any parametric
modeling assumption. We establish its consistency under mild model
specifications. Numerical studies showcase a clear advantage of the proposed
procedure.","['Alexander Hanbo Li', 'Jelena Bradic']","['stat.ML', 'cs.LG', 'econ.EM', 'stat.ME']",2019-02-08 23:29:50+00:00
http://arxiv.org/abs/1902.03306v2,A simple and efficient architecture for trainable activation functions,"Learning automatically the best activation function for the task is an active
topic in neural network research. At the moment, despite promising results, it
is still difficult to determine a method for learning an activation function
that is at the same time theoretically simple and easy to implement. Moreover,
most of the methods proposed so far introduce new parameters or adopt different
learning techniques. In this work we propose a simple method to obtain trained
activation function which adds to the neural network local subnetworks with a
small amount of neurons. Experiments show that this approach could lead to
better result with respect to using a pre-defined activation function, without
introducing a large amount of extra parameters that need to be learned.","['Andrea Apicella', 'Francesco Isgrò', 'Roberto Prevete']","['cs.LG', 'cs.NE', 'stat.ML']",2019-02-08 22:13:54+00:00
http://arxiv.org/abs/1902.03283v1,Machine learning and chord based feature engineering for genre prediction in popular Brazilian music,"Music genre can be hard to describe: many factors are involved, such as
style, music technique, and historical context. Some genres even have
overlapping characteristics. Looking for a better understanding of how music
genres are related to musical harmonic structures, we gathered data about the
music chords for thousands of popular Brazilian songs. Here, 'popular' does not
only refer to the genre named MPB (Brazilian Popular Music) but to nine
different genres that were considered particular to the Brazilian case. The
main goals of the present work are to extract and engineer harmonically related
features from chords data and to use it to classify popular Brazilian music
genres towards establishing a connection between harmonic relationships and
Brazilian genres. We also emphasize the generalization of the method for
obtaining the data, allowing for the replication and direct extension of this
work. Our final model is a combination of multiple classification trees, also
known as the random forest model. We found that features extracted from
harmonic elements can satisfactorily predict music genre for the Brazilian
case, as well as features obtained from the Spotify API. The variables
considered in this work also give an intuition about how they relate to the
genres.","['Bruna D. Wundervald', 'Walmes M. Zeviani']","['cs.IR', 'cs.LG', 'cs.SD', 'eess.AS', 'stat.ML']",2019-02-08 20:38:18+00:00
http://arxiv.org/abs/1902.03272v2,Scalable Holistic Linear Regression,"We propose a new scalable algorithm for holistic linear regression building
on Bertsimas & King (2016). Specifically, we develop new theory to model
significance and multicollinearity as lazy constraints rather than checking the
conditions iteratively. The resulting algorithm scales with the number of
samples $n$ in the 10,000s, compared to the low 100s in the previous framework.
Computational results on real and synthetic datasets show it greatly improves
from previous algorithms in accuracy, false detection rate, computational time
and scalability.","['Dimitris Bertsimas', 'Michael Lingzhi Li']","['stat.ML', 'cs.LG', 'math.OC']",2019-02-08 20:01:47+00:00
http://arxiv.org/abs/1902.03266v2,Discovering Context Effects from Raw Choice Data,"Many applications in preference learning assume that decisions come from the
maximization of a stable utility function. Yet a large experimental literature
shows that individual choices and judgements can be affected by ""irrelevant""
aspects of the context in which they are made. An important class of such
contexts is the composition of the choice set. In this work, our goal is to
discover such choice set effects from raw choice data. We introduce an
extension of the Multinomial Logit (MNL) model, called the context dependent
random utility model (CDM), which allows for a particular class of choice set
effects. We show that the CDM can be thought of as a second-order approximation
to a general choice system, can be inferred optimally using maximum likelihood
and, importantly, is easily interpretable. We apply the CDM to both real and
simulated choice data to perform principled exploratory analyses for the
presence of choice set effects.","['Arjun Seshadri', 'Alexander Peysakhovich', 'Johan Ugander']","['cs.LG', 'cs.GT', 'stat.ML']",2019-02-08 19:37:00+00:00
http://arxiv.org/abs/1902.03264v3,FSNet: Compression of Deep Convolutional Neural Networks by Filter Summary,"We present a novel method of compression of deep Convolutional Neural
Networks (CNNs) by weight sharing through a new representation of convolutional
filters. The proposed method reduces the number of parameters of each
convolutional layer by learning a 1D vector termed Filter Summary (FS). The
convolutional filters are located in FS as overlapping 1D segments, and nearby
filters in FS share weights in their overlapping regions in a natural way. The
resultant neural network based on such weight sharing scheme, termed Filter
Summary CNNs or FSNet, has a FS in each convolution layer instead of a set of
independent filters in the conventional convolution layer. FSNet has the same
architecture as that of the baseline CNN to be compressed, and each convolution
layer of FSNet has the same number of filters from FS as that of the basline
CNN in the forward process. With compelling computational acceleration ratio,
the parameter space of FSNet is much smaller than that of the baseline CNN. In
addition, FSNet is quantization friendly. FSNet with weight quantization leads
to even higher compression ratio without noticeable performance loss. We
further propose Differentiable FSNet where the way filters share weights is
learned in a differentiable and end-to-end manner. Experiments demonstrate the
effectiveness of FSNet in compression of CNNs for computer vision tasks
including image classification and object detection, and the effectiveness of
DFSNet is evidenced by the task of Neural Architecture Search.","['Yingzhen Yang', 'Jiahui Yu', 'Nebojsa Jojic', 'Jun Huan', 'Thomas S. Huang']","['cs.LG', 'cs.AI', 'stat.ML']",2019-02-08 19:26:46+00:00
http://arxiv.org/abs/1902.03251v2,Invariant-equivariant representation learning for multi-class data,"Representations learnt through deep neural networks tend to be highly
informative, but opaque in terms of what information they learn to encode. We
introduce an approach to probabilistic modelling that learns to represent data
with two separate deep representations: an invariant representation that
encodes the information of the class from which the data belongs, and an
equivariant representation that encodes the symmetry transformation defining
the particular data point within the class manifold (equivariant in the sense
that the representation varies naturally with symmetry transformations). This
approach is based primarily on the strategic routing of data through the two
latent variables, and thus is conceptually transparent, easy to implement, and
in-principle generally applicable to any data comprised of discrete classes of
continuous distributions (e.g. objects in images, topics in language,
individuals in behavioural data). We demonstrate qualitatively compelling
representation learning and competitive quantitative performance, in both
supervised and semi-supervised settings, versus comparable modelling approaches
in the literature with little fine tuning.",['Ilya Feige'],"['stat.ML', 'cs.AI', 'cs.LG']",2019-02-08 19:01:13+00:00
http://arxiv.org/abs/1902.03249v1,Insertion Transformer: Flexible Sequence Generation via Insertion Operations,"We present the Insertion Transformer, an iterative, partially autoregressive
model for sequence generation based on insertion operations. Unlike typical
autoregressive models which rely on a fixed, often left-to-right ordering of
the output, our approach accommodates arbitrary orderings by allowing for
tokens to be inserted anywhere in the sequence during decoding. This
flexibility confers a number of advantages: for instance, not only can our
model be trained to follow specific orderings such as left-to-right generation
or a binary tree traversal, but it can also be trained to maximize entropy over
all valid insertions for robustness. In addition, our model seamlessly
accommodates both fully autoregressive generation (one insertion at a time) and
partially autoregressive generation (simultaneous insertions at multiple
locations). We validate our approach by analyzing its performance on the WMT
2014 English-German machine translation task under various settings for
training and decoding. We find that the Insertion Transformer outperforms many
prior non-autoregressive approaches to translation at comparable or better
levels of parallelism, and successfully recovers the performance of the
original Transformer while requiring only logarithmically many iterations
during decoding.","['Mitchell Stern', 'William Chan', 'Jamie Kiros', 'Jakob Uszkoreit']","['cs.CL', 'cs.LG', 'stat.ML']",2019-02-08 19:00:04+00:00
http://arxiv.org/abs/1902.03229v2,Adaptive and Safe Bayesian Optimization in High Dimensions via One-Dimensional Subspaces,"Bayesian optimization is known to be difficult to scale to high dimensions,
because the acquisition step requires solving a non-convex optimization problem
in the same search space. In order to scale the method and keep its benefits,
we propose an algorithm (LineBO) that restricts the problem to a sequence of
iteratively chosen one-dimensional sub-problems that can be solved efficiently.
We show that our algorithm converges globally and obtains a fast local rate
when the function is strongly convex. Further, if the objective has an
invariant subspace, our method automatically adapts to the effective dimension
without changing the algorithm. When combined with the SafeOpt algorithm to
solve the sub-problems, we obtain the first safe Bayesian optimization
algorithm with theoretical guarantees applicable in high-dimensional settings.
We evaluate our method on multiple synthetic benchmarks, where we obtain
competitive performance. Further, we deploy our algorithm to optimize the beam
intensity of the Swiss Free Electron Laser with up to 40 parameters while
satisfying safe operation constraints.","['Johannes Kirschner', 'Mojmír Mutný', 'Nicole Hiller', 'Rasmus Ischebeck', 'Andreas Krause']","['cs.LG', 'stat.ML']",2019-02-08 18:41:24+00:00
http://arxiv.org/abs/1902.03228v1,A Smoother Way to Train Structured Prediction Models,"We present a framework to train a structured prediction model by performing
smoothing on the inference algorithm it builds upon. Smoothing overcomes the
non-smoothness inherent to the maximum margin structured prediction objective,
and paves the way for the use of fast primal gradient-based optimization
algorithms. We illustrate the proposed framework by developing a novel primal
incremental optimization algorithm for the structural support vector machine.
The proposed algorithm blends an extrapolation scheme for acceleration and an
adaptive smoothing scheme and builds upon the stochastic variance-reduced
gradient algorithm. We establish its worst-case global complexity bound and
study several practical variants, including extensions to deep structured
prediction. We present experimental results on two real-world problems, namely
named entity recognition and visual object localization. The experimental
results show that the proposed framework allows us to build upon efficient
inference algorithms to develop large-scale optimization algorithms for
structured prediction which can achieve competitive performance on the two
real-world problems.","['Krishna Pillutla', 'Vincent Roulet', 'Sham M. Kakade', 'Zaid Harchaoui']","['stat.ML', 'cs.LG', 'math.OC']",2019-02-08 18:38:51+00:00
http://arxiv.org/abs/1902.03223v3,Robust Streaming PCA,"We consider streaming principal component analysis when the stochastic
data-generating model is subject to perturbations. While existing models assume
a fixed covariance, we adopt a robust perspective where the covariance matrix
belongs to a temporal uncertainty set. Under this setting, we provide
fundamental limits on convergence of any algorithm recovering principal
components. We analyze the convergence of the noisy power method and Oja's
algorithm, both studied for the stationary data generating model, and argue
that the noisy power method is rate-optimal in our setting. Finally, we
demonstrate the validity of our analysis through numerical experiments on
synthetic and real-world dataset.","['Daniel Bienstock', 'Minchan Jeong', 'Apurv Shukla', 'Se-Young Yun']","['stat.ML', 'cs.LG']",2019-02-08 18:31:38+00:00
http://arxiv.org/abs/1902.03210v2,Tensor Variable Elimination for Plated Factor Graphs,"A wide class of machine learning algorithms can be reduced to variable
elimination on factor graphs. While factor graphs provide a unifying notation
for these algorithms, they do not provide a compact way to express repeated
structure when compared to plate diagrams for directed graphical models. To
exploit efficient tensor algebra in graphs with plates of variables, we
generalize undirected factor graphs to plated factor graphs and variable
elimination to a tensor variable elimination algorithm that operates directly
on plated factor graphs. Moreover, we generalize complexity bounds based on
treewidth and characterize the class of plated factor graphs for which
inference is tractable. As an application, we integrate tensor variable
elimination into the Pyro probabilistic programming language to enable exact
inference in discrete latent variable models with repeated structure. We
validate our methods with experiments on both directed and undirected graphical
models, including applications to polyphonic music modeling, animal movement
modeling, and latent sentiment analysis.","['Fritz Obermeyer', 'Eli Bingham', 'Martin Jankowiak', 'Justin Chiu', 'Neeraj Pradhan', 'Alexander Rush', 'Noah Goodman']","['stat.ML', 'cs.LG']",2019-02-08 18:00:08+00:00
http://arxiv.org/abs/1902.03175v2,Scalable Nonparametric Sampling from Multimodal Posteriors with the Posterior Bootstrap,"Increasingly complex datasets pose a number of challenges for Bayesian
inference. Conventional posterior sampling based on Markov chain Monte Carlo
can be too computationally intensive, is serial in nature and mixes poorly
between posterior modes. Further, all models are misspecified, which brings
into question the validity of the conventional Bayesian update. We present a
scalable Bayesian nonparametric learning routine that enables posterior
sampling through the optimization of suitably randomized objective functions. A
Dirichlet process prior on the unknown data distribution accounts for model
misspecification, and admits an embarrassingly parallel posterior bootstrap
algorithm that generates independent and exact samples from the nonparametric
posterior distribution. Our method is particularly adept at sampling from
multimodal posterior distributions via a random restart mechanism. We
demonstrate our method on Gaussian mixture model and sparse logistic regression
examples.","['Edwin Fong', 'Simon Lyddon', 'Chris Holmes']","['stat.ML', 'cs.LG', 'stat.ME']",2019-02-08 16:37:25+00:00
http://arxiv.org/abs/1902.03151v2,Discretization based Solutions for Secure Machine Learning against Adversarial Attacks,"Adversarial examples are perturbed inputs that are designed (from a deep
learning network's (DLN) parameter gradients) to mislead the DLN during test
time. Intuitively, constraining the dimensionality of inputs or parameters of a
network reduces the 'space' in which adversarial examples exist. Guided by this
intuition, we demonstrate that discretization greatly improves the robustness
of DLNs against adversarial attacks. Specifically, discretizing the input space
(or allowed pixel levels from 256 values or 8-bit to 4 values or 2-bit)
extensively improves the adversarial robustness of DLNs for a substantial range
of perturbations for minimal loss in test accuracy. Furthermore, we find that
Binary Neural Networks (BNNs) and related variants are intrinsically more
robust than their full precision counterparts in adversarial scenarios.
Combining input discretization with BNNs furthers the robustness even waiving
the need for adversarial training for certain magnitude of perturbation values.
We evaluate the effect of discretization on MNIST, CIFAR10, CIFAR100 and
Imagenet datasets. Across all datasets, we observe maximal adversarial
resistance with 2-bit input discretization that incurs an adversarial accuracy
loss of just ~1-2% as compared to clean test accuracy.","['Priyadarshini Panda', 'Indranil Chakraborty', 'Kaushik Roy']","['cs.LG', 'cs.CR', 'cs.CV', 'stat.ML']",2019-02-08 15:38:24+00:00
http://arxiv.org/abs/1902.03149v1,Distributional reinforcement learning with linear function approximation,"Despite many algorithmic advances, our theoretical understanding of practical
distributional reinforcement learning methods remains limited. One exception is
Rowland et al. (2018)'s analysis of the C51 algorithm in terms of the Cram\'er
distance, but their results only apply to the tabular setting and ignore C51's
use of a softmax to produce normalized distributions. In this paper we adapt
the Cram\'er distance to deal with arbitrary vectors. From it we derive a new
distributional algorithm which is fully Cram\'er-based and can be combined to
linear function approximation, with formal guarantees in the context of policy
evaluation. In allowing the model's prediction to be any real vector, we lose
the probabilistic interpretation behind the method, but otherwise maintain the
appealing properties of distributional approaches. To the best of our
knowledge, ours is the first proof of convergence of a distributional algorithm
combined with function approximation. Perhaps surprisingly, our results provide
evidence that Cram\'er-based distributional methods may perform worse than
directly approximating the value function.","['Marc G. Bellemare', 'Nicolas Le Roux', 'Pablo Samuel Castro', 'Subhodeep Moitra']","['cs.LG', 'stat.ML']",2019-02-08 15:31:42+00:00
http://arxiv.org/abs/1902.03127v1,Bounded Fuzzy Possibilistic Method,"This paper introduces Bounded Fuzzy Possibilistic Method (BFPM) by addressing
several issues that previous clustering/classification methods have not
considered. In fuzzy clustering, object's membership values should sum to 1.
Hence, any object may obtain full membership in at most one cluster.
Possibilistic clustering methods remove this restriction. However, BFPM differs
from previous fuzzy and possibilistic clustering approaches by allowing the
membership function to take larger values with respect to all clusters.
Furthermore, in BFPM, a data object can have full membership in multiple
clusters or even in all clusters. BFPM relaxes the boundary conditions
(restrictions) in membership assignment. The proposed methodology satisfies the
necessity of obtaining full memberships and overcomes the issues with
conventional methods on dealing with overlapping. Analysing the objects'
movements from their own cluster to another (mutation) is also proposed in this
paper. BFPM has been applied in different domains in geometry, set theory,
anomaly detection, risk management, diagnosis diseases, and other disciplines.
Validity and comparison indexes have been also used to evaluate the accuracy of
BFPM. BFPM has been evaluated in terms of accuracy, fuzzification constant
(different norms), objects' movement analysis, and covering diversity. The
promising results prove the importance of considering the proposed methodology
in learning methods to track the behaviour of data objects, in addition to
obtain accurate results.",['Hossein Yazdani'],"['cs.LG', 'cs.AI', 'stat.ML']",2019-02-08 14:53:59+00:00
http://arxiv.org/abs/1902.03926v1,Speech enhancement with variational autoencoders and alpha-stable distributions,"This paper focuses on single-channel semi-supervised speech enhancement. We
learn a speaker-independent deep generative speech model using the framework of
variational autoencoders. The noise model remains unsupervised because we do
not assume prior knowledge of the noisy recording environment. In this context,
our contribution is to propose a noise model based on alpha-stable
distributions, instead of the more conventional Gaussian non-negative matrix
factorization approach found in previous studies. We develop a Monte Carlo
expectation-maximization algorithm for estimating the model parameters at test
time. Experimental results show the superiority of the proposed approach both
in terms of perceptual quality and intelligibility of the enhanced speech
signal.","['Simon Leglaive', 'Umut Simsekli', 'Antoine Liutkus', 'Laurent Girin', 'Radu Horaud']","['cs.SD', 'eess.AS', 'stat.ML']",2019-02-08 14:50:47+00:00
http://arxiv.org/abs/1902.02783v3,Humor in Word Embeddings: Cockamamie Gobbledegook for Nincompoops,"While humor is often thought to be beyond the reach of Natural Language
Processing, we show that several aspects of single-word humor correlate with
simple linear directions in Word Embeddings. In particular: (a) the word
vectors capture multiple aspects discussed in humor theories from various
disciplines; (b) each individual's sense of humor can be represented by a
vector, which can predict differences in people's senses of humor on new,
unrated, words; and (c) upon clustering humor ratings of multiple demographic
groups, different humor preferences emerge across the different groups. Humor
ratings are taken from the work of Engelthaler and Hills (2017) as well as from
an original crowdsourcing study of 120,000 words. Our dataset further includes
annotations for the theoretically-motivated humor features we identify.","['Limor Gultchin', 'Genevieve Patterson', 'Nancy Baym', 'Nathaniel Swinger', 'Adam Tauman Kalai']","['cs.CL', 'cs.LG', 'stat.ML']",2019-02-08 14:36:43+00:00
