id,title,abstract,authors,categories,date
http://arxiv.org/abs/1609.05524v3,Principled Option Learning in Markov Decision Processes,"It is well known that options can make planning more efficient, among their
many benefits. Thus far, algorithms for autonomously discovering a set of
useful options were heuristic. Naturally, a principled way of finding a set of
useful options may be more promising and insightful. In this paper we suggest a
mathematical characterization of good sets of options using tools from
information theory. This characterization enables us to find conditions for a
set of options to be optimal and an algorithm that outputs a useful set of
options and illustrate the proposed algorithm in simulation.","['Roy Fox', 'Michal Moshkovitz', 'Naftali Tishby']","['cs.LG', 'stat.ML']",2016-09-18 18:19:02+00:00
http://arxiv.org/abs/1609.05486v3,Probabilistic Feature Selection and Classification Vector Machine,"Sparse Bayesian learning is a state-of-the-art supervised learning algorithm
that can choose a subset of relevant samples from the input data and make
reliable probabilistic predictions. However, in the presence of
high-dimensional data with irrelevant features, traditional sparse Bayesian
classifiers suffer from performance degradation and low efficiency by failing
to eliminate irrelevant features. To tackle this problem, we propose a novel
sparse Bayesian embedded feature selection method that adopts truncated
Gaussian distributions as both sample and feature priors. The proposed method,
called probabilistic feature selection and classification vector machine
(PFCVMLP ), is able to simultaneously select relevant features and samples for
classification tasks. In order to derive the analytical solutions, Laplace
approximation is applied to compute approximate posteriors and marginal
likelihoods. Finally, parameters and hyperparameters are optimized by the
type-II maximum likelihood method. Experiments on three datasets validate the
performance of PFCVMLP along two dimensions: classification performance and
effectiveness for feature selection. Finally, we analyze the generalization
performance and derive a generalization error bound for PFCVMLP . By tightening
the bound, the importance of feature selection is demonstrated.","['Bingbing Jiang', 'Chang Li', 'Maarten de Rijke', 'Xin Yao', 'Huanhuan Chen']","['cs.LG', 'stat.ML']",2016-09-18 14:01:04+00:00
http://arxiv.org/abs/1609.05388v1,ADAGIO: Fast Data-aware Near-Isometric Linear Embeddings,"Many important applications, including signal reconstruction, parameter
estimation, and signal processing in a compressed domain, rely on a
low-dimensional representation of the dataset that preserves {\em all} pairwise
distances between the data points and leverages the inherent geometric
structure that is typically present. Recently Hedge, Sankaranarayanan, Yin and
Baraniuk \cite{hedge2015} proposed the first data-aware near-isometric linear
embedding which achieves the best of both worlds. However, their method NuMax
does not scale to large-scale datasets.
  Our main contribution is a simple, data-aware, near-isometric linear
dimensionality reduction method which significantly outperforms a
state-of-the-art method \cite{hedge2015} with respect to scalability while
achieving high quality near-isometries. Furthermore, our method comes with
strong worst-case theoretical guarantees that allow us to guarantee the quality
of the obtained near-isometry. We verify experimentally the efficiency of our
method on numerous real-world datasets, where we find that our method ($<$10
secs) is more than 3\,000$\times$ faster than the state-of-the-art method
\cite{hedge2015} ($>$9 hours) on medium scale datasets with 60\,000 data points
in 784 dimensions. Finally, we use our method as a preprocessing step to
increase the computational efficiency of a classification application and for
speeding up approximate nearest neighbor queries.","['Jarosław Błasiok', 'Charalampos E. Tsourakakis']","['stat.ML', 'cs.LG']",2016-09-17 21:01:19+00:00
http://arxiv.org/abs/1609.05342v1,Fast and Effective Algorithms for Symmetric Nonnegative Matrix Factorization,"Symmetric Nonnegative Matrix Factorization (SNMF) models arise naturally as
simple reformulations of many standard clustering algorithms including the
popular spectral clustering method. Recent work has demonstrated that an
elementary instance of SNMF provides superior clustering quality compared to
many classic clustering algorithms on a variety of synthetic and real world
data sets. In this work, we present novel reformulations of this instance of
SNMF based on the notion of variable splitting and produce two fast and
effective algorithms for its optimization using i) the provably convergent
Accelerated Proximal Gradient (APG) procedure and ii) a heuristic version of
the Alternating Direction Method of Multipliers (ADMM) framework. Our two
algorithms present an interesting tradeoff between computational speed and
mathematical convergence guarantee: while the former method is provably
convergent it is considerably slower than the latter approach, for which we
also provide significant but less stringent mathematical proof regarding its
convergence. Through extensive experiments we show not only that the efficacy
of these approaches is equal to that of the state of the art SNMF algorithm,
but also that the latter of our algorithms is extremely fast being one to two
orders of magnitude faster in terms of total computation time than the state of
the art approach, outperforming even spectral clustering in terms of
computation time on large data sets.","['Reza Borhani', 'Jeremy Watt', 'Aggelos Katsaggelos']","['cs.CV', 'cs.LG', 'stat.ML']",2016-09-17 14:41:32+00:00
http://arxiv.org/abs/1609.05191v2,Gradient Descent Learns Linear Dynamical Systems,"We prove that stochastic gradient descent efficiently converges to the global
optimizer of the maximum likelihood objective of an unknown linear
time-invariant dynamical system from a sequence of noisy observations generated
by the system. Even though the objective function is non-convex, we provide
polynomial running time and sample complexity bounds under strong but natural
assumptions. Linear systems identification has been studied for many decades,
yet, to the best of our knowledge, these are the first polynomial guarantees
for the problem we consider.","['Moritz Hardt', 'Tengyu Ma', 'Benjamin Recht']","['cs.LG', 'cs.DS', 'math.OC', 'stat.ML']",2016-09-16 19:42:34+00:00
http://arxiv.org/abs/1609.05158v2,Real-Time Single Image and Video Super-Resolution Using an Efficient Sub-Pixel Convolutional Neural Network,"Recently, several models based on deep neural networks have achieved great
success in terms of both reconstruction accuracy and computational performance
for single image super-resolution. In these methods, the low resolution (LR)
input image is upscaled to the high resolution (HR) space using a single
filter, commonly bicubic interpolation, before reconstruction. This means that
the super-resolution (SR) operation is performed in HR space. We demonstrate
that this is sub-optimal and adds computational complexity. In this paper, we
present the first convolutional neural network (CNN) capable of real-time SR of
1080p videos on a single K2 GPU. To achieve this, we propose a novel CNN
architecture where the feature maps are extracted in the LR space. In addition,
we introduce an efficient sub-pixel convolution layer which learns an array of
upscaling filters to upscale the final LR feature maps into the HR output. By
doing so, we effectively replace the handcrafted bicubic filter in the SR
pipeline with more complex upscaling filters specifically trained for each
feature map, whilst also reducing the computational complexity of the overall
SR operation. We evaluate the proposed approach using images and videos from
publicly available datasets and show that it performs significantly better
(+0.15dB on Images and +0.39dB on Videos) and is an order of magnitude faster
than previous CNN-based methods.","['Wenzhe Shi', 'Jose Caballero', 'Ferenc Huszár', 'Johannes Totz', 'Andrew P. Aitken', 'Rob Bishop', 'Daniel Rueckert', 'Zehan Wang']","['cs.CV', 'stat.ML']",2016-09-16 17:58:14+00:00
http://arxiv.org/abs/1609.05148v8,Discovering and Deciphering Relationships Across Disparate Data Modalities,"Understanding the relationships between different properties of data, such as
whether a connectome or genome has information about disease status, is
becoming increasingly important in modern biological datasets. While existing
approaches can test whether two properties are related, they often require
unfeasibly large sample sizes in real data scenarios, and do not provide any
insight into how or why the procedure reached its decision. Our approach,
""Multiscale Graph Correlation"" (MGC), is a dependence test that juxtaposes
previously disparate data science techniques, including k-nearest neighbors,
kernel methods (such as support vector machines), and multiscale analysis (such
as wavelets). Other methods typically require double or triple the number
samples to achieve the same statistical power as MGC in a benchmark suite
including high-dimensional and nonlinear relationships - spanning polynomial
(linear, quadratic, cubic), trigonometric (sinusoidal, circular, ellipsoidal,
spiral), geometric (square, diamond, W-shape), and other functions, with
dimensionality ranging from 1 to 1000. Moreover, MGC uniquely provides a simple
and elegant characterization of the potentially complex latent geometry
underlying the relationship, providing insight while maintaining computational
efficiency. In several real data applications, including brain imaging and
cancer genetics, MGC is the only method that can both detect the presence of a
dependency and provide specific guidance for the next experiment and/or
analysis to conduct.","['Joshua T. Vogelstein', 'Eric Bridgeford', 'Qing Wang', 'Carey E. Priebe', 'Mauro Maggioni', 'Cencheng Shen']",['stat.ML'],2016-09-16 17:29:01+00:00
http://arxiv.org/abs/1609.05057v2,Unbiased Sparse Subspace Clustering By Selective Pursuit,"Sparse subspace clustering (SSC) is an elegant approach for unsupervised
segmentation if the data points of each cluster are located in linear
subspaces. This model applies, for instance, in motion segmentation if some
restrictions on the camera model hold. SSC requires that problems based on the
$l_1$-norm are solved to infer which points belong to the same subspace. If
these unknown subspaces are well-separated this algorithm is guaranteed to
succeed. The algorithm rests upon the assumption that points on the same
subspace are well spread. The question what happens if this condition is
violated has not yet been investigated. In this work, the effect of particular
distributions on the same subspace will be analyzed. It will be shown that SSC
fails to infer correct labels if points on the same subspace fall into more
than one cluster.","['Hanno Ackermann', 'Michael Ying Yang', 'Bodo Rosenhahn']",['stat.ML'],2016-09-16 13:59:01+00:00
http://arxiv.org/abs/1609.04849v5,Predicting Shot Making in Basketball Learnt from Adversarial Multiagent Trajectories,"In this paper, we predict the likelihood of a player making a shot in
basketball from multiagent trajectories. Previous approaches to similar
problems center on hand-crafting features to capture domain specific knowledge.
Although intuitive, recent work in deep learning has shown this approach is
prone to missing important predictive features. To circumvent this issue, we
present a convolutional neural network (CNN) approach where we initially
represent the multiagent behavior as an image. To encode the adversarial nature
of basketball, we use a multi-channel image which we then feed into a CNN.
Additionally, to capture the temporal aspect of the trajectories we ""fade"" the
player trajectories. We find that this approach is superior to a traditional
FFN model. By using gradient ascent to create images using an already trained
CNN, we discover what features the CNN filters learn. Last, we find that a
combined CNN+FFN is the best performing network with an error rate of 39%.","['Mark Harmon', 'Abdolghani Ebrahimi', 'Patrick Lucey', 'Diego Klabjan']","['stat.ML', 'cs.LG']",2016-09-15 20:27:26+00:00
http://arxiv.org/abs/1609.04802v5,Photo-Realistic Single Image Super-Resolution Using a Generative Adversarial Network,"Despite the breakthroughs in accuracy and speed of single image
super-resolution using faster and deeper convolutional neural networks, one
central problem remains largely unsolved: how do we recover the finer texture
details when we super-resolve at large upscaling factors? The behavior of
optimization-based super-resolution methods is principally driven by the choice
of the objective function. Recent work has largely focused on minimizing the
mean squared reconstruction error. The resulting estimates have high peak
signal-to-noise ratios, but they are often lacking high-frequency details and
are perceptually unsatisfying in the sense that they fail to match the fidelity
expected at the higher resolution. In this paper, we present SRGAN, a
generative adversarial network (GAN) for image super-resolution (SR). To our
knowledge, it is the first framework capable of inferring photo-realistic
natural images for 4x upscaling factors. To achieve this, we propose a
perceptual loss function which consists of an adversarial loss and a content
loss. The adversarial loss pushes our solution to the natural image manifold
using a discriminator network that is trained to differentiate between the
super-resolved images and original photo-realistic images. In addition, we use
a content loss motivated by perceptual similarity instead of similarity in
pixel space. Our deep residual network is able to recover photo-realistic
textures from heavily downsampled images on public benchmarks. An extensive
mean-opinion-score (MOS) test shows hugely significant gains in perceptual
quality using SRGAN. The MOS scores obtained with SRGAN are closer to those of
the original high-resolution images than to those obtained with any
state-of-the-art method.","['Christian Ledig', 'Lucas Theis', 'Ferenc Huszar', 'Jose Caballero', 'Andrew Cunningham', 'Alejandro Acosta', 'Andrew Aitken', 'Alykhan Tejani', 'Johannes Totz', 'Zehan Wang', 'Wenzhe Shi']","['cs.CV', 'stat.ML']",2016-09-15 19:53:07+00:00
http://arxiv.org/abs/1609.04789v3,"Coherence Pursuit: Fast, Simple, and Robust Principal Component Analysis","This paper presents a remarkably simple, yet powerful, algorithm termed
Coherence Pursuit (CoP) to robust Principal Component Analysis (PCA). As
inliers lie in a low dimensional subspace and are mostly correlated, an inlier
is likely to have strong mutual coherence with a large number of data points.
By contrast, outliers either do not admit low dimensional structures or form
small clusters. In either case, an outlier is unlikely to bear strong
resemblance to a large number of data points. Given that, CoP sets an outlier
apart from an inlier by comparing their coherence with the rest of the data
points. The mutual coherences are computed by forming the Gram matrix of the
normalized data points. Subsequently, the sought subspace is recovered from the
span of the subset of the data points that exhibit strong coherence with the
rest of the data. As CoP only involves one simple matrix multiplication, it is
significantly faster than the state-of-the-art robust PCA algorithms. We derive
analytical performance guarantees for CoP under different models for the
distributions of inliers and outliers in both noise-free and noisy settings.
CoP is the first robust PCA algorithm that is simultaneously non-iterative,
provably robust to both unstructured and structured outliers, and can tolerate
a large number of unstructured outliers.","['Mostafa Rahmani', 'George Atia']","['cs.LG', 'stat.ML']",2016-09-15 19:25:55+00:00
http://arxiv.org/abs/1609.04721v1,Mixture model modal clustering,"The two most extended density-based approaches to clustering are surely
mixture model clustering and modal clustering. In the mixture model approach,
the density is represented as a mixture and clusters are associated to the
different mixture components. In modal clustering, clusters are understood as
regions of high density separated from each other by zones of lower density, so
that they are closely related to certain regions around the density modes. If
the true density is indeed in the assumed class of mixture densities, then
mixture model clustering allows to scrutinize more subtle situations than modal
clustering. However, when mixture modeling is used in a nonparametric way,
taking advantage of the denseness of the sieve of mixture densities to
approximate any density, then the correspondence between clusters and mixture
components may become questionable. In this paper we introduce two methods to
adopt a modal clustering point of view after a mixture model fit. Numerous
examples are provided to illustrate that mixture modeling can also be used for
clustering in a nonparametric sense, as long as clusters are understood as the
domains of attraction of the density modes.",['José E. Chacón'],"['stat.ML', 'stat.CO']",2016-09-15 16:24:43+00:00
http://arxiv.org/abs/1609.04699v1,Learning Schizophrenia Imaging Genetics Data Via Multiple Kernel Canonical Correlation Analysis,"Kernel and Multiple Kernel Canonical Correlation Analysis (CCA) are employed
to classify schizophrenic and healthy patients based on their SNPs, DNA
Methylation and fMRI data. Kernel and Multiple Kernel CCA are popular methods
for finding nonlinear correlations between high-dimensional datasets. Data was
gathered from 183 patients, 79 with schizophrenia and 104 healthy controls.
Kernel and Multiple Kernel CCA represent new avenues for studying
schizophrenia, because, to our knowledge, these methods have not been used on
these data before. Classification is performed via k-means clustering on the
kernel matrix outputs of the Kernel and Multiple Kernel CCA algorithm.
Accuracies of the Kernel and Multiple Kernel CCA classification are compared to
that of the regularized linear CCA algorithm classification, and are found to
be significantly more accurate. Both algorithms demonstrate maximal accuracies
when the combination of DNA methylation and fMRI data are used, and experience
lower accuracies when the SNP data are incorporated.","['Owen Richfield', 'Md. Ashad Alam', 'Vince Calhoun', 'Yu-Ping Wang']","['q-bio.QM', 'stat.ML']",2016-09-15 15:26:37+00:00
http://arxiv.org/abs/1609.04608v2,Recursive nearest agglomeration (ReNA): fast clustering for approximation of structured signals,"In this work, we revisit fast dimension reduction approaches, as with random
projections and random sampling. Our goal is to summarize the data to decrease
computational costs and memory footprint of subsequent analysis. Such dimension
reduction can be very efficient when the signals of interest have a strong
structure, such as with images. We focus on this setting and investigate
feature clustering schemes for data reductions that capture this structure. An
impediment to fast dimension reduction is that good clustering comes with large
algorithmic costs. We address it by contributing a linear-time agglomerative
clustering scheme, Recursive Nearest Agglomeration (ReNA). Unlike existing fast
agglomerative schemes, it avoids the creation of giant clusters. We empirically
validate that it approximates the data as well as traditional
variance-minimizing clustering schemes that have a quadratic complexity. In
addition, we analyze signal approximation with feature clustering and show that
it can remove noise, improving subsequent analysis steps. As a consequence,
data reduction by clustering features with ReNA yields very fast and accurate
models, enabling to process large datasets on budget. Our theoretical analysis
is backed by extensive experiments on publicly-available data that illustrate
the computation efficiency and the denoising properties of the resulting
dimension reduction scheme.","['Andrés Hoyos-Idrobo', 'Gaël Varoquaux', 'Jonas Kahn', 'Bertrand Thirion']","['stat.ML', 'cs.LG']",2016-09-15 12:46:52+00:00
http://arxiv.org/abs/1609.06144v1,Multilevel Monte Carlo for Scalable Bayesian Computations,"Markov chain Monte Carlo (MCMC) algorithms are ubiquitous in Bayesian
computations. However, they need to access the full data set in order to
evaluate the posterior density at every step of the algorithm. This results in
a great computational burden in big data applications. In contrast to MCMC
methods, Stochastic Gradient MCMC (SGMCMC) algorithms such as the Stochastic
Gradient Langevin Dynamics (SGLD) only require access to a batch of the data
set at every step. This drastically improves the computational performance and
scales well to large data sets. However, the difficulty with SGMCMC algorithms
comes from the sensitivity to its parameters which are notoriously difficult to
tune. Moreover, the Root Mean Square Error (RMSE) scales as
$\mathcal{O}(c^{-\frac{1}{3}})$ as opposed to standard MCMC
$\mathcal{O}(c^{-\frac{1}{2}})$ where $c$ is the computational cost.
  We introduce a new class of Multilevel Stochastic Gradient Markov chain Monte
Carlo algorithms that are able to mitigate the problem of tuning the step size
and more importantly of recovering the $\mathcal{O}(c^{-\frac{1}{2}})$
convergence of standard Markov Chain Monte Carlo methods without the need to
introduce Metropolis-Hasting steps. A further advantage of this new class of
algorithms is that it can easily be parallelised over a heterogeneous computer
architecture. We illustrate our methodology using Bayesian logistic regression
and provide numerical evidence that for a prescribed relative RMSE the
computational cost is sublinear in the number of data items.","['Mike Giles', 'Tigran Nagapetyan', 'Lukasz Szpruch', 'Sebastian Vollmer', 'Konstantinos Zygalakis']","['stat.ML', 'math.PR']",2016-09-15 10:36:36+00:00
http://arxiv.org/abs/1609.04541v1,Matrix Product State for Higher-Order Tensor Compression and Classification,"This paper introduces matrix product state (MPS) decomposition as a new and
systematic method to compress multidimensional data represented by higher-order
tensors. It solves two major bottlenecks in tensor compression: computation and
compression quality. Regardless of tensor order, MPS compresses tensors to
matrices of moderate dimension which can be used for classification. Mainly
based on a successive sequence of singular value decompositions (SVD), MPS is
quite simple to implement and arrives at the global optimal matrix, bypassing
local alternating optimization, which is not only computationally expensive but
cannot yield the global solution. Benchmark results show that MPS can achieve
better classification performance with favorable computation cost compared to
other tensor compression methods.","['Johann A. Bengua', 'Ho N. Phien', 'Hoang D. Tuan', 'Minh N. Do']","['stat.ML', 'cs.CV', 'cs.DS']",2016-09-15 09:04:25+00:00
http://arxiv.org/abs/1609.04523v3,STORE: Sparse Tensor Response Regression and Neuroimaging Analysis,"Motivated by applications in neuroimaging analysis, we propose a new
regression model, Sparse TensOr REsponse regression (STORE), with a tensor
response and a vector predictor. STORE embeds two key sparse structures:
element-wise sparsity and low-rankness. It can handle both a non-symmetric and
a symmetric tensor response, and thus is applicable to both structural and
functional neuroimaging data. We formulate the parameter estimation as a
non-convex optimization problem, and develop an efficient alternating updating
algorithm. We establish a non-asymptotic estimation error bound for the actual
estimator obtained from the proposed algorithm. This error bound reveals an
interesting interaction between the computational efficiency and the
statistical rate of convergence. When the distribution of the error tensor is
Gaussian, we further obtain a fast estimation error rate which allows the
tensor dimension to grow exponentially with the sample size. We illustrate the
efficacy of our model through intensive simulations and an analysis of the
Autism spectrum disorder neuroimaging data.","['Will Wei Sun', 'Lexin Li']","['stat.ML', 'stat.AP', 'stat.ME']",2016-09-15 06:51:51+00:00
