id,title,abstract,authors,categories,date
http://arxiv.org/abs/1609.03544v1,Online Data Thinning via Multi-Subspace Tracking,"In an era of ubiquitous large-scale streaming data, the availability of data
far exceeds the capacity of expert human analysts. In many settings, such data
is either discarded or stored unprocessed in datacenters. This paper proposes a
method of online data thinning, in which large-scale streaming datasets are
winnowed to preserve unique, anomalous, or salient elements for timely expert
analysis. At the heart of this proposed approach is an online anomaly detection
method based on dynamic, low-rank Gaussian mixture models. Specifically, the
high-dimensional covariances matrices associated with the Gaussian components
are associated with low-rank models. According to this model, most observations
lie near a union of subspaces. The low-rank modeling mitigates the curse of
dimensionality associated with anomaly detection for high-dimensional data, and
recent advances in subspace clustering and subspace tracking allow the proposed
method to adapt to dynamic environments. Furthermore, the proposed method
allows subsampling, is robust to missing data, and uses a mini-batch online
optimization approach. The resulting algorithms are scalable, efficient, and
are capable of operating in real time. Experiments on wide-area motion imagery
and e-mail databases illustrate the efficacy of the proposed approach.","['Xin Jiang', 'Rebecca Willett']","['stat.ML', 'cs.LG']",2016-09-12 19:34:02+00:00
http://arxiv.org/abs/1609.03541v1,"Comment on ""Why does deep and cheap learning work so well?"" [arXiv:1608.08225]","In a recent paper, ""Why does deep and cheap learning work so well?"", Lin and
Tegmark claim to show that the mapping between deep belief networks and the
variational renormalization group derived in [arXiv:1410.3831] is invalid, and
present a ""counterexample"" that claims to show that this mapping does not hold.
In this comment, we show that these claims are incorrect and stem from a
misunderstanding of the variational RG procedure proposed by Kadanoff. We also
explain why the ""counterexample"" of Lin and Tegmark is compatible with the
mapping proposed in [arXiv:1410.3831].","['David J. Schwab', 'Pankaj Mehta']","['cond-mat.dis-nn', 'cs.LG', 'stat.ML']",2016-09-12 19:25:27+00:00
http://arxiv.org/abs/1609.03519v1,Optimal Encoding and Decoding for Point Process Observations: an Approximate Closed-Form Filter,"The process of dynamic state estimation (filtering) based on point process
observations is in general intractable. Numerical sampling techniques are often
practically useful, but lead to limited conceptual insight about optimal
encoding/decoding strategies, which are of significant relevance to
Computational Neuroscience. We develop an analytically tractable Bayesian
approximation to optimal filtering based on point process observations, which
allows us to introduce distributional assumptions about sensor properties, that
greatly facilitate the analysis of optimal encoding in situations deviating
from common assumptions of uniform coding. Numerical comparison with particle
filtering demonstrate the quality of the approximation. The analytic framework
leads to insights which are difficult to obtain from numerical algorithms, and
is consistent with biological observations about the distribution of sensory
cells' tuning curve centers.","['Yuval Harel', 'Ron Meir', 'Manfred Opper']","['stat.ML', 'q-bio.NC']",2016-09-12 18:33:50+00:00
http://arxiv.org/abs/1610.08495v1,Adaptive matching pursuit for sparse signal recovery,"Spike and Slab priors have been of much recent interest in signal processing
as a means of inducing sparsity in Bayesian inference. Applications domains
that benefit from the use of these priors include sparse recovery, regression
and classification. It is well-known that solving for the sparse coefficient
vector to maximize these priors results in a hard non-convex and mixed integer
programming problem. Most existing solutions to this optimization problem
either involve simplifying assumptions/relaxations or are computationally
expensive. We propose a new greedy and adaptive matching pursuit (AMP)
algorithm to directly solve this hard problem. Essentially, in each step of the
algorithm, the set of active elements would be updated by either adding or
removing one index, whichever results in better improvement. In addition, the
intermediate steps of the algorithm are calculated via an inexpensive Cholesky
decomposition which makes the algorithm much faster. Results on simulated data
sets as well as real-world image recovery challenges confirm the benefits of
the proposed AMP, particularly in providing a superior cost-quality trade-off
over existing alternatives.","['Tiep H. Vu', 'Hojjat S. Mousavi', 'Vishal Monga']","['cs.LG', 'stat.ML']",2016-09-12 17:48:38+00:00
http://arxiv.org/abs/1609.03344v2,Finite-sample and asymptotic analysis of generalization ability with an application to penalized regression,"In this paper, we study the performance of extremum estimators from the
perspective of generalization ability (GA): the ability of a model to predict
outcomes in new samples from the same population. By adapting the classical
concentration inequalities, we derive upper bounds on the empirical
out-of-sample prediction errors as a function of the in-sample errors,
in-sample data size, heaviness in the tails of the error distribution, and
model complexity. We show that the error bounds may be used for tuning key
estimation hyper-parameters, such as the number of folds $K$ in
cross-validation. We also show how $K$ affects the bias-variance trade-off for
cross-validation. We demonstrate that the $\mathcal{L}_2$-norm difference
between penalized and the corresponding un-penalized regression estimates is
directly explained by the GA of the estimates and the GA of empirical moment
conditions. Lastly, we prove that all penalized regression estimates are
$L_2$-consistent for both the $n \geqslant p$ and the $n < p$ cases.
Simulations are used to demonstrate key results.
  Keywords: generalization ability, upper bound of generalization error,
penalized regression, cross-validation, bias-variance trade-off,
$\mathcal{L}_2$ difference between penalized and unpenalized regression, lasso,
high-dimensional data.","['Ning Xu', 'Jian Hong', 'Timothy C. G. Fisher']","['stat.ML', 'cs.LG', 'math.ST', 'q-fin.EC', 'stat.CO', 'stat.TH']",2016-09-12 11:09:50+00:00
http://arxiv.org/abs/1609.03333v1,On Generation of Time-based Label Refinements,"Process mining is a research field focused on the analysis of event data with
the aim of extracting insights in processes. Applying process mining techniques
on data from smart home environments has the potential to provide valuable
insights in (un)healthy habits and to contribute to ambient assisted living
solutions. Finding the right event labels to enable application of process
mining techniques is however far from trivial, as simply using the triggering
sensor as the label for sensor events results in uninformative models that
allow for too much behavior (overgeneralizing). Refinements of sensor level
event labels suggested by domain experts have shown to enable discovery of more
precise and insightful process models. However, there exist no automated
approach to generate refinements of event labels in the context of process
mining. In this paper we propose a framework for automated generation of label
refinements based on the time attribute of events. We show on a case study with
real life smart home event data that behaviorally more specific, and therefore
more insightful, process models can be found by using automatically generated
refined labels in process discovery.","['Niek Tax', 'Emin Alasgarov', 'Natalia Sidorova', 'Reinder Haakma']","['stat.ME', 'cs.AI', 'stat.ML']",2016-09-12 10:25:29+00:00
http://arxiv.org/abs/1609.03319v2,"CompAdaGrad: A Compressed, Complementary, Computationally-Efficient Adaptive Gradient Method","The adaptive gradient online learning method known as AdaGrad has seen
widespread use in the machine learning community in stochastic and adversarial
online learning problems and more recently in deep learning methods. The
method's full-matrix incarnation offers much better theoretical guarantees and
potentially better empirical performance than its diagonal version; however,
this version is computationally prohibitive and so the simpler diagonal version
often is used in practice. We introduce a new method, CompAdaGrad, that
navigates the space between these two schemes and show that this method can
yield results much better than diagonal AdaGrad while avoiding the (effectively
intractable) $O(n^3)$ computational complexity of full-matrix AdaGrad for
dimension $n$. CompAdaGrad essentially performs full-matrix regularization in a
low-dimensional subspace while performing diagonal regularization in the
complementary subspace. We derive CompAdaGrad's updates for composite mirror
descent in case of the squared $\ell_2$ norm and the $\ell_1$ norm, demonstrate
that its complexity per iteration is linear in the dimension, and establish
guarantees for the method independent of the choice of composite regularizer.
Finally, we show preliminary results on several datasets.","['Nishant A. Mehta', 'Alistair Rendell', 'Anish Varghese', 'Christfried Webers']","['cs.LG', 'stat.ML']",2016-09-12 09:06:44+00:00
http://arxiv.org/abs/1609.03261v3,Less than a Single Pass: Stochastically Controlled Stochastic Gradient Method,"We develop and analyze a procedure for gradient-based optimization that we
refer to as stochastically controlled stochastic gradient (SCSG). As a member
of the SVRG family of algorithms, SCSG makes use of gradient estimates at two
scales, with the number of updates at the faster scale being governed by a
geometric random variable. Unlike most existing algorithms in this family, both
the computation cost and the communication cost of SCSG do not necessarily
scale linearly with the sample size $n$; indeed, these costs are independent of
$n$ when the target accuracy is low. An experimental evaluation on real
datasets confirms the effectiveness of SCSG.","['Lihua Lei', 'Michael I. Jordan']","['math.OC', 'cs.DS', 'cs.LG', 'stat.ML']",2016-09-12 03:35:29+00:00
http://arxiv.org/abs/1609.03240v2,Non-square matrix sensing without spurious local minima via the Burer-Monteiro approach,"We consider the non-square matrix sensing problem, under restricted isometry
property (RIP) assumptions. We focus on the non-convex formulation, where any
rank-$r$ matrix $X \in \mathbb{R}^{m \times n}$ is represented as $UV^\top$,
where $U \in \mathbb{R}^{m \times r}$ and $V \in \mathbb{R}^{n \times r}$. In
this paper, we complement recent findings on the non-convex geometry of the
analogous PSD setting [5], and show that matrix factorization does not
introduce any spurious local minima, under RIP.","['Dohyung Park', 'Anastasios Kyrillidis', 'Constantine Caramanis', 'Sujay Sanghavi']","['stat.ML', 'cs.IT', 'cs.LG', 'math.IT', 'math.NA', 'math.OC']",2016-09-12 01:20:45+00:00
http://arxiv.org/abs/1609.03228v2,Supervised multiway factorization,"We describe a probabilistic PARAFAC/CANDECOMP (CP) factorization for multiway
(i.e., tensor) data that incorporates auxiliary covariates, SupCP. SupCP
generalizes the supervised singular value decomposition (SupSVD) for
vector-valued observations, to allow for observations that have the form of a
matrix or higher-order array. Such data are increasingly encountered in
biomedical research and other fields. We describe a likelihood-based latent
variable representation of the CP factorization, in which the latent variables
are informed by additional covariates. We give conditions for identifiability,
and develop an EM algorithm for simultaneous estimation of all model
parameters. SupCP can be used for dimension reduction, capturing latent
structures that are more accurate and interpretable due to covariate
supervision. Moreover, SupCP specifies a full probability distribution for a
multiway data observation with given covariate values, which can be used for
predictive modeling. We conduct comprehensive simulations to evaluate the SupCP
algorithm. We apply it to a facial image database with facial descriptors
(e.g., smiling / not smiling) as covariates, and to a study of amino acid
fluorescence. Software is available at https://github.com/lockEF/SupCP .","['Eric F. Lock', 'Gen Li']","['stat.ME', 'stat.ML']",2016-09-11 23:12:54+00:00
http://arxiv.org/abs/1609.03219v3,Sharing Hash Codes for Multiple Purposes,"Locality sensitive hashing (LSH) is a powerful tool for sublinear-time
approximate nearest neighbor search, and a variety of hashing schemes have been
proposed for different dissimilarity measures. However, hash codes
significantly depend on the dissimilarity, which prohibits users from adjusting
the dissimilarity at query time. In this paper, we propose {multiple purpose
LSH (mp-LSH) which shares the hash codes for different dissimilarities. mp-LSH
supports L2, cosine, and inner product dissimilarities, and their corresponding
weighted sums, where the weights can be adjusted at query time. It also allows
us to modify the importance of pre-defined groups of features. Thus, mp-LSH
enables us, for example, to retrieve similar items to a query with the user
preference taken into account, to find a similar material to a query with some
properties (stability, utility, etc.) optimized, and to turn on or off a part
of multi-modal information (brightness, color, audio, text, etc.) in
image/video retrieval. We theoretically and empirically analyze the performance
of three variants of mp-LSH, and demonstrate their usefulness on real-world
data sets.","['Wikor Pronobis', 'Danny Panknin', 'Johannes Kirschnick', 'Vignesh Srinivasan', 'Wojciech Samek', 'Volker Markl', 'Manohar Kaul', 'Klaus-Robert Mueller', 'Shinichi Nakajima']","['stat.ML', 'cs.LG']",2016-09-11 21:55:07+00:00
http://arxiv.org/abs/1609.03164v1,On the Relationship between Online Gaussian Process Regression and Kernel Least Mean Squares Algorithms,"We study the relationship between online Gaussian process (GP) regression and
kernel least mean squares (KLMS) algorithms. While the latter have no capacity
of storing the entire posterior distribution during online learning, we
discover that their operation corresponds to the assumption of a fixed
posterior covariance that follows a simple parametric model. Interestingly,
several well-known KLMS algorithms correspond to specific cases of this model.
The probabilistic perspective allows us to understand how each of them handles
uncertainty, which could explain some of their performance differences.","['Steven Van Vaerenbergh', 'Jesus Fernandez-Bes', 'Víctor Elvira']","['stat.ML', 'cs.IT', 'cs.LG', 'math.IT']",2016-09-11 14:17:33+00:00
http://arxiv.org/abs/1609.03126v4,Energy-based Generative Adversarial Network,"We introduce the ""Energy-based Generative Adversarial Network"" model (EBGAN)
which views the discriminator as an energy function that attributes low
energies to the regions near the data manifold and higher energies to other
regions. Similar to the probabilistic GANs, a generator is seen as being
trained to produce contrastive samples with minimal energies, while the
discriminator is trained to assign high energies to these generated samples.
Viewing the discriminator as an energy function allows to use a wide variety of
architectures and loss functionals in addition to the usual binary classifier
with logistic output. Among them, we show one instantiation of EBGAN framework
as using an auto-encoder architecture, with the energy being the reconstruction
error, in place of the discriminator. We show that this form of EBGAN exhibits
more stable behavior than regular GANs during training. We also show that a
single-scale architecture can be trained to generate high-resolution images.","['Junbo Zhao', 'Michael Mathieu', 'Yann LeCun']","['cs.LG', 'stat.ML']",2016-09-11 07:11:13+00:00
http://arxiv.org/abs/1609.02997v2,Iteratively Reweighted Least Squares Algorithms for L1-Norm Principal Component Analysis,"Principal component analysis (PCA) is often used to reduce the dimension of
data by selecting a few orthonormal vectors that explain most of the variance
structure of the data. L1 PCA uses the L1 norm to measure error, whereas the
conventional PCA uses the L2 norm. For the L1 PCA problem minimizing the
fitting error of the reconstructed data, we propose an exact reweighted and an
approximate algorithm based on iteratively reweighted least squares. We provide
convergence analyses, and compare their performance against benchmark
algorithms in the literature. The computational experiment shows that the
proposed algorithms consistently perform best.","['Young Woong Park', 'Diego Klabjan']","['stat.ML', 'cs.LG']",2016-09-10 04:06:07+00:00
http://arxiv.org/abs/1609.02943v2,Stealing Machine Learning Models via Prediction APIs,"Machine learning (ML) models may be deemed confidential due to their
sensitive training data, commercial value, or use in security applications.
Increasingly often, confidential ML models are being deployed with publicly
accessible query interfaces. ML-as-a-service (""predictive analytics"") systems
are an example: Some allow users to train models on potentially sensitive data
and charge others for access on a pay-per-query basis.
  The tension between model confidentiality and public access motivates our
investigation of model extraction attacks. In such attacks, an adversary with
black-box access, but no prior knowledge of an ML model's parameters or
training data, aims to duplicate the functionality of (i.e., ""steal"") the
model. Unlike in classical learning theory settings, ML-as-a-service offerings
may accept partial feature vectors as inputs and include confidence values with
predictions. Given these practices, we show simple, efficient attacks that
extract target ML models with near-perfect fidelity for popular model classes
including logistic regression, neural networks, and decision trees. We
demonstrate these attacks against the online services of BigML and Amazon
Machine Learning. We further show that the natural countermeasure of omitting
confidence values from model outputs still admits potentially harmful model
extraction attacks. Our results highlight the need for careful ML model
deployment and new model extraction countermeasures.","['Florian Tramèr', 'Fan Zhang', 'Ari Juels', 'Michael K. Reiter', 'Thomas Ristenpart']","['cs.CR', 'cs.LG', 'stat.ML']",2016-09-09 20:39:20+00:00
http://arxiv.org/abs/1609.02938v1,Extract fetal ECG from single-lead abdominal ECG by de-shape short time Fourier transform and nonlocal median,"The multiple fundamental frequency detection problem and the source
separation problem from a single-channel signal containing multiple oscillatory
components and a nonstationary noise are both challenging tasks. To extract the
fetal electrocardiogram (ECG) from a single-lead maternal abdominal ECG, we
face both challenges. In this paper, we propose a novel method to extract the
fetal ECG signal from the single channel maternal abdominal ECG signal, without
any additional measurement. The algorithm is composed of three main
ingredients. First, the maternal and fetal heart rates are estimated by the
de-shape short time Fourier transform, which is a recently proposed nonlinear
time-frequency analysis technique; second, the beat tracking technique is
applied to accurately obtain the maternal and fetal R peaks; third, the
maternal and fetal ECG waveforms are established by the nonlocal median. The
algorithm is evaluated on a simulated fetal ECG signal database ({\em fecgsyn}
database), and tested on two real databases with the annotation provided by
experts ({\em adfecgdb} database and {\em CinC2013} database). In general, the
algorithm could be applied to solve other detection and source separation
problems, and reconstruct the time-varying wave-shape function of each
oscillatory component.","['Su Li', 'Hau-tieng Wu']","['q-bio.QM', 'physics.data-an', 'stat.AP', 'stat.ME', 'stat.ML']",2016-09-09 20:26:31+00:00
http://arxiv.org/abs/1609.02907v4,Semi-Supervised Classification with Graph Convolutional Networks,"We present a scalable approach for semi-supervised learning on
graph-structured data that is based on an efficient variant of convolutional
neural networks which operate directly on graphs. We motivate the choice of our
convolutional architecture via a localized first-order approximation of
spectral graph convolutions. Our model scales linearly in the number of graph
edges and learns hidden layer representations that encode both local graph
structure and features of nodes. In a number of experiments on citation
networks and on a knowledge graph dataset we demonstrate that our approach
outperforms related methods by a significant margin.","['Thomas N. Kipf', 'Max Welling']","['cs.LG', 'stat.ML']",2016-09-09 19:48:41+00:00
http://arxiv.org/abs/1609.02906v1,Robust Spectral Detection of Global Structures in the Data by Learning a Regularization,"Spectral methods are popular in detecting global structures in the given data
that can be represented as a matrix. However when the data matrix is sparse or
noisy, classic spectral methods usually fail to work, due to localization of
eigenvectors (or singular vectors) induced by the sparsity or noise. In this
work, we propose a general method to solve the localization problem by learning
a regularization matrix from the localized eigenvectors. Using matrix
perturbation analysis, we demonstrate that the learned regularizations suppress
down the eigenvalues associated with localized eigenvectors and enable us to
recover the informative eigenvectors representing the global structure. We show
applications of our method in several inference problems: community detection
in networks, clustering from pairwise similarities, rank estimation and matrix
completion problems. Using extensive experiments, we illustrate that our method
solves the localization problem and works down to the theoretical detectability
limits in different kinds of synthetic data. This is in contrast with existing
spectral algorithms based on data matrix, non-backtracking matrix, Laplacians
and those with rank-one regularizations, which perform poorly in the sparse
case with noise.",['Pan Zhang'],"['stat.ML', 'cs.LG', 'cs.SI', 'physics.soc-ph']",2016-09-09 19:48:29+00:00
http://arxiv.org/abs/1609.02845v1,Distributed Online Optimization in Dynamic Environments Using Mirror Descent,"This work addresses decentralized online optimization in non-stationary
environments. A network of agents aim to track the minimizer of a global
time-varying convex function. The minimizer evolves according to a known
dynamics corrupted by an unknown, unstructured noise. At each time, the global
function can be cast as a sum of a finite number of local functions, each of
which is assigned to one agent in the network. Moreover, the local functions
become available to agents sequentially, and agents do not have a prior
knowledge of the future cost functions. Therefore, agents must communicate with
each other to build an online approximation of the global function. We propose
a decentralized variation of the celebrated Mirror Descent, developed by
Nemirovksi and Yudin. Using the notion of Bregman divergence in lieu of
Euclidean distance for projection, Mirror Descent has been shown to be a
powerful tool in large-scale optimization. Our algorithm builds on Mirror
Descent, while ensuring that agents perform a consensus step to follow the
global function and take into account the dynamics of the global minimizer. To
measure the performance of the proposed online algorithm, we compare it to its
offline counterpart, where the global functions are available a priori. The gap
between the two is called dynamic regret. We establish a regret bound that
scales inversely in the spectral gap of the network, and more notably it
represents the deviation of minimizer sequence with respect to the given
dynamics. We then show that our results subsume a number of results in
distributed optimization. We demonstrate the application of our method to
decentralized tracking of dynamic parameters and verify the results via
numerical experiments.","['Shahin Shahrampour', 'Ali Jadbabaie']","['math.OC', 'cs.DC', 'cs.LG', 'stat.ML']",2016-09-09 16:00:04+00:00
http://arxiv.org/abs/1609.02815v3,By-passing the Kohn-Sham equations with machine learning,"Last year, at least 30,000 scientific papers used the Kohn-Sham scheme of
density functional theory to solve electronic structure problems in a wide
variety of scientific fields, ranging from materials science to biochemistry to
astrophysics. Machine learning holds the promise of learning the kinetic energy
functional via examples, by-passing the need to solve the Kohn-Sham equations.
This should yield substantial savings in computer time, allowing either larger
systems or longer time-scales to be tackled, but attempts to machine-learn this
functional have been limited by the need to find its derivative. The present
work overcomes this difficulty by directly learning the density-potential and
energy-density maps for test systems and various molecules. Both improved
accuracy and lower computational cost with this method are demonstrated by
reproducing DFT energies for a range of molecular geometries generated during
molecular dynamics simulations. Moreover, the methodology could be applied
directly to quantum chemical calculations, allowing construction of density
functionals of quantum-chemical accuracy.","['Felix Brockherde', 'Leslie Vogt', 'Li Li', 'Mark E. Tuckerman', 'Kieron Burke', 'Klaus-Robert Müller']","['physics.comp-ph', 'cs.LG', 'physics.chem-ph', 'stat.ML']",2016-09-09 14:45:48+00:00
