id,title,abstract,authors,categories,date
http://arxiv.org/abs/1902.03517v2,Biadversarial Variational Autoencoder,"In the original version of the Variational Autoencoder, Kingma et al. assume
Gaussian distributions for the approximate posterior during the inference and
for the output during the generative process. This assumptions are good for
computational reasons, e.g. we can easily optimize the parameters of a neural
network using the reparametrization trick and the KL divergence between two
Gaussians can be computed in closed form. However it results in blurry images
due to its difficulty to represent multimodal distributions. We show that using
two adversarial networks, we can optimize the parameters without any Gaussian
assumptions.",['Arnaud Fickinger'],"['cs.LG', 'stat.ML']",2019-02-09 23:57:06+00:00
http://arxiv.org/abs/1902.03515v1,Multi-Domain Translation by Learning Uncoupled Autoencoders,"Multi-domain translation seeks to learn a probabilistic coupling between
marginal distributions that reflects the correspondence between different
domains. We assume that data from different domains are generated from a shared
latent representation based on a structural equation model. Under this
assumption, we show that the problem of computing a probabilistic coupling
between marginals is equivalent to learning multiple uncoupled autoencoders
that embed to a given shared latent distribution. In addition, we propose a new
framework and algorithm for multi-domain translation based on learning the
shared latent distribution and training autoencoders under distributional
constraints. A key practical advantage of our framework is that new
autoencoders (i.e., new domains) can be added sequentially to the model without
retraining on the other domains, which we demonstrate experimentally on image
as well as genomics datasets.","['Karren D. Yang', 'Caroline Uhler']","['cs.LG', 'stat.ML', '68T01']",2019-02-09 23:46:22+00:00
http://arxiv.org/abs/1902.03511v4,Nonparametric Density Estimation & Convergence Rates for GANs under Besov IPM Losses,"We study the problem of estimating a nonparametric probability density under
a large family of losses called Besov IPMs, which include, for example,
$\mathcal{L}^p$ distances, total variation distance, and generalizations of
both Wasserstein and Kolmogorov-Smirnov distances. For a wide variety of
settings, we provide both lower and upper bounds, identifying precisely how the
choice of loss function and assumptions on the data interact to determine the
minimax optimal convergence rate. We also show that linear distribution
estimates, such as the empirical distribution or kernel density estimator,
often fail to converge at the optimal rate. Our bounds generalize, unify, or
improve several recent and classical results. Moreover, IPMs can be used to
formalize a statistical model of generative adversarial networks (GANs). Thus,
we show how our results imply bounds on the statistical error of a GAN,
showing, for example, that GANs can strictly outperform the best linear
estimator.","['Ananya Uppal', 'Shashank Singh', 'Barnabás Póczos']","['math.ST', 'cs.IT', 'cs.LG', 'math.IT', 'stat.ML', 'stat.TH']",2019-02-09 23:24:43+00:00
http://arxiv.org/abs/1902.03510v2,Inverse Projection Representation and Category Contribution Rate for Robust Tumor Recognition,"Sparse representation based classification (SRC) methods have achieved
remarkable results. SRC, however, still suffer from requiring enough training
samples, insufficient use of test samples and instability of representation. In
this paper, a stable inverse projection representation based classification
(IPRC) is presented to tackle these problems by effectively using test samples.
An IPR is firstly proposed and its feasibility and stability are analyzed. A
classification criterion named category contribution rate is constructed to
match the IPR and complete classification. Moreover, a statistical measure is
introduced to quantify the stability of representation-based classification
methods. Based on the IPRC technique, a robust tumor recognition framework is
presented by interpreting microarray gene expression data, where a two-stage
hybrid gene selection method is introduced to select informative genes.
Finally, the functional analysis of candidate's pathogenicity-related genes is
given. Extensive experiments on six public tumor microarray gene expression
datasets demonstrate the proposed technique is competitive with
state-of-the-art methods.","['Xiao-Hui Yang', 'Li Tian', 'Yun-Mei Chen', 'Li-Jun Yang', 'Shuang Xu', 'Wen-Ming Wu']","['q-bio.QM', 'cs.CV', 'cs.LG', 'stat.ML']",2019-02-09 23:07:22+00:00
http://arxiv.org/abs/1902.03501v2,Assessing the Local Interpretability of Machine Learning Models,"The increasing adoption of machine learning tools has led to calls for
accountability via model interpretability. But what does it mean for a machine
learning model to be interpretable by humans, and how can this be assessed? We
focus on two definitions of interpretability that have been introduced in the
machine learning literature: simulatability (a user's ability to run a model on
a given input) and ""what if"" local explainability (a user's ability to
correctly determine a model's prediction under local changes to the input,
given knowledge of the model's original prediction). Through a user study with
1,000 participants, we test whether humans perform well on tasks that mimic the
definitions of simulatability and ""what if"" local explainability on models that
are typically considered locally interpretable. To track the relative
interpretability of models, we employ a simple metric, the runtime operation
count on the simulatability task. We find evidence that as the number of
operations increases, participant accuracy on the local interpretability tasks
decreases. In addition, this evidence is consistent with the common intuition
that decision trees and logistic regression models are interpretable and are
more interpretable than neural networks.","['Dylan Slack', 'Sorelle A. Friedler', 'Carlos Scheidegger', 'Chitradeep Dutta Roy']","['cs.LG', 'cs.HC', 'stat.ML']",2019-02-09 21:49:36+00:00
http://arxiv.org/abs/1902.03498v3,Space lower bounds for linear prediction in the streaming model,"We show that fundamental learning tasks, such as finding an approximate
linear separator or linear regression, require memory at least \emph{quadratic}
in the dimension, in a natural streaming setting. This implies that such
problems cannot be solved (at least in this setting) by scalable
memory-efficient streaming algorithms. Our results build on a memory lower
bound for a simple linear-algebraic problem -- finding orthogonal vectors --
and utilize the estimates on the packing of the Grassmannian, the manifold of
all linear subspaces of fixed dimension.","['Yuval Dagan', 'Gil Kur', 'Ohad Shamir']","['cs.LG', 'stat.ML']",2019-02-09 21:44:40+00:00
http://arxiv.org/abs/1902.03493v3,Deep Algorithm Unrolling for Blind Image Deblurring,"Blind image deblurring remains a topic of enduring interest. Learning based
approaches, especially those that employ neural networks have emerged to
complement traditional model based methods and in many cases achieve vastly
enhanced performance. That said, neural network approaches are generally
empirically designed and the underlying structures are difficult to interpret.
In recent years, a promising technique called algorithm unrolling has been
developed that has helped connect iterative algorithms such as those for sparse
coding to neural network architectures. However, such connections have not been
made yet for blind image deblurring. In this paper, we propose a neural network
architecture based on this idea. We first present an iterative algorithm that
may be considered as a generalization of the traditional total-variation
regularization method in the gradient domain. We then unroll the algorithm to
construct a neural network for image deblurring which we refer to as Deep
Unrolling for Blind Deblurring (DUBLID). Key algorithm parameters are learned
with the help of training images. Our proposed deep network DUBLID achieves
significant practical performance gains while enjoying interpretability at the
same time. Extensive experimental results show that DUBLID outperforms many
state-of-the-art methods and in addition is computationally faster.","['Yuelong Li', 'Mohammad Tofighi', 'Junyi Geng', 'Vishal Monga', 'Yonina C. Eldar']","['eess.IV', 'cs.CV', 'cs.LG', 'stat.ML']",2019-02-09 21:19:35+00:00
http://arxiv.org/abs/1902.05399v2,An Algorithm Unrolling Approach to Deep Image Deblurring,"While neural networks have achieved vastly enhanced performance over
traditional iterative methods in many cases, they are generally empirically
designed and the underlying structures are difficult to interpret. The
algorithm unrolling approach has helped connect iterative algorithms to neural
network architectures. However, such connections have not been made yet for
blind image deblurring. In this paper, we propose a neural network architecture
that advances this idea. We first present an iterative algorithm that may be
considered a generalization of the traditional total-variation regularization
method on the gradient domain, and subsequently unroll the half-quadratic
splitting algorithm to construct a neural network. Our proposed deep network
achieves significant practical performance gains while enjoying
interpretability at the same time. Experimental results show that our approach
outperforms many state-of-the-art methods.","['Yuelong Li', 'Mohammad Tofighi', 'Vishal Monga', 'Yonina C. Eldar']","['cs.CV', 'cs.LG', 'stat.ML']",2019-02-09 21:19:11+00:00
http://arxiv.org/abs/1902.03475v1,Pure Exploration with Multiple Correct Answers,"We determine the sample complexity of pure exploration bandit problems with
multiple good answers. We derive a lower bound using a new game equilibrium
argument. We show how continuity and convexity properties of single-answer
problems ensures that the Track-and-Stop algorithm has asymptotically optimal
sample complexity. However, that convexity is lost when going to the
multiple-answer setting. We present a new algorithm which extends
Track-and-Stop to the multiple-answer case and has asymptotic sample complexity
matching the lower bound.","['Rémy Degenne', 'Wouter M. Koolen']","['cs.LG', 'stat.ML']",2019-02-09 19:08:22+00:00
http://arxiv.org/abs/1902.03468v4,Synthetic Data Generators: Sequential and Private,"We study the sample complexity of private synthetic data generation over an
unbounded sized class of statistical queries, and show that any class that is
privately proper PAC learnable admits a private synthetic data generator
(perhaps non-efficient). Previous work on synthetic data generators focused on
the case that the query class $\mathcal{D}$ is finite and obtained sample
complexity bounds that scale logarithmically with the size $|\mathcal{D}|$.
Here we construct a private synthetic data generator whose sample complexity is
independent of the domain size, and we replace finiteness with the assumption
that $\mathcal{D}$ is privately PAC learnable (a formally weaker task, hence we
obtain equivalence between the two tasks).","['Olivier Bousquet', 'Roi Livni', 'Shay Moran']","['cs.LG', 'stat.ML']",2019-02-09 18:35:39+00:00
http://arxiv.org/abs/1902.03466v2,Hierarchical Multi-task Deep Neural Network Architecture for End-to-End Driving,"A novel hierarchical Deep Neural Network (DNN) model is presented to address
the task of end-to-end driving. The model consists of a master classifier
network which determines the driving task required from an input stereo image
and directs said image to one of a set of subservient network regression models
that perform inference and output a steering command. These subservient
networks are designed and trained for a specific driving task: straightaway,
swerve maneuver, tight turn, gradual turn, and chicane. Using this modular
network strategy allows for two primary advantages: an overall reduction in the
amount of data required to train the complete system, and for model tailoring
where more complex models can be used for more challenging tasks while
simplified networks can handle more mundane tasks. It is this latter facet of
the model that makes the approach attractive to a number of applications beyond
the current vehicle steering strategy.","['Jose Solomon', 'Francois Charette']","['cs.LG', 'cs.CV', 'cs.RO', 'stat.ML']",2019-02-09 18:23:51+00:00
http://arxiv.org/abs/1902.03453v2,Distance metric learning based on structural neighborhoods for dimensionality reduction and classification performance improvement,"Distance metric learning can be viewed as one of the fundamental interests in
pattern recognition and machine learning, which plays a pivotal role in the
performance of many learning methods. One of the effective methods in learning
such a metric is to learn it from a set of labeled training samples. The issue
of data imbalance is the most important challenge of recent methods. This
research tries not only to preserve the local structures but also covers the
issue of imbalanced datasets. To do this, the proposed method first tries to
extract a low dimensional manifold from the input data. Then, it learns the
local neighborhood structures and the relationship of the data points in the
ambient space based on the adjacencies of the same data points on the embedded
low dimensional manifold. Using the local neighborhood relationships extracted
from the manifold space, the proposed method learns the distance metric in a
way which minimizes the distance between similar data and maximizes their
distance from the dissimilar data points. The evaluations of the proposed
method on numerous datasets from the UCI repository of machine learning, and
also the KDDCup98 dataset as the most imbalance dataset, justify the supremacy
of the proposed approach in comparison with other approaches especially when
the imbalance factor is high.","['Mostafa Razavi Ghods', 'Mohammad Hossein Moattar', 'Yahya Forghani']","['cs.LG', 'stat.ML']",2019-02-09 17:33:37+00:00
http://arxiv.org/abs/1902.03444v1,Venn GAN: Discovering Commonalities and Particularities of Multiple Distributions,"We propose a GAN design which models multiple distributions effectively and
discovers their commonalities and particularities. Each data distribution is
modeled with a mixture of $K$ generator distributions. As the generators are
partially shared between the modeling of different true data distributions,
shared ones captures the commonality of the distributions, while non-shared
ones capture unique aspects of them. We show the effectiveness of our method on
various datasets (MNIST, Fashion MNIST, CIFAR-10, Omniglot, CelebA) with
compelling results.","['Yasin Yazıcı', 'Bruno Lecouat', 'Chuan-Sheng Foo', 'Stefan Winkler', 'Kim-Hui Yap', 'Georgios Piliouras', 'Vijay Chandrasekhar']","['cs.LG', 'stat.ML']",2019-02-09 16:57:17+00:00
http://arxiv.org/abs/1902.03427v1,Low-pass filtering as Bayesian inference,"We propose a Bayesian nonparametric method for low-pass filtering that can
naturally handle unevenly-sampled and noise-corrupted observations. The
proposed model is constructed as a latent-factor model for time series, where
the latent factors are Gaussian processes with non-overlapping spectra. With
this construction, the low-pass version of the time series can be identified as
the low-frequency latent component, and therefore it can be found by means of
Bayesian inference. We show that the model admits exact training and can be
implemented with minimal numerical approximations. Finally, the proposed model
is validated against standard linear filters on synthetic and real-world time
series.","['Cristobal Valenzuela', 'Felipe Tobar']","['stat.ML', 'cs.LG', 'eess.SP']",2019-02-09 14:09:32+00:00
http://arxiv.org/abs/1902.05400v1,Data-Driven Vehicle Trajectory Forecasting,"An active area of research is to increase the safety of self-driving
vehicles. Although safety cannot be guarenteed completely, the capability of a
vehicle to predict the future trajectories of its surrounding vehicles could
help ensure this notion of safety to a greater deal. We cast the trajectory
forecast problem in a multi-time step forecasting problem and develop a
Convolutional Neural Network based approach to learn from trajectory sequences
generated from completely raw dataset in real-time. Results show improvement
over baselines.","['Shayan Jawed', 'Eya Boumaiza', 'Josif Grabocka', 'Lars Schmidt-Thieme']","['cs.CV', 'cs.LG', 'cs.RO', 'stat.ML']",2019-02-09 12:09:48+00:00
http://arxiv.org/abs/1902.03394v2,A stochastic version of Stein Variational Gradient Descent for efficient sampling,"We propose in this work RBM-SVGD, a stochastic version of Stein Variational
Gradient Descent (SVGD) method for efficiently sampling from a given
probability measure and thus useful for Bayesian inference. The method is to
apply the Random Batch Method (RBM) for interacting particle systems proposed
by Jin et al to the interacting particle systems in SVGD. While keeping the
behaviors of SVGD, it reduces the computational cost, especially when the
interacting kernel has long range. Numerical examples verify the efficiency of
this new version of SVGD.","['Lei Li', 'Yingzhou Li', 'Jian-Guo Liu', 'Zibu Liu', 'Jianfeng Lu']","['stat.ML', 'cs.LG', 'math.PR', '62D05, 65C35']",2019-02-09 09:22:24+00:00
http://arxiv.org/abs/1902.03393v2,Improved Knowledge Distillation via Teacher Assistant,"Despite the fact that deep neural networks are powerful models and achieve
appealing results on many tasks, they are too large to be deployed on edge
devices like smartphones or embedded sensor nodes. There have been efforts to
compress these networks, and a popular method is knowledge distillation, where
a large (teacher) pre-trained network is used to train a smaller (student)
network. However, in this paper, we show that the student network performance
degrades when the gap between student and teacher is large. Given a fixed
student network, one cannot employ an arbitrarily large teacher, or in other
words, a teacher can effectively transfer its knowledge to students up to a
certain size, not smaller. To alleviate this shortcoming, we introduce
multi-step knowledge distillation, which employs an intermediate-sized network
(teacher assistant) to bridge the gap between the student and the teacher.
Moreover, we study the effect of teacher assistant size and extend the
framework to multi-step distillation. Theoretical analysis and extensive
experiments on CIFAR-10,100 and ImageNet datasets and on CNN and ResNet
architectures substantiate the effectiveness of our proposed approach.","['Seyed-Iman Mirzadeh', 'Mehrdad Farajtabar', 'Ang Li', 'Nir Levine', 'Akihiro Matsukawa', 'Hassan Ghasemzadeh']","['cs.LG', 'cs.AI', 'stat.ML']",2019-02-09 09:06:01+00:00
http://arxiv.org/abs/1902.03376v1,Measuring Patient Similarities via a Deep Architecture with Medical Concept Embedding,"Evaluating the clinical similarities between pairwise patients is a
fundamental problem in healthcare informatics. A proper patient similarity
measure enables various downstream applications, such as cohort study and
treatment comparative effectiveness research. One major carrier for conducting
patient similarity research is Electronic Health Records(EHRs), which are
usually heterogeneous, longitudinal, and sparse. Though existing studies on
learning patient similarity from EHRs have shown being useful in solving real
clinical problems, their applicability is limited due to the lack of medical
interpretations. Moreover, most previous methods assume a vector-based
representation for patients, which typically requires aggregation of medical
events over a certain time period. As a consequence, temporal information will
be lost. In this paper, we propose a patient similarity evaluation framework
based on the temporal matching of longitudinal patient EHRs. Two efficient
methods are presented, unsupervised and supervised, both of which preserve the
temporal properties in EHRs. The supervised scheme takes a convolutional neural
network architecture and learns an optimal representation of patient clinical
records with medical concept embedding. The empirical results on real-world
clinical data demonstrate substantial improvement over the baselines. We make
our code and sample data available for further study.","['Zihao Zhu', 'Changchang Yin', 'Buyue Qian', 'Yu Cheng', 'Jishang Wei', 'Fei Wang']","['stat.ML', 'cs.AI', 'cs.LG']",2019-02-09 05:36:18+00:00
http://arxiv.org/abs/1902.03364v2,Latent Representations of Dynamical Systems: When Two is Better Than One,"A popular approach for predicting the future of dynamical systems involves
mapping them into a lower-dimensional ""latent space"" where prediction is
easier. We show that the information-theoretically optimal approach uses
different mappings for present and future, in contrast to state-of-the-art
machine-learning approaches where both mappings are the same. We illustrate
this dichotomy by predicting the time-evolution of coupled harmonic oscillators
with dissipation and thermal noise, showing how the optimal 2-mapping method
significantly outperforms principal component analysis and all other approaches
that use a single latent representation, and discuss the intuitive reason why
two representations are better than one. We conjecture that a single latent
representation is optimal only for time-reversible processes, not for e.g.
text, speech, music or out-of-equilibrium physical systems.",['Max Tegmark'],"['physics.data-an', 'stat.ML']",2019-02-09 03:14:39+00:00
http://arxiv.org/abs/1902.03362v2,Sinogram interpolation for sparse-view micro-CT with deep learning neural network,"In sparse-view Computed Tomography (CT), only a small number of projection
images are taken around the object, and sinogram interpolation method has a
significant impact on final image quality. When the amount of sparsity (the
amount of missing views in sinogram data) is not high, conventional
interpolation methods have yielded good results. When the amount of sparsity is
high, more advanced sinogram interpolation methods are needed. Recently,
several deep learning (DL) based sinogram interpolation methods have been
proposed. However, those DL-based methods have mostly tested so far on computer
simulated sinogram data rather experimentally acquired sinogram data. In this
study, we developed a sinogram interpolation method for sparse-view micro-CT
based on the combination of U-Net and residual learning. We applied the method
to sinogram data obtained from sparse-view micro-CT experiments, where the
sparsity reached 90%. The interpolated sinogram by the DL neural network was
fed to FBP algorithm for reconstruction. The result shows that both RMSE and
SSIM of CT image are greatly improved. The experimental results demonstrate
that this sinogram interpolation method produce significantly better results
over standard linear interpolation methods when the sinogram data are extremely
sparse.","['Xu Dong', 'Swapnil Vekhande', 'Guohua Cao']","['physics.med-ph', 'cs.LG', 'stat.ML']",2019-02-09 02:46:12+00:00
http://arxiv.org/abs/1902.03356v3,Meta-Curvature,"We propose meta-curvature (MC), a framework to learn curvature information
for better generalization and fast model adaptation. MC expands on the
model-agnostic meta-learner (MAML) by learning to transform the gradients in
the inner optimization such that the transformed gradients achieve better
generalization performance to a new task. For training large scale neural
networks, we decompose the curvature matrix into smaller matrices in a novel
scheme where we capture the dependencies of the model's parameters with a
series of tensor products. We demonstrate the effects of our proposed method on
several few-shot learning tasks and datasets. Without any task specific
techniques and architectures, the proposed method achieves substantial
improvement upon previous MAML variants and outperforms the recent
state-of-the-art methods. Furthermore, we observe faster convergence rates of
the meta-training process. Finally, we present an analysis that explains better
generalization performance with the meta-trained curvature.","['Eunbyung Park', 'Junier B. Oliva']","['cs.LG', 'stat.ML']",2019-02-09 02:34:53+00:00
http://arxiv.org/abs/1902.03350v1,Bayesian Nonparametric Adaptive Spectral Density Estimation for Financial Time Series,"Discrimination between non-stationarity and long-range dependency is a
difficult and long-standing issue in modelling financial time series. This
paper uses an adaptive spectral technique which jointly models the
non-stationarity and dependency of financial time series in a non-parametric
fashion assuming that the time series consists of a finite, but unknown number,
of locally stationary processes, the locations of which are also unknown. The
model allows a non-parametric estimate of the dependency structure by modelling
the auto-covariance function in the spectral domain. All our estimates are made
within a Bayesian framework where we use aReversible Jump Markov Chain Monte
Carlo algorithm for inference. We study the frequentist properties of our
estimates via a simulation study, and present a novel way of generating time
series data from a nonparametric spectrum. Results indicate that our techniques
perform well across a range of data generating processes. We apply our method
to a number of real examples and our results indicate that several financial
time series exhibit both long-range dependency and non-stationarity.","['Nick James', 'Roman Marchant', 'Richard Gerlach', 'Sally Cripps']","['q-fin.ST', 'cs.LG', 'stat.AP', 'stat.ML']",2019-02-09 01:58:48+00:00
