id,title,abstract,authors,categories,date
http://arxiv.org/abs/1911.02471v1,Designing Evaluations of Machine Learning Models for Subjective Inference: The Case of Sentence Toxicity,"Machine Learning (ML) is increasingly applied in real-life scenarios, raising
concerns about bias in automatic decision making. We focus on bias as a notion
of opinion exclusion, that stems from the direct application of traditional ML
pipelines to infer subjective properties. We argue that such ML systems should
be evaluated with subjectivity and bias in mind. Considering the lack of
evaluation standards yet to create evaluation benchmarks, we propose an initial
list of specifications to define prior to creating evaluation datasets, in
order to later accurately evaluate the biases. With the example of a sentence
toxicity inference system, we illustrate how the specifications support the
analysis of biases related to subjectivity. We highlight difficulties in
instantiating these specifications and list future work for the crowdsourcing
community to help the creation of appropriate evaluation datasets.","['Agathe Balayn', 'Alessandro Bozzon']","['cs.LG', 'cs.CL', 'stat.ML']",2019-11-06 16:38:19+00:00
http://arxiv.org/abs/1911.02469v1,Don't Blame the ELBO! A Linear VAE Perspective on Posterior Collapse,"Posterior collapse in Variational Autoencoders (VAEs) arises when the
variational posterior distribution closely matches the prior for a subset of
latent variables. This paper presents a simple and intuitive explanation for
posterior collapse through the analysis of linear VAEs and their direct
correspondence with Probabilistic PCA (pPCA). We explain how posterior collapse
may occur in pPCA due to local maxima in the log marginal likelihood.
Unexpectedly, we prove that the ELBO objective for the linear VAE does not
introduce additional spurious local maxima relative to log marginal likelihood.
We show further that training a linear VAE with exact variational inference
recovers an identifiable global maximum corresponding to the principal
component directions. Empirically, we find that our linear analysis is
predictive even for high-capacity, non-linear VAEs and helps explain the
relationship between the observation noise, local maxima, and posterior
collapse in deep Gaussian VAEs.","['James Lucas', 'George Tucker', 'Roger Grosse', 'Mohammad Norouzi']","['cs.LG', 'stat.ML']",2019-11-06 16:34:04+00:00
http://arxiv.org/abs/1911.02457v5,High-dimensional Black-box Optimization Under Uncertainty,"Optimizing expensive black-box systems with limited data is an extremely
challenging problem. As a resolution, we present a new surrogate optimization
approach by addressing two gaps in prior research -- unimportant input
variables and inefficient treatment of uncertainty associated with the
black-box output. We first design a new flexible non-interpolating parsimonious
surrogate model using a partitioning-based multivariate adaptive regression
splines approach, Tree Knot MARS (TK-MARS). The proposed model is specifically
designed for optimization by capturing the structure of the function, bending
at near-optimal locations, and is capable of screening unimportant input
variables. Furthermore, we develop a novel replication approach called
\emph{Smart-Replication}, to overcome the uncertainty associated with the
black-box output. The Smart-Replication approach identifies promising input
points to replicate and avoids unnecessary evaluations of other data points.
Smart-Replication is agnostic to the choice of a surrogate and can adapt itself
to an unknown noise level. Finally to demonstrate the effectiveness of our
proposed approaches we consider different complex global optimization test
functions from the surrogate optimization literature. The results indicate that
TK-MARS outperforms original MARS within a surrogate optimization algorithm and
successfully detects important variables. The results also show that although
non-interpolating surrogates can mitigate uncertainty, replication is still
beneficial for optimizing highly complex black-box functions. The robustness
and the quality of the final optimum solution found through Smart-Replication
are competitive with that using no replications in environments with low levels
of noise and using a fixed number of replications in highly noisy environments.","['Hadis Anahideh', 'Jay Rosenberger', 'Victoria Chen']","['math.OC', 'stat.ME', 'stat.ML']",2019-11-06 16:13:36+00:00
http://arxiv.org/abs/1911.02455v1,Unfairness towards subjective opinions in Machine Learning,"Despite the high interest for Machine Learning (ML) in academia and industry,
many issues related to the application of ML to real-life problems are yet to
be addressed. Here we put forward one limitation which arises from a lack of
adaptation of ML models and datasets to specific applications. We formalise a
new notion of unfairness as exclusion of opinions. We propose ways to quantify
this unfairness, and aid understanding its causes through visualisation. These
insights into the functioning of ML-based systems hint at methods to mitigate
unfairness.","['Agathe Balayn', 'Alessandro Bozzon', 'Zoltan Szlavik']","['cs.LG', 'cs.CY', 'cs.HC', 'stat.ML']",2019-11-06 16:11:41+00:00
http://arxiv.org/abs/1911.05495v4,Correlated Feature Selection for Tweet Spam Classification,"The identification of spam messages on social networks is a very challenging
task. Social media sites like Twitter \& Facebook attracts a lot of users and
companies to advertise and attract users of personal gains. These
advertisements most of the time leads to spamming, which in return leads to
poor user experience. The purpose of this paper is to undertake the analysis of
spamming on Twitter. To classify spams efficiently, it is necessary to first
understand the features of the spam tweets as well as identify attributes of
the spammer. We extract both tweet based features and user-based features for
our analysis and observe the correlation between these features. This step is
necessary as we can reduce the training time if we combine the highly
correlated features. Our proposed approach uses a classification model based on
artificial neural networks to classify the tweets as spam or non-spam giving
the highest accuracy of 97.57\% when compared with four other standard
classifiers namely, SVM, K Nearest Neighbours, Naive Bayes, and Random Forest.",['Prakamya Mishra'],"['cs.SI', 'cs.LG', 'stat.ML']",2019-11-06 15:16:35+00:00
http://arxiv.org/abs/1911.02417v2,Energy Efficient Federated Learning Over Wireless Communication Networks,"In this paper, the problem of energy efficient transmission and computation
resource allocation for federated learning (FL) over wireless communication
networks is investigated. In the considered model, each user exploits limited
local computational resources to train a local FL model with its collected data
and, then, sends the trained FL model to a base station (BS) which aggregates
the local FL model and broadcasts it back to all of the users. Since FL
involves an exchange of a learning model between users and the BS, both
computation and communication latencies are determined by the learning accuracy
level. Meanwhile, due to the limited energy budget of the wireless users, both
local computation energy and transmission energy must be considered during the
FL process. This joint learning and communication problem is formulated as an
optimization problem whose goal is to minimize the total energy consumption of
the system under a latency constraint. To solve this problem, an iterative
algorithm is proposed where, at every step, closed-form solutions for time
allocation, bandwidth allocation, power control, computation frequency, and
learning accuracy are derived. Since the iterative algorithm requires an
initial feasible solution, we construct the completion time minimization
problem and a bisection-based algorithm is proposed to obtain the optimal
solution, which is a feasible solution to the original energy minimization
problem. Numerical results show that the proposed algorithms can reduce up to
59.5% energy consumption compared to the conventional FL method.","['Zhaohui Yang', 'Mingzhe Chen', 'Walid Saad', 'Choong Seon Hong', 'Mohammad Shikh-Bahaei']","['cs.IT', 'cs.LG', 'math.IT', 'stat.ML']",2019-11-06 14:51:49+00:00
http://arxiv.org/abs/1911.02377v5,Searching to Exploit Memorization Effect in Learning from Corrupted Labels,"Sample selection approaches are popular in robust learning from noisy labels.
However, how to properly control the selection process so that deep networks
can benefit from the memorization effect is a hard problem. In this paper,
motivated by the success of automated machine learning (AutoML), we model this
issue as a function approximation problem. Specifically, we design a
domain-specific search space based on general patterns of the memorization
effect and propose a novel Newton algorithm to solve the bi-level optimization
problem efficiently. We further provide theoretical analysis of the algorithm,
which ensures a good approximation to critical points. Experiments are
performed on benchmark data sets. Results demonstrate that the proposed method
is much better than the state-of-the-art noisy-label-learning approaches, and
also much more efficient than existing AutoML algorithms.","['Quanming Yao', 'Hansi Yang', 'Bo Han', 'Gang Niu', 'James Kwok']","['cs.LG', 'stat.ML']",2019-11-06 13:36:04+00:00
http://arxiv.org/abs/1911.03522v1,Deep Sequential Models for Suicidal Ideation from Multiple Source Data,"This article presents a novel method for predicting suicidal ideation from
Electronic Health Records (EHR) and Ecological Momentary Assessment (EMA) data
using deep sequential models. Both EHR longitudinal data and EMA question forms
are defined by asynchronous, variable length, randomly-sampled data sequences.
In our method, we model each of them with a Recurrent Neural Network (RNN), and
both sequences are aligned by concatenating the hidden state of each of them
using temporal marks. Furthermore, we incorporate attention schemes to improve
performance in long sequences and time-independent pre-trained schemes to cope
with very short sequences. Using a database of 1023 patients, our experimental
results show that the addition of EMA records boosts the system recall to
predict the suicidal ideation diagnosis from 48.13% obtained exclusively from
EHR-based state-of-the-art methods to 67.78%. Additionally, our method provides
interpretability through the t-SNE representation of the latent space. Further,
the most relevant input features are identified and interpreted medically.","['Ignacio Peis', 'Pablo M. Olmos', 'Constanza Vera-Varela', 'María Luisa Barrigón', 'Philippe Courtet', 'Enrique Baca-García', 'Antonio Artés-Rodríguez']","['cs.LG', 'stat.ML']",2019-11-06 12:55:28+00:00
http://arxiv.org/abs/1911.02347v1,Convolutional Neural Network for Multipath Detection in GNSS Receivers,"Global Navigation Satellite System (GNSS) signals are subject to different
kinds of events causing significant errors in positioning. This work explores
the application of Machine Learning (ML) methods of anomaly detection applied
to GNSS receiver signals. More specifically, our study focuses on multipath
contamination, using samples of the correlator output signal. The GPS L1 C/A
signal data is used and sourced directly from the correlator output. To extract
the important features and patterns from such data, we use deep convolutional
neural networks (CNN), which have proven to be efficient in image analysis in
particular. To take advantage of CNN, the correlator output signal is mapped as
a 2D input image and fed to the convolutional layers of a neural network. The
network automatically extracts the relevant features from the input samples and
proceeds with the multipath detection. We train the CNN using synthetic
signals. To optimize the model architecture with respect to the GNSS correlator
complexity, the evaluation of the CNN performance is done as a function of the
number of correlator output points.","['Evgenii Munin', 'Antoine Blais', 'Nicolas Couellan']","['eess.SP', 'stat.ML']",2019-11-06 12:55:02+00:00
http://arxiv.org/abs/1911.07936v4,Privacy Preserving Gaze Estimation using Synthetic Images via a Randomized Encoding Based Framework,"Eye tracking is handled as one of the key technologies for applications that
assess and evaluate human attention, behavior, and biometrics, especially using
gaze, pupillary, and blink behaviors. One of the challenges with regard to the
social acceptance of eye tracking technology is however the preserving of
sensitive and personal information. To tackle this challenge, we employ a
privacy-preserving framework based on randomized encoding to train a Support
Vector Regression model using synthetic eye images privately to estimate the
human gaze. During the computation, none of the parties learn about the data or
the result that any other party has. Furthermore, the party that trains the
model cannot reconstruct pupil, blinks or visual scanpath. The experimental
results show that our privacy-preserving framework is capable of working in
real-time, with the same accuracy as compared to non-private version and could
be extended to other eye tracking related problems.","['Efe Bozkir', 'Ali Burak Ünal', 'Mete Akgün', 'Enkelejda Kasneci', 'Nico Pfeifer']","['cs.CV', 'cs.CR', 'cs.HC', 'cs.LG', 'stat.ML']",2019-11-06 12:52:09+00:00
http://arxiv.org/abs/1911.04862v1,An End-to-end Approach for Lexical Stress Detection based on Transformer,"The dominant automatic lexical stress detection method is to split the
utterance into syllable segments using phoneme sequence and their time-aligned
boundaries. Then we extract features from syllable to use classification method
to classify the lexical stress. However, we can't get very accurate time
boundaries of each phoneme and we have to design some features in the syllable
segments to classify the lexical stress. Therefore, we propose a end-to-end
approach using sequence to sequence model of transformer to estimate lexical
stress. For this, we train transformer model using feature sequence of audio
and their phoneme sequence with lexical stress marks. During the recognition
process, the recognized phoneme sequence is restricted according to the
original standard phoneme sequence without lexical stress marks, but the
lexical stress mark of each phoneme is not limited. We train the model in
different subset of Librispeech and do lexical stress recognition in TIMIT and
L2-ARCTIC dataset. For all subsets, the end-to-end model will perform better
than the syllable segments classification method. Our method can achieve a
6.36% phoneme error rate on the TIMIT dataset, which exceeds the 7.2% error
rate in other studies.","['Yong Ruan', 'Xiangdong Wang', 'Hong Liu', 'Zhigang Ou', 'Yun Gao', 'Jianfeng Cheng', 'Yueliang Qian']","['eess.AS', 'cs.LG', 'cs.SD', 'stat.ML']",2019-11-06 11:29:37+00:00
http://arxiv.org/abs/1911.02319v6,Improving reinforcement learning algorithms: towards optimal learning rate policies,"This paper investigates to what extent one can improve reinforcement learning
algorithms. Our study is split in three parts. First, our analysis shows that
the classical asymptotic convergence rate $O(1/\sqrt{N})$ is pessimistic and
can be replaced by $O((\log(N)/N)^{\beta})$ with $\frac{1}{2}\leq \beta \leq 1$
and $N$ the number of iterations. Second, we propose a dynamic optimal policy
for the choice of the learning rate $(\gamma_k)_{k\geq 0}$ used in stochastic
approximation (SA). We decompose our policy into two interacting levels: the
inner and the outer level. In the inner level, we present the
\nameref{Alg:v_4_s} algorithm (for ""PAst Sign Search"") which, based on a
predefined sequence $(\gamma^o_k)_{k\geq 0}$, constructs a new sequence
$(\gamma^i_k)_{k\geq 0}$ whose error decreases faster. In the outer level, we
propose an optimal methodology for the selection of the predefined sequence
$(\gamma^o_k)_{k\geq 0}$. Third, we show empirically that our selection
methodology of the learning rate outperforms significantly standard algorithms
used in reinforcement learning (RL) in the three following applications: the
estimation of a drift, the optimal placement of limit orders and the optimal
execution of large number of shares.","['Othmane Mounjid', 'Charles-Albert Lehalle']","['cs.LG', 'math.OC', 'stat.ML']",2019-11-06 11:17:53+00:00
http://arxiv.org/abs/1911.05466v2,Attentive Geo-Social Group Recommendation,"Social activities play an important role in people's daily life since they
interact. For recommendations based on social activities, it is vital to have
not only the activity information but also individuals' social relations.
Thanks to the geo-social networks and widespread use of location-aware mobile
devices, massive geo-social data is now readily available for exploitation by
the recommendation system. In this paper, a novel group recommendation method,
called attentive geo-social group recommendation, is proposed to recommend the
target user with both activity locations and a group of users that may join the
activities. We present an attention mechanism to model the influence of the
target user $u_T$ in candidate user groups that satisfy the social constraints.
It helps to retrieve the optimal user group and activity topic candidates, as
well as explains the group decision-making process. Once the user group and
topics are retrieved, a novel efficient spatial query algorithm SPA-DF is
employed to determine the activity location under the constraints of the given
user group and activity topic candidates. The proposed method is evaluated in
real-world datasets and the experimental results show that the proposed model
significantly outperforms baseline methods.","['Fei Yu', 'Feiyi Fan', 'Shouxu Jiang', 'Kaiping Zheng']","['cs.SI', 'cs.LG', 'stat.ML', '68U35', 'H.3.3']",2019-11-06 11:13:27+00:00
http://arxiv.org/abs/1911.02306v1,Linear Support Vector Regression with Linear Constraints,"This paper studies the addition of linear constraints to the Support Vector
Regression (SVR) when the kernel is linear. Adding those constraints into the
problem allows to add prior knowledge on the estimator obtained, such as
finding probability vector or monotone data. We propose a generalization of the
Sequential Minimal Optimization (SMO) algorithm for solving the optimization
problem with linear constraints and prove its convergence. Then, practical
performances of this estimator are shown on simulated and real datasets with
different settings: non negative regression, regression onto the simplex for
biomedical data and isotonic regression for weather forecast.","['Quentin Klopfenstein', 'Samuel Vaiter']","['math.OC', 'stat.ML']",2019-11-06 10:57:29+00:00
http://arxiv.org/abs/1911.02256v1,A Divergence Minimization Perspective on Imitation Learning Methods,"In many settings, it is desirable to learn decision-making and control
policies through learning or bootstrapping from expert demonstrations. The most
common approaches under this Imitation Learning (IL) framework are Behavioural
Cloning (BC), and Inverse Reinforcement Learning (IRL). Recent methods for IRL
have demonstrated the capacity to learn effective policies with access to a
very limited set of demonstrations, a scenario in which BC methods often fail.
Unfortunately, due to multiple factors of variation, directly comparing these
methods does not provide adequate intuition for understanding this difference
in performance. In this work, we present a unified probabilistic perspective on
IL algorithms based on divergence minimization. We present $f$-MAX, an
$f$-divergence generalization of AIRL [Fu et al., 2018], a state-of-the-art IRL
method. $f$-MAX enables us to relate prior IRL methods such as GAIL [Ho &
Ermon, 2016] and AIRL [Fu et al., 2018], and understand their algorithmic
properties. Through the lens of divergence minimization we tease apart the
differences between BC and successful IRL approaches, and empirically evaluate
these nuances on simulated high-dimensional continuous control domains. Our
findings conclusively identify that IRL's state-marginal matching objective
contributes most to its superior performance. Lastly, we apply our new
understanding of IL methods to the problem of state-marginal matching, where we
demonstrate that in simulated arm pushing environments we can teach agents a
diverse range of behaviours using simply hand-specified state distributions and
no reward functions or expert demonstrations. For datasets and reproducing
results please refer to
https://github.com/KamyarGh/rl_swiss/blob/master/reproducing/fmax_paper.md .","['Seyed Kamyar Seyed Ghasemipour', 'Richard Zemel', 'Shixiang Gu']","['cs.LG', 'stat.ML']",2019-11-06 08:50:50+00:00
http://arxiv.org/abs/1911.02254v2,Secure Federated Submodel Learning,"Federated learning was proposed with an intriguing vision of achieving
collaborative machine learning among numerous clients without uploading their
private data to a cloud server. However, the conventional framework requires
each client to leverage the full model for learning, which can be prohibitively
inefficient for resource-constrained clients and large-scale deep learning
tasks. We thus propose a new framework, called federated submodel learning,
where clients download only the needed parts of the full model, namely
submodels, and then upload the submodel updates. Nevertheless, the ""position""
of a client's truly required submodel corresponds to her private data, and its
disclosure to the cloud server during interactions inevitably breaks the tenet
of federated learning. To integrate efficiency and privacy, we have designed a
secure federated submodel learning scheme coupled with a private set union
protocol as a cornerstone. Our secure scheme features the properties of
randomized response, secure aggregation, and Bloom filter, and endows each
client with a customized plausible deniability, in terms of local differential
privacy, against the position of her desired submodel, thus protecting her
private data. We further instantiated our scheme with the e-commerce
recommendation scenario in Alibaba, implemented a prototype system, and
extensively evaluated its performance over 30-day Taobao user data. The
analysis and evaluation results demonstrate the feasibility and scalability of
our scheme from model accuracy and convergency, practical communication,
computation, and storage overheads, as well as manifest its remarkable
advantages over the conventional federated learning framework.","['Chaoyue Niu', 'Fan Wu', 'Shaojie Tang', 'Lifeng Hua', 'Rongfei Jia', 'Chengfei Lv', 'Zhihua Wu', 'Guihai Chen']","['cs.LG', 'cs.CR', 'cs.DC', 'stat.ML']",2019-11-06 08:49:23+00:00
http://arxiv.org/abs/1911.02247v2,Unsupervised Opinion Summarization as Copycat-Review Generation,"Opinion summarization is the task of automatically creating summaries that
reflect subjective information expressed in multiple documents, such as product
reviews. While the majority of previous work has focused on the extractive
setting, i.e., selecting fragments from input reviews to produce a summary, we
let the model generate novel sentences and hence produce abstractive summaries.
Recent progress in summarization has seen the development of supervised models
which rely on large quantities of document-summary pairs. Since such training
data is expensive to acquire, we instead consider the unsupervised setting, in
other words, we do not use any summaries in training. We define a generative
model for a review collection which capitalizes on the intuition that when
generating a new review given a set of other reviews of a product, we should be
able to control the ""amount of novelty"" going into the new review or,
equivalently, vary the extent to which it deviates from the input. At test
time, when generating summaries, we force the novelty to be minimal, and
produce a text reflecting consensus opinions. We capture this intuition by
defining a hierarchical variational autoencoder model. Both individual reviews
and the products they correspond to are associated with stochastic latent
codes, and the review generator (""decoder"") has direct access to the text of
input reviews through the pointer-generator mechanism. Experiments on Amazon
and Yelp datasets, show that setting at test time the review's latent code to
its mean, allows the model to produce fluent and coherent summaries reflecting
common opinions.","['Arthur Bražinskas', 'Mirella Lapata', 'Ivan Titov']","['cs.CL', 'cs.IR', 'cs.LG', 'stat.ML']",2019-11-06 08:20:13+00:00
