id,title,abstract,authors,categories,date
http://arxiv.org/abs/1710.04584v4,Towards Scalable Spectral Clustering via Spectrum-Preserving Sparsification,"The eigendeomposition of nearest-neighbor (NN) graph Laplacian matrices is
the main computational bottleneck in spectral clustering. In this work, we
introduce a highly-scalable, spectrum-preserving graph sparsification algorithm
that enables to build ultra-sparse NN (u-NN) graphs with guaranteed
preservation of the original graph spectrums, such as the first few
eigenvectors of the original graph Laplacian. Our approach can immediately lead
to scalable spectral clustering of large data networks without sacrificing
solution quality. The proposed method starts from constructing low-stretch
spanning trees (LSSTs) from the original graphs, which is followed by
iteratively recovering small portions of ""spectrally critical"" off-tree edges
to the LSSTs by leveraging a spectral off-tree embedding scheme. To determine
the suitable amount of off-tree edges to be recovered to the LSSTs, an
eigenvalue stability checking scheme is proposed, which enables to robustly
preserve the first few Laplacian eigenvectors within the sparsified graph.
Additionally, an incremental graph densification scheme is proposed for
identifying extra edges that have been missing in the original NN graphs but
can still play important roles in spectral clustering tasks. Our experimental
results for a variety of well-known data sets show that the proposed method can
dramatically reduce the complexity of NN graphs, leading to significant
speedups in spectral clustering.","['Yongyu Wang', 'Zhuo Feng']","['cs.LG', 'cs.AI', 'stat.ML']",2017-10-12 16:09:29+00:00
http://arxiv.org/abs/1710.04582v1,Is Epicurus the father of Reinforcement Learning?,"The Epicurean Philosophy is commonly thought as simplistic and hedonistic.
Here I discuss how this is a misconception and explore its link to
Reinforcement Learning. Based on the letters of Epicurus, I construct an
objective function for hedonism which turns out to be equivalent of the
Reinforcement Learning objective function when omitting the discount factor. I
then discuss how Plato and Aristotle 's views that can be also loosely linked
to Reinforcement Learning, as well as their weaknesses in relationship to it.
Finally, I emphasise the close affinity of the Epicurean views and the Bellman
equation.",['Eleni Vasilaki'],"['cs.LG', 'cs.AI', 'stat.ML']",2017-10-12 16:07:18+00:00
http://arxiv.org/abs/1710.04580v1,Additivity of Information in Multilayer Networks via Additive Gaussian Noise Transforms,"Multilayer (or deep) networks are powerful probabilistic models based on
multiple stages of a linear transform followed by a non-linear (possibly
random) function. In general, the linear transforms are defined by matrices and
the non-linear functions are defined by information channels. These models have
gained great popularity due to their ability to characterize complex
probabilistic relationships arising in a wide variety of inference problems.
The contribution of this paper is a new method for analyzing the fundamental
limits of statistical inference in settings where the model is known. The
validity of our method can be established in a number of settings and is
conjectured to hold more generally. A key assumption made throughout is that
the matrices are drawn randomly from orthogonally invariant distributions.
  Our method yields explicit formulas for 1) the mutual information; 2) the
minimum mean-squared error (MMSE); 3) the existence and locations of certain
phase-transitions with respect to the problem parameters; and 4) the stationary
points for the state evolution of approximate message passing algorithms. When
applied to the special case of models with multivariate Gaussian channels our
method is rigorous and has close connections to free probability theory for
random matrices. When applied to the general case of non-Gaussian channels, our
method provides a simple alternative to the replica method from statistical
physics. A key observation is that the combined effects of the individual
components in the model (namely the matrices and the channels) are additive
when viewed in a certain transform domain.",['Galen Reeves'],"['cs.IT', 'cs.LG', 'math.IT', 'stat.ML']",2017-10-12 16:02:19+00:00
http://arxiv.org/abs/1710.04556v1,New efficient algorithms for multiple change-point detection with kernels,"Several statistical approaches based on reproducing kernels have been
proposed to detect abrupt changes arising in the full distribution of the
observations and not only in the mean or variance. Some of these approaches
enjoy good statistical properties (oracle inequality, \ldots). Nonetheless,
they have a high computational cost both in terms of time and memory. This
makes their application difficult even for small and medium sample sizes ($n<
10^4$). This computational issue is addressed by first describing a new
efficient and exact algorithm for kernel multiple change-point detection with
an improved worst-case complexity that is quadratic in time and linear in
space. It allows dealing with medium size signals (up to $n \approx 10^5$).
Second, a faster but approximation algorithm is described. It is based on a
low-rank approximation to the Gram matrix. It is linear in time and space. This
approximation algorithm can be applied to large-scale signals ($n \geq 10^6$).
These exact and approximation algorithms have been implemented in \texttt{R}
and \texttt{C} for various kernels. The computational and statistical
performances of these new algorithms have been assessed through empirical
experiments. The runtime of the new algorithms is observed to be faster than
that of other considered procedures. Finally, simulations confirmed the higher
statistical accuracy of kernel-based approaches to detect changes that are not
only in the mean. These simulations also illustrate the flexibility of
kernel-based approaches to analyze complex biological profiles made of DNA copy
number and allele B frequencies. An R package implementing the approach will be
made available on github.","['Alain Celisse', 'Guillemette Marot', 'Morgane Pierre-Jean', 'Guillem Rigaill']","['math.ST', 'stat.CO', 'stat.ML', 'stat.TH']",2017-10-12 15:08:52+00:00
http://arxiv.org/abs/1710.04521v1,Subjectively Interesting Subgroup Discovery on Real-valued Targets,"Deriving insights from high-dimensional data is one of the core problems in
data mining. The difficulty mainly stems from the fact that there are
exponentially many variable combinations to potentially consider, and there are
infinitely many if we consider weighted combinations, even for linear
combinations. Hence, an obvious question is whether we can automate the search
for interesting patterns and visualizations. In this paper, we consider the
setting where a user wants to learn as efficiently as possible about
real-valued attributes. For example, to understand the distribution of crime
rates in different geographic areas in terms of other (numerical, ordinal
and/or categorical) variables that describe the areas. We introduce a method to
find subgroups in the data that are maximally informative (in the formal
Information Theoretic sense) with respect to a single or set of real-valued
target attributes. The subgroup descriptions are in terms of a succinct set of
arbitrarily-typed other attributes. The approach is based on the Subjective
Interestingness framework FORSIED to enable the use of prior knowledge when
finding most informative non-redundant patterns, and hence the method also
supports iterative data mining.","['Jefrey Lijffijt', 'Bo Kang', 'Wouter Duivesteijn', 'Kai Puolamäki', 'Emilia Oikarinen', 'Tijl De Bie']","['stat.ML', 'cs.IT', 'math.IT']",2017-10-12 14:04:19+00:00
http://arxiv.org/abs/1710.04486v1,Multimodal Observation and Interpretation of Subjects Engaged in Problem Solving,"In this paper we present the first results of a pilot experiment in the
capture and interpretation of multimodal signals of human experts engaged in
solving challenging chess problems. Our goal is to investigate the extent to
which observations of eye-gaze, posture, emotion and other physiological
signals can be used to model the cognitive state of subjects, and to explore
the integration of multiple sensor modalities to improve the reliability of
detection of human displays of awareness and emotion. We observed chess players
engaged in problems of increasing difficulty while recording their behavior.
Such recordings can be used to estimate a participant's awareness of the
current situation and to predict ability to respond effectively to challenging
situations. Results show that a multimodal approach is more accurate than a
unimodal one. By combining body posture, visual attention and emotion, the
multimodal approach can reach up to 93% of accuracy when determining player's
chess expertise while unimodal approach reaches 86%. Finally this experiment
validates the use of our equipment as a general and reproducible tool for the
study of participants engaged in screen-based interaction and/or problem
solving.","['Thomas Guntz', 'Raffaella Balzarini', 'Dominique Vaufreydaz', 'James L. Crowley']","['cs.HC', 'cs.CV', 'stat.ML']",2017-10-12 12:59:42+00:00
http://arxiv.org/abs/1710.04462v1,Effects of Images with Different Levels of Familiarity on EEG,"Evaluating human brain potentials during watching different images can be
used for memory evaluation, information retrieving, guilty-innocent
identification and examining the brain response. In this study, the effects of
watching images, with different levels of familiarity, on subjects'
Electroencephalogram (EEG) have been studied. Three different groups of images
with three familiarity levels of ""unfamiliar"", ""familiar"" and ""very familiar""
have been considered for this study. EEG signals of 21 subjects (14 men) were
recorded. After signal acquisition, pre-processing, including noise and
artifact removal, were performed on epochs of data. Features, including
spatial-statistical, wavelet, frequency and harmonic parameters, and also
correlation between recording channels, were extracted from the data. Then, we
evaluated the efficiency of the extracted features by using p-value and also an
orthogonal feature selection method (combination of Gram-Schmitt method and
Fisher discriminant ratio) for feature dimensional reduction. As the final step
of feature selection, we used 'add-r take-away l' method for choosing the most
discriminative features. For data classification, including all two-class and
three-class cases, we applied Support Vector Machine (SVM) on the extracted
features. The correct classification rates (CCR) for ""unfamiliar-familiar"",
""unfamiliar-very familiar"" and ""familiar-very familiar"" cases were 85.6%,
92.6%, and 70.6%, respectively. The best results of classifications were
obtained in pre-frontal and frontal regions of brain. Also, wavelet, frequency
and harmonic features were among the most discriminative features. Finally, in
three-class case, the best CCR was 86.8%.","['Ali Saeedi', 'Ehsan Arbabi']","['stat.ML', 'q-bio.NC']",2017-10-12 11:39:48+00:00
http://arxiv.org/abs/1710.04461v2,An Improved Naive Bayes Classifier-based Noise Detection Technique for Classifying User Phone Call Behavior,"The presence of noisy instances in mobile phone data is a fundamental issue
for classifying user phone call behavior (i.e., accept, reject, missed and
outgoing), with many potential negative consequences. The classification
accuracy may decrease and the complexity of the classifiers may increase due to
the number of redundant training samples. To detect such noisy instances from a
training dataset, researchers use naive Bayes classifier (NBC) as it identifies
misclassified instances by taking into account independence assumption and
conditional probabilities of the attributes. However, some of these
misclassified instances might indicate usages behavioral patterns of individual
mobile phone users. Existing naive Bayes classifier based noise detection
techniques have not considered this issue and, thus, are lacking in
classification accuracy. In this paper, we propose an improved noise detection
technique based on naive Bayes classifier for effectively classifying users'
phone call behaviors. In order to improve the classification accuracy, we
effectively identify noisy instances from the training dataset by analyzing the
behavioral patterns of individuals. We dynamically determine a noise threshold
according to individual's unique behavioral patterns by using both the naive
Bayes classifier and Laplace estimator. We use this noise threshold to identify
noisy instances. To measure the effectiveness of our technique in classifying
user phone call behavior, we employ the most popular classification algorithm
(e.g., decision tree). Experimental results on the real phone call log dataset
show that our proposed technique more accurately identifies the noisy instances
from the training datasets that leads to better classification accuracy.","['Iqbal H. Sarker', 'Muhammad Ashad Kabir', 'Alan Colman', 'Jun Han']","['cs.LG', 'cs.SI', 'stat.ML']",2017-10-12 11:37:21+00:00
http://arxiv.org/abs/1710.04450v1,Self-Taught Support Vector Machine,"In this paper, a new approach for classification of target task using limited
labeled target data as well as enormous unlabeled source data is proposed which
is called self-taught learning. The target and source data can be drawn from
different distributions. In the previous approaches, covariate shift assumption
is considered where the marginal distributions p(x) change over domains and the
conditional distributions p(y|x) remain the same. In our approach, we propose a
new objective function which simultaneously learns a common space T(.) where
the conditional distributions over domains p(T(x)|y) remain the same and learns
robust SVM classifiers for target task using both source and target data in the
new representation. Hence, in the proposed objective function, the hidden label
of the source data is also incorporated. We applied the proposed approach on
Caltech-256, MSRC+LMO datasets and compared the performance of our algorithm to
the available competing methods. Our method has a superior performance to the
successful existing algorithms.",['Parvin Razzaghi'],"['cs.CV', 'cs.LG', 'stat.ML']",2017-10-12 11:12:30+00:00
http://arxiv.org/abs/1710.04404v3,Sum-Product-Quotient Networks,"We present a novel tractable generative model that extends Sum-Product
Networks (SPNs) and significantly boosts their power. We call it
Sum-Product-Quotient Networks (SPQNs), whose core concept is to incorporate
conditional distributions into the model by direct computation using quotient
nodes, e.g. $P(A|B) = \frac{P(A,B)}{P(B)}$. We provide sufficient conditions
for the tractability of SPQNs that generalize and relax the decomposable and
complete tractability conditions of SPNs. These relaxed conditions give rise to
an exponential boost to the expressive efficiency of our model, i.e. we prove
that there are distributions which SPQNs can compute efficiently but require
SPNs to be of exponential size. Thus, we narrow the gap in expressivity between
tractable graphical models and other Neural Network-based generative models.","['Or Sharir', 'Amnon Shashua']","['cs.LG', 'cs.NE', 'stat.ML']",2017-10-12 08:18:07+00:00
http://arxiv.org/abs/1710.04382v1,Marginal sequential Monte Carlo for doubly intractable models,"Bayesian inference for models that have an intractable partition function is
known as a doubly intractable problem, where standard Monte Carlo methods are
not applicable. The past decade has seen the development of auxiliary variable
Monte Carlo techniques (M{\o}ller et al., 2006; Murray et al., 2006) for
tackling this problem; these approaches being members of the more general class
of pseudo-marginal, or exact-approximate, Monte Carlo algorithms (Andrieu and
Roberts, 2009), which make use of unbiased estimates of intractable posteriors.
Everitt et al. (2017) investigated the use of exact-approximate importance
sampling (IS) and sequential Monte Carlo (SMC) in doubly intractable problems,
but focussed only on SMC algorithms that used data-point tempering. This paper
describes SMC samplers that may use alternative sequences of distributions, and
describes ways in which likelihood estimates may be improved adaptively as the
algorithm progresses, building on ideas from Moores et al. (2015). This
approach is compared with a number of alternative algorithms for doubly
intractable problems, including approximate Bayesian computation (ABC), which
we show is closely related to the method of M{\o}ller et al. (2006).","['Richard G. Everitt', 'Dennis Prangle', 'Philip Maybank', 'Mark Bell']","['stat.CO', 'cs.AI', 'physics.data-an', 'stat.ME', 'stat.ML']",2017-10-12 06:36:14+00:00
http://arxiv.org/abs/1710.04373v1,Deep Learning in Multiple Multistep Time Series Prediction,"The project aims to research on combining deep learning specifically
Long-Short Memory (LSTM) and basic statistics in multiple multistep time series
prediction. LSTM can dive into all the pages and learn the general trends of
variation in a large scope, while the well selected medians for each page can
keep the special seasonality of different pages so that the future trend will
not fluctuate too much from the reality. A recent Kaggle competition on 145K
Web Traffic Time Series Forecasting [1] is used to thoroughly illustrate and
test this idea.",['Chuanyun Zang'],"['stat.ML', 'cs.LG']",2017-10-12 05:28:05+00:00
http://arxiv.org/abs/1710.04350v1,A Unified Neural Network Approach for Estimating Travel Time and Distance for a Taxi Trip,"In building intelligent transportation systems such as taxi or rideshare
services, accurate prediction of travel time and distance is crucial for
customer experience and resource management. Using the NYC taxi dataset, which
contains taxi trips data collected from GPS-enabled taxis [23], this paper
investigates the use of deep neural networks to jointly predict taxi trip time
and distance. We propose a model, called ST-NN (Spatio-Temporal Neural
Network), which first predicts the travel distance between an origin and a
destination GPS coordinate, then combines this prediction with the time of day
to predict the travel time. The beauty of ST-NN is that it uses only the raw
trips data without requiring further feature engineering and provides a joint
estimate of travel time and distance. We compare the performance of ST-NN to
that of state-of-the-art travel time estimation methods, and we observe that
the proposed approach generalizes better than state-of-the-art methods. We show
that ST-NN approach significantly reduces the mean absolute error for both
predicted travel time and distance, about 17% for travel time prediction. We
also observe that the proposed approach is more robust to outliers present in
the dataset by testing the performance of ST-NN on the datasets with and
without outliers.","['Ishan Jindal', 'Tony', 'Qin', 'Xuewen Chen', 'Matthew Nokleby', 'Jieping Ye']","['stat.ML', 'cs.LG']",2017-10-12 03:21:16+00:00
http://arxiv.org/abs/1710.04908v2,Graph Convolutional Networks for Classification with a Structured Label Space,"It is a usual practice to ignore any structural information underlying
classes in multi-class classification. In this paper, we propose a graph
convolutional network (GCN) augmented neural network classifier to exploit a
known, underlying graph structure of labels. The proposed approach resembles an
(approximate) inference procedure in, for instance, a conditional random field
(CRF). We evaluate the proposed approach on document classification and object
recognition and report both accuracies and graph-theoretic metrics that
correspond to the consistency of the model's prediction. The experiment results
reveal that the proposed model outperforms a baseline method which ignores the
graph structures of a label space in terms of graph-theoretic metrics.","['Meihao Chen', 'Zhuoru Lin', 'Kyunghyun Cho']","['cs.LG', 'stat.ML']",2017-10-12 02:39:18+00:00
http://arxiv.org/abs/1710.04340v2,Learning Koopman Invariant Subspaces for Dynamic Mode Decomposition,"Spectral decomposition of the Koopman operator is attracting attention as a
tool for the analysis of nonlinear dynamical systems. Dynamic mode
decomposition is a popular numerical algorithm for Koopman spectral analysis;
however, we often need to prepare nonlinear observables manually according to
the underlying dynamics, which is not always possible since we may not have any
a priori knowledge about them. In this paper, we propose a fully data-driven
method for Koopman spectral analysis based on the principle of learning Koopman
invariant subspaces from observed data. To this end, we propose minimization of
the residual sum of squares of linear least-squares regression to estimate a
set of functions that transforms data into a form in which the linear
regression fits well. We introduce an implementation with neural networks and
evaluate performance empirically using nonlinear dynamical systems and
applications.","['Naoya Takeishi', 'Yoshinobu Kawahara', 'Takehisa Yairi']","['cs.LG', 'math.DS', 'stat.ML']",2017-10-12 01:37:46+00:00
http://arxiv.org/abs/1710.04329v1,Efficient Data-Driven Geologic Feature Detection from Pre-stack Seismic Measurements using Randomized Machine-Learning Algorithm,"Conventional seismic techniques for detecting the subsurface geologic
features are challenged by limited data coverage, computational inefficiency,
and subjective human factors. We developed a novel data-driven geological
feature detection approach based on pre-stack seismic measurements. Our
detection method employs an efficient and accurate machine-learning detection
approach to extract useful subsurface geologic features automatically.
Specifically, our method is based on kernel ridge regression model. The
conventional kernel ridge regression can be computationally prohibited because
of the large volume of seismic measurements. We employ a data reduction
technique in combination with the conventional kernel ridge regression method
to improve the computational efficiency and reduce memory usage. In particular,
we utilize a randomized numerical linear algebra technique, named Nystr\""om
method, to effectively reduce the dimensionality of the feature space without
compromising the information content required for accurate detection. We
provide thorough computational cost analysis to show efficiency of our new
geological feature detection methods. We further validate the performance of
our new subsurface geologic feature detection method using synthetic surface
seismic data for 2D acoustic and elastic velocity models. Our numerical
examples demonstrate that our new detection method significantly improves the
computational efficiency while maintaining comparable accuracy. Interestingly,
we show that our method yields a speed-up ratio on the order of $\sim10^2$ to
$\sim 10^3$ in a multi-core computational environment.","['Youzuo Lin', 'Shusen Wang', 'Jayaraman Thiagarajan', 'George Guthrie', 'David Coblentz']","['cs.LG', 'stat.ML']",2017-10-11 23:04:49+00:00
http://arxiv.org/abs/1710.04328v1,What Would a Graph Look Like in This Layout? A Machine Learning Approach to Large Graph Visualization,"Using different methods for laying out a graph can lead to very different
visual appearances, with which the viewer perceives different information.
Selecting a ""good"" layout method is thus important for visualizing a graph. The
selection can be highly subjective and dependent on the given task. A common
approach to selecting a good layout is to use aesthetic criteria and visual
inspection. However, fully calculating various layouts and their associated
aesthetic metrics is computationally expensive. In this paper, we present a
machine learning approach to large graph visualization based on computing the
topological similarity of graphs using graph kernels. For a given graph, our
approach can show what the graph would look like in different layouts and
estimate their corresponding aesthetic metrics. An important contribution of
our work is the development of a new framework to design graph kernels. Our
experimental study shows that our estimation calculation is considerably faster
than computing the actual layouts and their aesthetic metrics. Also, our graph
kernels outperform the state-of-the-art ones in both time and accuracy. In
addition, we conducted a user study to demonstrate that the topological
similarity computed with our graph kernel matches perceptual similarity
assessed by human users.","['Oh-Hyun Kwon', 'Tarik Crnovrsanin', 'Kwan-Liu Ma']","['cs.SI', 'cs.CG', 'cs.GR', 'stat.ML']",2017-10-11 23:00:14+00:00
