id,title,abstract,authors,categories,date
http://arxiv.org/abs/1911.01915v1,Scalable Variational Gaussian Processes for Crowdsourcing: Glitch Detection in LIGO,"In the last years, crowdsourcing is transforming the way classification
training sets are obtained. Instead of relying on a single expert annotator,
crowdsourcing shares the labelling effort among a large number of
collaborators. For instance, this is being applied to the data acquired by the
laureate Laser Interferometer Gravitational Waves Observatory (LIGO), in order
to detect glitches which might hinder the identification of true
gravitational-waves. The crowdsourcing scenario poses new challenging
difficulties, as it deals with different opinions from a heterogeneous group of
annotators with unknown degrees of expertise. Probabilistic methods, such as
Gaussian Processes (GP), have proven successful in modeling this setting.
However, GPs do not scale well to large data sets, which hampers their broad
adoption in real practice (in particular at LIGO). This has led to the recent
introduction of deep learning based crowdsourcing methods, which have become
the state-of-the-art. However, the accurate uncertainty quantification of GPs
has been partially sacrificed. This is an important aspect for astrophysicists
in LIGO, since a glitch detection system should provide very accurate
probability distributions of its predictions. In this work, we leverage the
most popular sparse GP approximation to develop a novel GP based crowdsourcing
method that factorizes into mini-batches. This makes it able to cope with
previously-prohibitive data sets. The approach, which we refer to as Scalable
Variational Gaussian Processes for Crowdsourcing (SVGPCR), brings back GP-based
methods to the state-of-the-art, and excels at uncertainty quantification.
SVGPCR is shown to outperform deep learning based methods and previous
probabilistic approaches when applied to the LIGO data. Moreover, its behavior
and main properties are carefully analyzed in a controlled experiment based on
the MNIST data set.","['Pablo Morales-Álvarez', 'Pablo Ruiz', 'Scott Coughlin', 'Rafael Molina', 'Aggelos K. Katsaggelos']","['cs.LG', 'cs.CV', 'gr-qc', 'stat.ML']",2019-11-05 16:20:38+00:00
http://arxiv.org/abs/1911.01914v1,A Comparative Analysis of XGBoost,"XGBoost is a scalable ensemble technique based on gradient boosting that has
demonstrated to be a reliable and efficient machine learning challenge solver.
This work proposes a practical analysis of how this novel technique works in
terms of training speed, generalization performance and parameter setup. In
addition, a comprehensive comparison between XGBoost, random forests and
gradient boosting has been performed using carefully tuned models as well as
using the default settings. The results of this comparison may indicate that
XGBoost is not necessarily the best choice under all circumstances. Finally an
extensive analysis of XGBoost parametrization tuning process is carried out.","['Candice Bentéjac', 'Anna Csörgő', 'Gonzalo Martínez-Muñoz']","['cs.LG', 'stat.ML']",2019-11-05 16:18:29+00:00
http://arxiv.org/abs/1911.01894v1,"A Rule for Gradient Estimator Selection, with an Application to Variational Inference","Stochastic gradient descent (SGD) is the workhorse of modern machine
learning. Sometimes, there are many different potential gradient estimators
that can be used. When so, choosing the one with the best tradeoff between cost
and variance is important. This paper analyzes the convergence rates of SGD as
a function of time, rather than iterations. This results in a simple rule to
select the estimator that leads to the best optimization convergence guarantee.
This choice is the same for different variants of SGD, and with different
assumptions about the objective (e.g. convexity or smoothness). Inspired by
this principle, we propose a technique to automatically select an estimator
when a finite pool of estimators is given. Then, we extend to infinite pools of
estimators, where each one is indexed by control variate weights. This is
enabled by a reduction to a mixed-integer quadratic program. Empirically,
automatically choosing an estimator performs comparably to the best estimator
chosen with hindsight.","['Tomas Geffner', 'Justin Domke']","['cs.LG', 'stat.ML', '68T99']",2019-11-05 15:57:19+00:00
http://arxiv.org/abs/1911.01877v1,Out of distribution detection for intra-operative functional imaging,"Multispectral optical imaging is becoming a key tool in the operating room.
Recent research has shown that machine learning algorithms can be used to
convert pixel-wise reflectance measurements to tissue parameters, such as
oxygenation. However, the accuracy of these algorithms can only be guaranteed
if the spectra acquired during surgery match the ones seen during training. It
is therefore of great interest to detect so-called out of distribution (OoD)
spectra to prevent the algorithm from presenting spurious results. In this
paper we present an information theory based approach to OoD detection based on
the widely applicable information criterion (WAIC). Our work builds upon recent
methodology related to invertible neural networks (INN). Specifically, we make
use of an ensemble of INNs as we need their tractable Jacobians in order to
compute the WAIC. Comprehensive experiments with in silico, and in vivo
multispectral imaging data indicate that our approach is well-suited for OoD
detection. Our method could thus be an important step towards reliable
functional imaging in the operating room.","['Tim J. Adler', 'Leonardo Ayala', 'Lynton Ardizzone', 'Hannes G. Kenngott', 'Anant Vemuri', 'Beat P. Müller-Stich', 'Carsten Rother', 'Ullrich Köthe', 'Lena Maier-Hein']","['eess.IV', 'cs.LG', 'physics.med-ph', 'stat.ML']",2019-11-05 15:31:29+00:00
http://arxiv.org/abs/1911.01872v1,Interpretability Study on Deep Learning for Jet Physics at the Large Hadron Collider,"Using deep neural networks for identifying physics objects at the Large
Hadron Collider (LHC) has become a powerful alternative approach in recent
years. After successful training of deep neural networks, examining the trained
networks not only helps us understand the behaviour of neural networks, but
also helps improve the performance of deep learning models through proper
interpretation. We take jet tagging problem at the LHC as an example, using
recursive neural networks as a starting point, aim at a thorough understanding
of the behaviour of the physics-oriented DNNs and the information encoded in
the embedding space. We make a comparative study on a series of different jet
tagging tasks dominated by different underlying physics. Interesting
observations on the latent space are obtained.",['Taoli Cheng'],"['hep-ph', 'cs.LG', 'hep-ex', 'stat.ML']",2019-11-05 15:27:30+00:00
http://arxiv.org/abs/1911.01861v2,Biconditional Generative Adversarial Networks for Multiview Learning with Missing Views,"In this paper, we present a conditional GAN with two generators and a common
discriminator for multiview learning problems where observations have two
views, but one of them may be missing for some of the training samples. This is
for example the case for multilingual collections where documents are not
available in all languages. Some studies tackled this problem by assuming the
existence of view generation functions to approximately complete the missing
views; for example Machine Translation to translate documents into the missing
languages. These functions generally require an external resource to be set and
their quality has a direct impact on the performance of the learned multiview
classifier over the completed training set. Our proposed approach addresses
this problem by jointly learning the missing views and the multiview classifier
using a tripartite game with two generators and a discriminator. Each of the
generators is associated to one of the views and tries to fool the
discriminator by generating the other missing view conditionally on the
corresponding observed view. The discriminator then tries to identify if for an
observation, one of its views is completed by one of the generators or if both
views are completed along with its class. Our results on a subset of Reuters
RCV1/RCV2 collections show that the discriminator achieves significant
classification performance; and that the generators learn the missing views
with high quality without the need of any consequent external resource.","['Anastasiia Doinychko', 'Massih-Reza Amini']","['cs.LG', 'stat.ML']",2019-11-05 15:20:06+00:00
http://arxiv.org/abs/1911.01812v1,Enhancing the Privacy of Federated Learning with Sketching,"In response to growing concerns about user privacy, federated learning has
emerged as a promising tool to train statistical models over networks of
devices while keeping data localized. Federated learning methods run training
tasks directly on user devices and do not share the raw user data with third
parties. However, current methods still share model updates, which may contain
private information (e.g., one's weight and height), during the training
process. Existing efforts that aim to improve the privacy of federated learning
make compromises in one or more of the following key areas: performance
(particularly communication cost), accuracy, or privacy. To better optimize
these trade-offs, we propose that \textit{sketching algorithms} have a unique
advantage in that they can provide both privacy and performance benefits while
maintaining accuracy. We evaluate the feasibility of sketching-based federated
learning with a prototype on three representative learning models. Our initial
findings show that it is possible to provide strong privacy guarantees for
federated learning without sacrificing performance or accuracy. Our work
highlights that there exists a fundamental connection between privacy and
communication in distributed settings, and suggests important open problems
surrounding the theoretical understanding, methodology, and system design of
practical, private federated learning.","['Zaoxing Liu', 'Tian Li', 'Virginia Smith', 'Vyas Sekar']","['cs.LG', 'cs.CR', 'cs.NI', 'stat.ML']",2019-11-05 14:38:18+00:00
http://arxiv.org/abs/1911.01738v2,Weakly Supervised Fine Tuning Approach for Brain Tumor Segmentation Problem,"Segmentation of tumors in brain MRI images is a challenging task, where most
recent methods demand large volumes of data with pixel-level annotations, which
are generally costly to obtain. In contrast, image-level annotations, where
only the presence of lesion is marked, are generally cheap, generated in far
larger volumes compared to pixel-level labels, and contain less labeling noise.
In the context of brain tumor segmentation, both pixel-level and image-level
annotations are commonly available; thus, a natural question arises whether a
segmentation procedure could take advantage of both. In the present work we: 1)
propose a learning-based framework that allows simultaneous usage of both
pixel- and image-level annotations in MRI images to learn a segmentation model
for brain tumor; 2) study the influence of comparative amounts of pixel- and
image-level annotations on the quality of brain tumor segmentation; 3) compare
our approach to the traditional fully-supervised approach and show that the
performance of our method in terms of segmentation quality may be competitive.","['Sergey Pavlov', 'Alexey Artemov', 'Maksim Sharaev', 'Alexander Bernstein', 'Evgeny Burnaev']","['eess.IV', 'cs.CV', 'cs.LG', 'stat.ML']",2019-11-05 12:14:40+00:00
http://arxiv.org/abs/1911.01731v3,GraphAIR: Graph Representation Learning with Neighborhood Aggregation and Interaction,"Graph representation learning is of paramount importance for a variety of
graph analytical tasks, ranging from node classification to community
detection. Recently, graph convolutional networks (GCNs) have been successfully
applied for graph representation learning. These GCNs generate node
representation by aggregating features from the neighborhoods, which follows
the ""neighborhood aggregation"" scheme. In spite of having achieved promising
performance on various tasks, existing GCN-based models have difficulty in well
capturing complicated non-linearity of graph data. In this paper, we first
theoretically prove that coefficients of the neighborhood interacting terms are
relatively small in current models, which explains why GCNs barely outperforms
linear models. Then, in order to better capture the complicated non-linearity
of graph data, we present a novel GraphAIR framework which models the
neighborhood interaction in addition to neighborhood aggregation. Comprehensive
experiments conducted on benchmark tasks including node classification and link
prediction using public datasets demonstrate the effectiveness of the proposed
method.","['Fenyu Hu', 'Yanqiao Zhu', 'Shu Wu', 'Weiran Huang', 'Liang Wang', 'Tieniu Tan']","['cs.LG', 'stat.ML']",2019-11-05 11:47:58+00:00
http://arxiv.org/abs/1911.01705v1,A GMM based algorithm to generate point-cloud and its application to neuroimaging,"Recent years have witnessed the emergence of 3D medical imaging techniques
with the development of 3D sensors and technology. Due to the presence of noise
in image acquisition, registration researchers focused on an alternative way to
represent medical images. An alternative way to analyze medical imaging is by
understanding the 3D shapes represented in terms of point-cloud. Though in the
medical imaging community, 3D point-cloud processing is not a ``go-to'' choice,
it is a ``natural'' way to capture 3D shapes. However, as the number of samples
for medical images are small, researchers have used pre-trained models to
fine-tune on medical images. Furthermore, due to different modality in medical
images, standard generative models can not be used to generate new samples of
medical images. In this work, we use the advantage of point-cloud
representation of 3D structures of medical images and propose a Gaussian
mixture model-based generation scheme. Our proposed method is robust to
outliers. Experimental validation has been performed to show that the proposed
scheme can generate new 3D structures using interpolation techniques, i.e.,
given two 3D structures represented as point-clouds, we can generate
point-clouds in between. We have also generated new point-clouds for subjects
with and without dementia and show that the generated samples are indeed
closely matched to the respective training samples from the same class.","['Liu Yang', 'Rudrasis Chakraborty']","['cs.LG', 'eess.IV', 'stat.ML']",2019-11-05 10:54:53+00:00
http://arxiv.org/abs/1911.03443v1,"An ""augmentation-free"" rotation invariant classification scheme on point-cloud and its application to neuroimaging","Recent years have witnessed the emergence and increasing popularity of 3D
medical imaging techniques with the development of 3D sensors and technology.
However, achieving geometric invariance in the processing of 3D medical images
is computationally expensive but nonetheless essential due to the presence of
possible errors caused by rigid registration techniques. An alternative way to
analyze medical imaging is by understanding the 3D shapes represented in terms
of point-cloud. Though in the medical imaging community, 3D point-cloud
processing is not a ""go-to"" choice, it is a canonical way to preserve rotation
invariance. Unfortunately, due to the presence of discrete topology, one can
not use the standard convolution operator on point-cloud. To the best of our
knowledge, the existing ways to do ""convolution"" can not preserve the rotation
invariance without explicit data augmentation. Therefore, we propose a rotation
invariant convolution operator by inducing topology from hypersphere.
Experimental validation has been performed on publicly available OASIS dataset
in terms of classification accuracy between subjects with (without) dementia,
demonstrating the usefulness of our proposed method in terms of model
complexity, classification accuracy, and last but most important invariance to
rotations.","['Liu Yang', 'Rudrasis Chakraborty']","['eess.IV', 'cs.CV', 'cs.LG', 'stat.ML']",2019-11-05 10:45:56+00:00
http://arxiv.org/abs/1911.01702v2,DocParser: Hierarchical Structure Parsing of Document Renderings,"Translating renderings (e. g. PDFs, scans) into hierarchical document
structures is extensively demanded in the daily routines of many real-world
applications. However, a holistic, principled approach to inferring the
complete hierarchical structure of documents is missing. As a remedy, we
developed ""DocParser"": an end-to-end system for parsing the complete document
structure - including all text elements, nested figures, tables, and table cell
structures. Our second contribution is to provide a dataset for evaluating
hierarchical document structure parsing. Our third contribution is to propose a
scalable learning framework for settings where domain-specific data are scarce,
which we address by a novel approach to weak supervision that significantly
improves the document structure parsing performance. Our experiments confirm
the effectiveness of our proposed weak supervision: Compared to the baseline
without weak supervision, it improves the mean average precision for detecting
document entities by 39.1 % and improves the F1 score of classifying
hierarchical relations by 35.8 %.","['Johannes Rausch', 'Octavio Martinez', 'Fabian Bissig', 'Ce Zhang', 'Stefan Feuerriegel']","['cs.LG', 'cs.CL', 'cs.CV', 'stat.ML']",2019-11-05 10:42:08+00:00
http://arxiv.org/abs/1911.01700v1,Deep Hedging: Learning to Simulate Equity Option Markets,"We construct realistic equity option market simulators based on generative
adversarial networks (GANs). We consider recurrent and temporal convolutional
architectures, and assess the impact of state compression. Option market
simulators are highly relevant because they allow us to extend the limited
real-world data sets available for the training and evaluation of option
trading strategies. We show that network-based generators outperform classical
methods on a range of benchmark metrics, and adversarial training achieves the
best performance. Our work demonstrates for the first time that GANs can be
successfully applied to the task of generating multivariate financial time
series.","['Magnus Wiese', 'Lianjun Bai', 'Ben Wood', 'Hans Buehler']","['q-fin.CP', 'cs.LG', 'q-fin.MF', 'q-fin.ST', 'stat.ML']",2019-11-05 10:23:39+00:00
http://arxiv.org/abs/1911.01695v2,Towards Optimal and Efficient Best Arm Identification in Linear Bandits,"We give a new algorithm for best arm identification in linearly parameterised
bandits in the fixed confidence setting. The algorithm generalises the
well-known LUCB algorithm of Kalyanakrishnan et al. (2012) by playing an arm
which minimises a suitable notion of geometric overlap of the statistical
confidence set for the unknown parameter, and is fully adaptive and
computationally efficient as compared to several state-of-the methods. We
theoretically analyse the sample complexity of the algorithm for problems with
two and three arms, showing optimality in many cases. Numerical results
indicate favourable performance over other algorithms with which we compare.","['Mohammadi Zaki', 'Avinash Mohan', 'Aditya Gopalan']","['cs.LG', 'math.OC', 'stat.ML']",2019-11-05 10:11:49+00:00
http://arxiv.org/abs/1911.01694v1,Bounds for the Number of Tests in Non-Adaptive Randomized Algorithms for Group Testing,"We study the group testing problem with non-adaptive randomized algorithms.
Several models have been discussed in the literature to determine how to
randomly choose the tests. For a model ${\cal M}$, let $m_{\cal M}(n,d)$ be the
minimum number of tests required to detect at most $d$ defectives within $n$
items, with success probability at least $1-\delta$, for some constant
$\delta$. In this paper, we study the measures $$c_{\cal M}(d)=\lim_{n\to
\infty} \frac{m_{\cal M}(n,d)}{\ln n} \mbox{ and } c_{\cal M}=\lim_{d\to
\infty} \frac{c_{\cal M}(d)}{d}.$$
  In the literature, the analyses of such models only give upper bounds for
$c_{\cal M}(d)$ and $c_{\cal M}$, and for some of them, the bounds are not
tight. We give new analyses that yield tight bounds for $c_{\cal M}(d)$ and
$c_{\cal M}$ for all the known models~${\cal M}$.","['Nader H. Bshouty', 'George Haddad', 'Catherine A. Haddad-Zaknoon']","['cs.LG', 'math.ST', 'stat.ML', 'stat.TH']",2019-11-05 10:09:28+00:00
http://arxiv.org/abs/1911.04227v3,Cumulo: A Dataset for Learning Cloud Classes,"One of the greatest sources of uncertainty in future climate projections
comes from limitations in modelling clouds and in understanding how different
cloud types interact with the climate system. A key first step in reducing this
uncertainty is to accurately classify cloud types at high spatial and temporal
resolution. In this paper, we introduce Cumulo, a benchmark dataset for
training and evaluating global cloud classification models. It consists of one
year of 1km resolution MODIS hyperspectral imagery merged with pixel-width
'tracks' of CloudSat cloud labels. Bringing these complementary datasets
together is a crucial first step, enabling the Machine-Learning community to
develop innovative new techniques which could greatly benefit the Climate
community. To showcase Cumulo, we provide baseline performance analysis using
an invertible flow generative model (IResNet), which further allows us to
discover new sub-classes for a given cloud class by exploring the latent space.
To compare methods, we introduce a set of evaluation criteria, to identify
models that are not only accurate, but also physically-realistic. CUMULO can be
download from
https://www.dropbox.com/sh/i3s9q2v2jjyk2it/AACxXnXfMF5wuIqLXqH4NJOra?dl=0 .","['Valentina Zantedeschi', 'Fabrizio Falasca', 'Alyson Douglas', 'Richard Strange', 'Matt J. Kusner', 'Duncan Watson-Parris']","['physics.ao-ph', 'cs.CV', 'cs.LG', 'stat.ML']",2019-11-05 09:36:16+00:00
http://arxiv.org/abs/1911.01679v2,Apprenticeship Learning via Frank-Wolfe,"We consider the applications of the Frank-Wolfe (FW) algorithm for
Apprenticeship Learning (AL). In this setting, we are given a Markov Decision
Process (MDP) without an explicit reward function. Instead, we observe an
expert that acts according to some policy, and the goal is to find a policy
whose feature expectations are closest to those of the expert policy. We
formulate this problem as finding the projection of the feature expectations of
the expert on the feature expectations polytope -- the convex hull of the
feature expectations of all the deterministic policies in the MDP. We show that
this formulation is equivalent to the AL objective and that solving this
problem using the FW algorithm is equivalent well-known Projection method of
Abbeel and Ng (2004). This insight allows us to analyze AL with tools from
convex optimization literature and derive tighter convergence bounds on AL.
Specifically, we show that a variation of the FW method that is based on taking
""away steps"" achieves a linear rate of convergence when applied to AL and that
a stochastic version of the FW algorithm can be used to avoid precise
estimation of feature expectations. We also experimentally show that this
version outperforms the FW baseline. To the best of our knowledge, this is the
first work that shows linear convergence rates for AL.","['Tom Zahavy', 'Alon Cohen', 'Haim Kaplan', 'Yishay Mansour']","['cs.LG', 'stat.ML']",2019-11-05 09:26:06+00:00
http://arxiv.org/abs/1911.01658v1,Joint Ranking SVM and Binary Relevance with Robust Low-Rank Learning for Multi-Label Classification,"Multi-label classification studies the task where each example belongs to
multiple labels simultaneously. As a representative method, Ranking Support
Vector Machine (Rank-SVM) aims to minimize the Ranking Loss and can also
mitigate the negative influence of the class-imbalance issue. However, due to
its stacking-style way for thresholding, it may suffer error accumulation and
thus reduces the final classification performance. Binary Relevance (BR) is
another typical method, which aims to minimize the Hamming Loss and only needs
one-step learning. Nevertheless, it might have the class-imbalance issue and
does not take into account label correlations. To address the above issues, we
propose a novel multi-label classification model, which joints Ranking support
vector machine and Binary Relevance with robust Low-rank learning (RBRL). RBRL
inherits the ranking loss minimization advantages of Rank-SVM, and thus
overcomes the disadvantages of BR suffering the class-imbalance issue and
ignoring the label correlations. Meanwhile, it utilizes the hamming loss
minimization and one-step learning advantages of BR, and thus tackles the
disadvantages of Rank-SVM including another thresholding learning step.
Besides, a low-rank constraint is utilized to further exploit high-order label
correlations under the assumption of low dimensional label space. Furthermore,
to achieve nonlinear multi-label classifiers, we derive the kernelization RBRL.
Two accelerated proximal gradient methods (APG) are used to solve the
optimization problems efficiently. Extensive comparative experiments with
several state-of-the-art methods illustrate a highly competitive or superior
performance of our method RBRL.","['Guoqiang Wu', 'Ruobing Zheng', 'Yingjie Tian', 'Dalian Liu']","['cs.LG', 'stat.ML']",2019-11-05 07:50:36+00:00
