id,title,abstract,authors,categories,date
http://arxiv.org/abs/1801.04212v2,Multinomial logistic model for coinfection diagnosis between arbovirus and malaria in Kedougou,"In tropical regions, populations continue to suffer morbidity and mortality
from malaria and arboviral diseases. In Kedougou (Senegal), these illnesses are
all endemic due to the climate and its geographical position. The
co-circulation of malaria parasites and arboviruses can explain the observation
of coinfected cases. Indeed there is strong resemblance in symptoms between
these diseases making problematic targeted medical care of coinfected cases.
This is due to the fact that the origin of illness is not obviously known. Some
cases could be immunized against one or the other of the pathogens, immunity
typically acquired with factors like age and exposure as usual for endemic
area. Then, coinfection needs to be better diagnosed. Using data collected from
patients in Kedougou region, from 2009 to 2013, we adjusted a multinomial
logistic model and selected relevant variables in explaining coinfection
status. We observed specific sets of variables explaining each of the diseases
exclusively and the coinfection. We tested the independence between arboviral
and malaria infections and derived coinfection probabilities from the model
fitting. In case of a coinfection probability greater than a threshold value to
be calibrated on the data, duration of illness above 3 days and age above 10
years-old are mostly indicative of arboviral disease while body temperature
higher than 40{\textdegree}C and presence of nausea or vomiting symptoms during
the rainy season are mostly indicative of malaria disease.","['Mor Absa Loum', 'Marie-Anne Poursat', 'Abdourahmane Sow', 'Amadou Sall', 'Cheikh Loucoubar', 'Elisabeth Gassiat']","['stat.AP', 'math.ST', 'stat.ML', 'stat.TH']",2018-01-12 16:05:56+00:00
http://arxiv.org/abs/1801.04211v2,Towards Arbitrary Noise Augmentation - Deep Learning for Sampling from Arbitrary Probability Distributions,"Accurate noise modelling is important for training of deep learning
reconstruction algorithms. While noise models are well known for traditional
imaging techniques, the noise distribution of a novel sensor may be difficult
to determine a priori. Therefore, we propose learning arbitrary noise
distributions. To do so, this paper proposes a fully connected neural network
model to map samples from a uniform distribution to samples of any explicitly
known probability density function. During the training, the Jensen-Shannon
divergence between the distribution of the model's output and the target
distribution is minimized. We experimentally demonstrate that our model
converges towards the desired state. It provides an alternative to existing
sampling methods such as inversion sampling, rejection sampling, Gaussian
mixture models and Markov-Chain-Monte-Carlo. Our model has high sampling
efficiency and is easily applied to any probability distribution, without the
need of further analytical or numerical calculations.","['Felix Horger', 'Tobias Würfl', 'Vincent Christlein', 'Andreas Maier']","['cs.LG', 'stat.ML']",2018-01-12 16:03:21+00:00
http://arxiv.org/abs/1801.04159v2,Can Who-Edits-What Predict Edit Survival?,"As the number of contributors to online peer-production systems grows, it
becomes increasingly important to predict whether the edits that users make
will eventually be beneficial to the project. Existing solutions either rely on
a user reputation system or consist of a highly specialized predictor that is
tailored to a specific peer-production system. In this work, we explore a
different point in the solution space that goes beyond user reputation but does
not involve any content-based feature of the edits. We view each edit as a game
between the editor and the component of the project. We posit that the
probability that an edit is accepted is a function of the editor's skill, of
the difficulty of editing the component and of a user-component interaction
term. Our model is broadly applicable, as it only requires observing data about
who makes an edit, what the edit affects and whether the edit survives or not.
We apply our model on Wikipedia and the Linux kernel, two examples of
large-scale peer-production systems, and we seek to understand whether it can
effectively predict edit survival: in both cases, we provide a positive answer.
Our approach significantly outperforms those based solely on user reputation
and bridges the gap with specialized predictors that use content-based
features. It is simple to implement, computationally inexpensive, and in
addition it enables us to discover interesting structure in the data.","['Ali Batuhan Yardım', 'Victor Kristof', 'Lucas Maystre', 'Matthias Grossglauser']","['stat.AP', 'cs.SI', 'stat.ML']",2018-01-12 13:26:57+00:00
http://arxiv.org/abs/1801.04153v7,Bayesian Quadrature for Multiple Related Integrals,"Bayesian probabilistic numerical methods are a set of tools providing
posterior distributions on the output of numerical methods. The use of these
methods is usually motivated by the fact that they can represent our
uncertainty due to incomplete/finite information about the continuous
mathematical problem being approximated. In this paper, we demonstrate that
this paradigm can provide additional advantages, such as the possibility of
transferring information between several numerical methods. This allows users
to represent uncertainty in a more faithful manner and, as a by-product,
provide increased numerical efficiency. We propose the first such numerical
method by extending the well-known Bayesian quadrature algorithm to the case
where we are interested in computing the integral of several related functions.
We then prove convergence rates for the method in the well-specified and
misspecified cases, and demonstrate its efficiency in the context of
multi-fidelity models for complex engineering systems and a problem of global
illumination in computer graphics.","['Xiaoyue Xi', 'François-Xavier Briol', 'Mark Girolami']","['stat.CO', 'cs.NA', 'math.NA', 'stat.ML']",2018-01-12 12:49:32+00:00
http://arxiv.org/abs/1801.04140v1,Cosmic String Detection with Tree-Based Machine Learning,"We explore the use of random forest and gradient boosting, two powerful
tree-based machine learning algorithms, for the detection of cosmic strings in
maps of the cosmic microwave background (CMB), through their unique
Gott-Kaiser-Stebbins effect on the temperature anisotropies.The information in
the maps is compressed into feature vectors before being passed to the learning
units. The feature vectors contain various statistical measures of processed
CMB maps that boost the cosmic string detectability. Our proposed classifiers,
after training, give results improved over or similar to the claimed
detectability levels of the existing methods for string tension, $G\mu$. They
can make $3\sigma$ detection of strings with $G\mu \gtrsim 2.1\times 10^{-10}$
for noise-free, $0.9'$-resolution CMB observations. The minimum detectable
tension increases to $G\mu \gtrsim 3.0\times 10^{-8}$ for a more realistic, CMB
S4-like (II) strategy, still a significant improvement over the previous
results.","['A. Vafaei Sadr', 'M. Farhang', 'S. M. S. Movahed', 'B. Bassett', 'M. Kunz']","['astro-ph.CO', 'astro-ph.IM', 'physics.data-an', 'stat.ML']",2018-01-12 11:57:22+00:00
http://arxiv.org/abs/1801.04062v5,MINE: Mutual Information Neural Estimation,"We argue that the estimation of mutual information between high dimensional
continuous random variables can be achieved by gradient descent over neural
networks. We present a Mutual Information Neural Estimator (MINE) that is
linearly scalable in dimensionality as well as in sample size, trainable
through back-prop, and strongly consistent. We present a handful of
applications on which MINE can be used to minimize or maximize mutual
information. We apply MINE to improve adversarially trained generative models.
We also use MINE to implement Information Bottleneck, applying it to supervised
classification; our results demonstrate substantial improvement in flexibility
and performance in these settings.","['Mohamed Ishmael Belghazi', 'Aristide Baratin', 'Sai Rajeswar', 'Sherjil Ozair', 'Yoshua Bengio', 'Aaron Courville', 'R Devon Hjelm']","['cs.LG', 'stat.ML']",2018-01-12 05:42:58+00:00
http://arxiv.org/abs/1801.04055v1,A3T: Adversarially Augmented Adversarial Training,"Recent research showed that deep neural networks are highly sensitive to
so-called adversarial perturbations, which are tiny perturbations of the input
data purposely designed to fool a machine learning classifier. Most
classification models, including deep learning models, are highly vulnerable to
adversarial attacks. In this work, we investigate a procedure to improve
adversarial robustness of deep neural networks through enforcing representation
invariance. The idea is to train the classifier jointly with a discriminator
attached to one of its hidden layer and trained to filter the adversarial
noise. We perform preliminary experiments to test the viability of the approach
and to compare it to other standard adversarial training methods.","['Akram Erraqabi', 'Aristide Baratin', 'Yoshua Bengio', 'Simon Lacoste-Julien']","['cs.LG', 'stat.ML']",2018-01-12 04:34:17+00:00
http://arxiv.org/abs/1801.04053v1,Noisy Expectation-Maximization: Applications and Generalizations,"We present a noise-injected version of the Expectation-Maximization (EM)
algorithm: the Noisy Expectation Maximization (NEM) algorithm. The NEM
algorithm uses noise to speed up the convergence of the EM algorithm. The NEM
theorem shows that injected noise speeds up the average convergence of the EM
algorithm to a local maximum of the likelihood surface if a positivity
condition holds. The generalized form of the noisy expectation-maximization
(NEM) algorithm allow for arbitrary modes of noise injection including adding
and multiplying noise to the data.
  We demonstrate these noise benefits on EM algorithms for the Gaussian mixture
model (GMM) with both additive and multiplicative NEM noise injection. A
separate theorem (not presented here) shows that the noise benefit for
independent identically distributed additive noise decreases with sample size
in mixture models. This theorem implies that the noise benefit is most
pronounced if the data is sparse. Injecting blind noise only slowed
convergence.","['Osonde Osoba', 'Bart Kosko']","['stat.ML', 'cs.LG']",2018-01-12 04:09:48+00:00
http://arxiv.org/abs/1801.04016v1,Theoretical Impediments to Machine Learning With Seven Sparks from the Causal Revolution,"Current machine learning systems operate, almost exclusively, in a
statistical, or model-free mode, which entails severe theoretical limits on
their power and performance. Such systems cannot reason about interventions and
retrospection and, therefore, cannot serve as the basis for strong AI. To
achieve human level intelligence, learning machines need the guidance of a
model of reality, similar to the ones used in causal inference tasks. To
demonstrate the essential role of such models, I will present a summary of
seven tasks which are beyond reach of current machine learning systems and
which have been accomplished using the tools of causal modeling.",['Judea Pearl'],"['cs.LG', 'cs.AI', 'stat.ML']",2018-01-11 23:37:48+00:00
http://arxiv.org/abs/1801.03911v2,Stochastic Learning of Nonstationary Kernels for Natural Language Modeling,"Natural language processing often involves computations with semantic or
syntactic graphs to facilitate sophisticated reasoning based on structural
relationships. While convolution kernels provide a powerful tool for comparing
graph structure based on node (word) level relationships, they are difficult to
customize and can be computationally expensive. We propose a generalization of
convolution kernels, with a nonstationary model, for better expressibility of
natural languages in supervised settings. For a scalable learning of the
parameters introduced with our model, we propose a novel algorithm that
leverages stochastic sampling on k-nearest neighbor graphs, along with
approximations based on locality-sensitive hashing. We demonstrate the
advantages of our approach on a challenging real-world (structured inference)
problem of automatically extracting biological models from the text of
scientific papers.","['Sahil Garg', 'Greg Ver Steeg', 'Aram Galstyan']","['cs.CL', 'cs.IR', 'cs.LG', 'stat.ML']",2018-01-11 18:24:02+00:00
http://arxiv.org/abs/1801.03851v3,Autoencoders and Probabilistic Inference with Missing Data: An Exact Solution for The Factor Analysis Case,"Latent variable models can be used to probabilistically ""fill-in"" missing
data entries. The variational autoencoder architecture (Kingma and Welling,
2014; Rezende et al., 2014) includes a ""recognition"" or ""encoder"" network that
infers the latent variables given the data variables. However, it is not clear
how to handle missing data variables in this network. The factor analysis (FA)
model is a basic autoencoder, using linear encoder and decoder networks. We
show how to calculate exactly the latent posterior distribution for the factor
analysis (FA) model in the presence of missing data, and note that this
solution implies that a different encoder network is required for each pattern
of missingness. We also discuss various approximations to the exact solution.
Experiments compare the effectiveness of various approaches to filling in the
missing data.","['Christopher K. I. Williams', 'Charlie Nash', 'Alfredo Nazábal']","['cs.LG', 'stat.ML']",2018-01-11 16:22:07+00:00
http://arxiv.org/abs/1801.03765v2,Non-stationary Douglas-Rachford and alternating direction method of multipliers: adaptive stepsizes and convergence,"We revisit the classical Douglas-Rachford (DR) method for finding a zero of
the sum of two maximal monotone operators. Since the practical performance of
the DR method crucially depends on the stepsizes, we aim at developing an
adaptive stepsize rule. To that end, we take a closer look at a linear case of
the problem and use our findings to develop a stepsize strategy that eliminates
the need for stepsize tuning. We analyze a general non-stationary DR scheme and
prove its convergence for a convergent sequence of stepsizes with summable
increments. This, in turn, proves the convergence of the method with the new
adaptive stepsize rule. We also derive the related non-stationary alternating
direction method of multipliers (ADMM) from such a non-stationary DR method. We
illustrate the efficiency of the proposed methods on several numerical
examples.","['Dirk A. Lorenz', 'Quoc Tran-Dinh']","['math.OC', 'math.NA', 'stat.ML', '90C25, 65K05, 65J15, 47H05']",2018-01-11 14:13:16+00:00
http://arxiv.org/abs/1801.03749v3,Improved asynchronous parallel optimization analysis for stochastic incremental methods,"As datasets continue to increase in size and multi-core computer
architectures are developed, asynchronous parallel optimization algorithms
become more and more essential to the field of Machine Learning. Unfortunately,
conducting the theoretical analysis asynchronous methods is difficult, notably
due to the introduction of delay and inconsistency in inherently sequential
algorithms. Handling these issues often requires resorting to simplifying but
unrealistic assumptions. Through a novel perspective, we revisit and clarify a
subtle but important technical issue present in a large fraction of the recent
convergence rate proofs for asynchronous parallel optimization algorithms, and
propose a simplification of the recently introduced ""perturbed iterate""
framework that resolves it. We demonstrate the usefulness of our new framework
by analyzing three distinct asynchronous parallel incremental optimization
algorithms: Hogwild (asynchronous SGD), KROMAGNON (asynchronous SVRG) and
ASAGA, a novel asynchronous parallel version of the incremental gradient
algorithm SAGA that enjoys fast linear convergence rates. We are able to both
remove problematic assumptions and obtain better theoretical results. Notably,
we prove that ASAGA and KROMAGNON can obtain a theoretical linear speedup on
multi-core systems even without sparsity assumptions. We present results of an
implementation on a 40-core architecture illustrating the practical speedups as
well as the hardware overhead. Finally, we investigate the overlap constant, an
ill-understood but central quantity for the theoretical analysis of
asynchronous parallel algorithms. We find that it encompasses much more
complexity than suggested in previous work, and often is order-of-magnitude
bigger than traditionally thought.","['Rémi Leblond', 'Fabian Pedregosa', 'Simon Lacoste-Julien']","['math.OC', 'cs.LG', 'stat.ML']",2018-01-11 13:31:33+00:00
http://arxiv.org/abs/1801.03744v3,Which Neural Net Architectures Give Rise To Exploding and Vanishing Gradients?,"We give a rigorous analysis of the statistical behavior of gradients in a
randomly initialized fully connected network N with ReLU activations. Our
results show that the empirical variance of the squares of the entries in the
input-output Jacobian of N is exponential in a simple architecture-dependent
constant beta, given by the sum of the reciprocals of the hidden layer widths.
When beta is large, the gradients computed by N at initialization vary wildly.
Our approach complements the mean field theory analysis of random networks.
From this point of view, we rigorously compute finite width corrections to the
statistics of gradients at the edge of chaos.",['Boris Hanin'],"['stat.ML', 'cs.LG', 'math.PR', 'math.ST', 'stat.TH']",2018-01-11 13:17:22+00:00
http://arxiv.org/abs/1801.03714v1,Multi-Band Covariance Interpolation with Applications in Massive MIMO,"In this paper, we study the problem of multi-band (frequency-variant)
covariance interpolation with a particular emphasis towards massive MIMO
applications. In a massive MIMO system, the communication between each BS with
$M \gg 1$ antennas and each single-antenna user occurs through a collection of
scatterers in the environment, where the channel vector of each user at BS
antennas consists in a weighted linear combination of the array responses of
the scatterers, where each scatterer has its own angle of arrival (AoA) and
complex channel gain. The array response at a given AoA depends on the
wavelength of the incoming planar wave and is naturally frequency dependent.
This results in a frequency-dependent distortion where the second order
statistics, i.e., the covariance matrix, of the channel vectors varies with
frequency. In this paper, we show that although this effect is generally
negligible for a small number of antennas $M$, it results in a considerable
distortion of the covariance matrix and especially its dominant signal subspace
in the massive MIMO regime where $M \to \infty$, and can generally incur a
serious degradation of the performance especially in frequency division
duplexing (FDD) massive MIMO systems where the uplink (UL) and the downlink
(DL) communication occur over different frequency bands. We propose a novel
UL-DL covariance interpolation technique that is able to recover the covariance
matrix in the DL from an estimate of the covariance matrix in the UL under a
mild reciprocity condition on the angular power spread function (PSF) of the
users. We analyze the performance of our proposed scheme mathematically and
prove its robustness under a sufficiently large spatial oversampling of the
array. We also propose several simple off-the-shelf algorithms for UL-DL
covariance interpolation and evaluate their performance via numerical
simulations.","['Saeid Haghighatshoar', 'Mahdi Barzegar Khalilsarai', 'Giuseppe Caire']","['cs.IT', 'math.IT', 'stat.ML']",2018-01-11 11:21:03+00:00
http://arxiv.org/abs/1801.05856v2,Active Community Detection with Maximal Expected Model Change,"We present a novel active learning algorithm for community detection on
networks. Our proposed algorithm uses a Maximal Expected Model Change (MEMC)
criterion for querying network nodes label assignments. MEMC detects nodes that
maximally change the community assignment likelihood model following a query.
Our method is inspired by detection in the benchmark Stochastic Block Model
(SBM), where we provide sample complexity analysis and empirical study with SBM
and real network data for binary as well as for the multi-class settings. The
analysis also covers the most challenging case of sparse degree and
below-detection-threshold SBMs, where we observe a super-linear error
reduction. MEMC is shown to be superior to the random selection baseline and
other state-of-the-art active learners.","['Dan Kushnir', 'Benjamin Mirabelli']","['cs.SI', 'cs.LG', 'stat.ML']",2018-01-11 03:26:16+00:00
http://arxiv.org/abs/1801.03558v3,Inference Suboptimality in Variational Autoencoders,"Amortized inference allows latent-variable models trained via variational
learning to scale to large datasets. The quality of approximate inference is
determined by two factors: a) the capacity of the variational distribution to
match the true posterior and b) the ability of the recognition network to
produce good variational parameters for each datapoint. We examine approximate
inference in variational autoencoders in terms of these factors. We find that
divergence from the true posterior is often due to imperfect recognition
networks, rather than the limited complexity of the approximating distribution.
We show that this is due partly to the generator learning to accommodate the
choice of approximation. Furthermore, we show that the parameters used to
increase the expressiveness of the approximation play a role in generalizing
inference rather than simply improving the complexity of the approximation.","['Chris Cremer', 'Xuechen Li', 'David Duvenaud']","['cs.LG', 'stat.ML']",2018-01-10 21:24:59+00:00
http://arxiv.org/abs/1801.03454v2,Net2Vec: Quantifying and Explaining how Concepts are Encoded by Filters in Deep Neural Networks,"In an effort to understand the meaning of the intermediate representations
captured by deep networks, recent papers have tried to associate specific
semantic concepts to individual neural network filter responses, where
interesting correlations are often found, largely by focusing on extremal
filter responses. In this paper, we show that this approach can favor
easy-to-interpret cases that are not necessarily representative of the average
behavior of a representation.
  A more realistic but harder-to-study hypothesis is that semantic
representations are distributed, and thus filters must be studied in
conjunction. In order to investigate this idea while enabling systematic
visualization and quantification of multiple filter responses, we introduce the
Net2Vec framework, in which semantic concepts are mapped to vectorial
embeddings based on corresponding filter responses. By studying such
embeddings, we are able to show that 1., in most cases, multiple filters are
required to code for a concept, that 2., often filters are not concept specific
and help encode multiple concepts, and that 3., compared to single filter
activations, filter embeddings are able to better characterize the meaning of a
representation and its relationship to other concepts.","['Ruth Fong', 'Andrea Vedaldi']","['cs.CV', 'cs.AI', 'stat.ML']",2018-01-10 17:01:36+00:00
http://arxiv.org/abs/1801.03437v2,Approximation beats concentration? An approximation view on inference with smooth radial kernels,"Positive definite kernels and their associated Reproducing Kernel Hilbert
Spaces provide a mathematically compelling and practically competitive
framework for learning from data.
  In this paper we take the approximation theory point of view to explore
various aspects of smooth kernels related to their inferential properties. We
analyze eigenvalue decay of kernels operators and matrices, properties of
eigenfunctions/eigenvectors and ""Fourier"" coefficients of functions in the
kernel space restricted to a discrete set of data points. We also investigate
the fitting capacity of kernels, giving explicit bounds on the fat shattering
dimension of the balls in Reproducing Kernel Hilbert spaces. Interestingly, the
same properties that make kernels very effective approximators for functions in
their ""native"" kernel space, also limit their capacity to represent arbitrary
functions. We discuss various implications, including those for gradient
descent type methods.
  It is important to note that most of our bounds are measure independent.
Moreover, at least in moderate dimension, the bounds for eigenvalues are much
tighter than the bounds which can be obtained from the usual matrix
concentration results. For example, we see that the eigenvalues of kernel
matrices show nearly exponential decay with constants depending only on the
kernel and the domain. We call this ""approximation beats concentration""
phenomenon as even when the data are sampled from a probability distribution,
some of their aspects are better understood in terms of approximation theory.",['Mikhail Belkin'],"['cs.LG', 'stat.ML']",2018-01-10 16:13:15+00:00
