id,title,abstract,authors,categories,date
http://arxiv.org/abs/1609.06457v1,AMOS: An Automated Model Order Selection Algorithm for Spectral Graph Clustering,"One of the longstanding problems in spectral graph clustering (SGC) is the
so-called model order selection problem: automated selection of the correct
number of clusters. This is equivalent to the problem of finding the number of
connected components or communities in an undirected graph. In this paper, we
propose AMOS, an automated model order selection algorithm for SGC. Based on a
recent analysis of clustering reliability for SGC under the random
interconnection model, AMOS works by incrementally increasing the number of
clusters, estimating the quality of identified clusters, and providing a series
of clustering reliability tests. Consequently, AMOS outputs clusters of minimal
model order with statistical clustering reliability guarantees. Comparing to
three other automated graph clustering methods on real-world datasets, AMOS
shows superior performance in terms of multiple external and internal
clustering metrics.","['Pin-Yu Chen', 'Thibaut Gensollen', 'Alfred O. Hero III']","['cs.SI', 'cs.LG', 'stat.ML']",2016-09-21 08:14:12+00:00
http://arxiv.org/abs/1609.06390v1,Learning HMMs with Nonparametric Emissions via Spectral Decompositions of Continuous Matrices,"Recently, there has been a surge of interest in using spectral methods for
estimating latent variable models. However, it is usually assumed that the
distribution of the observations conditioned on the latent variables is either
discrete or belongs to a parametric family. In this paper, we study the
estimation of an $m$-state hidden Markov model (HMM) with only smoothness
assumptions, such as H\""olderian conditions, on the emission densities. By
leveraging some recent advances in continuous linear algebra and numerical
analysis, we develop a computationally efficient spectral algorithm for
learning nonparametric HMMs. Our technique is based on computing an SVD on
nonparametric estimates of density functions by viewing them as
\emph{continuous matrices}. We derive sample complexity bounds via
concentration results for nonparametric density estimation and novel
perturbation theory results for continuous matrices. We implement our method
using Chebyshev polynomial approximations. Our method is competitive with other
baselines on synthetic and real problems and is also very computationally
efficient.","['Kirthevasan Kandasamy', 'Maruan Al-Shedivat', 'Eric P. Xing']","['stat.ML', 'cs.LG']",2016-09-21 00:15:44+00:00
http://arxiv.org/abs/1609.06385v1,Multiclass Classification Calibration Functions,"In this paper we refine the process of computing calibration functions for a
number of multiclass classification surrogate losses. Calibration functions are
a powerful tool for easily converting bounds for the surrogate risk (which can
be computed through well-known methods) into bounds for the true risk, the
probability of making a mistake. They are particularly suitable in
non-parametric settings, where the approximation error can be controlled, and
provide tighter bounds than the common technique of upper-bounding the 0-1 loss
by the surrogate loss.
  The abstract nature of the more sophisticated existing calibration function
results requires calibration functions to be explicitly derived on a
case-by-case basis, requiring repeated efforts whenever bounds for a new
surrogate loss are required. We devise a streamlined analysis that simplifies
the process of deriving calibration functions for a large number of surrogate
losses that have been proposed in the literature. The effort of deriving
calibration functions is then surmised in verifying, for a chosen surrogate
loss, a small number of conditions that we introduce.
  As case studies, we recover existing calibration functions for the well-known
loss of Lee et al. (2004), and also provide novel calibration functions for
well-known losses, including the one-versus-all loss and the logistic
regression loss, plus a number of other losses that have been shown to be
classification-calibrated in the past, but for which no calibration function
had been derived.","['Bernardo Ávila Pires', 'Csaba Szepesvári']","['stat.ML', 'cs.LG']",2016-09-20 23:41:55+00:00
http://arxiv.org/abs/1609.06369v2,Generalized Kalman Smoothing: Modeling and Algorithms,"State-space smoothing has found many applications in science and engineering.
Under linear and Gaussian assumptions, smoothed estimates can be obtained using
efficient recursions, for example Rauch-Tung-Striebel and Mayne-Fraser
algorithms. Such schemes are equivalent to linear algebraic techniques that
minimize a convex quadratic objective function with structure induced by the
dynamic model.
  These classical formulations fall short in many important circumstances. For
instance, smoothers obtained using quadratic penalties can fail when outliers
are present in the data, and cannot track impulsive inputs and abrupt state
changes. Motivated by these shortcomings, generalized Kalman smoothing
formulations have been proposed in the last few years, replacing quadratic
models with more suitable, often nonsmooth, convex functions. In contrast to
classical models, these general estimators require use of iterated algorithms,
and these have received increased attention from control, signal processing,
machine learning, and optimization communities.
  In this survey we show that the optimization viewpoint provides the control
and signal processing community great freedom in the development of novel
modeling and inference frameworks for dynamical systems. We discuss general
statistical models for dynamic systems, making full use of nonsmooth convex
penalties and constraints, and providing links to important models in signal
processing and machine learning. We also survey optimization techniques for
these formulations, paying close attention to dynamic problem structure.
Modeling concepts and algorithms are illustrated with numerical examples.","['A. Y. Aravkin', 'J. V. Burke', 'L. Ljung', 'A. Lozano', 'G. Pillonetto']","['math.OC', 'stat.ML', '62F35, 65K10, 49M15']",2016-09-20 21:58:06+00:00
http://arxiv.org/abs/1609.07480v1,Predictive modelling of football injuries,"The goal of this thesis is to investigate the potential of predictive
modelling for football injuries. This work was conducted in close collaboration
with Tottenham Hotspurs FC (THFC), the PGA European tour and the participation
of Wolverhampton Wanderers (WW).
  Three investigations were conducted:
  1. Predicting the recovery time of football injuries using the UEFA injury
recordings: The UEFA recordings is a common standard for recording injuries in
professional football. For this investigation, three datasets of UEFA injury
recordings were available. Different machine learning algorithms were used in
order to build a predictive model. The performance of the machine learning
models is then improved by using feature selection conducted through
correlation-based subset feature selection and random forests.
  2. Predicting injuries in professional football using exposure records: The
relationship between exposure (in training hours and match hours) in
professional football athletes and injury incidence was studied. A common
problem in football is understanding how the training schedule of an athlete
can affect the chance of him getting injured. The task was to predict the
number of days a player can train before he gets injured.
  3. Predicting intrinsic injury incidence using in-training GPS measurements:
A significant percentage of football injuries can be attributed to overtraining
and fatigue. GPS data collected during training sessions might provide
indicators of fatigue, or might be used to detect very intense training
sessions which can lead to overtraining. This research used GPS data gathered
during training sessions of the first team of THFC, in order to predict whether
an injury would take place during a week.",['Stylianos Kampakis'],"['stat.AP', 'cs.AI', 'stat.ML']",2016-09-20 11:58:42+00:00
http://arxiv.org/abs/1609.06100v4,Distributed Adaptive Learning of Graph Signals,"The aim of this paper is to propose distributed strategies for adaptive
learning of signals defined over graphs. Assuming the graph signal to be
bandlimited, the method enables distributed reconstruction, with guaranteed
performance in terms of mean-square error, and tracking from a limited number
of sampled observations taken from a subset of vertices. A detailed mean square
analysis is carried out and illustrates the role played by the sampling
strategy on the performance of the proposed method. Finally, some useful
strategies for distributed selection of the sampling set are provided. Several
numerical results validate our theoretical findings, and illustrate the
performance of the proposed method for distributed adaptive learning of signals
defined over graphs.","['P. Di Lorenzo', 'P. Banelli', 'S. Barbarossa', 'S. Sardellitti']","['cs.LG', 'stat.ML']",2016-09-20 11:12:04+00:00
http://arxiv.org/abs/1609.06070v2,Boosting Factor-Specific Functional Historical Models for the Detection of Synchronisation in Bioelectrical Signals,"The link between different psychophysiological measures during emotion
episodes is not well understood. To analyse the functional relationship between
electroencephalography (EEG) and facial electromyography (EMG), we apply
historical function-on-function regression models to EEG and EMG data that were
simultaneously recorded from 24 participants while they were playing a
computerised gambling task. Given the complexity of the data structure for this
application, we extend simple functional historical models to models including
random historical effects, factor-specific historical effects, and
factor-specific random historical effects. Estimation is conducted by a
component-wise gradient boosting algorithm, which scales well to large data
sets and complex models.","['David Rügamer', 'Sarah Brockhaus', 'Kornelia Gentsch', 'Klaus Scherer', 'Sonja Greven']","['stat.AP', 'stat.ME', 'stat.ML']",2016-09-20 09:42:32+00:00
http://arxiv.org/abs/1609.05959v1,Conformalized Kernel Ridge Regression,"General predictive models do not provide a measure of confidence in
predictions without Bayesian assumptions. A way to circumvent potential
restrictions is to use conformal methods for constructing non-parametric
confidence regions, that offer guarantees regarding validity. In this paper we
provide a detailed description of a computationally efficient conformal
procedure for Kernel Ridge Regression (KRR), and conduct a comparative
numerical study to see how well conformal regions perform against the Bayesian
confidence sets. The results suggest that conformalized KRR can yield
predictive confidence regions with specified coverage rate, which is essential
in constructing anomaly detection systems based on predictive models.","['Evgeny Burnaev', 'Ivan Nazarov']","['stat.ML', 'cs.LG', 'stat.AP']",2016-09-19 22:30:36+00:00
http://arxiv.org/abs/1609.05881v1,Online and Distributed learning of Gaussian mixture models by Bayesian Moment Matching,"The Gaussian mixture model is a classic technique for clustering and data
modeling that is used in numerous applications. With the rise of big data,
there is a need for parameter estimation techniques that can handle streaming
data and distribute the computation over several processors. While online
variants of the Expectation Maximization (EM) algorithm exist, their data
efficiency is reduced by a stochastic approximation of the E-step and it is not
clear how to distribute the computation over multiple processors. We propose a
Bayesian learning technique that lends itself naturally to online and
distributed computation. Since the Bayesian posterior is not tractable, we
project it onto a family of tractable distributions after each observation by
matching a set of sufficient moments. This Bayesian moment matching technique
compares favorably to online EM in terms of time and accuracy on a set of data
modeling benchmarks.","['Priyank Jaini', 'Pascal Poupart']","['cs.AI', 'cs.LG', 'stat.ML']",2016-09-19 19:44:06+00:00
http://arxiv.org/abs/1609.05877v1,Geometrically Convergent Distributed Optimization with Uncoordinated Step-Sizes,"A recent algorithmic family for distributed optimization, DIGing's, have been
shown to have geometric convergence over time-varying undirected/directed
graphs. Nevertheless, an identical step-size for all agents is needed. In this
paper, we study the convergence rates of the Adapt-Then-Combine (ATC) variation
of the DIGing algorithm under uncoordinated step-sizes. We show that the ATC
variation of DIGing algorithm converges geometrically fast even if the
step-sizes are different among the agents. In addition, our analysis implies
that the ATC structure can accelerate convergence compared to the distributed
gradient descent (DGD) structure which has been used in the original DIGing
algorithm.","['Angelia Nedić', 'Alex Olshevsky', 'Wei Shi', 'César A. Uribe']","['math.OC', 'cs.SY', 'stat.ML']",2016-09-19 19:22:10+00:00
http://arxiv.org/abs/1609.05866v1,A Cheap Linear Attention Mechanism with Fast Lookups and Fixed-Size Representations,"The softmax content-based attention mechanism has proven to be very
beneficial in many applications of recurrent neural networks. Nevertheless it
suffers from two major computational limitations. First, its computations for
an attention lookup scale linearly in the size of the attended sequence.
Second, it does not encode the sequence into a fixed-size representation but
instead requires to memorize all the hidden states. These two limitations
restrict the use of the softmax attention mechanism to relatively small-scale
applications with short sequences and few lookups per sequence. In this work we
introduce a family of linear attention mechanisms designed to overcome the two
limitations listed above. We show that removing the softmax non-linearity from
the traditional attention formulation yields constant-time attention lookups
and fixed-size representations of the attended sequences. These properties make
these linear attention mechanisms particularly suitable for large-scale
applications with extreme query loads, real-time requirements and memory
constraints. Early experiments on a question answering task show that these
linear mechanisms yield significantly better accuracy results than no
attention, but obviously worse than their softmax alternative.","['Alexandre de Brébisson', 'Pascal Vincent']","['cs.LG', 'cs.IR', 'cs.NE', 'stat.ML']",2016-09-19 18:55:18+00:00
http://arxiv.org/abs/1609.05820v3,The Projected Power Method: An Efficient Algorithm for Joint Alignment from Pairwise Differences,"Various applications involve assigning discrete label values to a collection
of objects based on some pairwise noisy data. Due to the discrete---and hence
nonconvex---structure of the problem, computing the optimal assignment
(e.g.~maximum likelihood assignment) becomes intractable at first sight. This
paper makes progress towards efficient computation by focusing on a concrete
joint alignment problem---that is, the problem of recovering $n$ discrete
variables $x_i \in \{1,\cdots, m\}$, $1\leq i\leq n$ given noisy observations
of their modulo differences $\{x_i - x_j~\mathsf{mod}~m\}$. We propose a
low-complexity and model-free procedure, which operates in a lifted space by
representing distinct label values in orthogonal directions, and which attempts
to optimize quadratic functions over hypercubes. Starting with a first guess
computed via a spectral method, the algorithm successively refines the iterates
via projected power iterations. We prove that for a broad class of statistical
models, the proposed projected power method makes no error---and hence
converges to the maximum likelihood estimate---in a suitable regime. Numerical
experiments have been carried out on both synthetic and real data to
demonstrate the practicality of our algorithm. We expect this algorithmic
framework to be effective for a broad range of discrete assignment problems.","['Yuxin Chen', 'Emmanuel Candes']","['cs.IT', 'cs.CV', 'cs.LG', 'math.IT', 'math.OC', 'stat.ML']",2016-09-19 16:29:46+00:00
http://arxiv.org/abs/1609.05807v2,Inherent Trade-Offs in the Fair Determination of Risk Scores,"Recent discussion in the public sphere about algorithmic classification has
involved tension between competing notions of what it means for a probabilistic
classification to be fair to different groups. We formalize three fairness
conditions that lie at the heart of these debates, and we prove that except in
highly constrained special cases, there is no method that can satisfy these
three conditions simultaneously. Moreover, even satisfying all three conditions
approximately requires that the data lie in an approximate version of one of
the constrained special cases identified by our theorem. These results suggest
some of the ways in which key notions of fairness are incompatible with each
other, and hence provide a framework for thinking about the trade-offs between
them.","['Jon Kleinberg', 'Sendhil Mullainathan', 'Manish Raghavan']","['cs.LG', 'cs.CY', 'stat.ML']",2016-09-19 16:08:51+00:00
http://arxiv.org/abs/1609.05796v2,Enabling Dark Energy Science with Deep Generative Models of Galaxy Images,"Understanding the nature of dark energy, the mysterious force driving the
accelerated expansion of the Universe, is a major challenge of modern
cosmology. The next generation of cosmological surveys, specifically designed
to address this issue, rely on accurate measurements of the apparent shapes of
distant galaxies. However, shape measurement methods suffer from various
unavoidable biases and therefore will rely on a precise calibration to meet the
accuracy requirements of the science analysis. This calibration process remains
an open challenge as it requires large sets of high quality galaxy images. To
this end, we study the application of deep conditional generative models in
generating realistic galaxy images. In particular we consider variations on
conditional variational autoencoder and introduce a new adversarial objective
for training of conditional generative networks. Our results suggest a reliable
alternative to the acquisition of expensive high quality observations for
generating the calibration data needed by the next generation of cosmological
surveys.","['Siamak Ravanbakhsh', 'Francois Lanusse', 'Rachel Mandelbaum', 'Jeff Schneider', 'Barnabas Poczos']","['astro-ph.IM', 'astro-ph.CO', 'cs.AI', 'stat.ML']",2016-09-19 15:48:03+00:00
http://arxiv.org/abs/1609.05772v1,Stochastic Matrix Factorization,"This paper considers a restriction to non-negative matrix factorization in
which at least one matrix factor is stochastic. That is, the elements of the
matrix factors are non-negative and the columns of one matrix factor sum to 1.
This restriction includes topic models, a popular method for analyzing
unstructured data. It also includes a method for storing and finding pictures.
The paper presents necessary and sufficient conditions on the observed data
such that the factorization is unique. In addition, the paper characterizes
natural bounds on the parameters for any observed data and presents a
consistent least squares estimator. The results are illustrated using a topic
model analysis of PhD abstracts in economics and the problem of storing and
retrieving a set of pictures of faces.",['Christopher Adams'],"['stat.ML', 'cs.LG']",2016-09-19 15:19:44+00:00
http://arxiv.org/abs/1609.05573v2,Optimality and Sub-optimality of PCA for Spiked Random Matrices and Synchronization,"A central problem of random matrix theory is to understand the eigenvalues of
spiked random matrix models, in which a prominent eigenvector is planted into a
random matrix. These distributions form natural statistical models for
principal component analysis (PCA) problems throughout the sciences. Baik, Ben
Arous and P\'ech\'e showed that the spiked Wishart ensemble exhibits a sharp
phase transition asymptotically: when the signal strength is above a critical
threshold, it is possible to detect the presence of a spike based on the top
eigenvalue, and below the threshold the top eigenvalue provides no information.
Such results form the basis of our understanding of when PCA can detect a
low-rank signal in the presence of noise.
  However, not all the information about the spike is necessarily contained in
the spectrum. We study the fundamental limitations of statistical methods,
including non-spectral ones. Our results include:
  I) For the Gaussian Wigner ensemble, we show that PCA achieves the optimal
detection threshold for a variety of benign priors for the spike. We extend
previous work on the spherically symmetric and i.i.d. Rademacher priors through
an elementary, unified analysis.
  II) For any non-Gaussian Wigner ensemble, we show that PCA is always
suboptimal for detection. However, a variant of PCA achieves the optimal
threshold (for benign priors) by pre-transforming the matrix entries according
to a carefully designed function. This approach has been stated before, and we
give a rigorous and general analysis.
  III) For both the Gaussian Wishart ensemble and various synchronization
problems over groups, we show that inefficient procedures can work below the
threshold where PCA succeeds, whereas no known efficient algorithm achieves
this. This conjectural gap between what is statistically possible and what can
be done efficiently remains open.","['Amelia Perry', 'Alexander S. Wein', 'Afonso S. Bandeira', 'Ankur Moitra']","['math.ST', 'cs.DS', 'cs.IT', 'math.IT', 'math.PR', 'stat.ML', 'stat.TH', '62H15, 62B15']",2016-09-19 00:25:43+00:00
http://arxiv.org/abs/1609.05539v2,On Randomized Distributed Coordinate Descent with Quantized Updates,"In this paper, we study the randomized distributed coordinate descent
algorithm with quantized updates. In the literature, the iteration complexity
of the randomized distributed coordinate descent algorithm has been
characterized under the assumption that machines can exchange updates with an
infinite precision. We consider a practical scenario in which the messages
exchange occurs over channels with finite capacity, and hence the updates have
to be quantized. We derive sufficient conditions on the quantization error such
that the algorithm with quantized update still converge. We further verify our
theoretical results by running an experiment, where we apply the algorithm with
quantized updates to solve a linear regression problem.","['Mostafa El Gamal', 'Lifeng Lai']","['stat.ML', 'cs.LG']",2016-09-18 20:17:00+00:00
http://arxiv.org/abs/1609.05536v1,Learning Personalized Optimal Control for Repeatedly Operated Systems,"We consider the problem of online learning of optimal control for repeatedly
operated systems in the presence of parametric uncertainty. During each round
of operation, environment selects system parameters according to a fixed but
unknown probability distribution. These parameters govern the dynamics of a
plant. An agent chooses a control input to the plant and is then revealed the
cost of the choice. In this setting, we design an agent that personalizes the
control input to this plant taking into account the stochasticity involved. We
demonstrate the effectiveness of our approach on a simulated system.",['Theja Tulabandhula'],"['cs.LG', 'stat.ML']",2016-09-18 19:58:48+00:00
http://arxiv.org/abs/1609.05528v1,Sequential Ensemble Learning for Outlier Detection: A Bias-Variance Perspective,"Ensemble methods for classification and clustering have been effectively used
for decades, while ensemble learning for outlier detection has only been
studied recently. In this work, we design a new ensemble approach for outlier
detection in multi-dimensional point data, which provides improved accuracy by
reducing error through both bias and variance. Although classification and
outlier detection appear as different problems, their theoretical underpinnings
are quite similar in terms of the bias-variance trade-off [1], where outlier
detection is considered as a binary classification task with unobserved labels
but a similar bias-variance decomposition of error.
  In this paper, we propose a sequential ensemble approach called CARE that
employs a two-phase aggregation of the intermediate results in each iteration
to reach the final outcome. Unlike existing outlier ensembles which solely
incorporate a parallel framework by aggregating the outcomes of independent
base detectors to reduce variance, our ensemble incorporates both the parallel
and sequential building blocks to reduce bias as well as variance by ($i$)
successively eliminating outliers from the original dataset to build a better
data model on which outlierness is estimated (sequentially), and ($ii$)
combining the results from individual base detectors and across iterations
(parallelly). Through extensive experiments on sixteen real-world datasets
mainly from the UCI machine learning repository [2], we show that CARE performs
significantly better than or at least similar to the individual baselines. We
also compare CARE with the state-of-the-art outlier ensembles where it also
provides significant improvement when it is the winner and remains close
otherwise.","['Shebuti Rayana', 'Wen Zhong', 'Leman Akoglu']","['cs.LG', 'stat.ML']",2016-09-18 18:59:42+00:00
