id,title,abstract,authors,categories,date
http://arxiv.org/abs/1710.05989v1,Sparse Linear Isotonic Models,"In machine learning and data mining, linear models have been widely used to
model the response as parametric linear functions of the predictors. To relax
such stringent assumptions made by parametric linear models, additive models
consider the response to be a summation of unknown transformations applied on
the predictors; in particular, additive isotonic models (AIMs) assume the
unknown transformations to be monotone. In this paper, we introduce sparse
linear isotonic models (SLIMs) for highdimensional problems by hybridizing
ideas in parametric sparse linear models and AIMs, which enjoy a few appealing
advantages over both. In the high-dimensional setting, a two-step algorithm is
proposed for estimating the sparse parameters as well as the monotone functions
over predictors. Under mild statistical assumptions, we show that the algorithm
can accurately estimate the parameters. Promising preliminary experiments are
presented to support the theoretical results.","['Sheng Chen', 'Arindam Banerjee']",['stat.ML'],2017-10-16 20:20:45+00:00
http://arxiv.org/abs/1710.05895v1,Spectral Algorithms for Computing Fair Support Vector Machines,"Classifiers and rating scores are prone to implicitly codifying biases, which
may be present in the training data, against protected classes (i.e., age,
gender, or race). So it is important to understand how to design classifiers
and scores that prevent discrimination in predictions. This paper develops
computationally tractable algorithms for designing accurate but fair support
vector machines (SVM's). Our approach imposes a constraint on the covariance
matrices conditioned on each protected class, which leads to a nonconvex
quadratic constraint in the SVM formulation. We develop iterative algorithms to
compute fair linear and kernel SVM's, which solve a sequence of relaxations
constructed using a spectral decomposition of the nonconvex constraint. Its
effectiveness in achieving high prediction accuracy while ensuring fairness is
shown through numerical experiments on several data sets.","['Matt Olfat', 'Anil Aswani']","['cs.LG', 'math.OC', 'stat.ML']",2017-10-16 17:48:23+00:00
http://arxiv.org/abs/1710.05829v3,Non-Euclidean Conditional Expectation and Filtering,"A non-Euclidean generalization of conditional expectation is introduced and
characterized as the minimizer of expected intrinsic squared-distance from a
manifold-valued target. The computational tractable formulation expresses the
non-convex optimization problem as transformations of Euclidean conditional
expectation. This gives computationally tractable filtering equations for the
dynamics of the intrinsic conditional expectation of a manifold-valued signal
and is used to obtain accurate numerical forecasts of efficient portfolios by
incorporating their geometric structure into the estimates.","['Anastasis Kratsios', 'Cody B. Hyndman']","['q-fin.MF', 'math.PR', 'q-fin.CP', 'stat.ML', '60D05, 91G60, 91G10, 62M20, 60G35, 93E11']",2017-10-16 16:51:27+00:00
http://arxiv.org/abs/1710.05778v2,A successive difference-of-convex approximation method for a class of nonconvex nonsmooth optimization problems,"We consider a class of nonconvex nonsmooth optimization problems whose
objective is the sum of a smooth function and a finite number of nonnegative
proper closed possibly nonsmooth functions (whose proximal mappings are easy to
compute), some of which are further composed with linear maps. This kind of
problems arises naturally in various applications when different regularizers
are introduced for inducing simultaneous structures in the solutions. Solving
these problems, however, can be challenging because of the coupled nonsmooth
functions: the corresponding proximal mapping can be hard to compute so that
standard first-order methods such as the proximal gradient algorithm cannot be
applied efficiently. In this paper, we propose a successive
difference-of-convex approximation method for solving this kind of problems. In
this algorithm, we approximate the nonsmooth functions by their Moreau
envelopes in each iteration. Making use of the simple observation that Moreau
envelopes of nonnegative proper closed functions are continuous {\em
difference-of-convex} functions, we can then approximately minimize the
approximation function by first-order methods with suitable majorization
techniques. These first-order methods can be implemented efficiently thanks to
the fact that the proximal mapping of {\em each} nonsmooth function is easy to
compute. Under suitable assumptions, we prove that the sequence generated by
our method is bounded and any accumulation point is a stationary point of the
objective. We also discuss how our method can be applied to concrete
applications such as nonconvex fused regularized optimization problems and
simultaneously structured matrix optimization problems, and illustrate the
performance numerically for these two specific applications.","['Tianxiang Liu', 'Ting Kei Pong', 'Akiko Takeda']","['math.OC', 'stat.ML']",2017-10-16 15:18:28+00:00
http://arxiv.org/abs/1710.05776v2,Nonsmooth Frank-Wolfe using Uniform Affine Approximations,"Frank-Wolfe methods (FW) have gained significant interest in the machine
learning community due to its ability to efficiently solve large problems that
admit a sparse structure (e.g. sparse vectors and low-rank matrices). However
the performance of the existing FW method hinges on the quality of the linear
approximation. This typically restricts FW to smooth functions for which the
approximation quality, indicated by a global curvature measure, is reasonably
good.
  In this paper, we propose a modified FW algorithm amenable to nonsmooth
functions by optimizing for approximation quality over all affine
approximations given a neighborhood of interest. We analyze theoretical
properties of the proposed algorithm and demonstrate that it overcomes many
issues associated with existing methods in the context of nonsmooth low-rank
matrix estimation.","['Edward Cheung', 'Yuying Li']","['stat.ML', 'math.OC']",2017-10-16 15:16:20+00:00
http://arxiv.org/abs/1710.05751v2,Time Series Prediction : Predicting Stock Price,"Time series forecasting is widely used in a multitude of domains. In this
paper, we present four models to predict the stock price using the SPX index as
input time series data. The martingale and ordinary linear models require the
strongest assumption in stationarity which we use as baseline models. The
generalized linear model requires lesser assumptions but is unable to
outperform the martingale. In empirical testing, the RNN model performs the
best comparing to other two models, because it will update the input through
LSTM instantaneously, but also does not beat the martingale. In addition, we
introduce an online to batch algorithm and discrepancy measure to inform
readers the newest research in time series predicting method, which doesn't
require any stationarity or non mixing assumptions in time series data.
Finally, to apply these forecasting to practice, we introduce basic trading
strategies that can create Win win and Zero sum situations.","['Aaron Elliot', 'Cheng Hua Hsu']","['stat.ML', '62-07']",2017-10-16 14:39:38+00:00
http://arxiv.org/abs/1710.05741v2,A Disentangled Recognition and Nonlinear Dynamics Model for Unsupervised Learning,"This paper takes a step towards temporal reasoning in a dynamically changing
video, not in the pixel space that constitutes its frames, but in a latent
space that describes the non-linear dynamics of the objects in its world. We
introduce the Kalman variational auto-encoder, a framework for unsupervised
learning of sequential data that disentangles two latent representations: an
object's representation, coming from a recognition model, and a latent state
describing its dynamics. As a result, the evolution of the world can be
imagined and missing data imputed, both without the need to generate high
dimensional frames at each time step. The model is trained end-to-end on videos
of a variety of simulated physical systems, and outperforms competing methods
in generative and missing data imputation tasks.","['Marco Fraccaro', 'Simon Kamronn', 'Ulrich Paquet', 'Ole Winther']","['stat.ML', 'cs.LG']",2017-10-16 14:34:24+00:00
http://arxiv.org/abs/1710.05739v1,On the Hardness of Inventory Management with Censored Demand Data,"We consider a repeated newsvendor problem where the inventory manager has no
prior information about the demand, and can access only censored/sales data. In
analogy to multi-armed bandit problems, the manager needs to simultaneously
""explore"" and ""exploit"" with her inventory decisions, in order to minimize the
cumulative cost. We make no probabilistic assumptions---importantly,
independence or time stationarity---regarding the mechanism that creates the
demand sequence. Our goal is to shed light on the hardness of the problem, and
to develop policies that perform well with respect to the regret criterion,
that is, the difference between the cumulative cost of a policy and that of the
best fixed action/static inventory decision in hindsight, uniformly over all
feasible demand sequences. We show that a simple randomized policy, termed the
Exponentially Weighted Forecaster, combined with a carefully designed cost
estimator, achieves optimal scaling of the expected regret (up to logarithmic
factors) with respect to all three key primitives: the number of time periods,
the number of inventory decisions available, and the demand support. Through
this result, we derive an important insight: the benefit from ""information
stalking"" as well as the cost of censoring are both negligible in this dynamic
learning problem, at least with respect to the regret criterion. Furthermore,
we modify the proposed policy in order to perform well in terms of the tracking
regret, that is, using as benchmark the best sequence of inventory decisions
that switches a limited number of times. Numerical experiments suggest that the
proposed approach outperforms existing ones (that are tailored to, or
facilitated by, time stationarity) on nonstationary demand models. Finally, we
extend the proposed approach and its analysis to a ""combinatorial"" version of
the repeated newsvendor problem.","['Gábor Lugosi', 'Mihalis G. Markakis', 'Gergely Neu']","['cs.LG', 'math.OC', 'stat.ML']",2017-10-16 14:33:59+00:00
http://arxiv.org/abs/1710.05918v1,Convolutional neural networks for structured omics: OmicsCNN and the OmicsConv layer,"Convolutional Neural Networks (CNNs) are a popular deep learning architecture
widely applied in different domains, in particular in classifying over images,
for which the concept of convolution with a filter comes naturally.
Unfortunately, the requirement of a distance (or, at least, of a neighbourhood
function) in the input feature space has so far prevented its direct use on
data types such as omics data. However, a number of omics data are metrizable,
i.e., they can be endowed with a metric structure, enabling to adopt a
convolutional based deep learning framework, e.g., for prediction. We propose a
generalized solution for CNNs on omics data, implemented through a dedicated
Keras layer. In particular, for metagenomics data, a metric can be derived from
the patristic distance on the phylogenetic tree. For transcriptomics data, we
combine Gene Ontology semantic similarity and gene co-expression to define a
distance; the function is defined through a multilayer network where 3 layers
are defined by the GO mutual semantic similarity while the fourth one by gene
co-expression. As a general tool, feature distance on omics data is enabled by
OmicsConv, a novel Keras layer, obtaining OmicsCNN, a dedicated deep learning
framework. Here we demonstrate OmicsCNN on gut microbiota sequencing data, for
Inflammatory Bowel Disease (IBD) 16S data, first on synthetic data and then a
metagenomics collection of gut microbiota of 222 IBD patients.","['Giuseppe Jurman', 'Valerio Maggio', 'Diego Fioravanti', 'Ylenia Giarratano', 'Isotta Landi', 'Margherita Francescatto', 'Claudio Agostinelli', 'Marco Chierici', 'Manlio De Domenico', 'Cesare Furlanello']","['q-bio.QM', 'stat.ML']",2017-10-16 13:58:08+00:00
http://arxiv.org/abs/1710.05654v2,Large Scale Graph Learning from Smooth Signals,"Graphs are a prevalent tool in data science, as they model the inherent
structure of the data. They have been used successfully in unsupervised and
semi-supervised learning. Typically they are constructed either by connecting
nearest samples, or by learning them from data, solving an optimization
problem. While graph learning does achieve a better quality, it also comes with
a higher computational cost. In particular, the current state-of-the-art model
cost is $\mathcal{O}(n^2)$ for $n$ samples. In this paper, we show how to scale
it, obtaining an approximation with leading cost of $\mathcal{O}(n\log(n))$,
with quality that approaches the exact graph learning model. Our algorithm uses
known approximate nearest neighbor techniques to reduce the number of
variables, and automatically selects the correct parameters of the model,
requiring a single intuitive input: the desired edge density.","['Vassilis Kalofolias', 'Nathanaël Perraudin']","['stat.ML', 'cs.LG']",2017-10-16 12:42:15+00:00
http://arxiv.org/abs/1710.05613v3,Is Simple Better? Revisiting Non-linear Matrix Factorization for Learning Incomplete Ratings,"Matrix factorization techniques have been widely used as a method for
collaborative filtering for recommender systems. In recent times, different
variants of deep learning algorithms have been explored in this setting to
improve the task of making a personalized recommendation with user-item
interaction data. The idea that the mapping between the latent user or item
factors and the original features is highly nonlinear suggest that classical
matrix factorization techniques are no longer sufficient. In this paper, we
propose a multilayer nonlinear semi-nonnegative matrix factorization method,
with the motivation that user-item interactions can be modeled more accurately
using a linear combination of non-linear item features. Firstly, we learn
latent factors for representations of users and items from the designed
multilayer nonlinear Semi-NMF approach using explicit ratings. Secondly, the
architecture built is compared with deep-learning algorithms like Restricted
Boltzmann Machine and state-of-the-art Deep Matrix factorization techniques. By
using both supervised rate prediction task and unsupervised clustering in
latent item space, we demonstrate that our proposed approach achieves better
generalization ability in prediction as well as comparable representation
ability as deep matrix factorization in the clustering task.","['Vaibhav Krishna', 'Tian Guo', 'Nino Antulov-Fantulin']","['cs.LG', 'stat.ML']",2017-10-16 10:46:41+00:00
http://arxiv.org/abs/1710.05578v1,Fair Kernel Learning,"New social and economic activities massively exploit big data and machine
learning algorithms to do inference on people's lives. Applications include
automatic curricula evaluation, wage determination, and risk assessment for
credits and loans. Recently, many governments and institutions have raised
concerns about the lack of fairness, equity and ethics in machine learning to
treat these problems. It has been shown that not including sensitive features
that bias fairness, such as gender or race, is not enough to mitigate the
discrimination when other related features are included. Instead, including
fairness in the objective function has been shown to be more efficient.
  We present novel fair regression and dimensionality reduction methods built
on a previously proposed fair classification framework. Both methods rely on
using the Hilbert Schmidt independence criterion as the fairness term. Unlike
previous approaches, this allows us to simplify the problem and to use multiple
sensitive variables simultaneously. Replacing the linear formulation by kernel
functions allows the methods to deal with nonlinear problems. For both linear
and nonlinear formulations the solution reduces to solving simple matrix
inversions or generalized eigenvalue problems. This simplifies the evaluation
of the solutions for different trade-off values between the predictive error
and fairness terms. We illustrate the usefulness of the proposed methods in toy
examples, and evaluate their performance on real world datasets to predict
income using gender and/or race discrimination as sensitive variables, and
contraceptive method prediction under demographic and socio-economic sensitive
descriptors.","['Adrián Pérez-Suay', 'Valero Laparra', 'Gonzalo Mateo-García', 'Jordi Muñoz-Marí', 'Luis Gómez-Chova', 'Gustau Camps-Valls']",['stat.ML'],2017-10-16 09:19:56+00:00
http://arxiv.org/abs/1710.05552v1,Fully adaptive algorithm for pure exploration in linear bandits,"We propose the first fully-adaptive algorithm for pure exploration in linear
bandits---the task to find the arm with the largest expected reward, which
depends on an unknown parameter linearly. While existing methods partially or
entirely fix sequences of arm selections before observing rewards, our method
adaptively changes the arm selection strategy based on past observations at
each round. We show our sample complexity matches the achievable lower bound up
to a constant factor in an extreme case. Furthermore, we evaluate the
performance of the methods by simulations based on both synthetic setting and
real-world data, in which our method shows vast improvement over existing
methods.","['Liyuan Xu', 'Junya Honda', 'Masashi Sugiyama']",['stat.ML'],2017-10-16 08:16:50+00:00
http://arxiv.org/abs/1710.05513v1,Robust Maximum Likelihood Estimation of Sparse Vector Error Correction Model,"In econometrics and finance, the vector error correction model (VECM) is an
important time series model for cointegration analysis, which is used to
estimate the long-run equilibrium variable relationships. The traditional
analysis and estimation methodologies assume the underlying Gaussian
distribution but, in practice, heavy-tailed data and outliers can lead to the
inapplicability of these methods. In this paper, we propose a robust model
estimation method based on the Cauchy distribution to tackle this issue. In
addition, sparse cointegration relations are considered to realize feature
selection and dimension reduction. An efficient algorithm based on the
majorization-minimization (MM) method is applied to solve the proposed
nonconvex problem. The performance of this algorithm is shown through numerical
simulations.","['Ziping Zhao', 'Daniel P. Palomar']","['stat.ML', 'cs.NA', 'q-fin.ST', 'stat.AP', 'stat.CO']",2017-10-16 05:38:27+00:00
http://arxiv.org/abs/1710.05512v1,The Feeling of Success: Does Touch Sensing Help Predict Grasp Outcomes?,"A successful grasp requires careful balancing of the contact forces. Deducing
whether a particular grasp will be successful from indirect measurements, such
as vision, is therefore quite challenging, and direct sensing of contacts
through touch sensing provides an appealing avenue toward more successful and
consistent robotic grasping. However, in order to fully evaluate the value of
touch sensing for grasp outcome prediction, we must understand how touch
sensing can influence outcome prediction accuracy when combined with other
modalities. Doing so using conventional model-based techniques is exceptionally
difficult. In this work, we investigate the question of whether touch sensing
aids in predicting grasp outcomes within a multimodal sensing framework that
combines vision and touch. To that end, we collected more than 9,000 grasping
trials using a two-finger gripper equipped with GelSight high-resolution
tactile sensors on each finger, and evaluated visuo-tactile deep neural network
models to directly predict grasp outcomes from either modality individually,
and from both modalities together. Our experimental results indicate that
incorporating tactile readings substantially improve grasping performance.","['Roberto Calandra', 'Andrew Owens', 'Manu Upadhyaya', 'Wenzhen Yuan', 'Justin Lin', 'Edward H. Adelson', 'Sergey Levine']","['cs.RO', 'cs.CV', 'cs.LG', 'stat.ML']",2017-10-16 05:32:38+00:00
http://arxiv.org/abs/1710.05488v2,A Geometric View of Optimal Transportation and Generative Model,"In this work, we show the intrinsic relations between optimal transportation
and convex geometry, especially the variational approach to solve Alexandrov
problem: constructing a convex polytope with prescribed face normals and
volumes. This leads to a geometric interpretation to generative models, and
leads to a novel framework for generative models. By using the optimal
transportation view of GAN model, we show that the discriminator computes the
Kantorovich potential, the generator calculates the transportation map. For a
large class of transportation costs, the Kantorovich potential can give the
optimal transportation map by a close-form formula. Therefore, it is sufficient
to solely optimize the discriminator. This shows the adversarial competition
can be avoided, and the computational architecture can be simplified.
Preliminary experimental results show the geometric method outperforms WGAN for
approximating probability measures with multiple clusters in low dimensional
space.","['Na Lei', 'Kehua Su', 'Li Cui', 'Shing-Tung Yau', 'David Xianfeng Gu']","['cs.LG', 'stat.ML']",2017-10-16 03:30:09+00:00
http://arxiv.org/abs/1710.05476v3,Calibrated Boosting-Forest,"Excellent ranking power along with well calibrated probability estimates are
needed in many classification tasks. In this paper, we introduce a technique,
Calibrated Boosting-Forest that captures both. This novel technique is an
ensemble of gradient boosting machines that can support both continuous and
binary labels. While offering superior ranking power over any individual
regression or classification model, Calibrated Boosting-Forest is able to
preserve well calibrated posterior probabilities. Along with these benefits, we
provide an alternative to the tedious step of tuning gradient boosting
machines. We demonstrate that tuning Calibrated Boosting-Forest can be reduced
to a simple hyper-parameter selection. We further establish that increasing
this hyper-parameter improves the ranking performance under a diminishing
return. We examine the effectiveness of Calibrated Boosting-Forest on
ligand-based virtual screening where both continuous and binary labels are
available and compare the performance of Calibrated Boosting-Forest with
logistic regression, gradient boosting machine and deep learning. Calibrated
Boosting-Forest achieved an approximately 48% improvement compared to a
state-of-art deep learning model. Moreover, it achieved around 95% improvement
on probability quality measurement compared to the best individual gradient
boosting machine. Calibrated Boosting-Forest offers a benchmark demonstration
that in the field of ligand-based virtual screening, deep learning is not the
universally dominant machine learning model and good calibrated probabilities
can better facilitate virtual screening process.",['Haozhen Wu'],"['stat.ML', 'cs.LG']",2017-10-16 02:49:07+00:00
http://arxiv.org/abs/1710.05468v9,Generalization in Deep Learning,"This paper provides theoretical insights into why and how deep learning can
generalize well, despite its large capacity, complexity, possible algorithmic
instability, nonrobustness, and sharp minima, responding to an open question in
the literature. We also discuss approaches to provide non-vacuous
generalization guarantees for deep learning. Based on theoretical observations,
we propose new open problems and discuss the limitations of our results.","['Kenji Kawaguchi', 'Leslie Pack Kaelbling', 'Yoshua Bengio']","['stat.ML', 'cs.AI', 'cs.LG', 'cs.NE']",2017-10-16 02:21:24+00:00
