id,title,abstract,authors,categories,date
http://arxiv.org/abs/1507.04436v1,Joint Tensor Factorization and Outlying Slab Suppression with Applications,"We consider factoring low-rank tensors in the presence of outlying slabs.
This problem is important in practice, because data collected in many
real-world applications, such as speech, fluorescence, and some social network
data, fit this paradigm. Prior work tackles this problem by iteratively
selecting a fixed number of slabs and fitting, a procedure which may not
converge. We formulate this problem from a group-sparsity promoting point of
view, and propose an alternating optimization framework to handle the
corresponding $\ell_p$ ($0<p\leq 1$) minimization-based low-rank tensor
factorization problem. The proposed algorithm features a similar per-iteration
complexity as the plain trilinear alternating least squares (TALS) algorithm.
Convergence of the proposed algorithm is also easy to analyze under the
framework of alternating optimization and its variants. In addition,
regularization and constraints can be easily incorporated to make use of
\emph{a priori} information on the latent loading factors. Simulations and real
data experiments on blind speech separation, fluorescence data analysis, and
social network mining are used to showcase the effectiveness of the proposed
algorithm.","['Xiao Fu', 'Kejun Huang', 'Wing-Kin Ma', 'Nicholas D. Sidiropoulos', 'Rasmus Bro']",['stat.ML'],2015-07-16 02:47:58+00:00
http://arxiv.org/abs/1507.04396v1,Parallel MMF: a Multiresolution Approach to Matrix Computation,"Multiresolution Matrix Factorization (MMF) was recently introduced as a
method for finding multiscale structure and defining wavelets on
graphs/matrices. In this paper we derive pMMF, a parallel algorithm for
computing the MMF factorization. Empirically, the running time of pMMF scales
linearly in the dimension for sparse matrices. We argue that this makes pMMF a
valuable new computational primitive in its own right, and present experiments
on using pMMF for two distinct purposes: compressing matrices and
preconditioning large sparse linear systems.","['Risi Kondor', 'Nedelina Teneva', 'Pramod K. Mudrakarta']","['cs.NA', 'cs.LG', 'stat.ML']",2015-07-15 21:19:25+00:00
http://arxiv.org/abs/1507.04230v1,The Role of Principal Angles in Subspace Classification,"Subspace models play an important role in a wide range of signal processing
tasks, and this paper explores how the pairwise geometry of subspaces
influences the probability of misclassification. When the mismatch between the
signal and the model is vanishingly small, the probability of misclassification
is determined by the product of the sines of the principal angles between
subspaces. When the mismatch is more significant, the probability of
misclassification is determined by the sum of the squares of the sines of the
principal angles. Reliability of classification is derived in terms of the
distribution of signal energy across principal vectors. Larger principal angles
lead to smaller classification error, motivating a linear transform that
optimizes principal angles. The transform presented here (TRAIT) preserves some
specific characteristic of each individual class, and this approach is shown to
be complementary to a previously developed transform (LRT) that enlarges
inter-class distance while suppressing intra-class dispersion. Theoretical
results are supported by demonstration of superior classification accuracy on
synthetic and measured data even in the presence of significant model mismatch.","['Jiaji Huang', 'Qiang Qiu', 'Robert Calderbank']","['stat.ML', 'cs.LG']",2015-07-15 14:24:24+00:00
http://arxiv.org/abs/1507.04208v3,Combinatorial Cascading Bandits,"We propose combinatorial cascading bandits, a class of partial monitoring
problems where at each step a learning agent chooses a tuple of ground items
subject to constraints and receives a reward if and only if the weights of all
chosen items are one. The weights of the items are binary, stochastic, and
drawn independently of each other. The agent observes the index of the first
chosen item whose weight is zero. This observation model arises in network
routing, for instance, where the learning agent may only observe the first link
in the routing path which is down, and blocks the path. We propose a UCB-like
algorithm for solving our problems, CombCascade; and prove gap-dependent and
gap-free upper bounds on its $n$-step regret. Our proofs build on recent work
in stochastic combinatorial semi-bandits but also address two novel challenges
of our setting, a non-linear reward function and partial observability. We
evaluate CombCascade on two real-world problems and show that it performs well
even when our modeling assumptions are violated. We also demonstrate that our
setting requires a new learning algorithm.","['Branislav Kveton', 'Zheng Wen', 'Azin Ashkan', 'Csaba Szepesvari']","['cs.LG', 'stat.ML']",2015-07-15 13:30:46+00:00
http://arxiv.org/abs/1507.04201v3,Minimum Density Hyperplanes,"Associating distinct groups of objects (clusters) with contiguous regions of
high probability density (high-density clusters), is central to many
statistical and machine learning approaches to the classification of unlabelled
data. We propose a novel hyperplane classifier for clustering and
semi-supervised classification which is motivated by this objective. The
proposed minimum density hyperplane minimises the integral of the empirical
probability density function along it, thereby avoiding intersection with high
density clusters. We show that the minimum density and the maximum margin
hyperplanes are asymptotically equivalent, thus linking this approach to
maximum margin clustering and semi-supervised support vector classifiers. We
propose a projection pursuit formulation of the associated optimisation problem
which allows us to find minimum density hyperplanes efficiently in practice,
and evaluate its performance on a range of benchmark datasets. The proposed
approach is found to be very competitive with state of the art methods for
clustering and semi-supervised classification.","['Nicos G. Pavlidis', 'David P. Hofmeyr', 'Sotiris K. Tasoulis']","['stat.ML', 'cs.LG', '62H30, 68T10', 'I.5.0; I.5.3; G.3']",2015-07-15 13:08:11+00:00
http://arxiv.org/abs/1507.04155v1,ALEVS: Active Learning by Statistical Leverage Sampling,"Active learning aims to obtain a classifier of high accuracy by using fewer
label requests in comparison to passive learning by selecting effective
queries. Many active learning methods have been developed in the past two
decades, which sample queries based on informativeness or representativeness of
unlabeled data points. In this work, we explore a novel querying criterion
based on statistical leverage scores. The statistical leverage scores of a row
in a matrix are the squared row-norms of the matrix containing its (top) left
singular vectors and is a measure of influence of the row on the matrix.
Leverage scores have been used for detecting high influential points in
regression diagnostics and have been recently shown to be useful for data
analysis and randomized low-rank matrix approximation algorithms. We explore
how sampling data instances with high statistical leverage scores perform in
active learning. Our empirical comparison on several binary classification
datasets indicate that querying high leverage points is an effective strategy.","['Cem Orhan', 'Öznur Taştan']","['cs.LG', 'stat.ML']",2015-07-15 10:31:00+00:00
http://arxiv.org/abs/1507.04001v1,Structure and inference in annotated networks,"For many networks of scientific interest we know both the connections of the
network and information about the network nodes, such as the age or gender of
individuals in a social network, geographic location of nodes in the Internet,
or cellular function of nodes in a gene regulatory network. Here we demonstrate
how this ""metadata"" can be used to improve our analysis and understanding of
network structure. We focus in particular on the problem of community detection
in networks and develop a mathematically principled approach that combines a
network and its metadata to detect communities more accurately than can be done
with either alone. Crucially, the method does not assume that the metadata are
correlated with the communities we are trying to find. Instead the method
learns whether a correlation exists and correctly uses or ignores the metadata
depending on whether they contain useful information. The learned correlations
are also of interest in their own right, allowing us to make predictions about
the community membership of nodes whose network connections are unknown. We
demonstrate our method on synthetic networks with known structure and on
real-world networks, large and small, drawn from social, biological, and
technological domains.","['M. E. J. Newman', 'Aaron Clauset']","['cs.SI', 'physics.data-an', 'physics.soc-ph', 'stat.ML']",2015-07-14 20:01:46+00:00
http://arxiv.org/abs/1507.03887v1,An SVM-like Approach for Expectile Regression,"Expectile regression is a nice tool for investigating conditional
distributions beyond the conditional mean. It is well-known that expectiles can
be described with the help of the asymmetric least square loss function, and
this link makes it possible to estimate expectiles in a non-parametric
framework by a support vector machine like approach. In this work we develop an
efficient sequential-minimal-optimization-based solver for the underlying
optimization problem. The behavior of the solver is investigated by conducting
various experiments and the results are compared with the recent R-package
ER-Boost.","['Muhammad Farooq', 'Ingo Steinwart']","['stat.CO', 'stat.ML']",2015-07-14 15:24:52+00:00
http://arxiv.org/abs/1507.03867v1,Rich Component Analysis,"In many settings, we have multiple data sets (also called views) that capture
different and overlapping aspects of the same phenomenon. We are often
interested in finding patterns that are unique to one or to a subset of the
views. For example, we might have one set of molecular observations and one set
of physiological observations on the same group of individuals, and we want to
quantify molecular patterns that are uncorrelated with physiology. Despite
being a common problem, this is highly challenging when the correlations come
from complex distributions. In this paper, we develop the general framework of
Rich Component Analysis (RCA) to model settings where the observations from
different views are driven by different sets of latent components, and each
component can be a complex, high-dimensional distribution. We introduce
algorithms based on cumulant extraction that provably learn each of the
components without having to model the other components. We show how to
integrate RCA with stochastic gradient descent into a meta-algorithm for
learning general models, and demonstrate substantial improvement in accuracy on
several synthetic and real datasets in both supervised and unsupervised tasks.
Our method makes it possible to learn latent variable models when we don't have
samples from the true model but only samples after complex perturbations.","['Rong Ge', 'James Zou']","['cs.LG', 'stat.ML']",2015-07-14 14:38:23+00:00
http://arxiv.org/abs/1507.03857v2,MMSE of probabilistic low-rank matrix estimation: Universality with respect to the output channel,"This paper considers probabilistic estimation of a low-rank matrix from
non-linear element-wise measurements of its elements. We derive the
corresponding approximate message passing (AMP) algorithm and its state
evolution. Relying on non-rigorous but standard assumptions motivated by
statistical physics, we characterize the minimum mean squared error (MMSE)
achievable information theoretically and with the AMP algorithm. Unlike in
related problems of linear estimation, in the present setting the MMSE depends
on the output channel only trough a single parameter - its Fisher information.
We illustrate this striking finding by analysis of submatrix localization, and
of detection of communities hidden in a dense stochastic block model. For this
example we locate the computational and statistical boundaries that are not
equal for rank larger than four.","['Thibault Lesieur', 'Florent Krzakala', 'Lenka Zdeborová']","['cs.IT', 'cond-mat.stat-mech', 'math.IT', 'stat.ML']",2015-07-14 14:17:42+00:00
http://arxiv.org/abs/1507.03734v3,Smooth Alternating Direction Methods for Nonsmooth Constrained Convex Optimization,"We propose two new alternating direction methods to solve ""fully"" nonsmooth
constrained convex problems. Our algorithms have the best known worst-case
iteration-complexity guarantee under mild assumptions for both the objective
residual and feasibility gap. Through theoretical analysis, we show how to
update all the algorithmic parameters automatically with clear impact on the
convergence performance. We also provide a representative numerical example
showing the advantages of our methods over the classical alternating direction
methods using a well-known feasibility problem.","['Quoc Tran-Dinh', 'Volkan Cevher']","['math.OC', 'stat.ML']",2015-07-14 06:39:05+00:00
http://arxiv.org/abs/1507.03538v3,Classifying X-ray Binaries: A Probabilistic Approach,"In X-ray binary star systems consisting of a compact object that accretes
material from an orbiting secondary star, there is no straightforward means to
decide if the compact object is a black hole or a neutron star. To assist this
classification, we develop a Bayesian statistical model that makes use of the
fact that X-ray binary systems appear to cluster based on their compact object
type when viewed from a 3-dimensional coordinate system derived from X-ray
spectral data. The first coordinate of this data is the ratio of counts in mid
to low energy band (color 1), the second coordinate is the ratio of counts in
high to low energy band (color 2), and the third coordinate is the sum of
counts in all three bands. We use this model to estimate the probabilities that
an X-ray binary system contains a black hole, non-pulsing neutron star, or
pulsing neutron star. In particular, we utilize a latent variable model in
which the latent variables follow a Gaussian process prior distribution, and
hence we are able to induce the spatial correlation we believe exists between
systems of the same type. The utility of this approach is evidenced by the
accurate prediction of system types using Rossi X-ray Timing Explorer All Sky
Monitor data, but it is not flawless. In particular, non-pulsing neutron
systems containing ""bursters"" that are close to the boundary demarcating
systems containing black holes tend to be classified as black hole systems. As
a byproduct of our analyses, we provide the astronomer with public R code that
can be used to predict the compact object type of X-ray binaries given training
data.","['Giri Gopalan', 'Saeqa Dil Vrtilek', 'Luke Bornn']","['astro-ph.HE', 'stat.AP', 'stat.ML']",2015-07-13 18:24:16+00:00
http://arxiv.org/abs/1507.03496v1,The mRMR variable selection method: a comparative study for functional data,"The use of variable selection methods is particularly appealing in
statistical problems with functional data. The obvious general criterion for
variable selection is to choose the `most representative' or `most relevant'
variables. However, it is also clear that a purely relevance-oriented criterion
could lead to select many redundant variables. The mRMR (minimum Redundance
Maximum Relevance) procedure, proposed by Ding and Peng (2005) and Peng et al.
(2005) is an algorithm to systematically perform variable selection, achieving
a reasonable trade-off between relevance and redundancy. In its original form,
this procedure is based on the use of the so-called mutual information
criterion to assess relevance and redundancy. Keeping the focus on functional
data problems, we propose here a modified version of the mRMR method, obtained
by replacing the mutual information by the new association measure (called
distance correlation) suggested by Sz\'ekely et al. (2007). We have also
performed an extensive simulation study, including 1600 functional experiments
(100 functional models $\times$ 4 sample sizes $\times$ 4 classifiers) and
three real-data examples aimed at comparing the different versions of the mRMR
methodology. The results are quite conclusive in favor of the new proposed
alternative.","['José R. Berrendero', 'Antonio Cuevas', 'José L. Torrecilla']","['stat.ME', 'stat.ML', 'Primary: 62H30, Secondary: 62H20']",2015-07-13 15:31:26+00:00
http://arxiv.org/abs/1507.03482v1,Individual performance calibration using physiological stress signals,"The relation between performance and stress is described by the Yerkes-Dodson
Law but varies significantly between individuals. This paper describes a method
for determining the individual optimal performance as a function of
physiological signals. The method is based on attention and reasoning tests of
increasing complexity under monitoring of three physiological signals: Galvanic
Skin Response (GSR), Heart Rate (HR), and Electromyogram (EMG). Based on the
test results with 15 different individuals, we first show that two of the
signals, GSR and HR, have enough discriminative power to distinguish between
relax and stress periods. We then show a positive correlation between the
complexity level of the tests and the GSR and HR signals, and we finally
determine the optimal performance point as the signal level just before a
performance decrease. We also discuss the differences among signals depending
on the type of test.","['Francisco Hernando-Gallego', 'Antonio Artés-Rodríguez']","['cs.HC', 'cs.CY', 'stat.ML']",2015-07-13 14:52:02+00:00
http://arxiv.org/abs/1507.03285v1,Scatter Matrix Concordance: A Diagnostic for Regressions on Subsets of Data,"Linear regression models depend directly on the design matrix and its
properties. Techniques that efficiently estimate model coefficients by
partitioning rows of the design matrix are increasingly popular for large-scale
problems because they fit well with modern parallel computing architectures. We
propose a simple measure of {\em concordance} between a design matrix and a
subset of its rows that estimates how well a subset captures the
variance-covariance structure of a larger data set. We illustrate the use of
this measure in a heuristic method for selecting row partition sizes that
balance statistical and computational efficiency goals in real-world problems.","['Michael J. Kane', 'Bryan Lewis', 'Sekhar Tatikonda', 'Simon Urbanek']",['stat.ML'],2015-07-12 22:51:07+00:00
http://arxiv.org/abs/1507.03269v1,Tensor principal component analysis via sum-of-squares proofs,"We study a statistical model for the tensor principal component analysis
problem introduced by Montanari and Richard: Given a order-$3$ tensor $T$ of
the form $T = \tau \cdot v_0^{\otimes 3} + A$, where $\tau \geq 0$ is a
signal-to-noise ratio, $v_0$ is a unit vector, and $A$ is a random noise
tensor, the goal is to recover the planted vector $v_0$. For the case that $A$
has iid standard Gaussian entries, we give an efficient algorithm to recover
$v_0$ whenever $\tau \geq \omega(n^{3/4} \log(n)^{1/4})$, and certify that the
recovered vector is close to a maximum likelihood estimator, all with high
probability over the random choice of $A$. The previous best algorithms with
provable guarantees required $\tau \geq \Omega(n)$.
  In the regime $\tau \leq o(n)$, natural tensor-unfolding-based spectral
relaxations for the underlying optimization problem break down (in the sense
that their integrality gap is large). To go beyond this barrier, we use convex
relaxations based on the sum-of-squares method. Our recovery algorithm proceeds
by rounding a degree-$4$ sum-of-squares relaxations of the
maximum-likelihood-estimation problem for the statistical model. To complement
our algorithmic results, we show that degree-$4$ sum-of-squares relaxations
break down for $\tau \leq O(n^{3/4}/\log(n)^{1/4})$, which demonstrates that
improving our current guarantees (by more than logarithmic factors) would
require new techniques or might even be intractable.
  Finally, we show how to exploit additional problem structure in order to
solve our sum-of-squares relaxations, up to some approximation, very
efficiently. Our fastest algorithm runs in nearly-linear time using shifted
(matrix) power iteration and has similar guarantees as above. The analysis of
this algorithm also confirms a variant of a conjecture of Montanari and Richard
about singular vectors of tensor unfoldings.","['Samuel B. Hopkins', 'Jonathan Shi', 'David Steurer']","['cs.LG', 'cs.CC', 'cs.DS', 'stat.ML']",2015-07-12 20:30:09+00:00
http://arxiv.org/abs/1507.03229v1,Homotopy Continuation Approaches for Robust SV Classification and Regression,"In support vector machine (SVM) applications with unreliable data that
contains a portion of outliers, non-robustness of SVMs often causes
considerable performance deterioration. Although many approaches for improving
the robustness of SVMs have been studied, two major challenges remain in robust
SVM learning. First, robust learning algorithms are essentially formulated as
non-convex optimization problems. It is thus important to develop a non-convex
optimization method for robust SVM that can find a good local optimal solution.
The second practical issue is how one can tune the hyperparameter that controls
the balance between robustness and efficiency. Unfortunately, due to the
non-convexity, robust SVM solutions with slightly different hyper-parameter
values can be significantly different, which makes model selection highly
unstable. In this paper, we address these two issues simultaneously by
introducing a novel homotopy approach to non-convex robust SVM learning. Our
basic idea is to introduce parametrized formulations of robust SVM which bridge
the standard SVM and fully robust SVM via the parameter that represents the
influence of outliers. We characterize the necessary and sufficient conditions
of the local optimal solutions of robust SVM, and develop an algorithm that can
trace a path of local optimal solutions when the influence of outliers is
gradually decreased. An advantage of our homotopy approach is that it can be
interpreted as simulated annealing, a common approach for finding a good local
optimal solution in non-convex optimization problems. In addition, our homotopy
method allows stable and efficient model selection based on the path of local
optimal solutions. Empirical performances of the proposed approach are
demonstrated through intensive numerical experiments both on robust
classification and regression problems.","['Shinya Suzumura', 'Kohei Ogawa', 'Masashi Sugiyama', 'Masayuki Karasuyama', 'Ichiro Takeuchi']","['stat.ML', 'cs.LG']",2015-07-12 13:07:26+00:00
http://arxiv.org/abs/1507.03228v1,Scalable Bayesian Inference for Excitatory Point Process Networks,"Networks capture our intuition about relationships in the world. They
describe the friendships between Facebook users, interactions in financial
markets, and synapses connecting neurons in the brain. These networks are
richly structured with cliques of friends, sectors of stocks, and a smorgasbord
of cell types that govern how neurons connect. Some networks, like social
network friendships, can be directly observed, but in many cases we only have
an indirect view of the network through the actions of its constituents and an
understanding of how the network mediates that activity. In this work, we focus
on the problem of latent network discovery in the case where the observable
activity takes the form of a mutually-excitatory point process known as a
Hawkes process. We build on previous work that has taken a Bayesian approach to
this problem, specifying prior distributions over the latent network structure
and a likelihood of observed activity given this network. We extend this work
by proposing a discrete-time formulation and developing a computationally
efficient stochastic variational inference (SVI) algorithm that allows us to
scale the approach to long sequences of observations. We demonstrate our
algorithm on the calcium imaging data used in the Chalearn neural connectomics
challenge.","['Scott W. Linderman', 'Ryan P. Adams']",['stat.ML'],2015-07-12 12:59:28+00:00
http://arxiv.org/abs/1507.03194v2,A Review of Nonnegative Matrix Factorization Methods for Clustering,"Nonnegative Matrix Factorization (NMF) was first introduced as a low-rank
matrix approximation technique, and has enjoyed a wide area of applications.
Although NMF does not seem related to the clustering problem at first, it was
shown that they are closely linked. In this report, we provide a gentle
introduction to clustering and NMF before reviewing the theoretical
relationship between them. We then explore several NMF variants, namely Sparse
NMF, Projective NMF, Nonnegative Spectral Clustering and Cluster-NMF, along
with their clustering interpretations.",['Ali Caner Türkmen'],"['stat.ML', 'cs.LG', 'cs.NA']",2015-07-12 07:14:16+00:00
