id,title,abstract,authors,categories,date
http://arxiv.org/abs/2101.10102v2,Towards Practical Robustness Analysis for DNNs based on PAC-Model Learning,"To analyse local robustness properties of deep neural networks (DNNs), we
present a practical framework from a model learning perspective. Based on
black-box model learning with scenario optimisation, we abstract the local
behaviour of a DNN via an affine model with the probably approximately correct
(PAC) guarantee. From the learned model, we can infer the corresponding
PAC-model robustness property. The innovation of our work is the integration of
model learning into PAC robustness analysis: that is, we construct a PAC
guarantee on the model level instead of sample distribution, which induces a
more faithful and accurate robustness evaluation. This is in contrast to
existing statistical methods without model learning. We implement our method in
a prototypical tool named DeepPAC. As a black-box method, DeepPAC is scalable
and efficient, especially when DNNs have complex structures or high-dimensional
inputs. We extensively evaluate DeepPAC, with 4 baselines (using formal
verification, statistical methods, testing and adversarial attack) and 20 DNN
models across 3 datasets, including MNIST, CIFAR-10, and ImageNet. It is shown
that DeepPAC outperforms the state-of-the-art statistical method PROVERO, and
it achieves more practical robustness analysis than the formal verification
tool ERAN. Also, its results are consistent with existing DNN testing work like
DeepGini.","['Renjue Li', 'Pengfei Yang', 'Cheng-Chao Huang', 'Youcheng Sun', 'Bai Xue', 'Lijun Zhang']","['cs.LG', 'cs.AI', 'stat.ML']",2021-01-25 14:10:52+00:00
http://arxiv.org/abs/2101.10058v1,The EM Perspective of Directional Mean Shift Algorithm,"The directional mean shift (DMS) algorithm is a nonparametric method for
pursuing local modes of densities defined by kernel density estimators on the
unit hypersphere. In this paper, we show that any DMS iteration can be viewed
as a generalized Expectation-Maximization (EM) algorithm; in particular, when
the von Mises kernel is applied, it becomes an exact EM algorithm. Under the
(generalized) EM framework, we provide a new proof for the ascending property
of density estimates and demonstrate the global convergence of directional mean
shift sequences. Finally, we give a new insight into the linear convergence of
the DMS algorithm.","['Yikun Zhang', 'Yen-Chi Chen']","['math.ST', 'stat.ME', 'stat.ML', 'stat.TH']",2021-01-25 13:17:12+00:00
http://arxiv.org/abs/2101.10050v3,Learning Parametrised Graph Shift Operators,"In many domains data is currently represented as graphs and therefore, the
graph representation of this data becomes increasingly important in machine
learning. Network data is, implicitly or explicitly, always represented using a
graph shift operator (GSO) with the most common choices being the adjacency,
Laplacian matrices and their normalisations. In this paper, a novel
parametrised GSO (PGSO) is proposed, where specific parameter values result in
the most commonly used GSOs and message-passing operators in graph neural
network (GNN) frameworks. The PGSO is suggested as a replacement of the
standard GSOs that are used in state-of-the-art GNN architectures and the
optimisation of the PGSO parameters is seamlessly included in the model
training. It is proved that the PGSO has real eigenvalues and a set of real
eigenvectors independent of the parameter values and spectral bounds on the
PGSO are derived. PGSO parameters are shown to adapt to the sparsity of the
graph structure in a study on stochastic blockmodel networks, where they are
found to automatically replicate the GSO regularisation found in the
literature. On several real-world datasets the accuracy of state-of-the-art GNN
architectures is improved by the inclusion of the PGSO in both node- and
graph-classification tasks.","['George Dasoulas', 'Johannes Lutzeyer', 'Michalis Vazirgiannis']","['cs.LG', 'stat.ML']",2021-01-25 13:01:26+00:00
http://arxiv.org/abs/2101.10037v1,Optimizing Convergence for Iterative Learning of ARIMA for Stationary Time Series,"Forecasting of time series in continuous systems becomes an increasingly
relevant task due to recent developments in IoT and 5G. The popular forecasting
model ARIMA is applied to a large variety of applications for decades. An
online variant of ARIMA applies the Online Newton Step in order to learn the
underlying process of the time series. This optimization method has pitfalls
concerning the computational complexity and convergence. Thus, this work
focuses on the computational less expensive Online Gradient Descent
optimization method, which became popular for learning of neural networks in
recent years. For the iterative training of such models, we propose a new
approach combining different Online Gradient Descent learners (such as Adam,
AMSGrad, Adagrad, Nesterov) to achieve fast convergence. The evaluation on
synthetic data and experimental datasets show that the proposed approach
outperforms the existing methods resulting in an overall lower prediction
error.","['Kevin Styp-Rekowski', 'Florian Schmidt', 'Odej Kao']","['cs.LG', 'stat.ML']",2021-01-25 12:07:46+00:00
http://arxiv.org/abs/2101.09973v1,Approximating Probability Distributions by ReLU Networks,"How many neurons are needed to approximate a target probability distribution
using a neural network with a given input distribution and approximation error?
This paper examines this question for the case when the input distribution is
uniform, and the target distribution belongs to the class of histogram
distributions. We obtain a new upper bound on the number of required neurons,
which is strictly better than previously existing upper bounds. The key
ingredient in this improvement is an efficient construction of the neural nets
representing piecewise linear functions. We also obtain a lower bound on the
minimum number of neurons needed to approximate the histogram distributions.","['Manuj Mukherjee', 'Aslan Tchamkerten', 'Mansoor Yousefi']","['cs.LG', 'cs.IT', 'math.IT', 'stat.ML']",2021-01-25 09:31:20+00:00
http://arxiv.org/abs/2101.09957v1,Activation Functions in Artificial Neural Networks: A Systematic Overview,"Activation functions shape the outputs of artificial neurons and, therefore,
are integral parts of neural networks in general and deep learning in
particular. Some activation functions, such as logistic and relu, have been
used for many decades. But with deep learning becoming a mainstream research
topic, new activation functions have mushroomed, leading to confusion in both
theory and practice. This paper provides an analytic yet up-to-date overview of
popular activation functions and their properties, which makes it a timely
resource for anyone who studies or applies neural networks.",['Johannes Lederer'],"['cs.LG', 'cs.AI', 'cs.NE', 'stat.ML']",2021-01-25 08:55:26+00:00
http://arxiv.org/abs/2101.09875v2,Eigen-convergence of Gaussian kernelized graph Laplacian by manifold heat interpolation,"This work studies the spectral convergence of graph Laplacian to the
Laplace-Beltrami operator when the graph affinity matrix is constructed from
$N$ random samples on a $d$-dimensional manifold embedded in a possibly high
dimensional space. By analyzing Dirichlet form convergence and constructing
candidate approximate eigenfunctions via convolution with manifold heat kernel,
we prove that, with Gaussian kernel, one can set the kernel bandwidth parameter
$\epsilon \sim (\log N/ N)^{1/(d/2+2)}$ such that the eigenvalue convergence
rate is $N^{-1/(d/2+2)}$ and the eigenvector convergence in 2-norm has rate
$N^{-1/(d+4)}$; When $\epsilon \sim (\log N/N)^{1/(d/2+3)}$, both eigenvalue
and eigenvector rates are $N^{-1/(d/2+3)}$. These rates are up to a $\log N$
factor and proved for finitely many low-lying eigenvalues. The result holds for
un-normalized and random-walk graph Laplacians when data are uniformly sampled
on the manifold, as well as the density-corrected graph Laplacian (where the
affinity matrix is normalized by the degree matrix from both sides) with
non-uniformly sampled data. As an intermediate result, we prove new point-wise
and Dirichlet form convergence rates for the density-corrected graph Laplacian.
Numerical results are provided to verify the theory.","['Xiuyuan Cheng', 'Nan Wu']","['math.ST', 'cs.LG', 'stat.ML', 'stat.TH']",2021-01-25 03:22:18+00:00
http://arxiv.org/abs/2101.09844v1,Pattern Ensembling for Spatial Trajectory Reconstruction,"Digital sensing provides an unprecedented opportunity to assess and
understand mobility. However, incompleteness, missing information, possible
inaccuracies, and temporal heterogeneity in the geolocation data can undermine
its applicability. As mobility patterns are often repeated, we propose a method
to use similar trajectory patterns from the local vicinity and
probabilistically ensemble them to robustly reconstruct missing or unreliable
observations. We evaluate the proposed approach in comparison with traditional
functional trajectory interpolation using a case of sea vessel trajectory data
provided by The Automatic Identification System (AIS). By effectively
leveraging the similarities in real-world trajectories, our pattern ensembling
method helps to reconstruct missing trajectory segments of extended length and
complex geometry. It can be used for locating mobile objects when temporary
unobserved as well as for creating an evenly sampled trajectory interpolation
useful for further trajectory mining.","['Shivam Pathak', 'Mingyi He', 'Sergey Malinchik', 'Stanislav Sobolevsky']","['physics.data-an', 'cs.LG', 'stat.ML', '68W99', 'I.5']",2021-01-25 01:44:00+00:00
http://arxiv.org/abs/2101.09809v1,NeurT-FDR: Controlling FDR by Incorporating Feature Hierarchy,"Controlling false discovery rate (FDR) while leveraging the side information
of multiple hypothesis testing is an emerging research topic in modern data
science. Existing methods rely on the test-level covariates while ignoring
possible hierarchy among the covariates. This strategy may not be optimal for
complex large-scale problems, where hierarchical information often exists among
those test-level covariates. We propose NeurT-FDR which boosts statistical
power and controls FDR for multiple hypothesis testing while leveraging the
hierarchy among test-level covariates. Our method parametrizes the test-level
covariates as a neural network and adjusts the feature hierarchy through a
regression framework, which enables flexible handling of high-dimensional
features as well as efficient end-to-end optimization. We show that NeurT-FDR
has strong FDR guarantees and makes substantially more discoveries in synthetic
and real datasets compared to competitive baselines.","['Lin Qiu', 'Nils Murrugarra-Llerena', 'Vítor Silva', 'Lin Lin', 'Vernon M. Chinchilli']","['stat.ML', 'cs.LG']",2021-01-24 21:55:10+00:00
http://arxiv.org/abs/2101.09763v2,Analysing the Noise Model Error for Realistic Noisy Label Data,"Distant and weak supervision allow to obtain large amounts of labeled
training data quickly and cheaply, but these automatic annotations tend to
contain a high amount of errors. A popular technique to overcome the negative
effects of these noisy labels is noise modelling where the underlying noise
process is modelled. In this work, we study the quality of these estimated
noise models from the theoretical side by deriving the expected error of the
noise model. Apart from evaluating the theoretical results on commonly used
synthetic noise, we also publish NoisyNER, a new noisy label dataset from the
NLP domain that was obtained through a realistic distant supervision technique.
It provides seven sets of labels with differing noise patterns to evaluate
different noise levels on the same instances. Parallel, clean labels are
available making it possible to study scenarios where a small amount of
gold-standard data can be leveraged. Our theoretical results and the
corresponding experiments give insights into the factors that influence the
noise model estimation like the noise distribution and the sampling technique.","['Michael A. Hedderich', 'Dawei Zhu', 'Dietrich Klakow']","['cs.LG', 'cs.CL', 'stat.ML']",2021-01-24 17:45:15+00:00
http://arxiv.org/abs/2101.09756v1,Entropy Partial Transport with Tree Metrics: Theory and Practice,"Optimal transport (OT) theory provides powerful tools to compare probability
measures. However, OT is limited to nonnegative measures having the same mass,
and suffers serious drawbacks about its computation and statistics. This leads
to several proposals of regularized variants of OT in the recent literature. In
this work, we consider an \textit{entropy partial transport} (EPT) problem for
nonnegative measures on a tree having different masses. The EPT is shown to be
equivalent to a standard complete OT problem on a one-node extended tree. We
derive its dual formulation, then leverage this to propose a novel
regularization for EPT which admits fast computation and negative definiteness.
To our knowledge, the proposed regularized EPT is the first approach that
yields a \textit{closed-form} solution among available variants of unbalanced
OT. For practical applications without priori knowledge about the tree
structure for measures, we propose tree-sliced variants of the regularized EPT,
computed by averaging the regularized EPT between these measures using random
tree metrics, built adaptively from support data points. Exploiting the
negative definiteness of our regularized EPT, we introduce a positive definite
kernel, and evaluate it against other baselines on benchmark tasks such as
document classification with word embedding and topological data analysis. In
addition, we empirically demonstrate that our regularization also provides
effective approximations.","['Tam Le', 'Truyen Nguyen']","['stat.ML', 'cs.LG']",2021-01-24 17:04:24+00:00
http://arxiv.org/abs/2101.09747v2,Numerical issues in maximum likelihood parameter estimation for Gaussian process interpolation,"This article investigates the origin of numerical issues in maximum
likelihood parameter estimation for Gaussian process (GP) interpolation and
investigates simple but effective strategies for improving commonly used
open-source software implementations. This work targets a basic problem but a
host of studies, particularly in the literature of Bayesian optimization, rely
on off-the-shelf GP implementations. For the conclusions of these studies to be
reliable and reproducible, robust GP implementations are critical.","['Subhasish Basak', 'Sébastien Petit', 'Julien Bect', 'Emmanuel Vazquez']","['stat.ML', 'cs.LG', 'stat.CO']",2021-01-24 16:30:55+00:00
http://arxiv.org/abs/2101.09682v2,Solving optimal stopping problems with Deep Q-Learning,"We propose a reinforcement learning (RL) approach to model optimal exercise
strategies for option-type products. We pursue the RL avenue in order to learn
the optimal action-value function of the underlying stopping problem. In
addition to retrieving the optimal Q-function at any time step, one can also
price the contract at inception. We first discuss the standard setting with one
exercise right, and later extend this framework to the case of multiple
stopping opportunities in the presence of constraints. We propose to
approximate the Q-function with a deep neural network, which does not require
the specification of basis functions as in the least-squares Monte Carlo
framework and is scalable to higher dimensions. We derive a lower bound on the
option price obtained from the trained neural network and an upper bound from
the dual formulation of the stopping problem, which can also be expressed in
terms of the Q-function. Our methodology is illustrated with examples covering
the pricing of swing options.","['John Ery', 'Loris Michel']","['q-fin.PR', 'stat.ML', '91G20']",2021-01-24 10:05:46+00:00
http://arxiv.org/abs/2101.09645v1,Multi-Task Time Series Forecasting With Shared Attention,"Time series forecasting is a key component in many industrial and business
decision processes and recurrent neural network (RNN) based models have
achieved impressive progress on various time series forecasting tasks. However,
most of the existing methods focus on single-task forecasting problems by
learning separately based on limited supervised objectives, which often suffer
from insufficient training instances. As the Transformer architecture and other
attention-based models have demonstrated its great capability of capturing long
term dependency, we propose two self-attention based sharing schemes for
multi-task time series forecasting which can train jointly across multiple
tasks. We augment a sequence of paralleled Transformer encoders with an
external public multi-head attention function, which is updated by all data of
all tasks. Experiments on a number of real-world multi-task time series
forecasting tasks show that our proposed architectures can not only outperform
the state-of-the-art single-task forecasting baselines but also outperform the
RNN-based multi-task forecasting method.","['Zekai Chen', 'Jiaze E', 'Xiao Zhang', 'Hao Sheng', 'Xiuzheng Cheng']","['cs.LG', 'stat.ML']",2021-01-24 04:25:08+00:00
http://arxiv.org/abs/2101.09612v3,On the Proof of Global Convergence of Gradient Descent for Deep ReLU Networks with Linear Widths,"We give a simple proof for the global convergence of gradient descent in
training deep ReLU networks with the standard square loss, and show some of its
improvements over the state-of-the-art. In particular, while prior works
require all the hidden layers to be wide with width at least $\Omega(N^8)$ ($N$
being the number of training samples), we require a single wide layer of
linear, quadratic or cubic width depending on the type of initialization.
Unlike many recent proofs based on the Neural Tangent Kernel (NTK), our proof
need not track the evolution of the entire NTK matrix, or more generally, any
quantities related to the changes of activation patterns during training.
Instead, we only need to track the evolution of the output at the last hidden
layer, which can be done much more easily thanks to the Lipschitz property of
ReLU. Some highlights of our setting: (i) all the layers are trained with
standard gradient descent, (ii) the network has standard parameterization as
opposed to the NTK one, and (iii) the network has a single wide layer as
opposed to having all wide hidden layers as in most of NTK-related results.",['Quynh Nguyen'],"['cs.LG', 'stat.ML']",2021-01-24 00:29:19+00:00
http://arxiv.org/abs/2101.09611v4,Generative hypergraph clustering: from blockmodels to modularity,"Hypergraphs are a natural modeling paradigm for a wide range of complex
relational systems. A standard analysis task is to identify clusters of closely
related or densely interconnected nodes. Many graph algorithms for this task
are based on variants of the stochastic blockmodel, a random graph with
flexible cluster structure. However, there are few models and algorithms for
hypergraph clustering. Here, we propose a Poisson degree-corrected hypergraph
stochastic blockmodel (DCHSBM), a generative model of clustered hypergraphs
with heterogeneous node degrees and edge sizes. Approximate maximum-likelihood
inference in the DCHSBM naturally leads to a clustering objective that
generalizes the popular modularity objective for graphs. We derive a general
Louvain-type algorithm for this objective, as well as a a faster, specialized
""All-Or-Nothing"" (AON) variant in which edges are expected to lie fully within
clusters. This special case encompasses a recent proposal for modularity in
hypergraphs, while also incorporating flexible resolution and edge-size
parameters. We show that AON hypergraph Louvain is highly scalable, including
as an example an experiment on a synthetic hypergraph of one million nodes. We
also demonstrate through synthetic experiments that the detectability regimes
for hypergraph community detection differ from methods based on dyadic graph
projections. We use our generative model to analyze different patterns of
higher-order structure in school contact networks, U.S. congressional bill
cosponsorship, U.S. congressional committees, product categories in
co-purchasing behavior, and hotel locations from web browsing sessions, finding
interpretable higher-order structure. We then study the behavior of our AON
hypergraph Louvain algorithm, finding that it is able to recover ground truth
clusters in empirical data sets exhibiting the corresponding higher-order
structure.","['Philip S. Chodrow', 'Nate Veldt', 'Austin R. Benson']","['cs.SI', 'cs.DM', 'physics.data-an', 'physics.soc-ph', 'stat.ML']",2021-01-24 00:25:22+00:00
http://arxiv.org/abs/2101.09577v1,ReliefE: Feature Ranking in High-dimensional Spaces via Manifold Embeddings,"Feature ranking has been widely adopted in machine learning applications such
as high-throughput biology and social sciences. The approaches of the popular
Relief family of algorithms assign importances to features by iteratively
accounting for nearest relevant and irrelevant instances. Despite their high
utility, these algorithms can be computationally expensive and not-well suited
for high-dimensional sparse input spaces. In contrast, recent embedding-based
methods learn compact, low-dimensional representations, potentially
facilitating down-stream learning capabilities of conventional learners. This
paper explores how the Relief branch of algorithms can be adapted to benefit
from (Riemannian) manifold-based embeddings of instance and target spaces,
where a given embedding's dimensionality is intrinsic to the dimensionality of
the considered data set. The developed ReliefE algorithm is faster and can
result in better feature rankings, as shown by our evaluation on 20 real-life
data sets for multi-class and multi-label classification tasks. The utility of
ReliefE for high-dimensional data sets is ensured by its implementation that
utilizes sparse matrix algebraic operations. Finally, the relation of ReliefE
to other ranking algorithms is studied via the Fuzzy Jaccard Index.","['Blaž Škrlj', 'Sašo Džeroski', 'Nada Lavrač', 'Matej Petković']","['cs.LG', 'stat.ML']",2021-01-23 20:23:31+00:00
http://arxiv.org/abs/2101.09512v1,Unsupervised clustering of series using dynamic programming,"We are interested in clustering parts of a given single multi-variate series
in an unsupervised manner. We would like to segment and cluster the series such
that the resulting blocks present in each cluster are coherent with respect to
a known model (e.g. physics model). Data points are said to be coherent if they
can be described using this model with the same parameters. We have designed an
algorithm based on dynamic programming with constraints on the number of
clusters, the number of transitions as well as the minimal size of a block such
that the clusters are coherent with this process. We present an use-case:
clustering of petrophysical series using the Waxman-Smits equation.","['Karthigan Sinnathamby', 'Chang-Yu Hou', 'Lalitha Venkataramanan', 'Vasileios-Marios Gkortsas', 'François Fleuret']","['cs.LG', 'stat.ML']",2021-01-23 14:35:35+00:00
http://arxiv.org/abs/2101.09460v1,Feature Selection Using Reinforcement Learning,"With the decreasing cost of data collection, the space of variables or
features that can be used to characterize a particular predictor of interest
continues to grow exponentially. Therefore, identifying the most characterizing
features that minimizes the variance without jeopardizing the bias of our
models is critical to successfully training a machine learning model. In
addition, identifying such features is critical for interpretability,
prediction accuracy and optimal computation cost. While statistical methods
such as subset selection, shrinkage, dimensionality reduction have been applied
in selecting the best set of features, some other approaches in literature have
approached feature selection task as a search problem where each state in the
search space is a possible feature subset. In this paper, we solved the feature
selection problem using Reinforcement Learning. Formulating the state space as
a Markov Decision Process (MDP), we used Temporal Difference (TD) algorithm to
select the best subset of features. Each state was evaluated using a robust and
low cost classifier algorithm which could handle any non-linearities in the
dataset.","['Sali Rasoul', 'Sodiq Adewole', 'Alphonse Akakpo']","['cs.LG', 'stat.ML']",2021-01-23 09:24:37+00:00
