id,title,abstract,authors,categories,date
http://arxiv.org/abs/2107.12438v4,"Debiasing In-Sample Policy Performance for Small-Data, Large-Scale Optimization","Motivated by the poor performance of cross-validation in settings where data
are scarce, we propose a novel estimator of the out-of-sample performance of a
policy in data-driven optimization.Our approach exploits the optimization
problem's sensitivity analysis to estimate the gradient of the optimal
objective value with respect to the amount of noise in the data and uses the
estimated gradient to debias the policy's in-sample performance. Unlike
cross-validation techniques, our approach avoids sacrificing data for a test
set, utilizes all data when training and, hence, is well-suited to settings
where data are scarce. We prove bounds on the bias and variance of our
estimator for optimization problems with uncertain linear objectives but known,
potentially non-convex, feasible regions. For more specialized optimization
problems where the feasible region is ""weakly-coupled"" in a certain sense, we
prove stronger results. Specifically, we provide explicit high-probability
bounds on the error of our estimator that hold uniformly over a policy class
and depends on the problem's dimension and policy class's complexity. Our
bounds show that under mild conditions, the error of our estimator vanishes as
the dimension of the optimization problem grows, even if the amount of
available data remains small and constant. Said differently, we prove our
estimator performs well in the small-data, large-scale regime. Finally, we
numerically compare our proposed method to state-of-the-art approaches through
a case-study on dispatching emergency medical response services using real
data. Our method provides more accurate estimates of out-of-sample performance
and learns better-performing policies.","['Vishal Gupta', 'Michael Huang', 'Paat Rusmevichientong']","['math.OC', 'cs.LG', 'stat.ML']",2021-07-26 19:00:51+00:00
http://arxiv.org/abs/2107.12365v2,Inference for Heteroskedastic PCA with Missing Data,"This paper studies how to construct confidence regions for principal
component analysis (PCA) in high dimension, a problem that has been vastly
under-explored. While computing measures of uncertainty for nonlinear/nonconvex
estimators is in general difficult in high dimension, the challenge is further
compounded by the prevalent presence of missing data and heteroskedastic noise.
We propose a novel approach to performing valid inference on the principal
subspace under a spiked covariance model with missing data, on the basis of an
estimator called HeteroPCA (Zhang et al., 2022). We develop non-asymptotic
distributional guarantees for HeteroPCA, and demonstrate how these can be
invoked to compute both confidence regions for the principal subspace and
entrywise confidence intervals for the spiked covariance matrix. Our inference
procedures are fully data-driven and adaptive to heteroskedastic random noise,
without requiring prior knowledge about the noise levels.","['Yuling Yan', 'Yuxin Chen', 'Jianqing Fan']","['math.ST', 'cs.IT', 'cs.LG', 'math.IT', 'stat.ME', 'stat.ML', 'stat.TH']",2021-07-26 17:59:01+00:00
http://arxiv.org/abs/2107.12364v3,Plugin Estimation of Smooth Optimal Transport Maps,"We analyze a number of natural estimators for the optimal transport map
between two distributions and show that they are minimax optimal. We adopt the
plugin approach: our estimators are simply optimal couplings between measures
derived from our observations, appropriately extended so that they define
functions on $\mathbb{R}^d$. When the underlying map is assumed to be
Lipschitz, we show that computing the optimal coupling between the empirical
measures, and extending it using linear smoothers, already gives a minimax
optimal estimator. When the underlying map enjoys higher regularity, we show
that the optimal coupling between appropriate nonparametric density estimates
yields faster rates. Our work also provides new bounds on the risk of
corresponding plugin estimators for the quadratic Wasserstein distance, and we
show how this problem relates to that of estimating optimal transport maps
using stability arguments for smooth and strongly convex Brenier potentials. As
an application of our results, we derive central limit theorems for plugin
estimators of the squared Wasserstein distance, which are centered at their
population counterpart when the underlying distributions have sufficiently
smooth densities. In contrast to known central limit theorems for empirical
estimators, this result easily lends itself to statistical inference for the
quadratic Wasserstein distance.","['Tudor Manole', 'Sivaraman Balakrishnan', 'Jonathan Niles-Weed', 'Larry Wasserman']","['math.ST', 'stat.ML', 'stat.TH']",2021-07-26 17:58:48+00:00
http://arxiv.org/abs/2107.12797v1,Wasserstein-Splitting Gaussian Process Regression for Heterogeneous Online Bayesian Inference,"Gaussian processes (GPs) are a well-known nonparametric Bayesian inference
technique, but they suffer from scalability problems for large sample sizes,
and their performance can degrade for non-stationary or spatially heterogeneous
data. In this work, we seek to overcome these issues through (i) employing
variational free energy approximations of GPs operating in tandem with online
expectation propagation steps; and (ii) introducing a local splitting step
which instantiates a new GP whenever the posterior distribution changes
significantly as quantified by the Wasserstein metric over posterior
distributions. Over time, then, this yields an ensemble of sparse GPs which may
be updated incrementally, and adapts to locality, heterogeneity, and
non-stationarity in training data.","['Michael E. Kepler', 'Alec Koppel', 'Amrit Singh Bedi', 'Daniel J. Stilwell']","['stat.ML', 'cs.LG']",2021-07-26 17:52:46+00:00
http://arxiv.org/abs/2107.12250v1,Uncertainty-Aware Time-to-Event Prediction using Deep Kernel Accelerated Failure Time Models,"Recurrent neural network based solutions are increasingly being used in the
analysis of longitudinal Electronic Health Record data. However, most works
focus on prediction accuracy and neglect prediction uncertainty. We propose
Deep Kernel Accelerated Failure Time models for the time-to-event prediction
task, enabling uncertainty-awareness of the prediction by a pipeline of a
recurrent neural network and a sparse Gaussian Process. Furthermore, a deep
metric learning based pre-training step is adapted to enhance the proposed
model. Our model shows better point estimate performance than recurrent neural
network based baselines in experiments on two real-world datasets. More
importantly, the predictive variance from our model can be used to quantify the
uncertainty estimates of the time-to-event prediction: Our model delivers
better performance when it is more confident in its prediction. Compared to
related methods, such as Monte Carlo Dropout, our model offers better
uncertainty estimates by leveraging an analytical solution and is more
computationally efficient.","['Zhiliang Wu', 'Yinchong Yang', 'Peter A. Fasching', 'Volker Tresp']","['cs.LG', 'stat.ML']",2021-07-26 14:55:02+00:00
http://arxiv.org/abs/2107.12248v1,Are Bayesian neural networks intrinsically good at out-of-distribution detection?,"The need to avoid confident predictions on unfamiliar data has sparked
interest in out-of-distribution (OOD) detection. It is widely assumed that
Bayesian neural networks (BNN) are well suited for this task, as the endowed
epistemic uncertainty should lead to disagreement in predictions on outliers.
In this paper, we question this assumption and provide empirical evidence that
proper Bayesian inference with common neural network architectures does not
necessarily lead to good OOD detection. To circumvent the use of approximate
inference, we start by studying the infinite-width case, where Bayesian
inference can be exact considering the corresponding Gaussian process.
Strikingly, the kernels induced under common architectural choices lead to
uncertainties that do not reflect the underlying data generating process and
are therefore unsuited for OOD detection. Finally, we study finite-width
networks using HMC, and observe OOD behavior that is consistent with the
infinite-width case. Overall, our study discloses fundamental problems when
naively using BNNs for OOD detection and opens interesting avenues for future
research.","['Christian Henning', ""Francesco D'Angelo"", 'Benjamin F. Grewe']","['cs.LG', 'stat.ML']",2021-07-26 14:53:14+00:00
http://arxiv.org/abs/2107.12100v2,Predicting Influential Higher-Order Patterns in Temporal Network Data,"Networks are frequently used to model complex systems comprised of
interacting elements. While edges capture the topology of direct interactions,
the true complexity of many systems originates from higher-order patterns in
paths by which nodes can indirectly influence each other. Path data,
representing ordered sequences of consecutive direct interactions, can be used
to model these patterns. On the one hand, to avoid overfitting, such models
should only consider those higher-order patterns for which the data provide
sufficient statistical evidence. On the other hand, we hypothesise that network
models, which capture only direct interactions, underfit higher-order patterns
present in data. Consequently, both approaches are likely to misidentify
influential nodes in complex networks. We contribute to this issue by proposing
five centrality measures based on MOGen, a multi-order generative model that
accounts for all indirect influences up to a maximum distance but disregards
influences at higher distances. We compare MOGen-based centralities to
equivalent measures for network models and path data in a prediction experiment
where we aim to identify influential nodes in out-of-sample data. Our results
show strong evidence supporting our hypothesis. MOGen consistently outperforms
both the network model and path-based prediction. We further show that the
performance difference between MOGen and the path-based approach disappears if
we have sufficient observations, confirming that the error is due to
overfitting.","['Christoph Gote', 'Vincenzo Perri', 'Ingo Scholtes']","['cs.SI', 'cs.IT', 'cs.LG', 'math.IT', 'physics.data-an', 'stat.ML']",2021-07-26 10:44:46+00:00
http://arxiv.org/abs/2107.12034v1,Workpiece Image-based Tool Wear Classification in Blanking Processes Using Deep Convolutional Neural Networks,"Blanking processes belong to the most widely used manufacturing techniques
due to their economic efficiency. Their economic viability depends to a large
extent on the resulting product quality and the associated customer
satisfaction as well as on possible downtimes. In particular, the occurrence of
increased tool wear reduces the product quality and leads to downtimes, which
is why considerable research has been carried out in recent years with regard
to wear detection. While processes have widely been monitored based on force
and acceleration signals, a new approach is pursued in this paper. Blanked
workpieces manufactured by punches with 16 different wear states are
photographed and then used as inputs for Deep Convolutional Neural Networks to
classify wear states. The results show that wear states can be predicted with
surprisingly high accuracy, opening up new possibilities and research
opportunities for tool wear monitoring of blanking processes.","['Dirk Alexander Molitor', 'Christian Kubik', 'Ruben Helmut Hetfleisch', 'Peter Groche']","['cs.LG', 'eess.IV', 'stat.ML']",2021-07-26 08:49:08+00:00
http://arxiv.org/abs/2107.11892v1,A brief note on understanding neural networks as Gaussian processes,"As a generalization of the work in [Lee et al., 2017], this note briefly
discusses when the prior of a neural network output follows a Gaussian process,
and how a neural-network-induced Gaussian process is formulated. The posterior
mean functions of such a Gaussian process regression lie in the reproducing
kernel Hilbert space defined by the neural-network-induced kernel. In the case
of two-layer neural networks, the induced Gaussian processes provide an
interpretation of the reproducing kernel Hilbert spaces whose union forms a
Barron space.",['Mengwu Guo'],"['cs.LG', 'cs.CE', 'stat.ML']",2021-07-25 21:06:58+00:00
http://arxiv.org/abs/2107.11869v3,Adaptive Estimation and Uniform Confidence Bands for Nonparametric Structural Functions and Elasticities,"We introduce two data-driven procedures for optimal estimation and inference
in nonparametric models using instrumental variables. The first is a
data-driven choice of sieve dimension for a popular class of sieve two-stage
least squares estimators. When implemented with this choice, estimators of both
the structural function $h_0$ and its derivatives (such as elasticities)
converge at the fastest possible (i.e., minimax) rates in sup-norm. The second
is for constructing uniform confidence bands (UCBs) for $h_0$ and its
derivatives. Our UCBs guarantee coverage over a generic class of
data-generating processes and contract at the minimax rate, possibly up to a
logarithmic factor. As such, our UCBs are asymptotically more efficient than
UCBs based on the usual approach of undersmoothing. As an application, we
estimate the elasticity of the intensive margin of firm exports in a
monopolistic competition model of international trade. Simulations illustrate
the good performance of our procedures in empirically calibrated designs. Our
results provide evidence against common parameterizations of the distribution
of unobserved firm heterogeneity.","['Xiaohong Chen', 'Timothy Christensen', 'Sid Kankanala']","['econ.EM', 'stat.ME', 'stat.ML']",2021-07-25 18:46:33+00:00
http://arxiv.org/abs/2107.11858v2,Estimation of Stationary Optimal Transport Plans,"We study optimal transport for stationary stochastic processes taking values
in finite spaces. In order to reflect the stationarity of the underlying
processes, we restrict attention to stationary couplings, also known as
joinings. The resulting optimal joining problem captures differences in the
long run average behavior of the processes of interest. We introduce estimators
of both optimal joinings and the optimal joining cost, and we establish
consistency of the estimators under mild conditions. Furthermore, under
stronger mixing assumptions we establish finite-sample error rates for the
estimated optimal joining cost that extend the best known results in the iid
case. Finally, we extend the consistency and rate analysis to an
entropy-penalized version of the optimal joining problem.","[""Kevin O'Connor"", 'Kevin McGoff', 'Andrew B Nobel']","['math.ST', 'math.DS', 'stat.ML', 'stat.TH']",2021-07-25 17:46:21+00:00
http://arxiv.org/abs/2107.11774v4,SGD with a Constant Large Learning Rate Can Converge to Local Maxima,"Previous works on stochastic gradient descent (SGD) often focus on its
success. In this work, we construct worst-case optimization problems
illustrating that, when not in the regimes that the previous works often
assume, SGD can exhibit many strange and potentially undesirable behaviors.
Specifically, we construct landscapes and data distributions such that (1) SGD
converges to local maxima, (2) SGD escapes saddle points arbitrarily slowly,
(3) SGD prefers sharp minima over flat ones, and (4) AMSGrad converges to local
maxima. We also realize results in a minimal neural network-like example. Our
results highlight the importance of simultaneously analyzing the minibatch
sampling, discrete-time updates rules, and realistic landscapes to understand
the role of SGD in deep learning.","['Liu Ziyin', 'Botao Li', 'James B. Simon', 'Masahito Ueda']","['cs.LG', 'math.OC', 'stat.ML']",2021-07-25 10:12:18+00:00
http://arxiv.org/abs/2107.11717v1,Invariance-based Multi-Clustering of Latent Space Embeddings for Equivariant Learning,"Variational Autoencoders (VAEs) have been shown to be remarkably effective in
recovering model latent spaces for several computer vision tasks. However,
currently trained VAEs, for a number of reasons, seem to fall short in learning
invariant and equivariant clusters in latent space. Our work focuses on
providing solutions to this problem and presents an approach to disentangle
equivariance feature maps in a Lie group manifold by enforcing deep,
group-invariant learning. Simultaneously implementing a novel separation of
semantic and equivariant variables of the latent space representation, we
formulate a modified Evidence Lower BOund (ELBO) by using a mixture model pdf
like Gaussian mixtures for invariant cluster embeddings that allows superior
unsupervised variational clustering. Our experiments show that this model
effectively learns to disentangle the invariant and equivariant representations
with significant improvements in the learning rate and an observably superior
image recognition and canonical state reconstruction compared to the currently
best deep learning models.","['Chandrajit Bajaj', 'Avik Roy', 'Haoran Zhang']","['cs.LG', 'stat.ML']",2021-07-25 03:27:47+00:00
http://arxiv.org/abs/2107.11712v2,Efficient inference of interventional distributions,"We consider the problem of efficiently inferring interventional distributions
in a causal Bayesian network from a finite number of observations. Let
$\mathcal{P}$ be a causal model on a set $\mathbf{V}$ of observable variables
on a given causal graph $G$. For sets $\mathbf{X},\mathbf{Y}\subseteq
\mathbf{V}$, and setting ${\bf x}$ to $\mathbf{X}$, let $P_{\bf x}(\mathbf{Y})$
denote the interventional distribution on $\mathbf{Y}$ with respect to an
intervention ${\bf x}$ to variables ${\bf x}$. Shpitser and Pearl (AAAI 2006),
building on the work of Tian and Pearl (AAAI 2001), gave an exact
characterization of the class of causal graphs for which the interventional
distribution $P_{\bf x}({\mathbf{Y}})$ can be uniquely determined. We give the
first efficient version of the Shpitser-Pearl algorithm. In particular, under
natural assumptions, we give a polynomial-time algorithm that on input a causal
graph $G$ on observable variables $\mathbf{V}$, a setting ${\bf x}$ of a set
$\mathbf{X} \subseteq \mathbf{V}$ of bounded size, outputs succinct
descriptions of both an evaluator and a generator for a distribution $\hat{P}$
that is $\varepsilon$-close (in total variation distance) to $P_{\bf
x}({\mathbf{Y}})$ where $Y=\mathbf{V}\setminus \mathbf{X}$, if $P_{\bf
x}(\mathbf{Y})$ is identifiable. We also show that when $\mathbf{Y}$ is an
arbitrary set, there is no efficient algorithm that outputs an evaluator of a
distribution that is $\varepsilon$-close to $P_{\bf x}({\mathbf{Y}})$ unless
all problems that have statistical zero-knowledge proofs, including the Graph
Isomorphism problem, have efficient randomized algorithms.","['Arnab Bhattacharyya', 'Sutanu Gayen', 'Saravanan Kandasamy', 'Vedant Raval', 'N. V. Vinodchandran']","['cs.DS', 'cs.LG', 'stat.ML']",2021-07-25 02:40:01+00:00
http://arxiv.org/abs/2107.11662v1,Inference of collective Gaussian hidden Markov models,"We consider inference problems for a class of continuous state collective
hidden Markov models, where the data is recorded in aggregate (collective) form
generated by a large population of individuals following the same dynamics. We
propose an aggregate inference algorithm called collective Gaussian
forward-backward algorithm, extending recently proposed Sinkhorn belief
propagation algorithm to models characterized by Gaussian densities. Our
algorithm enjoys convergence guarantee. In addition, it reduces to the standard
Kalman filter when the observations are generated by a single individual. The
efficacy of the proposed algorithm is demonstrated through multiple
experiments.","['Rahul Singh', 'Yongxin Chen']","['stat.ML', 'cs.LG', 'cs.SY', 'eess.SP', 'eess.SY']",2021-07-24 17:49:01+00:00
http://arxiv.org/abs/2107.11658v2,Tail of Distribution GAN (TailGAN): Generative-Adversarial-Network-Based Boundary Formation,"Generative Adversarial Networks (GAN) are a powerful methodology and can be
used for unsupervised anomaly detection, where current techniques have
limitations such as the accurate detection of anomalies near the tail of a
distribution. GANs generally do not guarantee the existence of a probability
density and are susceptible to mode collapse, while few GANs use likelihood to
reduce mode collapse. In this paper, we create a GAN-based tail formation model
for anomaly detection, the Tail of distribution GAN (TailGAN), to generate
samples on the tail of the data distribution and detect anomalies near the
support boundary. Using TailGAN, we leverage GANs for anomaly detection and use
maximum entropy regularization. Using GANs that learn the probability of the
underlying distribution has advantages in improving the anomaly detection
methodology by allowing us to devise a generator for boundary samples, and use
this model to characterize anomalies. TailGAN addresses supports with disjoint
components and achieves competitive performance on images. We evaluate TailGAN
for identifying Out-of-Distribution (OoD) data and its performance evaluated on
MNIST, CIFAR-10, Baggage X-Ray, and OoD data shows competitiveness compared to
methods from the literature.","['Nikolaos Dionelis', 'Mehrdad Yaghoobi', 'Sotirios A. Tsaftaris']","['cs.LG', 'stat.ML']",2021-07-24 17:29:21+00:00
http://arxiv.org/abs/2107.11630v2,Detecting Adversarial Examples Is (Nearly) As Hard As Classifying Them,"Making classifiers robust to adversarial examples is hard. Thus, many
defenses tackle the seemingly easier task of detecting perturbed inputs. We
show a barrier towards this goal. We prove a general hardness reduction between
detection and classification of adversarial examples: given a robust detector
for attacks at distance {\epsilon} (in some metric), we can build a similarly
robust (but inefficient) classifier for attacks at distance {\epsilon}/2. Our
reduction is computationally inefficient, and thus cannot be used to build
practical classifiers. Instead, it is a useful sanity check to test whether
empirical detection results imply something much stronger than the authors
presumably anticipated. To illustrate, we revisit 13 detector defenses. For
11/13 cases, we show that the claimed detection results would imply an
inefficient classifier with robustness far beyond the state-of-the-art.",['Florian Tramèr'],"['cs.LG', 'cs.CR', 'stat.ML']",2021-07-24 15:14:53+00:00
http://arxiv.org/abs/2107.11609v1,A Model-Agnostic Algorithm for Bayes Error Determination in Binary Classification,"This paper presents the intrinsic limit determination algorithm (ILD
Algorithm), a novel technique to determine the best possible performance,
measured in terms of the AUC (area under the ROC curve) and accuracy, that can
be obtained from a specific dataset in a binary classification problem with
categorical features {\sl regardless} of the model used. This limit, namely the
Bayes error, is completely independent of any model used and describes an
intrinsic property of the dataset. The ILD algorithm thus provides important
information regarding the prediction limits of any binary classification
algorithm when applied to the considered dataset. In this paper the algorithm
is described in detail, its entire mathematical framework is presented and the
pseudocode is given to facilitate its implementation. Finally, an example with
a real dataset is given.","['Umberto Michelucci', 'Michela Sperti', 'Dario Piga', 'Francesca Venturini', 'Marco A. Deriu']","['cs.LG', 'cs.AI', 'stat.ML']",2021-07-24 13:55:31+00:00
http://arxiv.org/abs/2107.11533v1,Combining Online Learning and Offline Learning for Contextual Bandits with Deficient Support,"We address policy learning with logged data in contextual bandits. Current
offline-policy learning algorithms are mostly based on inverse propensity score
(IPS) weighting requiring the logging policy to have \emph{full support} i.e. a
non-zero probability for any context/action of the evaluation policy. However,
many real-world systems do not guarantee such logging policies, especially when
the action space is large and many actions have poor or missing rewards. With
such \emph{support deficiency}, the offline learning fails to find optimal
policies. We propose a novel approach that uses a hybrid of offline learning
with online exploration. The online exploration is used to explore unsupported
actions in the logged data whilst offline learning is used to exploit supported
actions from the logged data avoiding unnecessary explorations. Our approach
determines an optimal policy with theoretical guarantees using the minimal
number of online explorations. We demonstrate our algorithms' effectiveness
empirically on a diverse collection of datasets.","['Hung Tran-The', 'Sunil Gupta', 'Thanh Nguyen-Tang', 'Santu Rana', 'Svetha Venkatesh']","['stat.ML', 'cs.LG']",2021-07-24 05:07:43+00:00
