id,title,abstract,authors,categories,date
http://arxiv.org/abs/2211.11119v1,Counterfactual Learning with Multioutput Deep Kernels,"In this paper, we address the challenge of performing counterfactual
inference with observational data via Bayesian nonparametric regression
adjustment, with a focus on high-dimensional settings featuring multiple
actions and multiple correlated outcomes. We present a general class of
counterfactual multi-task deep kernels models that estimate causal effects and
learn policies proficiently thanks to their sample efficiency gains, while
scaling well with high dimensions. In the first part of the work, we rely on
Structural Causal Models (SCM) to formally introduce the setup and the problem
of identifying counterfactual quantities under observed confounding. We then
discuss the benefits of tackling the task of causal effects estimation via
stacked coregionalized Gaussian Processes and Deep Kernels. Finally, we
demonstrate the use of the proposed methods on simulated experiments that span
individual causal effects estimation, off-policy evaluation and optimization.","['Alberto Caron', 'Gianluca Baio', 'Ioanna Manolopoulou']","['cs.LG', 'stat.ML']",2022-11-20 23:28:41+00:00
http://arxiv.org/abs/2211.11103v2,The Past Does Matter: Correlation of Subsequent States in Trajectory Predictions of Gaussian Process Models,"Computing the distribution of trajectories from a Gaussian Process model of a
dynamical system is an important challenge in utilizing such models. Motivated
by the computational cost of sampling-based approaches, we consider
approximations of the model's output and trajectory distribution. We show that
previous work on uncertainty propagation, focussed on discrete state-space
models, incorrectly included an independence assumption between subsequent
states of the predicted trajectories. Expanding these ideas to continuous
ordinary differential equation models, we illustrate the implications of this
assumption and propose a novel piecewise linear approximation of Gaussian
Processes to mitigate them.","['Steffen Ridderbusch', 'Sina Ober-Blöbaum', 'Paul Goulart']","['stat.ML', 'cs.LG', 'math.DS']",2022-11-20 22:19:39+00:00
http://arxiv.org/abs/2212.00103v1,Quadratically Regularized Optimal Transport: nearly optimal potentials and convergence of discrete Laplace operators,"We consider the conjecture proposed in Matsumoto, Zhang and Schiebinger
(2022) suggesting that optimal transport with quadratic regularisation can be
used to construct a graph whose discrete Laplace operator converges to the
Laplace--Beltrami operator. We derive first order optimal potentials for the
problem under consideration and find that the resulting solutions exhibit a
surprising resemblance to the well-known Barenblatt--Prattle solution of the
porous medium equation. Then, relying on these first order optimal potentials,
we derive the pointwise $L^2$-limit of such discrete operators built from an
i.i.d. random sample on a smooth compact manifold. Simulation results
complementing the limiting distribution results are also presented.","['Gilles Mordant', 'Stephen Zhang']","['math.AP', 'math.PR', 'math.ST', 'stat.ML', 'stat.TH', '62R30']",2022-11-20 22:12:16+00:00
http://arxiv.org/abs/2211.11052v1,Convexifying Transformers: Improving optimization and understanding of transformer networks,"Understanding the fundamental mechanism behind the success of transformer
networks is still an open problem in the deep learning literature. Although
their remarkable performance has been mostly attributed to the self-attention
mechanism, the literature still lacks a solid analysis of these networks and
interpretation of the functions learned by them. To this end, we study the
training problem of attention/transformer networks and introduce a novel convex
analytic approach to improve the understanding and optimization of these
networks. Particularly, we first introduce a convex alternative to the
self-attention mechanism and reformulate the regularized training problem of
transformer networks with our alternative convex attention. Then, we cast the
reformulation as a convex optimization problem that is interpretable and easier
to optimize. Moreover, as a byproduct of our convex analysis, we reveal an
implicit regularization mechanism, which promotes sparsity across tokens.
Therefore, we not only improve the optimization of attention/transformer
networks but also provide a solid theoretical understanding of the functions
learned by them. We also demonstrate the effectiveness of our theory through
several numerical experiments.","['Tolga Ergen', 'Behnam Neyshabur', 'Harsh Mehta']","['cs.LG', 'cs.AI', 'cs.CL', 'stat.ML']",2022-11-20 18:17:47+00:00
http://arxiv.org/abs/2211.11028v1,Algorithmic Decision-Making Safeguarded by Human Knowledge,"Commercial AI solutions provide analysts and managers with data-driven
business intelligence for a wide range of decisions, such as demand forecasting
and pricing. However, human analysts may have their own insights and
experiences about the decision-making that is at odds with the algorithmic
recommendation. In view of such a conflict, we provide a general analytical
framework to study the augmentation of algorithmic decisions with human
knowledge: the analyst uses the knowledge to set a guardrail by which the
algorithmic decision is clipped if the algorithmic output is out of bound, and
seems unreasonable. We study the conditions under which the augmentation is
beneficial relative to the raw algorithmic decision. We show that when the
algorithmic decision is asymptotically optimal with large data, the
non-data-driven human guardrail usually provides no benefit. However, we point
out three common pitfalls of the algorithmic decision: (1) lack of domain
knowledge, such as the market competition, (2) model misspecification, and (3)
data contamination. In these cases, even with sufficient data, the augmentation
from human knowledge can still improve the performance of the algorithmic
decision.","['Ningyuan Chen', 'Ming Hu', 'Wenhao Li']","['stat.ML', 'cs.HC', 'cs.LG']",2022-11-20 17:13:32+00:00
http://arxiv.org/abs/2211.11003v3,Unadjusted Hamiltonian MCMC with Stratified Monte Carlo Time Integration,"A randomized time integrator is suggested for unadjusted Hamiltonian Monte
Carlo (uHMC) which involves a very minor modification to the usual Verlet time
integrator, and hence, is easy to implement. For target distributions of the
form $\mu(dx) \propto e^{-U(x)} dx$ where $U: \mathbb{R}^d \to \mathbb{R}_{\ge
0}$ is $K$-strongly convex but only $L$-gradient Lipschitz, and initial
distributions $\nu$ with finite second moment, coupling proofs reveal that an
$\varepsilon$-accurate approximation of the target distribution in
$L^2$-Wasserstein distance $\boldsymbol{\mathcal{W}}^2$ can be achieved by the
uHMC algorithm with randomized time integration using $O\left((d/K)^{1/3}
(L/K)^{5/3} \varepsilon^{-2/3} \log( \boldsymbol{\mathcal{W}}^2(\mu, \nu) /
\varepsilon)^+\right)$ gradient evaluations; whereas for such rough target
densities the corresponding complexity of the uHMC algorithm with Verlet time
integration is in general $O\left((d/K)^{1/2} (L/K)^2 \varepsilon^{-1} \log(
\boldsymbol{\mathcal{W}}^2(\mu, \nu) / \varepsilon)^+ \right)$.
Metropolis-adjustable randomized time integrators are also provided.","['Nawaf Bou-Rabee', 'Milo Marsden']","['math.PR', 'cs.NA', 'math.NA', 'math.ST', 'stat.CO', 'stat.ML', 'stat.TH', '60J05 (Primary) 65C05, 65P10 (Secondary)']",2022-11-20 15:45:26+00:00
http://arxiv.org/abs/2211.10987v1,Finding active galactic nuclei through Fink,"We present the Active Galactic Nuclei (AGN) classifier as currently
implemented within the Fink broker. Features were built upon summary statistics
of available photometric points, as well as color estimation enabled by
symbolic regression. The learning stage includes an active learning loop, used
to build an optimized training sample from labels reported in astronomical
catalogs. Using this method to classify real alerts from the Zwicky Transient
Facility (ZTF), we achieved 98.0% accuracy, 93.8% precision and 88.5% recall.
We also describe the modifications necessary to enable processing data from the
upcoming Vera C. Rubin Observatory Large Survey of Space and Time (LSST), and
apply them to the training sample of the Extended LSST Astronomical Time-series
Classification Challenge (ELAsTiCC). Results show that our designed feature
space enables high performances of traditional machine learning algorithms in
this binary classification task.","['Etienne Russeil', 'Emille E. O. Ishida', 'Roman Le Montagner', 'Julien Peloton', 'Anais Moller']","['astro-ph.IM', 'stat.ML']",2022-11-20 14:24:15+00:00
http://arxiv.org/abs/2211.10968v3,Statistical Optimality of Divide and Conquer Kernel-based Functional Linear Regression,"Previous analysis of regularized functional linear regression in a
reproducing kernel Hilbert space (RKHS) typically requires the target function
to be contained in this kernel space. This paper studies the convergence
performance of divide-and-conquer estimators in the scenario that the target
function does not necessarily reside in the underlying RKHS. As a
decomposition-based scalable approach, the divide-and-conquer estimators of
functional linear regression can substantially reduce the algorithmic
complexities in time and memory. We develop an integral operator approach to
establish sharp finite sample upper bounds for prediction with
divide-and-conquer estimators under various regularity conditions of
explanatory variables and target function. We also prove the asymptotic
optimality of the derived rates by building the mini-max lower bounds. Finally,
we consider the convergence of noiseless estimators and show that the rates can
be arbitrarily fast under mild conditions.","['Jiading Liu', 'Lei Shi']","['stat.ML', 'cs.LG']",2022-11-20 12:29:06+00:00
http://arxiv.org/abs/2211.10866v2,Estimating Task Completion Times for Network Rollouts using Statistical Models within Partitioning-based Regression Methods,"This paper proposes a data and Machine Learning-based forecasting solution
for the Telecommunications network-rollout planning problem. Milestone
completion-time estimation is crucial to network-rollout planning; accurate
estimates enable better crew utilisation and optimised cost of materials and
logistics. Using historical data of milestone completion times, a model needs
to incorporate domain knowledge, handle noise and yet be interpretable to
project managers. This paper proposes partition-based regression models that
incorporate data-driven statistical models within each partition, as a solution
to the problem. Benchmarking experiments demonstrate that the proposed approach
obtains competitive to better performance, at a small fraction of the model
complexity of the best alternative approach based on Gradient Boosting.
Experiments also demonstrate that the proposed approach is effective for both
short and long-range forecasts. The proposed idea is applicable in any context
requiring time-series regression with noisy and attributed data.","['Venkatachalam Natchiappan', 'Shrihari Vasudevan', 'Thalanayar Muthukumar']","['cs.LG', 'cs.AI', 'stat.ML']",2022-11-20 04:28:12+00:00
http://arxiv.org/abs/2211.12343v4,Diffusion Model Based Posterior Sampling for Noisy Linear Inverse Problems,"With the rapid development of diffusion models and flow-based generative
models, there has been a surge of interests in solving noisy linear inverse
problems, e.g., super-resolution, deblurring, denoising, colorization, etc,
with generative models. However, while remarkable reconstruction performances
have been achieved, their inference time is typically too slow since most of
them rely on the seminal diffusion posterior sampling (DPS) framework and thus
to approximate the intractable likelihood score, time-consuming gradient
calculation through back-propagation is needed. To address this issue, this
paper provides a fast and effective solution by proposing a simple closed-form
approximation to the likelihood score. For both diffusion and flow-based
models, extensive experiments are conducted on various noisy linear inverse
problems such as noisy super-resolution, denoising, deblurring, and
colorization. In all these tasks, our method (namely DMPS) demonstrates highly
competitive or even better reconstruction performances while being
significantly faster than all the baseline methods.","['Xiangming Meng', 'Yoshiyuki Kabashima']","['cs.LG', 'cs.CV', 'cs.IT', 'math.IT', 'stat.ML']",2022-11-20 01:09:49+00:00
http://arxiv.org/abs/2211.10805v3,On the Pointwise Behavior of Recursive Partitioning and Its Implications for Heterogeneous Causal Effect Estimation,"Decision tree learning is increasingly being used for pointwise inference.
Important applications include causal heterogenous treatment effects and
dynamic policy decisions, as well as conditional quantile regression and design
of experiments, where tree estimation and inference is conducted at specific
values of the covariates. In this paper, we call into question the use of
decision trees (trained by adaptive recursive partitioning) for such purposes
by demonstrating that they can fail to achieve polynomial rates of convergence
in uniform norm with non-vanishing probability, even with pruning. Instead, the
convergence may be arbitrarily slow or, in some important special cases, such
as honest regression trees, fail completely. We show that random forests can
remedy the situation, turning poor performing trees into nearly optimal
procedures, at the cost of losing interpretability and introducing two
additional tuning parameters. The two hallmarks of random forests, subsampling
and the random feature selection mechanism, are seen to each distinctively
contribute to achieving nearly optimal performance for the model class
considered.","['Matias D. Cattaneo', 'Jason M. Klusowski', 'Peter M. Tian']","['stat.ML', 'cs.LG', 'math.ST', 'stat.TH']",2022-11-19 21:28:30+00:00
http://arxiv.org/abs/2211.10793v1,BENK: The Beran Estimator with Neural Kernels for Estimating the Heterogeneous Treatment Effect,"A method for estimating the conditional average treatment effect under
condition of censored time-to-event data called BENK (the Beran Estimator with
Neural Kernels) is proposed. The main idea behind the method is to apply the
Beran estimator for estimating the survival functions of controls and
treatments. Instead of typical kernel functions in the Beran estimator, it is
proposed to implement kernels in the form of neural networks of a specific form
called the neural kernels. The conditional average treatment effect is
estimated by using the survival functions as outcomes of the control and
treatment neural networks which consists of a set of neural kernels with shared
parameters. The neural kernels are more flexible and can accurately model a
complex location structure of feature vectors. Various numerical simulation
experiments illustrate BENK and compare it with the well-known T-learner,
S-learner and X-learner for several types of the control and treatment outcome
functions based on the Cox models, the random survival forest and the
Nadaraya-Watson regression with Gaussian kernels. The code of proposed
algorithms implementing BENK is available in https://github.com/Stasychbr/BENK.","['Stanislav R. Kirpichenko', 'Lev V. Utkin', 'Andrei V. Konstantinov']","['cs.LG', 'stat.ML']",2022-11-19 20:36:52+00:00
http://arxiv.org/abs/2211.10760v4,Evaluating Synthetically Generated Data from Small Sample Sizes: An Experimental Study,"This work proposes a method to evaluate the similarity between low-sample
tabular data and synthetically generated data with a larger number of samples
than the original. The technique is known to as data augmentation. However,
significance values derived from non-parametric tests are questionable when the
sample size is limited. Our approach uses a combination of geometry, topology,
and robust statistics for hypothesis testing to evaluate the ""validity"" of
generated data. We additionally contrast the findings with prominent global
metric practices described in the literature for large sample size data.",['Javier Marin'],"['cs.LG', 'stat.ML']",2022-11-19 18:18:52+00:00
http://arxiv.org/abs/2211.10747v3,Exploring validation metrics for offline model-based optimisation with diffusion models,"In model-based optimisation (MBO) we are interested in using machine learning
to design candidates that maximise some measure of reward with respect to a
black box function called the (ground truth) oracle, which is expensive to
compute since it involves executing a real world process. In offline MBO we
wish to do so without assuming access to such an oracle during training or
validation, with makes evaluation non-straightforward. While an approximation
to the ground oracle can be trained and used in place of it during model
validation to measure the mean reward over generated candidates, the evaluation
is approximate and vulnerable to adversarial examples. Measuring the mean
reward of generated candidates over this approximation is one such `validation
metric', whereas we are interested in a more fundamental question which is
finding which validation metrics correlate the most with the ground truth. This
involves proposing validation metrics and quantifying them over many datasets
for which the ground truth is known, for instance simulated environments. This
is encapsulated under our proposed evaluation framework which is also designed
to measure extrapolation, which is the ultimate goal behind leveraging
generative models for MBO. While our evaluation framework is model agnostic we
specifically evaluate denoising diffusion models due to their state-of-the-art
performance, as well as derive interesting insights such as ranking the most
effective validation metrics as well as discussing important hyperparameters.","['Christopher Beckham', 'Alexandre Piche', 'David Vazquez', 'Christopher Pal']","['stat.ML', 'cs.LG']",2022-11-19 16:57:37+00:00
http://arxiv.org/abs/2211.10656v1,Parallel Diffusion Models of Operator and Image for Blind Inverse Problems,"Diffusion model-based inverse problem solvers have demonstrated
state-of-the-art performance in cases where the forward operator is known (i.e.
non-blind). However, the applicability of the method to blind inverse problems
has yet to be explored. In this work, we show that we can indeed solve a family
of blind inverse problems by constructing another diffusion prior for the
forward operator. Specifically, parallel reverse diffusion guided by gradients
from the intermediate stages enables joint optimization of both the forward
operator parameters as well as the image, such that both are jointly estimated
at the end of the parallel reverse diffusion procedure. We show the efficacy of
our method on two representative tasks -- blind deblurring, and imaging through
turbulence -- and show that our method yields state-of-the-art performance,
while also being flexible to be applicable to general blind inverse problems
when we know the functional forms.","['Hyungjin Chung', 'Jeongsol Kim', 'Sehui Kim', 'Jong Chul Ye']","['cs.CV', 'cs.LG', 'stat.ML']",2022-11-19 10:36:32+00:00
http://arxiv.org/abs/2211.10575v1,"Bayesian autoencoders for data-driven discovery of coordinates, governing equations and fundamental constants","Recent progress in autoencoder-based sparse identification of nonlinear
dynamics (SINDy) under $\ell_1$ constraints allows joint discoveries of
governing equations and latent coordinate systems from spatio-temporal data,
including simulated video frames. However, it is challenging for $\ell_1$-based
sparse inference to perform correct identification for real data due to the
noisy measurements and often limited sample sizes. To address the data-driven
discovery of physics in the low-data and high-noise regimes, we propose
Bayesian SINDy autoencoders, which incorporate a hierarchical Bayesian
sparsifying prior: Spike-and-slab Gaussian Lasso. Bayesian SINDy autoencoder
enables the joint discovery of governing equations and coordinate systems with
a theoretically guaranteed uncertainty estimate. To resolve the challenging
computational tractability of the Bayesian hierarchical setting, we adapt an
adaptive empirical Bayesian method with Stochatic gradient Langevin dynamics
(SGLD) which gives a computationally tractable way of Bayesian posterior
sampling within our framework. Bayesian SINDy autoencoder achieves better
physics discovery with lower data and fewer training epochs, along with valid
uncertainty quantification suggested by the experimental studies. The Bayesian
SINDy autoencoder can be applied to real video data, with accurate physics
discovery which correctly identifies the governing equation and provides a
close estimate for standard physics constants like gravity $g$, for example, in
videos of a pendulum.","['L. Mars Gao', 'J. Nathan Kutz']","['cs.LG', 'cs.AI', 'stat.ML']",2022-11-19 03:29:01+00:00
http://arxiv.org/abs/2211.10515v2,Curiosity in Hindsight: Intrinsic Exploration in Stochastic Environments,"Consider the problem of exploration in sparse-reward or reward-free
environments, such as in Montezuma's Revenge. In the curiosity-driven paradigm,
the agent is rewarded for how much each realized outcome differs from their
predicted outcome. But using predictive error as intrinsic motivation is
fragile in stochastic environments, as the agent may become trapped by
high-entropy areas of the state-action space, such as a ""noisy TV"". In this
work, we study a natural solution derived from structural causal models of the
world: Our key idea is to learn representations of the future that capture
precisely the unpredictable aspects of each outcome -- which we use as
additional input for predictions, such that intrinsic rewards only reflect the
predictable aspects of world dynamics. First, we propose incorporating such
hindsight representations into models to disentangle ""noise"" from ""novelty"",
yielding Curiosity in Hindsight: a simple and scalable generalization of
curiosity that is robust to stochasticity. Second, we instantiate this
framework for the recently introduced BYOL-Explore algorithm as our prime
example, resulting in the noise-robust BYOL-Hindsight. Third, we illustrate its
behavior under a variety of different stochasticities in a grid world, and find
improvements over BYOL-Explore in hard-exploration Atari games with sticky
actions. Notably, we show state-of-the-art results in exploring Montezuma's
Revenge with sticky actions, while preserving performance in the non-sticky
setting.","['Daniel Jarrett', 'Corentin Tallec', 'Florent Altché', 'Thomas Mesnard', 'Rémi Munos', 'Michal Valko']","['stat.ML', 'cs.LG']",2022-11-18 21:49:53+00:00
http://arxiv.org/abs/2211.10508v1,Distributionally Robust Survival Analysis: A Novel Fairness Loss Without Demographics,"We propose a general approach for training survival analysis models that
minimizes a worst-case error across all subpopulations that are large enough
(occurring with at least a user-specified minimum probability). This approach
uses a training loss function that does not know any demographic information to
treat as sensitive. Despite this, we demonstrate that our proposed approach
often scores better on recently established fairness metrics (without a
significant drop in prediction accuracy) compared to various baselines,
including ones which directly use sensitive demographic information in their
training loss. Our code is available at: https://github.com/discovershu/DRO_COX","['Shu Hu', 'George H. Chen']","['stat.ML', 'cs.LG']",2022-11-18 20:54:34+00:00
http://arxiv.org/abs/2211.10420v3,Mirror Sinkhorn: Fast Online Optimization on Transport Polytopes,"Optimal transport is an important tool in machine learning, allowing to
capture geometric properties of the data through a linear program on transport
polytopes. We present a single-loop optimization algorithm for minimizing
general convex objectives on these domains, utilizing the principles of
Sinkhorn matrix scaling and mirror descent. The proposed algorithm is robust to
noise, and can be used in an online setting. We provide theoretical guarantees
for convex objectives and experimental results showcasing it effectiveness on
both synthetic and real-world data.","['Marin Ballu', 'Quentin Berthet']","['cs.LG', 'stat.ML']",2022-11-18 18:35:14+00:00
