id,title,abstract,authors,categories,date
http://arxiv.org/abs/2311.06117v1,Distributionally Robust Skeleton Learning of Discrete Bayesian Networks,"We consider the problem of learning the exact skeleton of general discrete
Bayesian networks from potentially corrupted data. Building on distributionally
robust optimization and a regression approach, we propose to optimize the most
adverse risk over a family of distributions within bounded Wasserstein distance
or KL divergence to the empirical distribution. The worst-case risk accounts
for the effect of outliers. The proposed approach applies for general
categorical random variables without assuming faithfulness, an ordinal
relationship or a specific form of conditional distribution. We present
efficient algorithms and show the proposed methods are closely related to the
standard regularized regression approach. Under mild assumptions, we derive
non-asymptotic guarantees for successful structure learning with logarithmic
sample complexities for bounded-degree graphs. Numerical study on synthetic and
real datasets validates the effectiveness of our method. Code is available at
https://github.com/DanielLeee/drslbn.","['Yeshu Li', 'Brian D. Ziebart']","['cs.LG', 'stat.ML']",2023-11-10 15:33:19+00:00
http://arxiv.org/abs/2311.06108v5,Consistency for constrained maximum likelihood estimation and clustering based on mixtures of elliptically-symmetric distributions under general data generating processes,"The consistency of the maximum likelihood estimator for mixtures of
elliptically-symmetric distributions for estimating its population version is
shown, where the underlying distribution $P$ is nonparametric and does not
necessarily belong to the class of mixtures on which the estimator is based. In
a situation where $P$ is a mixture of well enough separated but nonparametric
distributions it is shown that the components of the population version of the
estimator correspond to the well separated components of $P$. This provides
some theoretical justification for the use of such estimators for cluster
analysis in case that $P$ has well separated subpopulations even if these
subpopulations differ from what the mixture model assumes.","['Pietro Coretto', 'Christian Hennig']","['math.ST', 'stat.ML', 'stat.TH', '62H30, 62F35']",2023-11-10 15:20:39+00:00
http://arxiv.org/abs/2311.05931v2,Early-Exit Neural Networks with Nested Prediction Sets,"Early-exit neural networks (EENNs) enable adaptive and efficient inference by
providing predictions at multiple stages during the forward pass. In
safety-critical applications, these predictions are meaningful only when
accompanied by reliable uncertainty estimates. A popular method for quantifying
the uncertainty of predictive models is the use of prediction sets. However, we
demonstrate that standard techniques such as conformal prediction and Bayesian
credible sets are not suitable for EENNs. They tend to generate non-nested sets
across exits, meaning that labels deemed improbable at one exit may reappear in
the prediction set of a subsequent exit. To address this issue, we investigate
anytime-valid confidence sequences (AVCSs), an extension of traditional
confidence intervals tailored for data-streaming scenarios. These sequences are
inherently nested and thus well-suited for an EENN's sequential predictions. We
explore the theoretical and practical challenges of using AVCSs in EENNs and
show that they indeed yield nested sets across exits. Thus our work presents a
promising approach towards fast, yet still safe, predictive modeling","['Metod Jazbec', 'Patrick Forré', 'Stephan Mandt', 'Dan Zhang', 'Eric Nalisnick']","['cs.LG', 'cs.AI', 'stat.ML']",2023-11-10 08:38:18+00:00
http://arxiv.org/abs/2311.05866v2,Fair Supervised Learning with A Simple Random Sampler of Sensitive Attributes,"As the data-driven decision process becomes dominating for industrial
applications, fairness-aware machine learning arouses great attention in
various areas. This work proposes fairness penalties learned by neural networks
with a simple random sampler of sensitive attributes for non-discriminatory
supervised learning. In contrast to many existing works that critically rely on
the discreteness of sensitive attributes and response variables, the proposed
penalty is able to handle versatile formats of the sensitive attributes, so it
is more extensively applicable in practice than many existing algorithms. This
penalty enables us to build a computationally efficient group-level
in-processing fairness-aware training framework. Empirical evidence shows that
our framework enjoys better utility and fairness measures on popular benchmark
data sets than competing methods. We also theoretically characterize estimation
errors and loss of utility of the proposed neural-penalized risk minimization
problem.","['Jinwon Sohn', 'Qifan Song', 'Guang Lin']","['stat.ML', 'cs.LG']",2023-11-10 04:38:13+00:00
http://arxiv.org/abs/2311.05795v1,Improvements on Uncertainty Quantification for Node Classification via Distance-Based Regularization,"Deep neural networks have achieved significant success in the last decades,
but they are not well-calibrated and often produce unreliable predictions. A
large number of literature relies on uncertainty quantification to evaluate the
reliability of a learning model, which is particularly important for
applications of out-of-distribution (OOD) detection and misclassification
detection. We are interested in uncertainty quantification for interdependent
node-level classification. We start our analysis based on graph posterior
networks (GPNs) that optimize the uncertainty cross-entropy (UCE)-based loss
function. We describe the theoretical limitations of the widely-used UCE loss.
To alleviate the identified drawbacks, we propose a distance-based
regularization that encourages clustered OOD nodes to remain clustered in the
latent space. We conduct extensive comparison experiments on eight standard
datasets and demonstrate that the proposed regularization outperforms the
state-of-the-art in both OOD detection and misclassification detection.","['Russell Alan Hart', 'Linlin Yu', 'Yifei Lou', 'Feng Chen']","['cs.LG', 'stat.ML']",2023-11-10 00:00:20+00:00
http://arxiv.org/abs/2311.05788v2,Structured Transforms Across Spaces with Cost-Regularized Optimal Transport,"Matching a source to a target probability measure is often solved by
instantiating a linear optimal transport (OT) problem, parameterized by a
ground cost function that quantifies discrepancy between points. When these
measures live in the same metric space, the ground cost often defaults to its
distance. When instantiated across two different spaces, however, choosing that
cost in the absence of aligned data is a conundrum. As a result, practitioners
often resort to solving instead a quadratic Gromow-Wasserstein (GW) problem. We
exploit in this work a parallel between GW and cost-regularized OT, the
regularized minimization of a linear OT objective parameterized by a ground
cost. We use this cost-regularized formulation to match measures across two
different Euclidean spaces, where the cost is evaluated between transformed
source points and target points. We show that several quadratic OT problems
fall in this category, and consider enforcing structure in linear transform
(e.g. sparsity), by introducing structure-inducing regularizers. We provide a
proximal algorithm to extract such transforms from unaligned data, and
demonstrate its applicability to single-cell spatial transcriptomics/multiomics
matching tasks.","['Othmane Sebbouh', 'Marco Cuturi', 'Gabriel Peyré']","['cs.LG', 'math.OC', 'stat.ML']",2023-11-09 23:33:31+00:00
http://arxiv.org/abs/2311.05756v1,Step and Smooth Decompositions as Topological Clustering,"We investigate a class of recovery problems for which observations are a
noisy combination of continuous and step functions. These problems can be seen
as non-injective instances of non-linear ICA with direct applications to image
decontamination for magnetic resonance imaging. Alternately, the problem can be
viewed as clustering in the presence of structured (smooth) contaminant. We
show that a global topological property (graph connectivity) interacts with a
local property (the degree of smoothness of the continuous component) to
determine conditions under which the components are identifiable. Additionally,
a practical estimation algorithm is provided for the case when the contaminant
lies in a reproducing kernel Hilbert space of continuous functions. Algorithm
effectiveness is demonstrated through a series of simulations and real-world
studies.","['Luciano Vinas', 'Arash A. Amini']","['math.ST', 'stat.AP', 'stat.ML', 'stat.TH']",2023-11-09 21:46:22+00:00
http://arxiv.org/abs/2311.05742v1,Optimal simulation-based Bayesian decisions,"We present a framework for the efficient computation of optimal Bayesian
decisions under intractable likelihoods, by learning a surrogate model for the
expected utility (or its distribution) as a function of the action and data
spaces. We leverage recent advances in simulation-based inference and Bayesian
optimization to develop active learning schemes to choose where in parameter
and action spaces to simulate. This allows us to learn the optimal action in as
few simulations as possible. The resulting framework is extremely simulation
efficient, typically requiring fewer model calls than the associated posterior
inference task alone, and a factor of $100-1000$ more efficient than
Monte-Carlo based methods. Our framework opens up new capabilities for
performing Bayesian decision making, particularly in the previously challenging
regime where likelihoods are intractable, and simulations expensive.","['Justin Alsing', 'Thomas D. P. Edwards', 'Benjamin Wandelt']","['stat.ML', 'astro-ph.IM', 'cs.AI', 'cs.GT', 'cs.LG']",2023-11-09 20:59:52+00:00
http://arxiv.org/abs/2311.05589v1,A Coefficient Makes SVRG Effective,"Stochastic Variance Reduced Gradient (SVRG), introduced by Johnson & Zhang
(2013), is a theoretically compelling optimization method. However, as Defazio
& Bottou (2019) highlights, its effectiveness in deep learning is yet to be
proven. In this work, we demonstrate the potential of SVRG in optimizing
real-world neural networks. Our analysis finds that, for deeper networks, the
strength of the variance reduction term in SVRG should be smaller and decrease
as training progresses. Inspired by this, we introduce a multiplicative
coefficient $\alpha$ to control the strength and adjust it through a linear
decay schedule. We name our method $\alpha$-SVRG. Our results show
$\alpha$-SVRG better optimizes neural networks, consistently reducing training
loss compared to both baseline and the standard SVRG across various
architectures and image classification datasets. We hope our findings encourage
further exploration into variance reduction techniques in deep learning. Code
is available at https://github.com/davidyyd/alpha-SVRG.","['Yida Yin', 'Zhiqiu Xu', 'Zhiyuan Li', 'Trevor Darrell', 'Zhuang Liu']","['cs.LG', 'math.OC', 'stat.ML']",2023-11-09 18:47:44+00:00
http://arxiv.org/abs/2311.05672v3,Conditional Optimal Transport on Function Spaces,"We present a systematic study of conditional triangular transport maps in
function spaces from the perspective of optimal transportation and with a view
towards amortized Bayesian inference. More specifically, we develop a theory of
constrained optimal transport problems that describe block-triangular Monge
maps that characterize conditional measures along with their Kantorovich
relaxations. This generalizes the theory of optimal triangular transport to
separable infinite-dimensional function spaces with general cost functions. We
further tailor our results to the case of Bayesian inference problems and
obtain regularity estimates on the conditioning maps from the prior to the
posterior. Finally, we present numerical experiments that demonstrate the
computational applicability of our theoretical results for amortized and
likelihood-free inference of functional parameters.","['Bamdad Hosseini', 'Alexander W. Hsu', 'Amirhossein Taghvaei']","['math.OC', 'math.PR', 'stat.CO', 'stat.ML', '49Q22, 62G86, 62F15, 60B05']",2023-11-09 18:44:42+00:00
http://arxiv.org/abs/2311.05573v1,Outlier-Robust Wasserstein DRO,"Distributionally robust optimization (DRO) is an effective approach for
data-driven decision-making in the presence of uncertainty. Geometric
uncertainty due to sampling or localized perturbations of data points is
captured by Wasserstein DRO (WDRO), which seeks to learn a model that performs
uniformly well over a Wasserstein ball centered around the observed data
distribution. However, WDRO fails to account for non-geometric perturbations
such as adversarial outliers, which can greatly distort the Wasserstein
distance measurement and impede the learned model. We address this gap by
proposing a novel outlier-robust WDRO framework for decision-making under both
geometric (Wasserstein) perturbations and non-geometric (total variation (TV))
contamination that allows an $\varepsilon$-fraction of data to be arbitrarily
corrupted. We design an uncertainty set using a certain robust Wasserstein ball
that accounts for both perturbation types and derive minimax optimal excess
risk bounds for this procedure that explicitly capture the Wasserstein and TV
risks. We prove a strong duality result that enables tractable convex
reformulations and efficient computation of our outlier-robust WDRO problem.
When the loss function depends only on low-dimensional features of the data, we
eliminate certain dimension dependencies from the risk bounds that are
unavoidable in the general setting. Finally, we present experiments validating
our theory on standard regression and classification tasks.","['Sloan Nietert', 'Ziv Goldfeld', 'Soroosh Shafiee']","['stat.ML', 'cs.LG', 'math.OC']",2023-11-09 18:32:00+00:00
http://arxiv.org/abs/2311.05501v1,Dirichlet Active Learning,"This work introduces Dirichlet Active Learning (DiAL), a Bayesian-inspired
approach to the design of active learning algorithms. Our framework models
feature-conditional class probabilities as a Dirichlet random field and lends
observational strength between similar features in order to calibrate the
random field. This random field can then be utilized in learning tasks: in
particular, we can use current estimates of mean and variance to conduct
classification and active learning in the context where labeled data is scarce.
We demonstrate the applicability of this model to low-label rate graph learning
by constructing ``propagation operators'' based upon the graph Laplacian, and
offer computational studies demonstrating the method's competitiveness with the
state of the art. Finally, we provide rigorous guarantees regarding the ability
of this approach to ensure both exploration and exploitation, expressed
respectively in terms of cluster exploration and increased attention to
decision boundaries.","['Kevin Miller', 'Ryan Murray']","['stat.ML', 'cs.LG']",2023-11-09 16:39:02+00:00
http://arxiv.org/abs/2311.05436v4,Fair Wasserstein Coresets,"Data distillation and coresets have emerged as popular approaches to generate
a smaller representative set of samples for downstream learning tasks to handle
large-scale datasets. At the same time, machine learning is being increasingly
applied to decision-making processes at a societal level, making it imperative
for modelers to address inherent biases towards subgroups present in the data.
While current approaches focus on creating fair synthetic representative
samples by optimizing local properties relative to the original samples, their
impact on downstream learning processes has yet to be explored. In this work,
we present fair Wasserstein coresets (FWC), a novel coreset approach which
generates fair synthetic representative samples along with sample-level weights
to be used in downstream learning tasks. FWC uses an efficient majority
minimization algorithm to minimize the Wasserstein distance between the
original dataset and the weighted synthetic samples while enforcing demographic
parity. We show that an unconstrained version of FWC is equivalent to Lloyd's
algorithm for k-medians and k-means clustering. Experiments conducted on both
synthetic and real datasets show that FWC: (i) achieves a competitive
fairness-utility tradeoff in downstream models compared to existing approaches,
(ii) improves downstream fairness when added to the existing training data and
(iii) can be used to reduce biases in predictions from large language models
(GPT-3.5 and GPT-4).","['Zikai Xiong', 'Niccolò Dalmasso', 'Shubham Sharma', 'Freddy Lecue', 'Daniele Magazzeni', 'Vamsi K. Potluru', 'Tucker Balch', 'Manuela Veloso']","['stat.ML', 'cs.CY', 'cs.LG']",2023-11-09 15:21:56+00:00
http://arxiv.org/abs/2311.05398v1,The Sample Complexity Of ERMs In Stochastic Convex Optimization,"Stochastic convex optimization is one of the most well-studied models for
learning in modern machine learning. Nevertheless, a central fundamental
question in this setup remained unresolved: ""How many data points must be
observed so that any empirical risk minimizer (ERM) shows good performance on
the true population?"" This question was proposed by Feldman (2016), who proved
that $\Omega(\frac{d}{\epsilon}+\frac{1}{\epsilon^2})$ data points are
necessary (where $d$ is the dimension and $\epsilon>0$ is the accuracy
parameter). Proving an $\omega(\frac{d}{\epsilon}+\frac{1}{\epsilon^2})$ lower
bound was left as an open problem. In this work we show that in fact
$\tilde{O}(\frac{d}{\epsilon}+\frac{1}{\epsilon^2})$ data points are also
sufficient. This settles the question and yields a new separation between ERMs
and uniform convergence. This sample complexity holds for the classical setup
of learning bounded convex Lipschitz functions over the Euclidean unit ball. We
further generalize the result and show that a similar upper bound holds for all
symmetric convex bodies. The general bound is composed of two terms: (i) a term
of the form $\tilde{O}(\frac{d}{\epsilon})$ with an inverse-linear dependence
on the accuracy parameter, and (ii) a term that depends on the statistical
complexity of the class of $\textit{linear}$ functions (captured by the
Rademacher complexity). The proof builds a mechanism for controlling the
behavior of stochastic convex optimization problems.","['Daniel Carmon', 'Roi Livni', 'Amir Yehudayoff']","['cs.LG', 'stat.ML']",2023-11-09 14:29:25+00:00
http://arxiv.org/abs/2311.05245v1,Uncertainty Wrapper in the medical domain: Establishing transparent uncertainty quantification for opaque machine learning models in practice,"When systems use data-based models that are based on machine learning (ML),
errors in their results cannot be ruled out. This is particularly critical if
it remains unclear to the user how these models arrived at their decisions and
if errors can have safety-relevant consequences, as is often the case in the
medical field. In such cases, the use of dependable methods to quantify the
uncertainty remaining in a result allows the user to make an informed decision
about further usage and draw possible conclusions based on a given result. This
paper demonstrates the applicability and practical utility of the Uncertainty
Wrapper using flow cytometry as an application from the medical field that can
benefit from the use of ML models in conjunction with dependable and
transparent uncertainty quantification.","['Lisa Jöckel', 'Michael Kläs', 'Georg Popp', 'Nadja Hilger', 'Stephan Fricke']","['cs.LG', 'cs.AI', 'stat.ML']",2023-11-09 09:58:02+00:00
http://arxiv.org/abs/2311.05241v3,When Meta-Learning Meets Online and Continual Learning: A Survey,"Over the past decade, deep neural networks have demonstrated significant
success using the training scheme that involves mini-batch stochastic gradient
descent on extensive datasets. Expanding upon this accomplishment, there has
been a surge in research exploring the application of neural networks in other
learning scenarios. One notable framework that has garnered significant
attention is meta-learning. Often described as ""learning to learn,""
meta-learning is a data-driven approach to optimize the learning algorithm.
Other branches of interest are continual learning and online learning, both of
which involve incrementally updating a model with streaming data. While these
frameworks were initially developed independently, recent works have started
investigating their combinations, proposing novel problem settings and learning
algorithms. However, due to the elevated complexity and lack of unified
terminology, discerning differences between the learning frameworks can be
challenging even for experienced researchers. To facilitate a clear
understanding, this paper provides a comprehensive survey that organizes
various problem settings using consistent terminology and formal descriptions.
By offering an overview of these learning paradigms, our work aims to foster
further advancements in this promising area of research.","['Jaehyeon Son', 'Soochan Lee', 'Gunhee Kim']","['cs.LG', 'stat.ML']",2023-11-09 09:49:50+00:00
http://arxiv.org/abs/2311.10101v1,Gaussian Differential Privacy on Riemannian Manifolds,"We develop an advanced approach for extending Gaussian Differential Privacy
(GDP) to general Riemannian manifolds. The concept of GDP stands out as a
prominent privacy definition that strongly warrants extension to manifold
settings, due to its central limit properties. By harnessing the power of the
renowned Bishop-Gromov theorem in geometric analysis, we propose a Riemannian
Gaussian distribution that integrates the Riemannian distance, allowing us to
achieve GDP in Riemannian manifolds with bounded Ricci curvature. To the best
of our knowledge, this work marks the first instance of extending the GDP
framework to accommodate general Riemannian manifolds, encompassing curved
spaces, and circumventing the reliance on tangent space summaries. We provide a
simple algorithm to evaluate the privacy budget $\mu$ on any one-dimensional
manifold and introduce a versatile Markov Chain Monte Carlo (MCMC)-based
algorithm to calculate $\mu$ on any Riemannian manifold with constant
curvature. Through simulations on one of the most prevalent manifolds in
statistics, the unit sphere $S^d$, we demonstrate the superior utility of our
Riemannian Gaussian mechanism in comparison to the previously proposed
Riemannian Laplace mechanism for implementing GDP.","['Yangdi Jiang', 'Xiaotian Chang', 'Yi Liu', 'Lei Ding', 'Linglong Kong', 'Bei Jiang']","['cs.CR', 'cs.DS', 'cs.LG', 'stat.ML', 'stat.OT']",2023-11-09 04:46:27+00:00
http://arxiv.org/abs/2311.05088v1,Meta-learning of semi-supervised learning from tasks with heterogeneous attribute spaces,"We propose a meta-learning method for semi-supervised learning that learns
from multiple tasks with heterogeneous attribute spaces. The existing
semi-supervised meta-learning methods assume that all tasks share the same
attribute space, which prevents us from learning with a wide variety of tasks.
With the proposed method, the expected test performance on tasks with a small
amount of labeled data is improved with unlabeled data as well as data in
various tasks, where the attribute spaces are different among tasks. The
proposed method embeds labeled and unlabeled data simultaneously in a
task-specific space using a neural network, and the unlabeled data's labels are
estimated by adapting classification or regression models in the embedding
space. For the neural network, we develop variable-feature self-attention
layers, which enable us to find embeddings of data with different attribute
spaces with a single neural network by considering interactions among examples,
attributes, and labels. Our experiments on classification and regression
datasets with heterogeneous attribute spaces demonstrate that our proposed
method outperforms the existing meta-learning and semi-supervised learning
methods.","['Tomoharu Iwata', 'Atsutoshi Kumagai']","['cs.LG', 'cs.AI', 'stat.ML']",2023-11-09 01:22:58+00:00
http://arxiv.org/abs/2311.05067v2,Accelerating Exploration with Unlabeled Prior Data,"Learning to solve tasks from a sparse reward signal is a major challenge for
standard reinforcement learning (RL) algorithms. However, in the real world,
agents rarely need to solve sparse reward tasks entirely from scratch. More
often, we might possess prior experience to draw on that provides considerable
guidance about which actions and outcomes are possible in the world, which we
can use to explore more effectively for new tasks. In this work, we study how
prior data without reward labels may be used to guide and accelerate
exploration for an agent solving a new sparse reward task. We propose a simple
approach that learns a reward model from online experience, labels the
unlabeled prior data with optimistic rewards, and then uses it concurrently
alongside the online data for downstream policy and critic optimization. This
general formula leads to rapid exploration in several challenging sparse-reward
domains where tabula rasa exploration is insufficient, including the AntMaze
domain, Adroit hand manipulation domain, and a visual simulated robotic
manipulation domain. Our results highlight the ease of incorporating unlabeled
prior data into existing online RL algorithms, and the (perhaps surprising)
effectiveness of doing so.","['Qiyang Li', 'Jason Zhang', 'Dibya Ghosh', 'Amy Zhang', 'Sergey Levine']","['cs.LG', 'cs.AI', 'stat.ML']",2023-11-09 00:05:17+00:00
