id,title,abstract,authors,categories,date
http://arxiv.org/abs/2210.11844v1,Cox-Hawkes: doubly stochastic spatiotemporal Poisson processes,"Hawkes processes are point process models that have been used to capture
self-excitatory behavior in social interactions, neural activity, earthquakes
and viral epidemics. They can model the occurrence of the times and locations
of events. Here we develop a new class of spatiotemporal Hawkes processes that
can capture both triggering and clustering behavior and we provide an efficient
method for performing inference. We use a log-Gaussian Cox process (LGCP) as
prior for the background rate of the Hawkes process which gives arbitrary
flexibility to capture a wide range of underlying background effects (for
infectious diseases these are called endemic effects). The Hawkes process and
LGCP are computationally expensive due to the former having a likelihood with
quadratic complexity in the number of observations and the latter involving
inversion of the precision matrix which is cubic in observations. Here we
propose a novel approach to perform MCMC sampling for our Hawkes process with
LGCP background, using pre-trained Gaussian Process generators which provide
direct and cheap access to samples during inference. We show the efficacy and
flexibility of our approach in experiments on simulated data and use our
methods to uncover the trends in a dataset of reported crimes in the US.","['Xenia Miscouridou', 'Samir Bhatt', 'George Mohler', 'Seth Flaxman', 'Swapnil Mishra']","['stat.ML', 'cs.LG']",2022-10-21 09:47:34+00:00
http://arxiv.org/abs/2210.11836v1,Structural Kernel Search via Bayesian Optimization and Symbolical Optimal Transport,"Despite recent advances in automated machine learning, model selection is
still a complex and computationally intensive process. For Gaussian processes
(GPs), selecting the kernel is a crucial task, often done manually by the
expert. Additionally, evaluating the model selection criteria for Gaussian
processes typically scales cubically in the sample size, rendering kernel
search particularly computationally expensive. We propose a novel, efficient
search method through a general, structured kernel space. Previous methods
solved this task via Bayesian optimization and relied on measuring the distance
between GP's directly in function space to construct a kernel-kernel. We
present an alternative approach by defining a kernel-kernel over the symbolic
representation of the statistical hypothesis that is associated with a kernel.
We empirically show that this leads to a computationally more efficient way of
searching through a discrete kernel space.","['Matthias Bitzer', 'Mona Meister', 'Christoph Zimmer']","['cs.LG', 'cs.AI', 'stat.ML']",2022-10-21 09:30:21+00:00
http://arxiv.org/abs/2210.11834v2,Optimal Contextual Bandits with Knapsacks under Realizability via Regression Oracles,"We study the stochastic contextual bandit with knapsacks (CBwK) problem,
where each action, taken upon a context, not only leads to a random reward but
also costs a random resource consumption in a vector form. The challenge is to
maximize the total reward without violating the budget for each resource. We
study this problem under a general realizability setting where the expected
reward and expected cost are functions of contexts and actions in some given
general function classes $\mathcal{F}$ and $\mathcal{G}$, respectively.
Existing works on CBwK are restricted to the linear function class since they
use UCB-type algorithms, which heavily rely on the linear form and thus are
difficult to extend to general function classes. Motivated by online regression
oracles that have been successfully applied to contextual bandits, we propose
the first universal and optimal algorithmic framework for CBwK by reducing it
to online regression. We also establish the lower regret bound to show the
optimality of our algorithm for a variety of function classes.","['Yuxuan Han', 'Jialin Zeng', 'Yang Wang', 'Yang Xiang', 'Jiheng Zhang']","['cs.LG', 'stat.ML']",2022-10-21 09:28:53+00:00
http://arxiv.org/abs/2210.11790v2,FoSR: First-order spectral rewiring for addressing oversquashing in GNNs,"Graph neural networks (GNNs) are able to leverage the structure of graph data
by passing messages along the edges of the graph. While this allows GNNs to
learn features depending on the graph structure, for certain graph topologies
it leads to inefficient information propagation and a problem known as
oversquashing. This has recently been linked with the curvature and spectral
gap of the graph. On the other hand, adding edges to the message-passing graph
can lead to increasingly similar node representations and a problem known as
oversmoothing. We propose a computationally efficient algorithm that prevents
oversquashing by systematically adding edges to the graph based on spectral
expansion. We combine this with a relational architecture, which lets the GNN
preserve the original graph structure and provably prevents oversmoothing. We
find experimentally that our algorithm outperforms existing graph rewiring
methods in several graph classification tasks.","['Kedar Karhadkar', 'Pradeep Kr. Banerjee', 'Guido Montúfar']","['cs.LG', 'stat.ML']",2022-10-21 07:58:03+00:00
http://arxiv.org/abs/2210.11780v3,Correlating sparse sensing for large-scale traffic speed estimation: A Laplacian-enhanced low-rank tensor kriging approach,"Traffic speed is central to characterizing the fluidity of the road network.
Many transportation applications rely on it, such as real-time navigation,
dynamic route planning, and congestion management. Rapid advances in sensing
and communication techniques make traffic speed detection easier than ever.
However, due to sparse deployment of static sensors or low penetration of
mobile sensors, speeds detected are incomplete and far from network-wide use.
In addition, sensors are prone to error or missing data due to various kinds of
reasons, speeds from these sensors can become highly noisy. These drawbacks
call for effective techniques to recover credible estimates from the incomplete
data. In this work, we first identify the issue as a spatiotemporal kriging
problem and propose a Laplacian enhanced low-rank tensor completion (LETC)
framework featuring both lowrankness and multi-dimensional correlations for
large-scale traffic speed kriging under limited observations. To be specific,
three types of speed correlation including temporal continuity, temporal
periodicity, and spatial proximity are carefully chosen and simultaneously
modeled by three different forms of graph Laplacian, named temporal graph
Fourier transform, generalized temporal consistency regularization, and
diffusion graph regularization. We then design an efficient solution algorithm
via several effective numeric techniques to scale up the proposed model to
network-wide kriging. By performing experiments on two public million-level
traffic speed datasets, we finally draw the conclusion and find our proposed
LETC achieves the state-of-the-art kriging performance even under low
observation rates, while at the same time saving more than half computing time
compared with baseline methods. Some insights into spatiotemporal traffic data
modeling and kriging at the network level are provided as well.","['Tong Nie', 'Guoyang Qin', 'Yunpeng Wang', 'Jian Sun']","['stat.ML', 'cs.LG']",2022-10-21 07:25:57+00:00
http://arxiv.org/abs/2210.11737v1,Bayesian deep learning framework for uncertainty quantification in high dimensions,"We develop a novel deep learning method for uncertainty quantification in
stochastic partial differential equations based on Bayesian neural network
(BNN) and Hamiltonian Monte Carlo (HMC). A BNN efficiently learns the posterior
distribution of the parameters in deep neural networks by performing Bayesian
inference on the network parameters. The posterior distribution is efficiently
sampled using HMC to quantify uncertainties in the system. Several numerical
examples are shown for both forward and inverse problems in high dimension to
demonstrate the effectiveness of the proposed method for uncertainty
quantification. These also show promising results that the computational cost
is almost independent of the dimension of the problem demonstrating the
potential of the method for tackling the so-called curse of dimensionality.","['Jeahan Jung', 'Minseok Choi']","['stat.ML', 'cs.AI', 'cs.LG']",2022-10-21 05:20:06+00:00
http://arxiv.org/abs/2210.11620v2,LOT: Layer-wise Orthogonal Training on Improving $\ell_2$ Certified Robustness,"Recent studies show that training deep neural networks (DNNs) with Lipschitz
constraints are able to enhance adversarial robustness and other model
properties such as stability. In this paper, we propose a layer-wise orthogonal
training method (LOT) to effectively train 1-Lipschitz convolution layers via
parametrizing an orthogonal matrix with an unconstrained matrix. We then
efficiently compute the inverse square root of a convolution kernel by
transforming the input domain to the Fourier frequency domain. On the other
hand, as existing works show that semi-supervised training helps improve
empirical robustness, we aim to bridge the gap and prove that semi-supervised
learning also improves the certified robustness of Lipschitz-bounded models. We
conduct comprehensive evaluations for LOT under different settings. We show
that LOT significantly outperforms baselines regarding deterministic l2
certified robustness, and scales to deeper neural networks. Under the
supervised scenario, we improve the state-of-the-art certified robustness for
all architectures (e.g. from 59.04% to 63.50% on CIFAR-10 and from 32.57% to
34.59% on CIFAR-100 at radius rho = 36/255 for 40-layer networks). With
semi-supervised learning over unlabelled data, we are able to improve
state-of-the-art certified robustness on CIFAR-10 at rho = 108/255 from 36.04%
to 42.39%. In addition, LOT consistently outperforms baselines on different
model architectures with only 1/3 evaluation time.","['Xiaojun Xu', 'Linyi Li', 'Bo Li']","['cs.LG', 'stat.ML']",2022-10-20 22:31:26+00:00
http://arxiv.org/abs/2210.11589v2,Monotonic Risk Relationships under Distribution Shifts for Regularized Risk Minimization,"Machine learning systems are often applied to data that is drawn from a
different distribution than the training distribution. Recent work has shown
that for a variety of classification and signal reconstruction problems, the
out-of-distribution performance is strongly linearly correlated with the
in-distribution performance. If this relationship or more generally a monotonic
one holds, it has important consequences. For example, it allows to optimize
performance on one distribution as a proxy for performance on the other. In
this paper, we study conditions under which a monotonic relationship between
the performances of a model on two distributions is expected. We prove an exact
asymptotic linear relation for squared error and a monotonic relation for
misclassification error for ridge-regularized general linear models under
covariate shift, as well as an approximate linear relation for linear inverse
problems.","['Daniel LeJeune', 'Jiayu Liu', 'Reinhard Heckel']","['cs.LG', 'stat.ML']",2022-10-20 21:01:14+00:00
http://arxiv.org/abs/2210.11562v1,Local SGD in Overparameterized Linear Regression,"We consider distributed learning using constant stepsize SGD (DSGD) over
several devices, each sending a final model update to a central server. In a
final step, the local estimates are aggregated. We prove in the setting of
overparameterized linear regression general upper bounds with matching lower
bounds and derive learning rates for specific data generating distributions. We
show that the excess risk is of order of the variance provided the number of
local nodes grows not too large with the global sample size. We further compare
the sample complexity of DSGD with the sample complexity of distributed ridge
regression (DRR) and show that the excess SGD-risk is smaller than the excess
RR-risk, where both sample complexities are of the same order.","['Mike Nguyen', 'Charly Kirst', 'Nicole Mücke']","['stat.ML', 'cs.LG']",2022-10-20 19:58:22+00:00
http://arxiv.org/abs/2210.11538v1,An Improved Algorithm for Clustered Federated Learning,"In this paper, we address the dichotomy between heterogeneous models and
simultaneous training in Federated Learning (FL) via a clustering framework. We
define a new clustering model for FL based on the (optimal) local models of the
users: two users belong to the same cluster if their local models are close;
otherwise they belong to different clusters. A standard algorithm for clustered
FL is proposed in \cite{ghosh_efficient_2021}, called \texttt{IFCA}, which
requires \emph{suitable} initialization and the knowledge of hyper-parameters
like the number of clusters (which is often quite difficult to obtain in
practical applications) to converge. We propose an improved algorithm,
\emph{Successive Refine Federated Clustering Algorithm} (\texttt{SR-FCA}),
which removes such restrictive assumptions. \texttt{SR-FCA} treats each user as
a singleton cluster as an initialization, and then successively refine the
cluster estimation via exploiting similar users belonging to the same cluster.
In any intermediate step, \texttt{SR-FCA} uses a robust federated learning
algorithm within each cluster to exploit simultaneous training and to correct
clustering errors. Furthermore, \texttt{SR-FCA} does not require any
\emph{good} initialization (warm start), both in theory and practice. We show
that with proper choice of learning rate, \texttt{SR-FCA} incurs arbitrarily
small clustering error. Additionally, we validate the performance of our
algorithm on standard FL datasets in non-convex problems like neural nets, and
we show the benefits of \texttt{SR-FCA} over baselines.","['Harshvardhan', 'Avishek Ghosh', 'Arya Mazumdar']","['stat.ML', 'cs.DC', 'cs.IT', 'cs.LG', 'math.IT']",2022-10-20 19:14:36+00:00
http://arxiv.org/abs/2210.11530v1,Theoretical analysis of deep neural networks for temporally dependent observations,"Deep neural networks are powerful tools to model observations over time with
non-linear patterns. Despite the widespread use of neural networks in such
settings, most theoretical developments of deep neural networks are under the
assumption of independent observations, and theoretical results for temporally
dependent observations are scarce. To bridge this gap, we study theoretical
properties of deep neural networks on modeling non-linear time series data.
Specifically, non-asymptotic bounds for prediction error of (sparse)
feed-forward neural network with ReLU activation function is established under
mixing-type assumptions. These assumptions are mild such that they include a
wide range of time series models including auto-regressive models. Compared to
independent observations, established convergence rates have additional
logarithmic factors to compensate for additional complexity due to dependence
among data points. The theoretical results are supported via various numerical
simulation settings as well as an application to a macroeconomic data set.","['Mingliang Ma', 'Abolfazl Safikhani']","['stat.ML', 'cs.LG']",2022-10-20 18:56:37+00:00
http://arxiv.org/abs/2210.11452v2,Global Convergence of SGD On Two Layer Neural Nets,"In this note we demonstrate provable convergence of SGD to the global minima
of appropriately regularized $\ell_2-$empirical risk of depth $2$ nets -- for
arbitrary data and with any number of gates, if they are using adequately
smooth and bounded activations like sigmoid and tanh. We build on the results
in [1] and leverage a constant amount of Frobenius norm regularization on the
weights, along with sampling of the initial weights from an appropriate
distribution. We also give a continuous time SGD convergence result that also
applies to smooth unbounded activations like SoftPlus. Our key idea is to show
the existence loss functions on constant sized neural nets which are ""Villani
Functions"". [1] Bin Shi, Weijie J. Su, and Michael I. Jordan. On learning rates
and schr\""odinger operators, 2020. arXiv:2004.06977","['Pulkit Gopalani', 'Anirbit Mukherjee']","['cs.LG', 'math.OC', 'stat.ML']",2022-10-20 17:50:46+00:00
http://arxiv.org/abs/2210.11445v3,Bagging in overparameterized learning: Risk characterization and risk monotonization,"Bagging is a commonly used ensemble technique in statistics and machine
learning to improve the performance of prediction procedures. In this paper, we
study the prediction risk of variants of bagged predictors under the
proportional asymptotics regime, in which the ratio of the number of features
to the number of observations converges to a constant. Specifically, we propose
a general strategy to analyze the prediction risk under squared error loss of
bagged predictors using classical results on simple random sampling.
Specializing the strategy, we derive the exact asymptotic risk of the bagged
ridge and ridgeless predictors with an arbitrary number of bags under a
well-specified linear model with arbitrary feature covariance matrices and
signal vectors. Furthermore, we prescribe a generic cross-validation procedure
to select the optimal subsample size for bagging and discuss its utility to
eliminate the non-monotonic behavior of the limiting risk in the sample size
(i.e., double or multiple descents). In demonstrating the proposed procedure
for bagged ridge and ridgeless predictors, we thoroughly investigate the oracle
properties of the optimal subsample size and provide an in-depth comparison
between different bagging variants.","['Pratik Patil', 'Jin-Hong Du', 'Arun Kumar Kuchibhotla']","['math.ST', 'stat.ML', 'stat.TH']",2022-10-20 17:45:58+00:00
http://arxiv.org/abs/2210.11436v2,Revisiting Le Cam's Equation: Exact Minimax Rates over Convex Density Classes,"We study the classical problem of deriving minimax rates for density
estimation over convex density classes. Building on the pioneering work of Le
Cam (1973), Birge (1983, 1986), Wong and Shen (1995), Yang and Barron (1999),
we determine the exact (up to constants) minimax rate over any convex density
class. This work thus extends these known results by demonstrating that the
local metric entropy of the density class always captures the minimax optimal
rates under such settings. Our bounds provide a unifying perspective across
both parametric and nonparametric convex density classes, under weaker
assumptions on the richness of the density class than previously considered.
Our proposed `multistage sieve' MLE applies to any such convex density class.
We further demonstrate that this estimator is also adaptive to the true
underlying density of interest. We apply our risk bounds to rederive known
minimax rates including bounded total variation, and Holder density classes. We
further illustrate the utility of the result by deriving upper bounds for less
studied classes, e.g., convex mixture of densities.","['Shamindra Shrotriya', 'Matey Neykov']","['math.ST', 'stat.ML', 'stat.TH']",2022-10-20 17:35:27+00:00
http://arxiv.org/abs/2210.11402v1,Learning Rationalizable Equilibria in Multiplayer Games,"A natural goal in multiagent learning besides finding equilibria is to learn
rationalizable behavior, where players learn to avoid iteratively dominated
actions. However, even in the basic setting of multiplayer general-sum games,
existing algorithms require a number of samples exponential in the number of
players to learn rationalizable equilibria under bandit feedback. This paper
develops the first line of efficient algorithms for learning rationalizable
Coarse Correlated Equilibria (CCE) and Correlated Equilibria (CE) whose sample
complexities are polynomial in all problem parameters including the number of
players. To achieve this result, we also develop a new efficient algorithm for
the simpler task of finding one rationalizable action profile (not necessarily
an equilibrium), whose sample complexity substantially improves over the best
existing results of Wu et al. (2021). Our algorithms incorporate several novel
techniques to guarantee rationalizability and no (swap-)regret simultaneously,
including a correlated exploration scheme and adaptive learning rates, which
may be of independent interest. We complement our results with a sample
complexity lower bound showing the sharpness of our guarantees.","['Yuanhao Wang', 'Dingwen Kong', 'Yu Bai', 'Chi Jin']","['cs.LG', 'cs.AI', 'cs.GT', 'stat.ML']",2022-10-20 16:49:00+00:00
http://arxiv.org/abs/2210.11385v1,On Representations of Mean-Field Variational Inference,"The mean field variational inference (MFVI) formulation restricts the general
Bayesian inference problem to the subspace of product measures. We present a
framework to analyze MFVI algorithms, which is inspired by a similar
development for general variational Bayesian formulations. Our approach enables
the MFVI problem to be represented in three different manners: a gradient flow
on Wasserstein space, a system of Fokker-Planck-like equations and a diffusion
process. Rigorous guarantees are established to show that a time-discretized
implementation of the coordinate ascent variational inference algorithm in the
product Wasserstein space of measures yields a gradient flow in the limit. A
similar result is obtained for their associated densities, with the limit being
given by a quasi-linear partial differential equation. A popular class of
practical algorithms falls in this framework, which provides tools to establish
convergence. We hope this framework could be used to guarantee convergence of
algorithms in a variety of approaches, old and new, to solve variational
inference problems.","['Soumyadip Ghosh', 'Yingdong Lu', 'Tomasz Nowicki', 'Edith Zhang']","['stat.ML', 'cs.AI', 'cs.LG']",2022-10-20 16:26:22+00:00
http://arxiv.org/abs/2210.11377v1,Krylov-Bellman boosting: Super-linear policy evaluation in general state spaces,"We present and analyze the Krylov-Bellman Boosting (KBB) algorithm for policy
evaluation in general state spaces. It alternates between fitting the Bellman
residual using non-parametric regression (as in boosting), and estimating the
value function via the least-squares temporal difference (LSTD) procedure
applied with a feature set that grows adaptively over time. By exploiting the
connection to Krylov methods, we equip this method with two attractive
guarantees. First, we provide a general convergence bound that allows for
separate estimation errors in residual fitting and LSTD computation. Consistent
with our numerical experiments, this bound shows that convergence rates depend
on the restricted spectral structure, and are typically super-linear. Second,
by combining this meta-result with sample-size dependent guarantees for
residual fitting and LSTD computation, we obtain concrete statistical
guarantees that depend on the sample size along with the complexity of the
function class used to fit the residuals. We illustrate the behavior of the KBB
algorithm for various types of policy evaluation problems, and typically find
large reductions in sample complexity relative to the standard approach of
fitted value iterationn.","['Eric Xia', 'Martin J. Wainwright']","['stat.ML', 'cs.LG', 'math.OC', 'math.ST', 'stat.TH']",2022-10-20 16:17:14+00:00
http://arxiv.org/abs/2210.11369v1,On Feature Learning in the Presence of Spurious Correlations,"Deep classifiers are known to rely on spurious features $\unicode{x2013}$
patterns which are correlated with the target on the training data but not
inherently relevant to the learning problem, such as the image backgrounds when
classifying the foregrounds. In this paper we evaluate the amount of
information about the core (non-spurious) features that can be decoded from the
representations learned by standard empirical risk minimization (ERM) and
specialized group robustness training. Following recent work on Deep Feature
Reweighting (DFR), we evaluate the feature representations by re-training the
last layer of the model on a held-out set where the spurious correlation is
broken. On multiple vision and NLP problems, we show that the features learned
by simple ERM are highly competitive with the features learned by specialized
group robustness methods targeted at reducing the effect of spurious
correlations. Moreover, we show that the quality of learned feature
representations is greatly affected by the design decisions beyond the training
method, such as the model architecture and pre-training strategy. On the other
hand, we find that strong regularization is not necessary for learning high
quality feature representations. Finally, using insights from our analysis, we
significantly improve upon the best results reported in the literature on the
popular Waterbirds, CelebA hair color prediction and WILDS-FMOW problems,
achieving 97%, 92% and 50% worst-group accuracies, respectively.","['Pavel Izmailov', 'Polina Kirichenko', 'Nate Gruver', 'Andrew Gordon Wilson']","['cs.LG', 'cs.CV', 'stat.ML']",2022-10-20 16:10:28+00:00
