id,title,abstract,authors,categories,date
http://arxiv.org/abs/2311.08549v2,Manifold learning in Wasserstein space,"This paper aims at building the theoretical foundations for manifold learning
algorithms in the space of absolutely continuous probability measures on a
compact and convex subset of $\mathbb{R}^d$, metrized with the Wasserstein-2
distance $\mathrm{W}$. We begin by introducing a construction of submanifolds
$\Lambda$ of probability measures equipped with metric $\mathrm{W}_\Lambda$,
the geodesic restriction of $W$ to $\Lambda$. In contrast to other
constructions, these submanifolds are not necessarily flat, but still allow for
local linearizations in a similar fashion to Riemannian submanifolds of
$\mathbb{R}^d$. We then show how the latent manifold structure of
$(\Lambda,\mathrm{W}_{\Lambda})$ can be learned from samples
$\{\lambda_i\}_{i=1}^N$ of $\Lambda$ and pairwise extrinsic Wasserstein
distances $\mathrm{W}$ only. In particular, we show that the metric space
$(\Lambda,\mathrm{W}_{\Lambda})$ can be asymptotically recovered in the sense
of Gromov--Wasserstein from a graph with nodes $\{\lambda_i\}_{i=1}^N$ and edge
weights $W(\lambda_i,\lambda_j)$. In addition, we demonstrate how the tangent
space at a sample $\lambda$ can be asymptotically recovered via spectral
analysis of a suitable ""covariance operator"" using optimal transport maps from
$\lambda$ to sufficiently close and diverse samples $\{\lambda_i\}_{i=1}^N$.
The paper closes with some explicit constructions of submanifolds $\Lambda$ and
numerical examples on the recovery of tangent spaces through spectral analysis.","['Keaton Hamm', 'Caroline Moosmüller', 'Bernhard Schmitzer', 'Matthew Thorpe']","['stat.ML', 'cs.LG', 'math.DG', '49Q22, 41A65, 58B20, 53Z50']",2023-11-14 21:21:35+00:00
http://arxiv.org/abs/2311.08504v1,On semi-supervised estimation using exponential tilt mixture models,"Consider a semi-supervised setting with a labeled dataset of binary responses
and predictors and an unlabeled dataset with only the predictors. Logistic
regression is equivalent to an exponential tilt model in the labeled
population. For semi-supervised estimation, we develop further analysis and
understanding of a statistical approach using exponential tilt mixture (ETM)
models and maximum nonparametric likelihood estimation, while allowing that the
class proportions may differ between the unlabeled and labeled data. We derive
asymptotic properties of ETM-based estimation and demonstrate improved
efficiency over supervised logistic regression in a random sampling setup and
an outcome-stratified sampling setup previously used. Moreover, we reconcile
such efficiency improvement with the existing semiparametric efficiency theory
when the class proportions in the unlabeled and labeled data are restricted to
be the same. We also provide a simulation study to numerically illustrate our
theoretical findings.","['Ye Tian', 'Xinwei Zhang', 'Zhiqiang Tan']","['stat.ML', 'cs.LG']",2023-11-14 19:53:26+00:00
http://arxiv.org/abs/2311.08384v1,Offline Data Enhanced On-Policy Policy Gradient with Provable Guarantees,"Hybrid RL is the setting where an RL agent has access to both offline data
and online data by interacting with the real-world environment. In this work,
we propose a new hybrid RL algorithm that combines an on-policy actor-critic
method with offline data. On-policy methods such as policy gradient and natural
policy gradient (NPG) have shown to be more robust to model misspecification,
though sometimes it may not be as sample efficient as methods that rely on
off-policy learning. On the other hand, offline methods that depend on
off-policy training often require strong assumptions in theory and are less
stable to train in practice. Our new approach integrates a procedure of
off-policy training on the offline data into an on-policy NPG framework. We
show that our approach, in theory, can obtain a best-of-both-worlds type of
result -- it achieves the state-of-art theoretical guarantees of offline RL
when offline RL-specific assumptions hold, while at the same time maintaining
the theoretical guarantees of on-policy NPG regardless of the offline RL
assumptions' validity. Experimentally, in challenging rich-observation
environments, we show that our approach outperforms a state-of-the-art hybrid
RL baseline which only relies on off-policy policy optimization, demonstrating
the empirical benefit of combining on-policy and off-policy learning. Our code
is publicly available at https://github.com/YifeiZhou02/HNPG.","['Yifei Zhou', 'Ayush Sekhari', 'Yuda Song', 'Wen Sun']","['cs.LG', 'cs.AI', 'stat.ML']",2023-11-14 18:45:56+00:00
http://arxiv.org/abs/2311.08376v3,Ensemble sampling for linear bandits: small ensembles suffice,"We provide the first useful and rigorous analysis of ensemble sampling for
the stochastic linear bandit setting. In particular, we show that, under
standard assumptions, for a $d$-dimensional stochastic linear bandit with an
interaction horizon $T$, ensemble sampling with an ensemble of size of order
$\smash{d \log T}$ incurs regret at most of the order $\smash{(d \log T)^{5/2}
\sqrt{T}}$. Ours is the first result in any structured setting not to require
the size of the ensemble to scale linearly with $T$ -- which defeats the
purpose of ensemble sampling -- while obtaining near $\smash{\sqrt{T}}$ order
regret. Ours is also the first result that allows infinite action sets.","['David Janz', 'Alexander E. Litvak', 'Csaba Szepesvári']","['stat.ML', 'cs.LG']",2023-11-14 18:41:28+00:00
http://arxiv.org/abs/2311.08362v1,Transformers can optimally learn regression mixture models,"Mixture models arise in many regression problems, but most methods have seen
limited adoption partly due to these algorithms' highly-tailored and
model-specific nature. On the other hand, transformers are flexible, neural
sequence models that present the intriguing possibility of providing
general-purpose prediction methods, even in this mixture setting. In this work,
we investigate the hypothesis that transformers can learn an optimal predictor
for mixtures of regressions. We construct a generative process for a mixture of
linear regressions for which the decision-theoretic optimal procedure is given
by data-driven exponential weights on a finite set of parameters. We observe
that transformers achieve low mean-squared error on data generated via this
process. By probing the transformer's output at inference time, we also show
that transformers typically make predictions that are close to the optimal
predictor. Our experiments also demonstrate that transformers can learn
mixtures of regressions in a sample-efficient fashion and are somewhat robust
to distribution shifts. We complement our experimental observations by proving
constructively that the decision-theoretic optimal procedure is indeed
implementable by a transformer.","['Reese Pathak', 'Rajat Sen', 'Weihao Kong', 'Abhimanyu Das']","['cs.LG', 'stat.ML']",2023-11-14 18:09:15+00:00
http://arxiv.org/abs/2311.08442v1,Mean-field variational inference with the TAP free energy: Geometric and statistical properties in linear models,"We study mean-field variational inference in a Bayesian linear model when the
sample size n is comparable to the dimension p. In high dimensions, the common
approach of minimizing a Kullback-Leibler divergence from the posterior
distribution, or maximizing an evidence lower bound, may deviate from the true
posterior mean and underestimate posterior uncertainty. We study instead
minimization of the TAP free energy, showing in a high-dimensional asymptotic
framework that it has a local minimizer which provides a consistent estimate of
the posterior marginals and may be used for correctly calibrated posterior
inference. Geometrically, we show that the landscape of the TAP free energy is
strongly convex in an extensive neighborhood of this local minimizer, which
under certain general conditions can be found by an Approximate Message Passing
(AMP) algorithm. We then exhibit an efficient algorithm that linearly converges
to the minimizer within this local neighborhood. In settings where it is
conjectured that no efficient algorithm can find this local neighborhood, we
prove analogous geometric properties for a local minimizer of the TAP free
energy reachable by AMP, and show that posterior inference based on this
minimizer remains correctly calibrated.","['Michael Celentano', 'Zhou Fan', 'Licong Lin', 'Song Mei']","['math.ST', 'cs.LG', 'stat.ML', 'stat.TH']",2023-11-14 17:35:01+00:00
http://arxiv.org/abs/2311.08340v3,Causal Message Passing for Experiments with Unknown and General Network Interference,"Randomized experiments are a powerful methodology for data-driven evaluation
of decisions or interventions. Yet, their validity may be undermined by network
interference. This occurs when the treatment of one unit impacts not only its
outcome but also that of connected units, biasing traditional treatment effect
estimations. Our study introduces a new framework to accommodate complex and
unknown network interference, moving beyond specialized models in the existing
literature. Our framework, termed causal message-passing, is grounded in
high-dimensional approximate message passing methodology. It is tailored for
multi-period experiments and is particularly effective in settings with many
units and prevalent network interference. The framework models causal effects
as a dynamic process where a treated unit's impact propagates through the
network via neighboring units until equilibrium is reached. This approach
allows us to approximate the dynamics of potential outcomes over time, enabling
the extraction of valuable information before treatment effects reach
equilibrium. Utilizing causal message-passing, we introduce a practical
algorithm to estimate the total treatment effect, defined as the impact
observed when all units are treated compared to the scenario where no unit
receives treatment. We demonstrate the effectiveness of this approach across
five numerical scenarios, each characterized by a distinct interference
structure.","['Sadegh Shirani', 'Mohsen Bayati']","['stat.ME', 'stat.ML']",2023-11-14 17:31:50+00:00
http://arxiv.org/abs/2311.08309v1,Introducing an Improved Information-Theoretic Measure of Predictive Uncertainty,"Applying a machine learning model for decision-making in the real world
requires to distinguish what the model knows from what it does not. A critical
factor in assessing the knowledge of a model is to quantify its predictive
uncertainty. Predictive uncertainty is commonly measured by the entropy of the
Bayesian model average (BMA) predictive distribution. Yet, the properness of
this current measure of predictive uncertainty was recently questioned. We
provide new insights regarding those limitations. Our analyses show that the
current measure erroneously assumes that the BMA predictive distribution is
equivalent to the predictive distribution of the true model that generated the
dataset. Consequently, we introduce a theoretically grounded measure to
overcome these limitations. We experimentally verify the benefits of our
introduced measure of predictive uncertainty. We find that our introduced
measure behaves more reasonably in controlled synthetic tasks. Moreover, our
evaluations on ImageNet demonstrate that our introduced measure is advantageous
in real-world applications utilizing predictive uncertainty.","['Kajetan Schweighofer', 'Lukas Aichberger', 'Mykyta Ielanskyi', 'Sepp Hochreiter']","['cs.LG', 'stat.ML']",2023-11-14 16:55:12+00:00
http://arxiv.org/abs/2311.09251v1,A Simple and Powerful Framework for Stable Dynamic Network Embedding,"In this paper, we address the problem of dynamic network embedding, that is,
representing the nodes of a dynamic network as evolving vectors within a
low-dimensional space. While the field of static network embedding is wide and
established, the field of dynamic network embedding is comparatively in its
infancy. We propose that a wide class of established static network embedding
methods can be used to produce interpretable and powerful dynamic network
embeddings when they are applied to the dilated unfolded adjacency matrix. We
provide a theoretical guarantee that, regardless of embedding dimension, these
unfolded methods will produce stable embeddings, meaning that nodes with
identical latent behaviour will be exchangeable, regardless of their position
in time or space. We additionally define a hypothesis testing framework which
can be used to evaluate the quality of a dynamic network embedding by testing
for planted structure in simulated networks. Using this, we demonstrate that,
even in trivial cases, unstable methods are often either conservative or encode
incorrect structure. In contrast, we demonstrate that our suite of stable
unfolded methods are not only more interpretable but also more powerful in
comparison to their unstable counterparts.","['Ed Davis', 'Ian Gallagher', 'Daniel John Lawson', 'Patrick Rubin-Delanchy']","['cs.SI', 'cs.LG', 'stat.ML', '62H15 (Primary) 62H30, 62M10, 62G99 (Secondary)']",2023-11-14 15:38:17+00:00
http://arxiv.org/abs/2311.08214v4,Frequentist Guarantees of Distributed (Non)-Bayesian Inference,"Motivated by the need to analyze large, decentralized datasets, distributed
Bayesian inference has become a critical research area across multiple fields,
including statistics, electrical engineering, and economics. This paper
establishes Frequentist properties, such as posterior consistency, asymptotic
normality, and posterior contraction rates, for the distributed (non-)Bayes
Inference problem among agents connected via a communication network. Our
results show that, under appropriate assumptions on the communication graph,
distributed Bayesian inference retains parametric efficiency while enhancing
robustness in uncertainty quantification. We also explore the trade-off between
statistical efficiency and communication efficiency by examining how the design
and size of the communication graph impact the posterior contraction rate.
Furthermore, We extend our analysis to time-varying graphs and apply our
results to exponential family models, distributed logistic regression, and
decentralized detection models.","['Bohan Wu', 'César A. Uribe']","['math.ST', 'stat.ML', 'stat.TH']",2023-11-14 14:50:46+00:00
http://arxiv.org/abs/2311.08168v3,Time-Uniform Confidence Spheres for Means of Random Vectors,"We derive and study time-uniform confidence spheres -- confidence sphere
sequences (CSSs) -- which contain the mean of random vectors with high
probability simultaneously across all sample sizes. Our results include a
dimension-free CSS for log-concave random vectors, a dimension-free CSS for
sub-Gaussian random vectors, and CSSs for sub-$\psi$ random vectors (which
includes sub-gamma, sub-Poisson, and sub-exponential distributions). For
sub-Gaussian distributions we also provide a CSS which tracks a time-varying
mean, generalizing Robbins' mixture approach to the multivariate setting.
Finally, we provide several CSSs for heavy-tailed random vectors (two moments
only). Our bounds hold under a martingale assumption on the mean and do not
require that the observations be iid. Our work is based on PAC-Bayesian theory
and inspired by an approach of Catoni and Giulini.","['Ben Chugg', 'Hongjian Wang', 'Aaditya Ramdas']","['math.ST', 'cs.IT', 'math.IT', 'stat.ME', 'stat.ML', 'stat.TH']",2023-11-14 13:49:46+00:00
http://arxiv.org/abs/2311.08149v3,Modeling Complex Disease Trajectories using Deep Generative Models with Semi-Supervised Latent Processes,"In this paper, we propose a deep generative time series approach using latent
temporal processes for modeling and holistically analyzing complex disease
trajectories. We aim to find meaningful temporal latent representations of an
underlying generative process that explain the observed disease trajectories in
an interpretable and comprehensive way. To enhance the interpretability of
these latent temporal processes, we develop a semi-supervised approach for
disentangling the latent space using established medical concepts. By combining
the generative approach with medical knowledge, we leverage the ability to
discover novel aspects of the disease while integrating medical concepts into
the model. We show that the learned temporal latent processes can be utilized
for further data analysis and clinical hypothesis testing, including finding
similar patients and clustering the disease into new sub-types. Moreover, our
method enables personalized online monitoring and prediction of multivariate
time series including uncertainty quantification. We demonstrate the
effectiveness of our approach in modeling systemic sclerosis, showcasing the
potential of our machine learning model to capture complex disease trajectories
and acquire new medical knowledge.","['Cécile Trottet', 'Manuel Schürch', 'Ahmed Allam', 'Imon Barua', 'Liubov Petelytska', 'Oliver Distler', 'Anna-Maria Hoffmann-Vold', 'Michael Krauthammer', 'the EUSTAR collaborators']","['cs.LG', 'stat.ML']",2023-11-14 13:25:41+00:00
http://arxiv.org/abs/2311.08139v1,Feedforward neural networks as statistical models: Improving interpretability through uncertainty quantification,"Feedforward neural networks (FNNs) are typically viewed as pure prediction
algorithms, and their strong predictive performance has led to their use in
many machine-learning applications. However, their flexibility comes with an
interpretability trade-off; thus, FNNs have been historically less popular
among statisticians. Nevertheless, classical statistical theory, such as
significance testing and uncertainty quantification, is still relevant.
Supplementing FNNs with methods of statistical inference, and covariate-effect
visualisations, can shift the focus away from black-box prediction and make
FNNs more akin to traditional statistical models. This can allow for more
inferential analysis, and, hence, make FNNs more accessible within the
statistical-modelling context.","['Andrew McInerney', 'Kevin Burke']","['stat.ME', 'stat.ML', '62J02, 68T07, 62F03']",2023-11-14 13:08:58+00:00
http://arxiv.org/abs/2311.08005v1,Iterative missing value imputation based on feature importance,"Many datasets suffer from missing values due to various reasons,which not
only increases the processing difficulty of related tasks but also reduces the
accuracy of classification. To address this problem, the mainstream approach is
to use missing value imputation to complete the dataset. Existing imputation
methods estimate the missing parts based on the observed values in the original
feature space, and they treat all features as equally important during data
completion, while in fact different features have different importance.
Therefore, we have designed an imputation method that considers feature
importance. This algorithm iteratively performs matrix completion and feature
importance learning, and specifically, matrix completion is based on a filling
loss that incorporates feature importance. Our experimental analysis involves
three types of datasets: synthetic datasets with different noisy features and
missing values, real-world datasets with artificially generated missing values,
and real-world datasets originally containing missing values. The results on
these datasets consistently show that the proposed method outperforms the
existing five imputation algorithms.To the best of our knowledge, this is the
first work that considers feature importance in the imputation model.","['Cong Guo', 'Chun Liu', 'Wei Yang']","['cs.LG', 'cs.AI', 'stat.ML']",2023-11-14 09:03:33+00:00
http://arxiv.org/abs/2401.02431v2,Execution time budget assignment for mixed criticality systems,"In this paper we propose to quantify execution time variability of programs
using statistical dispersion parameters. We show how the execution time
variability can be exploited in mixed criticality real-time systems. We propose
a heuristic to compute the execution time budget to be allocated to each low
criticality real-time task according to its execution time variability. We show
using experiments and simulations that the proposed heuristic reduces the
probability of exceeding the allocated budget compared to algorithms which do
not take into account the execution time variability parameter.","['Mohamed Amine Khelassi', 'Yasmina Abdeddaïm']","['cs.PF', 'cs.DC', 'stat.ML']",2023-11-14 07:55:56+00:00
http://arxiv.org/abs/2311.08434v1,Uplift Modeling based on Graph Neural Network Combined with Causal Knowledge,"Uplift modeling is a fundamental component of marketing effect modeling,
which is commonly employed to evaluate the effects of treatments on outcomes.
Through uplift modeling, we can identify the treatment with the greatest
benefit. On the other side, we can identify clients who are likely to make
favorable decisions in response to a certain treatment. In the past, uplift
modeling approaches relied heavily on the difference-in-difference (DID)
architecture, paired with a machine learning model as the estimation learner,
while neglecting the link and confidential information between features. We
proposed a framework based on graph neural networks that combine causal
knowledge with an estimate of uplift value. Firstly, we presented a causal
representation technique based on CATE (conditional average treatment effect)
estimation and adjacency matrix structure learning. Secondly, we suggested a
more scalable uplift modeling framework based on graph convolution networks for
combining causal knowledge. Our findings demonstrate that this method works
effectively for predicting uplift values, with small errors in typical
simulated data, and its effectiveness has been verified in actual industry
marketing data.","['Haowen Wang', 'Xinyan Ye', 'Yangze Zhou', 'Zhiyi Zhang', 'Longhan Zhang', 'Jing Jiang']","['cs.LG', 'cs.AI', 'stat.ML']",2023-11-14 07:21:00+00:00
http://arxiv.org/abs/2311.07951v1,A Fast and Simple Algorithm for computing the MLE of Amplitude Density Function Parameters,"Over the last decades, the family of $\alpha$-stale distributions has proven
to be useful for modelling in telecommunication systems. Particularly, in the
case of radar applications, finding a fast and accurate estimation for the
amplitude density function parameters appears to be very important. In this
work, the maximum likelihood estimator (MLE) is proposed for parameters of the
amplitude distribution. To do this, the amplitude data are \emph{projected} on
the horizontal and vertical axes using two simple transformations. It is proved
that the \emph{projected} data follow a zero-location symmetric $\alpha$-stale
distribution for which the MLE can be computed quite fast. The average of
computed MLEs based on two \emph{projections} is considered as estimator for
parameters of the amplitude distribution. Performance of the proposed
\emph{projection} method is demonstrated through simulation study and analysis
of two sets of real radar data.",['Mahdi Teimouri'],"['stat.ME', 'cs.LG', 'stat.ML']",2023-11-14 07:04:47+00:00
http://arxiv.org/abs/2311.07876v1,Learning Adversarial Low-rank Markov Decision Processes with Unknown Transition and Full-information Feedback,"In this work, we study the low-rank MDPs with adversarially changed losses in
the full-information feedback setting. In particular, the unknown transition
probability kernel admits a low-rank matrix decomposition \citep{REPUCB22}, and
the loss functions may change adversarially but are revealed to the learner at
the end of each episode. We propose a policy optimization-based algorithm POLO,
and we prove that it attains the
$\widetilde{O}(K^{\frac{5}{6}}A^{\frac{1}{2}}d\ln(1+M)/(1-\gamma)^2)$ regret
guarantee, where $d$ is rank of the transition kernel (and hence the dimension
of the unknown representations), $A$ is the cardinality of the action space,
$M$ is the cardinality of the model class, and $\gamma$ is the discounted
factor. Notably, our algorithm is oracle-efficient and has a regret guarantee
with no dependence on the size of potentially arbitrarily large state space.
Furthermore, we also prove an $\Omega(\frac{\gamma^2}{1-\gamma} \sqrt{d A K})$
regret lower bound for this problem, showing that low-rank MDPs are
statistically more difficult to learn than linear MDPs in the regret
minimization setting. To the best of our knowledge, we present the first
algorithm that interleaves representation learning, exploration, and
exploitation to achieve the sublinear regret guarantee for RL with nonlinear
function approximation and adversarial losses.","['Canzhe Zhao', 'Ruofeng Yang', 'Baoxiang Wang', 'Xuezhou Zhang', 'Shuai Li']","['cs.LG', 'cs.AI', 'stat.ML']",2023-11-14 03:12:43+00:00
