id,title,abstract,authors,categories,date
http://arxiv.org/abs/1811.03619v3,Pipe-SGD: A Decentralized Pipelined SGD Framework for Distributed Deep Net Training,"Distributed training of deep nets is an important technique to address some
of the present day computing challenges like memory consumption and
computational demands. Classical distributed approaches, synchronous or
asynchronous, are based on the parameter server architecture, i.e., worker
nodes compute gradients which are communicated to the parameter server while
updated parameters are returned. Recently, distributed training with AllReduce
operations gained popularity as well. While many of those operations seem
appealing, little is reported about wall-clock training time improvements. In
this paper, we carefully analyze the AllReduce based setup, propose timing
models which include network latency, bandwidth, cluster size and compute time,
and demonstrate that a pipelined training with a width of two combines the best
of both synchronous and asynchronous training. Specifically, for a setup
consisting of a four-node GPU cluster we show wall-clock time training
improvements of up to 5.4x compared to conventional approaches.","['Youjie Li', 'Mingchao Yu', 'Songze Li', 'Salman Avestimehr', 'Nam Sung Kim', 'Alexander Schwing']","['cs.LG', 'cs.DC', 'stat.ML']",2018-11-08 18:59:55+00:00
http://arxiv.org/abs/1811.03617v2,GradiVeQ: Vector Quantization for Bandwidth-Efficient Gradient Aggregation in Distributed CNN Training,"Data parallelism can boost the training speed of convolutional neural
networks (CNN), but could suffer from significant communication costs caused by
gradient aggregation. To alleviate this problem, several scalar quantization
techniques have been developed to compress the gradients. But these techniques
could perform poorly when used together with decentralized aggregation
protocols like ring all-reduce (RAR), mainly due to their inability to directly
aggregate compressed gradients. In this paper, we empirically demonstrate the
strong linear correlations between CNN gradients, and propose a gradient vector
quantization technique, named GradiVeQ, to exploit these correlations through
principal component analysis (PCA) for substantial gradient dimension
reduction. GradiVeQ enables direct aggregation of compressed gradients, hence
allows us to build a distributed learning system that parallelizes GradiVeQ
gradient compression and RAR communications. Extensive experiments on popular
CNNs demonstrate that applying GradiVeQ slashes the wall-clock gradient
aggregation time of the original RAR by more than 5X without noticeable
accuracy loss, and reduces the end-to-end training time by almost 50%. The
results also show that GradiVeQ is compatible with scalar quantization
techniques such as QSGD (Quantized SGD), and achieves a much higher speed-up
gain under the same compression ratio.","['Mingchao Yu', 'Zhifeng Lin', 'Krishna Narra', 'Songze Li', 'Youjie Li', 'Nam Sung Kim', 'Alexander Schwing', 'Murali Annavaram', 'Salman Avestimehr']","['cs.LG', 'cs.DC', 'stat.ML']",2018-11-08 18:59:50+00:00
http://arxiv.org/abs/1811.03600v3,Measuring the Effects of Data Parallelism on Neural Network Training,"Recent hardware developments have dramatically increased the scale of data
parallelism available for neural network training. Among the simplest ways to
harness next-generation hardware is to increase the batch size in standard
mini-batch neural network training algorithms. In this work, we aim to
experimentally characterize the effects of increasing the batch size on
training time, as measured by the number of steps necessary to reach a goal
out-of-sample error. We study how this relationship varies with the training
algorithm, model, and data set, and find extremely large variation between
workloads. Along the way, we show that disagreements in the literature on how
batch size affects model quality can largely be explained by differences in
metaparameter tuning and compute budgets at different batch sizes. We find no
evidence that larger batch sizes degrade out-of-sample performance. Finally, we
discuss the implications of our results on efforts to train neural networks
much faster in the future. Our experimental data is publicly available as a
database of 71,638,836 loss measurements taken over the course of training for
168,160 individual models across 35 workloads.","['Christopher J. Shallue', 'Jaehoon Lee', 'Joseph Antognini', 'Jascha Sohl-Dickstein', 'Roy Frostig', 'George E. Dahl']","['cs.LG', 'stat.ML']",2018-11-08 18:33:41+00:00
http://arxiv.org/abs/1811.03970v2,Looking Deeper into Deep Learning Model: Attribution-based Explanations of TextCNN,"Layer-wise Relevance Propagation (LRP) and saliency maps have been recently
used to explain the predictions of Deep Learning models, specifically in the
domain of text classification. Given different attribution-based explanations
to highlight relevant words for a predicted class label, experiments based on
word deleting perturbation is a common evaluation method. This word removal
approach, however, disregards any linguistic dependencies that may exist
between words or phrases in a sentence, which could semantically guide a
classifier to a particular prediction. In this paper, we present a
feature-based evaluation framework for comparing the two attribution methods on
customer reviews (public data sets) and Customer Due Diligence (CDD) extracted
reports (corporate data set). Instead of removing words based on the relevance
score, we investigate perturbations based on embedded features removal from
intermediate layers of Convolutional Neural Networks. Our experimental study is
carried out on embedded-word, embedded-document, and embedded-ngrams
explanations. Using the proposed framework, we provide a visualization tool to
assist analysts in reasoning toward the model's final prediction.","['Wenting Xiong', ""Iftitahu Ni'mah"", 'Juan M. G. Huesca', 'Werner van Ipenburg', 'Jan Veldsink', 'Mykola Pechenizkiy']","['cs.IR', 'cs.LG', 'stat.ML']",2018-11-08 18:23:48+00:00
http://arxiv.org/abs/1811.03575v3,Large-Scale Visual Active Learning with Deep Probabilistic Ensembles,"Annotating the right data for training deep neural networks is an important
challenge. Active learning using uncertainty estimates from Bayesian Neural
Networks (BNNs) could provide an effective solution to this. Despite being
theoretically principled, BNNs require approximations to be applied to
large-scale problems, where both performance and uncertainty estimation are
crucial. In this paper, we introduce Deep Probabilistic Ensembles (DPEs), a
scalable technique that uses a regularized ensemble to approximate a deep BNN.
We conduct a series of large-scale visual active learning experiments to
evaluate DPEs on classification with the CIFAR-10, CIFAR-100 and ImageNet
datasets, and semantic segmentation with the BDD100k dataset. Our models
require significantly less training data to achieve competitive performances,
and steadily improve upon strong active learning baselines as the annotation
budget is increased.","['Kashyap Chitta', 'Jose M. Alvarez', 'Adam Lesnikowski']","['cs.CV', 'cs.LG', 'stat.ML']",2018-11-08 17:56:43+00:00
http://arxiv.org/abs/1811.03571v2,Intrinsic Geometric Vulnerability of High-Dimensional Artificial Intelligence,"The success of modern Artificial Intelligence (AI) technologies depends
critically on the ability to learn non-linear functional dependencies from
large, high dimensional data sets. Despite recent high-profile successes,
empirical evidence indicates that the high predictive performance is often
paired with low robustness, making AI systems potentially vulnerable to
adversarial attacks. In this report, we provide a simple intuitive argument
suggesting that high performance and vulnerability are intrinsically coupled,
and largely dependent on the geometry of typical, high-dimensional data sets.
Our work highlights a major potential pitfall of modern AI systems, and
suggests practical research directions to ameliorate the problem.","['Luca Bortolussi', 'Guido Sanguinetti']","['cs.LG', 'stat.ML']",2018-11-08 17:51:27+00:00
http://arxiv.org/abs/1811.03568v3,A Geometric Approach of Gradient Descent Algorithms in Linear Neural Networks,"In this paper, we propose a geometric framework to analyze the convergence
properties of gradient descent trajectories in the context of linear neural
networks. We translate a well-known empirical observation of linear neural nets
into a conjecture that we call the \emph{overfitting conjecture} which states
that, for almost all training data and initial conditions, the trajectory of
the corresponding gradient descent system converges to a global minimum. This
would imply that the solution achieved by vanilla gradient descent algorithms
is equivalent to that of the least-squares estimation, for linear neural
networks of an arbitrary number of hidden layers. Built upon a key invariance
property induced by the network structure, we first establish convergence of
gradient descent trajectories to critical points of the square loss function in
the case of linear networks of arbitrary depth. Our second result is the proof
of the \emph{overfitting conjecture} in the case of single-hidden-layer linear
networks with an argument based on the notion of normal hyperbolicity and under
a generic property on the training data (i.e., holding for almost all training
data).","['Yacine Chitour', 'Zhenyu Liao', 'Romain Couillet']","['cs.LG', 'stat.ML', 'Primary: 68T07, 37B35, Secondary: 37D10']",2018-11-08 17:45:19+00:00
http://arxiv.org/abs/1811.03567v3,Biologically-plausible learning algorithms can scale to large datasets,"The backpropagation (BP) algorithm is often thought to be biologically
implausible in the brain. One of the main reasons is that BP requires symmetric
weight matrices in the feedforward and feedback pathways. To address this
""weight transport problem"" (Grossberg, 1987), two more biologically plausible
algorithms, proposed by Liao et al. (2016) and Lillicrap et al. (2016), relax
BP's weight symmetry requirements and demonstrate comparable learning
capabilities to that of BP on small datasets. However, a recent study by
Bartunov et al. (2018) evaluate variants of target-propagation (TP) and
feedback alignment (FA) on MINIST, CIFAR, and ImageNet datasets, and find that
although many of the proposed algorithms perform well on MNIST and CIFAR, they
perform significantly worse than BP on ImageNet. Here, we additionally evaluate
the sign-symmetry algorithm (Liao et al., 2016), which differs from both BP and
FA in that the feedback and feedforward weights share signs but not magnitudes.
We examine the performance of sign-symmetry and feedback alignment on ImageNet
and MS COCO datasets using different network architectures (ResNet-18 and
AlexNet for ImageNet, RetinaNet for MS COCO). Surprisingly, networks trained
with sign-symmetry can attain classification performance approaching that of
BP-trained networks. These results complement the study by Bartunov et al.
(2018), and establish a new benchmark for future biologically plausible
learning algorithms on more difficult datasets and more complex architectures.","['Will Xiao', 'Honglin Chen', 'Qianli Liao', 'Tomaso Poggio']","['cs.LG', 'cs.AI', 'cs.CV', 'cs.NE', 'stat.ML']",2018-11-08 17:43:59+00:00
http://arxiv.org/abs/1811.03562v2,Real time Traffic Flow Parameters Prediction with Basic Safety Messages at Low Penetration of Connected Vehicles,"The expected low market penetration of connected vehicles (CVs) in the near
future could be a constraint in estimating traffic flow parameters, such as
average travel speed of a roadway segment and average space headway between
vehicles from the CV broadcasted data. This estimated traffic flow parameters
from low penetration of connected vehicles become noisy compared to 100 percent
penetration of CVs, and such noise reduces the real time prediction accuracy of
a machine learning model, such as the accuracy of long short term memory (LSTM)
model in terms of predicting traffic flow parameters. The accurate prediction
of the parameters is important for future traffic condition assessment. To
improve the prediction accuracy using noisy traffic flow parameters, which is
constrained by limited CV market penetration and limited CV data, we developed
a real time traffic data prediction model that combines LSTM with Kalman filter
based Rauch Tung Striebel (RTS) noise reduction model. We conducted a case
study using the Enhanced Next Generation Simulation (NGSIM) dataset, which
contains vehicle trajectory data for every one tenth of a second, to evaluate
the performance of this prediction model. Compared to a baseline LSTM model
performance, for only 5 percent penetration of CVs, the analyses revealed that
combined LSTM and RTS model reduced the mean absolute percentage error (MAPE)
from 19 percent to 5 percent for speed prediction and from 27 percent to 9
percent for space-headway prediction. The statistical significance test with a
95 percent confidence interval confirmed no significant difference in predicted
average speed and average space headway using this LSTM and RTS combination
with only 5 percent CV penetration rate.","['Mizanur Rahman', 'Mashrur Chowdhury', 'Jerome McClendon']","['cs.LG', 'stat.ML']",2018-11-08 17:34:14+00:00
http://arxiv.org/abs/1811.03539v2,Uncovering the Social Interaction in Swarm Intelligence with Network Science,"Swarm intelligence is the collective behavior emerging in systems with
locally interacting components. Because of their self-organization
capabilities, swarm-based systems show essential properties for handling
real-world problems such as robustness, scalability, and flexibility. Yet, we
do not know why swarm-based algorithms work well and neither we can compare the
different approaches in the literature. The lack of a common framework capable
of characterizing these several swarm-based algorithms, transcending their
particularities, has led to a stream of publications inspired by different
aspects of nature without a systematic comparison over existing approaches.
Here, we address this gap by introducing a network-based framework---the
interaction network---to examine computational swarm-based systems via the
optics of the social dynamics of such interaction network; a clear example of
network science being applied to bring further clarity to a complicated field
within artificial intelligence. We discuss the social interactions of four
well-known swarm-based algorithms and provide an in-depth case study of the
Particle Swarm Optimization. The interaction network enables researchers to
study swarm algorithms as systems, removing the algorithm particularities from
the analyses while focusing on the structure of the social interactions.","['Marcos Oliveira', 'Diego Pinheiro', 'Mariana Macedo', 'Carmelo Bastos-Filho', 'Ronaldo Menezes']","['cs.NE', 'cs.AI', 'cs.MA', 'cs.SI', 'stat.ML']",2018-11-08 16:36:11+00:00
http://arxiv.org/abs/1811.03537v2,Iterative Classroom Teaching,"We consider the machine teaching problem in a classroom-like setting wherein
the teacher has to deliver the same examples to a diverse group of students.
Their diversity stems from differences in their initial internal states as well
as their learning rates. We prove that a teacher with full knowledge about the
learning dynamics of the students can teach a target concept to the entire
classroom using O(min{d,N} log(1/eps)) examples, where d is the ambient
dimension of the problem, N is the number of learners, and eps is the accuracy
parameter. We show the robustness of our teaching strategy when the teacher has
limited knowledge of the learners' internal dynamics as provided by a noisy
oracle. Further, we study the trade-off between the learners' workload and the
teacher's cost in teaching the target concept. Our experiments validate our
theoretical results and suggest that appropriately partitioning the classroom
into homogenous groups provides a balance between these two objectives.","['Teresa Yeo', 'Parameswaran Kamalaruban', 'Adish Singla', 'Arpit Merchant', 'Thibault Asselborn', 'Louis Faucon', 'Pierre Dillenbourg', 'Volkan Cevher']","['cs.LG', 'stat.ML']",2018-11-08 16:34:14+00:00
http://arxiv.org/abs/1811.03531v1,A Geometric Perspective on the Transferability of Adversarial Directions,"State-of-the-art machine learning models frequently misclassify inputs that
have been perturbed in an adversarial manner. Adversarial perturbations
generated for a given input and a specific classifier often seem to be
effective on other inputs and even different classifiers. In other words,
adversarial perturbations seem to transfer between different inputs, models,
and even different neural network architectures. In this work, we show that in
the context of linear classifiers and two-layer ReLU networks, there provably
exist directions that give rise to adversarial perturbations for many
classifiers and data points simultaneously. We show that these ""transferable
adversarial directions"" are guaranteed to exist for linear separators of a
given set, and will exist with high probability for linear classifiers trained
on independent sets drawn from the same distribution. We extend our results to
large classes of two-layer ReLU networks. We further show that adversarial
directions for ReLU networks transfer to linear classifiers while the reverse
need not hold, suggesting that adversarial perturbations for more complex
models are more likely to transfer to other classifiers. We validate our
findings empirically, even for deeper ReLU networks.","['Zachary Charles', 'Harrison Rosenberg', 'Dimitris Papailiopoulos']","['cs.LG', 'stat.ML']",2018-11-08 16:23:50+00:00
http://arxiv.org/abs/1811.03516v2,Learning from Demonstration in the Wild,"Learning from demonstration (LfD) is useful in settings where hand-coding
behaviour or a reward function is impractical. It has succeeded in a wide range
of problems but typically relies on manually generated demonstrations or
specially deployed sensors and has not generally been able to leverage the
copious demonstrations available in the wild: those that capture behaviours
that were occurring anyway using sensors that were already deployed for another
purpose, e.g., traffic camera footage capturing demonstrations of natural
behaviour of vehicles, cyclists, and pedestrians. We propose Video to Behaviour
(ViBe), a new approach to learn models of behaviour from unlabelled raw video
data of a traffic scene collected from a single, monocular, initially
uncalibrated camera with ordinary resolution. Our approach calibrates the
camera, detects relevant objects, tracks them through time, and uses the
resulting trajectories to perform LfD, yielding models of naturalistic
behaviour. We apply ViBe to raw videos of a traffic intersection and show that
it can learn purely from videos, without additional expert knowledge.","['Feryal Behbahani', 'Kyriacos Shiarlis', 'Xi Chen', 'Vitaly Kurin', 'Sudhanshu Kasewa', 'Ciprian Stirbu', 'João Gomes', 'Supratik Paul', 'Frans A. Oliehoek', 'João Messias', 'Shimon Whiteson']","['cs.LG', 'stat.ML']",2018-11-08 16:03:23+00:00
http://arxiv.org/abs/1811.03508v3,A simple yet effective baseline for non-attributed graph classification,"Graphs are complex objects that do not lend themselves easily to typical
learning tasks. Recently, a range of approaches based on graph kernels or graph
neural networks have been developed for graph classification and for
representation learning on graphs in general. As the developed methodologies
become more sophisticated, it is important to understand which components of
the increasingly complex methods are necessary or most effective.
  As a first step, we develop a simple yet meaningful graph representation, and
explore its effectiveness in graph classification. We test our baseline
representation for the graph classification task on a range of graph datasets.
Interestingly, this simple representation achieves similar performance as the
state-of-the-art graph kernels and graph neural networks for non-attributed
graph classification. Its performance on classifying attributed graphs is
slightly weaker as it does not incorporate attributes. However, given its
simplicity and efficiency, we believe that it still serves as an effective
baseline for attributed graph classification. Our graph representation is
efficient (linear-time) to compute. We also provide a simple connection with
the graph neural networks.
  Note that these observations are only for the task of graph classification
while existing methods are often designed for a broader scope including node
embedding and link prediction. The results are also likely biased due to the
limited amount of benchmark datasets available. Nevertheless, the good
performance of our simple baseline calls for the development of new, more
comprehensive benchmark datasets so as to better evaluate and analyze different
graph learning methods. Furthermore, given the computational efficiency of our
graph summary, we believe that it is a good candidate as a baseline method for
future graph classification (or even other graph learning) studies.","['Chen Cai', 'Yusu Wang']","['cs.LG', 'stat.ML']",2018-11-08 15:53:37+00:00
http://arxiv.org/abs/1811.03444v2,Disentangling Latent Factors of Variational Auto-Encoder with Whitening,"After deep generative models were successfully applied to image generation
tasks, learning disentangled latent variables of data has become a crucial part
of deep generative model research. Many models have been proposed to learn an
interpretable and factorized representation of latent variable by modifying
their objective function or model architecture. To disentangle the latent
variable, some models show lower quality of reconstructed images and others
increase the model complexity which is hard to train. In this paper, we propose
a simple disentangling method based on a traditional whitening process. The
proposed method is applied to the latent variables of variational auto-encoder
(VAE), although it can be applied to any generative models with latent
variables. In experiment, we apply the proposed method to simple VAE models and
experiment results confirm that our method finds more interpretable factors
from the latent space while keeping the reconstruction error the same as the
conventional VAE's error.","['Sangchul Hahn', 'Heeyoul Choi']","['cs.LG', 'stat.ML']",2018-11-08 14:33:16+00:00
http://arxiv.org/abs/1811.03436v4,Alpha-Integration Pooling for Convolutional Neural Networks,"Convolutional neural networks (CNNs) have achieved remarkable performance in
many applications, especially in image recognition tasks. As a crucial
component of CNNs, sub-sampling plays an important role for efficient training
or invariance property, and max-pooling and arithmetic average-pooling are
commonly used sub-sampling methods. In addition to the two pooling methods,
however, there could be many other pooling types, such as geometric average,
harmonic average, and so on. Since it is not easy for algorithms to find the
best pooling method, usually the pooling types are assumed a priority, which
might not be optimal for different tasks. In line with the deep learning
philosophy, the type of pooling can be driven by data for a given task. In this
paper, we propose {\it $\alpha$-integration pooling} ($\alpha$I-pooling), which
has a trainable parameter $\alpha$ to find the type of pooling.
$\alpha$I-pooling is a general pooling method including max-pooling and
arithmetic average-pooling as a special case, depending on the parameter
$\alpha$. Experiments show that $\alpha$I-pooling outperforms other pooling
methods including max-pooling, in image recognition tasks. Also, it turns out
that each layer has different optimal pooling type.","['Hayoung Eom', 'Heeyoul Choi']","['cs.LG', 'stat.ML']",2018-11-08 14:25:08+00:00
http://arxiv.org/abs/1811.03433v2,Explainable cardiac pathology classification on cine MRI with motion characterization by semi-supervised learning of apparent flow,"We propose a method to classify cardiac pathology based on a novel approach
to extract image derived features to characterize the shape and motion of the
heart. An original semi-supervised learning procedure, which makes efficient
use of a large amount of non-segmented images and a small amount of images
segmented manually by experts, is developed to generate pixel-wise apparent
flow between two time points of a 2D+t cine MRI image sequence. Combining the
apparent flow maps and cardiac segmentation masks, we obtain a local apparent
flow corresponding to the 2D motion of myocardium and ventricular cavities.
This leads to the generation of time series of the radius and thickness of
myocardial segments to represent cardiac motion. These time series of motion
features are reliable and explainable characteristics of pathological cardiac
motion. Furthermore, they are combined with shape-related features to classify
cardiac pathologies. Using only nine feature values as input, we propose an
explainable, simple and flexible model for pathology classification. On ACDC
training set and testing set, the model achieves 95% and 94% respectively as
classification accuracy. Its performance is hence comparable to that of the
state-of-the-art. Comparison with various other models is performed to outline
some advantages of our model.","['Qiao Zheng', 'Hervé Delingette', 'Nicholas Ayache']","['cs.CV', 'cs.AI', 'cs.LG', 'stat.ML']",2018-11-08 14:22:05+00:00
