id,title,abstract,authors,categories,date
http://arxiv.org/abs/1701.05228v2,Recommendation under Capacity Constraints,"In this paper, we investigate the common scenario where every candidate item
for recommendation is characterized by a maximum capacity, i.e., number of
seats in a Point-of-Interest (POI) or size of an item's inventory. Despite the
prevalence of the task of recommending items under capacity constraints in a
variety of settings, to the best of our knowledge, none of the known
recommender methods is designed to respect capacity constraints. To close this
gap, we extend three state-of-the art latent factor recommendation approaches:
probabilistic matrix factorization (PMF), geographical matrix factorization
(GeoMF), and bayesian personalized ranking (BPR), to optimize for both
recommendation accuracy and expected item usage that respects the capacity
constraints. We introduce the useful concepts of user propensity to listen and
item capacity. Our experimental results in real-world datasets, both for the
domain of item recommendation and POI recommendation, highlight the benefit of
our method for the setting of recommendation under capacity constraints.","['Konstantina Christakopoulou', 'Jaya Kawale', 'Arindam Banerjee']","['stat.ML', 'cs.IR', 'cs.LG']",2017-01-18 20:45:57+00:00
http://arxiv.org/abs/1701.05131v3,Basic protocols in quantum reinforcement learning with superconducting circuits,"Superconducting circuit technologies have recently achieved quantum protocols
involving closed feedback loops. Quantum artificial intelligence and quantum
machine learning are emerging fields inside quantum technologies which may
enable quantum devices to acquire information from the outer world and improve
themselves via a learning process. Here we propose the implementation of basic
protocols in quantum reinforcement learning, with superconducting circuits
employing feedback-loop control. We introduce diverse scenarios for
proof-of-principle experiments with state-of-the-art superconducting circuit
technologies and analyze their feasibility in presence of imperfections. The
field of quantum artificial intelligence implemented with superconducting
circuits paves the way for enhanced quantum control and quantum computation
protocols.",['Lucas Lamata'],"['quant-ph', 'cond-mat.mes-hall', 'cond-mat.supr-con', 'cs.AI', 'stat.ML']",2017-01-18 16:18:22+00:00
http://arxiv.org/abs/1701.05130v1,On the Performance of Network Parallel Training in Artificial Neural Networks,"Artificial Neural Networks (ANNs) have received increasing attention in
recent years with applications that span a wide range of disciplines including
vital domains such as medicine, network security and autonomous transportation.
However, neural network architectures are becoming increasingly complex and
with an increasing need to obtain real-time results from such models, it has
become pivotal to use parallelization as a mechanism for speeding up network
training and deployment. In this work we propose an implementation of Network
Parallel Training through Cannon's Algorithm for matrix multiplication. We show
that increasing the number of processes speeds up training until the point
where process communication costs become prohibitive; this point varies by
network complexity. We also show through empirical efficiency calculations that
the speedup obtained is superlinear.","['Ludvig Ericson', 'Rendani Mbuvha']","['cs.AI', 'cs.NE', 'cs.PF', 'stat.ML']",2017-01-18 16:17:35+00:00
http://arxiv.org/abs/1701.05004v1,Converting Cascade-Correlation Neural Nets into Probabilistic Generative Models,"Humans are not only adept in recognizing what class an input instance belongs
to (i.e., classification task), but perhaps more remarkably, they can imagine
(i.e., generate) plausible instances of a desired class with ease, when
prompted. Inspired by this, we propose a framework which allows transforming
Cascade-Correlation Neural Networks (CCNNs) into probabilistic generative
models, thereby enabling CCNNs to generate samples from a category of interest.
CCNNs are a well-known class of deterministic, discriminative NNs, which
autonomously construct their topology, and have been successful in giving
accounts for a variety of psychological phenomena. Our proposed framework is
based on a Markov Chain Monte Carlo (MCMC) method, called the
Metropolis-adjusted Langevin algorithm, which capitalizes on the gradient
information of the target distribution to direct its explorations towards
regions of high probability, thereby achieving good mixing properties. Through
extensive simulations, we demonstrate the efficacy of our proposed framework.","['Ardavan Salehi Nobandegani', 'Thomas R. Shultz']","['q-bio.NC', 'cs.AI', 'cs.NE', 'stat.ML']",2017-01-18 10:51:58+00:00
http://arxiv.org/abs/1701.04968v1,Multilayer Perceptron Algebra,"Artificial Neural Networks(ANN) has been phenomenally successful on various
pattern recognition tasks. However, the design of neural networks rely heavily
on the experience and intuitions of individual developers. In this article, the
author introduces a mathematical structure called MLP algebra on the set of all
Multilayer Perceptron Neural Networks(MLP), which can serve as a guiding
principle to build MLPs accommodating to the particular data sets, and to build
complex MLPs from simpler ones.",['Zhao Peng'],"['stat.ML', 'cs.LG']",2017-01-18 06:49:03+00:00
http://arxiv.org/abs/1701.04944v5,A Machine Learning Alternative to P-values,"This paper presents an alternative approach to p-values in regression
settings. This approach, whose origins can be traced to machine learning, is
based on the leave-one-out bootstrap for prediction error. In machine learning
this is called the out-of-bag (OOB) error. To obtain the OOB error for a model,
one draws a bootstrap sample and fits the model to the in-sample data. The
out-of-sample prediction error for the model is obtained by calculating the
prediction error for the model using the out-of-sample data. Repeating and
averaging yields the OOB error, which represents a robust cross-validated
estimate of the accuracy of the underlying model. By a simple modification to
the bootstrap data involving ""noising up"" a variable, the OOB method yields a
variable importance (VIMP) index, which directly measures how much a specific
variable contributes to the prediction precision of a model. VIMP provides a
scientifically interpretable measure of the effect size of a variable, we call
the ""predictive effect size"", that holds whether the researcher's model is
correct or not, unlike the p-value whose calculation is based on the assumed
correctness of the model. We also discuss a marginal VIMP index, also easily
calculated, which measures the marginal effect of a variable, or what we call
""the discovery effect"". The OOB procedure can be applied to both parametric and
nonparametric regression models and requires only that the researcher can
repeatedly fit their model to bootstrap and modified bootstrap data. We
illustrate this approach on a survival data set involving patients with
systolic heart failure and to a simulated survival data set where the model is
incorrectly specified to illustrate its robustness to model misspecification.","['Min Lu', 'Hemant Ishwaran']","['stat.ML', 'cs.LG']",2017-01-18 05:07:03+00:00
http://arxiv.org/abs/1701.04895v1,Unknowable Manipulators: Social Network Curator Algorithms,"For a social networking service to acquire and retain users, it must find
ways to keep them engaged. By accurately gauging their preferences, it is able
to serve them with the subset of available content that maximises revenue for
the site. Without the constraints of an appropriate regulatory framework, we
argue that a sufficiently sophisticated curator algorithm tasked with
performing this process may choose to explore curation strategies that are
detrimental to users. In particular, we suggest that such an algorithm is
capable of learning to manipulate its users, for several qualitative reasons:
1. Access to vast quantities of user data combined with ongoing breakthroughs
in the field of machine learning are leading to powerful but uninterpretable
strategies for decision making at scale. 2. The availability of an effective
feedback mechanism for assessing the short and long term user responses to
curation strategies. 3. Techniques from reinforcement learning have allowed
machines to learn automated and highly successful strategies at an abstract
level, often resulting in non-intuitive yet nonetheless highly appropriate
action selection. In this work, we consider the form that these strategies for
user manipulation might take and scrutinise the role that regulation should
play in the design of such systems.","['Samuel Albanie', 'Hillary Shakespeare', 'Tom Gunter']","['cs.AI', 'cs.SI', 'stat.ML']",2017-01-17 22:52:24+00:00
http://arxiv.org/abs/1701.04889v2,Efficient and Adaptive Linear Regression in Semi-Supervised Settings,"We consider the linear regression problem under semi-supervised settings
wherein the available data typically consists of: (i) a small or moderate sized
'labeled' data, and (ii) a much larger sized 'unlabeled' data. Such data arises
naturally from settings where the outcome, unlike the covariates, is expensive
to obtain, a frequent scenario in modern studies involving large databases like
electronic medical records (EMR). Supervised estimators like the ordinary least
squares (OLS) estimator utilize only the labeled data. It is often of interest
to investigate if and when the unlabeled data can be exploited to improve
estimation of the regression parameter in the adopted linear model.
  In this paper, we propose a class of 'Efficient and Adaptive Semi-Supervised
Estimators' (EASE) to improve estimation efficiency. The EASE are two-step
estimators adaptive to model mis-specification, leading to improved (optimal in
some cases) efficiency under model mis-specification, and equal (optimal)
efficiency under a linear model. This adaptive property, often unaddressed in
the existing literature, is crucial for advocating 'safe' use of the unlabeled
data. The construction of EASE primarily involves a flexible
'semi-non-parametric' imputation, including a smoothing step that works well
even when the number of covariates is not small; and a follow up 'refitting'
step along with a cross-validation (CV) strategy both of which have useful
practical as well as theoretical implications towards addressing two important
issues: under-smoothing and over-fitting. We establish asymptotic results
including consistency, asymptotic normality and the adaptive properties of
EASE. We also provide influence function expansions and a 'double' CV strategy
for inference. The results are further validated through extensive simulations,
followed by application to an EMR study on auto-immunity.","['Abhishek Chakrabortty', 'Tianxi Cai']","['stat.ME', 'math.ST', 'stat.ML', 'stat.TH', '62F35, 62J05, 62F10, 62F12, 62G08']",2017-01-17 22:29:22+00:00
http://arxiv.org/abs/1701.04869v2,3D Morphology Prediction of Progressive Spinal Deformities from Probabilistic Modeling of Discriminant Manifolds,"We introduce a novel approach for predicting the progression of adolescent
idiopathic scoliosis from 3D spine models reconstructed from biplanar X-ray
images. Recent progress in machine learning have allowed to improve
classification and prognosis rates, but lack a probabilistic framework to
measure uncertainty in the data. We propose a discriminative probabilistic
manifold embedding where locally linear mappings transform data points from
high-dimensional space to corresponding low-dimensional coordinates. A
discriminant adjacency matrix is constructed to maximize the separation between
progressive and non-progressive groups of patients diagnosed with scoliosis,
while minimizing the distance in latent variables belonging to the same class.
To predict the evolution of deformation, a baseline reconstruction is projected
onto the manifold, from which a spatiotemporal regression model is built from
parallel transport curves inferred from neighboring exemplars. Rate of
progression is modulated from the spine flexibility and curve magnitude of the
3D spine deformation. The method was tested on 745 reconstructions from 133
subjects using longitudinal 3D reconstructions of the spine, with results
demonstrating the discriminatory framework can identify between progressive and
non-progressive of scoliotic patients with a classification rate of 81% and
prediction differences of 2.1$^{o}$ in main curve angulation, outperforming
other manifold learning methods. Our method achieved a higher prediction
accuracy and improved the modeling of spatiotemporal morphological changes in
highly deformed spines compared to other learning methods.","['Samuel Kadoury', 'William Mandel', 'Marjolaine Roy-Beaudry', 'Marie-Lyne Nault', 'Stefan Parent']","['cs.LG', 'stat.ML']",2017-01-17 21:15:56+00:00
http://arxiv.org/abs/1701.04862v1,Towards Principled Methods for Training Generative Adversarial Networks,"The goal of this paper is not to introduce a single algorithm or method, but
to make theoretical steps towards fully understanding the training dynamics of
generative adversarial networks. In order to substantiate our theoretical
analysis, we perform targeted experiments to verify our assumptions, illustrate
our claims, and quantify the phenomena. This paper is divided into three
sections. The first section introduces the problem at hand. The second section
is dedicated to studying and proving rigorously the problems including
instability and saturation that arize when training generative adversarial
networks. The third section examines a practical and theoretically grounded
direction towards solving these problems, while introducing new tools to study
them.","['Martin Arjovsky', 'Léon Bottou']","['stat.ML', 'cs.LG']",2017-01-17 20:46:21+00:00
http://arxiv.org/abs/1701.04851v4,Synthesizing Normalized Faces from Facial Identity Features,"We present a method for synthesizing a frontal, neutral-expression image of a
person's face given an input face photograph. This is achieved by learning to
generate facial landmarks and textures from features extracted from a
facial-recognition network. Unlike previous approaches, our encoding feature
vector is largely invariant to lighting, pose, and facial expression.
Exploiting this invariance, we train our decoder network using only frontal,
neutral-expression photographs. Since these photographs are well aligned, we
can decompose them into a sparse set of landmark points and aligned texture
maps. The decoder then predicts landmarks and textures independently and
combines them using a differentiable image warping operation. The resulting
images can be used for a number of applications, such as analyzing facial
attributes, exposure and white balance adjustment, or creating a 3-D avatar.","['Forrester Cole', 'David Belanger', 'Dilip Krishnan', 'Aaron Sarna', 'Inbar Mosseri', 'William T. Freeman']","['cs.CV', 'stat.ML']",2017-01-17 20:03:46+00:00
http://arxiv.org/abs/1701.04831v2,Equivalence of restricted Boltzmann machines and tensor network states,"The restricted Boltzmann machine (RBM) is one of the fundamental building
blocks of deep learning. RBM finds wide applications in dimensional reduction,
feature extraction, and recommender systems via modeling the probability
distributions of a variety of input data including natural images, speech
signals, and customer ratings, etc. We build a bridge between RBM and tensor
network states (TNS) widely used in quantum many-body physics research. We
devise efficient algorithms to translate an RBM into the commonly used TNS.
Conversely, we give sufficient and necessary conditions to determine whether a
TNS can be transformed into an RBM of given architectures. Revealing these
general and constructive connections can cross-fertilize both deep learning and
quantum many-body physics. Notably, by exploiting the entanglement entropy
bound of TNS, we can rigorously quantify the expressive power of RBM on complex
data sets. Insights into TNS and its entanglement capacity can guide the design
of more powerful deep learning architectures. On the other hand, RBM can
represent quantum many-body states with fewer parameters compared to TNS, which
may allow more efficient classical simulations.","['Jing Chen', 'Song Cheng', 'Haidong Xie', 'Lei Wang', 'Tao Xiang']","['cond-mat.str-el', 'quant-ph', 'stat.ML']",2017-01-17 19:00:07+00:00
http://arxiv.org/abs/1701.04724v5,On the Sample Complexity of Graphical Model Selection for Non-Stationary Processes,"We characterize the sample size required for accurate graphical model
selection from non-stationary samples. The observed data is modeled as a
vector-valued zero-mean Gaussian random process whose samples are uncorrelated
but have different covariance matrices. This model contains as special cases
the standard setting of i.i.d. samples as well as the case of samples forming a
stationary or underspread (non-stationary) processes. More generally, our model
applies to any process model for which an efficient decorrelation can be
obtained. By analyzing a particular model selection method, we derive a
sufficient condition on the required sample size for accurate graphical model
selection based on non-stationary data.","['Nguyen Q. Tran', 'Oleksii Abramenko', 'Alexander Jung']","['cs.LG', 'stat.ML']",2017-01-17 15:19:44+00:00
http://arxiv.org/abs/1701.04532v1,Multi-view Regularized Gaussian Processes,"Gaussian processes (GPs) have been proven to be powerful tools in various
areas of machine learning. However, there are very few applications of GPs in
the scenario of multi-view learning. In this paper, we present a new GP model
for multi-view learning. Unlike existing methods, it combines multiple views by
regularizing marginal likelihood with the consistency among the posterior
distributions of latent functions from different views. Moreover, we give a
general point selection scheme for multi-view learning and improve the proposed
model by this criterion. Experimental results on multiple real world data sets
have verified the effectiveness of the proposed model and witnessed the
performance improvement through employing this novel point selection scheme.","['Qiuyang Liu', 'Shiliang Sun']",['stat.ML'],2017-01-17 05:20:38+00:00
http://arxiv.org/abs/1701.04516v1,On The Construction of Extreme Learning Machine for Online and Offline One-Class Classification - An Expanded Toolbox,"One-Class Classification (OCC) has been prime concern for researchers and
effectively employed in various disciplines. But, traditional methods based
one-class classifiers are very time consuming due to its iterative process and
various parameters tuning. In this paper, we present six OCC methods based on
extreme learning machine (ELM) and Online Sequential ELM (OSELM). Our proposed
classifiers mainly lie in two categories: reconstruction based and boundary
based, which supports both types of learning viz., online and offline learning.
Out of various proposed methods, four are offline and remaining two are online
methods. Out of four offline methods, two methods perform random feature
mapping and two methods perform kernel feature mapping. Kernel feature mapping
based approaches have been tested with RBF kernel and online version of
one-class classifiers are tested with both types of nodes viz., additive and
RBF. It is well known fact that threshold decision is a crucial factor in case
of OCC, so, three different threshold deciding criteria have been employed so
far and analyses the effectiveness of one threshold deciding criteria over
another. Further, these methods are tested on two artificial datasets to check
there boundary construction capability and on eight benchmark datasets from
different discipline to evaluate the performance of the classifiers. Our
proposed classifiers exhibit better performance compared to ten traditional
one-class classifiers and ELM based two one-class classifiers. Through proposed
one-class classifiers, we intend to expand the functionality of the most used
toolbox for OCC i.e. DD toolbox. All of our methods are totally compatible with
all the present features of the toolbox.","['Chandan Gautam', 'Aruna Tiwari', 'Qian Leng']","['cs.LG', 'stat.ML']",2017-01-17 02:55:51+00:00
http://arxiv.org/abs/1701.04503v1,Deep Learning for Computational Chemistry,"The rise and fall of artificial neural networks is well documented in the
scientific literature of both computer science and computational chemistry. Yet
almost two decades later, we are now seeing a resurgence of interest in deep
learning, a machine learning algorithm based on multilayer neural networks.
Within the last few years, we have seen the transformative impact of deep
learning in many domains, particularly in speech recognition and computer
vision, to the extent that the majority of expert practitioners in those field
are now regularly eschewing prior established models in favor of deep learning
models. In this review, we provide an introductory overview into the theory of
deep neural networks and their unique properties that distinguish them from
traditional machine learning algorithms used in cheminformatics. By providing
an overview of the variety of emerging applications of deep neural networks, we
highlight its ubiquity and broad applicability to a wide range of challenges in
the field, including QSAR, virtual screening, protein structure prediction,
quantum chemistry, materials design and property prediction. In reviewing the
performance of deep neural networks, we observed a consistent outperformance
against non-neural networks state-of-the-art models across disparate research
topics, and deep neural network based models often exceeded the ""glass ceiling""
expectations of their respective tasks. Coupled with the maturity of
GPU-accelerated computing for training deep neural networks and the exponential
growth of chemical data on which to train these networks on, we anticipate that
deep learning algorithms will be a valuable tool for computational chemistry.","['Garrett B. Goh', 'Nathan O. Hodas', 'Abhinav Vishnu']","['stat.ML', 'cs.AI', 'cs.CE', 'cs.LG', 'physics.chem-ph']",2017-01-17 01:15:14+00:00
http://arxiv.org/abs/1701.04489v1,Towards a New Interpretation of Separable Convolutions,"In recent times, the use of separable convolutions in deep convolutional
neural network architectures has been explored. Several researchers, most
notably (Chollet, 2016) and (Ghosh, 2017) have used separable convolutions in
their deep architectures and have demonstrated state of the art or close to
state of the art performance. However, the underlying mechanism of action of
separable convolutions are still not fully understood. Although their
mathematical definition is well understood as a depthwise convolution followed
by a pointwise convolution, deeper interpretations such as the extreme
Inception hypothesis (Chollet, 2016) have failed to provide a thorough
explanation of their efficacy. In this paper, we propose a hybrid
interpretation that we believe is a better model for explaining the efficacy of
separable convolutions.",['Tapabrata Ghosh'],"['cs.LG', 'stat.ML']",2017-01-16 23:57:33+00:00
http://arxiv.org/abs/1701.04455v3,High-Dimensional Regression with Binary Coefficients. Estimating Squared Error and a Phase Transition,"We consider a sparse linear regression model Y=X\beta^{*}+W where X has a
Gaussian entries, W is the noise vector with mean zero Gaussian entries, and
\beta^{*} is a binary vector with support size (sparsity) k. Using a novel
conditional second moment method we obtain a tight up to a multiplicative
constant approximation of the optimal squared error
\min_{\beta}\|Y-X\beta\|_{2}, where the minimization is over all k-sparse
binary vectors \beta. The approximation reveals interesting structural
properties of the underlying regression problem. In particular, a) We establish
that n^*=2k\log p/\log (2k/\sigma^{2}+1) is a phase transition point with the
following ""all-or-nothing"" property. When n exceeds n^{*},
(2k)^{-1}\|\beta_{2}-\beta^*\|_0\approx 0, and when n is below n^{*},
(2k)^{-1}\|\beta_{2}-\beta^*\|_0\approx 1, where \beta_2 is the optimal
solution achieving the smallest squared error. With this we prove that n^{*} is
the asymptotic threshold for recovering \beta^* information theoretically. b)
We compute the squared error for an intermediate problem
\min_{\beta}\|Y-X\beta\|_{2} where minimization is restricted to vectors \beta
with \|\beta-\beta^{*}\|_0=2k \zeta, for \zeta\in [0,1]. We show that a lower
bound part \Gamma(\zeta) of the estimate, which corresponds to the estimate
based on the first moment method, undergoes a phase transition at three
different thresholds, namely n_{\text{inf,1}}=\sigma^2\log p, which is
information theoretic bound for recovering \beta^* when k=1 and \sigma is
large, then at n^{*} and finally at n_{\text{LASSO/CS}}. c) We establish a
certain Overlap Gap Property (OGP) on the space of all binary vectors \beta
when n\le ck\log p for sufficiently small constant c. We conjecture that OGP is
the source of algorithmic hardness of solving the minimization problem
\min_{\beta}\|Y-X\beta\|_{2} in the regime n<n_{\text{LASSO/CS}}.","['David Gamarnik', 'Ilias Zadik']","['stat.ML', 'math.PR', 'math.ST', 'stat.TH']",2017-01-16 20:44:36+00:00
