id,title,abstract,authors,categories,date
http://arxiv.org/abs/1511.07367v1,Black box variational inference for state space models,"Latent variable time-series models are among the most heavily used tools from
machine learning and applied statistics. These models have the advantage of
learning latent structure both from noisy observations and from the temporal
ordering in the data, where it is assumed that meaningful correlation structure
exists across time. A few highly-structured models, such as the linear
dynamical system with linear-Gaussian observations, have closed-form inference
procedures (e.g. the Kalman Filter), but this case is an exception to the
general rule that exact posterior inference in more complex generative models
is intractable. Consequently, much work in time-series modeling focuses on
approximate inference procedures for one particular class of models. Here, we
extend recent developments in stochastic variational inference to develop a
`black-box' approximate inference technique for latent variable models with
latent dynamical structure. We propose a structured Gaussian variational
approximate posterior that carries the same intuition as the standard Kalman
filter-smoother but, importantly, permits us to use the same inference approach
to approximate the posterior of much more general, nonlinear latent variable
generative models. We show that our approach recovers accurate estimates in the
case of basic models with closed-form posteriors, and more interestingly
performs well in comparison to variational approaches that were designed in a
bespoke fashion for specific non-conjugate models.","['Evan Archer', 'Il Memming Park', 'Lars Buesing', 'John Cunningham', 'Liam Paninski']",['stat.ML'],2015-11-23 19:08:08+00:00
http://arxiv.org/abs/1511.07334v2,Switched latent force models for reverse-engineering transcriptional regulation in gene expression data,"To survive environmental conditions, cells transcribe their response
activities into encoded mRNA sequences in order to produce certain amounts of
protein concentrations. The external conditions are mapped into the cell
through the activation of special proteins called transcription factors (TFs).
Due to the difficult task to measure experimentally TF behaviours, and the
challenges to capture their quick-time dynamics, different types of models
based on differential equations have been proposed. However, those approaches
usually incur in costly procedures, and they present problems to describe
sudden changes in TF regulators. In this paper, we present a switched dynamical
latent force model for reverse-engineering transcriptional regulation in gene
expression data which allows the exact inference over latent TF activities
driving some observed gene expressions through a linear differential equation.
To deal with discontinuities in the dynamics, we introduce an approach that
switches between different TF activities and different dynamical systems. This
creates a versatile representation of transcription networks that can capture
discrete changes and non-linearities We evaluate our model on both simulated
data and real-data (e.g. microaerobic shift in E. coli, yeast respiration),
concluding that our framework allows for the fitting of the expression data
while being able to infer continuous-time TF profiles.","['Andrés F. López-Lopera', 'Mauricio A. Álvarez']","['physics.bio-ph', 'physics.data-an', 'stat.ML']",2015-11-23 17:38:38+00:00
http://arxiv.org/abs/1511.07294v1,Stochastic Parallel Block Coordinate Descent for Large-scale Saddle Point Problems,"We consider convex-concave saddle point problems with a separable structure
and non-strongly convex functions. We propose an efficient stochastic block
coordinate descent method using adaptive primal-dual updates, which enables
flexible parallel optimization for large-scale problems. Our method shares the
efficiency and flexibility of block coordinate descent methods with the
simplicity of primal-dual methods and utilizing the structure of the separable
convex-concave saddle point problem. It is capable of solving a wide range of
machine learning applications, including robust principal component analysis,
Lasso, and feature selection by group Lasso, etc. Theoretically and
empirically, we demonstrate significantly better performance than
state-of-the-art methods in all these applications.","['Zhanxing Zhu', 'Amos J. Storkey']",['stat.ML'],2015-11-23 16:12:11+00:00
http://arxiv.org/abs/1511.07293v1,"Sparse Recovery via Partial Regularization: Models, Theory and Algorithms","In the context of sparse recovery, it is known that most of existing
regularizers such as $\ell_1$ suffer from some bias incurred by some leading
entries (in magnitude) of the associated vector. To neutralize this bias, we
propose a class of models with partial regularizers for recovering a sparse
solution of a linear system. We show that every local minimizer of these models
is sufficiently sparse or the magnitude of all its nonzero entries is above a
uniform constant depending only on the data of the linear system. Moreover, for
a class of partial regularizers, any global minimizer of these models is a
sparsest solution to the linear system. We also establish some sufficient
conditions for local or global recovery of the sparsest solution to the linear
system, among which one of the conditions is weaker than the best known
restricted isometry property (RIP) condition for sparse recovery by $\ell_1$.
In addition, a first-order feasible augmented Lagrangian (FAL) method is
proposed for solving these models, in which each subproblem is solved by a
nonmonotone proximal gradient (NPG) method. Despite the complication of the
partial regularizers, we show that each proximal subproblem in NPG can be
solved as a certain number of one-dimensional optimization problems, which
usually have a closed-form solution. We also show that any accumulation point
of the sequence generated by FAL is a first-order stationary point of the
models. Numerical results on compressed sensing and sparse logistic regression
demonstrate that the proposed models substantially outperform the widely used
ones in the literature in terms of solution quality.","['Zhaosong Lu', 'Xiaorui Li']","['math.OC', 'cs.IT', 'cs.LG', 'math.IT', 'stat.ME', 'stat.ML']",2015-11-23 16:08:24+00:00
http://arxiv.org/abs/1511.07281v1,Sparse Linear Models applied to Power Quality Disturbance Classification,"Power quality (PQ) analysis describes the non-pure electric signals that are
usually present in electric power systems. The automatic recognition of PQ
disturbances can be seen as a pattern recognition problem, in which different
types of waveform distortion are differentiated based on their features.
Similar to other quasi-stationary signals, PQ disturbances can be decomposed
into time-frequency dependent components by using time-frequency or time-scale
transforms, also known as dictionaries. These dictionaries are used in the
feature extraction step in pattern recognition systems. Short-time Fourier,
Wavelets and Stockwell transforms are some of the most common dictionaries used
in the PQ community, aiming to achieve a better signal representation. To the
best of our knowledge, previous works about PQ disturbance classification have
been restricted to the use of one among several available dictionaries. Taking
advantage of the theory behind sparse linear models (SLM), we introduce a
sparse method for PQ representation, starting from overcomplete dictionaries.
In particular, we apply Group Lasso. We employ different types of
time-frequency (or time-scale) dictionaries to characterize the PQ
disturbances, and evaluate their performance under different pattern
recognition algorithms. We show that the SLM reduce the PQ classification
complexity promoting sparse basis selection, and improving the classification
accuracy.","['Andrés F. López-Lopera', 'Mauricio A. Álvarez', 'Ávaro A. Orozco']","['stat.AP', 'stat.ML']",2015-11-23 15:44:16+00:00
http://arxiv.org/abs/1511.07211v2,Noisy Submodular Maximization via Adaptive Sampling with Applications to Crowdsourced Image Collection Summarization,"We address the problem of maximizing an unknown submodular function that can
only be accessed via noisy evaluations. Our work is motivated by the task of
summarizing content, e.g., image collections, by leveraging users' feedback in
form of clicks or ratings. For summarization tasks with the goal of maximizing
coverage and diversity, submodular set functions are a natural choice. When the
underlying submodular function is unknown, users' feedback can provide noisy
evaluations of the function that we seek to maximize. We provide a generic
algorithm -- \submM{} -- for maximizing an unknown submodular function under
cardinality constraints. This algorithm makes use of a novel exploration module
-- \blbox{} -- that proposes good elements based on adaptively sampling noisy
function evaluations. \blbox{} is able to accommodate different kinds of
observation models such as value queries and pairwise comparisons. We provide
PAC-style guarantees on the quality and sampling cost of the solution obtained
by \submM{}. We demonstrate the effectiveness of our approach in an
interactive, crowdsourced image collection summarization application.","['Adish Singla', 'Sebastian Tschiatschek', 'Andreas Krause']","['cs.AI', 'cs.LG', 'stat.ML']",2015-11-23 13:19:05+00:00
http://arxiv.org/abs/1511.07130v1,Parallel Predictive Entropy Search for Batch Global Optimization of Expensive Objective Functions,"We develop parallel predictive entropy search (PPES), a novel algorithm for
Bayesian optimization of expensive black-box objective functions. At each
iteration, PPES aims to select a batch of points which will maximize the
information gain about the global maximizer of the objective. Well known
strategies exist for suggesting a single evaluation point based on previous
observations, while far fewer are known for selecting batches of points to
evaluate in parallel. The few batch selection schemes that have been studied
all resort to greedy methods to compute an optimal batch. To the best of our
knowledge, PPES is the first non-greedy batch Bayesian optimization strategy.
We demonstrate the benefit of this approach in optimization performance on both
synthetic and real world applications, including problems in machine learning,
rocket science and robotics.","['Amar Shah', 'Zoubin Ghahramani']","['cs.LG', 'stat.ML']",2015-11-23 08:21:17+00:00
http://arxiv.org/abs/1511.07125v1,What Happened to My Dog in That Network: Unraveling Top-down Generators in Convolutional Neural Networks,"Top-down information plays a central role in human perception, but plays
relatively little role in many current state-of-the-art deep networks, such as
Convolutional Neural Networks (CNNs). This work seeks to explore a path by
which top-down information can have a direct impact within current deep
networks. We explore this path by learning and using ""generators"" corresponding
to the network internal effects of three types of transformation (each a
restriction of a general affine transformation): rotation, scaling, and
translation. We demonstrate how these learned generators can be used to
transfer top-down information to novel settings, as mediated by the ""feature
flows"" that the transformations (and the associated generators) correspond to
inside the network. Specifically, we explore three aspects: 1) using generators
as part of a method for synthesizing transformed images --- given a previously
unseen image, produce versions of that image corresponding to one or more
specified transformations, 2) ""zero-shot learning"" --- when provided with a
feature flow corresponding to the effect of a transformation of unknown amount,
leverage learned generators as part of a method by which to perform an accurate
categorization of the amount of transformation, even for amounts never observed
during training, and 3) (inside-CNN) ""data augmentation"" --- improve the
classification performance of an existing network by using the learned
generators to directly provide additional training ""inside the CNN"".","['Patrick W. Gallagher', 'Shuai Tang', 'Zhuowen Tu']","['cs.NE', 'cs.CV', 'cs.LG', 'stat.ML']",2015-11-23 07:48:01+00:00
http://arxiv.org/abs/1511.06909v7,BlackOut: Speeding up Recurrent Neural Network Language Models With Very Large Vocabularies,"We propose BlackOut, an approximation algorithm to efficiently train massive
recurrent neural network language models (RNNLMs) with million word
vocabularies. BlackOut is motivated by using a discriminative loss, and we
describe a new sampling strategy which significantly reduces computation while
improving stability, sample efficiency, and rate of convergence. One way to
understand BlackOut is to view it as an extension of the DropOut strategy to
the output layer, wherein we use a discriminative training loss and a weighted
sampling scheme. We also establish close connections between BlackOut,
importance sampling, and noise contrastive estimation (NCE). Our experiments,
on the recently released one billion word language modeling benchmark,
demonstrate scalability and accuracy of BlackOut; we outperform the
state-of-the art, and achieve the lowest perplexity scores on this dataset.
Moreover, unlike other established methods which typically require GPUs or CPU
clusters, we show that a carefully implemented version of BlackOut requires
only 1-10 days on a single machine to train a RNNLM with a million word
vocabulary and billions of parameters on one billion words. Although we
describe BlackOut in the context of RNNLM training, it can be used to any
networks with large softmax output layers.","['Shihao Ji', 'S. V. N. Vishwanathan', 'Nadathur Satish', 'Michael J. Anderson', 'Pradeep Dubey']","['cs.LG', 'cs.CL', 'cs.NE', 'stat.ML']",2015-11-21 17:49:30+00:00
http://arxiv.org/abs/1511.06891v2,Near-Optimal Active Learning of Multi-Output Gaussian Processes,"This paper addresses the problem of active learning of a multi-output
Gaussian process (MOGP) model representing multiple types of coexisting
correlated environmental phenomena. In contrast to existing works, our active
learning problem involves selecting not just the most informative sampling
locations to be observed but also the types of measurements at each selected
location for minimizing the predictive uncertainty (i.e., posterior joint
entropy) of a target phenomenon of interest given a sampling budget.
Unfortunately, such an entropy criterion scales poorly in the numbers of
candidate sampling locations and selected observations when optimized. To
resolve this issue, we first exploit a structure common to sparse MOGP models
for deriving a novel active learning criterion. Then, we exploit a relaxed form
of submodularity property of our new criterion for devising a polynomial-time
approximation algorithm that guarantees a constant-factor approximation of that
achieved by the optimal set of selected observations. Empirical evaluation on
real-world datasets shows that our proposed approach outperforms existing
algorithms for active learning of MOGP and single-output GP models.","['Yehong Zhang', 'Trong Nghia Hoang', 'Kian Hsiang Low', 'Mohan Kankanhalli']","['stat.ML', 'cs.AI', 'cs.LG']",2015-11-21 15:08:53+00:00
http://arxiv.org/abs/1511.06890v1,"Gaussian Process Planning with Lipschitz Continuous Reward Functions: Towards Unifying Bayesian Optimization, Active Learning, and Beyond","This paper presents a novel nonmyopic adaptive Gaussian process planning
(GPP) framework endowed with a general class of Lipschitz continuous reward
functions that can unify some active learning/sensing and Bayesian optimization
criteria and offer practitioners some flexibility to specify their desired
choices for defining new tasks/problems. In particular, it utilizes a
principled Bayesian sequential decision problem framework for jointly and
naturally optimizing the exploration-exploitation trade-off. In general, the
resulting induced GPP policy cannot be derived exactly due to an uncountable
set of candidate observations. A key contribution of our work here thus lies in
exploiting the Lipschitz continuity of the reward functions to solve for a
nonmyopic adaptive epsilon-optimal GPP (epsilon-GPP) policy. To plan in real
time, we further propose an asymptotically optimal, branch-and-bound anytime
variant of epsilon-GPP with performance guarantee. We empirically demonstrate
the effectiveness of our epsilon-GPP policy and its anytime variant in Bayesian
optimization and an energy harvesting task.","['Chun Kai Ling', 'Kian Hsiang Low', 'Patrick Jaillet']","['stat.ML', 'cs.AI', 'cs.LG', 'cs.RO']",2015-11-21 14:57:48+00:00
http://arxiv.org/abs/1511.06821v1,Kernel Additive Principal Components,"Additive principal components (APCs for short) are a nonlinear generalization
of linear principal components. We focus on smallest APCs to describe additive
nonlinear constraints that are approximately satisfied by the data. Thus APCs
fit data with implicit equations that treat the variables symmetrically, as
opposed to regression analyses which fit data with explicit equations that
treat the data asymmetrically by singling out a response variable. We propose a
regularized data-analytic procedure for APC estimation using kernel methods. In
contrast to existing approaches to APCs that are based on regularization
through subspace restriction, kernel methods achieve regularization through
shrinkage and therefore grant distinctive flexibility in APC estimation by
allowing the use of infinite-dimensional functions spaces for searching APC
transformation while retaining computational feasibility. To connect population
APCs and kernelized finite-sample APCs, we study kernelized population APCs and
their associated eigenproblems, which eventually lead to the establishment of
consistency of the estimated APCs. Lastly, we discuss an iterative algorithm
for computing kernelized finite-sample APCs.","['Xin Lu Tan', 'Andreas Buja', 'Zongming Ma']","['stat.ME', 'stat.ML']",2015-11-21 03:12:04+00:00
http://arxiv.org/abs/1511.06807v1,Adding Gradient Noise Improves Learning for Very Deep Networks,"Deep feedforward and recurrent networks have achieved impressive results in
many perception and language processing applications. This success is partially
attributed to architectural innovations such as convolutional and long
short-term memory networks. The main motivation for these architectural
innovations is that they capture better domain knowledge, and importantly are
easier to optimize than more basic architectures. Recently, more complex
architectures such as Neural Turing Machines and Memory Networks have been
proposed for tasks including question answering and general computation,
creating a new set of optimization challenges. In this paper, we discuss a
low-overhead and easy-to-implement technique of adding gradient noise which we
find to be surprisingly effective when training these very deep architectures.
The technique not only helps to avoid overfitting, but also can result in lower
training loss. This method alone allows a fully-connected 20-layer deep network
to be trained with standard gradient descent, even starting from a poor
initialization. We see consistent improvements for many complex models,
including a 72% relative reduction in error rate over a carefully-tuned
baseline on a challenging question-answering task, and a doubling of the number
of accurate binary multiplication models learned across 7,000 random restarts.
We encourage further application of this technique to additional complex modern
architectures.","['Arvind Neelakantan', 'Luke Vilnis', 'Quoc V. Le', 'Ilya Sutskever', 'Lukasz Kaiser', 'Karol Kurach', 'James Martens']","['stat.ML', 'cs.LG']",2015-11-21 01:11:29+00:00
http://arxiv.org/abs/1511.07422v1,Variational Bayes Factor Analysis for i-Vector Extraction,"In this document we are going to derive the equations needed to implement a
Variational Bayes i-vector extractor. This can be used to extract longer
i-vectors reducing the risk of overfittig or to adapt an i-vector extractor
from a database to another with scarce development data. This work is based on
Patrick Kenny's joint factor analysis and Christopher Bishop's variational
principal components.",['Jesús Villalba'],['stat.ML'],2015-11-20 21:38:25+00:00
http://arxiv.org/abs/1511.07421v1,Unsupervised Adaptation of SPLDA,"State-of-the-art speaker recognition relays on models that need a large
amount of training data. This models are successful in tasks like NIST SRE
because there is sufficient data available. However, in real applications, we
usually do not have so much data and, in many cases, the speaker labels are
unknown. We present a method to adapt a PLDA model from a domain with a large
amount of labeled data to another with unlabeled data. We describe a generative
model that produces both sets of data where the unknown labels are modeled like
latent variables. We used variational Bayes to estimate the hidden variables.
Here, we derive the equations for this model. This model has been used in the
papers: ""UNSUPERVISED ADAPTATION OF PLDA BY USING VARIATIONAL BAYES METHODS""
publised at ICASSP 2014, ""Unsupervised Training of PLDA with Variational Bayes""
published at Iberspeech 2014, and ""VARIATIONAL BAYESIAN PLDA FOR SPEAKER
DIARIZATION IN THE MGB CHALLENGE"" published at ASRU 2015.",['Jesús Villalba'],['stat.ML'],2015-11-20 21:25:59+00:00
http://arxiv.org/abs/1511.06772v1,PLDA with Two Sources of Inter-session Variability,"In some speaker recognition scenarios we find conversations recorded
simultaneously over multiple channels. That is the case of the interviews in
the NIST SRE dataset. To take advantage of that, we propose a modification of
the PLDA model that considers two different inter-session variability terms.
The first term is tied between all the recordings belonging to the same
conversation whereas the second is not. Thus, the former mainly intends to
capture the variability due to the phonetic content of the conversation while
the latter tries to capture the channel variability. In this document, we
derive the equations for this model. This model was applied in the paper
""Handling Recordings Acquired Simultaneously over Multiple Channels with PLDA""
published at Interspeech 2013.",['Jesús Villalba'],['stat.ML'],2015-11-20 21:08:04+00:00
http://arxiv.org/abs/1511.07318v1,Bayesian SPLDA,"In this document we are going to derive the equations needed to implement a
Variational Bayes estimation of the parameters of the simplified probabilistic
linear discriminant analysis (SPLDA) model. This can be used to adapt SPLDA
from one database to another with few development data or to implement the
fully Bayesian recipe. Our approach is similar to Bishop's VB PPCA.",['Jesús Villalba'],['stat.ML'],2015-11-20 20:43:43+00:00
http://arxiv.org/abs/1511.06718v1,Top-N recommendations from expressive recommender systems,"Normalized nonnegative models assign probability distributions to users and
random variables to items; see [Stark, 2015]. Rating an item is regarded as
sampling the random variable assigned to the item with respect to the
distribution assigned to the user who rates the item. Models of that kind are
highly expressive. For instance, using normalized nonnegative models we can
understand users' preferences as mixtures of interpretable user stereotypes,
and we can arrange properties of users and items in a hierarchical manner.
These features would not be useful if the predictive power of normalized
nonnegative models was poor. Thus, we analyze here the performance of
normalized nonnegative models for top-N recommendation and observe that their
performance matches the performance of methods like PureSVD which was
introduced in [Cremonesi et al., 2010]. We conclude that normalized nonnegative
models not only provide accurate recommendations but they also deliver (for
free) representations that are interpretable. We deepen the discussion of
normalized nonnegative models by providing further theoretical insights. In
particular, we introduce total variational distance as an operational
similarity measure, we discover scenarios where normalized nonnegative models
yield unique representations of users and items, we prove that the inference of
optimal normalized nonnegative models is NP-hard and finally, we discuss the
relationship between normalized nonnegative models and nonnegative matrix
factorization.",['Cyril Stark'],"['cs.LG', 'stat.ML']",2015-11-20 18:18:45+00:00
http://arxiv.org/abs/1511.06683v1,Top-k Multiclass SVM,"Class ambiguity is typical in image classification problems with a large
number of classes. When classes are difficult to discriminate, it makes sense
to allow k guesses and evaluate classifiers based on the top-k error instead of
the standard zero-one loss. We propose top-k multiclass SVM as a direct method
to optimize for top-k performance. Our generalization of the well-known
multiclass SVM is based on a tight convex upper bound of the top-k error. We
propose a fast optimization scheme based on an efficient projection onto the
top-k simplex, which is of its own interest. Experiments on five datasets show
consistent improvements in top-k accuracy compared to various baselines.","['Maksim Lapin', 'Matthias Hein', 'Bernt Schiele']","['stat.ML', 'cs.CV', 'cs.LG']",2015-11-20 16:49:33+00:00
