id,title,abstract,authors,categories,date
http://arxiv.org/abs/2104.11833v1,Selecting a number of voters for a voting ensemble,"For a voting ensemble that selects an odd-sized subset of the ensemble
classifiers at random for each example, applies them to the example, and
returns the majority vote, we show that any number of voters may minimize the
error rate over an out-of-sample distribution. The optimal number of voters
depends on the out-of-sample distribution of the number of classifiers in
error. To select a number of voters to use, estimating that distribution then
inferring error rates for numbers of voters gives lower-variance estimates than
directly estimating those error rates.",['Eric Bax'],"['cs.LG', 'stat.ML']",2021-04-23 22:37:02+00:00
http://arxiv.org/abs/2104.11824v2,Optimal Dynamic Regret in Exp-Concave Online Learning,"We consider the problem of the Zinkevich (2003)-style dynamic regret
minimization in online learning with exp-concave losses. We show that whenever
improper learning is allowed, a Strongly Adaptive online learner achieves the
dynamic regret of $\tilde O^*(n^{1/3}C_n^{2/3} \vee 1)$ where $C_n$ is the
total variation (a.k.a. path length) of the an arbitrary sequence of
comparators that may not be known to the learner ahead of time. Achieving this
rate was highly nontrivial even for squared losses in 1D where the best known
upper bound was $O(\sqrt{nC_n} \vee \log n)$ (Yuan and Lamperski, 2019). Our
new proof techniques make elegant use of the intricate structures of the primal
and dual variables imposed by the KKT conditions and could be of independent
interest. Finally, we apply our results to the classical statistical problem of
locally adaptive non-parametric regression (Mammen, 1991; Donoho and Johnstone,
1998) and obtain a stronger and more flexible algorithm that do not require any
statistical assumptions or any hyperparameter tuning.","['Dheeraj Baby', 'Yu-Xiang Wang']","['cs.LG', 'math.OC', 'stat.ML']",2021-04-23 21:36:51+00:00
http://arxiv.org/abs/2104.11734v3,Exact marginal prior distributions of finite Bayesian neural networks,"Bayesian neural networks are theoretically well-understood only in the
infinite-width limit, where Gaussian priors over network weights yield Gaussian
priors over network outputs. Recent work has suggested that finite Bayesian
networks may outperform their infinite counterparts, but their non-Gaussian
function space priors have been characterized only though perturbative
approaches. Here, we derive exact solutions for the function space priors for
individual input examples of a class of finite fully-connected feedforward
Bayesian neural networks. For deep linear networks, the prior has a simple
expression in terms of the Meijer $G$-function. The prior of a finite ReLU
network is a mixture of the priors of linear networks of smaller widths,
corresponding to different numbers of active units in each layer. Our results
unify previous descriptions of finite network priors in terms of their tail
decay and large-width behavior.","['Jacob A. Zavatone-Veth', 'Cengiz Pehlevan']","['cs.LG', 'cond-mat.dis-nn', 'stat.ML']",2021-04-23 17:31:42+00:00
http://arxiv.org/abs/2104.11702v2,Correlated Dynamics in Marketing Sensitivities,"Understanding individual customers' sensitivities to prices, promotions,
brands, and other marketing mix elements is fundamental to a wide swath of
marketing problems. An important but understudied aspect of this problem is the
dynamic nature of these sensitivities, which change over time and vary across
individuals. Prior work has developed methods for capturing such dynamic
heterogeneity within product categories, but neglected the possibility of
correlated dynamics across categories. In this work, we introduce a framework
to capture such correlated dynamics using a hierarchical dynamic factor model,
where individual preference parameters are influenced by common cross-category
dynamic latent factors, estimated through Bayesian nonparametric Gaussian
processes. We apply our model to grocery purchase data, and find that a
surprising degree of dynamic heterogeneity can be accounted for by only a few
global trends. We also characterize the patterns in how consumers'
sensitivities evolve across categories. Managerially, the proposed framework
not only enhances predictive accuracy by leveraging cross-category data, but
enables more precise estimation of quantities of interest, like price
elasticity.","['Ryan Dew', 'Yuhao Fan']","['stat.AP', 'econ.EM', 'stat.ML']",2021-04-23 16:43:01+00:00
http://arxiv.org/abs/2104.11688v1,Grouped Feature Importance and Combined Features Effect Plot,"Interpretable machine learning has become a very active area of research due
to the rising popularity of machine learning algorithms and their inherently
challenging interpretability. Most work in this area has been focused on the
interpretation of single features in a model. However, for researchers and
practitioners, it is often equally important to quantify the importance or
visualize the effect of feature groups. To address this research gap, we
provide a comprehensive overview of how existing model-agnostic techniques can
be defined for feature groups to assess the grouped feature importance,
focusing on permutation-based, refitting, and Shapley-based methods. We also
introduce an importance-based sequential procedure that identifies a stable and
well-performing combination of features in the grouped feature space.
Furthermore, we introduce the combined features effect plot, which is a
technique to visualize the effect of a group of features based on a sparse,
interpretable linear combination of features. We used simulation studies and a
real data example from computational psychology to analyze, compare, and
discuss these methods.","['Quay Au', 'Julia Herbinger', 'Clemens Stachl', 'Bernd Bischl', 'Giuseppe Casalicchio']","['stat.ML', 'cs.LG']",2021-04-23 16:27:38+00:00
http://arxiv.org/abs/2104.11547v2,Transitional Conditional Independence,"We develope the framework of transitional conditional independence. For this
we introduce transition probability spaces and transitional random variables.
These constructions will generalize, strengthen and unify previous notions of
(conditional) random variables and non-stochastic variables, (extended)
stochastic conditional independence and some form of functional conditional
independence. Transitional conditional independence is asymmetric in general
and it will be shown that it satisfies all desired relevance relations in terms
of left and right versions of the separoid rules, except symmetry, on standard,
analytic and universal measurable spaces. As a preparation we prove a
disintegration theorem for transition probabilities, i.e. the existence and
essential uniqueness of (regular) conditional Markov kernels, on those spaces.
Transitional conditional independence will be able to express classical
statistical concepts like sufficiency, adequacy and ancillarity. As an
application, we will then show how transitional conditional independence can be
used to prove a directed global Markov property for causal graphical models
that allow for non-stochastic input variables in strong generality. This will
then also allow us to show the main rules of causal/do-calculus, relating
observational and interventional distributions, in such measure theoretic
generality.",['Patrick Forré'],"['math.ST', 'math.PR', 'stat.ML', 'stat.OT', 'stat.TH', '62A99, 60A05']",2021-04-23 11:52:15+00:00
http://arxiv.org/abs/2104.11496v1,Learning to reflect: A unifying approach for data-driven stochastic control strategies,"Stochastic optimal control problems have a long tradition in applied
probability, with the questions addressed being of high relevance in a
multitude of fields. Even though theoretical solutions are well understood in
many scenarios, their practicability suffers from the assumption of known
dynamics of the underlying stochastic process, raising the statistical
challenge of developing purely data-driven strategies. For the mathematically
separated classes of continuous diffusion processes and L\'evy processes, we
show that developing efficient strategies for related singular stochastic
control problems can essentially be reduced to finding rate-optimal estimators
with respect to the sup-norm risk of objects associated to the invariant
distribution of ergodic processes which determine the theoretical solution of
the control problem. From a statistical perspective, we exploit the exponential
$\beta$-mixing property as the common factor of both scenarios to drive the
convergence analysis, indicating that relying on general stability properties
of Markov processes is a sufficiently powerful and flexible approach to treat
complex applications requiring statistical methods. We show moreover that in
the L\'evy case $-$ even though per se jump processes are more difficult to
handle both in statistics and control theory $-$ a fully data-driven strategy
with regret of significantly better order than in the diffusion case can be
constructed.","['Sören Christensen', 'Claudia Strauch', 'Lukas Trottner']","['math.ST', 'math.OC', 'math.PR', 'stat.ML', 'stat.TH', '62M05, 62G05, 93E20, 93E35, 60G10, 60G51, 60J60']",2021-04-23 09:33:15+00:00
http://arxiv.org/abs/2104.12576v3,A Splicing Approach to Best Subset of Groups Selection,"Best subset of groups selection (BSGS) is the process of selecting a small
part of non-overlapping groups to achieve the best interpretability on the
response variable. It has attracted increasing attention and has far-reaching
applications in practice. However, due to the computational intractability of
BSGS in high-dimensional settings, developing efficient algorithms for solving
BSGS remains a research hotspot. In this paper,we propose a group-splicing
algorithm that iteratively detects the relevant groups and excludes the
irrelevant ones. Moreover, coupled with a novel group information criterion, we
develop an adaptive algorithm to determine the optimal model size. Under mild
conditions, it is certifiable that our algorithm can identify the optimal
subset of groups in polynomial time with high probability. Finally, we
demonstrate the efficiency and accuracy of our methods by comparing them with
several state-of-the-art algorithms on both synthetic and real-world datasets.","['Yanhang Zhang', 'Junxian Zhu', 'Jin Zhu', 'Xueqin Wang']","['cs.LG', 'stat.ML']",2021-04-23 03:05:11+00:00
http://arxiv.org/abs/2104.11375v1,Decentralized Federated Averaging,"Federated averaging (FedAvg) is a communication efficient algorithm for the
distributed training with an enormous number of clients. In FedAvg, clients
keep their data locally for privacy protection; a central parameter server is
used to communicate between clients. This central server distributes the
parameters to each client and collects the updated parameters from clients.
FedAvg is mostly studied in centralized fashions, which requires massive
communication between server and clients in each communication. Moreover,
attacking the central server can break the whole system's privacy. In this
paper, we study the decentralized FedAvg with momentum (DFedAvgM), which is
implemented on clients that are connected by an undirected graph. In DFedAvgM,
all clients perform stochastic gradient descent with momentum and communicate
with their neighbors only. To further reduce the communication cost, we also
consider the quantized DFedAvgM. We prove convergence of the (quantized)
DFedAvgM under trivial assumptions; the convergence rate can be improved when
the loss function satisfies the P{\L} property. Finally, we numerically verify
the efficacy of DFedAvgM.","['Tao Sun', 'Dongsheng Li', 'Bao Wang']","['cs.DC', 'stat.ML']",2021-04-23 02:01:30+00:00
http://arxiv.org/abs/2104.11315v1,SPECTRE: Defending Against Backdoor Attacks Using Robust Statistics,"Modern machine learning increasingly requires training on a large collection
of data from multiple sources, not all of which can be trusted. A particularly
concerning scenario is when a small fraction of poisoned data changes the
behavior of the trained model when triggered by an attacker-specified
watermark. Such a compromised model will be deployed unnoticed as the model is
accurate otherwise. There have been promising attempts to use the intermediate
representations of such a model to separate corrupted examples from clean ones.
However, these defenses work only when a certain spectral signature of the
poisoned examples is large enough for detection. There is a wide range of
attacks that cannot be protected against by the existing defenses. We propose a
novel defense algorithm using robust covariance estimation to amplify the
spectral signature of corrupted data. This defense provides a clean model,
completely removing the backdoor, even in regimes where previous methods have
no hope of detecting the poisoned examples. Code and pre-trained models are
available at https://github.com/SewoongLab/spectre-defense .","['Jonathan Hayase', 'Weihao Kong', 'Raghav Somani', 'Sewoong Oh']","['cs.LG', 'cs.AI', 'stat.ML']",2021-04-22 20:49:40+00:00
http://arxiv.org/abs/2104.11283v3,A Dimension-Insensitive Algorithm for Stochastic Zeroth-Order Optimization,"This paper concerns a convex, stochastic zeroth-order optimization (S-ZOO)
problem. The objective is to minimize the expectation of a cost function whose
gradient is not directly accessible. For this problem, traditional optimization
algorithms mostly yield query complexities that grow polynomially with
dimensionality (the number of decision variables). Consequently, these methods
may not perform well in solving massive-dimensional problems arising in many
modern applications. Although more recent methods can be provably
dimension-insensitive, almost all of them require arguably more stringent
conditions such as everywhere sparse or compressible gradient. In this paper,
we propose a sparsity-inducing stochastic gradient-free (SI-SGF) algorithm,
which provably yields a dimension-free (up to a logarithmic term) query
complexity in both convex and strongly convex cases. Such insensitivity to the
dimensionality growth is proven, for the first time, to be achievable when
neither gradient sparsity nor gradient compressibility is satisfied. Our
numerical results demonstrate a consistency between our theoretical prediction
and the empirical performance.","['Hongcheng Liu', 'Yu Yang']","['math.OC', 'stat.ME', 'stat.ML', '90C15, 90C25, 90C26']",2021-04-22 18:56:17+00:00
http://arxiv.org/abs/2104.11216v1,Hierarchical Motion Understanding via Motion Programs,"Current approaches to video analysis of human motion focus on raw pixels or
keypoints as the basic units of reasoning. We posit that adding higher-level
motion primitives, which can capture natural coarser units of motion such as
backswing or follow-through, can be used to improve downstream analysis tasks.
This higher level of abstraction can also capture key features, such as loops
of repeated primitives, that are currently inaccessible at lower levels of
representation. We therefore introduce Motion Programs, a neuro-symbolic,
program-like representation that expresses motions as a composition of
high-level primitives. We also present a system for automatically inducing
motion programs from videos of human motion and for leveraging motion programs
in video synthesis. Experiments show that motion programs can accurately
describe a diverse set of human motions and the inferred programs contain
semantically meaningful motion primitives, such as arm swings and jumping
jacks. Our representation also benefits downstream tasks such as video
interpolation and video prediction and outperforms off-the-shelf models. We
further demonstrate how these programs can detect diverse kinds of repetitive
motion and facilitate interactive video editing.","['Sumith Kulal', 'Jiayuan Mao', 'Alex Aiken', 'Jiajun Wu']","['cs.CV', 'cs.AI', 'cs.LG', 'stat.ML']",2021-04-22 17:49:59+00:00
http://arxiv.org/abs/2104.11212v1,Imagining The Road Ahead: Multi-Agent Trajectory Prediction via Differentiable Simulation,"We develop a deep generative model built on a fully differentiable simulator
for multi-agent trajectory prediction. Agents are modeled with conditional
recurrent variational neural networks (CVRNNs), which take as input an
ego-centric birdview image representing the current state of the world and
output an action, consisting of steering and acceleration, which is used to
derive the subsequent agent state using a kinematic bicycle model. The full
simulation state is then differentiably rendered for each agent, initiating the
next time step. We achieve state-of-the-art results on the INTERACTION dataset,
using standard neural architectures and a standard variational training
objective, producing realistic multi-modal predictions without any ad-hoc
diversity-inducing losses. We conduct ablation studies to examine individual
components of the simulator, finding that both the kinematic bicycle model and
the continuous feedback from the birdview image are crucial for achieving this
level of performance. We name our model ITRA, for ""Imagining the Road Ahead"".","['Adam Scibior', 'Vasileios Lioutas', 'Daniele Reda', 'Peyman Bateni', 'Frank Wood']","['stat.ML', 'cs.LG']",2021-04-22 17:48:08+00:00
http://arxiv.org/abs/2104.11191v1,Variational Bayesian Supertrees,"Given overlapping subsets of a set of taxa (e.g. species), and posterior
distributions on phylogenetic tree topologies for each of these taxon sets, how
can we infer a posterior distribution on phylogenetic tree topologies for the
entire taxon set? Although the equivalent problem for in the non-Bayesian case
has attracted substantial research, the Bayesian case has not attracted the
attention it deserves. In this paper we develop a variational Bayes approach to
this problem and demonstrate its effectiveness.","['Michael Karcher', 'Cheng Zhang', 'Frederick A Matsen IV']","['q-bio.PE', 'stat.ML']",2021-04-22 17:24:00+00:00
http://arxiv.org/abs/2104.11142v1,Deep learning for detecting bid rigging: Flagging cartel participants based on convolutional neural networks,"Adding to the literature on the data-driven detection of bid-rigging cartels,
we propose a novel approach based on deep learning (a subfield of artificial
intelligence) that flags cartel participants based on their pairwise bidding
interactions with other firms. More concisely, we combine a so-called
convolutional neural network for image recognition with graphs that in a
pairwise manner plot the normalized bid values of some reference firm against
the normalized bids of any other firms participating in the same tenders as the
reference firm. Based on Japanese and Swiss procurement data, we construct such
graphs for both collusive and competitive episodes (i.e when a bid-rigging
cartel is or is not active) and use a subset of graphs to train the neural
network such that it learns distinguishing collusive from competitive bidding
patterns. We use the remaining graphs to test the neural network's
out-of-sample performance in correctly classifying collusive and competitive
bidding interactions. We obtain a very decent average accuracy of around 90% or
slightly higher when either applying the method within Japanese, Swiss, or
mixed data (in which Swiss and Japanese graphs are pooled). When using data
from one country for training to test the trained model's performance in the
other country (i.e. transnationally), predictive performance decreases (likely
due to institutional differences in procurement procedures across countries),
but often remains satisfactorily high. All in all, the generally quite high
accuracy of the convolutional neural network despite being trained in a rather
small sample of a few 100 graphs points to a large potential of deep learning
approaches for flagging and fighting bid-rigging cartels.","['Martin Huber', 'David Imhof']","['stat.ML', 'cs.LG']",2021-04-22 15:48:12+00:00
http://arxiv.org/abs/2104.11092v1,Survey on Modeling Intensity Function of Hawkes Process Using Neural Models,"The event sequence of many diverse systems is represented as a sequence of
discrete events in a continuous space. Examples of such an event sequence are
earthquake aftershock events, financial transactions, e-commerce transactions,
social network activity of a user, and the user's web search pattern. Finding
such an intricate pattern helps discover which event will occur in the future
and when it will occur. A Hawkes process is a mathematical tool used for
modeling such time series discrete events. Traditionally, the Hawkes process
uses a critical component for modeling data as an intensity function with a
parameterized kernel function. The Hawkes process's intensity function involves
two components: the background intensity and the effect of events' history.
However, such parameterized assumption can not capture future event
characteristics using past events data precisely due to bias in modeling kernel
function. This paper explores the recent advancement using novel deep
learning-based methods to model kernel function to remove such parametrized
kernel function. In the end, we will give potential future research directions
to improve modeling using the Hawkes process.",['Jayesh Malaviya'],"['cs.LG', 'stat.ML']",2021-04-22 14:23:38+00:00
http://arxiv.org/abs/2104.12587v2,Bayesian Numerical Methods for Nonlinear Partial Differential Equations,"The numerical solution of differential equations can be formulated as an
inference problem to which formal statistical approaches can be applied.
However, nonlinear partial differential equations (PDEs) pose substantial
challenges from an inferential perspective, most notably the absence of
explicit conditioning formula. This paper extends earlier work on linear PDEs
to a general class of initial value problems specified by nonlinear PDEs,
motivated by problems for which evaluations of the right-hand-side, initial
conditions, or boundary conditions of the PDE have a high computational cost.
The proposed method can be viewed as exact Bayesian inference under an
approximate likelihood, which is based on discretisation of the nonlinear
differential operator. Proof-of-concept experimental results demonstrate that
meaningful probabilistic uncertainty quantification for the unknown solution of
the PDE can be performed, while controlling the number of times the
right-hand-side, initial and boundary conditions are evaluated. A suitable
prior model for the solution of the PDE is identified using novel theoretical
analysis of the sample path properties of Mat\'{e}rn processes, which may be of
independent interest.","['Junyang Wang', 'Jon Cockayne', 'Oksana Chkrebtii', 'T. J. Sullivan', 'Chris. J. Oates']","['math.NA', 'cs.NA', 'stat.CO', 'stat.ME', 'stat.ML']",2021-04-22 14:02:10+00:00
http://arxiv.org/abs/2104.11061v2,Chasing Collective Variables using Autoencoders and biased trajectories,"Free energy biasing methods have proven to be powerful tools to accelerate
the simulation of important conformational changes of molecules by modifying
the sampling measure. However, most of these methods rely on the prior
knowledge of low-dimensional slow degrees of freedom, i.e. Collective Variables
(CV). Alternatively, such CVs can be identified using machine learning (ML) and
dimensionality reduction algorithms. In this context, approaches where the CVs
are learned in an iterative way using adaptive biasing have been proposed: at
each iteration, the learned CV is used to perform free energy adaptive biasing
to generate new data and learn a new CV. In this paper, we introduce a new
iterative method involving CV learning with autoencoders: Free Energy Biasing
and Iterative Learning with AutoEncoders (FEBILAE). Our method includes a
reweighting scheme to ensure that the learning model optimizes the same loss at
each iteration, and achieves CV convergence. Using the alanine dipeptide system
and the solvated chignolin mini-protein system as examples, we present results
of our algorithm using the extended adaptive biasing force as the free energy
adaptive biasing method.","['Zineb Belkacemi', 'Paraskevi Gkeka', 'Tony Lelièvre', 'Gabriel Stoltz']","['physics.bio-ph', 'cs.LG', 'physics.comp-ph', 'stat.ML']",2021-04-22 13:44:21+00:00
http://arxiv.org/abs/2104.11044v2,Analyzing Monotonic Linear Interpolation in Neural Network Loss Landscapes,"Linear interpolation between initial neural network parameters and converged
parameters after training with stochastic gradient descent (SGD) typically
leads to a monotonic decrease in the training objective. This Monotonic Linear
Interpolation (MLI) property, first observed by Goodfellow et al. (2014)
persists in spite of the non-convex objectives and highly non-linear training
dynamics of neural networks. Extending this work, we evaluate several
hypotheses for this property that, to our knowledge, have not yet been
explored. Using tools from differential geometry, we draw connections between
the interpolated paths in function space and the monotonicity of the network -
providing sufficient conditions for the MLI property under mean squared error.
While the MLI property holds under various settings (e.g. network architectures
and learning problems), we show in practice that networks violating the MLI
property can be produced systematically, by encouraging the weights to move far
from initialization. The MLI property raises important questions about the loss
landscape geometry of neural networks and highlights the need to further study
their global properties.","['James Lucas', 'Juhan Bae', 'Michael R. Zhang', 'Stanislav Fort', 'Richard Zemel', 'Roger Grosse']","['cs.LG', 'cs.AI', 'stat.ML']",2021-04-22 13:22:12+00:00
