id,title,abstract,authors,categories,date
http://arxiv.org/abs/1811.04350v1,Towards Governing Agent's Efficacy: Action-Conditional $β$-VAE for Deep Transparent Reinforcement Learning,"We tackle the blackbox issue of deep neural networks in the settings of
reinforcement learning (RL) where neural agents learn towards maximizing reward
gains in an uncontrollable way. Such learning approach is risky when the
interacting environment includes an expanse of state space because it is then
almost impossible to foresee all unwanted outcomes and penalize them with
negative rewards beforehand. Unlike reverse analysis of learned neural features
from previous works, our proposed method \nj{tackles the blackbox issue by
encouraging} an RL policy network to learn interpretable latent features
through an implementation of a disentangled representation learning method.
Toward this end, our method allows an RL agent to understand self-efficacy by
distinguishing its influences from uncontrollable environmental factors, which
closely resembles the way humans understand their scenes. Our experimental
results show that the learned latent factors not only are interpretable, but
also enable modeling the distribution of entire visited state space with a
specific action condition. We have experimented that this characteristic of the
proposed structure can lead to ex post facto governance for desired behaviors
of RL agents.","['John Yang', 'Gyujeong Lee', 'Minsung Hyun', 'Simyung Chang', 'Nojun Kwak']","['cs.LG', 'cs.AI', 'stat.ML']",2018-11-11 04:48:15+00:00
http://arxiv.org/abs/1811.04345v1,Optimizing Taxi Carpool Policies via Reinforcement Learning and Spatio-Temporal Mining,"In this paper, we develop a reinforcement learning (RL) based system to learn
an effective policy for carpooling that maximizes transportation efficiency so
that fewer cars are required to fulfill the given amount of trip demand. For
this purpose, first, we develop a deep neural network model, called ST-NN
(Spatio-Temporal Neural Network), to predict taxi trip time from the raw GPS
trip data. Secondly, we develop a carpooling simulation environment for RL
training, with the output of ST-NN and using the NYC taxi trip dataset. In
order to maximize transportation efficiency and minimize traffic congestion, we
choose the effective distance covered by the driver on a carpool trip as the
reward. Therefore, the more effective distance a driver achieves over a trip
(i.e. to satisfy more trip demand) the higher the efficiency and the less will
be the traffic congestion. We compared the performance of RL learned policy to
a fixed policy (which always accepts carpool) as a baseline and obtained
promising results that are interpretable and demonstrate the advantage of our
RL approach. We also compare the performance of ST-NN to that of
state-of-the-art travel time estimation methods and observe that ST-NN
significantly improves the prediction performance and is more robust to
outliers.","['Ishan Jindal', 'Zhiwei Qin', 'Xuewen Chen', 'Matthew Nokleby', 'Jieping Ye']","['cs.LG', 'cs.AI', 'stat.ML']",2018-11-11 04:13:31+00:00
http://arxiv.org/abs/1811.04344v3,Discovering heterogeneous subpopulations for fine-grained analysis of opioid use and opioid use disorders,"The opioid epidemic in the United States claims over 40,000 lives per year,
and it is estimated that well over two million Americans have an opioid use
disorder. Over-prescription and misuse of prescription opioids play an
important role in the epidemic. Individuals who are prescribed opioids, and who
are diagnosed with opioid use disorder, have diverse underlying health states.
Policy interventions targeting prescription opioid use, opioid use disorder,
and overdose often fail to account for this variation. To identify latent
health states, or phenotypes, pertinent to opioid use and opioid use disorders,
we use probabilistic topic modeling with medical diagnosis histories from a
statewide population of individuals who were prescribed opioids. We demonstrate
that our learned phenotypes are predictive of future opioid use-related
outcomes. In addition, we show how the learned phenotypes can provide important
context for variability in opioid prescriptions. Understanding the
heterogeneity in individual health states and in prescription opioid use can
help identify policy interventions to address this public health crisis.","['Jen J. Gong', 'Abigail Z. Jacobs', 'Toby E. Stuart', 'Mathijs de Vaan']","['q-bio.QM', 'cs.LG', 'stat.ML']",2018-11-11 04:00:32+00:00
http://arxiv.org/abs/1811.04343v1,Langevin-gradient parallel tempering for Bayesian neural learning,"Bayesian neural learning feature a rigorous approach to estimation and
uncertainty quantification via the posterior distribution of weights that
represent knowledge of the neural network. This not only provides point
estimates of optimal set of weights but also the ability to quantify
uncertainty in decision making using the posterior distribution. Markov chain
Monte Carlo (MCMC) techniques are typically used to obtain sample-based
estimates of the posterior distribution. However, these techniques face
challenges in convergence and scalability, particularly in settings with large
datasets and network architectures. This paper address these challenges in two
ways. First, parallel tempering is used used to explore multiple modes of the
posterior distribution and implemented in multi-core computing architecture.
Second, we make within-chain sampling schemes more efficient by using Langevin
gradient information in forming Metropolis-Hastings proposal distributions. We
demonstrate the techniques using time series prediction and pattern
classification applications. The results show that the method not only improves
the computational time, but provides better prediction or decision making
capabilities when compared to related methods.","['Rohitash Chandra', 'Konark Jain', 'Ratneel V. Deo', 'Sally Cripps']","['cs.LG', 'cs.AI', 'stat.ML']",2018-11-11 03:53:54+00:00
http://arxiv.org/abs/1811.06366v2,Cluster analysis of homicide rates in the Brazilian state of Goias from 2002 to 2014,"Homicide mortality is a worldwide concern and has occupied the agenda of
researchers and public managers. In Brazil, homicide is the third leading cause
of death in the general population and the first in the 15-39 age group. In
South America, Brazil has the third highest homicide mortality, behind
Venezuela and Colombia. To measure the impacts of violence it is important to
assess health systems and criminal justice, as well as other areas. In this
paper, we analyze the spatial distribution of homicide mortality in the state
of Goias, Center-West of Brazil, since the homicide rate increased from 24.5
per 100,000 in 2002 to 42.6 per 100,000 in 2014 in this location. Moreover,
this state had the fifth position of homicides in Brazil in 2014. We considered
socio-demographic variables for the state, performed analysis about correlation
and employed three clustering algorithms: K-means, Density-based and
Hierarchical. The results indicate the homicide rates are higher in cities
neighbors of large urban centers, although these cities have the best
socioeconomic indicators.","['Samuel Bruno da Silva Sousa', 'Ronaldo de Castro Del-Fiaco', 'Lilian Berton']","['cs.CY', 'cs.LG', 'stat.ML']",2018-11-11 02:10:18+00:00
http://arxiv.org/abs/1811.07770v2,Aff-Wild2: Extending the Aff-Wild Database for Affect Recognition,"Automatic understanding of human affect using visual signals is a problem
that has attracted significant interest over the past 20 years. However, human
emotional states are quite complex. To appraise such states displayed in
real-world settings, we need expressive emotional descriptors that are capable
of capturing and describing this complexity. The circumplex model of affect,
which is described in terms of valence (i.e., how positive or negative is an
emotion) and arousal (i.e., power of the activation of the emotion), can be
used for this purpose. Recent progress in the emotion recognition domain has
been achieved through the development of deep neural architectures and the
availability of very large training databases. To this end, Aff-Wild has been
the first large-scale ""in-the-wild"" database, containing around 1,200,000
frames. In this paper, we build upon this database, extending it with 260 more
subjects and 1,413,000 new video frames. We call the union of Aff-Wild with the
additional data, Aff-Wild2. The videos are downloaded from Youtube and have
large variations in pose, age, illumination conditions, ethnicity and
profession. Both database-specific as well as cross-database experiments are
performed in this paper, by utilizing the Aff-Wild2, along with the RECOLA
database. The developed deep neural architectures are based on the joint
training of state-of-the-art convolutional and recurrent neural networks with
attention mechanism; thus exploiting both the invariant properties of
convolutional features, while modeling temporal dynamics that arise in human
behaviour via the recurrent layers. The obtained results show premise for
utilization of the extended Aff-Wild, as well as of the developed deep neural
architectures for visual analysis of human behaviour in terms of continuous
emotion dimensions.","['Dimitrios Kollias', 'Stefanos Zafeiriou']","['cs.CV', 'cs.AI', 'cs.LG', 'stat.ML']",2018-11-11 01:57:15+00:00
http://arxiv.org/abs/1811.04324v2,Diversity-Driven Extensible Hierarchical Reinforcement Learning,"Hierarchical reinforcement learning (HRL) has recently shown promising
advances on speeding up learning, improving the exploration, and discovering
intertask transferable skills. Most recent works focus on HRL with two levels,
i.e., a master policy manipulates subpolicies, which in turn manipulate
primitive actions. However, HRL with multiple levels is usually needed in many
real-world scenarios, whose ultimate goals are highly abstract, while their
actions are very primitive. Therefore, in this paper, we propose a
diversity-driven extensible HRL (DEHRL), where an extensible and scalable
framework is built and learned levelwise to realize HRL with multiple levels.
DEHRL follows a popular assumption: diverse subpolicies are useful, i.e.,
subpolicies are believed to be more useful if they are more diverse. However,
existing implementations of this diversity assumption usually have their own
drawbacks, which makes them inapplicable to HRL with multiple levels.
Consequently, we further propose a novel diversity-driven solution to achieve
this assumption in DEHRL. Experimental studies evaluate DEHRL with five
baselines from four perspectives in two domains; the results show that DEHRL
outperforms the state-of-the-art baselines in all four aspects.","['Yuhang Song', 'Jianyi Wang', 'Thomas Lukasiewicz', 'Zhenghua Xu', 'Mai Xu']","['cs.LG', 'stat.ML']",2018-11-10 23:35:34+00:00
http://arxiv.org/abs/1811.07768v1,Handwriting Recognition of Historical Documents with few labeled data,"Historical documents present many challenges for offline handwriting
recognition systems, among them, the segmentation and labeling steps. Carefully
annotated textlines are needed to train an HTR system. In some scenarios,
transcripts are only available at the paragraph level with no text-line
information. In this work, we demonstrate how to train an HTR system with few
labeled data. Specifically, we train a deep convolutional recurrent neural
network (CRNN) system on only 10% of manually labeled text-line data from a
dataset and propose an incremental training procedure that covers the rest of
the data. Performance is further increased by augmenting the training set with
specially crafted multiscale data. We also propose a model-based normalization
scheme which considers the variability in the writing scale at the recognition
phase. We apply this approach to the publicly available READ dataset. Our
system achieved the second best result during the ICDAR2017 competition.","['Edgard Chammas', 'Chafic Mokbel', 'Laurence Likforman-Sulem']","['cs.CV', 'cs.LG', 'stat.ML']",2018-11-10 23:21:12+00:00
http://arxiv.org/abs/1811.04319v3,Playing by the Book: An Interactive Game Approach for Action Graph Extraction from Text,"Understanding procedural text requires tracking entities, actions and effects
as the narrative unfolds. We focus on the challenging real-world problem of
action-graph extraction from material science papers, where language is highly
specialized and data annotation is expensive and scarce. We propose a novel
approach, Text2Quest, where procedural text is interpreted as instructions for
an interactive game. A learning agent completes the game by executing the
procedure correctly in a text-based simulated lab environment. The framework
can complement existing approaches and enables richer forms of learning
compared to static texts. We discuss potential limitations and advantages of
the approach, and release a prototype proof-of-concept, hoping to encourage
research in this direction.","['Ronen Tamari', 'Hiroyuki Shindo', 'Dafna Shahaf', 'Yuji Matsumoto']","['cs.LG', 'cs.CL', 'stat.ML']",2018-11-10 21:45:07+00:00
http://arxiv.org/abs/1811.04277v1,Anomaly Detection via Graphical Lasso,"Anomalies and outliers are common in real-world data, and they can arise from
many sources, such as sensor faults. Accordingly, anomaly detection is
important both for analyzing the anomalies themselves and for cleaning the data
for further analysis of its ambient structure. Nonetheless, a precise
definition of anomalies is important for automated detection and herein we
approach such problems from the perspective of detecting sparse latent effects
embedded in large collections of noisy data. Standard Graphical Lasso-based
techniques can identify the conditional dependency structure of a collection of
random variables based on their sample covariance matrix. However, classic
Graphical Lasso is sensitive to outliers in the sample covariance matrix. In
particular, several outliers in a sample covariance matrix can destroy the
sparsity of its inverse. Accordingly, we propose a novel optimization problem
that is similar in spirit to Robust Principal Component Analysis (RPCA) and
splits the sample covariance matrix $M$ into two parts, $M=F+S$, where $F$ is
the cleaned sample covariance whose inverse is sparse and computable by
Graphical Lasso, and $S$ contains the outliers in $M$. We accomplish this
decomposition by adding an additional $ \ell_1$ penalty to classic Graphical
Lasso, and name it ""Robust Graphical Lasso (Rglasso)"". Moreover, we propose an
Alternating Direction Method of Multipliers (ADMM) solution to the optimization
problem which scales to large numbers of unknowns. We evaluate our algorithm on
both real and synthetic datasets, obtaining interpretable results and
outperforming the standard robust Minimum Covariance Determinant (MCD) method
and Robust Principal Component Analysis (RPCA) regarding both accuracy and
speed.","['Haitao Liu', 'Randy C. Paffenroth', 'Jian Zou', 'Chong Zhou']","['stat.ML', 'cs.LG']",2018-11-10 16:15:04+00:00
http://arxiv.org/abs/1811.04251v4,Formal Limitations on the Measurement of Mutual Information,"Measuring mutual information from finite data is difficult. Recent work has
considered variational methods maximizing a lower bound. In this paper, we
prove that serious statistical limitations are inherent to any method of
measuring mutual information. More specifically, we show that any
distribution-free high-confidence lower bound on mutual information estimated
from N samples cannot be larger than O(ln N ).","['David McAllester', 'Karl Stratos']","['cs.IT', 'cs.LG', 'math.IT', 'stat.ML']",2018-11-10 13:12:27+00:00
http://arxiv.org/abs/1811.04234v1,Towards Formula Translation using Recursive Neural Networks,"While it has become common to perform automated translations on natural
language, performing translations between different representations of
mathematical formulae has thus far not been possible. We implemented the first
translator for mathematical formulae based on recursive neural networks. We
chose recursive neural networks because mathematical formulae inherently
include a structural encoding. In our implementation, we developed new
techniques and topologies for recursive tree-to-tree neural networks based on
multi-variate multi-valued Long Short-Term Memory cells. We propose a novel
approach for mini-batch training that utilizes clustering and tree traversal.
We evaluate our translator and analyze the behavior of our proposed topologies
and techniques based on a translation from generic LaTeX to the semantic LaTeX
notation. We use the semantic LaTeX notation from the Digital Library for
Mathematical Formulae and the Digital Repository for Mathematical Formulae at
the National Institute for Standards and Technology. We find that a simple
heuristics-based clustering algorithm outperforms the conventional clustering
algorithms on the task of clustering binary trees of mathematical formulae with
respect to their topology. Furthermore, we find a mask for the loss function,
which can prevent the neural network from finding a local minimum of the loss
function. Given our preliminary results, a complete translation from formula to
formula is not yet possible. However, we achieved a prediction accuracy of
47.05% for predicting symbols at the correct position and an accuracy of 92.3%
when ignoring the predicted position. Concluding, our work advances the field
of recursive neural networks by improving the training speed and quality of
training. In the future, we will work towards a complete translation allowing a
machine-interpretation of LaTeX formulae.","['Felix Petersen', 'Moritz Schubotz', 'Bela Gipp']","['cs.LG', 'cs.AI', 'stat.ML']",2018-11-10 11:20:18+00:00
http://arxiv.org/abs/1811.07769v1,Addressing the Invisible: Street Address Generation for Developing Countries with Deep Learning,"More than half of the world's roads lack adequate street addressing systems.
Lack of addresses is even more visible in daily lives of people in developing
countries. We would like to object to the assumption that having an address is
a luxury, by proposing a generative address design that maps the world in
accordance with streets. The addressing scheme is designed considering several
traditional street addressing methodologies employed in the urban development
scenarios around the world. Our algorithm applies deep learning to extract
roads from satellite images, converts the road pixel confidences into a road
network, partitions the road network to find neighborhoods, and labels the
regions, roads, and address units using graph- and proximity-based algorithms.
We present our results on a sample US city, and several developing cities,
compare travel times of users using current ad hoc and new complete addresses,
and contrast our addressing solution to current industrial and open geocoding
alternatives.","['Ilke Demir', 'Ramesh Raskar']","['cs.CV', 'cs.CY', 'cs.LG', 'stat.ML']",2018-11-10 07:34:04+00:00
http://arxiv.org/abs/1811.04151v1,Design Rule Violation Hotspot Prediction Based on Neural Network Ensembles,"Design rule check is a critical step in the physical design of integrated
circuits to ensure manufacturability. However, it can be done only after a
time-consuming detailed routing procedure, which adds drastically to the time
of design iterations. With advanced technology nodes, the outcomes of global
routing and detailed routing become less correlated, which adds to the
difficulty of predicting design rule violations from earlier stages. In this
paper, a framework based on neural network ensembles is proposed to predict
design rule violation hotspots using information from placement and global
routing. A soft voting structure and a PCA-based subset selection scheme are
developed on top of a baseline neural network from a recent work. Experimental
results show that the proposed architecture achieves significant improvement in
model performance compared to the baseline case. For half of test cases, the
performance is even better than random forest, a commonly-used ensemble
learning model.","['Wei Zeng', 'Azadeh Davoodi', 'Yu Hen Hu']","['cs.LG', 'stat.ML']",2018-11-09 22:18:26+00:00
http://arxiv.org/abs/1811.04142v2,Complex Unitary Recurrent Neural Networks using Scaled Cayley Transform,"Recurrent neural networks (RNNs) have been successfully used on a wide range
of sequential data problems. A well known difficulty in using RNNs is the
\textit{vanishing or exploding gradient} problem. Recently, there have been
several different RNN architectures that try to mitigate this issue by
maintaining an orthogonal or unitary recurrent weight matrix. One such
architecture is the scaled Cayley orthogonal recurrent neural network (scoRNN)
which parameterizes the orthogonal recurrent weight matrix through a scaled
Cayley transform. This parametrization contains a diagonal scaling matrix
consisting of positive or negative one entries that can not be optimized by
gradient descent. Thus the scaling matrix is fixed before training and a
hyperparameter is introduced to tune the matrix for each particular task. In
this paper, we develop a unitary RNN architecture based on a complex scaled
Cayley transform. Unlike the real orthogonal case, the transformation uses a
diagonal scaling matrix consisting of entries on the complex unit circle which
can be optimized using gradient descent and no longer requires the tuning of a
hyperparameter. We also provide an analysis of a potential issue of the modReLU
activiation function which is used in our work and several other unitary RNNs.
In the experiments conducted, the scaled Cayley unitary recurrent neural
network (scuRNN) achieves comparable or better results than scoRNN and other
unitary RNNs without fixing the scaling matrix.","['Kehelwala D. G. Maduranga', 'Kyle E. Helfrich', 'Qiang Ye']","['stat.ML', 'cs.LG']",2018-11-09 21:37:36+00:00
http://arxiv.org/abs/1811.04136v3,The GaussianSketch for Almost Relative Error Kernel Distance,"We introduce two versions of a new sketch for approximately embedding the
Gaussian kernel into Euclidean inner product space. These work by truncating
infinite expansions of the Gaussian kernel, and carefully invoking the
RecursiveTensorSketch [Ahle et al. SODA 2020]. After providing concentration
and approximation properties of these sketches, we use them to approximate the
kernel distance between points sets. These sketches yield almost
$(1+\varepsilon)$-relative error, but with a small additive $\alpha$ term. In
the first variants the dependence on $1/\alpha$ is poly-logarithmic, but has
higher degree of polynomial dependence on the original dimension $d$. In the
second variant, the dependence on $1/\alpha$ is still poly-logarithmic, but the
dependence on $d$ is linear.","['Jeff M. Phillips', 'Wai Ming Tai']","['cs.LG', 'cs.CG', 'stat.ML']",2018-11-09 21:12:32+00:00
http://arxiv.org/abs/1811.04133v1,Integrating Recurrence Dynamics for Speech Emotion Recognition,"We investigate the performance of features that can capture nonlinear
recurrence dynamics embedded in the speech signal for the task of Speech
Emotion Recognition (SER). Reconstruction of the phase space of each speech
frame and the computation of its respective Recurrence Plot (RP) reveals
complex structures which can be measured by performing Recurrence
Quantification Analysis (RQA). These measures are aggregated by using
statistical functionals over segment and utterance periods. We report SER
results for the proposed feature set on three databases using different
classification methods. When fusing the proposed features with traditional
feature sets, we show an improvement in unweighted accuracy of up to 5.7% and
10.7% on Speaker-Dependent (SD) and Speaker-Independent (SI) SER tasks,
respectively, over the baseline. Following a segment-based approach we
demonstrate state-of-the-art performance on IEMOCAP using a Bidirectional
Recurrent Neural Network.","['Efthymios Tzinis', 'Georgios Paraskevopoulos', 'Christos Baziotis', 'Alexandros Potamianos']","['cs.SD', 'cs.LG', 'eess.AS', 'stat.ML']",2018-11-09 21:02:52+00:00
http://arxiv.org/abs/1811.04132v1,Reasoning over RDF Knowledge Bases using Deep Learning,"Semantic Web knowledge representation standards, and in particular RDF and
OWL, often come endowed with a formal semantics which is considered to be of
fundamental importance for the field. Reasoning, i.e., the drawing of logical
inferences from knowledge expressed in such standards, is traditionally based
on logical deductive methods and algorithms which can be proven to be sound and
complete and terminating, i.e. correct in a very strong sense. For various
reasons, though, in particular, the scalability issues arising from the
ever-increasing amounts of Semantic Web data available and the inability of
deductive algorithms to deal with noise in the data, it has been argued that
alternative means of reasoning should be investigated which bear high promise
for high scalability and better robustness. From this perspective, deductive
algorithms can be considered the gold standard regarding correctness against
which alternative methods need to be tested. In this paper, we show that it is
possible to train a Deep Learning system on RDF knowledge graphs, such that it
is able to perform reasoning over new RDF knowledge graphs, with high precision
and recall compared to the deductive gold standard.","['Monireh Ebrahimi', 'Md Kamruzzaman Sarker', 'Federico Bianchi', 'Ning Xie', 'Derek Doran', 'Pascal Hitzler']","['cs.LG', 'cs.AI', 'stat.ML']",2018-11-09 21:00:46+00:00
