id,title,abstract,authors,categories,date
http://arxiv.org/abs/2211.10381v5,Environmental Sensor Placement with Convolutional Gaussian Neural Processes,"Environmental sensors are crucial for monitoring weather conditions and the
impacts of climate change. However, it is challenging to place sensors in a way
that maximises the informativeness of their measurements, particularly in
remote regions like Antarctica. Probabilistic machine learning models can
suggest informative sensor placements by finding sites that maximally reduce
prediction uncertainty. Gaussian process (GP) models are widely used for this
purpose, but they struggle with capturing complex non-stationary behaviour and
scaling to large datasets. This paper proposes using a convolutional Gaussian
neural process (ConvGNP) to address these issues. A ConvGNP uses neural
networks to parameterise a joint Gaussian distribution at arbitrary target
locations, enabling flexibility and scalability. Using simulated surface air
temperature anomaly over Antarctica as training data, the ConvGNP learns
spatial and seasonal non-stationarities, outperforming a non-stationary GP
baseline. In a simulated sensor placement experiment, the ConvGNP better
predicts the performance boost obtained from new observations than GP
baselines, leading to more informative sensor placements. We contrast our
approach with physics-based sensor placement methods and propose future steps
towards an operational sensor placement recommendation system. Our work could
help to realise environmental digital twins that actively direct measurement
sampling to improve the digital representation of reality.","['Tom R. Andersson', 'Wessel P. Bruinsma', 'Stratis Markou', 'James Requeima', 'Alejandro Coca-Castro', 'Anna Vaughan', 'Anna-Louise Ellis', 'Matthew A. Lazzara', 'Dani Jones', 'J. Scott Hosking', 'Richard E. Turner']","['stat.ML', 'cs.LG']",2022-11-18 17:25:14+00:00
http://arxiv.org/abs/2211.10378v1,Comparing Explanation Methods for Traditional Machine Learning Models Part 2: Quantifying Model Explainability Faithfulness and Improvements with Dimensionality Reduction,"Machine learning (ML) models are becoming increasingly common in the
atmospheric science community with a wide range of applications. To enable
users to understand what an ML model has learned, ML explainability has become
a field of active research. In Part I of this two-part study, we described
several explainability methods and demonstrated that feature rankings from
different methods can substantially disagree with each other. It is unclear,
though, whether the disagreement is overinflated due to some methods being less
faithful in assigning importance. Herein, ""faithfulness"" or ""fidelity"" refer to
the correspondence between the assigned feature importance and the contribution
of the feature to model performance. In the present study, we evaluate the
faithfulness of feature ranking methods using multiple methods. Given the
sensitivity of explanation methods to feature correlations, we also quantify
how much explainability faithfulness improves after correlated features are
limited. Before dimensionality reduction, the feature relevance methods [e.g.,
SHAP, LIME, ALE variance, and logistic regression (LR) coefficients] were
generally more faithful than the permutation importance methods due to the
negative impact of correlated features. Once correlated features were reduced,
traditional permutation importance became the most faithful method. In
addition, the ranking uncertainty (i.e., the spread in rank assigned to a
feature by the different ranking methods) was reduced by a factor of 2-10, and
excluding less faithful feature ranking methods reduces it further. This study
is one of the first to quantify the improvement in explainability from limiting
correlated features and knowing the relative fidelity of different
explainability methods.","['Montgomery Flora', 'Corey Potvin', 'Amy McGovern', 'Shawn Handler']","['cs.LG', 'cs.AI', 'physics.ao-ph', 'stat.ML']",2022-11-18 17:15:59+00:00
http://arxiv.org/abs/2211.10363v1,Always Valid Risk Monitoring for Online Matrix Completion,"Always-valid concentration inequalities are increasingly used as performance
measures for online statistical learning, notably in the learning of generative
models and supervised learning. Such inequality advances the online learning
algorithms design by allowing random, adaptively chosen sample sizes instead of
a fixed pre-specified size in offline statistical learning. However,
establishing such an always-valid type result for the task of matrix completion
is challenging and far from understood in the literature. Due to the importance
of such type of result, this work establishes and devises the always-valid risk
bound process for online matrix completion problems. Such theoretical advances
are made possible by a novel combination of non-asymptotic martingale
concentration and regularized low-rank matrix regression. Our result enables a
more sample-efficient online algorithm design and serves as a foundation to
evaluate online experiment policies on the task of online matrix completion.","['Chi-Hua Wang', 'Wenjie Li']","['stat.ML', 'cs.AI', 'cs.LG', 'math.ST', 'stat.TH']",2022-11-18 17:00:47+00:00
http://arxiv.org/abs/2211.10332v1,A Unified Approach to Differentially Private Bayes Point Estimation,"Parameter estimation in statistics and system identification relies on data
that may contain sensitive information. To protect this sensitive information,
the notion of \emph{differential privacy} (DP) has been proposed, which
enforces confidentiality by introducing randomization in the estimates.
Standard algorithms for differentially private estimation are based on adding
an appropriate amount of noise to the output of a traditional point estimation
method. This leads to an accuracy-privacy trade off, as adding more noise
reduces the accuracy while increasing privacy. In this paper, we propose a new
Unified Bayes Private Point (UBaPP) approach to Bayes point estimation of the
unknown parameters of a data generating mechanism under a DP constraint, that
achieves a better accuracy-privacy trade off than traditional approaches. We
verify the performance of our approach on a simple numerical example.","['Braghadeesh Lakshminarayanan', 'Cristian R. Rojas']","['math.OC', 'stat.ML']",2022-11-18 16:42:49+00:00
http://arxiv.org/abs/2211.10257v2,Model-based Causal Bayesian Optimization,"How should we intervene on an unknown structural equation model to maximize a
downstream variable of interest? This setting, also known as causal Bayesian
optimization (CBO), has important applications in medicine, ecology, and
manufacturing. Standard Bayesian optimization algorithms fail to effectively
leverage the underlying causal structure. Existing CBO approaches assume
noiseless measurements and do not come with guarantees. We propose the
model-based causal Bayesian optimization algorithm (MCBO) that learns a full
system model instead of only modeling intervention-reward pairs. MCBO
propagates epistemic uncertainty about the causal mechanisms through the graph
and trades off exploration and exploitation via the optimism principle. We
bound its cumulative regret, and obtain the first non-asymptotic bounds for
CBO. Unlike in standard Bayesian optimization, our acquisition function cannot
be evaluated in closed form, so we show how the reparameterization trick can be
used to apply gradient-based optimizers. The resulting practical implementation
of MCBO compares favorably with state-of-the-art approaches empirically.","['Scott Sussex', 'Anastasiia Makarova', 'Andreas Krause']","['cs.LG', 'stat.ML']",2022-11-18 14:28:21+00:00
http://arxiv.org/abs/2211.10174v1,Deep Gaussian Processes for Air Quality Inference,"Air pollution kills around 7 million people annually, and approximately 2.4
billion people are exposed to hazardous air pollution. Accurate, fine-grained
air quality (AQ) monitoring is essential to control and reduce pollution.
However, AQ station deployment is sparse, and thus air quality inference for
unmonitored locations is crucial. Conventional interpolation methods fail to
learn the complex AQ phenomena. This work demonstrates that Deep Gaussian
Process models (DGPs) are a promising model for the task of AQ inference. We
implement Doubly Stochastic Variational Inference, a DGP algorithm, and show
that it performs comparably to the state-of-the-art models.","['Aadesh Desai', 'Eshan Gujarathi', 'Saagar Parikh', 'Sachin Yadav', 'Zeel Patel', 'Nipun Batra']","['cs.LG', 'stat.ML']",2022-11-18 11:42:42+00:00
http://arxiv.org/abs/2211.10124v1,Global quantitative robustness of regression feed-forward neural networks,"Neural networks are an indispensable model class for many complex learning
tasks. Despite the popularity and importance of neural networks and many
different established techniques from literature for stabilization and
robustification of the training, the classical concepts from robust statistics
have rarely been considered so far in the context of neural networks.
Therefore, we adapt the notion of the regression breakdown point to regression
neural networks and compute the breakdown point for different feed-forward
network configurations and contamination settings. In an extensive simulation
study, we compare the performance, measured by the out-of-sample loss, by a
proxy of the breakdown rate and by the training steps, of non-robust and robust
regression feed-forward neural networks in a plethora of different
configurations. The results indeed motivate to use robust loss functions for
neural network training.",['Tino Werner'],"['stat.ML', 'cs.LG']",2022-11-18 09:57:53+00:00
http://arxiv.org/abs/2211.10066v2,Hyperbolic Sliced-Wasserstein via Geodesic and Horospherical Projections,"It has been shown beneficial for many types of data which present an
underlying hierarchical structure to be embedded in hyperbolic spaces.
Consequently, many tools of machine learning were extended to such spaces, but
only few discrepancies to compare probability distributions defined over those
spaces exist. Among the possible candidates, optimal transport distances are
well defined on such Riemannian manifolds and enjoy strong theoretical
properties, but suffer from high computational cost. On Euclidean spaces,
sliced-Wasserstein distances, which leverage a closed-form of the Wasserstein
distance in one dimension, are more computationally efficient, but are not
readily available on hyperbolic spaces. In this work, we propose to derive
novel hyperbolic sliced-Wasserstein discrepancies. These constructions use
projections on the underlying geodesics either along horospheres or geodesics.
We study and compare them on different tasks where hyperbolic representations
are relevant, such as sampling or image classification.","['Clément Bonet', 'Laetitia Chapel', 'Lucas Drumetz', 'Nicolas Courty']","['cs.LG', 'stat.ME', 'stat.ML']",2022-11-18 07:44:27+00:00
http://arxiv.org/abs/2211.10061v1,Data-Adaptive Discriminative Feature Localization with Statistically Guaranteed Interpretation,"In explainable artificial intelligence, discriminative feature localization
is critical to reveal a blackbox model's decision-making process from raw data
to prediction. In this article, we use two real datasets, the MNIST handwritten
digits and MIT-BIH Electrocardiogram (ECG) signals, to motivate key
characteristics of discriminative features, namely adaptiveness, predictive
importance and effectiveness. Then, we develop a localization framework based
on adversarial attacks to effectively localize discriminative features. In
contrast to existing heuristic methods, we also provide a statistically
guaranteed interpretability of the localized features by measuring a
generalized partial $R^2$. We apply the proposed method to the MNIST dataset
and the MIT-BIH dataset with a convolutional auto-encoder. In the first, the
compact image regions localized by the proposed method are visually appealing.
Similarly, in the second, the identified ECG features are biologically
plausible and consistent with cardiac electrophysiological principles while
locating subtle anomalies in a QRS complex that may not be discernible by the
naked eye. Overall, the proposed method compares favorably with
state-of-the-art competitors. Accompanying this paper is a Python library
dnn-locate (https://dnn-locate.readthedocs.io/en/latest/) that implements the
proposed approach.","['Ben Dai', 'Xiaotong Shen', 'Lin Yee Chen', 'Chunlin Li', 'Wei Pan']","['stat.ML', 'cs.AI', 'cs.LG', 'stat.AP', 'stat.ME']",2022-11-18 07:20:00+00:00
http://arxiv.org/abs/2211.10015v1,Asymptotics for The $k$-means,"The $k$-means is one of the most important unsupervised learning techniques
in statistics and computer science. The goal is to partition a data set into
many clusters, such that observations within clusters are the most homogeneous
and observations between clusters are the most heterogeneous. Although it is
well known, the investigation of the asymptotic properties is far behind,
leading to difficulties in developing more precise $k$-means methods in
practice. To address this issue, a new concept called clustering consistency is
proposed. Fundamentally, the proposed clustering consistency is more
appropriate than the previous criterion consistency for the clustering methods.
Using this concept, a new $k$-means method is proposed. It is found that the
proposed $k$-means method has lower clustering error rates and is more robust
to small clusters and outliers than existing $k$-means methods. When $k$ is
unknown, using the Gap statistics, the proposed method can also identify the
number of clusters. This is rarely achieved by existing $k$-means methods
adopted by many software packages.",['Tonglin Zhang'],"['stat.ML', 'cs.LG', '62H30, 62J12']",2022-11-18 03:36:58+00:00
http://arxiv.org/abs/2211.10013v1,Active Learning by Query by Committee with Robust Divergences,"Active learning is a widely used methodology for various problems with high
measurement costs. In active learning, the next object to be measured is
selected by an acquisition function, and measurements are performed
sequentially. The query by committee is a well-known acquisition function. In
conventional methods, committee disagreement is quantified by the
Kullback--Leibler divergence. In this paper, the measure of disagreement is
defined by the Bregman divergence, which includes the Kullback--Leibler
divergence as an instance, and the dual $\gamma$-power divergence. As a
particular class of the Bregman divergence, the $\beta$-divergence is
considered. By deriving the influence function, we show that the proposed
method using $\beta$-divergence and dual $\gamma$-power divergence are more
robust than the conventional method in which the measure of disagreement is
defined by the Kullback--Leibler divergence. Experimental results show that the
proposed method performs as well as or better than the conventional method.","['Hideitsu Hino', 'Shinto Eguchi']","['stat.ML', 'cs.LG']",2022-11-18 03:35:18+00:00
http://arxiv.org/abs/2211.09981v3,Weighted Ensemble Self-Supervised Learning,"Ensembling has proven to be a powerful technique for boosting model
performance, uncertainty estimation, and robustness in supervised learning.
Advances in self-supervised learning (SSL) enable leveraging large unlabeled
corpora for state-of-the-art few-shot and supervised learning performance. In
this paper, we explore how ensemble methods can improve recent SSL techniques
by developing a framework that permits data-dependent weighted cross-entropy
losses. We refrain from ensembling the representation backbone; this choice
yields an efficient ensemble method that incurs a small training cost and
requires no architectural changes or computational overhead to downstream
evaluation. The effectiveness of our method is demonstrated with two
state-of-the-art SSL methods, DINO (Caron et al., 2021) and MSN (Assran et al.,
2022). Our method outperforms both in multiple evaluation metrics on
ImageNet-1K, particularly in the few-shot setting. We explore several weighting
schemes and find that those which increase the diversity of ensemble heads lead
to better downstream evaluation results. Thorough experiments yield improved
prior art baselines which our method still surpasses; e.g., our overall
improvement with MSN ViT-B/16 is 3.9 p.p. for 1-shot learning.","['Yangjun Ruan', 'Saurabh Singh', 'Warren Morningstar', 'Alexander A. Alemi', 'Sergey Ioffe', 'Ian Fischer', 'Joshua V. Dillon']","['cs.LG', 'cs.AI', 'stat.ML']",2022-11-18 02:00:17+00:00
http://arxiv.org/abs/2211.09961v1,Path Independent Equilibrium Models Can Better Exploit Test-Time Computation,"Designing networks capable of attaining better performance with an increased
inference budget is important to facilitate generalization to harder problem
instances. Recent efforts have shown promising results in this direction by
making use of depth-wise recurrent networks. We show that a broad class of
architectures named equilibrium models display strong upwards generalization,
and find that stronger performance on harder examples (which require more
iterations of inference to get correct) strongly correlates with the path
independence of the system -- its tendency to converge to the same steady-state
behaviour regardless of initialization, given enough computation. Experimental
interventions made to promote path independence result in improved
generalization on harder problem instances, while those that penalize it
degrade this ability. Path independence analyses are also useful on a
per-example basis: for equilibrium models that have good in-distribution
performance, path independence on out-of-distribution samples strongly
correlates with accuracy. Our results help explain why equilibrium models are
capable of strong upwards generalization and motivates future work that
harnesses path independence as a general modelling principle to facilitate
scalable test-time usage.","['Cem Anil', 'Ashwini Pokle', 'Kaiqu Liang', 'Johannes Treutlein', 'Yuhuai Wu', 'Shaojie Bai', 'Zico Kolter', 'Roger Grosse']","['cs.LG', 'stat.ML']",2022-11-18 00:42:53+00:00
http://arxiv.org/abs/2211.09781v2,Monitoring machine learning (ML)-based risk prediction algorithms in the presence of confounding medical interventions,"Performance monitoring of machine learning (ML)-based risk prediction models
in healthcare is complicated by the issue of confounding medical interventions
(CMI): when an algorithm predicts a patient to be at high risk for an adverse
event, clinicians are more likely to administer prophylactic treatment and
alter the very target that the algorithm aims to predict. A simple approach is
to ignore CMI and monitor only the untreated patients, whose outcomes remain
unaltered. In general, ignoring CMI may inflate Type I error because (i)
untreated patients disproportionally represent those with low predicted risk
and (ii) evolution in both the model and clinician trust in the model can
induce complex dependencies that violate standard assumptions. Nevertheless, we
show that valid inference is still possible if one monitors conditional
performance and if either conditional exchangeability or time-constant
selection bias hold. Specifically, we develop a new score-based cumulative sum
(CUSUM) monitoring procedure with dynamic control limits. Through simulations,
we demonstrate the benefits of combining model updating with monitoring and
investigate how over-trust in a prediction model may delay detection of
performance deterioration. Finally, we illustrate how these monitoring methods
can be used to detect calibration decay of an ML-based risk calculator for
postoperative nausea and vomiting during the COVID-19 pandemic.","['Jean Feng', 'Alexej Gossmann', 'Gene Pennello', 'Nicholas Petrick', 'Berkman Sahiner', 'Romain Pirracchio']","['stat.ML', 'cs.CY', 'cs.LG']",2022-11-17 18:54:34+00:00
http://arxiv.org/abs/2211.09760v1,VeLO: Training Versatile Learned Optimizers by Scaling Up,"While deep learning models have replaced hand-designed features across many
domains, these models are still trained with hand-designed optimizers. In this
work, we leverage the same scaling approach behind the success of deep learning
to learn versatile optimizers. We train an optimizer for deep learning which is
itself a small neural network that ingests gradients and outputs parameter
updates. Meta-trained with approximately four thousand TPU-months of compute on
a wide variety of optimization tasks, our optimizer not only exhibits
compelling performance, but optimizes in interesting and unexpected ways. It
requires no hyperparameter tuning, instead automatically adapting to the
specifics of the problem being optimized. We open source our learned optimizer,
meta-training code, the associated train and test data, and an extensive
optimizer benchmark suite with baselines at velo-code.github.io.","['Luke Metz', 'James Harrison', 'C. Daniel Freeman', 'Amil Merchant', 'Lucas Beyer', 'James Bradbury', 'Naman Agrawal', 'Ben Poole', 'Igor Mordatch', 'Adam Roberts', 'Jascha Sohl-Dickstein']","['cs.LG', 'math.OC', 'stat.ML']",2022-11-17 18:39:07+00:00
http://arxiv.org/abs/2211.09721v5,A Finite-Particle Convergence Rate for Stein Variational Gradient Descent,"We provide the first finite-particle convergence rate for Stein variational
gradient descent (SVGD), a popular algorithm for approximating a probability
distribution with a collection of particles. Specifically, whenever the target
distribution is sub-Gaussian with a Lipschitz score, SVGD with n particles and
an appropriate step size sequence drives the kernel Stein discrepancy to zero
at an order 1/sqrt(log log n) rate. We suspect that the dependence on n can be
improved, and we hope that our explicit, non-asymptotic proof strategy will
serve as a template for future refinements.","['Jiaxin Shi', 'Lester Mackey']","['cs.LG', 'stat.ML']",2022-11-17 17:50:39+00:00
http://arxiv.org/abs/2211.09619v3,Introduction to Online Nonstochastic Control,"This text presents an introduction to an emerging paradigm in control of
dynamical systems and differentiable reinforcement learning called online
nonstochastic control. The new approach applies techniques from online convex
optimization and convex relaxations to obtain new methods with provable
guarantees for classical settings in optimal and robust control.
  The primary distinction between online nonstochastic control and other
frameworks is the objective. In optimal control, robust control, and other
control methodologies that assume stochastic noise, the goal is to perform
comparably to an offline optimal strategy. In online nonstochastic control,
both the cost functions as well as the perturbations from the assumed dynamical
model are chosen by an adversary. Thus the optimal policy is not defined a
priori. Rather, the target is to attain low regret against the best policy in
hindsight from a benchmark class of policies.
  This objective suggests the use of the decision making framework of online
convex optimization as an algorithmic methodology. The resulting methods are
based on iterative mathematical optimization algorithms, and are accompanied by
finite-time regret and computational complexity guarantees.","['Elad Hazan', 'Karan Singh']","['cs.LG', 'cs.RO', 'cs.SY', 'eess.SY', 'math.OC', 'stat.ML']",2022-11-17 16:12:45+00:00
http://arxiv.org/abs/2211.09602v2,Validation Diagnostics for SBI algorithms based on Normalizing Flows,"Building on the recent trend of new deep generative models known as
Normalizing Flows (NF), simulation-based inference (SBI) algorithms can now
efficiently accommodate arbitrary complex and high-dimensional data
distributions. The development of appropriate validation methods however has
fallen behind. Indeed, most of the existing metrics either require access to
the true posterior distribution, or fail to provide theoretical guarantees on
the consistency of the inferred approximation beyond the one-dimensional
setting. This work proposes easy to interpret validation diagnostics for
multi-dimensional conditional (posterior) density estimators based on NF. It
also offers theoretical guarantees based on results of local consistency. The
proposed workflow can be used to check, analyse and guarantee consistent
behavior of the estimator. The method is illustrated with a challenging example
that involves tightly coupled parameters in the context of computational
neuroscience. This work should help the design of better specified models or
drive the development of novel SBI-algorithms, hence allowing to build up trust
on their ability to address important questions in experimental science.","['Julia Linhart', 'Alexandre Gramfort', 'Pedro L. C. Rodrigues']","['stat.ML', 'cs.AI', 'cs.LG', 'q-bio.QM']",2022-11-17 15:48:06+00:00
