id,title,abstract,authors,categories,date
http://arxiv.org/abs/2107.10013v1,Optimal Operation of Power Systems with Energy Storage under Uncertainty: A Scenario-based Method with Strategic Sampling,"The multi-period dynamics of energy storage (ES), intermittent renewable
generation and uncontrollable power loads, make the optimization of power
system operation (PSO) challenging. A multi-period optimal PSO under
uncertainty is formulated using the chance-constrained optimization (CCO)
modeling paradigm, where the constraints include the nonlinear energy storage
and AC power flow models. Based on the emerging scenario optimization method
which does not rely on pre-known probability distribution functions, this paper
develops a novel solution method for this challenging CCO problem. The proposed
meth-od is computationally effective for mainly two reasons. First, the
original AC power flow constraints are approximated by a set of
learning-assisted quadratic convex inequalities based on a generalized least
absolute shrinkage and selection operator. Second, considering the physical
patterns of data and motived by learning-based sampling, the strategic sampling
method is developed to significantly reduce the required number of scenarios
through different sampling strategies. The simulation results on IEEE standard
systems indicate that 1) the proposed strategic sampling significantly improves
the computational efficiency of the scenario-based approach for solving the
chance-constrained optimal PSO problem, 2) the data-driven convex approximation
of power flow can be promising alternatives of nonlinear and nonconvex AC power
flow.","['Ren Hu', 'Qifeng Li']","['eess.SY', 'cs.AI', 'cs.SY', 'stat.ML', '68T09']",2021-07-21 11:21:50+00:00
http://arxiv.org/abs/2107.09957v2,Memorization in Deep Neural Networks: Does the Loss Function matter?,"Deep Neural Networks, often owing to the overparameterization, are shown to
be capable of exactly memorizing even randomly labelled data. Empirical studies
have also shown that none of the standard regularization techniques mitigate
such overfitting. We investigate whether the choice of the loss function can
affect this memorization. We empirically show, with benchmark data sets MNIST
and CIFAR-10, that a symmetric loss function, as opposed to either
cross-entropy or squared error loss, results in significant improvement in the
ability of the network to resist such overfitting. We then provide a formal
definition for robustness to memorization and provide a theoretical explanation
as to why the symmetric losses provide this robustness. Our results clearly
bring out the role loss functions alone can play in this phenomenon of
memorization.","['Deep Patel', 'P. S. Sastry']","['cs.LG', 'cs.CV', 'stat.ML']",2021-07-21 09:08:51+00:00
http://arxiv.org/abs/2107.09950v2,Boundary of Distribution Support Generator (BDSG): Sample Generation on the Boundary,"Generative models, such as Generative Adversarial Networks (GANs), have been
used for unsupervised anomaly detection. While performance keeps improving,
several limitations exist particularly attributed to difficulties at capturing
multimodal supports and to the ability to approximate the underlying
distribution closer to the tails, i.e. the boundary of the distribution's
support. This paper proposes an approach that attempts to alleviate such
shortcomings. We propose an invertible-residual-network-based model, the
Boundary of Distribution Support Generator (BDSG). GANs generally do not
guarantee the existence of a probability distribution and here, we use the
recently developed Invertible Residual Network (IResNet) and Residual Flow
(ResFlow), for density estimation. These models have not yet been used for
anomaly detection. We leverage IResNet and ResFlow for Out-of-Distribution
(OoD) sample detection and for sample generation on the boundary using a
compound loss function that forces the samples to lie on the boundary. The BDSG
addresses non-convex support, disjoint components, and multimodal
distributions. Results on synthetic data and data from multimodal
distributions, such as MNIST and CIFAR-10, demonstrate competitive performance
compared to methods from the literature.","['Nikolaos Dionelis', 'Mehrdad Yaghoobi', 'Sotirios A. Tsaftaris']","['cs.LG', 'stat.ML']",2021-07-21 09:00:32+00:00
http://arxiv.org/abs/2107.09949v1,Online structural kernel selection for mobile health,"Motivated by the need for efficient and personalized learning in mobile
health, we investigate the problem of online kernel selection for Gaussian
Process regression in the multi-task setting. We propose a novel generative
process on the kernel composition for this purpose. Our method demonstrates
that trajectories of kernel evolutions can be transferred between users to
improve learning and that the kernels themselves are meaningful for an mHealth
prediction goal.","['Eura Shin', 'Pedja Klasnja', 'Susan Murphy', 'Finale Doshi-Velez']","['cs.LG', 'stat.ML']",2021-07-21 08:58:53+00:00
http://arxiv.org/abs/2107.09912v2,Design of Experiments for Stochastic Contextual Linear Bandits,"In the stochastic linear contextual bandit setting there exist several
minimax procedures for exploration with policies that are reactive to the data
being acquired. In practice, there can be a significant engineering overhead to
deploy these algorithms, especially when the dataset is collected in a
distributed fashion or when a human in the loop is needed to implement a
different policy. Exploring with a single non-reactive policy is beneficial in
such cases. Assuming some batch contexts are available, we design a single
stochastic policy to collect a good dataset from which a near-optimal policy
can be extracted. We present a theoretical analysis as well as numerical
experiments on both synthetic and real-world datasets.","['Andrea Zanette', 'Kefan Dong', 'Jonathan Lee', 'Emma Brunskill']","['cs.LG', 'stat.ML']",2021-07-21 07:25:37+00:00
http://arxiv.org/abs/2107.09853v1,EMG Pattern Recognition via Bayesian Inference with Scale Mixture-Based Stochastic Generative Models,"Electromyogram (EMG) has been utilized to interface signals for prosthetic
hands and information devices owing to its ability to reflect human motion
intentions. Although various EMG classification methods have been introduced
into EMG-based control systems, they do not fully consider the stochastic
characteristics of EMG signals. This paper proposes an EMG pattern
classification method incorporating a scale mixture-based generative model. A
scale mixture model is a stochastic EMG model in which the EMG variance is
considered as a random variable, enabling the representation of uncertainty in
the variance. This model is extended in this study and utilized for EMG pattern
classification. The proposed method is trained by variational Bayesian
learning, thereby allowing the automatic determination of the model complexity.
Furthermore, to optimize the hyperparameters of the proposed method with a
partial discriminative approach, a mutual information-based determination
method is introduced. Simulation and EMG analysis experiments demonstrated the
relationship between the hyperparameters and classification accuracy of the
proposed method as well as the validity of the proposed method. The comparison
using public EMG datasets revealed that the proposed method outperformed the
various conventional classifiers. These results indicated the validity of the
proposed method and its applicability to EMG-based control systems. In EMG
pattern recognition, a classifier based on a generative model that reflects the
stochastic characteristics of EMG signals can outperform the conventional
general-purpose classifier.","['Akira Furui', 'Takuya Igaue', 'Toshio Tsuji']","['eess.SP', 'cs.LG', 'stat.ML']",2021-07-21 02:51:19+00:00
http://arxiv.org/abs/2107.09802v1,Private Alternating Least Squares: Practical Private Matrix Completion with Tighter Rates,"We study the problem of differentially private (DP) matrix completion under
user-level privacy. We design a joint differentially private variant of the
popular Alternating-Least-Squares (ALS) method that achieves: i) (nearly)
optimal sample complexity for matrix completion (in terms of number of items,
users), and ii) the best known privacy/utility trade-off both theoretically, as
well as on benchmark data sets. In particular, we provide the first global
convergence analysis of ALS with noise introduced to ensure DP, and show that,
in comparison to the best known alternative (the Private Frank-Wolfe algorithm
by Jain et al. (2018)), our error bounds scale significantly better with
respect to the number of items and users, which is critical in practical
problems. Extensive validation on standard benchmarks demonstrate that the
algorithm, in combination with carefully designed sampling procedures, is
significantly more accurate than existing techniques, thus promising to be the
first practical DP embedding model.","['Steve Chien', 'Prateek Jain', 'Walid Krichene', 'Steffen Rendle', 'Shuang Song', 'Abhradeep Thakurta', 'Li Zhang']","['cs.LG', 'cs.CR', 'stat.ML']",2021-07-20 23:19:11+00:00
http://arxiv.org/abs/2107.09773v1,Statistical Estimation from Dependent Data,"We consider a general statistical estimation problem wherein binary labels
across different observations are not independent conditioned on their feature
vectors, but dependent, capturing settings where e.g. these observations are
collected on a spatial domain, a temporal domain, or a social network, which
induce dependencies. We model these dependencies in the language of Markov
Random Fields and, importantly, allow these dependencies to be substantial, i.e
do not assume that the Markov Random Field capturing these dependencies is in
high temperature. As our main contribution we provide algorithms and
statistically efficient estimation rates for this model, giving several
instantiations of our bounds in logistic regression, sparse logistic
regression, and neural network settings with dependent data. Our estimation
guarantees follow from novel results for estimating the parameters (i.e.
external fields and interaction strengths) of Ising models from a {\em single}
sample. {We evaluate our estimation approach on real networked data, showing
that it outperforms standard regression approaches that ignore dependencies,
across three text classification datasets: Cora, Citeseer and Pubmed.}","['Yuval Dagan', 'Constantinos Daskalakis', 'Nishanth Dikkala', 'Surbhi Goel', 'Anthimos Vardis Kandiros']","['cs.LG', 'math.ST', 'stat.ML', 'stat.TH']",2021-07-20 21:18:06+00:00
http://arxiv.org/abs/2107.09744v2,Turbulent field fluctuations in gyrokinetic and fluid plasmas,"A key uncertainty in the design and development of magnetic confinement
fusion energy reactors is predicting edge plasma turbulence. An essential step
in overcoming this uncertainty is the validation in accuracy of reduced
turbulent transport models. Drift-reduced Braginskii two-fluid theory is one
such set of reduced equations that has for decades simulated boundary plasmas
in experiment, but significant questions exist regarding its predictive
ability. To this end, using a novel physics-informed deep learning framework,
we demonstrate the first ever direct quantitative comparisons of turbulent
field fluctuations between electrostatic two-fluid theory and electromagnetic
gyrokinetic modelling with good overall agreement found in magnetized helical
plasmas at low normalized pressure. This framework is readily adaptable to
experimental and astrophysical environments, and presents a new technique for
the numerical validation and discovery of reduced global plasma turbulence
models.","['Abhilash Mathews', 'Noah Mandell', 'Manaure Francisquez', 'Jerry Hughes', 'Ammar Hakim']","['physics.plasm-ph', 'cs.LG', 'physics.comp-ph', 'stat.ML']",2021-07-20 19:50:30+00:00
http://arxiv.org/abs/2107.10869v3,Filament Plots for Data Visualization,"The efficiency of modern computer graphics allows us to explore collections
of space curves simultaneously with ""drag-to-rotate"" interfaces. This inspires
us to replace ""scatterplots of points"" with ""scatterplots of curves"" to
simultaneously visualize relationships across an entire dataset. Since spaces
of curves are infinite dimensional, scatterplots of curves avoid the ""lossy""
nature of scatterplots of points. In particular, if two points are close in a
scatterplot of points derived from high-dimensional data, it does not generally
follow that the two associated data points are close in the data space.
Standard Andrews plots provide scatterplots of curves that perfectly preserve
Euclidean distances, but simultaneous visualization of these graphs over an
entire dataset produces visual clutter because graphs of functions generally
overlap in 2D. We mitigate this visual clutter issue by constructing
computationally inexpensive 3D extensions of Andrews plots. First, we construct
optimally smooth 3D Andrews plots by considering linear isometries from
Euclidean data spaces to spaces of planar parametric curves. We rigorously
parametrize the linear isometries that produce (on average) optimally smooth
curves over a given dataset. This parameterization of optimal isometries
reveals many degrees of freedom, and (using recent results on generalized Gauss
sums) we identify a particular member of this set which admits an asymptotic
""tour"" property that avoids certain local degeneracies as well. Finally, we
construct unit-length 3D curves (filaments) by numerically solving
Frenet-Serret systems given data from these 3D Andrews plots. We conclude with
examples of filament plots for several standard datasets, illustrating how
filament plots avoid visual clutter. Code and examples available at
https://github.com/n8epi/filaments/ and https://n8epi.github.io/filaments/",['Nate Strawn'],"['cs.HC', 'cs.LG', 'stat.ML', '42A99, 46N10, 53Z50']",2021-07-20 18:20:33+00:00
http://arxiv.org/abs/2107.09660v1,On Estimating Rank-One Spiked Tensors in the Presence of Heavy Tailed Errors,"In this paper, we study the estimation of a rank-one spiked tensor in the
presence of heavy tailed noise. Our results highlight some of the fundamental
similarities and differences in the tradeoff between statistical and
computational efficiencies under heavy tailed and Gaussian noise. In
particular, we show that, for $p$ th order tensors, the tradeoff manifests in
an identical fashion as the Gaussian case when the noise has finite $4(p-1)$ th
moment. The difference in signal strength requirements, with or without
computational constraints, for us to estimate the singular vectors at the
optimal rate, interestingly, narrows for noise with heavier tails and vanishes
when the noise only has finite fourth moment. Moreover, if the noise has less
than fourth moment, tensor SVD, perhaps the most natural approach, is
suboptimal even though it is computationally intractable. Our analysis exploits
a close connection between estimating the rank-one spikes and the spectral norm
of a random tensor with iid entries. In particular, we show that the order of
the spectral norm of a random tensor can be precisely characterized by the
moment of its entries, generalizing classical results for random matrices. In
addition to the theoretical guarantees, we propose estimation procedures for
the heavy tailed regime, which are easy to implement and efficient to run.
Numerical experiments are presented to demonstrate their practical merits.","['Arnab Auddy', 'Ming Yuan']","['math.ST', 'cs.IT', 'cs.NA', 'math.IT', 'math.NA', 'stat.ML', 'stat.TH', '15A18, 15A69, 62H25, 62F35, 62-08']",2021-07-20 17:45:55+00:00
http://arxiv.org/abs/2107.09597v4,Positively Weighted Kernel Quadrature via Subsampling,"We study kernel quadrature rules with convex weights. Our approach combines
the spectral properties of the kernel with recombination results about point
measures. This results in effective algorithms that construct convex quadrature
rules using only access to i.i.d. samples from the underlying measure and
evaluation of the kernel and that result in a small worst-case error. In
addition to our theoretical results and the benefits resulting from convex
weights, our experiments indicate that this construction can compete with the
optimal bounds in well-known examples.","['Satoshi Hayakawa', 'Harald Oberhauser', 'Terry Lyons']","['math.NA', 'cs.LG', 'cs.NA', 'stat.ML']",2021-07-20 16:18:56+00:00
http://arxiv.org/abs/2107.09542v1,Open Problem: Is There an Online Learning Algorithm That Learns Whenever Online Learning Is Possible?,"This open problem asks whether there exists an online learning algorithm for
binary classification that guarantees, for all target concepts, to make a
sublinear number of mistakes, under only the assumption that the (possibly
random) sequence of points X allows that such a learning algorithm can exist
for that sequence. As a secondary problem, it also asks whether a specific
concise condition completely determines whether a given (possibly random)
sequence of points X admits the existence of online learning algorithms
guaranteeing a sublinear number of mistakes for all target concepts.",['Steve Hanneke'],"['cs.LG', 'cs.AI', 'math.PR', 'math.ST', 'stat.ML', 'stat.TH']",2021-07-20 14:57:37+00:00
http://arxiv.org/abs/2107.09532v1,Estimation of a regression function on a manifold by fully connected deep neural networks,"Estimation of a regression function from independent and identically
distributed data is considered. The $L_2$ error with integration with respect
to the distribution of the predictor variable is used as the error criterion.
The rate of convergence of least squares estimates based on fully connected
spaces of deep neural networks with ReLU activation function is analyzed for
smooth regression functions. It is shown that in case that the distribution of
the predictor variable is concentrated on a manifold, these estimates achieve a
rate of convergence which depends on the dimension of the manifold and not on
the number of components of the predictor variable.","['Michael Kohler', 'Sophie Langer', 'Ulrich Reif']","['math.ST', 'stat.ML', 'stat.TH', '62G05 (Primary), 62G20 (Secondary)']",2021-07-20 14:43:59+00:00
http://arxiv.org/abs/2107.09519v1,Canonical Polyadic Decomposition and Deep Learning for Machine Fault Detection,"Acoustic monitoring for machine fault detection is a recent and expanding
research path that has already provided promising results for industries.
However, it is impossible to collect enough data to learn all types of faults
from a machine. Thus, new algorithms, trained using data from healthy
conditions only, were developed to perform unsupervised anomaly detection. A
key issue in the development of these algorithms is the noise in the signals,
as it impacts the anomaly detection performance. In this work, we propose a
powerful data-driven and quasi non-parametric denoising strategy for spectral
data based on a tensor decomposition: the Non-negative Canonical Polyadic (CP)
decomposition. This method is particularly adapted for machine emitting
stationary sound. We demonstrate in a case study, the Malfunctioning Industrial
Machine Investigation and Inspection (MIMII) baseline, how the use of our
denoising strategy leads to a sensible improvement of the unsupervised anomaly
detection. Such approaches are capable to make sound-based monitoring of
industrial processes more reliable.","['Gaetan Frusque', 'Gabriel Michau', 'Olga Fink']","['stat.ML', 'cs.LG', 'eess.AS']",2021-07-20 14:06:50+00:00
http://arxiv.org/abs/2107.09422v1,Large-scale graph representation learning with very deep GNNs and self-supervision,"Effectively and efficiently deploying graph neural networks (GNNs) at scale
remains one of the most challenging aspects of graph representation learning.
Many powerful solutions have only ever been validated on comparatively small
datasets, often with counter-intuitive outcomes -- a barrier which has been
broken by the Open Graph Benchmark Large-Scale Challenge (OGB-LSC). We entered
the OGB-LSC with two large-scale GNNs: a deep transductive node classifier
powered by bootstrapping, and a very deep (up to 50-layer) inductive graph
regressor regularised by denoising objectives. Our models achieved an
award-level (top-3) performance on both the MAG240M and PCQM4M benchmarks. In
doing so, we demonstrate evidence of scalable self-supervised graph
representation learning, and utility of very deep GNNs -- both very important
open issues. Our code is publicly available at:
https://github.com/deepmind/deepmind-research/tree/master/ogb_lsc.","['Ravichandra Addanki', 'Peter W. Battaglia', 'David Budden', 'Andreea Deac', 'Jonathan Godwin', 'Thomas Keck', 'Wai Lok Sibon Li', 'Alvaro Sanchez-Gonzalez', 'Jacklynn Stott', 'Shantanu Thakoor', 'Petar Veličković']","['cs.LG', 'cs.AI', 'cs.SI', 'stat.ML']",2021-07-20 11:35:25+00:00
http://arxiv.org/abs/2107.09384v1,An induction proof of the backpropagation algorithm in matrix notation,"Backpropagation (BP) is a core component of the contemporary deep learning
incarnation of neural networks. Briefly, BP is an algorithm that exploits the
computational architecture of neural networks to efficiently evaluate the
gradient of a cost function during neural network parameter optimization. The
validity of BP rests on the application of a multivariate chain rule to the
computational architecture of neural networks and their associated objective
functions. Introductions to deep learning theory commonly present the
computational architecture of neural networks in matrix form, but eschew a
parallel formulation and justification of BP in the framework of matrix
differential calculus. This entails several drawbacks for the theory and
didactics of deep learning. In this work, we overcome these limitations by
providing a full induction proof of the BP algorithm in matrix notation.
Specifically, we situate the BP algorithm in the framework of matrix
differential calculus, encompass affine-linear potential functions, prove the
validity of the BP algorithm in inductive form, and exemplify the
implementation of the matrix form BP algorithm in computer code.","['Dirk Ostwald', 'Franziska Usée']","['stat.ML', 'cs.LG', 'math.ST', 'q-bio.NC', 'stat.TH']",2021-07-20 10:02:17+00:00
http://arxiv.org/abs/2107.09355v1,Approximation Theory of Convolutional Architectures for Time Series Modelling,"We study the approximation properties of convolutional architectures applied
to time series modelling, which can be formulated mathematically as a
functional approximation problem. In the recurrent setting, recent results
reveal an intricate connection between approximation efficiency and memory
structures in the data generation process. In this paper, we derive parallel
results for convolutional architectures, with WaveNet being a prime example.
Our results reveal that in this new setting, approximation efficiency is not
only characterised by memory, but also additional fine structures in the target
relationship. This leads to a novel definition of spectrum-based regularity
that measures the complexity of temporal relationships under the convolutional
approximation scheme. These analyses provide a foundation to understand the
differences between architectural choices for time series modelling and can
give theoretically grounded guidance for practical applications.","['Haotian Jiang', 'Zhong Li', 'Qianxiao Li']","['cs.LG', 'stat.ML', '68W25, 68T07, 37M10', 'I.2.6']",2021-07-20 09:19:26+00:00
http://arxiv.org/abs/2107.09338v2,Stein Variational Gradient Descent with Multiple Kernel,"Stein variational gradient descent (SVGD) and its variants have shown
promising successes in approximate inference for complex distributions. In
practice, we notice that the kernel used in SVGD-based methods has a decisive
effect on the empirical performance. Radial basis function (RBF) kernel with
median heuristics is a common choice in previous approaches, but unfortunately
this has proven to be sub-optimal. Inspired by the paradigm of Multiple Kernel
Learning (MKL), our solution to this flaw is using a combination of multiple
kernels to approximate the optimal kernel, rather than a single one which may
limit the performance and flexibility. Specifically, we first extend Kernelized
Stein Discrepancy (KSD) to its multiple kernels view called Multiple Kernelized
Stein Discrepancy (MKSD) and then leverage MKSD to construct a general
algorithm Multiple Kernel SVGD (MK-SVGD). Further, MKSVGD can automatically
assign a weight to each kernel without any other parameters, which means that
our method not only gets rid of optimal kernel dependence but also maintains
computational efficiency. Experiments on various tasks and models demonstrate
that our proposed method consistently matches or outperforms the competing
methods.","['Qingzhong Ai', 'Shiyu Liu', 'Lirong He', 'Zenglin Xu']","['cs.LG', 'stat.ML']",2021-07-20 08:48:42+00:00
http://arxiv.org/abs/2107.09301v2,A Bayesian Approach to Invariant Deep Neural Networks,"We propose a novel Bayesian neural network architecture that can learn
invariances from data alone by inferring a posterior distribution over
different weight-sharing schemes. We show that our model outperforms other
non-invariant architectures, when trained on datasets that contain specific
invariances. The same holds true when no data augmentation is performed.","['Nikolaos Mourdoukoutas', 'Marco Federici', 'Georges Pantalos', 'Mark van der Wilk', 'Vincent Fortuin']","['stat.ML', 'cs.LG']",2021-07-20 07:33:58+00:00
