id,title,abstract,authors,categories,date
http://arxiv.org/abs/2210.10268v1,Fast Approximation of the Generalized Sliced-Wasserstein Distance,"Generalized sliced Wasserstein distance is a variant of sliced Wasserstein
distance that exploits the power of non-linear projection through a given
defining function to better capture the complex structures of the probability
distributions. Similar to sliced Wasserstein distance, generalized sliced
Wasserstein is defined as an expectation over random projections which can be
approximated by the Monte Carlo method. However, the complexity of that
approximation can be expensive in high-dimensional settings. To that end, we
propose to form deterministic and fast approximations of the generalized sliced
Wasserstein distance by using the concentration of random projections when the
defining functions are polynomial function, circular function, and neural
network type function. Our approximations hinge upon an important result that
one-dimensional projections of a high-dimensional random vector are
approximately Gaussian.","['Dung Le', 'Huy Nguyen', 'Khai Nguyen', 'Trang Nguyen', 'Nhat Ho']","['stat.ML', 'cs.LG']",2022-10-19 03:15:50+00:00
http://arxiv.org/abs/2210.10199v1,Bayesian Optimization over Discrete and Mixed Spaces via Probabilistic Reparameterization,"Optimizing expensive-to-evaluate black-box functions of discrete (and
potentially continuous) design parameters is a ubiquitous problem in scientific
and engineering applications. Bayesian optimization (BO) is a popular,
sample-efficient method that leverages a probabilistic surrogate model and an
acquisition function (AF) to select promising designs to evaluate. However,
maximizing the AF over mixed or high-cardinality discrete search spaces is
challenging standard gradient-based methods cannot be used directly or
evaluating the AF at every point in the search space would be computationally
prohibitive. To address this issue, we propose using probabilistic
reparameterization (PR). Instead of directly optimizing the AF over the search
space containing discrete parameters, we instead maximize the expectation of
the AF over a probability distribution defined by continuous parameters. We
prove that under suitable reparameterizations, the BO policy that maximizes the
probabilistic objective is the same as that which maximizes the AF, and
therefore, PR enjoys the same regret bounds as the original BO policy using the
underlying AF. Moreover, our approach provably converges to a stationary point
of the probabilistic objective under gradient ascent using scalable, unbiased
estimators of both the probabilistic objective and its gradient. Therefore, as
the number of starting points and gradient steps increase, our approach will
recover of a maximizer of the AF (an often-neglected requisite for commonly
used BO regret bounds). We validate our approach empirically and demonstrate
state-of-the-art optimization performance on a wide range of real-world
applications. PR is complementary to (and benefits) recent work and naturally
generalizes to settings with multiple objectives and black-box constraints.","['Samuel Daulton', 'Xingchen Wan', 'David Eriksson', 'Maximilian Balandat', 'Michael A. Osborne', 'Eytan Bakshy']","['cs.LG', 'cs.AI', 'math.OC', 'stat.ML']",2022-10-18 22:41:00+00:00
http://arxiv.org/abs/2210.15458v2,Arithmetic Sampling: Parallel Diverse Decoding for Large Language Models,"Decoding methods for large language models often trade-off between diversity
of outputs and parallelism of computation. Methods such as beam search and
Gumbel top-k sampling can guarantee a different output for each element of the
beam, but are not easy to parallelize. Alternatively, methods such as
temperature sampling and its modifications (top-k sampling, nucleus sampling,
typical decoding, and others), are embarrassingly parallel, but have no
guarantees about duplicate samples. We present a framework for sampling
according to an arithmetic code book implicitly defined by a large language
model, compatible with common sampling variations, with provable beam diversity
under certain conditions, as well as being embarrassingly parallel and
providing unbiased and consistent expectations from the original model. We
demonstrate the effectiveness of our approach on WMT machine translation, more
than halving the standard deviation when estimating expected BLEU score reward,
and closing the BLEU score gap between independent sampling and beam search by
up to 63%.","['Luke Vilnis', 'Yury Zemlyanskiy', 'Patrick Murray', 'Alexandre Passos', 'Sumit Sanghai']","['cs.CL', 'cs.LG', 'stat.ML']",2022-10-18 22:19:41+00:00
http://arxiv.org/abs/2210.10781v1,Generalization Properties of Decision Trees on Real-valued and Categorical Features,"We revisit binary decision trees from the perspective of partitions of the
data. We introduce the notion of partitioning function, and we relate it to the
growth function and to the VC dimension. We consider three types of features:
real-valued, categorical ordinal and categorical nominal, with different split
rules for each. For each feature type, we upper bound the partitioning function
of the class of decision stumps before extending the bounds to the class of
general decision tree (of any fixed structure) using a recursive approach.
Using these new results, we are able to find the exact VC dimension of decision
stumps on examples of $\ell$ real-valued features, which is given by the
largest integer $d$ such that $2\ell \ge \binom{d}{\lfloor\frac{d}{2}\rfloor}$.
Furthermore, we show that the VC dimension of a binary tree structure with
$L_T$ leaves on examples of $\ell$ real-valued features is in $O(L_T
\log(L_T\ell))$. Finally, we elaborate a pruning algorithm based on these
results that performs better than the cost-complexity and reduced-error pruning
algorithms on a number of data sets, with the advantage that no
cross-validation is required.","['Jean-Samuel Leboeuf', 'Frédéric LeBlanc', 'Mario Marchand']","['stat.ML', 'cs.LG']",2022-10-18 21:50:24+00:00
http://arxiv.org/abs/2210.10161v1,Nonparametric Quantile Regression: Non-Crossing Constraints and Conformal Prediction,"We propose a nonparametric quantile regression method using deep neural
networks with a rectified linear unit penalty function to avoid quantile
crossing. This penalty function is computationally feasible for enforcing
non-crossing constraints in multi-dimensional nonparametric quantile
regression. We establish non-asymptotic upper bounds for the excess risk of the
proposed nonparametric quantile regression function estimators. Our error
bounds achieve optimal minimax rate of convergence for the Holder class, and
the prefactors of the error bounds depend polynomially on the dimension of the
predictor, instead of exponentially. Based on the proposed non-crossing
penalized deep quantile regression, we construct conformal prediction intervals
that are fully adaptive to heterogeneity. The proposed prediction interval is
shown to have good properties in terms of validity and accuracy under
reasonable conditions. We also derive non-asymptotic upper bounds for the
difference of the lengths between the proposed non-crossing conformal
prediction interval and the theoretically oracle prediction interval. Numerical
experiments including simulation studies and a real data example are conducted
to demonstrate the effectiveness of the proposed method.","['Wenlu Tang', 'Guohao Shen', 'Yuanyuan Lin', 'Jian Huang']","['stat.ML', 'cs.LG', 'math.ST', 'stat.TH', '62G08, 62G20']",2022-10-18 20:59:48+00:00
http://arxiv.org/abs/2210.10063v1,Multivariate outlier explanations using Shapley values and Mahalanobis distances,"For the purpose of explaining multivariate outlyingness, it is shown that the
squared Mahalanobis distance of an observation can be decomposed into
outlyingness contributions originating from single variables. The decomposition
is obtained using the Shapley value, a well-known concept from game theory that
became popular in the context of Explainable AI. In addition to outlier
explanation, this concept also relates to the recent formulation of cellwise
outlyingness, where Shapley values can be employed to obtain variable
contributions for outlying observations with respect to their ""expected""
position given the multivariate data structure. In combination with squared
Mahalanobis distances, Shapley values can be calculated at a low numerical
cost, making them even more attractive for outlier interpretation. Simulations
and real-world data examples demonstrate the usefulness of these concepts.","['Marcus Mayrhofer', 'Peter Filzmoser']","['stat.ME', 'stat.ML']",2022-10-18 18:00:07+00:00
http://arxiv.org/abs/2210.10003v4,$k$-Means Clustering for Persistent Homology,"Persistent homology is a methodology central to topological data analysis
that extracts and summarizes the topological features within a dataset as a
persistence diagram; it has recently gained much popularity from its myriad
successful applications to many domains. However, its algebraic construction
induces a metric space of persistence diagrams with a highly complex geometry.
In this paper, we prove convergence of the $k$-means clustering algorithm on
persistence diagram space and establish theoretical properties of the solution
to the optimization problem in the Karush--Kuhn--Tucker framework.
Additionally, we perform numerical experiments on various representations of
persistent homology, including embeddings of persistence diagrams as well as
diagrams themselves and their generalizations as persistence measures; we find
that $k$-means clustering performance directly on persistence diagrams and
measures outperform their vectorized representations.","['Yueqi Cao', 'Prudence Leung', 'Anthea Monod']","['stat.AP', 'math.OC', 'stat.ML']",2022-10-18 17:18:51+00:00
http://arxiv.org/abs/2210.09998v1,Locally Smoothed Gaussian Process Regression,"We develop a novel framework to accelerate Gaussian process regression (GPR).
In particular, we consider localization kernels at each data point to
down-weigh the contributions from other data points that are far away, and we
derive the GPR model stemming from the application of such localization
operation. Through a set of experiments, we demonstrate the competitive
performance of the proposed approach compared to full GPR, other localized
models, and deep Gaussian processes. Crucially, these performances are obtained
with considerable speedups compared to standard global GPR due to the
sparsification effect of the Gram matrix induced by the localization operation.","['Davit Gogolashvili', 'Bogdan Kozyrskiy', 'Maurizio Filippone']","['stat.ML', 'cs.LG']",2022-10-18 17:04:35+00:00
http://arxiv.org/abs/2210.09974v3,Theoretical Guarantees for Permutation-Equivariant Quantum Neural Networks,"Despite the great promise of quantum machine learning models, there are
several challenges one must overcome before unlocking their full potential. For
instance, models based on quantum neural networks (QNNs) can suffer from
excessive local minima and barren plateaus in their training landscapes.
Recently, the nascent field of geometric quantum machine learning (GQML) has
emerged as a potential solution to some of those issues. The key insight of
GQML is that one should design architectures, such as equivariant QNNs,
encoding the symmetries of the problem at hand. Here, we focus on problems with
permutation symmetry (i.e., the group of symmetry $S_n$), and show how to build
$S_n$-equivariant QNNs. We provide an analytical study of their performance,
proving that they do not suffer from barren plateaus, quickly reach
overparametrization, and generalize well from small amounts of data. To verify
our results, we perform numerical simulations for a graph state classification
task. Our work provides the first theoretical guarantees for equivariant QNNs,
thus indicating the extreme power and potential of GQML.","['Louis Schatzki', 'Martin Larocca', 'Quynh T. Nguyen', 'Frederic Sauvage', 'M. Cerezo']","['quant-ph', 'cs.LG', 'stat.ML']",2022-10-18 16:35:44+00:00
http://arxiv.org/abs/2210.09957v2,"Contextual bandits with concave rewards, and an application to fair ranking","We consider Contextual Bandits with Concave Rewards (CBCR), a multi-objective
bandit problem where the desired trade-off between the rewards is defined by a
known concave objective function, and the reward vector depends on an observed
stochastic context. We present the first algorithm with provably vanishing
regret for CBCR without restrictions on the policy space, whereas prior works
were restricted to finite policy spaces or tabular representations. Our
solution is based on a geometric interpretation of CBCR algorithms as
optimization algorithms over the convex set of expected rewards spanned by all
stochastic policies. Building on Frank-Wolfe analyses in constrained convex
optimization, we derive a novel reduction from the CBCR regret to the regret of
a scalar-reward bandit problem. We illustrate how to apply the reduction
off-the-shelf to obtain algorithms for CBCR with both linear and general reward
functions, in the case of non-combinatorial actions. Motivated by fairness in
recommendation, we describe a special case of CBCR with rankings and
fairness-aware objectives, leading to the first algorithm with regret
guarantees for contextual combinatorial bandits with fairness of exposure.","['Virginie Do', 'Elvis Dohmatob', 'Matteo Pirotta', 'Alessandro Lazaric', 'Nicolas Usunier']","['cs.LG', 'cs.AI', 'cs.CY', 'cs.IR', 'stat.ML']",2022-10-18 16:11:55+00:00
http://arxiv.org/abs/2210.09949v1,SQ Lower Bounds for Learning Single Neurons with Massart Noise,"We study the problem of PAC learning a single neuron in the presence of
Massart noise. Specifically, for a known activation function $f: \mathbb{R} \to
\mathbb{R}$, the learner is given access to labeled examples $(\mathbf{x}, y)
\in \mathbb{R}^d \times \mathbb{R}$, where the marginal distribution of
$\mathbf{x}$ is arbitrary and the corresponding label $y$ is a Massart
corruption of $f(\langle \mathbf{w}, \mathbf{x} \rangle)$. The goal of the
learner is to output a hypothesis $h: \mathbb{R}^d \to \mathbb{R}$ with small
squared loss. For a range of activation functions, including ReLUs, we
establish super-polynomial Statistical Query (SQ) lower bounds for this
learning problem. In more detail, we prove that no efficient SQ algorithm can
approximate the optimal error within any constant factor. Our main technical
contribution is a novel SQ-hard construction for learning $\{ \pm 1\}$-weight
Massart halfspaces on the Boolean hypercube that is interesting on its own
right.","['Ilias Diakonikolas', 'Daniel M. Kane', 'Lisheng Ren', 'Yuxin Sun']","['cs.LG', 'cs.DS', 'math.ST', 'stat.ML', 'stat.TH']",2022-10-18 15:58:00+00:00
http://arxiv.org/abs/2210.09929v3,Differentially Private Diffusion Models,"While modern machine learning models rely on increasingly large training
datasets, data is often limited in privacy-sensitive domains. Generative models
trained with differential privacy (DP) on sensitive data can sidestep this
challenge, providing access to synthetic data instead. We build on the recent
success of diffusion models (DMs) and introduce Differentially Private
Diffusion Models (DPDMs), which enforce privacy using differentially private
stochastic gradient descent (DP-SGD). We investigate the DM parameterization
and the sampling algorithm, which turn out to be crucial ingredients in DPDMs,
and propose noise multiplicity, a powerful modification of DP-SGD tailored to
the training of DMs. We validate our novel DPDMs on image generation benchmarks
and achieve state-of-the-art performance in all experiments. Moreover, on
standard benchmarks, classifiers trained on DPDM-generated synthetic data
perform on par with task-specific DP-SGD-trained classifiers, which has not
been demonstrated before for DP generative models. Project page and code:
https://nv-tlabs.github.io/DPDM.","['Tim Dockhorn', 'Tianshi Cao', 'Arash Vahdat', 'Karsten Kreis']","['stat.ML', 'cs.CR', 'cs.LG']",2022-10-18 15:20:47+00:00
http://arxiv.org/abs/2210.09925v1,Generalizing in the Real World with Representation Learning,"Machine learning (ML) formalizes the problem of getting computers to learn
from experience as optimization of performance according to some metric(s) on a
set of data examples. This is in contrast to requiring behaviour specified in
advance (e.g. by hard-coded rules). Formalization of this problem has enabled
great progress in many applications with large real-world impact, including
translation, speech recognition, self-driving cars, and drug discovery. But
practical instantiations of this formalism make many assumptions - for example,
that data are i.i.d.: independent and identically distributed - whose soundness
is seldom investigated. And in making great progress in such a short time, the
field has developed many norms and ad-hoc standards, focused on a relatively
small range of problem settings. As applications of ML, particularly in
artificial intelligence (AI) systems, become more pervasive in the real world,
we need to critically examine these assumptions, norms, and problem settings,
as well as the methods that have become de-facto standards. There is much we
still do not understand about how and why deep networks trained with stochastic
gradient descent are able to generalize as well as they do, why they fail when
they do, and how they will perform on out-of-distribution data. In this thesis
I cover some of my work towards better understanding deep net generalization,
identify several ways assumptions and problem settings fail to generalize to
the real world, and propose ways to address those failures in practice.",['Tegan Maharaj'],"['cs.LG', 'stat.ML']",2022-10-18 15:11:09+00:00
http://arxiv.org/abs/2210.09921v4,Finite-time analysis of single-timescale actor-critic,"Actor-critic methods have achieved significant success in many challenging
applications. However, its finite-time convergence is still poorly understood
in the most practical single-timescale form. Existing works on analyzing
single-timescale actor-critic have been limited to i.i.d. sampling or tabular
setting for simplicity. We investigate the more practical online
single-timescale actor-critic algorithm on continuous state space, where the
critic assumes linear function approximation and updates with a single
Markovian sample per actor step. Previous analysis has been unable to establish
the convergence for such a challenging scenario. We demonstrate that the online
single-timescale actor-critic method provably finds an $\epsilon$-approximate
stationary point with $\widetilde{\mathcal{O}}(\epsilon^{-2})$ sample
complexity under standard assumptions, which can be further improved to
$\mathcal{O}(\epsilon^{-2})$ under the i.i.d. sampling. Our novel framework
systematically evaluates and controls the error propagation between the actor
and critic. It offers a promising approach for analyzing other single-timescale
reinforcement learning algorithms as well.","['Xuyang Chen', 'Lin Zhao']","['cs.LG', 'math.OC', 'stat.ML']",2022-10-18 15:03:56+00:00
http://arxiv.org/abs/2210.09913v1,Measure-Theoretic Probability of Complex Co-occurrence and E-Integral,"Complex high-dimensional co-occurrence data are increasingly popular from a
complex system of interacting physical, biological and social processes in
discretely indexed modifiable areal units or continuously indexed locations of
a study region for landscape-based mechanism. Modeling, predicting and
interpreting complex co-occurrences are very general and fundamental problems
of statistical and machine learning in a broad variety of real-world modern
applications. Probability and conditional probability of co-occurrence are
introduced by being defined in a general setting with set functions to develop
a rigorous measure-theoretic foundation for the inherent challenge of data
sparseness. The data sparseness is a main challenge inherent to probabilistic
modeling and reasoning of co-occurrence in statistical inference. The behavior
of a class of natural integrals called E-integrals is investigated based on the
defined conditional probability of co-occurrence. The results on the properties
of E-integral are presented. The paper offers a novel measure-theoretic
framework where E-integral as a basic measure-theoretic concept can be the
starting point for the expectation functional approach preferred by Whittle
(1992) and Pollard (2001) to the development of probability theory for the
inherent challenge of co-occurrences emerging in modern high-dimensional
co-occurrence data problems and opens the doors to more sophisticated and
interesting research in complex high-dimensional co-occurrence data science.","['Jian-Yong Wang', 'Han Yu']","['stat.ML', 'cs.LG']",2022-10-18 14:52:23+00:00
http://arxiv.org/abs/2210.09903v5,Online Convex Optimization with Unbounded Memory,"Online convex optimization (OCO) is a widely used framework in online
learning. In each round, the learner chooses a decision in a convex set and an
adversary chooses a convex loss function, and then the learner suffers the loss
associated with their current decision. However, in many applications the
learner's loss depends not only on the current decision but on the entire
history of decisions until that point. The OCO framework and its existing
generalizations do not capture this, and they can only be applied to many
settings of interest after a long series of approximation arguments. They also
leave open the question of whether the dependence on memory is tight because
there are no non-trivial lower bounds. In this work we introduce a
generalization of the OCO framework, ""Online Convex Optimization with Unbounded
Memory"", that captures long-term dependence on past decisions. We introduce the
notion of $p$-effective memory capacity, $H_p$, that quantifies the maximum
influence of past decisions on present losses. We prove an $O(\sqrt{H_p T})$
upper bound on the policy regret and a matching (worst-case) lower bound. As a
special case, we prove the first non-trivial lower bound for OCO with finite
memory \citep{anavaHM2015online}, which could be of independent interest, and
also improve existing upper bounds. We demonstrate the broad applicability of
our framework by using it to derive regret bounds, and to improve and simplify
existing regret bound derivations, for a variety of online learning problems
including online linear control and an online variant of performative
prediction.","['Raunak Kumar', 'Sarah Dean', 'Robert Kleinberg']","['cs.LG', 'math.OC', 'stat.ML']",2022-10-18 14:43:44+00:00
http://arxiv.org/abs/2210.09881v1,Random Orthogonalization for Federated Learning in Massive MIMO Systems,"We propose a novel communication design, termed random orthogonalization, for
federated learning (FL) in a massive multiple-input and multiple-output (MIMO)
wireless system. The key novelty of random orthogonalization comes from the
tight coupling of FL and two unique characteristics of massive MIMO -- channel
hardening and favorable propagation. As a result, random orthogonalization can
achieve natural over-the-air model aggregation without requiring transmitter
side channel state information (CSI) for the uplink phase of FL, while
significantly reducing the channel estimation overhead at the receiver. We
extend this principle to the downlink communication phase and develop a simple
but highly effective model broadcast method for FL. We also relax the massive
MIMO assumption by proposing an enhanced random orthogonalization design for
both uplink and downlink FL communications, that does not rely on channel
hardening or favorable propagation. Theoretical analyses with respect to both
communication and machine learning performance are carried out. In particular,
an explicit relationship among the convergence rate, the number of clients, and
the number of antennas is established. Experimental results validate the
effectiveness and efficiency of random orthogonalization for FL in massive
MIMO.","['Xizixiang Wei', 'Cong Shen', 'Jing Yang', 'H. Vincent Poor']","['cs.IT', 'cs.LG', 'eess.SP', 'math.IT', 'stat.ML']",2022-10-18 14:17:10+00:00
http://arxiv.org/abs/2210.09852v1,Scaling Adversarial Training to Large Perturbation Bounds,"The vulnerability of Deep Neural Networks to Adversarial Attacks has fuelled
research towards building robust models. While most Adversarial Training
algorithms aim at defending attacks constrained within low magnitude Lp norm
bounds, real-world adversaries are not limited by such constraints. In this
work, we aim to achieve adversarial robustness within larger bounds, against
perturbations that may be perceptible, but do not change human (or Oracle)
prediction. The presence of images that flip Oracle predictions and those that
do not makes this a challenging setting for adversarial robustness. We discuss
the ideal goals of an adversarial defense algorithm beyond perceptual limits,
and further highlight the shortcomings of naively extending existing training
algorithms to higher perturbation bounds. In order to overcome these
shortcomings, we propose a novel defense, Oracle-Aligned Adversarial Training
(OA-AT), to align the predictions of the network with that of an Oracle during
adversarial training. The proposed approach achieves state-of-the-art
performance at large epsilon bounds (such as an L-inf bound of 16/255 on
CIFAR-10) while outperforming existing defenses (AWP, TRADES, PGD-AT) at
standard bounds (8/255) as well.","['Sravanti Addepalli', 'Samyak Jain', 'Gaurang Sriramanan', 'R. Venkatesh Babu']","['cs.LG', 'cs.CR', 'cs.CV', 'stat.ML']",2022-10-18 13:34:16+00:00
