id,title,abstract,authors,categories,date
http://arxiv.org/abs/2101.12113v1,Low Complexity Approximate Bayesian Logistic Regression for Sparse Online Learning,"Theoretical results show that Bayesian methods can achieve lower bounds on
regret for online logistic regression. In practice, however, such techniques
may not be feasible especially for very large feature sets. Various
approximations that, for huge sparse feature sets, diminish the theoretical
advantages, must be used. Often, they apply stochastic gradient methods with
hyper-parameters that must be tuned on some surrogate loss, defeating
theoretical advantages of Bayesian methods. The surrogate loss, defined to
approximate the mixture, requires techniques as Monte Carlo sampling,
increasing computations per example. We propose low complexity analytical
approximations for sparse online logistic and probit regressions. Unlike
variational inference and other methods, our methods use analytical closed
forms, substantially lowering computations. Unlike dense solutions, as Gaussian
Mixtures, our methods allow for sparse problems with huge feature sets without
increasing complexity. With the analytical closed forms, there is also no need
for applying stochastic gradient methods on surrogate losses, and for tuning
and balancing learning and regularization hyper-parameters. Empirical results
top the performance of the more computationally involved methods. Like such
methods, our methods still reveal per feature and per example uncertainty
measures.","['Gil I. Shamir', 'Wojciech Szpankowski']","['cs.LG', 'stat.ML']",2021-01-28 16:59:31+00:00
http://arxiv.org/abs/2101.12002v1,Copula-based conformal prediction for Multi-Target Regression,"There are relatively few works dealing with conformal prediction for
multi-task learning issues, and this is particularly true for multi-target
regression. This paper focuses on the problem of providing valid (i.e.,
frequency calibrated) multi-variate predictions. To do so, we propose to use
copula functions applied to deep neural networks for inductive conformal
prediction. We show that the proposed method ensures efficiency and validity
for multi-target regression problems on various data sets.","['Soundouss Messoudi', 'Sébastien Destercke', 'Sylvain Rousseau']","['cs.LG', 'cs.AI', 'stat.ML', '68T07,']",2021-01-28 14:06:25+00:00
http://arxiv.org/abs/2101.11885v3,Causality and independence in perfectly adapted dynamical systems,"Perfect adaptation in a dynamical system is the phenomenon that one or more
variables have an initial transient response to a persistent change in an
external stimulus but revert to their original value as the system converges to
equilibrium. With the help of the causal ordering algorithm, one can construct
graphical representations of dynamical systems that represent the causal
relations between the variables and the conditional independences in the
equilibrium distribution. We apply these tools to formulate sufficient
graphical conditions for identifying perfect adaptation from a set of
first-order differential equations. Furthermore, we give sufficient conditions
to test for the presence of perfect adaptation in experimental equilibrium
data. We apply this method to a simple model for a protein signalling pathway
and test its predictions both in simulations and using real-world protein
expression data. We demonstrate that perfect adaptation can lead to misleading
orientation of edges in the output of causal discovery algorithms.","['Tineke Blom', 'Joris M. Mooij']","['cs.AI', 'stat.ML']",2021-01-28 09:28:58+00:00
http://arxiv.org/abs/2101.11881v2,Deep learning via LSTM models for COVID-19 infection forecasting in India,"The COVID-19 pandemic continues to have major impact to health and medical
infrastructure, economy, and agriculture. Prominent computational and
mathematical models have been unreliable due to the complexity of the spread of
infections. Moreover, lack of data collection and reporting makes modelling
attempts difficult and unreliable. Hence, we need to re-look at the situation
with reliable data sources and innovative forecasting models. Deep learning
models such as recurrent neural networks are well suited for modelling
spatiotemporal sequences. In this paper, we apply recurrent neural networks
such as long short term memory (LSTM), bidirectional LSTM, and encoder-decoder
LSTM models for multi-step (short-term) COVID-19 infection forecasting. We
select Indian states with COVID-19 hotpots and capture the first (2020) and
second (2021) wave of infections and provide two months ahead forecast. Our
model predicts that the likelihood of another wave of infections in October and
November 2021 is low; however, the authorities need to be vigilant given
emerging variants of the virus. The accuracy of the predictions motivate the
application of the method in other countries and regions. Nevertheless, the
challenges in modelling remain due to the reliability of data and difficulties
in capturing factors such as population density, logistics, and social aspects
such as culture and lifestyle.","['Rohitash Chandra', 'Ayush Jain', 'Divyanshu Singh Chauhan']","['cs.LG', 'cs.AI', 'stat.AP', 'stat.ML']",2021-01-28 09:19:10+00:00
http://arxiv.org/abs/2101.11816v2,Inference of stochastic time series with missing data,"Inferring dynamics from time series is an important objective in data
analysis. In particular, it is challenging to infer stochastic dynamics given
incomplete data. We propose an expectation maximization (EM) algorithm that
iterates between alternating two steps: E-step restores missing data points,
while M-step infers an underlying network model of restored data. Using
synthetic data generated by a kinetic Ising model, we confirm that the
algorithm works for restoring missing data points as well as inferring the
underlying model. At the initial iteration of the EM algorithm, the model
inference shows better model-data consistency with observed data points than
with missing data points. As we keep iterating, however, missing data points
show better model-data consistency. We find that demanding equal consistency of
observed and missing data points provides an effective stopping criterion for
the iteration to prevent overshooting the most accurate model inference. Armed
with this EM algorithm with this stopping criterion, we infer missing data
points and an underlying network from a time-series data of real neuronal
activities. Our method recovers collective properties of neuronal activities,
such as time correlations and firing statistics, which have previously never
been optimized to fit.","['Sangwon Lee', 'Vipul Periwal', 'Junghyo Jo']","['physics.data-an', 'stat.ML']",2021-01-28 04:56:59+00:00
http://arxiv.org/abs/2101.11815v2,Interpolating Classifiers Make Few Mistakes,"This paper provides elementary analyses of the regret and generalization of
minimum-norm interpolating classifiers (MNIC). The MNIC is the function of
smallest Reproducing Kernel Hilbert Space norm that perfectly interpolates a
label pattern on a finite data set. We derive a mistake bound for MNIC and a
regularized variant that holds for all data sets. This bound follows from
elementary properties of matrix inverses. Under the assumption that the data is
independently and identically distributed, the mistake bound implies that MNIC
generalizes at a rate proportional to the norm of the interpolating solution
and inversely proportional to the number of data points. This rate matches
similar rates derived for margin classifiers and perceptrons. We derive several
plausible generative models where the norm of the interpolating classifier is
bounded or grows at a rate sublinear in $n$. We also show that as long as the
population class conditional distributions are sufficiently separable in total
variation, then MNIC generalizes with a fast rate.","['Tengyuan Liang', 'Benjamin Recht']","['stat.ML', 'cs.LG', 'cs.NA', 'math.NA', 'math.ST', 'stat.TH']",2021-01-28 04:51:24+00:00
http://arxiv.org/abs/2101.12578v4,Adjusting for Autocorrelated Errors in Neural Networks for Time Series,"An increasing body of research focuses on using neural networks to model time
series. A common assumption in training neural networks via maximum likelihood
estimation on time series is that the errors across time steps are
uncorrelated. However, errors are actually autocorrelated in many cases due to
the temporality of the data, which makes such maximum likelihood estimations
inaccurate. In this paper, in order to adjust for autocorrelated errors, we
propose to learn the autocorrelation coefficient jointly with the model
parameters. In our experiments, we verify the effectiveness of our approach on
time series forecasting. Results across a wide range of real-world datasets
with various state-of-the-art models show that our method enhances performance
in almost all cases. Based on these results, we suggest empirical critical
values to determine the severity of autocorrelated errors. We also analyze
several aspects of our method to demonstrate its advantages. Finally, other
time series tasks are also considered to validate that our method is not
restricted to only forecasting.","['Fan-Keng Sun', 'Christopher I. Lang', 'Duane S. Boning']","['cs.LG', 'stat.ML']",2021-01-28 04:25:51+00:00
http://arxiv.org/abs/2101.11783v3,Random Graph Matching with Improved Noise Robustness,"Graph matching, also known as network alignment, refers to finding a
bijection between the vertex sets of two given graphs so as to maximally align
their edges. This fundamental computational problem arises frequently in
multiple fields such as computer vision and biology. Recently, there has been a
plethora of work studying efficient algorithms for graph matching under
probabilistic models. In this work, we propose a new algorithm for graph
matching: Our algorithm associates each vertex with a signature vector using a
multistage procedure and then matches a pair of vertices from the two graphs if
their signature vectors are close to each other. We show that, for two
Erd\H{o}s--R\'enyi graphs with edge correlation $1-\alpha$, our algorithm
recovers the underlying matching exactly with high probability when $\alpha \le
1 / (\log \log n)^C$, where $n$ is the number of vertices in each graph and $C$
denotes a positive universal constant. This improves the condition $\alpha \le
1 / (\log n)^C$ achieved in previous work.","['Cheng Mao', 'Mark Rudelson', 'Konstantin Tikhomirov']","['cs.DS', 'math.PR', 'math.ST', 'stat.ML', 'stat.TH']",2021-01-28 02:39:27+00:00
http://arxiv.org/abs/2101.11769v2,Learning Matching Representations for Individualized Organ Transplantation Allocation,"Organ transplantation is often the last resort for treating end-stage
illness, but the probability of a successful transplantation depends greatly on
compatibility between donors and recipients. Current medical practice relies on
coarse rules for donor-recipient matching, but is short of domain knowledge
regarding the complex factors underlying organ compatibility. In this paper, we
formulate the problem of learning data-driven rules for organ matching using
observational data for organ allocations and transplant outcomes. This problem
departs from the standard supervised learning setup in that it involves
matching the two feature spaces (i.e., donors and recipients), and requires
estimating transplant outcomes under counterfactual matches not observed in the
data. To address these problems, we propose a model based on representation
learning to predict donor-recipient compatibility; our model learns
representations that cluster donor features, and applies donor-invariant
transformations to recipient features to predict outcomes for a given
donor-recipient feature instance. Experiments on semi-synthetic and real-world
datasets show that our model outperforms state-of-art allocation methods and
policies executed by human experts.","['Can Xu', 'Ahmed M. Alaa', 'Ioana Bica', 'Brent D. Ershoff', 'Maxime Cannesson', 'Mihaela van der Schaar']","['stat.ML', 'cs.LG']",2021-01-28 01:33:21+00:00
http://arxiv.org/abs/2101.11688v2,Hadamard Extensions and the Identification of Mixtures of Product Distributions,"The Hadamard Extension of a matrix is the matrix consisting of all Hadamard
products of subsets of its rows. This construction arises in the context of
identifying a mixture of product distributions on binary random variables: full
column rank of such extensions is a necessary ingredient of identification
algorithms. We provide several results concerning when a Hadamard Extension has
full column rank.","['Spencer L. Gordon', 'Leonard J. Schulman']","['cs.LG', 'eess.SP', 'stat.ML', '68W40, 62F99', 'F.2; G.3']",2021-01-27 21:07:54+00:00
http://arxiv.org/abs/2101.11665v2,On Statistical Bias In Active Learning: How and When To Fix It,"Active learning is a powerful tool when labelling data is expensive, but it
introduces a bias because the training data no longer follows the population
distribution. We formalize this bias and investigate the situations in which it
can be harmful and sometimes even helpful. We further introduce novel
corrective weights to remove bias when doing so is beneficial. Through this,
our work not only provides a useful mechanism that can improve the active
learning approach, but also an explanation of the empirical successes of
various existing approaches which ignore this bias. In particular, we show that
this bias can be actively helpful when training overparameterized models --
like neural networks -- with relatively little data.","['Sebastian Farquhar', 'Yarin Gal', 'Tom Rainforth']","['stat.ML', 'cs.LG']",2021-01-27 19:52:24+00:00
http://arxiv.org/abs/2101.11552v1,Efficient Graph Deep Learning in TensorFlow with tf_geometric,"We introduce tf_geometric, an efficient and friendly library for graph deep
learning, which is compatible with both TensorFlow 1.x and 2.x. tf_geometric
provides kernel libraries for building Graph Neural Networks (GNNs) as well as
implementations of popular GNNs. The kernel libraries consist of
infrastructures for building efficient GNNs, including graph data structures,
graph map-reduce framework, graph mini-batch strategy, etc. These
infrastructures enable tf_geometric to support single-graph computation,
multi-graph computation, graph mini-batch, distributed training, etc.;
therefore, tf_geometric can be used for a variety of graph deep learning tasks,
such as transductive node classification, inductive node classification, link
prediction, and graph classification. Based on the kernel libraries,
tf_geometric implements a variety of popular GNN models for different tasks. To
facilitate the implementation of GNNs, tf_geometric also provides some other
libraries for dataset management, graph sampling, etc. Different from existing
popular GNN libraries, tf_geometric provides not only Object-Oriented
Programming (OOP) APIs, but also Functional APIs, which enable tf_geometric to
handle advanced graph deep learning tasks such as graph meta-learning. The APIs
of tf_geometric are friendly, and they are suitable for both beginners and
experts. In this paper, we first present an overview of tf_geometric's
framework. Then, we conduct experiments on some benchmark datasets and report
the performance of several popular GNN models implemented by tf_geometric.","['Jun Hu', 'Shengsheng Qian', 'Quan Fang', 'Youze Wang', 'Quan Zhao', 'Huaiwen Zhang', 'Changsheng Xu']","['cs.LG', 'stat.ML']",2021-01-27 17:16:36+00:00
http://arxiv.org/abs/2101.11520v2,Supervised Tree-Wasserstein Distance,"To measure the similarity of documents, the Wasserstein distance is a
powerful tool, but it requires a high computational cost. Recently, for fast
computation of the Wasserstein distance, methods for approximating the
Wasserstein distance using a tree metric have been proposed. These tree-based
methods allow fast comparisons of a large number of documents; however, they
are unsupervised and do not learn task-specific distances. In this work, we
propose the Supervised Tree-Wasserstein (STW) distance, a fast, supervised
metric learning method based on the tree metric. Specifically, we rewrite the
Wasserstein distance on the tree metric by the parent-child relationships of a
tree and formulate it as a continuous optimization problem using a contrastive
loss. Experimentally, we show that the STW distance can be computed fast, and
improves the accuracy of document classification tasks. Furthermore, the STW
distance is formulated by matrix multiplications, runs on a GPU, and is
suitable for batch processing. Therefore, we show that the STW distance is
extremely efficient when comparing a large number of documents.","['Yuki Takezawa', 'Ryoma Sato', 'Makoto Yamada']","['cs.LG', 'stat.ML']",2021-01-27 16:24:51+00:00
http://arxiv.org/abs/2101.11482v1,Deriving the Traveler Behavior Information from Social Media: A Case Study in Manhattan with Twitter,"Social media platforms, such as Twitter, provide a totally new perspective in
dealing with the traffic problems and is anticipated to complement the
traditional methods. The geo-tagged tweets can provide the Twitter users'
location information and is being applied in traveler behavior analysis. This
paper explores the full potentials of Twitter in deriving travel behavior
information and conducts a case study in Manhattan Area. A systematic method is
proposed to extract displacement information from Twitter locations. Our study
shows that Twitter has a unique demographics which combine not only local
residents but also the tourists or passengers. For individual user, Twitter can
uncover his/her travel behavior features including the time-of-day and location
distributions on both weekdays and weekends. For all Twitter users, the
aggregated travel behavior results also show that the time-of-day travel
patterns in Manhattan Island resemble that of the traffic flow; the
identification of OD pattern is also promising by comparing with the results of
travel survey.",['Zhenhua Zhang'],"['cs.SI', 'cs.NA', 'math.NA', 'stat.ML']",2021-01-27 15:19:50+00:00
http://arxiv.org/abs/2101.11453v2,Meta Adversarial Training against Universal Patches,"Recently demonstrated physical-world adversarial attacks have exposed
vulnerabilities in perception systems that pose severe risks for
safety-critical applications such as autonomous driving. These attacks place
adversarial artifacts in the physical world that indirectly cause the addition
of a universal patch to inputs of a model that can fool it in a variety of
contexts. Adversarial training is the most effective defense against
image-dependent adversarial attacks. However, tailoring adversarial training to
universal patches is computationally expensive since the optimal universal
patch depends on the model weights which change during training. We propose
meta adversarial training (MAT), a novel combination of adversarial training
with meta-learning, which overcomes this challenge by meta-learning universal
patches along with model training. MAT requires little extra computation while
continuously adapting a large set of patches to the current model. MAT
considerably increases robustness against universal patch attacks on image
classification and traffic-light detection.","['Jan Hendrik Metzen', 'Nicole Finnie', 'Robin Hutmacher']","['cs.LG', 'cs.AI', 'cs.CV', 'stat.ML']",2021-01-27 14:36:23+00:00
http://arxiv.org/abs/2101.11410v2,Reproducing kernel Hilbert C*-module and kernel mean embeddings,"Kernel methods have been among the most popular techniques in machine
learning, where learning tasks are solved using the property of reproducing
kernel Hilbert space (RKHS). In this paper, we propose a novel data analysis
framework with reproducing kernel Hilbert $C^*$-module (RKHM) and kernel mean
embedding (KME) in RKHM. Since RKHM contains richer information than RKHS or
vector-valued RKHS (vvRKHS), analysis with RKHM enables us to capture and
extract structural properties in such as functional data. We show a branch of
theories for RKHM to apply to data analysis, including the representer theorem,
and the injectivity and universality of the proposed KME. We also show RKHM
generalizes RKHS and vvRKHS. Then, we provide concrete procedures for employing
RKHM and the proposed KME to data analysis.","['Yuka Hashimoto', 'Isao Ishikawa', 'Masahiro Ikeda', 'Fuyuta Komura', 'Takeshi Katsura', 'Yoshinobu Kawahara']","['stat.ML', 'cs.LG', 'math.OA']",2021-01-27 14:02:18+00:00
http://arxiv.org/abs/2101.11347v6,Decision Machines: Enhanced Decision Trees,"This paper presents Decision Machines (DMs), an innovative evolution of
traditional binary decision trees, which leverages matrix computations to
significantly enhance both computational efficiency and interpretability. By
explicitly mapping the dependencies between predictions and binary tests within
a vector space, DMs offer a streamlined approach to navigating decision paths.
We integrate decision trees with kernel methods, ensemble methods and attention
mechanisms. The integration of these elements not only bolsters the
hierarchical structure of decision trees but also aligns with the computational
efficiency of matrix computations. Our work bridges the gap between traditional
machine learning algorithms and modern deep learning techniques, providing a
novel foundation for further research and application in the field of machine
learning.",['Jinxiong Zhang'],"['cs.LG', 'math.OC', 'stat.ML']",2021-01-27 12:23:24+00:00
http://arxiv.org/abs/2101.11286v1,A Note on the Representation Power of GHHs,"In this note we prove a sharp lower bound on the necessary number of nestings
of nested absolute-value functions of generalized hinging hyperplanes (GHH) to
represent arbitrary CPWL functions. Previous upper bound states that $n+1$
nestings is sufficient for GHH to achieve universal representation power, but
the corresponding lower bound was unknown. We prove that $n$ nestings is
necessary for universal representation power, which provides an almost tight
lower bound. We also show that one-hidden-layer neural networks don't have
universal approximation power over the whole domain. The analysis is based on a
key lemma showing that any finite sum of periodic functions is either
non-integrable or the zero function, which might be of independent interest.",['Zhou Lu'],"['cs.LG', 'cs.IT', 'math.IT', 'stat.ML']",2021-01-27 09:46:37+00:00
http://arxiv.org/abs/2101.11256v1,Partition of unity networks: deep hp-approximation,"Approximation theorists have established best-in-class optimal approximation
rates of deep neural networks by utilizing their ability to simultaneously
emulate partitions of unity and monomials. Motivated by this, we propose
partition of unity networks (POUnets) which incorporate these elements directly
into the architecture. Classification architectures of the type used to learn
probability measures are used to build a meshfree partition of space, while
polynomial spaces with learnable coefficients are associated to each partition.
The resulting hp-element-like approximation allows use of a fast least-squares
optimizer, and the resulting architecture size need not scale exponentially
with spatial dimension, breaking the curse of dimensionality. An abstract
approximation result establishes desirable properties to guide network design.
Numerical results for two choices of architecture demonstrate that POUnets
yield hp-convergence for smooth functions and consistently outperform MLPs for
piecewise polynomial functions with large numbers of discontinuities.","['Kookjin Lee', 'Nathaniel A. Trask', 'Ravi G. Patel', 'Mamikon A. Gulian', 'Eric C. Cyr']","['cs.LG', 'cs.NA', 'math.NA', 'stat.ML']",2021-01-27 08:26:11+00:00
http://arxiv.org/abs/2101.11201v1,Similarity of Classification Tasks,"Recent advances in meta-learning has led to remarkable performances on
several few-shot learning benchmarks. However, such success often ignores the
similarity between training and testing tasks, resulting in a potential bias
evaluation. We, therefore, propose a generative approach based on a variant of
Latent Dirichlet Allocation to analyse task similarity to optimise and better
understand the performance of meta-learning. We demonstrate that the proposed
method can provide an insightful evaluation for meta-learning algorithms on two
few-shot classification benchmarks that matches common intuition: the more
similar the higher performance. Based on this similarity measure, we propose a
task-selection strategy for meta-learning and show that it can produce more
accurate classification results than methods that randomly select training
tasks.","['Cuong Nguyen', 'Thanh-Toan Do', 'Gustavo Carneiro']","['cs.LG', 'stat.ML']",2021-01-27 04:37:34+00:00
