id,title,abstract,authors,categories,date
http://arxiv.org/abs/1904.04204v2,Classification of pulsars with Dirichlet process Gaussian mixture model,"Young isolated neutron stars (INS) most commonly manifest themselves as
rotationally powered pulsars (RPPs) which involve conventional radio pulsars as
well as gamma-ray pulsars (GRPs) and rotating radio transients (RRATs). Some
other young INS families manifest themselves as anomalous X-ray pulsars (AXPs)
and soft gamma-ray repeaters (SGRs) which are commonly accepted as magnetars,
i.e. magnetically powered neutron stars with decaying superstrong fields. Yet
some other young INS are identified as central compact objects (CCOs) and X-ray
dim isolated neutron stars (XDINSs) which are cooling objects powered by their
thermal energy. Older pulsars, as a result of a previous long episode of
accretion from a companion, manifest themselves as millisecond pulsars and more
commonly appear in binary systems. We use Dirichlet process Gaussian mixture
model (DPGMM), an unsupervised machine learning algorithm, for analyzing the
distribution of these pulsar families in the parameter space of period and
period derivative. We compare the average values of the characteristic age,
magnetic dipole field strength, surface temperature and transverse velocity of
all discovered clusters. We verify that DPGMM is robust and provides hints for
inferring relations between different classes of pulsars. We discuss the
implications of our findings for the magneto-thermal spin evolution models and
fallback discs.","['F. Ay', 'G. İnce', 'M. E. Kamaşak', 'K. Y. Ekşi']","['astro-ph.HE', 'cs.LG', 'stat.ML']",2019-04-08 17:23:35+00:00
http://arxiv.org/abs/1904.04203v1,Characterizing the Social Interactions in the Artificial Bee Colony Algorithm,"Computational swarm intelligence consists of multiple artificial simple
agents exchanging information while exploring a search space. Despite a rich
literature in the field, with works improving old approaches and proposing new
ones, the mechanism by which complex behavior emerges in these systems is still
not well understood. This literature gap hinders the researchers' ability to
deal with known problems in swarms intelligence such as premature convergence,
and the balance of coordination and diversity among agents. Recent advances in
the literature, however, have proposed to study these systems via the network
that emerges from the social interactions within the swarm (i.e., the
interaction network). In our work, we propose a definition of the interaction
network for the Artificial Bee Colony (ABC) algorithm. With our approach, we
captured striking idiosyncrasies of the algorithm. We uncovered the different
patterns of social interactions that emerge from each type of bee, revealing
the importance of the bees variations throughout the iterations of the
algorithm. We found that ABC exhibits a dynamic information flow through the
use of different bees but lacks continuous coordination between the agents.","['Lydia Taw', 'Nishant Gurrapadi', 'Mariana Macedo', 'Marcos Oliveira', 'Diego Pinheiro', 'Carmelo Bastos-Filho', 'Ronaldo Menezes']","['cs.NE', 'cs.SI', 'stat.ML']",2019-04-08 17:21:14+00:00
http://arxiv.org/abs/1904.04161v1,Audio Source Separation via Multi-Scale Learning with Dilated Dense U-Nets,"Modern audio source separation techniques rely on optimizing sequence model
architectures such as, 1D-CNNs, on mixture recordings to generalize well to
unseen mixtures. Specifically, recent focus is on time-domain based
architectures such as Wave-U-Net which exploit temporal context by extracting
multi-scale features. However, the optimality of the feature extraction process
in these architectures has not been well investigated. In this paper, we
examine and recommend critical architectural changes that forge an optimal
multi-scale feature extraction process. To this end, we replace regular $1-$D
convolutions with adaptive dilated convolutions that have innate capability of
capturing increased context by using large temporal receptive fields. We also
investigate the impact of dense connections on the extraction process that
encourage feature reuse and better gradient flow. The dense connections between
the downsampling and upsampling paths of a U-Net architecture capture
multi-resolution information leading to improved temporal modelling. We
evaluate the proposed approaches on the MUSDB test dataset. In addition to
providing an improved performance over the state-of-the-art, we also provide
insights on the impact of different architectural choices on complex
data-driven solutions for source separation.","['Vivek Sivaraman Narayanaswamy', 'Sameeksha Katoch', 'Jayaraman J. Thiagarajan', 'Huan Song', 'Andreas Spanias']","['cs.LG', 'cs.SD', 'eess.AS', 'stat.ML']",2019-04-08 16:13:16+00:00
http://arxiv.org/abs/1904.04154v1,Bayesian Neural Networks at Finite Temperature,"We recapitulate the Bayesian formulation of neural network based classifiers
and show that, while sampling from the posterior does indeed lead to better
generalisation than is obtained by standard optimisation of the cost function,
even better performance can in general be achieved by sampling finite
temperature ($T$) distributions derived from the posterior. Taking the example
of two different deep (3 hidden layers) classifiers for MNIST data, we find
quite different $T$ values to be appropriate in each case. In particular, for a
typical neural network classifier a clear minimum of the test error is observed
at $T>0$. This suggests an early stopping criterion for full batch simulated
annealing: cool until the average validation error starts to increase, then
revert to the parameters with the lowest validation error. As $T$ is increased
classifiers transition from accurate classifiers to classifiers that have
higher training error than assigning equal probability to each class. Efficient
studies of these temperature-induced effects are enabled using a
replica-exchange Hamiltonian Monte Carlo simulation technique. Finally, we show
how thermodynamic integration can be used to perform model selection for deep
neural networks. Similar to the Laplace approximation, this approach assumes
that the posterior is dominated by a single mode. Crucially, however, no
assumption is made about the shape of that mode and it is not required to
precisely compute and invert the Hessian.","['Robert J. N. Baldock', 'Nicola Marzari']","['stat.ML', 'cond-mat.dis-nn', 'cs.LG']",2019-04-08 16:06:13+00:00
http://arxiv.org/abs/1904.04153v1,AutoSeM: Automatic Task Selection and Mixing in Multi-Task Learning,"Multi-task learning (MTL) has achieved success over a wide range of problems,
where the goal is to improve the performance of a primary task using a set of
relevant auxiliary tasks. However, when the usefulness of the auxiliary tasks
w.r.t. the primary task is not known a priori, the success of MTL models
depends on the correct choice of these auxiliary tasks and also a balanced
mixing ratio of these tasks during alternate training. These two problems could
be resolved via manual intuition or hyper-parameter tuning over all
combinatorial task choices, but this introduces inductive bias or is not
scalable when the number of candidate auxiliary tasks is very large. To address
these issues, we present AutoSeM, a two-stage MTL pipeline, where the first
stage automatically selects the most useful auxiliary tasks via a
Beta-Bernoulli multi-armed bandit with Thompson Sampling, and the second stage
learns the training mixing ratio of these selected auxiliary tasks via a
Gaussian Process based Bayesian optimization framework. We conduct several MTL
experiments on the GLUE language understanding tasks, and show that our AutoSeM
framework can successfully find relevant auxiliary tasks and automatically
learn their mixing ratio, achieving significant performance boosts on several
primary tasks. Finally, we present ablations for each stage of AutoSeM and
analyze the learned auxiliary task choices.","['Han Guo', 'Ramakanth Pasunuru', 'Mohit Bansal']","['cs.CL', 'cs.LG', 'stat.ML']",2019-04-08 16:05:43+00:00
http://arxiv.org/abs/1904.04123v2,"ASAP: Architecture Search, Anneal and Prune","Automatic methods for Neural Architecture Search (NAS) have been shown to
produce state-of-the-art network models. Yet, their main drawback is the
computational complexity of the search process. As some primal methods
optimized over a discrete search space, thousands of days of GPU were required
for convergence. A recent approach is based on constructing a differentiable
search space that enables gradient-based optimization, which reduces the search
time to a few days. While successful, it still includes some noncontinuous
steps, e.g., the pruning of many weak connections at once. In this paper, we
propose a differentiable search space that allows the annealing of architecture
weights, while gradually pruning inferior operations. In this way, the search
converges to a single output network in a continuous manner. Experiments on
several vision datasets demonstrate the effectiveness of our method with
respect to the search cost and accuracy of the achieved model. Specifically,
with $0.2$ GPU search days we achieve an error rate of $1.68\%$ on CIFAR-10.","['Asaf Noy', 'Niv Nayman', 'Tal Ridnik', 'Nadav Zamir', 'Sivan Doveh', 'Itamar Friedman', 'Raja Giryes', 'Lihi Zelnik-Manor']","['stat.ML', 'cs.LG']",2019-04-08 15:16:16+00:00
http://arxiv.org/abs/1904.04088v1,Large Margin Multi-modal Multi-task Feature Extraction for Image Classification,"The features used in many image analysis-based applications are frequently of
very high dimension. Feature extraction offers several advantages in
high-dimensional cases, and many recent studies have used multi-task feature
extraction approaches, which often outperform single-task feature extraction
approaches. However, most of these methods are limited in that they only
consider data represented by a single type of feature, even though features
usually represent images from multiple modalities. We therefore propose a novel
large margin multi-modal multi-task feature extraction (LM3FE) framework for
handling multi-modal features for image classification. In particular, LM3FE
simultaneously learns the feature extraction matrix for each modality and the
modality combination coefficients. In this way, LM3FE not only handles
correlated and noisy features, but also utilizes the complementarity of
different modalities to further help reduce feature redundancy in each
modality. The large margin principle employed also helps to extract strongly
predictive features so that they are more suitable for prediction (e.g.,
classification). An alternating algorithm is developed for problem optimization
and each sub-problem can be efficiently solved. Experiments on two challenging
real-world image datasets demonstrate the effectiveness and superiority of the
proposed method.","['Yong Luo', 'Yonggang Wen', 'Dacheng Tao', 'Jie Gui', 'Chao Xu']","['stat.ML', 'cs.CV', 'cs.LG']",2019-04-08 14:14:19+00:00
http://arxiv.org/abs/1904.04081v1,Heterogeneous Multi-task Metric Learning across Multiple Domains,"Distance metric learning (DML) plays a crucial role in diverse machine
learning algorithms and applications. When the labeled information in target
domain is limited, transfer metric learning (TML) helps to learn the metric by
leveraging the sufficient information from other related domains. Multi-task
metric learning (MTML), which can be regarded as a special case of TML,
performs transfer across all related domains. Current TML tools usually assume
that the same feature representation is exploited for different domains.
However, in real-world applications, data may be drawn from heterogeneous
domains. Heterogeneous transfer learning approaches can be adopted to remedy
this drawback by deriving a metric from the learned transformation across
different domains. But they are often limited in that only two domains can be
handled. To appropriately handle multiple domains, we develop a novel
heterogeneous multi-task metric learning (HMTML) framework. In HMTML, the
metrics of all different domains are learned together. The transformations
derived from the metrics are utilized to induce a common subspace, and the
high-order covariance among the predictive structures of these domains is
maximized in this subspace. There do exist a few heterogeneous transfer
learning approaches that deal with multiple domains, but the high-order
statistics (correlation information), which can only be exploited by
simultaneously examining all domains, is ignored in these approaches. Compared
with them, the proposed HMTML can effectively explore such high-order
information, thus obtaining more reliable feature transformations and metrics.
Effectiveness of our method is validated by the extensive and intensive
experiments on text categorization, scene classification, and social image
annotation.","['Yong Luo', 'Yonggang Wen', 'Dacheng Tao']","['stat.ML', 'cs.LG']",2019-04-08 13:59:36+00:00
http://arxiv.org/abs/1904.04061v1,Transferring Knowledge Fragments for Learning Distance Metric from A Heterogeneous Domain,"The goal of transfer learning is to improve the performance of target
learning task by leveraging information (or transferring knowledge) from other
related tasks. In this paper, we examine the problem of transfer distance
metric learning (DML), which usually aims to mitigate the label information
deficiency issue in the target DML. Most of the current Transfer DML (TDML)
methods are not applicable to the scenario where data are drawn from
heterogeneous domains. Some existing heterogeneous transfer learning (HTL)
approaches can learn target distance metric by usually transforming the samples
of source and target domain into a common subspace. However, these approaches
lack flexibility in real-world applications, and the learned transformations
are often restricted to be linear. This motivates us to develop a general
flexible heterogeneous TDML (HTDML) framework. In particular, any
(linear/nonlinear) DML algorithms can be employed to learn the source metric
beforehand. Then the pre-learned source metric is represented as a set of
knowledge fragments to help target metric learning. We show how generalization
error in the target domain could be reduced using the proposed transfer
strategy, and develop novel algorithm to learn either linear or nonlinear
target metric. Extensive experiments on various applications demonstrate the
effectiveness of the proposed method.","['Yong Luo', 'Yonggang Wen', 'Tongliang Liu', 'Dacheng Tao']","['stat.ML', 'cs.CV', 'cs.LG']",2019-04-08 13:44:22+00:00
http://arxiv.org/abs/1904.04025v5,Only Relevant Information Matters: Filtering Out Noisy Samples to Boost RL,"In reinforcement learning, policy gradient algorithms optimize the policy
directly and rely on sampling efficiently an environment. Nevertheless, while
most sampling procedures are based on direct policy sampling, self-performance
measures could be used to improve such sampling prior to each policy update.
Following this line of thought, we introduce SAUNA, a method where
non-informative transitions are rejected from the gradient update. The level of
information is estimated according to the fraction of variance explained by the
value function: a measure of the discrepancy between V and the empirical
returns. In this work, we use this metric to select samples that are useful to
learn from, and we demonstrate that this selection can significantly improve
the performance of policy gradient methods. In this paper: (a) We define
SAUNA's metric and introduce its method to filter transitions. (b) We conduct
experiments on a set of benchmark continuous control problems. SAUNA
significantly improves performance. (c) We investigate how SAUNA reliably
selects samples with the most positive impact on learning and study its
improvement on both performance and sample efficiency.","['Yannis Flet-Berliac', 'Philippe Preux']","['cs.LG', 'stat.ML']",2019-04-08 12:53:12+00:00
http://arxiv.org/abs/1904.04020v1,CRAD: Clustering with Robust Autocuts and Depth,"We develop a new density-based clustering algorithm named CRAD which is based
on a new neighbor searching function with a robust data depth as the
dissimilarity measure. Our experiments prove that the new CRAD is highly
competitive at detecting clusters with varying densities, compared with the
existing algorithms such as DBSCAN, OPTICS and DBCA. Furthermore, a new
effective parameter selection procedure is developed to select the optimal
underlying parameter in the real-world clustering, when the ground truth is
unknown. Lastly, we suggest a new clustering framework that extends CRAD from
spatial data clustering to time series clustering without a-priori knowledge of
the true number of clusters. The performance of CRAD is evaluated through
extensive experimental studies.","['Xin Huang', 'Yulia R. Gel']","['stat.CO', 'stat.ML', '91Cxx']",2019-04-08 12:49:45+00:00
http://arxiv.org/abs/1904.03971v2,Jointly Measuring Diversity and Quality in Text Generation Models,"Text generation is an important Natural Language Processing task with various
applications. Although several metrics have already been introduced to evaluate
the text generation methods, each of them has its own shortcomings. The most
widely used metrics such as BLEU only consider the quality of generated
sentences and neglect their diversity. For example, repeatedly generation of
only one high quality sentence would result in a high BLEU score. On the other
hand, the more recent metric introduced to evaluate the diversity of generated
texts known as Self-BLEU ignores the quality of generated texts. In this paper,
we propose metrics to evaluate both the quality and diversity simultaneously by
approximating the distance of the learned generative model and the real data
distribution. For this purpose, we first introduce a metric that approximates
this distance using n-gram based measures. Then, a feature-based measure which
is based on a recent highly deep model trained on a large text corpus called
BERT is introduced. Finally, for oracle training mode in which the generator's
density can also be calculated, we propose to use the distance measures between
the corresponding explicit distributions. Eventually, the most popular and
recent text generation models are evaluated using both the existing and the
proposed metrics and the preferences of the proposed metrics are determined.","['Ehsan Montahaei', 'Danial Alihosseini', 'Mahdieh Soleymani Baghshah']","['cs.LG', 'cs.CL', 'stat.ML']",2019-04-08 11:44:41+00:00
http://arxiv.org/abs/1904.03959v4,"Sampling, Intervention, Prediction, Aggregation: A Generalized Framework for Model-Agnostic Interpretations","Model-agnostic interpretation techniques allow us to explain the behavior of
any predictive model. Due to different notations and terminology, it is
difficult to see how they are related. A unified view on these methods has been
missing. We present the generalized SIPA (sampling, intervention, prediction,
aggregation) framework of work stages for model-agnostic interpretations and
demonstrate how several prominent methods for feature effects can be embedded
into the proposed framework. Furthermore, we extend the framework to feature
importance computations by pointing out how variance-based and
performance-based importance measures are based on the same work stages. The
SIPA framework reduces the diverse set of model-agnostic techniques to a single
methodology and establishes a common terminology to discuss them in future
work.","['Christian A. Scholbeck', 'Christoph Molnar', 'Christian Heumann', 'Bernd Bischl', 'Giuseppe Casalicchio']","['cs.LG', 'stat.ML']",2019-04-08 11:20:04+00:00
http://arxiv.org/abs/1904.03953v1,Feature Learning Viewpoint of AdaBoost and a New Algorithm,"The AdaBoost algorithm has the superiority of resisting overfitting.
Understanding the mysteries of this phenomena is a very fascinating fundamental
theoretical problem. Many studies are devoted to explaining it from statistical
view and margin theory. In this paper, we illustrate it from feature learning
viewpoint, and propose the AdaBoost+SVM algorithm, which can explain the
resistant to overfitting of AdaBoost directly and easily to understand.
Firstly, we adopt the AdaBoost algorithm to learn the base classifiers. Then,
instead of directly weighted combination the base classifiers, we regard them
as features and input them to SVM classifier. With this, the new coefficient
and bias can be obtained, which can be used to construct the final classifier.
We explain the rationality of this and illustrate the theorem that when the
dimension of these features increases, the performance of SVM would not be
worse, which can explain the resistant to overfitting of AdaBoost.","['Fei Wang', 'Zhongheng Li', 'Fang He', 'Rong Wang', 'Weizhong Yu', 'Feiping Nie']","['cs.LG', 'stat.ML']",2019-04-08 11:07:50+00:00
http://arxiv.org/abs/1904.03943v1,Component-Wise Boosting of Targets for Multi-Output Prediction,"Multi-output prediction deals with the prediction of several targets of
possibly diverse types. One way to address this problem is the so called
problem transformation method. This method is often used in multi-label
learning, but can also be used for multi-output prediction due to its
generality and simplicity. In this paper, we introduce an algorithm that uses
the problem transformation method for multi-output prediction, while
simultaneously learning the dependencies between target variables in a sparse
and interpretable manner. In a first step, predictions are obtained for each
target individually. Target dependencies are then learned via a component-wise
boosting approach. We compare our new method with similar approaches in a
benchmark using multi-label, multivariate regression and mixed-type datasets.","['Quay Au', 'Daniel Schalk', 'Giuseppe Casalicchio', 'Ramona Schoedel', 'Clemens Stachl', 'Bernd Bischl']","['stat.ML', 'cs.LG']",2019-04-08 10:48:56+00:00
http://arxiv.org/abs/1904.03936v3,Wasserstein Adversarial Regularization (WAR) on label noise,"Noisy labels often occur in vision datasets, especially when they are
obtained from crowdsourcing or Web scraping. We propose a new regularization
method, which enables learning robust classifiers in presence of noisy data. To
achieve this goal, we propose a new adversarial regularization scheme based on
the Wasserstein distance. Using this distance allows taking into account
specific relations between classes by leveraging the geometric properties of
the labels space. Our Wasserstein Adversarial Regularization (WAR) encodes a
selective regularization, which promotes smoothness of the classifier between
some classes, while preserving sufficient complexity of the decision boundary
between others. We first discuss how and why adversarial regularization can be
used in the context of label noise and then show the effectiveness of our
method on five datasets corrupted with noisy labels: in both benchmarks and
real datasets, WAR outperforms the state-of-the-art competitors.","['Kilian Fatras', 'Bharath Bhushan Damodaran', 'Sylvain Lobry', 'Rémi Flamary', 'Devis Tuia', 'Nicolas Courty']","['cs.LG', 'cs.CV', 'stat.ML']",2019-04-08 10:28:12+00:00
http://arxiv.org/abs/1904.03921v1,Multi-view Vector-valued Manifold Regularization for Multi-label Image Classification,"In computer vision, image datasets used for classification are naturally
associated with multiple labels and comprised of multiple views, because each
image may contain several objects (e.g. pedestrian, bicycle and tree) and is
properly characterized by multiple visual features (e.g. color, texture and
shape). Currently available tools ignore either the label relationship or the
view complementary. Motivated by the success of the vector-valued function that
constructs matrix-valued kernels to explore the multi-label structure in the
output space, we introduce multi-view vector-valued manifold regularization
(MV$\mathbf{^3}$MR) to integrate multiple features. MV$\mathbf{^3}$MR exploits
the complementary property of different features and discovers the intrinsic
local geometry of the compact support shared by different features under the
theme of manifold regularization. We conducted extensive experiments on two
challenging, but popular datasets, PASCAL VOC' 07 (VOC) and MIR Flickr (MIR),
and validated the effectiveness of the proposed MV$\mathbf{^3}$MR for image
classification.","['Yong Luo', 'Dacheng Tao', 'Chang Xu', 'Chao Xu', 'Hong Liu', 'Yonggang Wen']","['stat.ML', 'cs.CV', 'cs.LG']",2019-04-08 09:57:18+00:00
http://arxiv.org/abs/1904.03920v2,A Generalization Bound for Online Variational Inference,"Bayesian inference provides an attractive online-learning framework to
analyze sequential data, and offers generalization guarantees which hold even
with model mismatch and adversaries. Unfortunately, exact Bayesian inference is
rarely feasible in practice and approximation methods are usually employed, but
do such methods preserve the generalization properties of Bayesian inference ?
In this paper, we show that this is indeed the case for some variational
inference (VI) algorithms. We consider a few existing online, tempered VI
algorithms, as well as a new algorithm, and derive their generalization bounds.
Our theoretical result relies on the convexity of the variational objective,
but we argue that the result should hold more generally and present empirical
evidence in support of this. Our work in this paper presents theoretical
justifications in favor of online algorithms relying on approximate Bayesian
methods.","['Badr-Eddine Chérief-Abdellatif', 'Pierre Alquier', 'Mohammad Emtiyaz Khan']","['stat.ML', 'cs.LG', 'math.ST', 'stat.CO', 'stat.TH']",2019-04-08 09:53:25+00:00
