id,title,abstract,authors,categories,date
http://arxiv.org/abs/2104.14033v1,A Study of the Mathematics of Deep Learning,"""Deep Learning""/""Deep Neural Nets"" is a technological marvel that is now
increasingly deployed at the cutting-edge of artificial intelligence tasks.
This dramatic success of deep learning in the last few years has been hinged on
an enormous amount of heuristics and it has turned out to be a serious
mathematical challenge to be able to rigorously explain them. In this thesis,
submitted to the Department of Applied Mathematics and Statistics, Johns
Hopkins University we take several steps towards building strong theoretical
foundations for these new paradigms of deep-learning. In chapter 2 we show new
circuit complexity theorems for deep neural functions and prove classification
theorems about these function spaces which in turn lead to exact algorithms for
empirical risk minimization for depth 2 ReLU nets. We also motivate a measure
of complexity of neural functions to constructively establish the existence of
high-complexity neural functions. In chapter 3 we give the first algorithm
which can train a ReLU gate in the realizable setting in linear time in an
almost distribution free set up. In chapter 4 we give rigorous proofs towards
explaining the phenomenon of autoencoders being able to do sparse-coding. In
chapter 5 we give the first-of-its-kind proofs of convergence for stochastic
and deterministic versions of the widely used adaptive gradient deep-learning
algorithms, RMSProp and ADAM. This chapter also includes a detailed empirical
study on autoencoders of the hyper-parameter values at which modern algorithms
have a significant advantage over classical acceleration based methods. In the
last chapter 6 we give new and improved PAC-Bayesian bounds for the risk of
stochastic neural nets. This chapter also includes an experimental
investigation revealing new geometric properties of the paths in weight space
that are traced out by the net during the training.",['Anirbit Mukherjee'],"['cs.LG', 'math.OC', 'stat.AP', 'stat.ML']",2021-04-28 22:05:54+00:00
http://arxiv.org/abs/2104.14014v1,Algorithmic Factors Influencing Bias in Machine Learning,"It is fair to say that many of the prominent examples of bias in Machine
Learning (ML) arise from bias that is there in the training data. In fact, some
would argue that supervised ML algorithms cannot be biased, they reflect the
data on which they are trained. In this paper we demonstrate how ML algorithms
can misrepresent the training data through underestimation. We show how
irreducible error, regularization and feature and class imbalance can
contribute to this underestimation. The paper concludes with a demonstration of
how the careful management of synthetic counterfactuals can ameliorate the
impact of this underestimation bias.","['William Blanzeisky', 'Pádraig Cunningham']","['cs.LG', 'stat.ML']",2021-04-28 20:45:41+00:00
http://arxiv.org/abs/2104.14012v1,Simplified Kalman filter for online rating: one-fits-all approach,"In this work, we deal with the problem of rating in sports, where the skills
of the players/teams are inferred from the observed outcomes of the games. Our
focus is on the online rating algorithms which estimate the skills after each
new game by exploiting the probabilistic models of the relationship between the
skills and the game outcome. We propose a Bayesian approach which may be seen
as an approximate Kalman filter and which is generic in the sense that it can
be used with any skills-outcome model and can be applied in the individual --
as well as in the group-sports. We show how the well-know algorithms (such as
the Elo, the Glicko, and the TrueSkill algorithms) may be seen as instances of
the one-fits-all approach we propose. In order to clarify the conditions under
which the gains of the Bayesian approach over the simpler solutions can
actually materialize, we critically compare the known and the new algorithms by
means of numerical examples using the synthetic as well as the empirical data.","['Leszek Szczecinski', 'Raphaëlle Tihon']","['stat.ML', 'cs.LG', 'math.ST', 'stat.TH']",2021-04-28 20:44:10+00:00
http://arxiv.org/abs/2104.13881v5,Large Scale Prediction with Decision Trees,"This paper shows that decision trees constructed with Classification and
Regression Trees (CART) and C4.5 methodology are consistent for regression and
classification tasks, even when the number of predictor variables grows
sub-exponentially with the sample size, under natural 0-norm and 1-norm
sparsity constraints. The theory applies to a wide range of models, including
(ordinary or logistic) additive regression models with component functions that
are continuous, of bounded variation, or, more generally, Borel measurable.
Consistency holds for arbitrary joint distributions of the predictor variables,
thereby accommodating continuous, discrete, and/or dependent data. Finally, we
show that these qualitative properties of individual trees are inherited by
Breiman's random forests. A key step in the analysis is the establishment of an
oracle inequality, which allows for a precise characterization of the
goodness-of-fit and complexity tradeoff for a mis-specified model.","['Jason M. Klusowski', 'Peter M. Tian']","['stat.ML', 'cs.LG', 'math.ST', 'stat.TH']",2021-04-28 16:59:03+00:00
http://arxiv.org/abs/2104.13877v1,Autoregressive Dynamics Models for Offline Policy Evaluation and Optimization,"Standard dynamics models for continuous control make use of feedforward
computation to predict the conditional distribution of next state and reward
given current state and action using a multivariate Gaussian with a diagonal
covariance structure. This modeling choice assumes that different dimensions of
the next state and reward are conditionally independent given the current state
and action and may be driven by the fact that fully observable physics-based
simulation environments entail deterministic transition dynamics. In this
paper, we challenge this conditional independence assumption and propose a
family of expressive autoregressive dynamics models that generate different
dimensions of the next state and reward sequentially conditioned on previous
dimensions. We demonstrate that autoregressive dynamics models indeed
outperform standard feedforward models in log-likelihood on heldout
transitions. Furthermore, we compare different model-based and model-free
off-policy evaluation (OPE) methods on RL Unplugged, a suite of offline MuJoCo
datasets, and find that autoregressive dynamics models consistently outperform
all baselines, achieving a new state-of-the-art. Finally, we show that
autoregressive dynamics models are useful for offline policy optimization by
serving as a way to enrich the replay buffer through data augmentation and
improving performance using model-based planning.","['Michael R. Zhang', 'Tom Le Paine', 'Ofir Nachum', 'Cosmin Paduraru', 'George Tucker', 'Ziyu Wang', 'Mohammad Norouzi']","['cs.LG', 'cs.AI', 'stat.ML']",2021-04-28 16:48:44+00:00
http://arxiv.org/abs/2105.00773v2,Approximate Bayesian Computation for an Explicit-Duration Hidden Markov Model of COVID-19 Hospital Trajectories,"We address the problem of modeling constrained hospital resources in the
midst of the COVID-19 pandemic in order to inform decision-makers of future
demand and assess the societal value of possible interventions. For broad
applicability, we focus on the common yet challenging scenario where
patient-level data for a region of interest are not available. Instead, given
daily admissions counts, we model aggregated counts of observed resource use,
such as the number of patients in the general ward, in the intensive care unit,
or on a ventilator. In order to explain how individual patient trajectories
produce these counts, we propose an aggregate count explicit-duration hidden
Markov model, nicknamed the ACED-HMM, with an interpretable, compact
parameterization. We develop an Approximate Bayesian Computation approach that
draws samples from the posterior distribution over the model's transition and
duration parameters given aggregate counts from a specific location, thus
adapting the model to a region or individual hospital site of interest. Samples
from this posterior can then be used to produce future forecasts of any counts
of interest. Using data from the United States and the United Kingdom, we show
our mechanistic approach provides competitive probabilistic forecasts for the
future even as the dynamics of the pandemic shift. Furthermore, we show how our
model provides insight about recovery probabilities or length of stay
distributions, and we suggest its potential to answer challenging what-if
questions about the societal value of possible interventions.","['Gian Marco Visani', 'Alexandra Hope Lee', 'Cuong Nguyen', 'David M. Kent', 'John B. Wong', 'Joshua T. Cohen', 'Michael C. Hughes']","['stat.AP', 'cs.LG', 'stat.ML']",2021-04-28 15:32:42+00:00
http://arxiv.org/abs/2104.13818v2,NUQSGD: Provably Communication-efficient Data-parallel SGD via Nonuniform Quantization,"As the size and complexity of models and datasets grow, so does the need for
communication-efficient variants of stochastic gradient descent that can be
deployed to perform parallel model training. One popular
communication-compression method for data-parallel SGD is QSGD (Alistarh et
al., 2017), which quantizes and encodes gradients to reduce communication
costs. The baseline variant of QSGD provides strong theoretical guarantees,
however, for practical purposes, the authors proposed a heuristic variant which
we call QSGDinf, which demonstrated impressive empirical gains for distributed
training of large neural networks. In this paper, we build on this work to
propose a new gradient quantization scheme, and show that it has both stronger
theoretical guarantees than QSGD, and matches and exceeds the empirical
performance of the QSGDinf heuristic and of other compression methods.","['Ali Ramezani-Kebrya', 'Fartash Faghri', 'Ilya Markov', 'Vitalii Aksenov', 'Dan Alistarh', 'Daniel M. Roy']","['cs.LG', 'math.OC', 'stat.ML']",2021-04-28 15:07:03+00:00
http://arxiv.org/abs/2104.13790v3,FastAdaBelief: Improving Convergence Rate for Belief-based Adaptive Optimizers by Exploiting Strong Convexity,"AdaBelief, one of the current best optimizers, demonstrates superior
generalization ability compared to the popular Adam algorithm by viewing the
exponential moving average of observed gradients. AdaBelief is theoretically
appealing in that it has a data-dependent $O(\sqrt{T})$ regret bound when
objective functions are convex, where $T$ is a time horizon. It remains however
an open problem whether the convergence rate can be further improved without
sacrificing its generalization ability. %on how to exploit strong convexity to
further improve the convergence rate of AdaBelief. To this end, we make a first
attempt in this work and design a novel optimization algorithm called
FastAdaBelief that aims to exploit its strong convexity in order to achieve an
even faster convergence rate. In particular, by adjusting the step size that
better considers strong convexity and prevents fluctuation, our proposed
FastAdaBelief demonstrates excellent generalization ability as well as superior
convergence. As an important theoretical contribution, we prove that
FastAdaBelief attains a data-dependant $O(\log T)$ regret bound, which is
substantially lower than AdaBelief. On the empirical side, we validate our
theoretical analysis with extensive experiments in both scenarios of strong and
non-strong convexity on three popular baseline models. Experimental results are
very encouraging: FastAdaBelief converges the quickest in comparison to all
mainstream algorithms while maintaining an excellent generalization ability, in
cases of both strong or non-strong convexity. FastAdaBelief is thus posited as
a new benchmark model for the research community.","['Yangfan Zhou', 'Kaizhu Huang', 'Cheng Cheng', 'Xuguang Wang', 'Amir Hussain', 'Xin Liu']","['cs.LG', 'stat.ML']",2021-04-28 14:23:37+00:00
http://arxiv.org/abs/2104.13756v1,Distributional Gaussian Process Layers for Outlier Detection in Image Segmentation,"We propose a parameter efficient Bayesian layer for hierarchical
convolutional Gaussian Processes that incorporates Gaussian Processes operating
in Wasserstein-2 space to reliably propagate uncertainty. This directly
replaces convolving Gaussian Processes with a distance-preserving affine
operator on distributions. Our experiments on brain tissue-segmentation show
that the resulting architecture approaches the performance of well-established
deterministic segmentation algorithms (U-Net), which has never been achieved
with previous hierarchical Gaussian Processes. Moreover, by applying the same
segmentation model to out-of-distribution data (i.e., images with pathology
such as brain tumors), we show that our uncertainty estimates result in
out-of-distribution detection that outperforms the capabilities of previous
Bayesian networks and reconstruction-based approaches that learn normative
distributions.","['Sebastian G. Popescu', 'David J. Sharp', 'James H. Cole', 'Konstantinos Kamnitsas', 'Ben Glocker']","['stat.ML', 'cs.LG']",2021-04-28 13:37:10+00:00
http://arxiv.org/abs/2104.13669v4,Optimal Stopping via Randomized Neural Networks,"This paper presents the benefits of using randomized neural networks instead
of standard basis functions or deep neural networks to approximate the
solutions of optimal stopping problems. The key idea is to use neural networks,
where the parameters of the hidden layers are generated randomly and only the
last layer is trained, in order to approximate the continuation value. Our
approaches are applicable to high dimensional problems where the existing
approaches become increasingly impractical. In addition, since our approaches
can be optimized using simple linear regression, they are easy to implement and
theoretical guarantees can be provided. We test our approaches for American
option pricing on Black--Scholes, Heston and rough Heston models and for
optimally stopping a fractional Brownian motion. In all cases, our algorithms
outperform the state-of-the-art and other relevant machine learning approaches
in terms of computation time while achieving comparable results. Moreover, we
show that they can also be used to efficiently compute Greeks of American
options.","['Calypso Herrera', 'Florian Krach', 'Pierre Ruyssen', 'Josef Teichmann']","['stat.ML', 'cs.LG', 'cs.NA', 'math.NA', 'math.PR', 'q-fin.CP', '60G40 (Primary), 68T07 (Secondary)']",2021-04-28 09:47:21+00:00
http://arxiv.org/abs/2104.13662v1,A coding theorem for the rate-distortion-perception function,"The rate-distortion-perception function (RDPF; Blau and Michaeli, 2019) has
emerged as a useful tool for thinking about realism and distortion of
reconstructions in lossy compression. Unlike the rate-distortion function,
however, it is unknown whether encoders and decoders exist that achieve the
rate suggested by the RDPF. Building on results by Li and El Gamal (2018), we
show that the RDPF can indeed be achieved using stochastic, variable-length
codes. For this class of codes, we also prove that the RDPF lower-bounds the
achievable rate","['Lucas Theis', 'Aaron B. Wagner']","['cs.IT', 'math.IT', 'stat.ML']",2021-04-28 09:33:05+00:00
http://arxiv.org/abs/2104.13628v2,Risk Bounds for Over-parameterized Maximum Margin Classification on Sub-Gaussian Mixtures,"Modern machine learning systems such as deep neural networks are often highly
over-parameterized so that they can fit the noisy training data exactly, yet
they can still achieve small test errors in practice. In this paper, we study
this ""benign overfitting"" phenomenon of the maximum margin classifier for
linear classification problems. Specifically, we consider data generated from
sub-Gaussian mixtures, and provide a tight risk bound for the maximum margin
linear classifier in the over-parameterized setting. Our results precisely
characterize the condition under which benign overfitting can occur in linear
classification problems, and improve on previous work. They also have direct
implications for over-parameterized logistic regression.","['Yuan Cao', 'Quanquan Gu', 'Mikhail Belkin']","['cs.LG', 'math.ST', 'stat.ML', 'stat.TH']",2021-04-28 08:25:16+00:00
http://arxiv.org/abs/2104.13626v2,Self-Bounding Majority Vote Learning Algorithms by the Direct Minimization of a Tight PAC-Bayesian C-Bound,"In the PAC-Bayesian literature, the C-Bound refers to an insightful relation
between the risk of a majority vote classifier (under the zero-one loss) and
the first two moments of its margin (i.e., the expected margin and the voters'
diversity). Until now, learning algorithms developed in this framework minimize
the empirical version of the C-Bound, instead of explicit PAC-Bayesian
generalization bounds. In this paper, by directly optimizing PAC-Bayesian
guarantees on the C-Bound, we derive self-bounding majority vote learning
algorithms. Moreover, our algorithms based on gradient descent are scalable and
lead to accurate predictors paired with non-vacuous guarantees.","['Paul Viallard', 'Pascal Germain', 'Amaury Habrard', 'Emilie Morvant']","['stat.ML', 'cs.LG']",2021-04-28 08:23:18+00:00
http://arxiv.org/abs/2104.13621v5,MLDemon: Deployment Monitoring for Machine Learning Systems,"Post-deployment monitoring of ML systems is critical for ensuring
reliability, especially as new user inputs can differ from the training
distribution. Here we propose a novel approach, MLDemon, for ML DEployment
MONitoring. MLDemon integrates both unlabeled data and a small amount of
on-demand labels to produce a real-time estimate of the ML model's current
performance on a given data stream. Subject to budget constraints, MLDemon
decides when to acquire additional, potentially costly, expert supervised
labels to verify the model. On temporal datasets with diverse distribution
drifts and models, MLDemon outperforms existing approaches. Moreover, we
provide theoretical analysis to show that MLDemon is minimax rate optimal for a
broad class of distribution drifts.","['Antonio Ginart', 'Martin Zhang', 'James Zou']","['cs.LG', 'stat.ML']",2021-04-28 07:59:10+00:00
http://arxiv.org/abs/2104.13517v1,Detection of Signal in the Spiked Rectangular Models,"We consider the problem of detecting signals in the rank-one
signal-plus-noise data matrix models that generalize the spiked Wishart
matrices. We show that the principal component analysis can be improved by
pre-transforming the matrix entries if the noise is non-Gaussian. As an
intermediate step, we prove a sharp phase transition of the largest eigenvalues
of spiked rectangular matrices, which extends the Baik-Ben Arous-P\'ech\'e
(BBP) transition. We also propose a hypothesis test to detect the presence of
signal with low computational complexity, based on the linear spectral
statistics, which minimizes the sum of the Type-I and Type-II errors when the
noise is Gaussian.","['Ji Hyung Jung', 'Hye Won Chung', 'Ji Oon Lee']","['math.ST', 'cs.LG', 'math.PR', 'stat.ML', 'stat.TH', '62H25, 62H15, 60B20']",2021-04-28 01:15:45+00:00
http://arxiv.org/abs/2104.13504v1,Learning Fair Canonical Polyadical Decompositions using a Kernel Independence Criterion,"This work proposes to learn fair low-rank tensor decompositions by
regularizing the Canonical Polyadic Decomposition factorization with the kernel
Hilbert-Schmidt independence criterion (KHSIC). It is shown, theoretically and
empirically, that a small KHSIC between a latent factor and the sensitive
features guarantees approximate statistical parity. The proposed algorithm
surpasses the state-of-the-art algorithm, FATR (Zhu et al., 2018), in
controlling the trade-off between fairness and residual fit on synthetic and
real data sets.","['Kevin Kim', 'Alex Gittens']","['cs.LG', 'stat.ML']",2021-04-27 23:16:10+00:00
http://arxiv.org/abs/2104.13479v1,Phenotyping OSA: a time series analysis using fuzzy clustering and persistent homology,"Sleep apnea is a disorder that has serious consequences for the pediatric
population. There has been recent concern that traditional diagnosis of the
disorder using the apnea-hypopnea index may be ineffective in capturing its
multi-faceted outcomes. In this work, we take a first step in addressing this
issue by phenotyping patients using a clustering analysis of airflow time
series. This is approached in three ways: using feature-based fuzzy clustering
in the time and frequency domains, and using persistent homology to study the
signal from a topological perspective. The fuzzy clusters are analyzed in a
novel manner using a Dirichlet regression analysis, while the topological
approach leverages Takens embedding theorem to study the periodicity properties
of the signals.","['Prachi Loliencar', 'Giseon Heo']","['stat.ML', 'cs.LG', 'q-bio.QM']",2021-04-27 21:12:30+00:00
http://arxiv.org/abs/2104.13478v2,"Geometric Deep Learning: Grids, Groups, Graphs, Geodesics, and Gauges","The last decade has witnessed an experimental revolution in data science and
machine learning, epitomised by deep learning methods. Indeed, many
high-dimensional learning tasks previously thought to be beyond reach -- such
as computer vision, playing Go, or protein folding -- are in fact feasible with
appropriate computational scale. Remarkably, the essence of deep learning is
built from two simple algorithmic principles: first, the notion of
representation or feature learning, whereby adapted, often hierarchical,
features capture the appropriate notion of regularity for each task, and
second, learning by local gradient-descent type methods, typically implemented
as backpropagation.
  While learning generic functions in high dimensions is a cursed estimation
problem, most tasks of interest are not generic, and come with essential
pre-defined regularities arising from the underlying low-dimensionality and
structure of the physical world. This text is concerned with exposing these
regularities through unified geometric principles that can be applied
throughout a wide spectrum of applications.
  Such a 'geometric unification' endeavour, in the spirit of Felix Klein's
Erlangen Program, serves a dual purpose: on one hand, it provides a common
mathematical framework to study the most successful neural network
architectures, such as CNNs, RNNs, GNNs, and Transformers. On the other hand,
it gives a constructive procedure to incorporate prior physical knowledge into
neural architectures and provide principled way to build future architectures
yet to be invented.","['Michael M. Bronstein', 'Joan Bruna', 'Taco Cohen', 'Petar Veličković']","['cs.LG', 'cs.AI', 'cs.CG', 'cs.CV', 'stat.ML']",2021-04-27 21:09:51+00:00
http://arxiv.org/abs/2104.13458v2,Robust Classification via Support Vector Machines,"Classification models are very sensitive to data uncertainty, and finding
robust classifiers that are less sensitive to data uncertainty has raised great
interest in the machine learning literature. This paper aims to construct
robust \emph{Support Vector Machine} classifiers under feature data uncertainty
via two probabilistic arguments. The first classifier, \emph{Single
Perturbation}, reduces the local effect of data uncertainty with respect to one
given feature and acts as a local test that could confirm or refute the
presence of significant data uncertainty for that particular feature. The
second classifier, \emph{Extreme Empirical Loss}, aims to reduce the aggregate
effect of data uncertainty with respect to all features, which is possible via
a trade-off between the number of prediction model violations and the size of
these violations. Both methodologies are computationally efficient and our
extensive numerical investigation highlights the advantages and possible
limitations of the two robust classifiers on synthetic and real-life data.","['Vali Asimit', 'Ioannis Kyriakou', 'Simone Santoni', 'Salvatore Scognamiglio', 'Rui Zhu']","['stat.ML', 'cs.LG']",2021-04-27 20:20:12+00:00
http://arxiv.org/abs/2104.13417v1,Towards Fair Federated Learning with Zero-Shot Data Augmentation,"Federated learning has emerged as an important distributed learning paradigm,
where a server aggregates a global model from many client-trained models while
having no access to the client data. Although it is recognized that statistical
heterogeneity of the client local data yields slower global model convergence,
it is less commonly recognized that it also yields a biased federated global
model with a high variance of accuracy across clients. In this work, we aim to
provide federated learning schemes with improved fairness. To tackle this
challenge, we propose a novel federated learning system that employs zero-shot
data augmentation on under-represented data to mitigate statistical
heterogeneity and encourage more uniform accuracy performance across clients in
federated networks. We study two variants of this scheme, Fed-ZDAC (federated
learning with zero-shot data augmentation at the clients) and Fed-ZDAS
(federated learning with zero-shot data augmentation at the server). Empirical
results on a suite of datasets demonstrate the effectiveness of our methods on
simultaneously improving the test accuracy and fairness.","['Weituo Hao', 'Mostafa El-Khamy', 'Jungwon Lee', 'Jianyi Zhang', 'Kevin J Liang', 'Changyou Chen', 'Lawrence Carin']","['cs.CV', 'cs.LG', 'stat.ML']",2021-04-27 18:23:54+00:00
