id,title,abstract,authors,categories,date
http://arxiv.org/abs/1511.05864v3,Fast Saddle-Point Algorithm for Generalized Dantzig Selector and FDR Control with the Ordered l1-Norm,"In this paper we propose a primal-dual proximal extragradient algorithm to
solve the generalized Dantzig selector (GDS) estimation problem, based on a new
convex-concave saddle-point (SP) reformulation. Our new formulation makes it
possible to adopt recent developments in saddle-point optimization, to achieve
the optimal $O(1/k)$ rate of convergence. Compared to the optimal non-SP
algorithms, ours do not require specification of sensitive parameters that
affect algorithm performance or solution quality. We also provide a new
analysis showing a possibility of local acceleration to achieve the rate of
$O(1/k^2)$ in special cases even without strong convexity or strong smoothness.
As an application, we propose a GDS equipped with the ordered $\ell_1$-norm,
showing its false discovery rate control properties in variable selection.
Algorithm performance is compared between ours and other alternatives,
including the linearized ADMM, Nesterov's smoothing, Nemirovski's mirror-prox,
and the accelerated hybrid proximal extragradient techniques.","['Sangkyun Lee', 'Damian Brzyski', 'Malgorzata Bogdan']","['stat.ML', 'math.OC']",2015-11-18 16:29:51+00:00
http://arxiv.org/abs/1511.05837v1,Using Machine Learning to Predict the Outcome of English County twenty over Cricket Matches,"Cricket betting is a multi-billion dollar market. Therefore, there is a
strong incentive for models that can predict the outcomes of games and beat the
odds provided by bookers. The aim of this study was to investigate to what
degree it is possible to predict the outcome of cricket matches. The target
competition was the English twenty over county cricket cup. The original
features alongside engineered features gave rise to more than 500 team and
player statistics. The models were optimized firstly with team features only
and then both team and player features. The performance of the models was
tested over individual seasons from 2009 to 2014 having been trained over
previous season data in each case. The optimal model was a simple prediction
method combined with complex hierarchical features and was shown to
significantly outperform a gambling industry benchmark.","['Stylianos Kampakis', 'William Thomas']","['stat.ML', 'stat.AP']",2015-11-18 15:39:18+00:00
http://arxiv.org/abs/1511.09392v1,Enhancements in statistical spoken language translation by de-normalization of ASR results,"Spoken language translation (SLT) has become very important in an
increasingly globalized world. Machine translation (MT) for automatic speech
recognition (ASR) systems is a major challenge of great interest. This research
investigates that automatic sentence segmentation of speech that is important
for enriching speech recognition output and for aiding downstream language
processing. This article focuses on the automatic sentence segmentation of
speech and improving MT results. We explore the problem of identifying sentence
boundaries in the transcriptions produced by automatic speech recognition
systems in the Polish language. We also experiment with reverse normalization
of the recognized speech samples.","['Agnieszka Wołk', 'Krzysztof Wołk', 'Krzysztof Marasek']","['cs.CL', 'stat.ML']",2015-11-18 15:34:21+00:00
http://arxiv.org/abs/1511.05835v4,Alternative Markov and Causal Properties for Acyclic Directed Mixed Graphs,"We extend Andersson-Madigan-Perlman chain graphs by (i) relaxing the
semidirected acyclity constraint so that only directed cycles are forbidden,
and (ii) allowing up to two edges between any pair of nodes. We introduce
global, and ordered local and pairwise Markov properties for the new models. We
show the equivalence of these properties for strictly positive probability
distributions. We also show that when the random variables are continuous, the
new models can be interpreted as systems of structural equations with
correlated errors. This enables us to adapt Pearl's do-calculus to them.
Finally, we describe an exact algorithm for learning the new models from
observational and interventional data via answer set programming.",['Jose M. Peña'],"['stat.ML', 'cs.AI']",2015-11-18 15:33:57+00:00
http://arxiv.org/abs/1511.06285v1,Harvesting comparable corpora and mining them for equivalent bilingual sentences using statistical classification and analogy- based heuristics,"Parallel sentences are a relatively scarce but extremely useful resource for
many applications including cross-lingual retrieval and statistical machine
translation. This research explores our new methodologies for mining such data
from previously obtained comparable corpora. The task is highly practical since
non-parallel multilingual data exist in far greater quantities than parallel
corpora, but parallel sentences are a much more useful resource. Here we
propose a web crawling method for building subject-aligned comparable corpora
from e.g. Wikipedia dumps and Euronews web page. The improvements in machine
translation are shown on Polish-English language pair for various text domains.
We also tested another method of building parallel corpora based on comparable
corpora data. It lets automatically broad existing corpus of sentences from
subject of corpora based on analogies between them.","['Krzysztof Wołk', 'Emilia Rejmund', 'Krzysztof Marasek']","['cs.CL', 'stat.ML']",2015-11-18 15:26:06+00:00
http://arxiv.org/abs/1511.05741v1,A Random Forest Guided Tour,"The random forest algorithm, proposed by L. Breiman in 2001, has been
extremely successful as a general-purpose classification and regression method.
The approach, which combines several randomized decision trees and aggregates
their predictions by averaging, has shown excellent performance in settings
where the number of variables is much larger than the number of observations.
Moreover, it is versatile enough to be applied to large-scale problems, is
easily adapted to various ad-hoc learning tasks, and returns measures of
variable importance. The present article reviews the most recent theoretical
and methodological developments for random forests. Emphasis is placed on the
mathematical forces driving the algorithm, with special attention given to the
selection of parameters, the resampling mechanism, and variable importance
measures. This review is intended to provide non-experts easy access to the
main ideas.","['Gérard Biau', 'Erwan Scornet']","['math.ST', 'stat.ML', 'stat.TH']",2015-11-18 11:34:43+00:00
http://arxiv.org/abs/1511.05720v1,Online learning in repeated auctions,"Motivated by online advertising auctions, we consider repeated Vickrey
auctions where goods of unknown value are sold sequentially and bidders only
learn (potentially noisy) information about a good's value once it is
purchased. We adopt an online learning approach with bandit feedback to model
this problem and derive bidding strategies for two models: stochastic and
adversarial. In the stochastic model, the observed values of the goods are
random variables centered around the true value of the good. In this case,
logarithmic regret is achievable when competing against well behaved
adversaries. In the adversarial model, the goods need not be identical and we
simply compare our performance against that of the best fixed bid in hindsight.
We show that sublinear regret is also achievable in this case and prove
matching minimax lower bounds. To our knowledge, this is the first complete set
of strategies for bidders participating in auctions of this type.","['Jonathan Weed', 'Vianney Perchet', 'Philippe Rigollet']","['cs.GT', 'cs.LG', 'stat.ML', 'Primary 62L05, secondary 62C20']",2015-11-18 10:17:33+00:00
http://arxiv.org/abs/1511.05706v1,Efficient Output Kernel Learning for Multiple Tasks,"The paradigm of multi-task learning is that one can achieve better
generalization by learning tasks jointly and thus exploiting the similarity
between the tasks rather than learning them independently of each other. While
previously the relationship between tasks had to be user-defined in the form of
an output kernel, recent approaches jointly learn the tasks and the output
kernel. As the output kernel is a positive semidefinite matrix, the resulting
optimization problems are not scalable in the number of tasks as an
eigendecomposition is required in each step. \mbox{Using} the theory of
positive semidefinite kernels we show in this paper that for a certain class of
regularizers on the output kernel, the constraint of being positive
semidefinite can be dropped as it is automatically satisfied for the relaxed
problem. This leads to an unconstrained dual problem which can be solved
efficiently. Experiments on several multi-task and multi-class data sets
illustrate the efficacy of our approach in terms of computational efficiency as
well as generalization performance.","['Pratik Jawanpuria', 'Maksim Lapin', 'Matthias Hein', 'Bernt Schiele']","['stat.ML', 'cs.LG']",2015-11-18 09:37:54+00:00
http://arxiv.org/abs/1511.05680v2,Wishart Mechanism for Differentially Private Principal Components Analysis,"We propose a new input perturbation mechanism for publishing a covariance
matrix to achieve $(\epsilon,0)$-differential privacy. Our mechanism uses a
Wishart distribution to generate matrix noise. In particular, We apply this
mechanism to principal component analysis. Our mechanism is able to keep the
positive semi-definiteness of the published covariance matrix. Thus, our
approach gives rise to a general publishing framework for input perturbation of
a symmetric positive semidefinite matrix. Moreover, compared with the classic
Laplace mechanism, our method has better utility guarantee. To the best of our
knowledge, Wishart mechanism is the best input perturbation approach for
$(\epsilon,0)$-differentially private PCA. We also compare our work with
previous exponential mechanism algorithms in the literature and provide near
optimal bound while having more flexibility and less computational
intractability.","['Wuxuan Jiang', 'Cong Xie', 'Zhihua Zhang']","['cs.CR', 'cs.DS', 'stat.ML']",2015-11-18 07:34:23+00:00
http://arxiv.org/abs/1511.05660v1,Bayesian hypothesis testing for one bit compressed sensing with sensing matrix perturbation,"This letter proposes a low-computational Bayesian algorithm for noisy sparse
recovery in the context of one bit compressed sensing with sensing matrix
perturbation. The proposed algorithm which is called BHT-MLE comprises a sparse
support detector and an amplitude estimator. The support detector utilizes
Bayesian hypothesis test, while the amplitude estimator uses an ML estimator
which is obtained by solving a convex optimization problem. Simulation results
show that BHT-MLE algorithm offers more reconstruction accuracy than that of an
ML estimator (MLE) at a low computational cost.","['H. Zayyani', 'M. Korki', 'F. Marvasti']","['stat.ML', 'cs.IT', 'math.IT']",2015-11-18 05:28:26+00:00
http://arxiv.org/abs/1511.05650v1,Tree-Guided MCMC Inference for Normalized Random Measure Mixture Models,"Normalized random measures (NRMs) provide a broad class of discrete random
measures that are often used as priors for Bayesian nonparametric models.
Dirichlet process is a well-known example of NRMs. Most of posterior inference
methods for NRM mixture models rely on MCMC methods since they are easy to
implement and their convergence is well studied. However, MCMC often suffers
from slow convergence when the acceptance rate is low. Tree-based inference is
an alternative deterministic posterior inference method, where Bayesian
hierarchical clustering (BHC) or incremental Bayesian hierarchical clustering
(IBHC) have been developed for DP or NRM mixture (NRMM) models, respectively.
Although IBHC is a promising method for posterior inference for NRMM models due
to its efficiency and applicability to online inference, its convergence is not
guaranteed since it uses heuristics that simply selects the best solution after
multiple trials are made. In this paper, we present a hybrid inference
algorithm for NRMM models, which combines the merits of both MCMC and IBHC.
Trees built by IBHC outlines partitions of data, which guides
Metropolis-Hastings procedure to employ appropriate proposals. Inheriting the
nature of MCMC, our tree-guided MCMC (tgMCMC) is guaranteed to converge, and
enjoys the fast convergence thanks to the effective proposals guided by trees.
Experiments on both synthetic and real-world datasets demonstrate the benefit
of our method.","['Juho Lee', 'Seungjin Choi']","['stat.ML', 'cs.LG']",2015-11-18 03:16:27+00:00
http://arxiv.org/abs/1511.05634v2,Local entropy as a measure for sampling solutions in Constraint Satisfaction Problems,"We introduce a novel Entropy-driven Monte Carlo (EdMC) strategy to
efficiently sample solutions of random Constraint Satisfaction Problems (CSPs).
First, we extend a recent result that, using a large-deviation analysis, shows
that the geometry of the space of solutions of the Binary Perceptron Learning
Problem (a prototypical CSP), contains regions of very high-density of
solutions. Despite being sub-dominant, these regions can be found by optimizing
a local entropy measure. Building on these results, we construct a fast solver
that relies exclusively on a local entropy estimate, and can be applied to
general CSPs. We describe its performance not only for the Perceptron Learning
Problem but also for the random $K$-Satisfiabilty Problem (another prototypical
CSP with a radically different structure), and show numerically that a simple
zero-temperature Metropolis search in the smooth local entropy landscape can
reach sub-dominant clusters of optimal solutions in a small number of steps,
while standard Simulated Annealing either requires extremely long cooling
procedures or just fails. We also discuss how the EdMC can heuristically be
made even more efficient for the cases we studied.","['Carlo Baldassi', 'Alessandro Ingrosso', 'Carlo Lucibello', 'Luca Saglietti', 'Riccardo Zecchina']","['cond-mat.dis-nn', 'stat.ML', 'G.1.6; I.2.M']",2015-11-18 01:03:59+00:00
http://arxiv.org/abs/1511.05614v3,Model-based Dashboards for Customer Analytics,"Automating the customer analytics process is crucial for companies that
manage distinct customer bases. In such data-rich and dynamic environments,
visualization plays a key role in understanding events of interest. These ideas
have led to the popularity of analytics dashboards, yet academic research has
paid scant attention to these managerial needs. We develop a probabilistic,
nonparametric framework for understanding and predicting individual-level
spending using Gaussian process priors over latent functions that describe
customer spending along calendar time, interpurchase time, and customer
lifetime dimensions. These curves form a dashboard that provides a visual
model-based representation of purchasing dynamics that is easily
comprehensible. The model flexibly and automatically captures the form and
duration of the impact of events that influence spend propensity, even when
such events are unknown a-priori. We illustrate the use of our Gaussian Process
Propensity Model (GPPM) on data from two popular mobile games. We show that the
GPPM generalizes hazard and buy-till-you-die models by incorporating calendar
time dynamics while simultaneously accounting for recency and lifetime effects.
It therefore provides insights about spending propensity beyond those available
from these models. Finally, we show that the GPPM outperforms these benchmarks
both in fitting and forecasting real and simulated spend data.","['Ryan Dew', 'Asim Ansari']","['stat.AP', 'stat.ML']",2015-11-17 23:19:00+00:00
http://arxiv.org/abs/1511.05493v4,Gated Graph Sequence Neural Networks,"Graph-structured data appears frequently in domains including chemistry,
natural language semantics, social networks, and knowledge bases. In this work,
we study feature learning techniques for graph-structured inputs. Our starting
point is previous work on Graph Neural Networks (Scarselli et al., 2009), which
we modify to use gated recurrent units and modern optimization techniques and
then extend to output sequences. The result is a flexible and broadly useful
class of neural network models that has favorable inductive biases relative to
purely sequence-based models (e.g., LSTMs) when the problem is
graph-structured. We demonstrate the capabilities on some simple AI (bAbI) and
graph algorithm learning tasks. We then show it achieves state-of-the-art
performance on a problem from program verification, in which subgraphs need to
be matched to abstract data structures.","['Yujia Li', 'Daniel Tarlow', 'Marc Brockschmidt', 'Richard Zemel']","['cs.LG', 'cs.AI', 'cs.NE', 'stat.ML']",2015-11-17 18:10:12+00:00
http://arxiv.org/abs/1511.05483v1,Accelerating pseudo-marginal Metropolis-Hastings by correlating auxiliary variables,"Pseudo-marginal Metropolis-Hastings (pmMH) is a powerful method for Bayesian
inference in models where the posterior distribution is analytical intractable
or computationally costly to evaluate directly. It operates by introducing
additional auxiliary variables into the model and form an extended target
distribution, which then can be evaluated point-wise. In many cases, the
standard Metropolis-Hastings is then applied to sample from the extended target
and the sought posterior can be obtained by marginalisation. However, in some
implementations this approach suffers from poor mixing as the auxiliary
variables are sampled from an independent proposal. We propose a modification
to the pmMH algorithm in which a Crank-Nicolson (CN) proposal is used instead.
This results in that we introduce a positive correlation in the auxiliary
variables. We investigate how to tune the CN proposal and its impact on the
mixing of the resulting pmMH sampler. The conclusion is that the proposed
modification can have a beneficial effect on both the mixing of the Markov
chain and the computational cost for each iteration of the pmMH algorithm.","['Johan Dahlin', 'Fredrik Lindsten', 'Joel Kronander', 'Thomas B. Schön']","['stat.CO', 'stat.ML']",2015-11-17 17:35:57+00:00
http://arxiv.org/abs/1511.05467v3,Predictive Entropy Search for Multi-objective Bayesian Optimization,"We present PESMO, a Bayesian method for identifying the Pareto set of
multi-objective optimization problems, when the functions are expensive to
evaluate. The central idea of PESMO is to choose evaluation points so as to
maximally reduce the entropy of the posterior distribution over the Pareto set.
Critically, the PESMO multi-objective acquisition function can be decomposed as
a sum of objective-specific acquisition functions, which enables the algorithm
to be used in \emph{decoupled} scenarios in which the objectives can be
evaluated separately and perhaps with different costs. This decoupling
capability also makes it possible to identify difficult objectives that require
more evaluations. PESMO also offers gains in efficiency, as its cost scales
linearly with the number of objectives, in comparison to the exponential cost
of other methods. We compare PESMO with other related methods for
multi-objective Bayesian optimization on synthetic and real-world problems. The
results show that PESMO produces better recommendations with a smaller number
of evaluations of the objectives, and that a decoupled evaluation can lead to
improvements in performance, particularly when the number of objectives is
large.","['Daniel Hernández-Lobato', 'José Miguel Hernández-Lobato', 'Amar Shah', 'Ryan P. Adams']",['stat.ML'],2015-11-17 16:59:33+00:00
http://arxiv.org/abs/1511.05464v1,Extending Gossip Algorithms to Distributed Estimation of U-Statistics,"Efficient and robust algorithms for decentralized estimation in networks are
essential to many distributed systems. Whereas distributed estimation of sample
mean statistics has been the subject of a good deal of attention, computation
of $U$-statistics, relying on more expensive averaging over pairs of
observations, is a less investigated area. Yet, such data functionals are
essential to describe global properties of a statistical population, with
important examples including Area Under the Curve, empirical variance, Gini
mean difference and within-cluster point scatter. This paper proposes new
synchronous and asynchronous randomized gossip algorithms which simultaneously
propagate data across the network and maintain local estimates of the
$U$-statistic of interest. We establish convergence rate bounds of $O(1/t)$ and
$O(\log t / t)$ for the synchronous and asynchronous cases respectively, where
$t$ is the number of iterations, with explicit data and network dependent
terms. Beyond favorable comparisons in terms of rate analysis, numerical
experiments provide empirical evidence the proposed algorithms surpasses the
previously introduced approach.","['Igor Colin', 'Aurélien Bellet', 'Joseph Salmon', 'Stéphan Clémençon']","['stat.ML', 'cs.DC', 'cs.LG', 'cs.SY', 'stat.CO', '68Uxx, 62J15, 68Q32, 62-04,']",2015-11-17 16:49:52+00:00
http://arxiv.org/abs/1511.05440v6,Deep multi-scale video prediction beyond mean square error,"Learning to predict future images from a video sequence involves the
construction of an internal representation that models the image evolution
accurately, and therefore, to some degree, its content and dynamics. This is
why pixel-space video prediction may be viewed as a promising avenue for
unsupervised feature learning. In addition, while optical flow has been a very
studied problem in computer vision for a long time, future frame prediction is
rarely approached. Still, many vision applications could benefit from the
knowledge of the next frames of videos, that does not require the complexity of
tracking every pixel trajectories. In this work, we train a convolutional
network to generate future frames given an input sequence. To deal with the
inherently blurry predictions obtained from the standard Mean Squared Error
(MSE) loss function, we propose three different and complementary feature
learning strategies: a multi-scale architecture, an adversarial training
method, and an image gradient difference loss function. We compare our
predictions to different published results based on recurrent neural networks
on the UCF101 dataset","['Michael Mathieu', 'Camille Couprie', 'Yann LeCun']","['cs.LG', 'cs.CV', 'stat.ML']",2015-11-17 15:36:32+00:00
http://arxiv.org/abs/1511.05432v3,Understanding Adversarial Training: Increasing Local Stability of Neural Nets through Robust Optimization,"We propose a general framework for increasing local stability of Artificial
Neural Nets (ANNs) using Robust Optimization (RO). We achieve this through an
alternating minimization-maximization procedure, in which the loss of the
network is minimized over perturbed examples that are generated at each
parameter update. We show that adversarial training of ANNs is in fact
robustification of the network optimization, and that our proposed framework
generalizes previous approaches for increasing local stability of ANNs.
Experimental results reveal that our approach increases the robustness of the
network to existing adversarial examples, while making it harder to generate
new ones. Furthermore, our algorithm improves the accuracy of the network also
on the original test data.","['Uri Shaham', 'Yutaro Yamada', 'Sahand Negahban']","['stat.ML', 'cs.LG', 'cs.NE']",2015-11-17 15:14:57+00:00
http://arxiv.org/abs/1511.05424v2,Sacrificing information for the greater good: how to select photometric bands for optimal accuracy,"Large-scale surveys make huge amounts of photometric data available. Because
of the sheer amount of objects, spectral data cannot be obtained for all of
them. Therefore it is important to devise techniques for reliably estimating
physical properties of objects from photometric information alone. These
estimates are needed to automatically identify interesting objects worth a
follow-up investigation as well as to produce the required data for a
statistical analysis of the space covered by a survey. We argue that machine
learning techniques are suitable to compute these estimates accurately and
efficiently. This study promotes a feature selection algorithm, which selects
the most informative magnitudes and colours for a given task of estimating
physical quantities from photometric data alone. Using k nearest neighbours
regression, a well-known non-parametric machine learning method, we show that
using the found features significantly increases the accuracy of the
estimations compared to using standard features and standard methods. We
illustrate the usefulness of the approach by estimating specific star formation
rates (sSFRs) and redshifts (photo-z's) using only the broad-band photometry
from the Sloan Digital Sky Survey (SDSS). For estimating sSFRs, we demonstrate
that our method produces better estimates than traditional spectral energy
distribution (SED) fitting. For estimating photo-z's, we show that our method
produces more accurate photo-z's than the method employed by SDSS. The study
highlights the general importance of performing proper model selection to
improve the results of machine learning systems and how feature selection can
provide insights into the predictive relevance of particular input features.","['Kristoffer Stensbo-Smidt', 'Fabian Gieseke', 'Christian Igel', 'Andrew Zirm', 'Kim Steenstrup Pedersen']","['astro-ph.IM', 'stat.ML']",2015-11-17 14:52:40+00:00
