id,title,abstract,authors,categories,date
http://arxiv.org/abs/1608.03639v1,Faster Training of Very Deep Networks Via p-Norm Gates,"A major contributing factor to the recent advances in deep neural networks is
structural units that let sensory information and gradients to propagate
easily. Gating is one such structure that acts as a flow control. Gates are
employed in many recent state-of-the-art recurrent models such as LSTM and GRU,
and feedforward models such as Residual Nets and Highway Networks. This enables
learning in very deep networks with hundred layers and helps achieve
record-breaking results in vision (e.g., ImageNet with Residual Nets) and NLP
(e.g., machine translation with GRU). However, there is limited work in
analysing the role of gating in the learning process. In this paper, we propose
a flexible $p$-norm gating scheme, which allows user-controllable flow and as a
consequence, improve the learning speed. This scheme subsumes other existing
gating schemes, including those in GRU, Highway Networks and Residual Nets as
special cases. Experiments on large sequence and vector datasets demonstrate
that the proposed gating scheme helps improve the learning speed significantly
without extra overhead.","['Trang Pham', 'Truyen Tran', 'Dinh Phung', 'Svetha Venkatesh']","['stat.ML', 'cs.LG', 'cs.NE']",2016-08-11 23:48:44+00:00
http://arxiv.org/abs/1608.03585v1,Warm Starting Bayesian Optimization,"We develop a framework for warm-starting Bayesian optimization, that reduces
the solution time required to solve an optimization problem that is one in a
sequence of related problems. This is useful when optimizing the output of a
stochastic simulator that fails to provide derivative information, for which
Bayesian optimization methods are well-suited. Solving sequences of related
optimization problems arises when making several business decisions using one
optimization model and input data collected over different time periods or
markets. While many gradient-based methods can be warm started by initiating
optimization at the solution to the previous problem, this warm start approach
does not apply to Bayesian optimization methods, which carry a full metamodel
of the objective function from iteration to iteration. Our approach builds a
joint statistical model of the entire collection of related objective
functions, and uses a value of information calculation to recommend points to
evaluate.","['Matthias Poloczek', 'Jialei Wang', 'Peter I. Frazier']","['stat.ML', 'cs.LG', 'stat.AP']",2016-08-11 19:56:27+00:00
http://arxiv.org/abs/1608.03533v15,Sequence Graph Transform (SGT): A Feature Embedding Function for Sequence Data Mining,"Sequence feature embedding is a challenging task due to the unstructuredness
of sequence, i.e., arbitrary strings of arbitrary length. Existing methods are
efficient in extracting short-term dependencies but typically suffer from
computation issues for the long-term. Sequence Graph Transform (SGT), a feature
embedding function, that can extract a varying amount of short- to long-term
dependencies without increasing the computation is proposed. SGT's properties
are analytically proved for interpretation under normal and uniform
distribution assumptions. SGT features yield significantly superior results in
sequence clustering and classification with higher accuracy and lower
computation as compared to the existing methods, including the state-of-the-art
sequence/string Kernels and LSTM.","['Chitta Ranjan', 'Samaneh Ebrahimi', 'Kamran Paynabar']","['stat.ML', 'cs.LG']",2016-08-11 16:59:19+00:00
http://arxiv.org/abs/1608.03530v1,Semi-Supervised Prediction of Gene Regulatory Networks Using Machine Learning Algorithms,"Use of computational methods to predict gene regulatory networks (GRNs) from
gene expression data is a challenging task. Many studies have been conducted
using unsupervised methods to fulfill the task; however, such methods usually
yield low prediction accuracies due to the lack of training data. In this
article, we propose semi-supervised methods for GRN prediction by utilizing two
machine learning algorithms, namely support vector machines (SVM) and random
forests (RF). The semi-supervised methods make use of unlabeled data for
training. We investigate inductive and transductive learning approaches, both
of which adopt an iterative procedure to obtain reliable negative training data
from the unlabeled data. We then apply our semi-supervised methods to gene
expression data of Escherichia coli and Saccharomyces cerevisiae, and evaluate
the performance of our methods using the expression data. Our analysis
indicated that the transductive learning approach outperformed the inductive
learning approach for both organisms. However, there was no conclusive
difference identified in the performance of SVM and RF. Experimental results
also showed that the proposed semi-supervised methods performed better than
existing supervised methods for both organisms.","['Nihir Patel', 'Jason T. L. Wang']","['cs.LG', 'q-bio.QM', 'stat.ML']",2016-08-11 16:52:03+00:00
http://arxiv.org/abs/1608.03487v2,A Richer Theory of Convex Constrained Optimization with Reduced Projections and Improved Rates,"This paper focuses on convex constrained optimization problems, where the
solution is subject to a convex inequality constraint. In particular, we aim at
challenging problems for which both projection into the constrained domain and
a linear optimization under the inequality constraint are time-consuming, which
render both projected gradient methods and conditional gradient methods (a.k.a.
the Frank-Wolfe algorithm) expensive. In this paper, we develop projection
reduced optimization algorithms for both smooth and non-smooth optimization
with improved convergence rates under a certain regularity condition of the
constraint function. We first present a general theory of optimization with
only one projection. Its application to smooth optimization with only one
projection yields $O(1/\epsilon)$ iteration complexity, which improves over the
$O(1/\epsilon^2)$ iteration complexity established before for non-smooth
optimization and can be further reduced under strong convexity. Then we
introduce a local error bound condition and develop faster algorithms for
non-strongly convex optimization at the price of a logarithmic number of
projections. In particular, we achieve an iteration complexity of $\widetilde
O(1/\epsilon^{2(1-\theta)})$ for non-smooth optimization and $\widetilde
O(1/\epsilon^{1-\theta})$ for smooth optimization, where $\theta\in(0,1]$
appearing the local error bound condition characterizes the functional local
growth rate around the optimal solutions. Novel applications in solving the
constrained $\ell_1$ minimization problem and a positive semi-definite
constrained distance metric learning problem demonstrate that the proposed
algorithms achieve significant speed-up compared with previous algorithms.","['Tianbao Yang', 'Qihang Lin', 'Lijun Zhang']","['math.OC', 'stat.ML']",2016-08-11 14:48:18+00:00
http://arxiv.org/abs/1608.03339v2,Distributed learning with regularized least squares,"We study distributed learning with the least squares regularization scheme in
a reproducing kernel Hilbert space (RKHS). By a divide-and-conquer approach,
the algorithm partitions a data set into disjoint data subsets, applies the
least squares regularization scheme to each data subset to produce an output
function, and then takes an average of the individual output functions as a
final global estimator or predictor. We show with error bounds in expectation
in both the $L^2$-metric and RKHS-metric that the global output function of
this distributed learning is a good approximation to the algorithm processing
the whole data in one single machine. Our error bounds are sharp and stated in
a general setting without any eigenfunction assumption. The analysis is
achieved by a novel second order decomposition of operator differences in our
integral operator approach. Even for the classical least squares regularization
scheme in the RKHS associated with a general kernel, we give the best learning
rate in the literature.","['Shao-Bo Lin', 'Xin Guo', 'Ding-Xuan Zhou']","['cs.LG', 'stat.ML', '68T05, 94A20, 41A35', 'F.2.3']",2016-08-11 01:20:23+00:00
http://arxiv.org/abs/1608.03333v1,Temporal Learning and Sequence Modeling for a Job Recommender System,"We present our solution to the job recommendation task for RecSys Challenge
2016. The main contribution of our work is to combine temporal learning with
sequence modeling to capture complex user-item activity patterns to improve job
recommendations. First, we propose a time-based ranking model applied to
historical observations and a hybrid matrix factorization over time re-weighted
interactions. Second, we exploit sequence properties in user-items activities
and develop a RNN-based recommendation model. Our solution achieved 5$^{th}$
place in the challenge among more than 100 participants. Notably, the strong
performance of our RNN approach shows a promising new direction in employing
sequence modeling for recommendation systems.","['Kuan Liu', 'Xing Shi', 'Anoop Kumar', 'Linhong Zhu', 'Prem Natarajan']","['cs.LG', 'stat.ML']",2016-08-11 00:48:00+00:00
http://arxiv.org/abs/1608.03100v1,Estimation from Indirect Supervision with Linear Moments,"In structured prediction problems where we have indirect supervision of the
output, maximum marginal likelihood faces two computational obstacles:
non-convexity of the objective and intractability of even a single gradient
computation. In this paper, we bypass both obstacles for a class of what we
call linear indirectly-supervised problems. Our approach is simple: we solve a
linear system to estimate sufficient statistics of the model, which we then use
to estimate parameters via convex optimization. We analyze the statistical
properties of our approach and show empirically that it is effective in two
settings: learning with local privacy constraints and learning from low-cost
count-based annotations.","['Aditi Raghunathan', 'Roy Frostig', 'John Duchi', 'Percy Liang']","['stat.ML', 'cs.LG']",2016-08-10 09:19:07+00:00
http://arxiv.org/abs/1608.03045v3,Combinatorial Inference for Graphical Models,"We propose a new family of combinatorial inference problems for graphical
models. Unlike classical statistical inference where the main interest is point
estimation or parameter testing, combinatorial inference aims at testing the
global structure of the underlying graph. Examples include testing the graph
connectivity, the presence of a cycle of certain size, or the maximum degree of
the graph. To begin with, we develop a unified theory for the fundamental
limits of a large family of combinatorial inference problems. We propose new
concepts including structural packing and buffer entropies to characterize how
the complexity of combinatorial graph structures impacts the corresponding
minimax lower bounds. On the other hand, we propose a family of novel and
practical structural testing algorithms to match the lower bounds. We provide
thorough numerical results on both synthetic graphical models and brain
networks to illustrate the usefulness of these proposed methods.","['Matey Neykov', 'Junwei Lu', 'Han Liu']","['math.ST', 'stat.ML', 'stat.TH']",2016-08-10 04:47:29+00:00
http://arxiv.org/abs/1608.03023v3,Stochastic Rank-1 Bandits,"We propose stochastic rank-$1$ bandits, a class of online learning problems
where at each step a learning agent chooses a pair of row and column arms, and
receives the product of their values as a reward. The main challenge of the
problem is that the individual values of the row and column are unobserved. We
assume that these values are stochastic and drawn independently. We propose a
computationally-efficient algorithm for solving our problem, which we call
Rank1Elim. We derive a $O((K + L) (1 / \Delta) \log n)$ upper bound on its
$n$-step regret, where $K$ is the number of rows, $L$ is the number of columns,
and $\Delta$ is the minimum of the row and column gaps; under the assumption
that the mean row and column rewards are bounded away from zero. To the best of
our knowledge, we present the first bandit algorithm that finds the maximum
entry of a rank-$1$ matrix whose regret is linear in $K + L$, $1 / \Delta$, and
$\log n$. We also derive a nearly matching lower bound. Finally, we evaluate
Rank1Elim empirically on multiple problems. We observe that it leverages the
structure of our problems and can learn near-optimal solutions even if our
modeling assumptions are mildly violated.","['Sumeet Katariya', 'Branislav Kveton', 'Csaba Szepesvari', 'Claire Vernade', 'Zheng Wen']","['cs.LG', 'stat.ML']",2016-08-10 01:51:36+00:00
http://arxiv.org/abs/1608.03022v1,Dynamic Principal Component Analysis: Identifying the Relationship between Multiple Air Pollutants,"The dynamic nature of air quality chemistry and transport makes it difficult
to identify the mixture of air pollutants for a region. In this study of air
quality in the Houston metropolitan area we apply dynamic principal component
analysis (DPCA) to a normalized multivariate time series of daily concentration
measurements of five pollutants (O3, CO, NO2, SO2, PM2.5) from January 1, 2009
through December 31, 2011 for each of the 24 hours in a day. The resulting
dynamic components are examined by hour across days for the 3 year period.
Diurnal and seasonal patterns are revealed underlining times when DPCA performs
best and two principal components (PCs) explain most variability in the
multivariate series. DPCA is shown to be superior to static principal component
analysis (PCA) in discovery of linear relations among transformed pollutant
measurements. DPCA captures the time-dependent correlation structure of the
underlying pollutants recorded at up to 34 monitoring sites in the region. In
winter mornings the first principal component (PC1) (mainly CO and NO2)
explains up to 70% of variability. Augmenting with the second principal
component (PC2) (mainly driven by SO2) the explained variability rises to 90%.
In the afternoon, O3 gains prominence in the second principal component. The
seasonal profile of PCs' contribution to variance loses its distinction in the
afternoon, yet cumulatively PC1 and PC2 still explain up to 65% of variability
in ambient air data. DPCA provides a strategy for identifying the changing air
quality profile for the region studied.","['Oleg Melnikov', 'Loren H. Raun', 'Katherine B. Ensor']","['stat.AP', 'stat.ML']",2016-08-10 01:51:17+00:00
http://arxiv.org/abs/1608.02902v1,Linear Regression with an Unknown Permutation: Statistical and Computational Limits,"Consider a noisy linear observation model with an unknown permutation, based
on observing $y = \Pi^* A x^* + w$, where $x^* \in \mathbb{R}^d$ is an unknown
vector, $\Pi^*$ is an unknown $n \times n$ permutation matrix, and $w \in
\mathbb{R}^n$ is additive Gaussian noise. We analyze the problem of permutation
recovery in a random design setting in which the entries of the matrix $A$ are
drawn i.i.d. from a standard Gaussian distribution, and establish sharp
conditions on the SNR, sample size $n$, and dimension $d$ under which $\Pi^*$
is exactly and approximately recoverable. On the computational front, we show
that the maximum likelihood estimate of $\Pi^*$ is NP-hard to compute, while
also providing a polynomial time algorithm when $d =1$.","['Ashwin Pananjady', 'Martin J. Wainwright', 'Thomas A. Courtade']","['math.ST', 'cs.IT', 'math.IT', 'stat.ML', 'stat.TH']",2016-08-09 18:24:50+00:00
http://arxiv.org/abs/1608.02861v1,Classification with the pot-pot plot,"We propose a procedure for supervised classification that is based on
potential functions. The potential of a class is defined as a kernel density
estimate multiplied by the class's prior probability. The method transforms the
data to a potential-potential (pot-pot) plot, where each data point is mapped
to a vector of potentials. Separation of the classes, as well as classification
of new data points, is performed on this plot. For this, either the
$\alpha$-procedure ($\alpha$-P) or $k$-nearest neighbors ($k$-NN) are employed.
For data that are generated from continuous distributions, these classifiers
prove to be strongly Bayes-consistent. The potentials depend on the kernel and
its bandwidth used in the density estimate. We investigate several variants of
bandwidth selection, including joint and separate pre-scaling and a bandwidth
regression approach. The new method is applied to benchmark data from the
literature, including simulated data sets as well as 50 sets of real data. It
compares favorably to known classification methods such as LDA, QDA, max kernel
density estimates, $k$-NN, and $DD$-plot classification using depth functions.","['Oleksii Pokotylo', 'Karl Mosler']","['stat.ML', 'cs.LG', '62H30, 62G07']",2016-08-09 16:46:53+00:00
http://arxiv.org/abs/1608.02732v1,On Lower Bounds for Regret in Reinforcement Learning,"This is a brief technical note to clarify the state of lower bounds on regret
for reinforcement learning. In particular, this paper:
  - Reproduces a lower bound on regret for reinforcement learning, similar to
the result of Theorem 5 in the journal UCRL2 paper (Jaksch et al 2010).
  - Clarifies that the proposed proof of Theorem 6 in the REGAL paper (Bartlett
and Tewari 2009) does not hold using the standard techniques without further
work. We suggest that this result should instead be considered a conjecture as
it has no rigorous proof.
  - Suggests that the conjectured lower bound given by (Bartlett and Tewari
2009) is incorrect and, in fact, it is possible to improve the scaling of the
upper bound to match the weaker lower bounds presented in this paper.
  We hope that this note serves to clarify existing results in the field of
reinforcement learning and provides interesting motivation for future work.","['Ian Osband', 'Benjamin Van Roy']","['stat.ML', 'cs.LG']",2016-08-09 09:02:01+00:00
http://arxiv.org/abs/1608.02731v1,Posterior Sampling for Reinforcement Learning Without Episodes,"This is a brief technical note to clarify some of the issues with applying
the application of the algorithm posterior sampling for reinforcement learning
(PSRL) in environments without fixed episodes. In particular, this paper aims
to:
  - Review some of results which have been proven for finite horizon MDPs
(Osband et al 2013, 2014a, 2014b, 2016) and also for MDPs with finite ergodic
structure (Gopalan et al 2014).
  - Review similar results for optimistic algorithms in infinite horizon
problems (Jaksch et al 2010, Bartlett and Tewari 2009, Abbasi-Yadkori and
Szepesvari 2011), with particular attention to the dynamic episode growth.
  - Highlight the delicate technical issue which has led to a fault in the
proof of the lazy-PSRL algorithm (Abbasi-Yadkori and Szepesvari 2015). We
present an explicit counterexample to this style of argument. Therefore, we
suggest that the Theorem 2 in (Abbasi-Yadkori and Szepesvari 2015) be instead
considered a conjecture, as it has no rigorous proof.
  - Present pragmatic approaches to apply PSRL in infinite horizon problems. We
conjecture that, under some additional assumptions, it will be possible to
obtain bounds $O( \sqrt{T} )$ even without episodic reset.
  We hope that this note serves to clarify existing results in the field of
reinforcement learning and provides interesting motivation for future work.","['Ian Osband', 'Benjamin Van Roy']","['stat.ML', 'cs.LG']",2016-08-09 09:01:13+00:00
http://arxiv.org/abs/1608.02715v1,A deep language model for software code,"Existing language models such as n-grams for software code often fail to
capture a long context where dependent code elements scatter far apart. In this
paper, we propose a novel approach to build a language model for software code
to address this particular issue. Our language model, partly inspired by human
memory, is built upon the powerful deep learning-based Long Short Term Memory
architecture that is capable of learning long-term dependencies which occur
frequently in software code. Results from our intrinsic evaluation on a corpus
of Java projects have demonstrated the effectiveness of our language model.
This work contributes to realizing our vision for DeepSoft, an end-to-end,
generic deep learning-based framework for modeling software and its development
process.","['Hoa Khanh Dam', 'Truyen Tran', 'Trang Pham']","['cs.SE', 'stat.ML']",2016-08-09 08:16:42+00:00
http://arxiv.org/abs/1608.02658v3,Revisiting Causality Inference in Memory-less Transition Networks,"Several methods exist to infer causal networks from massive volumes of
observational data. However, almost all existing methods require a considerable
length of time series data to capture cause and effect relationships. In
contrast, memory-less transition networks or Markov Chain data, which refers to
one-step transitions to and from an event, have not been explored for causality
inference even though such data is widely available. We find that causal
network can be inferred from characteristics of four unique distribution zones
around each event. We call this Composition of Transitions and show that cause,
effect, and random events exhibit different behavior in their compositions. We
applied machine learning models to learn these different behaviors and to infer
causality. We name this new method Causality Inference using Composition of
Transitions (CICT). To evaluate CICT, we used an administrative inpatient
healthcare dataset to set up a network of patients transitions between
different diagnoses. We show that CICT is highly accurate in inferring whether
the transition between a pair of events is causal or random and performs well
in identifying the direction of causality in a bi-directional association.","['Abbas Shojaee', 'Isuru Ranasinghe', 'Alireza Ani']","['stat.ML', 'cs.AI', 'nlin.CD', 'physics.data-an']",2016-08-08 23:46:59+00:00
http://arxiv.org/abs/1608.02554v1,Sparse recovery via Orthogonal Least-Squares under presence of Noise,"We consider the Orthogonal Least-Squares (OLS) algorithm for the recovery of
a $m$-dimensional $k$-sparse signal from a low number of noisy linear
measurements. The Exact Recovery Condition (ERC) in bounded noisy scenario is
established for OLS under certain condition on nonzero elements of the signal.
The new result also improves the existing guarantees for Orthogonal Matching
Pursuit (OMP) algorithm. In addition, This framework is employed to provide
probabilistic guarantees for the case that the coefficient matrix is drawn at
random according to Gaussian or Bernoulli distribution where we exploit some
concentration properties. It is shown that under certain conditions, OLS
recovers the true support in $k$ iterations with high probability. This in turn
demonstrates that ${\cal O}\left(k\log m\right)$ measurements is sufficient for
exact recovery of sparse signals via OLS.","['Abolfazl Hashemi', 'Haris Vikalo']","['stat.ML', 'cs.IT', 'math.IT']",2016-08-08 18:52:33+00:00
http://arxiv.org/abs/1608.02549v2,Sampling Requirements and Accelerated Schemes for Sparse Linear Regression with Orthogonal Least-Squares,"We study the problem of inferring a sparse vector from random linear
combinations of its components. We propose the Accelerated Orthogonal
Least-Squares (AOLS) algorithm that improves performance of the well-known
Orthogonal Least-Squares (OLS) algorithm while requiring significantly lower
computational costs. While OLS greedily selects columns of the coefficient
matrix that correspond to non-zero components of the sparse vector, AOLS
employs a novel computationally efficient procedure that speeds up the search
by anticipating future selections via choosing $L$ columns in each step, where
$L$ is an adjustable hyper-parameter. We analyze the performance of AOLS and
establish lower bounds on the probability of exact recovery for both noiseless
and noisy random linear measurements. In the noiseless scenario, it is shown
that when the coefficients are samples from a Gaussian distribution, AOLS with
high probability recovers a $k$-sparse $m$-dimensional sparse vector using
${\cal O}(k\log \frac{m}{k+L-1})$ measurements. Similar result is established
for the bounded-noise scenario where an additional condition on the smallest
nonzero element of the unknown vector is required. The asymptotic sampling
complexity of AOLS is lower than the asymptotic sampling complexity of the
existing sparse reconstruction algorithms. In simulations, AOLS is compared to
state-of-the-art sparse recovery techniques and shown to provide better
performance in terms of accuracy, running time, or both. Finally, we consider
an application of AOLS to clustering high-dimensional data lying on the union
of low-dimensional subspaces and demonstrate its superiority over existing
methods.","['Abolfazl Hashemi', 'Haris Vikalo']","['stat.ML', 'cs.IT', 'math.IT']",2016-08-08 18:36:30+00:00
