id,title,abstract,authors,categories,date
http://arxiv.org/abs/1701.05936v2,The biglasso Package: A Memory- and Computation-Efficient Solver for Lasso Model Fitting with Big Data in R,"Penalized regression models such as the lasso have been extensively applied
to analyzing high-dimensional data sets. However, due to memory limitations,
existing R packages like glmnet and ncvreg are not capable of fitting
lasso-type models for ultrahigh-dimensional, multi-gigabyte data sets that are
increasingly seen in many areas such as genetics, genomics, biomedical imaging,
and high-frequency finance. In this research, we implement an R package called
biglasso that tackles this challenge. biglasso utilizes memory-mapped files to
store the massive data on the disk, only reading data into memory when
necessary during model fitting, and is thus able to handle out-of-core
computation seamlessly. Moreover, it's equipped with newly proposed, more
efficient feature screening rules, which substantially accelerate the
computation. Benchmarking experiments show that our biglasso package, as
compared to existing popular ones like glmnet, is much more memory- and
computation-efficient. We further analyze a 31 GB real data set on a laptop
with only 16 GB RAM to demonstrate the out-of-core computation capability of
biglasso in analyzing massive data sets that cannot be accommodated by existing
R packages.","['Yaohui Zeng', 'Patrick Breheny']","['stat.CO', 'stat.ML']",2017-01-20 22:08:49+00:00
http://arxiv.org/abs/1701.05927v2,Learning Particle Physics by Example: Location-Aware Generative Adversarial Networks for Physics Synthesis,"We provide a bridge between generative modeling in the Machine Learning
community and simulated physical processes in High Energy Particle Physics by
applying a novel Generative Adversarial Network (GAN) architecture to the
production of jet images -- 2D representations of energy depositions from
particles interacting with a calorimeter. We propose a simple architecture, the
Location-Aware Generative Adversarial Network, that learns to produce realistic
radiation patterns from simulated high energy particle collisions. The pixel
intensities of GAN-generated images faithfully span over many orders of
magnitude and exhibit the desired low-dimensional physical properties (i.e.,
jet mass, n-subjettiness, etc.). We shed light on limitations, and provide a
novel empirical validation of image quality and validity of GAN-produced
simulations of the natural world. This work provides a base for further
explorations of GANs for use in faster simulation in High Energy Particle
Physics.","['Luke de Oliveira', 'Michela Paganini', 'Benjamin Nachman']","['stat.ML', 'hep-ex', 'physics.data-an']",2017-01-20 21:09:06+00:00
http://arxiv.org/abs/1701.05923v1,Gate-Variants of Gated Recurrent Unit (GRU) Neural Networks,"The paper evaluates three variants of the Gated Recurrent Unit (GRU) in
recurrent neural networks (RNN) by reducing parameters in the update and reset
gates. We evaluate the three variant GRU models on MNIST and IMDB datasets and
show that these GRU-RNN variant models perform as well as the original GRU RNN
model while reducing the computational expense.","['Rahul Dey', 'Fathi M. Salem']","['cs.NE', 'stat.ML']",2017-01-20 20:53:51+00:00
http://arxiv.org/abs/1701.05804v4,Disentangling group and link persistence in Dynamic Stochastic Block models,"We study the inference of a model of dynamic networks in which both
communities and links keep memory of previous network states. By considering
maximum likelihood inference from single snapshot observations of the network,
we show that link persistence makes the inference of communities harder,
decreasing the detectability threshold, while community persistence tends to
make it easier. We analytically show that communities inferred from single
network snapshot can share a maximum overlap with the underlying communities of
a specific previous instant in time. This leads to time-lagged inference: the
identification of past communities rather than present ones. Finally we compute
the time lag and propose a corrected algorithm, the Lagged Snapshot Dynamic
(LSD) algorithm, for community detection in dynamic networks. We analytically
and numerically characterize the detectability transitions of such algorithm as
a function of the memory parameters of the model and we make a comparison with
a full dynamic inference.","['Paolo Barucca', 'Fabrizio Lillo', 'Piero Mazzarisi', 'Daniele Tantari']","['cs.SI', 'cs.LG', 'physics.soc-ph', 'stat.ML']",2017-01-20 14:33:45+00:00
http://arxiv.org/abs/1701.05763v1,Multivariate Confidence Intervals,"Confidence intervals are a popular way to visualize and analyze data
distributions. Unlike p-values, they can convey information both about
statistical significance as well as effect size. However, very little work
exists on applying confidence intervals to multivariate data. In this paper we
define confidence intervals for multivariate data that extend the
one-dimensional definition in a natural way. In our definition every variable
is associated with its own confidence interval as usual, but a data vector can
be outside of a few of these, and still be considered to be within the
confidence area. We analyze the problem and show that the resulting confidence
areas retain the good qualities of their one-dimensional counterparts: they are
informative and easy to interpret. Furthermore, we show that the problem of
finding multivariate confidence intervals is hard, but provide efficient
approximate algorithms to solve the problem.","['Jussi Korpela', 'Emilia Oikarinen', 'Kai Puolamäki', 'Antti Ukkonen']","['stat.AP', 'stat.ML', '62G15, 62H99, 62M10,', 'G.3']",2017-01-20 11:19:50+00:00
http://arxiv.org/abs/1701.05672v1,Stability Enhanced Large-Margin Classifier Selection,"Stability is an important aspect of a classification procedure because
unstable predictions can potentially reduce users' trust in a classification
system and also harm the reproducibility of scientific conclusions. The major
goal of our work is to introduce a novel concept of classification instability,
i.e., decision boundary instability (DBI), and incorporate it with the
generalization error (GE) as a standard for selecting the most accurate and
stable classifier. Specifically, we implement a two-stage algorithm: (i)
initially select a subset of classifiers whose estimated GEs are not
significantly different from the minimal estimated GE among all the candidate
classifiers; (ii) the optimal classifier is chosen as the one achieving the
minimal DBI among the subset selected in stage (i). This general selection
principle applies to both linear and nonlinear classifiers. Large-margin
classifiers are used as a prototypical example to illustrate the above idea.
Our selection method is shown to be consistent in the sense that the optimal
classifier simultaneously achieves the minimal GE and the minimal DBI. Various
simulations and real examples further demonstrate the advantage of our method
over several alternative approaches.","['Will Wei Sun', 'Guang Cheng', 'Yufeng Liu']",['stat.ML'],2017-01-20 03:38:57+00:00
http://arxiv.org/abs/1701.05654v2,Bayesian Network Learning via Topological Order,"We propose a mixed integer programming (MIP) model and iterative algorithms
based on topological orders to solve optimization problems with acyclic
constraints on a directed graph. The proposed MIP model has a significantly
lower number of constraints compared to popular MIP models based on cycle
elimination constraints and triangular inequalities. The proposed iterative
algorithms use gradient descent and iterative reordering approaches,
respectively, for searching topological orders. A computational experiment is
presented for the Gaussian Bayesian network learning problem, an optimization
problem minimizing the sum of squared errors of regression models with L1
penalty over a feature network with application of gene network inference in
bioinformatics.","['Young Woong Park', 'Diego Klabjan']","['stat.ML', 'cs.DS']",2017-01-20 01:58:33+00:00
http://arxiv.org/abs/1701.05644v1,Rare Disease Physician Targeting: A Factor Graph Approach,"In rare disease physician targeting, a major challenge is how to identify
physicians who are treating diagnosed or underdiagnosed rare diseases patients.
Rare diseases have extremely low incidence rate. For a specified rare disease,
only a small number of patients are affected and a fractional of physicians are
involved. The existing targeting methodologies, such as segmentation and
profiling, are developed under mass market assumption. They are not suitable
for rare disease market where the target classes are extremely imbalanced. The
authors propose a graphical model approach to predict targets by jointly
modeling physician and patient features from different data spaces and
utilizing the extra relational information. Through an empirical example with
medical claim and prescription data, the proposed approach demonstrates better
accuracy in finding target physicians. The graph representation also provides
visual interpretability of relationship among physicians and patients. The
model can be extended to incorporate more complex dependency structures. This
article contributes to the literature of exploring the benefit of utilizing
relational dependencies among entities in healthcare industry.","['Yong Cai', 'Yunlong Wang', 'Dong Dai']","['stat.ML', 'cs.LG']",2017-01-19 23:43:54+00:00
http://arxiv.org/abs/1701.05632v1,The Internet as Quantitative Social Science Platform: Insights from a Trillion Observations,"With the large-scale penetration of the internet, for the first time,
humanity has become linked by a single, open, communications platform.
Harnessing this fact, we report insights arising from a unified internet
activity and location dataset of an unparalleled scope and accuracy drawn from
over a trillion (1.5$\times 10^{12}$) observations of end-user internet
connections, with temporal resolution of just 15min over 2006-2012. We first
apply this dataset to the expansion of the internet itself over 1,647 urban
agglomerations globally. We find that unique IP per capita counts reach
saturation at approximately one IP per three people, and take, on average, 16.1
years to achieve; eclipsing the estimated 100- and 60- year saturation times
for steam-power and electrification respectively. Next, we use intra-diurnal
internet activity features to up-scale traditional over-night sleep
observations, producing the first global estimate of over-night sleep duration
in 645 cities over 7 years. We find statistically significant variation between
continental, national and regional sleep durations including some evidence of
global sleep duration convergence. Finally, we estimate the relationship
between internet concentration and economic outcomes in 411 OECD regions and
find that the internet's expansion is associated with negative or positive
productivity gains, depending strongly on sectoral considerations. To our
knowledge, our study is the first of its kind to use online/offline activity of
the entire internet to infer social science insights, demonstrating the
unparalleled potential of the internet as a social data-science platform.","['Klaus Ackermann', 'Simon D Angus', 'Paul A Raschky']","['q-fin.EC', 'cs.CY', 'cs.SI', 'physics.soc-ph', 'stat.ML']",2017-01-19 22:35:46+00:00
http://arxiv.org/abs/1701.05593v1,Parameter Selection Algorithm For Continuous Variables,"In this article, we propose a new algorithm for supervised learning methods,
by which one can both capture the non-linearity in data and also find the best
subset model. To produce an enhanced subset of the original variables, an ideal
selection method should have the potential of adding a supplementary level of
regression analysis that would capture complex relationships in the data via
mathematical transformation of the predictors and exploration of synergistic
effects of combined variables. The method that we present here has the
potential to produce an optimal subset of variables, rendering the overall
process of model selection to be more efficient. The core objective of this
paper is to introduce a new estimation technique for the classical least square
regression framework. This new automatic variable transformation and model
selection method could offer an optimal and stable model that minimizes the
mean square error and variability, while combining all possible subset
selection methodology and including variable transformations and interaction.
Moreover, this novel method controls multicollinearity, leading to an optimal
set of explanatory variables.","['Peyman Tavallali', 'Marianne Razavi', 'Sean Brady']","['stat.AP', 'stat.ME', 'stat.ML']",2017-01-19 20:35:31+00:00
http://arxiv.org/abs/1701.05573v1,Poisson--Gamma Dynamical Systems,"We introduce a new dynamical system for sequentially observed multivariate
count data. This model is based on the gamma--Poisson construction---a natural
choice for count data---and relies on a novel Bayesian nonparametric prior that
ties and shrinks the model parameters, thus avoiding overfitting. We present an
efficient MCMC inference algorithm that advances recent work on augmentation
schemes for inference in negative binomial models. Finally, we demonstrate the
model's inductive bias using a variety of real-world data sets, showing that it
exhibits superior predictive performance over other models and infers highly
interpretable latent structure.","['Aaron Schein', 'Mingyuan Zhou', 'Hanna Wallach']","['stat.ML', 'cs.LG']",2017-01-19 19:28:37+00:00
http://arxiv.org/abs/1701.05517v1,PixelCNN++: Improving the PixelCNN with Discretized Logistic Mixture Likelihood and Other Modifications,"PixelCNNs are a recently proposed class of powerful generative models with
tractable likelihood. Here we discuss our implementation of PixelCNNs which we
make available at https://github.com/openai/pixel-cnn. Our implementation
contains a number of modifications to the original model that both simplify its
structure and improve its performance. 1) We use a discretized logistic mixture
likelihood on the pixels, rather than a 256-way softmax, which we find to speed
up training. 2) We condition on whole pixels, rather than R/G/B sub-pixels,
simplifying the model structure. 3) We use downsampling to efficiently capture
structure at multiple resolutions. 4) We introduce additional short-cut
connections to further speed up optimization. 5) We regularize the model using
dropout. Finally, we present state-of-the-art log likelihood results on
CIFAR-10 to demonstrate the usefulness of these modifications.","['Tim Salimans', 'Andrej Karpathy', 'Xi Chen', 'Diederik P. Kingma']","['cs.LG', 'stat.ML']",2017-01-19 17:29:06+00:00
http://arxiv.org/abs/1701.05512v2,Fisher consistency for prior probability shift,"We introduce Fisher consistency in the sense of unbiasedness as a desirable
property for estimators of class prior probabilities. Lack of Fisher
consistency could be used as a criterion to dismiss estimators that are
unlikely to deliver precise estimates in test datasets under prior probability
and more general dataset shift. The usefulness of this unbiasedness concept is
demonstrated with three examples of classifiers used for quantification:
Adjusted Classify & Count, EM-algorithm and CDE-Iterate. We find that Adjusted
Classify & Count and EM-algorithm are Fisher consistent. A counter-example
shows that CDE-Iterate is not Fisher consistent and, therefore, cannot be
trusted to deliver reliable estimates of class probabilities.",['Dirk Tasche'],"['stat.ML', 'cs.LG', 'stat.CO', '62C10']",2017-01-19 17:07:21+00:00
http://arxiv.org/abs/1701.05458v1,Extreme value statistics for censored data with heavy tails under competing risks,"This paper addresses the problem of estimating, in the presence of random
censoring as well as competing risks, the extreme value index of the
(sub)-distribution function associated to one particular cause, in the
heavy-tail case. Asymptotic normality of the proposed estimator (which has the
form of an Aalen-Johansen integral, and is the first estimator proposed in this
context) is established. A small simulation study exhibits its performances for
finite samples. Estimation of extreme quantiles of the cumulative incidence
function is also addressed.","['Julien Worms', 'Rym Worms']","['math.ST', 'stat.ML', 'stat.TH']",2017-01-19 15:08:20+00:00
http://arxiv.org/abs/1701.05369v3,Variational Dropout Sparsifies Deep Neural Networks,"We explore a recently proposed Variational Dropout technique that provided an
elegant Bayesian interpretation to Gaussian Dropout. We extend Variational
Dropout to the case when dropout rates are unbounded, propose a way to reduce
the variance of the gradient estimator and report first experimental results
with individual dropout rates per weight. Interestingly, it leads to extremely
sparse solutions both in fully-connected and convolutional layers. This effect
is similar to automatic relevance determination effect in empirical Bayes but
has a number of advantages. We reduce the number of parameters up to 280 times
on LeNet architectures and up to 68 times on VGG-like networks with a
negligible decrease of accuracy.","['Dmitry Molchanov', 'Arsenii Ashukha', 'Dmitry Vetrov']","['stat.ML', 'cs.LG']",2017-01-19 10:44:55+00:00
http://arxiv.org/abs/1701.05363v3,Stochastic Subsampling for Factorizing Huge Matrices,"We present a matrix-factorization algorithm that scales to input matrices
with both huge number of rows and columns. Learned factors may be sparse or
dense and/or non-negative, which makes our algorithm suitable for dictionary
learning, sparse component analysis, and non-negative matrix factorization. Our
algorithm streams matrix columns while subsampling them to iteratively learn
the matrix factors. At each iteration, the row dimension of a new sample is
reduced by subsampling, resulting in lower time complexity compared to a simple
streaming algorithm. Our method comes with convergence guarantees to reach a
stationary point of the matrix-factorization problem. We demonstrate its
efficiency on massive functional Magnetic Resonance Imaging data (2 TB), and on
patches extracted from hyperspectral images (103 GB). For both problems, which
involve different penalties on rows and columns, we obtain significant
speed-ups compared to state-of-the-art algorithms.","['Arthur Mensch', 'Julien Mairal', 'Bertrand Thirion', 'Gael Varoquaux']","['stat.ML', 'cs.LG', 'math.OC', 'q-bio.NC']",2017-01-19 10:35:01+00:00
http://arxiv.org/abs/1701.05335v3,Validity of Clusters Produced By kernel-$k$-means With Kernel-Trick,"This paper corrects the proof of the Theorem 2 from the Gower's paper
\cite[page 5]{Gower:1982} as well as corrects the Theorem 7 from Gower's paper
\cite{Gower:1986}. The first correction is needed in order to establish the
existence of the kernel function used commonly in the kernel trick e.g. for
$k$-means clustering algorithm, on the grounds of distance matrix. The
correction encompasses the missing if-part proof and dropping unnecessary
conditions. The second correction deals with transformation of the kernel
matrix into a one embeddable in Euclidean space.",['Mieczysław A. Kłopotek'],"['cs.LG', 'stat.ML']",2017-01-19 08:55:20+00:00
http://arxiv.org/abs/1701.05306v2,Estimating Individual Treatment Effect in Observational Data Using Random Forest Methods,"Estimation of individual treatment effect in observational data is
complicated due to the challenges of confounding and selection bias. A useful
inferential framework to address this is the counterfactual (potential
outcomes) model which takes the hypothetical stance of asking what if an
individual had received both treatments. Making use of random forests (RF)
within the counterfactual framework we estimate individual treatment effects by
directly modeling the response. We find accurate estimation of individual
treatment effects is possible even in complex heterogeneous settings but that
the type of RF approach plays an important role in accuracy. Methods designed
to be adaptive to confounding, when used in parallel with out-of-sample
estimation, do best. One method found to be especially promising is
counterfactual synthetic forests. We illustrate this new methodology by
applying it to a large comparative effectiveness trial, Project Aware, in order
to explore the role drug use plays in sexual risk. The analysis reveals
important connections between risky behavior, drug usage, and sexual risk.","['Min Lu', 'Saad Sadiq', 'Daniel J. Feaster', 'Hemant Ishwaran']",['stat.ML'],2017-01-19 06:11:14+00:00
http://arxiv.org/abs/1701.05305v2,Random Forest Missing Data Algorithms,"Random forest (RF) missing data algorithms are an attractive approach for
dealing with missing data. They have the desirable properties of being able to
handle mixed types of missing data, they are adaptive to interactions and
nonlinearity, and they have the potential to scale to big data settings.
Currently there are many different RF imputation algorithms but relatively
little guidance about their efficacy, which motivated us to study their
performance. Using a large, diverse collection of data sets, performance of
various RF algorithms was assessed under different missing data mechanisms.
Algorithms included proximity imputation, on the fly imputation, and imputation
utilizing multivariate unsupervised and supervised splitting---the latter class
representing a generalization of a new promising imputation algorithm called
missForest. Performance of algorithms was assessed by ability to impute data
accurately. Our findings reveal RF imputation to be generally robust with
performance improving with increasing correlation. Performance was good under
moderate to high missingness, and even (in certain cases) when data was missing
not at random.","['Fei Tang', 'Hemant Ishwaran']",['stat.ML'],2017-01-19 05:58:05+00:00
http://arxiv.org/abs/1701.05265v1,Online Structure Learning for Sum-Product Networks with Gaussian Leaves,"Sum-product networks have recently emerged as an attractive representation
due to their dual view as a special type of deep neural network with clear
semantics and a special type of probabilistic graphical model for which
inference is always tractable. Those properties follow from some conditions
(i.e., completeness and decomposability) that must be respected by the
structure of the network. As a result, it is not easy to specify a valid
sum-product network by hand and therefore structure learning techniques are
typically used in practice. This paper describes the first online structure
learning technique for continuous SPNs with Gaussian leaves. We also introduce
an accompanying new parameter learning technique.","['Wilson Hsu', 'Agastya Kalra', 'Pascal Poupart']","['stat.ML', 'cs.LG']",2017-01-19 00:42:01+00:00
http://arxiv.org/abs/1701.05230v3,Surrogate Aided Unsupervised Recovery of Sparse Signals in Single Index Models for Binary Outcomes,"We consider the recovery of regression coefficients, denoted by
$\boldsymbol{\beta}_0$, for a single index model (SIM) relating a binary
outcome $Y$ to a set of possibly high dimensional covariates $\boldsymbol{X}$,
based on a large but 'unlabeled' dataset $\mathcal{U}$, with $Y$ never
observed. On $\mathcal{U}$, we fully observe $\boldsymbol{X}$ and additionally,
a surrogate $S$ which, while not being strongly predictive of $Y$ throughout
the entirety of its support, can forecast it with high accuracy when it assumes
extreme values. Such datasets arise naturally in modern studies involving large
databases such as electronic medical records (EMR) where $Y$, unlike
$(\boldsymbol{X}, S)$, is difficult and/or expensive to obtain. In EMR studies,
an example of $Y$ and $S$ would be the true disease phenotype and the count of
the associated diagnostic codes respectively. Assuming another SIM for $S$
given $\boldsymbol{X}$, we show that under sparsity assumptions, we can recover
$\boldsymbol{\beta}_0$ proportionally by simply fitting a least squares LASSO
estimator to the subset of the observed data on $(\boldsymbol{X}, S)$
restricted to the extreme sets of $S$, with $Y$ imputed using the surrogacy of
$S$. We obtain sharp finite sample performance bounds for our estimator,
including deterministic deviation bounds and probabilistic guarantees. We
demonstrate the effectiveness of our approach through multiple simulation
studies, as well as by application to real data from an EMR study conducted at
the Partners HealthCare Systems.","['Abhishek Chakrabortty', 'Matey Neykov', 'Raymond Carroll', 'Tianxi Cai']","['stat.ME', 'math.ST', 'stat.ML', 'stat.TH', '62J12, 62J07, 62H30, 62G32, 62F10, 62F30']",2017-01-18 20:51:27+00:00
