id,title,abstract,authors,categories,date
http://arxiv.org/abs/2106.13035v2,"Quantization Aware Training, ERNIE and Kurtosis Regularizer: a short empirical study","Pre-trained language models like Ernie or Bert are currently used in many
applications. These models come with a set of pre-trained weights typically
obtained in unsupervised/self-supervised modality on a huge amount of data.
After that, they are fine-tuned on a specific task. Applications then use these
models for inference, and often some additional constraints apply, like low
power-budget or low latency between input and output. The main avenue to meet
these additional requirements for the inference settings, is to use low
precision computation (e.g. INT8 rather than FP32), but this comes with a cost
of deteriorating the functional performance (e.g. accuracy) of the model. Some
approaches have been developed to tackle the problem and go beyond the
limitations of the PTO (Post-Training Quantization), more specifically the QAT
(Quantization Aware Training, see [4]) is a procedure that interferes with the
training process in order to make it affected (or simply disturbed) by the
quantization phase during the training itself. Besides QAT, recently
Intel-Habana Labs have proposed an additional and more direct way to make the
training results more robust to subsequent quantization which uses a
regularizer, therefore changing the loss function that drives the training
procedure. But their proposal does not work out-of-the-box for pre-trained
models like Ernie, for example. In this short paper we show why this is not
happening (for the Ernie case) and we propose a very basic way to deal with it,
sharing as well some initial results (increase in final INT8 accuracy) that
might be of interest to practitioners willing to use Ernie in their
applications, in low precision regime.",['Andrea Zanetti'],"['stat.ML', 'cs.LG']",2021-06-24 14:12:11+00:00
http://arxiv.org/abs/2106.13015v2,A Stochastic Sequential Quadratic Optimization Algorithm for Nonlinear Equality Constrained Optimization with Rank-Deficient Jacobians,"A sequential quadratic optimization algorithm is proposed for solving smooth
nonlinear equality constrained optimization problems in which the objective
function is defined by an expectation of a stochastic function. The algorithmic
structure of the proposed method is based on a step decomposition strategy that
is known in the literature to be widely effective in practice, wherein each
search direction is computed as the sum of a normal step (toward linearized
feasibility) and a tangential step (toward objective decrease in the null space
of the constraint Jacobian). However, the proposed method is unique from others
in the literature in that it both allows the use of stochastic objective
gradient estimates and possesses convergence guarantees even in the setting in
which the constraint Jacobians may be rank deficient. The results of numerical
experiments demonstrate that the algorithm offers superior performance when
compared to popular alternatives.","['Albert S. Berahas', 'Frank E. Curtis', ""Michael J. O'Neill"", 'Daniel P. Robinson']","['math.OC', 'stat.ML']",2021-06-24 13:46:52+00:00
http://arxiv.org/abs/2106.12997v2,Bayesian Optimization with High-Dimensional Outputs,"Bayesian Optimization is a sample-efficient black-box optimization procedure
that is typically applied to problems with a small number of independent
objectives. However, in practice we often wish to optimize objectives defined
over many correlated outcomes (or ""tasks""). For example, scientists may want to
optimize the coverage of a cell tower network across a dense grid of locations.
Similarly, engineers may seek to balance the performance of a robot across
dozens of different environments via constrained or robust optimization.
However, the Gaussian Process (GP) models typically used as probabilistic
surrogates for multi-task Bayesian Optimization scale poorly with the number of
outcomes, greatly limiting applicability. We devise an efficient technique for
exact multi-task GP sampling that combines exploiting Kronecker structure in
the covariance matrices with Matheron's identity, allowing us to perform
Bayesian Optimization using exact multi-task GP models with tens of thousands
of correlated outputs. In doing so, we achieve substantial improvements in
sample efficiency compared to existing approaches that only model aggregate
functions of the outcomes. We demonstrate how this unlocks a new class of
applications for Bayesian Optimization across a range of tasks in science and
engineering, including optimizing interference patterns of an optical
interferometer with more than 65,000 outputs.","['Wesley J. Maddox', 'Maximilian Balandat', 'Andrew Gordon Wilson', 'Eytan Bakshy']","['cs.LG', 'cs.AI', 'stat.ML']",2021-06-24 13:15:12+00:00
http://arxiv.org/abs/2106.12996v3,"Sparse Multi-Reference Alignment : Phase Retrieval, Uniform Uncertainty Principles and the Beltway Problem","Motivated by cutting-edge applications like cryo-electron microscopy
(cryo-EM), the Multi-Reference Alignment (MRA) model entails the learning of an
unknown signal from repeated measurements of its images under the latent action
of a group of isometries and additive noise of magnitude $\sigma$. Despite
significant interest, a clear picture for understanding rates of estimation in
this model has emerged only recently, particularly in the high-noise regime
$\sigma \gg 1$ that is highly relevant in applications. Recent investigations
have revealed a remarkable asymptotic sample complexity of order $\sigma^6$ for
certain signals whose Fourier transforms have full support, in stark contrast
to the traditional $\sigma^2$ that arise in regular models. Often prohibitively
large in practice, these results have prompted the investigation of variations
around the MRA model where better sample complexity may be achieved. In this
paper, we show that sparse signals exhibit an intermediate $\sigma^4$ sample
complexity even in the classical MRA model. Further, we characterise the
dependence of the estimation rate on the support size $s$ as $O_p(1)$ and
$O_p(s^{3.5})$ in the dilute and moderate regimes of sparsity respectively. Our
techniques have implications for the problem of crystallographic phase
retrieval, indicating a certain local uniqueness for the recovery of sparse
signals from their power spectrum. Our results explore and exploit connections
of the MRA estimation problem with two classical topics in applied mathematics:
the beltway problem from combinatorial optimization, and uniform uncertainty
principles from harmonic analysis. Our techniques include a certain enhanced
form of the probabilistic method, which might be of general interest in its own
right.","['Subhro Ghosh', 'Philippe Rigollet']","['math.ST', 'cs.LG', 'math.PR', 'stat.ML', 'stat.TH']",2021-06-24 13:13:10+00:00
http://arxiv.org/abs/2106.12974v2,Tensor networks for unsupervised machine learning,"Modeling the joint distribution of high-dimensional data is a central task in
unsupervised machine learning. In recent years, many interests have been
attracted to developing learning models based on tensor networks, which have
the advantages of a principle understanding of the expressive power using
entanglement properties, and as a bridge connecting classical computation and
quantum computation. Despite the great potential, however, existing tensor
network models for unsupervised machine learning only work as a proof of
principle, as their performance is much worse than the standard models such as
restricted Boltzmann machines and neural networks. In this Letter, we present
autoregressive matrix product states (AMPS), a tensor network model combining
matrix product states from quantum many-body physics and autoregressive
modeling from machine learning. Our model enjoys the exact calculation of
normalized probability and unbiased sampling. We demonstrate the performance of
our model using two applications, generative modeling on synthetic and
real-world data, and reinforcement learning in statistical physics. Using
extensive numerical experiments, we show that the proposed model significantly
outperforms the existing tensor network models and the restricted Boltzmann
machines, and is competitive with state-of-the-art neural network models.","['Jing Liu', 'Sujie Li', 'Jiang Zhang', 'Pan Zhang']","['cond-mat.stat-mech', 'cs.LG', 'quant-ph', 'stat.ML']",2021-06-24 12:51:00+00:00
http://arxiv.org/abs/2106.12936v3,Fundamental limits for learning hidden Markov model parameters,"We study the frontier between learnable and unlearnable hidden Markov models
(HMMs). HMMs are flexible tools for clustering dependent data coming from
unknown populations. The model parameters are known to be fully identifiable
(up to label-switching) without any modeling assumption on the distributions of
the populations as soon as the clusters are distinct and the hidden chain is
ergodic with a full rank transition matrix. In the limit as any one of these
conditions fails, it becomes impossible in general to identify parameters. For
a chain with two hidden states we prove nonasymptotic minimax upper and lower
bounds, matching up to constants, which exhibit thresholds at which the
parameters become learnable. We also provide an upper bound on the relative
entropy rate for parameters in a neighbourhood of the unlearnable region which
may have interest in itself.","['Kweku Abraham', 'Zacharie Naulet', 'Elisabeth Gassiat']","['stat.ML', 'cs.LG', 'math.ST', 'stat.TH', '62M05, 62F12']",2021-06-24 12:02:33+00:00
http://arxiv.org/abs/2106.12886v2,Constrained Classification and Policy Learning,"Modern machine learning approaches to classification, including AdaBoost,
support vector machines, and deep neural networks, utilize surrogate loss
techniques to circumvent the computational complexity of minimizing empirical
classification risk. These techniques are also useful for causal policy
learning problems, since estimation of individualized treatment rules can be
cast as a weighted (cost-sensitive) classification problem. Consistency of the
surrogate loss approaches studied in Zhang (2004) and Bartlett et al. (2006)
crucially relies on the assumption of correct specification, meaning that the
specified set of classifiers is rich enough to contain a first-best classifier.
This assumption is, however, less credible when the set of classifiers is
constrained by interpretability or fairness, leaving the applicability of
surrogate loss based algorithms unknown in such second-best scenarios. This
paper studies consistency of surrogate loss procedures under a constrained set
of classifiers without assuming correct specification. We show that in the
setting where the constraint restricts the classifier's prediction set only,
hinge losses (i.e., $\ell_1$-support vector machines) are the only surrogate
losses that preserve consistency in second-best scenarios. If the constraint
additionally restricts the functional form of the classifier, consistency of a
surrogate loss approach is not guaranteed even with hinge loss. We therefore
characterize conditions for the constrained set of classifiers that can
guarantee consistency of hinge risk minimizing classifiers. Exploiting our
theoretical results, we develop robust and computationally attractive hinge
loss based procedures for a monotone classification problem.","['Toru Kitagawa', 'Shosei Sakaguchi', 'Aleksey Tetenov']","['econ.EM', 'math.ST', 'stat.ML', 'stat.TH']",2021-06-24 10:43:00+00:00
http://arxiv.org/abs/2106.12871v1,DCoM: A Deep Column Mapper for Semantic Data Type Detection,"Detection of semantic data types is a very crucial task in data science for
automated data cleaning, schema matching, data discovery, semantic data type
normalization and sensitive data identification. Existing methods include
regular expression-based or dictionary lookup-based methods that are not robust
to dirty as well unseen data and are limited to a very less number of semantic
data types to predict. Existing Machine Learning methods extract large number
of engineered features from data and build logistic regression, random forest
or feedforward neural network for this purpose. In this paper, we introduce
DCoM, a collection of multi-input NLP-based deep neural networks to detect
semantic data types where instead of extracting large number of features from
the data, we feed the raw values of columns (or instances) to the model as
texts. We train DCoM on 686,765 data columns extracted from VizNet corpus with
78 different semantic data types. DCoM outperforms other contemporary results
with a quite significant margin on the same dataset.","['Subhadip Maji', 'Swapna Sourav Rout', 'Sudeep Choudhary']","['cs.LG', 'cs.AI', 'cs.CV', 'stat.ML']",2021-06-24 10:12:35+00:00
http://arxiv.org/abs/2106.12796v2,Three rates of convergence or separation via U-statistics in a dependent framework,"Despite the ubiquity of U-statistics in modern Probability and Statistics,
their non-asymptotic analysis in a dependent framework may have been
overlooked. In a recent work, a new concentration inequality for U-statistics
of order two for uniformly ergodic Markov chains has been proved. In this
paper, we put this theoretical breakthrough into action by pushing further the
current state of knowledge in three different active fields of research. First,
we establish a new exponential inequality for the estimation of spectra of
trace class integral operators with MCMC methods. The novelty is that this
result holds for kernels with positive and negative eigenvalues, which is new
as far as we know. In addition, we investigate generalization performance of
online algorithms working with pairwise loss functions and Markov chain
samples. We provide an online-to-batch conversion result by showing how we can
extract a low risk hypothesis from the sequence of hypotheses generated by any
online learner. We finally give a non-asymptotic analysis of a goodness-of-fit
test on the density of the invariant measure of a Markov chain. We identify
some classes of alternatives over which our test based on the $L_2$ distance
has a prescribed power.","['Quentin Duchemin', 'Yohann De Castro', 'Claire Lacour']","['math.ST', 'stat.ML', 'stat.TH']",2021-06-24 07:10:36+00:00
http://arxiv.org/abs/2106.12772v1,Task-agnostic Continual Learning with Hybrid Probabilistic Models,"Learning new tasks continuously without forgetting on a constantly changing
data distribution is essential for real-world problems but extremely
challenging for modern deep learning. In this work we propose HCL, a Hybrid
generative-discriminative approach to Continual Learning for classification. We
model the distribution of each task and each class with a normalizing flow. The
flow is used to learn the data distribution, perform classification, identify
task changes, and avoid forgetting, all leveraging the invertibility and exact
likelihood which are uniquely enabled by the normalizing flow model. We use the
generative capabilities of the flow to avoid catastrophic forgetting through
generative replay and a novel functional regularization technique. For task
identification, we use state-of-the-art anomaly detection techniques based on
measuring the typicality of the model's statistics. We demonstrate the strong
performance of HCL on a range of continual learning benchmarks such as
split-MNIST, split-CIFAR, and SVHN-MNIST.","['Polina Kirichenko', 'Mehrdad Farajtabar', 'Dushyant Rao', 'Balaji Lakshminarayanan', 'Nir Levine', 'Ang Li', 'Huiyi Hu', 'Andrew Gordon Wilson', 'Razvan Pascanu']","['cs.LG', 'stat.ML']",2021-06-24 05:19:26+00:00
http://arxiv.org/abs/2106.12766v2,Factors affecting the COVID-19 risk in the US counties: an innovative approach by combining unsupervised and supervised learning,"The COVID-19 disease spreads swiftly, and nearly three months after the first
positive case was confirmed in China, Coronavirus started to spread all over
the United States. Some states and counties reported high number of positive
cases and deaths, while some reported lower COVID-19 related cases and
mortality. In this paper, the factors that could affect the risk of COVID-19
infection and mortality were analyzed in county level. An innovative method by
using K-means clustering and several classification models is utilized to
determine the most critical factors. Results showed that mean temperature,
percent of people below poverty, percent of adults with obesity, air pressure,
population density, wind speed, longitude, and percent of uninsured people were
the most significant attributes","['Samira Ziyadidegan', 'Moein Razavi', 'Homa Pesarakli', 'Amir Hossein Javid', 'Madhav Erraguntla']","['cs.LG', 'stat.ML']",2021-06-24 04:29:00+00:00
http://arxiv.org/abs/2106.12751v1,Label Disentanglement in Partition-based Extreme Multilabel Classification,"Partition-based methods are increasingly-used in extreme multi-label
classification (XMC) problems due to their scalability to large output spaces
(e.g., millions or more). However, existing methods partition the large label
space into mutually exclusive clusters, which is sub-optimal when labels have
multi-modality and rich semantics. For instance, the label ""Apple"" can be the
fruit or the brand name, which leads to the following research question: can we
disentangle these multi-modal labels with non-exclusive clustering tailored for
downstream XMC tasks? In this paper, we show that the label assignment problem
in partition-based XMC can be formulated as an optimization problem, with the
objective of maximizing precision rates. This leads to an efficient algorithm
to form flexible and overlapped label clusters, and a method that can
alternatively optimizes the cluster assignments and the model parameters for
partition-based XMC. Experimental results on synthetic and real datasets show
that our method can successfully disentangle multi-modal labels, leading to
state-of-the-art (SOTA) results on four XMC benchmarks.","['Xuanqing Liu', 'Wei-Cheng Chang', 'Hsiang-Fu Yu', 'Cho-Jui Hsieh', 'Inderjit S. Dhillon']","['stat.ML', 'cs.LG']",2021-06-24 03:24:18+00:00
http://arxiv.org/abs/2106.12729v1,Finite-Sample Analysis of Off-Policy TD-Learning via Generalized Bellman Operators,"In temporal difference (TD) learning, off-policy sampling is known to be more
practical than on-policy sampling, and by decoupling learning from data
collection, it enables data reuse. It is known that policy evaluation
(including multi-step off-policy importance sampling) has the interpretation of
solving a generalized Bellman equation. In this paper, we derive finite-sample
bounds for any general off-policy TD-like stochastic approximation algorithm
that solves for the fixed-point of this generalized Bellman operator. Our key
step is to show that the generalized Bellman operator is simultaneously a
contraction mapping with respect to a weighted $\ell_p$-norm for each $p$ in
$[1,\infty)$, with a common contraction factor.
  Off-policy TD-learning is known to suffer from high variance due to the
product of importance sampling ratios. A number of algorithms (e.g.
$Q^\pi(\lambda)$, Tree-Backup$(\lambda)$, Retrace$(\lambda)$, and $Q$-trace)
have been proposed in the literature to address this issue. Our results
immediately imply finite-sample bounds of these algorithms. In particular, we
provide first-known finite-sample guarantees for $Q^\pi(\lambda)$,
Tree-Backup$(\lambda)$, and Retrace$(\lambda)$, and improve the best known
bounds of $Q$-trace in [19]. Moreover, we show the bias-variance trade-offs in
each of these algorithms.","['Zaiwei Chen', 'Siva Theja Maguluri', 'Sanjay Shakkottai', 'Karthikeyan Shanmugam']","['cs.LG', 'math.OC', 'stat.ML']",2021-06-24 02:22:36+00:00
http://arxiv.org/abs/2106.12674v2,Fairness via Representation Neutralization,"Existing bias mitigation methods for DNN models primarily work on learning
debiased encoders. This process not only requires a lot of instance-level
annotations for sensitive attributes, it also does not guarantee that all
fairness sensitive information has been removed from the encoder. To address
these limitations, we explore the following research question: Can we reduce
the discrimination of DNN models by only debiasing the classification head,
even with biased representations as inputs? To this end, we propose a new
mitigation technique, namely, Representation Neutralization for Fairness (RNF)
that achieves fairness by debiasing only the task-specific classification head
of DNN models. To this end, we leverage samples with the same ground-truth
label but different sensitive attributes, and use their neutralized
representations to train the classification head of the DNN model. The key idea
of RNF is to discourage the classification head from capturing spurious
correlation between fairness sensitive information in encoder representations
with specific class labels. To address low-resource settings with no access to
sensitive attribute annotations, we leverage a bias-amplified model to generate
proxy annotations for sensitive attributes. Experimental results over several
benchmark datasets demonstrate our RNF framework to effectively reduce
discrimination of DNN models with minimal degradation in task-specific
performance.","['Mengnan Du', 'Subhabrata Mukherjee', 'Guanchu Wang', 'Ruixiang Tang', 'Ahmed Hassan Awadallah', 'Xia Hu']","['cs.LG', 'cs.AI', 'cs.CY', 'stat.ML']",2021-06-23 22:26:29+00:00
http://arxiv.org/abs/2106.12639v1,Multi-objective Asynchronous Successive Halving,"Hyperparameter optimization (HPO) is increasingly used to automatically tune
the predictive performance (e.g., accuracy) of machine learning models.
However, in a plethora of real-world applications, accuracy is only one of the
multiple -- often conflicting -- performance criteria, necessitating the
adoption of a multi-objective (MO) perspective. While the literature on MO
optimization is rich, few prior studies have focused on HPO. In this paper, we
propose algorithms that extend asynchronous successive halving (ASHA) to the MO
setting. Considering multiple evaluation metrics, we assess the performance of
these methods on three real world tasks: (i) Neural architecture search, (ii)
algorithmic fairness and (iii) language model optimization. Our empirical
analysis shows that MO ASHA enables to perform MO HPO at scale. Further, we
observe that that taking the entire Pareto front into account for candidate
selection consistently outperforms multi-fidelity HPO based on MO scalarization
in terms of wall-clock time. Our algorithms (to be open-sourced) establish new
baselines for future research in the area.","['Robin Schmucker', 'Michele Donini', 'Muhammad Bilal Zafar', 'David Salinas', 'Cédric Archambeau']","['stat.ML', 'cs.LG']",2021-06-23 19:39:31+00:00
http://arxiv.org/abs/2106.12611v1,Adversarial Examples in Multi-Layer Random ReLU Networks,"We consider the phenomenon of adversarial examples in ReLU networks with
independent gaussian parameters. For networks of constant depth and with a
large range of widths (for instance, it suffices if the width of each layer is
polynomial in that of any other layer), small perturbations of input vectors
lead to large changes of outputs. This generalizes results of Daniely and
Schacham (2020) for networks of rapidly decreasing width and of Bubeck et al
(2021) for two-layer networks. The proof shows that adversarial examples arise
in these networks because the functions that they compute are very close to
linear. Bottleneck layers in the network play a key role: the minimal width up
to some point in the network determines scales and sensitivities of mappings
computed up to that point. The main result is for networks with constant depth,
but we also show that some constraint on depth is necessary for a result of
this kind, because there are suitably deep networks that, with constant
probability, compute a function that is close to constant.","['Peter L. Bartlett', 'Sébastien Bubeck', 'Yeshwanth Cherapanamjeri']","['cs.LG', 'cs.AI', 'stat.ML']",2021-06-23 18:16:34+00:00
http://arxiv.org/abs/2106.12575v3,Weisfeiler and Lehman Go Cellular: CW Networks,"Graph Neural Networks (GNNs) are limited in their expressive power, struggle
with long-range interactions and lack a principled way to model higher-order
structures. These problems can be attributed to the strong coupling between the
computational graph and the input graph structure. The recently proposed
Message Passing Simplicial Networks naturally decouple these elements by
performing message passing on the clique complex of the graph. Nevertheless,
these models can be severely constrained by the rigid combinatorial structure
of Simplicial Complexes (SCs). In this work, we extend recent theoretical
results on SCs to regular Cell Complexes, topological objects that flexibly
subsume SCs and graphs. We show that this generalisation provides a powerful
set of graph ""lifting"" transformations, each leading to a unique hierarchical
message passing procedure. The resulting methods, which we collectively call CW
Networks (CWNs), are strictly more powerful than the WL test and not less
powerful than the 3-WL test. In particular, we demonstrate the effectiveness of
one such scheme, based on rings, when applied to molecular graph problems. The
proposed architecture benefits from provably larger expressivity than commonly
used GNNs, principled modelling of higher-order signals and from compressing
the distances between nodes. We demonstrate that our model achieves
state-of-the-art results on a variety of molecular datasets.","['Cristian Bodnar', 'Fabrizio Frasca', 'Nina Otter', 'Yu Guang Wang', 'Pietro Liò', 'Guido Montúfar', 'Michael Bronstein']","['cs.LG', 'stat.ML']",2021-06-23 17:59:16+00:00
