id,title,abstract,authors,categories,date
http://arxiv.org/abs/1904.05233v1,What's in a Name? Reducing Bias in Bios without Access to Protected Attributes,"There is a growing body of work that proposes methods for mitigating bias in
machine learning systems. These methods typically rely on access to protected
attributes such as race, gender, or age. However, this raises two significant
challenges: (1) protected attributes may not be available or it may not be
legal to use them, and (2) it is often desirable to simultaneously consider
multiple protected attributes, as well as their intersections. In the context
of mitigating bias in occupation classification, we propose a method for
discouraging correlation between the predicted probability of an individual's
true occupation and a word embedding of their name. This method leverages the
societal biases that are encoded in word embeddings, eliminating the need for
access to protected attributes. Crucially, it only requires access to
individuals' names at training time and not at deployment time. We evaluate two
variations of our proposed method using a large-scale dataset of online
biographies. We find that both variations simultaneously reduce race and gender
biases, with almost no reduction in the classifier's overall true positive
rate.","['Alexey Romanov', 'Maria De-Arteaga', 'Hanna Wallach', 'Jennifer Chayes', 'Christian Borgs', 'Alexandra Chouldechova', 'Sahin Geyik', 'Krishnaram Kenthapadi', 'Anna Rumshisky', 'Adam Tauman Kalai']","['cs.LG', 'cs.CL', 'stat.ML']",2019-04-10 15:10:37+00:00
http://arxiv.org/abs/1904.05207v1,Know Your Boundaries: Constraining Gaussian Processes by Variational Harmonic Features,"Gaussian processes (GPs) provide a powerful framework for extrapolation,
interpolation, and noise removal in regression and classification. This paper
considers constraining GPs to arbitrarily-shaped domains with boundary
conditions. We solve a Fourier-like generalised harmonic feature representation
of the GP prior in the domain of interest, which both constrains the GP and
attains a low-rank representation that is used for speeding up inference. The
method scales as $\mathcal{O}(nm^2)$ in prediction and $\mathcal{O}(m^3)$ in
hyperparameter learning for regression, where $n$ is the number of data points
and $m$ the number of features. Furthermore, we make use of the variational
approach to allow the method to deal with non-Gaussian likelihoods. The
experiments cover both simulated and empirical data in which the boundary
conditions allow for inclusion of additional physical information.","['Arno Solin', 'Manon Kok']","['stat.ML', 'cs.LG']",2019-04-10 14:24:26+00:00
http://arxiv.org/abs/1904.07787v1,Topological based classification of paper domains using graph convolutional networks,"The main approaches for node classification in graphs are information
propagation and the association of the class of the node with external
information. State of the art methods merge these approaches through Graph
Convolutional Networks. We here use the association of topological features of
the nodes with their class to predict this class. Moreover, combining
topological information with information propagation improves classification
accuracy on the standard CiteSeer and Cora paper classification task.
Topological features and information propagation produce results almost as good
as text-based classification, without no textual or content information. We
propose to represent the topology and information propagation through a GCN
with the neighboring training node classification as an input and the current
node classification as output. Such a formalism outperforms state of the art
methods.","['Idan Benami', 'Keren Cohen', 'Oved Nagar', 'Yoram Louzoun']","['cs.SI', 'cs.LG', 'stat.ML']",2019-04-10 14:04:11+00:00
http://arxiv.org/abs/1904.05187v2,A Reproducing Kernel Hilbert Space log-rank test for the two-sample problem,"Weighted log-rank tests are arguably the most widely used tests by
practitioners for the two-sample problem in the context of right-censored data.
Many approaches have been considered to make weighted log-rank tests more
robust against a broader family of alternatives, among them, considering linear
combinations of weighted log-rank tests, and taking the maximum among a finite
collection of them. In this paper, we propose as test statistic the supremum of
a collection of (potentially infinite) weight-indexed log-rank tests where the
index space is the unit ball in a reproducing kernel Hilbert space (RKHS). By
using some desirable properties of RKHSs we provide an exact and simple
evaluation of the test statistic and establish connections with previous tests
in the literature. Additionally, we show that for a special family of RKHSs,
the proposed test is omnibus. We finalise by performing an empirical evaluation
of the proposed methodology and show an application to a real data scenario.
Our theoretical results are proved using techniques for double integrals with
respect to martingales that may be of independent interest.","['Tamara Fernandez', 'Nicolas Rivera']","['stat.ME', 'stat.ML']",2019-04-10 13:44:36+00:00
http://arxiv.org/abs/1904.05181v2,Black-box Adversarial Attacks on Video Recognition Models,"Deep neural networks (DNNs) are known for their vulnerability to adversarial
examples. These are examples that have undergone small, carefully crafted
perturbations, and which can easily fool a DNN into making misclassifications
at test time. Thus far, the field of adversarial research has mainly focused on
image models, under either a white-box setting, where an adversary has full
access to model parameters, or a black-box setting where an adversary can only
query the target model for probabilities or labels. Whilst several white-box
attacks have been proposed for video models, black-box video attacks are still
unexplored. To close this gap, we propose the first black-box video attack
framework, called V-BAD. V-BAD utilizes tentative perturbations transferred
from image models, and partition-based rectifications found by the NES on
partitions (patches) of tentative perturbations, to obtain good adversarial
gradient estimates with fewer queries to the target model. V-BAD is equivalent
to estimating the projection of an adversarial gradient on a selected subspace.
Using three benchmark video datasets, we demonstrate that V-BAD can craft both
untargeted and targeted attacks to fool two state-of-the-art deep video
recognition models. For the targeted attack, it achieves $>$93\% success rate
using only an average of $3.4 \sim 8.4 \times 10^4$ queries, a similar number
of queries to state-of-the-art black-box image attacks. This is despite the
fact that videos often have two orders of magnitude higher dimensionality than
static images. We believe that V-BAD is a promising new tool to evaluate and
improve the robustness of video recognition models to black-box adversarial
attacks.","['Linxi Jiang', 'Xingjun Ma', 'Shaoxiang Chen', 'James Bailey', 'Yu-Gang Jiang']","['cs.LG', 'cs.CR', 'cs.CV', 'cs.MM', 'stat.ML']",2019-04-10 13:41:02+00:00
http://arxiv.org/abs/1904.05100v2,Knowledge Squeezed Adversarial Network Compression,"Deep network compression has been achieved notable progress via knowledge
distillation, where a teacher-student learning manner is adopted by using
predetermined loss. Recently, more focuses have been transferred to employ the
adversarial training to minimize the discrepancy between distributions of
output from two networks. However, they always emphasize on result-oriented
learning while neglecting the scheme of process-oriented learning, leading to
the loss of rich information contained in the whole network pipeline. Inspired
by the assumption that, the small network can not perfectly mimic a large one
due to the huge gap of network scale, we propose a knowledge transfer method,
involving effective intermediate supervision, under the adversarial training
framework to learn the student network. To achieve powerful but highly compact
intermediate information representation, the squeezed knowledge is realized by
task-driven attention mechanism. Then, the transferred knowledge from teacher
network could accommodate the size of student network. As a result, the
proposed method integrates merits from both process-oriented and
result-oriented learning. Extensive experimental results on three typical
benchmark datasets, i.e., CIFAR-10, CIFAR-100, and ImageNet, demonstrate that
our method achieves highly superior performances against other state-of-the-art
methods.","['Shu Changyong', 'Li Peng', 'Xie Yuan', 'Qu Yanyun', 'Dai Longquan', 'Ma Lizhuang']","['cs.LG', 'stat.ML']",2019-04-10 10:42:33+00:00
http://arxiv.org/abs/1904.05351v2,RawNet: Fast End-to-End Neural Vocoder,"Neural network-based vocoders have recently demonstrated the powerful ability
to synthesize high-quality speech. These models usually generate samples by
conditioning on spectral features, such as Mel-spectrogram and fundamental
frequency, which is crucial to speech synthesis. However, the feature
extraction procession tends to depend heavily on human knowledge resulting in a
less expressive description of the origin audio. In this work, we proposed
RawNet, a complete end-to-end neural vocoder following the auto-encoder
structure for speaker-dependent and -independent speech synthesis. It
automatically learns to extract features and recover audio using neural
networks, which include a coder network to capture a higher representation of
the input audio and an autoregressive voder network to restore the audio in a
sample-by-sample manner. The coder and voder are jointly trained directly on
the raw waveform without any human-designed features. The experimental results
show that RawNet achieves a better speech quality using a simplified model
architecture and obtains a faster speech generation speed at the inference
stage.","['Yunchao He', 'Yujun Wang']","['eess.AS', 'cs.LG', 'cs.SD', 'stat.ML']",2019-04-10 10:25:25+00:00
http://arxiv.org/abs/1904.05098v1,Multitask Hopfield Networks,"Multitask algorithms typically use task similarity information as a bias to
speed up and improve the performance of learning processes. Tasks are learned
jointly, sharing information across them, in order to construct models more
accurate than those learned separately over single tasks. In this contribution,
we present the first multitask model, to our knowledge, based on Hopfield
Networks (HNs), named HoMTask. We show that by appropriately building a unique
HN embedding all tasks, a more robust and effective classification model can be
learned. HoMTask is a transductive semi-supervised parametric HN, that
minimizes an energy function extended to all nodes and to all tasks under
study. We provide theoretical evidence that the optimal parameters
automatically estimated by HoMTask make coherent the model itself with the
prior knowledge (connection weights and node labels). The convergence
properties of HNs are preserved, and the fixed point reached by the network
dynamics gives rise to the prediction of unlabeled nodes. The proposed model
improves the classification abilities of singletask HNs on a preliminary
benchmark comparison, and achieves competitive performance with
state-of-the-art semi-supervised graph-based algorithms.","['Marco Frasca', 'Giuliano Grossi', 'Giorgio Valentini']","['cs.LG', 'cs.NE', 'stat.ML']",2019-04-10 10:25:19+00:00
http://arxiv.org/abs/1904.05052v1,Classification of signaling proteins based on molecular star graph descriptors using Machine Learning models,"Signaling proteins are an important topic in drug development due to the
increased importance of finding fast, accurate and cheap methods to evaluate
new molecular targets involved in specific diseases. The complexity of the
protein structure hinders the direct association of the signaling activity with
the molecular structure. Therefore, the proposed solution involves the use of
protein star graphs for the peptide sequence information encoding into specific
topological indices calculated with S2SNet tool. The Quantitative
Structure-Activity Relationship classification model obtained with Machine
Learning techniques is able to predict new signaling peptides. The best
classification model is the first signaling prediction model, which is based on
eleven descriptors and it was obtained using the Support Vector Machines -
Recursive Feature Elimination (SVM-RFE) technique with the Laplacian kernel
(RFE-LAP) and an AUROC of 0.961. Testing a set of 3114 proteins of unknown
function from the PDB database assessed the prediction performance of the
model. Important signaling pathways are presented for three UniprotIDs (34
PDBs) with a signaling prediction greater than 98.0%.","['Carlos Fernandez-Lozano', 'Ruben F. Cuinas', 'Jose A. Seoane', 'Enrique Fernandez-Blanco', 'Julian Dorado', 'Cristian R. Munteanu']","['q-bio.QM', 'cs.LG', 'stat.ML']",2019-04-10 08:22:35+00:00
http://arxiv.org/abs/1904.05780v1,Corpora Generation for Grammatical Error Correction,"Grammatical Error Correction (GEC) has been recently modeled using the
sequence-to-sequence framework. However, unlike sequence transduction problems
such as machine translation, GEC suffers from the lack of plentiful parallel
data. We describe two approaches for generating large parallel datasets for GEC
using publicly available Wikipedia data. The first method extracts
source-target pairs from Wikipedia edit histories with minimal filtration
heuristics, while the second method introduces noise into Wikipedia sentences
via round-trip translation through bridge languages. Both strategies yield
similar sized parallel corpora containing around 4B tokens. We employ an
iterative decoding strategy that is tailored to the loosely supervised nature
of our constructed corpora. We demonstrate that neural GEC models trained using
either type of corpora give similar performance. Fine-tuning these models on
the Lang-8 corpus and ensembling allows us to surpass the state of the art on
both the CoNLL-2014 benchmark and the JFLEG task. We provide systematic
analysis that compares the two approaches to data generation and highlights the
effectiveness of ensembling.","['Jared Lichtarge', 'Chris Alberti', 'Shankar Kumar', 'Noam Shazeer', 'Niki Parmar', 'Simon Tong']","['cs.CL', 'stat.ML']",2019-04-10 05:47:15+00:00
http://arxiv.org/abs/1904.04994v1,Discovering patterns of online popularity from time series,"How is popularity gained online? Is being successful strictly related to
rapidly becoming viral in an online platform or is it possible to acquire
popularity in a steady and disciplined fashion? What are other temporal
characteristics that can unveil the popularity of online content? To answer
these questions, we leverage a multi-faceted temporal analysis of the evolution
of popular online contents. Here, we present dipm-SC: a multi-dimensional
shape-based time-series clustering algorithm with a heuristic to find the
optimal number of clusters. First, we validate the accuracy of our algorithm on
synthetic datasets generated from benchmark time series models. Second, we show
that dipm-SC can uncover meaningful clusters of popularity behaviors in a
real-world Twitter dataset. By clustering the multidimensional time-series of
the popularity of contents coupled with other domain-specific dimensions, we
uncover two main patterns of popularity: bursty and steady temporal behaviors.
Moreover, we find that the way popularity is gained over time has no
significant impact on the final cumulative popularity.","['Mert Ozer', 'Anna Sapienza', 'Andrés Abeliuk', 'Goran Muric', 'Emilio Ferrara']","['cs.LG', 'cs.SI', 'stat.ML']",2019-04-10 03:47:49+00:00
http://arxiv.org/abs/1904.04990v2,Identifying Sub-Phenotypes of Acute Kidney Injury using Structured and Unstructured Electronic Health Record Data with Memory Networks,"Acute Kidney Injury (AKI) is a common clinical syndrome characterized by the
rapid loss of kidney excretory function, which aggravates the clinical severity
of other diseases in a large number of hospitalized patients. Accurate early
prediction of AKI can enable in-time interventions and treatments. However, AKI
is highly heterogeneous, thus identification of AKI sub-phenotypes can lead to
an improved understanding of the disease pathophysiology and development of
more targeted clinical interventions. This study used a memory network-based
deep learning approach to discover AKI sub-phenotypes using structured and
unstructured electronic health record (EHR) data of patients before AKI
diagnosis. We leveraged a real world critical care EHR corpus including 37,486
ICU stays. Our approach identified three distinct sub-phenotypes: sub-phenotype
I is with an average age of 63.03$ \pm 17.25 $ years, and is characterized by
mild loss of kidney excretory function (Serum Creatinine (SCr) $1.55\pm 0.34$
mg/dL, estimated Glomerular Filtration Rate Test (eGFR) $107.65\pm 54.98$
mL/min/1.73$m^2$). These patients are more likely to develop stage I AKI.
Sub-phenotype II is with average age 66.81$ \pm 10.43 $ years, and was
characterized by severe loss of kidney excretory function (SCr $1.96\pm 0.49$
mg/dL, eGFR $82.19\pm 55.92$ mL/min/1.73$m^2$). These patients are more likely
to develop stage III AKI. Sub-phenotype III is with average age 65.07$ \pm
11.32 $ years, and was characterized moderate loss of kidney excretory function
and thus more likely to develop stage II AKI (SCr $1.69\pm 0.32$ mg/dL, eGFR
$93.97\pm 56.53$ mL/min/1.73$m^2$). Both SCr and eGFR are significantly
different across the three sub-phenotypes with statistical testing plus postdoc
analysis, and the conclusion still holds after age adjustment.","['Zhenxing Xu', 'Jingyuan Chou', 'Xi Sheryl Zhang', 'Yuan Luo', 'Tamara Isakova', 'Prakash Adekkanattu', 'Jessica S. Ancker', 'Guoqian Jiang', 'Richard C. Kiefer', 'Jennifer A. Pacheco', 'Luke V. Rasmussen', 'Jyotishman Pathak', 'Fei Wang']","['cs.LG', 'stat.ML']",2019-04-10 03:22:34+00:00
http://arxiv.org/abs/1904.04973v2,Model-Free Reinforcement Learning for Financial Portfolios: A Brief Survey,"Financial portfolio management is one of the problems that are most
frequently encountered in the investment industry. Nevertheless, it is not
widely recognized that both Kelly Criterion and Risk Parity collapse into Mean
Variance under some conditions, which implies that a universal solution to the
portfolio optimization problem could potentially exist. In fact, the process of
sequential computation of optimal component weights that maximize the
portfolio's expected return subject to a certain risk budget can be
reformulated as a discrete-time Markov Decision Process (MDP) and hence as a
stochastic optimal control, where the system being controlled is a portfolio
consisting of multiple investment components, and the control is its component
weights. Consequently, the problem could be solved using model-free
Reinforcement Learning (RL) without knowing specific component dynamics. By
examining existing methods of both value-based and policy-based model-free RL
for the portfolio optimization problem, we identify some of the key unresolved
questions and difficulties facing today's portfolio managers of applying
model-free RL to their investment portfolios.",['Yoshiharu Sato'],"['q-fin.PM', 'cs.AI', 'cs.LG', 'stat.ML']",2019-04-10 01:48:52+00:00
http://arxiv.org/abs/1904.04956v1,Distributed Deep Learning Strategies For Automatic Speech Recognition,"In this paper, we propose and investigate a variety of distributed deep
learning strategies for automatic speech recognition (ASR) and evaluate them
with a state-of-the-art Long short-term memory (LSTM) acoustic model on the
2000-hour Switchboard (SWB2000), which is one of the most widely used datasets
for ASR performance benchmark. We first investigate what are the proper
hyper-parameters (e.g., learning rate) to enable the training with sufficiently
large batch size without impairing the model accuracy. We then implement
various distributed strategies, including Synchronous (SYNC), Asynchronous
Decentralized Parallel SGD (ADPSGD) and the hybrid of the two HYBRID, to study
their runtime/accuracy trade-off. We show that we can train the LSTM model
using ADPSGD in 14 hours with 16 NVIDIA P100 GPUs to reach a 7.6% WER on the
Hub5- 2000 Switchboard (SWB) test set and a 13.1% WER on the CallHome (CH) test
set. Furthermore, we can train the model using HYBRID in 11.5 hours with 32
NVIDIA V100 GPUs without loss in accuracy.","['Wei Zhang', 'Xiaodong Cui', 'Ulrich Finkler', 'Brian Kingsbury', 'George Saon', 'David Kung', 'Michael Picheny']","['cs.SD', 'cs.CL', 'cs.LG', 'eess.AS', 'stat.ML']",2019-04-10 01:00:26+00:00
http://arxiv.org/abs/1904.04940v1,Handling temporality of clinical events with application to Adverse Drug Event detection in Electronic Health Records: A scoping review,"The increased adoption of Electronic Health Records(EHRs) has brought changes
to the way the patient care is carried out. The rich heterogeneous and temporal
data space stored in EHRs can be leveraged by machine learning models to
capture the underlying information and make clinically relevant predictions.
This can be exploited to support public health activities such as
pharmacovigilance and specifically mitigate the public health issue of Adverse
Drug Events(ADEs). The aim of this article is, therefore, to investigate the
various ways of handling temporal data for the purpose of detecting ADEs. Based
on a review of the existing literature, 11 articles from the last 10 years were
chosen to be studied. According to the literature retrieved the main methods
were found to fall into 5 different approaches: based on temporal abstraction,
graph-based, learning weights and data tables containing time series of
different length. To that end, EHRs are a valuable source that has led current
research to the automatic detection of ADEs. Yet there still exists a great
deal of challenges that concerns the exploitation of the heterogeneous, data
types with temporal information included in EHRs for predicting ADEs.",['Maria Bampa'],"['cs.LG', 'stat.ML']",2019-04-09 22:46:20+00:00
http://arxiv.org/abs/1904.04917v1,Novel Uncertainty Framework for Deep Learning Ensembles,"Deep neural networks have become the default choice for many of the machine
learning tasks such as classification and regression. Dropout, a method
commonly used to improve the convergence of deep neural networks, generates an
ensemble of thinned networks with extensive weight sharing. Recent studies that
dropout can be viewed as an approximate variational inference in Gaussian
processes, and used as a practical tool to obtain uncertainty estimates of the
network. We propose a novel statistical mechanics based framework to dropout
and use this framework to propose a new generic algorithm that focuses on
estimates of the variance of the loss as measured by the ensemble of thinned
networks. Our approach can be applied to a wide range of deep neural network
architectures and machine learning tasks. In classification, this algorithm
allows the generation of a don't-know answer to be generated, which can
increase the reliability of the classifier. Empirically we demonstrate
state-of-the-art AUC results on publicly available benchmarks.","['Tal Kachman', 'Michal Moshkovitz', 'Michal Rosen-Zvi']","['stat.ML', 'cs.LG']",2019-04-09 21:31:08+00:00
http://arxiv.org/abs/1904.04912v3,Enhancing Time Series Momentum Strategies Using Deep Neural Networks,"While time series momentum is a well-studied phenomenon in finance, common
strategies require the explicit definition of both a trend estimator and a
position sizing rule. In this paper, we introduce Deep Momentum Networks -- a
hybrid approach which injects deep learning based trading rules into the
volatility scaling framework of time series momentum. The model also
simultaneously learns both trend estimation and position sizing in a
data-driven manner, with networks directly trained by optimising the Sharpe
ratio of the signal. Backtesting on a portfolio of 88 continuous futures
contracts, we demonstrate that the Sharpe-optimised LSTM improved traditional
methods by more than two times in the absence of transactions costs, and
continue outperforming when considering transaction costs up to 2-3 basis
points. To account for more illiquid assets, we also propose a turnover
regularisation term which trains the network to factor in costs at run-time.","['Bryan Lim', 'Stefan Zohren', 'Stephen Roberts']","['stat.ML', 'cs.LG', 'q-fin.TR']",2019-04-09 21:06:55+00:00
http://arxiv.org/abs/1904.08502v2,Few-Shot Learning with Localization in Realistic Settings,"Traditional recognition methods typically require large,
artificially-balanced training classes, while few-shot learning methods are
tested on artificially small ones. In contrast to both extremes, real world
recognition problems exhibit heavy-tailed class distributions, with cluttered
scenes and a mix of coarse and fine-grained class distinctions. We show that
prior methods designed for few-shot learning do not work out of the box in
these challenging conditions, based on a new ""meta-iNat"" benchmark. We
introduce three parameter-free improvements: (a) better training procedures
based on adapting cross-validation to meta-learning, (b) novel architectures
that localize objects using limited bounding box annotations before
classification, and (c) simple parameter-free expansions of the feature space
based on bilinear pooling. Together, these improvements double the accuracy of
state-of-the-art models on meta-iNat while generalizing to prior benchmarks,
complex neural architectures, and settings with substantial domain shift.","['Davis Wertheimer', 'Bharath Hariharan']","['cs.CV', 'cs.AI', 'cs.LG', 'stat.ML']",2019-04-09 20:20:38+00:00
