id,title,abstract,authors,categories,date
http://arxiv.org/abs/2211.08572v3,Bayesian Fixed-Budget Best-Arm Identification,"Fixed-budget best-arm identification (BAI) is a bandit problem where the
agent maximizes the probability of identifying the optimal arm within a fixed
budget of observations. In this work, we study this problem in the Bayesian
setting. We propose a Bayesian elimination algorithm and derive an upper bound
on its probability of misidentifying the optimal arm. The bound reflects the
quality of the prior and is the first distribution-dependent bound in this
setting. We prove it using a frequentist-like argument, where we carry the
prior through, and then integrate out the bandit instance at the end. We also
provide a lower bound on the probability of misidentification in a $2$-armed
Bayesian bandit and show that our upper bound (almost) matches it for any
budget. Our experiments show that Bayesian elimination is superior to
frequentist methods and competitive with the state-of-the-art Bayesian
algorithms that have no guarantees in our setting.","['Alexia Atsidakou', 'Sumeet Katariya', 'Sujay Sanghavi', 'Branislav Kveton']","['cs.LG', 'stat.ML']",2022-11-15 23:29:51+00:00
http://arxiv.org/abs/2211.08499v1,Probabilistic Querying of Continuous-Time Event Sequences,"Continuous-time event sequences, i.e., sequences consisting of continuous
time stamps and associated event types (""marks""), are an important type of
sequential data with many applications, e.g., in clinical medicine or user
behavior modeling. Since these data are typically modeled autoregressively
(e.g., using neural Hawkes processes or their classical counterparts), it is
natural to ask questions about future scenarios such as ""what kind of event
will occur next"" or ""will an event of type $A$ occur before one of type $B$"".
Unfortunately, some of these queries are notoriously hard to address since
current methods are limited to naive simulation, which can be highly
inefficient. This paper introduces a new typology of query types and a
framework for addressing them using importance sampling. Example queries
include predicting the $n^\text{th}$ event type in a sequence and the hitting
time distribution of one or more event types. We also leverage these findings
further to be applicable for estimating general ""$A$ before $B$"" type of
queries. We prove theoretically that our estimation method is effectively
always better than naive simulation and show empirically based on three
real-world datasets that it is on average 1,000 times more efficient than
existing approaches.","['Alex Boyd', 'Yuxin Chang', 'Stephan Mandt', 'Padhraic Smyth']","['stat.ML', 'cs.LG']",2022-11-15 20:58:00+00:00
http://arxiv.org/abs/2211.08414v2,Model free variable importance for high dimensional data,"A model-agnostic variable importance method can be used with arbitrary
prediction functions. Here we present some model-free methods that do not
require access to the prediction function. This is useful when that function is
proprietary and not available, or just extremely expensive. It is also useful
when studying residuals from a model. The cohort Shapley (CS) method is
model-free but has exponential cost in the dimension of the input space. A
supervised on-manifold Shapley method from Frye et al. (2020) is also model
free but requires as input a second black box model that has to be trained for
the Shapley value problem. We introduce an integrated gradient (IG) version of
cohort Shapley, called IGCS, with cost $\mathcal{O}(nd)$. We show that over the
vast majority of the relevant unit cube that the IGCS value function is close
to a multilinear function for which IGCS matches CS. Another benefit of IGCS is
that is allows IG methods to be used with binary predictors. We use some area
between curves (ABC) measures to quantify the performance of IGCS. On a problem
from high energy physics we verify that IGCS has nearly the same ABCs as CS
does. We also use it on a problem from computational chemistry in 1024
variables. We see there that IGCS attains much higher ABCs than we get from
Monte Carlo sampling. The code is publicly available at
https://github.com/cohortshapley/cohortintgrad","['Naofumi Hama', 'Masayoshi Mase', 'Art B. Owen']","['cs.LG', 'cs.AI', 'stat.ML']",2022-11-15 18:51:41+00:00
http://arxiv.org/abs/2211.08403v3,REPAIR: REnormalizing Permuted Activations for Interpolation Repair,"In this paper we look into the conjecture of Entezari et al. (2021) which
states that if the permutation invariance of neural networks is taken into
account, then there is likely no loss barrier to the linear interpolation
between SGD solutions. First, we observe that neuron alignment methods alone
are insufficient to establish low-barrier linear connectivity between SGD
solutions due to a phenomenon we call variance collapse: interpolated deep
networks suffer a collapse in the variance of their activations, causing poor
performance. Next, we propose REPAIR (REnormalizing Permuted Activations for
Interpolation Repair) which mitigates variance collapse by rescaling the
preactivations of such interpolated networks. We explore the interaction
between our method and the choice of normalization layer, network width, and
depth, and demonstrate that using REPAIR on top of neuron alignment methods
leads to 60%-100% relative barrier reduction across a wide variety of
architecture families and tasks. In particular, we report a 74% barrier
reduction for ResNet50 on ImageNet and 90% barrier reduction for ResNet18 on
CIFAR10.","['Keller Jordan', 'Hanie Sedghi', 'Olga Saukh', 'Rahim Entezari', 'Behnam Neyshabur']","['cs.LG', 'cs.AI', 'cs.CV', 'stat.ML']",2022-11-15 18:45:26+00:00
http://arxiv.org/abs/2211.08393v1,On the Performance of Direct Loss Minimization for Bayesian Neural Networks,"Direct Loss Minimization (DLM) has been proposed as a pseudo-Bayesian method
motivated as regularized loss minimization. Compared to variational inference,
it replaces the loss term in the evidence lower bound (ELBO) with the
predictive log loss, which is the same loss function used in evaluation. A
number of theoretical and empirical results in prior work suggest that DLM can
significantly improve over ELBO optimization for some models. However, as we
point out in this paper, this is not the case for Bayesian neural networks
(BNNs). The paper explores the practical performance of DLM for BNN, the
reasons for its failure and its relationship to optimizing the ELBO, uncovering
some interesting facts about both algorithms.","['Yadi Wei', 'Roni Khardon']","['cs.LG', 'stat.ML']",2022-11-15 18:39:06+00:00
http://arxiv.org/abs/2211.08385v1,CardiacGen: A Hierarchical Deep Generative Model for Cardiac Signals,"We present CardiacGen, a Deep Learning framework for generating synthetic but
physiologically plausible cardiac signals like ECG. Based on the physiology of
cardiovascular system function, we propose a modular hierarchical generative
model and impose explicit regularizing constraints for training each module
using multi-objective loss functions. The model comprises 2 modules, an HRV
module focused on producing realistic Heart-Rate-Variability characteristics
and a Morphology module focused on generating realistic signal morphologies for
different modalities. We empirically show that in addition to having realistic
physiological features, the synthetic data from CardiacGen can be used for data
augmentation to improve the performance of Deep Learning based classifiers.
CardiacGen code is available at
https://github.com/SENSE-Lab-OSU/cardiac_gen_model.","['Tushar Agarwal', 'Emre Ertin']","['cs.LG', 'cs.AI', 'eess.SP', 'stat.ML']",2022-11-15 18:32:36+00:00
http://arxiv.org/abs/2211.08327v3,Weighted Sum-Rate Maximization With Causal Inference for Latent Interference Estimation,"The paper investigates the weighted sum-rate maximization (WSRM) problem with
latent interfering sources outside the known network, whose power allocation
policy is hidden from and uncontrollable to optimization. The paper extends the
famous alternate optimization algorithm weighted minimum mean square error
(WMMSE) [1] under a causal inference framework to tackle with WSRM.
Specifically, with the possibility of power policy shifting in the hidden
network, computing an iterating direction based only on the observed
interference inherently implies that counterfactual is ignored in decision
making. A method called synthetic control (SC) is used to estimate the
counterfactual. For any link in the known network, SC constructs a convex
combination of the interference on other links and uses it as an estimate for
the counterfactual. Power iteration in the proposed SC-WMMSE is performed
taking into account both the observed interference and its counterfactual.
SC-WMMSE requires no more information than the original WMMSE in the
optimization stage. To our best knowledge, this is the first paper explores the
potential of SC in assisting mathematical optimization in addressing classic
wireless optimization problems. Numerical results suggest the superiority of
the SC-WMMSE over the original in both convergence and objective.",['Lei You'],"['cs.IT', 'math.IT', 'stat.ML']",2022-11-15 17:27:45+00:00
http://arxiv.org/abs/2211.08311v1,On Penalization in Stochastic Multi-armed Bandits,"We study an important variant of the stochastic multi-armed bandit (MAB)
problem, which takes penalization into consideration. Instead of directly
maximizing cumulative expected reward, we need to balance between the total
reward and fairness level. In this paper, we present some new insights in MAB
and formulate the problem in the penalization framework, where rigorous
penalized regret can be well defined and more sophisticated regret analysis is
possible. Under such a framework, we propose a hard-threshold UCB-like
algorithm, which enjoys many merits including asymptotic fairness, nearly
optimal regret, better tradeoff between reward and fairness. Both gap-dependent
and gap-independent regret bounds have been established. Multiple insightful
comments are given to illustrate the soundness of our theoretical analysis.
Numerous experimental results corroborate the theory and show the superiority
of our method over other existing methods.","['Guanhua Fang', 'Ping Li', 'Gennady Samorodnitsky']","['stat.ML', 'cs.LG']",2022-11-15 17:13:09+00:00
http://arxiv.org/abs/2211.08303v1,Reverberation as Supervision for Speech Separation,"This paper proposes reverberation as supervision (RAS), a novel unsupervised
loss function for single-channel reverberant speech separation. Prior methods
for unsupervised separation required the synthesis of mixtures of mixtures or
assumed the existence of a teacher model, making them difficult to consider as
potential methods explaining the emergence of separation abilities in an
animal's auditory system. We assume the availability of two-channel mixtures at
training time, and train a neural network to separate the sources given one of
the channels as input such that the other channel may be predicted from the
separated sources. As the relationship between the room impulse responses
(RIRs) of each channel depends on the locations of the sources, which are
unknown to the network, the network cannot rely on learning that relationship.
Instead, our proposed loss function fits each of the separated sources to the
mixture in the target channel via Wiener filtering, and compares the resulting
mixture to the ground-truth one. We show that minimizing the scale-invariant
signal-to-distortion ratio (SI-SDR) of the predicted right-channel mixture with
respect to the ground truth implicitly guides the network towards separating
the left-channel sources. On a semi-supervised reverberant speech separation
task based on the WHAMR! dataset, using training data where just 5% (resp.,
10%) of the mixtures are labeled with associated isolated sources, we achieve
70% (resp., 78%) of the SI-SDR improvement obtained when training with
supervision on the full training set, while a model trained only on the labeled
data obtains 43% (resp., 45%).","['Rohith Aralikatti', 'Christoph Boeddeker', 'Gordon Wichern', 'Aswin Shanmugam Subramanian', 'Jonathan Le Roux']","['eess.AS', 'cs.AI', 'cs.LG', 'cs.SD', 'stat.ML']",2022-11-15 17:06:50+00:00
http://arxiv.org/abs/2211.08262v4,A mixed-categorical correlation kernel for Gaussian process,"Recently, there has been a growing interest for mixed-categorical meta-models
based on Gaussian process (GP) surrogates. In this setting, several existing
approaches use different strategies either by using continuous kernels (e.g.,
continuous relaxation and Gower distance based GP) or by using a direct
estimation of the correlation matrix. In this paper, we present a kernel-based
approach that extends continuous exponential kernels to handle
mixed-categorical variables. The proposed kernel leads to a new GP surrogate
that generalizes both the continuous relaxation and the Gower distance based GP
models. We demonstrate, on both analytical and engineering problems, that our
proposed GP model gives a higher likelihood and a smaller residual error than
the other kernel-based state-of-the-art models. Our method is available in the
open-source software SMT.","['P. Saves', 'Y. Diouane', 'N. Bartoli', 'T. Lefebvre', 'J. Morlier']","['math.OC', 'cs.LG', 'stat.ML']",2022-11-15 16:13:04+00:00
http://arxiv.org/abs/2211.09024v1,Phenomenological Causality,"Discussions on causal relations in real life often consider variables for
which the definition of causality is unclear since the notion of interventions
on the respective variables is obscure. Asking 'what qualifies an action for
being an intervention on the variable X' raises the question whether the action
impacted all other variables only through X or directly, which implicitly
refers to a causal model.
  To avoid this known circularity, we instead suggest a notion of
'phenomenological causality' whose basic concept is a set of elementary
actions. Then the causal structure is defined such that elementary actions
change only the causal mechanism at one node (e.g. one of the causal
conditionals in the Markov factorization). This way, the Principle of
Independent Mechanisms becomes the defining property of causal structure in
domains where causality is a more abstract phenomenon rather than being an
objective fact relying on hard-wired causal links between tangible objects. We
describe this phenomenological approach to causality for toy and hypothetical
real-world examples and argue that it is consistent with the causal Markov
condition when the system under consideration interacts with other variables
that control the elementary actions.","['Dominik Janzing', 'Sergio Hernan Garrido Mejia']","['stat.ME', 'cs.AI', 'cs.LG', 'stat.ML', '62Axx']",2022-11-15 13:05:45+00:00
http://arxiv.org/abs/2211.08036v3,Provably Reliable Large-Scale Sampling from Gaussian Processes,"When comparing approximate Gaussian process (GP) models, it can be helpful to
be able to generate data from any GP. If we are interested in how approximate
methods perform at scale, we may wish to generate very large synthetic datasets
to evaluate them. Na\""{i}vely doing so would cost \(\mathcal{O}(n^3)\) flops
and \(\mathcal{O}(n^2)\) memory to generate a size \(n\) sample. We demonstrate
how to scale such data generation to large \(n\) whilst still providing
guarantees that, with high probability, the sample is indistinguishable from a
sample from the desired GP.","['Anthony Stephenson', 'Robert Allison', 'Edward Pyzer-Knapp']","['stat.ML', 'cs.LG', 'stat.ME', '62-06']",2022-11-15 10:36:21+00:00
http://arxiv.org/abs/2211.08018v1,Universal Time-Uniform Trajectory Approximation for Random Dynamical Systems with Recurrent Neural Networks,"The capability of recurrent neural networks to approximate trajectories of a
random dynamical system, with random inputs, on non-compact domains, and over
an indefinite or infinite time horizon is considered. The main result states
that certain random trajectories over an infinite time horizon may be
approximated to any desired accuracy, uniformly in time, by a certain class of
deep recurrent neural networks, with simple feedback structures. The
formulation here contrasts with related literature on this topic, much of which
is restricted to compact state spaces and finite time intervals. The model
conditions required here are natural, mild, and easy to test, and the proof is
very simple.",['Adrian N. Bishop'],"['cs.NE', 'cs.LG', 'math.DS', 'stat.ML']",2022-11-15 10:03:45+00:00
http://arxiv.org/abs/2211.07907v3,MMD-B-Fair: Learning Fair Representations with Statistical Testing,"We introduce a method, MMD-B-Fair, to learn fair representations of data via
kernel two-sample testing. We find neural features of our data where a maximum
mean discrepancy (MMD) test cannot distinguish between representations of
different sensitive groups, while preserving information about the target
attributes. Minimizing the power of an MMD test is more difficult than
maximizing it (as done in previous work), because the test threshold's complex
behavior cannot be simply ignored. Our method exploits the simple asymptotics
of block testing schemes to efficiently find fair representations without
requiring complex adversarial optimization or generative modelling schemes
widely used by existing work on fair representation learning. We evaluate our
approach on various datasets, showing its ability to ``hide'' information about
sensitive attributes, and its effectiveness in downstream transfer tasks.","['Namrata Deka', 'Danica J. Sutherland']","['stat.ML', 'cs.LG']",2022-11-15 05:25:38+00:00
http://arxiv.org/abs/2211.07866v5,Efficient Estimation for Longitudinal Networks via Adaptive Merging,"Longitudinal network consists of a sequence of temporal edges among multiple
nodes, where the temporal edges are observed in real time. It has become
ubiquitous with the rise of online social platform and e-commerce, but largely
under-investigated in literature. In this paper, we propose an efficient
estimation framework for longitudinal network, leveraging strengths of adaptive
network merging, tensor decomposition and point process. It merges neighboring
sparse networks so as to enlarge the number of observed edges and reduce
estimation variance, whereas the estimation bias introduced by network merging
is controlled by exploiting local temporal structures for adaptive network
neighborhood. A projected gradient descent algorithm is proposed to facilitate
estimation, where the upper bound of the estimation error in each iteration is
established. A thorough analysis is conducted to quantify the asymptotic
behavior of the proposed method, which shows that it can significantly reduce
the estimation error and also provides guideline for network merging under
various scenarios. We further demonstrate the advantage of the proposed method
through extensive numerical experiments on synthetic datasets and a militarized
interstate dispute dataset.","['Haoran Zhang', 'Junhui Wang']","['stat.ML', 'cs.LG']",2022-11-15 03:17:11+00:00
http://arxiv.org/abs/2211.07861v2,Regularized Stein Variational Gradient Flow,"The Stein Variational Gradient Descent (SVGD) algorithm is a deterministic
particle method for sampling. However, a mean-field analysis reveals that the
gradient flow corresponding to the SVGD algorithm (i.e., the Stein Variational
Gradient Flow) only provides a constant-order approximation to the Wasserstein
Gradient Flow corresponding to the KL-divergence minimization. In this work, we
propose the Regularized Stein Variational Gradient Flow, which interpolates
between the Stein Variational Gradient Flow and the Wasserstein Gradient Flow.
We establish various theoretical properties of the Regularized Stein
Variational Gradient Flow (and its time-discretization) including convergence
to equilibrium, existence and uniqueness of weak solutions, and stability of
the solutions. We provide preliminary numerical evidence of the improved
performance offered by the regularization.","['Ye He', 'Krishnakumar Balasubramanian', 'Bharath K. Sriperumbudur', 'Jianfeng Lu']","['stat.ML', 'cs.LG', 'cs.NA', 'math.AP', 'math.NA', 'math.ST', 'stat.CO', 'stat.TH']",2022-11-15 02:56:46+00:00
http://arxiv.org/abs/2211.07817v1,Multi-Player Bandits Robust to Adversarial Collisions,"Motivated by cognitive radios, stochastic Multi-Player Multi-Armed Bandits
has been extensively studied in recent years. In this setting, each player
pulls an arm, and receives a reward corresponding to the arm if there is no
collision, namely the arm was selected by one single player. Otherwise, the
player receives no reward if collision occurs. In this paper, we consider the
presence of malicious players (or attackers) who obstruct the cooperative
players (or defenders) from maximizing their rewards, by deliberately colliding
with them. We provide the first decentralized and robust algorithm RESYNC for
defenders whose performance deteriorates gracefully as $\tilde{O}(C)$ as the
number of collisions $C$ from the attackers increases. We show that this
algorithm is order-optimal by proving a lower bound which scales as
$\Omega(C)$. This algorithm is agnostic to the algorithm used by the attackers
and agnostic to the number of collisions $C$ faced from attackers.","['Shivakumar Mahesh', 'Anshuka Rangi', 'Haifeng Xu', 'Long Tran-Thanh']","['cs.LG', 'stat.ML']",2022-11-15 00:43:26+00:00
http://arxiv.org/abs/2211.07816v7,Quantifying the Impact of Label Noise on Federated Learning,"Federated Learning (FL) is a distributed machine learning paradigm where
clients collaboratively train a model using their local (human-generated)
datasets. While existing studies focus on FL algorithm development to tackle
data heterogeneity across clients, the important issue of data quality (e.g.,
label noise) in FL is overlooked. This paper aims to fill this gap by providing
a quantitative study on the impact of label noise on FL. We derive an upper
bound for the generalization error that is linear in the clients' label noise
level. Then we conduct experiments on MNIST and CIFAR-10 datasets using various
FL algorithms. Our empirical results show that the global model accuracy
linearly decreases as the noise level increases, which is consistent with our
theoretical analysis. We further find that label noise slows down the
convergence of FL training, and the global model tends to overfit when the
noise level is high.","['Shuqi Ke', 'Chao Huang', 'Xin Liu']","['cs.LG', 'stat.ML']",2022-11-15 00:40:55+00:00
http://arxiv.org/abs/2211.07772v1,Robust Deep Learning for Autonomous Driving,"The last decade's research in artificial intelligence had a significant
impact on the advance of autonomous driving. Yet, safety remains a major
concern when it comes to deploying such systems in high-risk environments. The
objective of this thesis is to develop methodological tools which provide
reliable uncertainty estimates for deep neural networks. First, we introduce a
new criterion to reliably estimate model confidence: the true class probability
(TCP). We show that TCP offers better properties for failure prediction than
current uncertainty measures. Since the true class is by essence unknown at
test time, we propose to learn TCP criterion from data with an auxiliary model,
introducing a specific learning scheme adapted to this context. The relevance
of the proposed approach is validated on image classification and semantic
segmentation datasets. Then, we extend our learned confidence approach to the
task of domain adaptation where it improves the selection of pseudo-labels in
self-training methods. Finally, we tackle the challenge of jointly detecting
misclassification and out-of-distributions samples by introducing a new
uncertainty measure based on evidential models and defined on the simplex.",['Charles Corbière'],"['cs.CV', 'cs.LG', 'stat.ML']",2022-11-14 22:07:11+00:00
http://arxiv.org/abs/2211.07767v3,Learning to Optimize with Stochastic Dominance Constraints,"In real-world decision-making, uncertainty is important yet difficult to
handle. Stochastic dominance provides a theoretically sound approach for
comparing uncertain quantities, but optimization with stochastic dominance
constraints is often computationally expensive, which limits practical
applicability. In this paper, we develop a simple yet efficient approach for
the problem, the Light Stochastic Dominance Solver (light-SD), that leverages
useful properties of the Lagrangian. We recast the inner optimization in the
Lagrangian as a learning problem for surrogate approximation, which bypasses
apparent intractability and leads to tractable updates or even closed-form
solutions for gradient calculations. We prove convergence of the algorithm and
test it empirically. The proposed light-SD demonstrates superior performance on
several representative problems ranging from finance to supply chain
management.","['Hanjun Dai', 'Yuan Xue', 'Niao He', 'Bethany Wang', 'Na Li', 'Dale Schuurmans', 'Bo Dai']","['stat.ML', 'cs.LG', 'math.OC']",2022-11-14 21:54:31+00:00
