id,title,abstract,authors,categories,date
http://arxiv.org/abs/1608.05889v1,Online Feature Selection with Group Structure Analysis,"Online selection of dynamic features has attracted intensive interest in
recent years. However, existing online feature selection methods evaluate
features individually and ignore the underlying structure of feature stream.
For instance, in image analysis, features are generated in groups which
represent color, texture and other visual information. Simply breaking the
group structure in feature selection may degrade performance. Motivated by this
fact, we formulate the problem as an online group feature selection. The
problem assumes that features are generated individually but there are group
structure in the feature stream. To the best of our knowledge, this is the
first time that the correlation among feature stream has been considered in the
online feature selection process. To solve this problem, we develop a novel
online group feature selection method named OGFS. Our proposed approach
consists of two stages: online intra-group selection and online inter-group
selection. In the intra-group selection, we design a criterion based on
spectral analysis to select discriminative features in each group. In the
inter-group selection, we utilize a linear regression model to select an
optimal subset. This two-stage procedure continues until there are no more
features arriving or some predefined stopping conditions are met. %Our method
has been applied Finally, we apply our method to multiple tasks including image
classification %, face verification and face verification. Extensive empirical
studies performed on real-world and benchmark data sets demonstrate that our
method outperforms other state-of-the-art online feature selection %method
methods.","['Jing Wang', 'Meng Wang', 'Peipei Li', 'Luoqi Liu', 'Zhongqiu Zhao', 'Xuegang Hu', 'Xindong Wu']","['cs.CV', 'cs.LG', 'stat.ML']",2016-08-21 02:39:48+00:00
http://arxiv.org/abs/1608.05878v2,The ground truth about metadata and community detection in networks,"Across many scientific domains, there is a common need to automatically
extract a simplified view or coarse-graining of how a complex system's
components interact. This general task is called community detection in
networks and is analogous to searching for clusters in independent vector data.
It is common to evaluate the performance of community detection algorithms by
their ability to find so-called ""ground truth"" communities. This works well in
synthetic networks with planted communities because such networks' links are
formed explicitly based on those known communities. However, there are no
planted communities in real world networks. Instead, it is standard practice to
treat some observed discrete-valued node attributes, or metadata, as ground
truth. Here, we show that metadata are not the same as ground truth, and that
treating them as such induces severe theoretical and practical problems. We
prove that no algorithm can uniquely solve community detection, and we prove a
general No Free Lunch theorem for community detection, which implies that there
can be no algorithm that is optimal for all possible community detection tasks.
However, community detection remains a powerful tool and node metadata still
have value so a careful exploration of their relationship with network
structure can yield insights of genuine worth. We illustrate this point by
introducing two statistical techniques that can quantify the relationship
between metadata and community structure for a broad class of models. We
demonstrate these techniques using both synthetic and real-world networks, and
for multiple types of metadata and community structure.","['Leto Peel', 'Daniel B. Larremore', 'Aaron Clauset']","['cs.SI', 'physics.data-an', 'physics.soc-ph', 'stat.ML']",2016-08-20 23:57:12+00:00
http://arxiv.org/abs/1608.05806v1,Reweighting with Boosted Decision Trees,"Machine learning tools are commonly used in modern high energy physics (HEP)
experiments. Different models, such as boosted decision trees (BDT) and
artificial neural networks (ANN), are widely used in analyses and even in the
software triggers.
  In most cases, these are classification models used to select the ""signal""
events from data. Monte Carlo simulated events typically take part in training
of these models. While the results of the simulation are expected to be close
to real data, in practical cases there is notable disagreement between
simulated and observed data. In order to use available simulation in training,
corrections must be introduced to generated data. One common approach is
reweighting - assigning weights to the simulated events. We present a novel
method of event reweighting based on boosted decision trees. The problem of
checking the quality of reweighting step in analyses is also discussed.",['A. Rogozhnikov'],"['physics.data-an', 'hep-ex', 'stat.ML']",2016-08-20 09:30:29+00:00
http://arxiv.org/abs/1608.07251v1,Large-scale Collaborative Imaging Genetics Studies of Risk Genetic Factors for Alzheimer's Disease Across Multiple Institutions,"Genome-wide association studies (GWAS) offer new opportunities to identify
genetic risk factors for Alzheimer's disease (AD). Recently, collaborative
efforts across different institutions emerged that enhance the power of many
existing techniques on individual institution data. However, a major barrier to
collaborative studies of GWAS is that many institutions need to preserve
individual data privacy. To address this challenge, we propose a novel
distributed framework, termed Local Query Model (LQM) to detect risk SNPs for
AD across multiple research institutions. To accelerate the learning process,
we propose a Distributed Enhanced Dual Polytope Projection (D-EDPP) screening
rule to identify irrelevant features and remove them from the optimization. To
the best of our knowledge, this is the first successful run of the
computationally intensive model selection procedure to learn a consistent model
across different institutions without compromising their privacy while ranking
the SNPs that may collectively affect AD. Empirical studies are conducted on
809 subjects with 5.9 million SNP features which are distributed across three
individual institutions. D-EDPP achieved a 66-fold speed-up by effectively
identifying irrelevant features.","['Qingyang Li', 'Tao Yang', 'Liang Zhan', 'Derrek Paul Hibar', 'Neda Jahanshad', 'Yalin Wang', 'Jieping Ye', 'Paul M. Thompson', 'Jie Wang']","['cs.LG', 'stat.ML']",2016-08-19 23:21:49+00:00
http://arxiv.org/abs/1608.05749v1,Solving a Mixture of Many Random Linear Equations by Tensor Decomposition and Alternating Minimization,"We consider the problem of solving mixed random linear equations with $k$
components. This is the noiseless setting of mixed linear regression. The goal
is to estimate multiple linear models from mixed samples in the case where the
labels (which sample corresponds to which model) are not observed. We give a
tractable algorithm for the mixed linear equation problem, and show that under
some technical conditions, our algorithm is guaranteed to solve the problem
exactly with sample complexity linear in the dimension, and polynomial in $k$,
the number of components. Previous approaches have required either exponential
dependence on $k$, or super-linear dependence on the dimension. The proposed
algorithm is a combination of tensor decomposition and alternating
minimization. Our analysis involves proving that the initialization provided by
the tensor method allows alternating minimization, which is equivalent to EM in
our setting, to converge to the global optimum at a linear rate.","['Xinyang Yi', 'Constantine Caramanis', 'Sujay Sanghavi']","['cs.LG', 'cs.IT', 'math.IT', 'math.ST', 'stat.ML', 'stat.TH']",2016-08-19 22:10:46+00:00
http://arxiv.org/abs/1608.05747v1,Space-Filling Curves as a Novel Crystal Structure Representation for Machine Learning Models,"A fundamental problem in applying machine learning techniques for chemical
problems is to find suitable representations for molecular and crystal
structures. While the structure representations based on atom connectivities
are prevalent for molecules, two-dimensional descriptors are not suitable for
describing molecular crystals. In this work, we introduce the SFC-M family of
feature representations, which are based on Morton space-filling curves, as an
alternative means of representing crystal structures. Latent Semantic Indexing
(LSI) was employed in a novel setting to reduce sparsity of feature
representations. The quality of the SFC-M representations were assessed by
using them in combination with artificial neural networks to predict Density
Functional Theory (DFT) single point, Ewald summed, lattice, and many-body
dispersion energies of 839 organic molecular crystal unit cells from the
Cambridge Structural Database that consist of the elements C, H, N, and O.
Promising initial results suggest that the SFC-M representations merit further
exploration to improve its ability to predict solid-state properties of organic
crystal structures","['Dipti Jasrasaria', 'Edward O. Pyzer-Knapp', 'Dmitrij Rappoport', 'Alan Aspuru-Guzik']","['stat.ML', 'physics.chem-ph']",2016-08-19 22:01:43+00:00
http://arxiv.org/abs/1608.05610v2,A Strongly Quasiconvex PAC-Bayesian Bound,"We propose a new PAC-Bayesian bound and a way of constructing a hypothesis
space, so that the bound is convex in the posterior distribution and also
convex in a trade-off parameter between empirical performance of the posterior
distribution and its complexity. The complexity is measured by the
Kullback-Leibler divergence to a prior. We derive an alternating procedure for
minimizing the bound. We show that the bound can be rewritten as a
one-dimensional function of the trade-off parameter and provide sufficient
conditions under which the function has a single global minimum. When the
conditions are satisfied the alternating minimization is guaranteed to converge
to the global minimum of the bound. We provide experimental results
demonstrating that rigorous minimization of the bound is competitive with
cross-validation in tuning the trade-off between complexity and empirical
performance. In all our experiments the trade-off turned to be quasiconvex even
when the sufficient conditions were violated.","['Niklas Thiemann', 'Christian Igel', 'Olivier Wintenberger', 'Yevgeny Seldin']","['cs.LG', 'stat.ML']",2016-08-19 14:21:18+00:00
http://arxiv.org/abs/1608.05581v5,Unsupervised Feature Selection Based on the Morisita Estimator of Intrinsic Dimension,"This paper deals with a new filter algorithm for selecting the smallest
subset of features carrying all the information content of a data set (i.e. for
removing redundant features). It is an advanced version of the fractal
dimension reduction technique, and it relies on the recently introduced
Morisita estimator of Intrinsic Dimension (ID). Here, the ID is used to
quantify dependencies between subsets of features, which allows the effective
processing of highly non-linear data. The proposed algorithm is successfully
tested on simulated and real world case studies. Different levels of sample
size and noise are examined along with the variability of the results. In
addition, a comprehensive procedure based on random forests shows that the data
dimensionality is significantly reduced by the algorithm without loss of
relevant information. And finally, comparisons with benchmark feature selection
techniques demonstrate the promising performance of this new filter.","['Jean Golay', 'Mikhail Kanevski']","['stat.ML', 'cs.LG']",2016-08-19 12:28:21+00:00
http://arxiv.org/abs/1608.05560v1,Iterative Views Agreement: An Iterative Low-Rank based Structured Optimization Method to Multi-View Spectral Clustering,"Multi-view spectral clustering, which aims at yielding an agreement or
consensus data objects grouping across multi-views with their graph laplacian
matrices, is a fundamental clustering problem. Among the existing methods,
Low-Rank Representation (LRR) based method is quite superior in terms of its
effectiveness, intuitiveness and robustness to noise corruptions. However, it
aggressively tries to learn a common low-dimensional subspace for multi-view
data, while inattentively ignoring the local manifold structure in each view,
which is critically important to the spectral clustering; worse still, the
low-rank minimization is enforced to achieve the data correlation consensus
among all views, failing to flexibly preserve the local manifold structure for
each view. In this paper, 1) we propose a multi-graph laplacian regularized LRR
with each graph laplacian corresponding to one view to characterize its local
manifold structure. 2) Instead of directly enforcing the low-rank minimization
among all views for correlation consensus, we separately impose low-rank
constraint on each view, coupled with a mutual structural consensus constraint,
where it is able to not only well preserve the local manifold structure but
also serve as a constraint for that from other views, which iteratively makes
the views more agreeable. Extensive experiments on real-world multi-view data
sets demonstrate its superiority.","['Yang Wang', 'Wenjie Zhang', 'Lin Wu', 'Xuemin Lin', 'Meng Fang', 'Shirui Pan']","['cs.LG', 'stat.ML']",2016-08-19 10:25:46+00:00
http://arxiv.org/abs/1608.05493v1,Network Volume Anomaly Detection and Identification in Large-scale Networks based on Online Time-structured Traffic Tensor Tracking,"This paper addresses network anomography, that is, the problem of inferring
network-level anomalies from indirect link measurements. This problem is cast
as a low-rank subspace tracking problem for normal flows under incomplete
observations, and an outlier detection problem for abnormal flows. Since
traffic data is large-scale time-structured data accompanied with noise and
outliers under partial observations, an efficient modeling method is essential.
To this end, this paper proposes an online subspace tracking of a Hankelized
time-structured traffic tensor for normal flows based on the Candecomp/PARAFAC
decomposition exploiting the recursive least squares (RLS) algorithm. We
estimate abnormal flows as outlier sparse flows via sparsity maximization in
the underlying under-constrained linear-inverse problem. A major advantage is
that our algorithm estimates normal flows by low-dimensional matrices with
time-directional features as well as the spatial correlation of multiple links
without using the past observed measurements and the past model parameters.
Extensive numerical evaluations show that the proposed algorithm achieves
faster convergence per iteration of model approximation, and better volume
anomaly detection performance compared to state-of-the-art algorithms.","['Hiroyuki Kasai', 'Wolfgang Kellerer', 'Martin Kleinsteuber']","['cs.NI', 'stat.ML']",2016-08-19 05:06:58+00:00
http://arxiv.org/abs/1608.05347v1,Probabilistic Data Analysis with Probabilistic Programming,"Probabilistic techniques are central to data analysis, but different
approaches can be difficult to apply, combine, and compare. This paper
introduces composable generative population models (CGPMs), a computational
abstraction that extends directed graphical models and can be used to describe
and compose a broad class of probabilistic data analysis techniques. Examples
include hierarchical Bayesian models, multivariate kernel methods,
discriminative machine learning, clustering algorithms, dimensionality
reduction, and arbitrary probabilistic programs. We also demonstrate the
integration of CGPMs into BayesDB, a probabilistic programming platform that
can express data analysis tasks using a modeling language and a structured
query language. The practical value is illustrated in two ways. First, CGPMs
are used in an analysis that identifies satellite data records which probably
violate Kepler's Third Law, by composing causal probabilistic programs with
non-parametric Bayes in under 50 lines of probabilistic code. Second, for
several representative data analysis tasks, we report on lines of code and
accuracy measurements of various CGPMs, plus comparisons with standard baseline
solutions from Python and MATLAB libraries.","['Feras Saad', 'Vikash Mansinghka']","['cs.AI', 'cs.LG', 'stat.ML']",2016-08-18 17:47:53+00:00
http://arxiv.org/abs/1608.05275v1,A Tight Convex Upper Bound on the Likelihood of a Finite Mixture,"The likelihood function of a finite mixture model is a non-convex function
with multiple local maxima and commonly used iterative algorithms such as EM
will converge to different solutions depending on initial conditions. In this
paper we ask: is it possible to assess how far we are from the global maximum
of the likelihood? Since the likelihood of a finite mixture model can grow
unboundedly by centering a Gaussian on a single datapoint and shrinking the
covariance, we constrain the problem by assuming that the parameters of the
individual models are members of a large discrete set (e.g. estimating a
mixture of two Gaussians where the means and variances of both Gaussians are
members of a set of a million possible means and variances). For this setting
we show that a simple upper bound on the likelihood can be computed using
convex optimization and we analyze conditions under which the bound is
guaranteed to be tight. This bound can then be used to assess the quality of
solutions found by EM (where the final result is projected on the discrete set)
or any other mixture estimation algorithm. For any dataset our method allows us
to find a finite mixture model together with a dataset-specific bound on how
far the likelihood of this mixture is from the global optimum of the likelihood","['Elad Mezuman', 'Yair Weiss']","['cs.LG', 'stat.ML']",2016-08-18 14:27:45+00:00
http://arxiv.org/abs/1608.05258v1,Parameter Learning for Log-supermodular Distributions,"We consider log-supermodular models on binary variables, which are
probabilistic models with negative log-densities which are submodular. These
models provide probabilistic interpretations of common combinatorial
optimization tasks such as image segmentation. In this paper, we focus
primarily on parameter estimation in the models from known upper-bounds on the
intractable log-partition function. We show that the bound based on separable
optimization on the base polytope of the submodular function is always inferior
to a bound based on ""perturb-and-MAP"" ideas. Then, to learn parameters, given
that our approximation of the log-partition function is an expectation (over
our own randomization), we use a stochastic subgradient technique to maximize a
lower-bound on the log-likelihood. This can also be extended to conditional
maximum likelihood. We illustrate our new results in a set of experiments in
binary image denoising, where we highlight the flexibility of a probabilistic
model to learn with missing data.","['Tatiana Shpakova', 'Francis Bach']","['stat.ML', 'cs.LG']",2016-08-18 13:55:41+00:00
http://arxiv.org/abs/1608.05225v1,Active Learning for Approximation of Expensive Functions with Normal Distributed Output Uncertainty,"When approximating a black-box function, sampling with active learning
focussing on regions with non-linear responses tends to improve accuracy. We
present the FLOLA-Voronoi method introduced previously for deterministic
responses, and theoretically derive the impact of output uncertainty. The
algorithm automatically puts more emphasis on exploration to provide more
information to the models.","['Joachim van der Herten', 'Ivo Couckuyt', 'Dirk Deschrijver', 'Tom Dhaene']","['cs.LG', 'stat.ML']",2016-08-18 10:15:54+00:00
http://arxiv.org/abs/1608.05182v2,A Bayesian Nonparametric Approach for Estimating Individualized Treatment-Response Curves,"We study the problem of estimating the continuous response over time to
interventions using observational time series---a retrospective dataset where
the policy by which the data are generated is unknown to the learner. We are
motivated by applications where response varies by individuals and therefore,
estimating responses at the individual-level is valuable for personalizing
decision-making. We refer to this as the problem of estimating individualized
treatment response (ITR) curves. In statistics, G-computation formula (Robins,
1986) has been commonly used for estimating treatment responses from
observational data containing sequential treatment assignments. However, past
studies have focused predominantly on obtaining point-in-time estimates at the
population level. We leverage the G-computation formula and develop a novel
Bayesian nonparametric (BNP) method that can flexibly model functional data and
provide posterior inference over the treatment response curves at both the
individual and population level. On a challenging dataset containing time
series from patients admitted to a hospital, we estimate responses to
treatments used in managing kidney function and show that the resulting fits
are more accurate than alternative approaches. Accurate methods for obtaining
ITRs from observational data can dramatically accelerate the pace at which
personalized treatment plans become possible.","['Yanbo Xu', 'Yanxun Xu', 'Suchi Saria']","['cs.LG', 'stat.ML']",2016-08-18 05:31:53+00:00
http://arxiv.org/abs/1608.05152v1,Conditional Sparse Linear Regression,"Machine learning and statistics typically focus on building models that
capture the vast majority of the data, possibly ignoring a small subset of data
as ""noise"" or ""outliers."" By contrast, here we consider the problem of jointly
identifying a significant (but perhaps small) segment of a population in which
there is a highly sparse linear regression fit, together with the coefficients
for the linear fit. We contend that such tasks are of interest both because the
models themselves may be able to achieve better predictions in such special
cases, but also because they may aid our understanding of the data. We give
algorithms for such problems under the sup norm, when this unknown segment of
the population is described by a k-DNF condition and the regression fit is
s-sparse for constant k and s. For the variants of this problem when the
regression fit is not so sparse or using expected error, we also give a
preliminary algorithm and highlight the question as a challenge for future
work.",['Brendan Juba'],"['cs.LG', 'cs.DS', 'stat.ML']",2016-08-18 01:30:49+00:00
http://arxiv.org/abs/1608.05138v2,Hybrid CPU-GPU Framework for Network Motifs,"Massively parallel architectures such as the GPU are becoming increasingly
important due to the recent proliferation of data. In this paper, we propose a
key class of hybrid parallel graphlet algorithms that leverages multiple CPUs
and GPUs simultaneously for computing k-vertex induced subgraph statistics
(called graphlets). In addition to the hybrid multi-core CPU-GPU framework, we
also investigate single GPU methods (using multiple cores) and multi-GPU
methods that leverage all available GPUs simultaneously for computing induced
subgraph statistics. Both methods leverage GPU devices only, whereas the hybrid
multi-core CPU-GPU framework leverages all available multi-core CPUs and
multiple GPUs for computing graphlets in large networks. Compared to recent
approaches, our methods are orders of magnitude faster, while also more cost
effective enjoying superior performance per capita and per watt. In particular,
the methods are up to 300 times faster than the recent state-of-the-art method.
To the best of our knowledge, this is the first work to leverage multiple CPUs
and GPUs simultaneously for computing induced subgraph statistics.","['Ryan A. Rossi', 'Rong Zhou']","['cs.DC', 'cs.SI', 'stat.ML', 'H.2.8; I.2.6; G.1.0']",2016-08-18 00:29:21+00:00
http://arxiv.org/abs/1608.05127v1,A Bayesian Network approach to County-Level Corn Yield Prediction using historical data and expert knowledge,"Crop yield forecasting is the methodology of predicting crop yields prior to
harvest. The availability of accurate yield prediction frameworks have enormous
implications from multiple standpoints, including impact on the crop commodity
futures markets, formulation of agricultural policy, as well as crop insurance
rating. The focus of this work is to construct a corn yield predictor at the
county scale. Corn yield (forecasting) depends on a complex, interconnected set
of variables that include economic, agricultural, management and meteorological
factors. Conventional forecasting is either knowledge-based computer programs
(that simulate plant-weather-soil-management interactions) coupled with
targeted surveys or statistical model based. The former is limited by the need
for painstaking calibration, while the latter is limited to univariate analysis
or similar simplifying assumptions that fail to capture the complex
interdependencies affecting yield. In this paper, we propose a data-driven
approach that is ""gray box"" i.e. that seamlessly utilizes expert knowledge in
constructing a statistical network model for corn yield forecasting. Our
multivariate gray box model is developed on Bayesian network analysis to build
a Directed Acyclic Graph (DAG) between predictors and yield. Starting from a
complete graph connecting various carefully chosen variables and yield, expert
knowledge is used to prune or strengthen edges connecting variables.
Subsequently the structure (connectivity and edge weights) of the DAG that
maximizes the likelihood of observing the training data is identified via
optimization. We curated an extensive set of historical data (1948-2012) for
each of the 99 counties in Iowa as data to train the model.","['Vikas Chawla', 'Hsiang Sing Naik', 'Adedotun Akintayo', 'Dermot Hayes', 'Patrick Schnable', 'Baskar Ganapathysubramanian', 'Soumik Sarkar']","['cs.LG', 'stat.AP', 'stat.ML']",2016-08-17 23:30:04+00:00
