id,title,abstract,authors,categories,date
http://arxiv.org/abs/2311.09369v1,Time-dependent Probabilistic Generative Models for Disease Progression,"Electronic health records contain valuable information for monitoring
patients' health trajectories over time. Disease progression models have been
developed to understand the underlying patterns and dynamics of diseases using
these data as sequences. However, analyzing temporal data from EHRs is
challenging due to the variability and irregularities present in medical
records. We propose a Markovian generative model of treatments developed to (i)
model the irregular time intervals between medical events; (ii) classify
treatments into subtypes based on the patient sequence of medical events and
the time intervals between them; and (iii) segment treatments into subsequences
of disease progression patterns. We assume that sequences have an associated
structure of latent variables: a latent class representing the different
subtypes of treatments; and a set of latent stages indicating the phase of
progression of the treatments. We use the Expectation-Maximization algorithm to
learn the model, which is efficiently solved with a dynamic programming-based
method. Various parametric models have been employed to model the time
intervals between medical events during the learning process, including the
geometric, exponential, and Weibull distributions. The results demonstrate the
effectiveness of our model in recovering the underlying model from data and
accurately modeling the irregular time intervals between medical actions.","['Onintze Zaballa', 'Aritz Pérez', 'Elisa Gómez-Inhiesto', 'Teresa Acaiturri-Ayesta', 'Jose A. Lozano']","['stat.ML', 'cs.CY', 'cs.LG']",2023-11-15 21:00:00+00:00
http://arxiv.org/abs/2311.09200v4,Are Normalizing Flows the Key to Unlocking the Exponential Mechanism?,"The Exponential Mechanism (ExpM), designed for private optimization, has been
historically sidelined from use on continuous sample spaces, as it requires
sampling from a generally intractable density, and, to a lesser extent,
bounding the sensitivity of the objective function. Any differential privacy
(DP) mechanism can be instantiated as ExpM, and ExpM poses an elegant solution
for private machine learning (ML) that bypasses inherent inefficiencies of
DPSGD. This paper seeks to operationalize ExpM for private optimization and ML
by using an auxiliary Normalizing Flow (NF), an expressive deep network for
density learning, to approximately sample from ExpM density. The method,
ExpM+NF is an alternative to SGD methods for model training. We prove a
sensitivity bound for the $\ell^2$ loss permitting ExpM use with any sampling
method. To test feasibility, we present results on MIMIC-III health data
comparing (non-private) SGD, DPSGD, and ExpM+NF training methods' accuracy and
training time. We find that a model sampled from ExpM+NF is nearly as accurate
as non-private SGD, more accurate than DPSGD, and ExpM+NF trains faster than
Opacus' DPSGD implementation. Unable to provide a privacy proof for the NF
approximation, we present empirical results to investigate privacy including
the LiRA membership inference attack of Carlini et al. and the recent privacy
auditing lower bound method of Steinke et al. Our findings suggest ExpM+NF
provides more privacy than non-private SGD, but not as much as DPSGD, although
many attacks are impotent against any model. Ancillary benefits of this work
include pushing the SOTA of privacy and accuracy on MIMIC-III healthcare data,
exhibiting the use of ExpM+NF for Bayesian inference, showing the limitations
of empirical privacy auditing in practice, and providing several privacy
theorems applicable to distribution learning.","['Robert A. Bridges', 'Vandy J. Tombs', 'Christopher B. Stanley']","['stat.ML', 'cs.AI', 'cs.CR', 'cs.LG', 'math.PR']",2023-11-15 18:43:29+00:00
http://arxiv.org/abs/2311.09197v1,A Unified Approach to Learning Ising Models: Beyond Independence and Bounded Width,"We revisit the problem of efficiently learning the underlying parameters of
Ising models from data. Current algorithmic approaches achieve essentially
optimal sample complexity when given i.i.d. samples from the stationary measure
and the underlying model satisfies ""width"" bounds on the total $\ell_1$
interaction involving each node. We show that a simple existing approach based
on node-wise logistic regression provably succeeds at recovering the underlying
model in several new settings where these assumptions are violated:
  (1) Given dynamically generated data from a wide variety of local Markov
chains, like block or round-robin dynamics, logistic regression recovers the
parameters with optimal sample complexity up to $\log\log n$ factors. This
generalizes the specialized algorithm of Bresler, Gamarnik, and Shah [IEEE
Trans. Inf. Theory'18] for structure recovery in bounded degree graphs from
Glauber dynamics.
  (2) For the Sherrington-Kirkpatrick model of spin glasses, given
$\mathsf{poly}(n)$ independent samples, logistic regression recovers the
parameters in most of the known high-temperature regime via a simple reduction
to weaker structural properties of the measure. This improves on recent work of
Anari, Jain, Koehler, Pham, and Vuong [ArXiv'23] which gives distribution
learning at higher temperature.
  (3) As a simple byproduct of our techniques, logistic regression achieves an
exponential improvement in learning from samples in the M-regime of data
considered by Dutt, Lokhov, Vuffray, and Misra [ICML'21] as well as novel
guarantees for learning from the adversarial Glauber dynamics of Chin, Moitra,
Mossel, and Sandon [ArXiv'23].
  Our approach thus significantly generalizes the elegant analysis of Wu,
Sanghavi, and Dimakis [Neurips'19] without any algorithmic modification.","['Jason Gaitonde', 'Elchanan Mossel']","['cs.LG', 'cs.DS', 'stat.ML']",2023-11-15 18:41:19+00:00
http://arxiv.org/abs/2311.09145v1,Model Agnostic Explainable Selective Regression via Uncertainty Estimation,"With the wide adoption of machine learning techniques, requirements have
evolved beyond sheer high performance, often requiring models to be
trustworthy. A common approach to increase the trustworthiness of such systems
is to allow them to refrain from predicting. Such a framework is known as
selective prediction. While selective prediction for classification tasks has
been widely analyzed, the problem of selective regression is understudied. This
paper presents a novel approach to selective regression that utilizes
model-agnostic non-parametric uncertainty estimation. Our proposed framework
showcases superior performance compared to state-of-the-art selective
regressors, as demonstrated through comprehensive benchmarking on 69 datasets.
Finally, we use explainable AI techniques to gain an understanding of the
drivers behind selective regression. We implement our selective regression
method in the open-source Python package doubt and release the code used to
reproduce our experiments.","['Andrea Pugnana', 'Carlos Mougan', 'Dan Saattrup Nielsen']","['cs.LG', 'stat.ML']",2023-11-15 17:40:48+00:00
http://arxiv.org/abs/2311.09068v1,Learning Fair Division from Bandit Feedback,"This work addresses learning online fair division under uncertainty, where a
central planner sequentially allocates items without precise knowledge of
agents' values or utilities. Departing from conventional online algorithm, the
planner here relies on noisy, estimated values obtained after allocating items.
We introduce wrapper algorithms utilizing \textit{dual averaging}, enabling
gradual learning of both the type distribution of arriving items and agents'
values through bandit feedback. This approach enables the algorithms to
asymptotically achieve optimal Nash social welfare in linear Fisher markets
with agents having additive utilities. We establish regret bounds in Nash
social welfare and empirically validate the superior performance of our
proposed algorithms across synthetic and empirical datasets.","['Hakuei Yamada', 'Junpei Komiyama', 'Kenshi Abe', 'Atsushi Iwasaki']","['cs.LG', 'cs.AI', 'stat.ML']",2023-11-15 16:10:34+00:00
http://arxiv.org/abs/2311.09018v3,On the Foundation of Distributionally Robust Reinforcement Learning,"Motivated by the need for a robust policy in the face of environment shifts
between training and the deployment, we contribute to the theoretical
foundation of distributionally robust reinforcement learning (DRRL). This is
accomplished through a comprehensive modeling framework centered around
distributionally robust Markov decision processes (DRMDPs). This framework
obliges the decision maker to choose an optimal policy under the worst-case
distributional shift orchestrated by an adversary. By unifying and extending
existing formulations, we rigorously construct DRMDPs that embraces various
modeling attributes for both the decision maker and the adversary. These
attributes include adaptability granularity, exploring history-dependent,
Markov, and Markov time-homogeneous decision maker and adversary dynamics.
Additionally, we delve into the flexibility of shifts induced by the adversary,
examining SA and S-rectangularity. Within this DRMDP framework, we investigate
conditions for the existence or absence of the dynamic programming principle
(DPP). From an algorithmic standpoint, the existence of DPP holds significant
implications, as the vast majority of existing data and computationally
efficiency RL algorithms are reliant on the DPP. To study its existence, we
comprehensively examine combinations of controller and adversary attributes,
providing streamlined proofs grounded in a unified methodology. We also offer
counterexamples for settings in which a DPP with full generality is absent.","['Shengbo Wang', 'Nian Si', 'Jose Blanchet', 'Zhengyuan Zhou']","['cs.LG', 'cs.SY', 'eess.SY', 'math.OC', 'stat.ML']",2023-11-15 15:02:23+00:00
http://arxiv.org/abs/2311.09017v1,Semidefinite programs simulate approximate message passing robustly,"Approximate message passing (AMP) is a family of iterative algorithms that
generalize matrix power iteration. AMP algorithms are known to optimally solve
many average-case optimization problems. In this paper, we show that a large
class of AMP algorithms can be simulated in polynomial time by \emph{local
statistics hierarchy} semidefinite programs (SDPs), even when an unknown
principal minor of measure $1/\mathrm{polylog}(\mathrm{dimension})$ is
adversarially corrupted. Ours are the first robust guarantees for many of these
problems. Further, our results offer an interesting counterpoint to strong
lower bounds against less constrained SDP relaxations for average-case
max-cut-gain (a.k.a. ""optimizing the Sherrington-Kirkpatrick Hamiltonian"") and
other problems.","['Misha Ivkov', 'Tselil Schramm']","['cs.DS', 'cs.LG', 'math.ST', 'stat.ML', 'stat.TH']",2023-11-15 15:00:48+00:00
http://arxiv.org/abs/2311.09003v1,Taming under isoperimetry,"In this article we propose a novel taming Langevin-based scheme called
$\mathbf{sTULA}$ to sample from distributions with superlinearly growing
log-gradient which also satisfy a Log-Sobolev inequality. We derive
non-asymptotic convergence bounds in $KL$ and consequently total variation and
Wasserstein-$2$ distance from the target measure. Non-asymptotic convergence
guarantees are provided for the performance of the new algorithm as an
optimizer. Finally, some theoretical results on isoperimertic inequalities for
distributions with superlinearly growing gradients are provided. Key findings
are a Log-Sobolev inequality with constant independent of the dimension, in the
presence of a higher order regularization and a Poincare inequality with
constant independent of temperature and dimension under a novel non-convex
theoretical framework.","['Iosif Lytras', 'Sotirios Sabanis']","['math.PR', 'cs.NA', 'math.NA', 'math.OC', 'math.ST', 'stat.ML', 'stat.TH']",2023-11-15 14:44:16+00:00
http://arxiv.org/abs/2311.08874v2,Human-in-the-loop: Towards Label Embeddings for Measuring Classification Difficulty,"Uncertainty in machine learning models is a timely and vast field of
research. In supervised learning, uncertainty can already occur in the first
stage of the training process, the annotation phase. This scenario is
particularly evident when some instances cannot be definitively classified. In
other words, there is inevitable ambiguity in the annotation step and hence,
not necessarily a ""ground truth"" associated with each instance. The main idea
of this work is to drop the assumption of a ground truth label and instead
embed the annotations into a multidimensional space. This embedding is derived
from the empirical distribution of annotations in a Bayesian setup, modeled via
a Dirichlet-Multinomial framework. We estimate the model parameters and
posteriors using a stochastic Expectation Maximization algorithm with Markov
Chain Monte Carlo steps. The methods developed in this paper readily extend to
various situations where multiple annotators independently label instances. To
showcase the generality of the proposed approach, we apply our approach to
three benchmark datasets for image classification and Natural Language
Inference. Besides the embeddings, we can investigate the resulting correlation
matrices, which reflect the semantic similarities of the original classes very
well for all three exemplary datasets.","['Katharina Hechinger', 'Christoph Koller', 'Xiao Xiang Zhu', 'Göran Kauermann']","['cs.LG', 'stat.AP', 'stat.ML']",2023-11-15 11:23:15+00:00
http://arxiv.org/abs/2311.08845v1,Statistical learning by sparse deep neural networks,"We consider a deep neural network estimator based on empirical risk
minimization with l_1-regularization. We derive a general bound for its excess
risk in regression and classification (including multiclass), and prove that it
is adaptively nearly-minimax (up to log-factors) simultaneously across the
entire range of various function classes.",['Felix Abramovich'],"['math.ST', 'cs.LG', 'stat.ME', 'stat.ML', 'stat.TH']",2023-11-15 10:35:23+00:00
http://arxiv.org/abs/2311.08815v2,Self-Supervised Disentanglement by Leveraging Structure in Data Augmentations,"Self-supervised representation learning often uses data augmentations to
induce some invariance to ""style"" attributes of the data. However, with
downstream tasks generally unknown at training time, it is difficult to deduce
a priori which attributes of the data are indeed ""style"" and can be safely
discarded. To deal with this, current approaches try to retain some style
information by tuning the degree of invariance to some particular task, such as
ImageNet object classification. However, prior work has shown that such
task-specific tuning can lead to significant performance degradation on other
tasks that rely on the discarded style. To address this, we introduce a more
principled approach that seeks to disentangle style features rather than
discard them. The key idea is to add multiple style embedding spaces where: (i)
each is invariant to all-but-one augmentation; and (ii) joint entropy is
maximized. We formalize our structured data-augmentation procedure from a
causal latent-variable-model perspective, and prove identifiability of both
content and individual style variables. We empirically demonstrate the benefits
of our approach on both synthetic and real-world data.","['Cian Eastwood', 'Julius von Kügelgen', 'Linus Ericsson', 'Diane Bouchacourt', 'Pascal Vincent', 'Bernhard Schölkopf', 'Mark Ibrahim']","['cs.LG', 'cs.AI', 'cs.CV', 'stat.ML']",2023-11-15 09:34:08+00:00
http://arxiv.org/abs/2311.08793v1,German FinBERT: A German Pre-trained Language Model,"This study presents German FinBERT, a novel pre-trained German language model
tailored for financial textual data. The model is trained through a
comprehensive pre-training process, leveraging a substantial corpus comprising
financial reports, ad-hoc announcements and news related to German companies.
The corpus size is comparable to the data sets commonly used for training
standard BERT models. I evaluate the performance of German FinBERT on
downstream tasks, specifically sentiment prediction, topic recognition and
question answering against generic German language models. My results
demonstrate improved performance on finance-specific data, indicating the
efficacy of German FinBERT in capturing domain-specific nuances. The presented
findings suggest that German FinBERT holds promise as a valuable tool for
financial text analysis, potentially benefiting various applications in the
financial domain.",['Moritz Scherrmann'],"['cs.CL', 'stat.ML']",2023-11-15 09:07:29+00:00
http://arxiv.org/abs/2311.08677v1,Federated Learning for Sparse Principal Component Analysis,"In the rapidly evolving realm of machine learning, algorithm effectiveness
often faces limitations due to data quality and availability. Traditional
approaches grapple with data sharing due to legal and privacy concerns. The
federated learning framework addresses this challenge. Federated learning is a
decentralized approach where model training occurs on client sides, preserving
privacy by keeping data localized. Instead of sending raw data to a central
server, only model updates are exchanged, enhancing data security. We apply
this framework to Sparse Principal Component Analysis (SPCA) in this work. SPCA
aims to attain sparse component loadings while maximizing data variance for
improved interpretability. Beside the L1 norm regularization term in
conventional SPCA, we add a smoothing function to facilitate gradient-based
optimization methods. Moreover, in order to improve computational efficiency,
we introduce a least squares approximation to original SPCA. This enables
analytic solutions on the optimization processes, leading to substantial
computational improvements. Within the federated framework, we formulate SPCA
as a consensus optimization problem, which can be solved using the Alternating
Direction Method of Multipliers (ADMM). Our extensive experiments involve both
IID and non-IID random features across various data owners. Results on
synthetic and public datasets affirm the efficacy of our federated SPCA
approach.","['Sin Cheng Ciou', 'Pin Jui Chen', 'Elvin Y. Tseng', 'Yuh-Jye Lee']","['cs.LG', 'cs.DC', 'cs.IT', 'math.IT', 'stat.ML']",2023-11-15 03:55:28+00:00
http://arxiv.org/abs/2311.08661v1,Deep Neural Network Identification of Limnonectes Species and New Class Detection Using Image Data,"As is true of many complex tasks, the work of discovering, describing, and
understanding the diversity of life on Earth (viz., biological systematics and
taxonomy) requires many tools. Some of this work can be accomplished as it has
been done in the past, but some aspects present us with challenges which
traditional knowledge and tools cannot adequately resolve. One such challenge
is presented by species complexes in which the morphological similarities among
the group members make it difficult to reliably identify known species and
detect new ones. We address this challenge by developing new tools using the
principles of machine learning to resolve two specific questions related to
species complexes. The first question is formulated as a classification problem
in statistics and machine learning and the second question is an
out-of-distribution (OOD) detection problem. We apply these tools to a species
complex comprising Southeast Asian stream frogs (Limnonectes kuhlii complex)
and employ a morphological character (hind limb skin texture) traditionally
treated qualitatively in a quantitative and objective manner. We demonstrate
that deep neural networks can successfully automate the classification of an
image into a known species group for which it has been trained. We further
demonstrate that the algorithm can successfully classify an image into a new
class if the image does not belong to the existing classes. Additionally, we
use the larger MNIST dataset to test the performance of our OOD detection
algorithm. We finish our paper with some concluding remarks regarding the
application of these methods to species complexes and our efforts to document
true biodiversity. This paper has online supplementary materials.","['Li Xu', 'Yili Hong', 'Eric P. Smith', 'David S. McLeod', 'Xinwei Deng', 'Laura J. Freeman']","['stat.ML', 'cs.CV', 'cs.LG', 'eess.IV']",2023-11-15 02:57:59+00:00
http://arxiv.org/abs/2311.08658v1,Structured Estimation of Heterogeneous Time Series,"How best to model structurally heterogeneous processes is a foundational
question in the social, health and behavioral sciences. Recently, Fisher et
al., (2022) introduced the multi-VAR approach for simultaneously estimating
multiple-subject multivariate time series characterized by common and
individualizing features using penalized estimation. This approach differs from
many popular modeling approaches for multiple-subject time series in that
qualitative and quantitative differences in a large number of individual
dynamics are well-accommodated. The current work extends the multi-VAR
framework to include new adaptive weighting schemes that greatly improve
estimation performance. In a small set of simulation studies we compare
adaptive multi-VAR with these new penalty weights to common alternative
estimators in terms of path recovery and bias. Furthermore, we provide toy
examples and code demonstrating the utility of multi-VAR under different
heterogeneity regimes using the multivar package for R (Fisher, 2022).","['Zachary F. Fisher', 'Younghoon Kim', 'Vladas Pipiras', 'Christopher Crawford', 'Daniel J. Petrie', 'Michael D. Hunter', 'Charles F. Geier']","['stat.ME', 'stat.ML']",2023-11-15 02:39:13+00:00
http://arxiv.org/abs/2311.08636v2,Supervised low-rank semi-nonnegative matrix factorization with frequency regularization for forecasting spatio-temporal data,"We propose a novel methodology for forecasting spatio-temporal data using
supervised semi-nonnegative matrix factorization (SSNMF) with frequency
regularization. Matrix factorization is employed to decompose spatio-temporal
data into spatial and temporal components. To improve clarity in the temporal
patterns, we introduce a nonnegativity constraint on the time domain along with
regularization in the frequency domain. Specifically, regularization in the
frequency domain involves selecting features in the frequency space, making an
interpretation in the frequency domain more convenient. We propose two methods
in the frequency domain: soft and hard regularizations, and provide convergence
guarantees to first-order stationary points of the corresponding constrained
optimization problem. While our primary motivation stems from geophysical data
analysis based on GRACE (Gravity Recovery and Climate Experiment) data, our
methodology has the potential for wider application. Consequently, when
applying our methodology to GRACE data, we find that the results with the
proposed methodology are comparable to previous research in the field of
geophysical sciences but offer clearer interpretability.","['Keunsu Kim', 'Hanbaek Lyu', 'Jinsu Kim', 'Jae-Hun Jung']","['stat.ML', 'cs.LG', '65F22, 65F55 and 86A04']",2023-11-15 01:23:13+00:00
http://arxiv.org/abs/2311.08594v1,"Variational Temporal IRT: Fast, Accurate, and Explainable Inference of Dynamic Learner Proficiency","Dynamic Item Response Models extend the standard Item Response Theory (IRT)
to capture temporal dynamics in learner ability. While these models have the
potential to allow instructional systems to actively monitor the evolution of
learner proficiency in real time, existing dynamic item response models rely on
expensive inference algorithms that scale poorly to massive datasets. In this
work, we propose Variational Temporal IRT (VTIRT) for fast and accurate
inference of dynamic learner proficiency. VTIRT offers orders of magnitude
speedup in inference runtime while still providing accurate inference.
Moreover, the proposed algorithm is intrinsically interpretable by virtue of
its modular design. When applied to 9 real student datasets, VTIRT consistently
yields improvements in predicting future learner performance over other learner
proficiency models.","['Yunsung Kim', 'Sreechan Sankaranarayanan', 'Chris Piech', 'Candace Thille']","['cs.LG', 'stat.ML']",2023-11-14 23:36:39+00:00
http://arxiv.org/abs/2311.08561v1,Measuring association with recursive rank binning,"Pairwise measures of dependence are a common tool to map data in the early
stages of analysis with several modern examples based on maximized partitions
of the pairwise sample space. Following a short survey of modern measures of
dependence, we introduce a new measure which recursively splits the ranks of a
pair of variables to partition the sample space and computes the $\chi^2$
statistic on the resulting bins. Splitting logic is detailed for splits
maximizing a score function and randomly selected splits. Simulations indicate
that random splitting produces a statistic conservatively approximated by the
$\chi^2$ distribution without a loss of power to detect numerous different data
patterns compared to maximized binning. Though it seems to add no power to
detect dependence, maximized recursive binning is shown to produce a natural
visualization of the data and the measure. Applying maximized recursive rank
binning to S&P 500 constituent data suggests the automatic detection of tail
dependence.","['Chris Salahub', 'Wayne Oldford']","['stat.ME', 'stat.CO', 'stat.ML', '62G10', 'G.3; J.2']",2023-11-14 21:43:56+00:00
