id,title,abstract,authors,categories,date
http://arxiv.org/abs/1701.02386v2,AdaGAN: Boosting Generative Models,"Generative Adversarial Networks (GAN) (Goodfellow et al., 2014) are an
effective method for training generative models of complex data such as natural
images. However, they are notoriously hard to train and can suffer from the
problem of missing modes where the model is not able to produce examples in
certain regions of the space. We propose an iterative procedure, called AdaGAN,
where at every step we add a new component into a mixture model by running a
GAN algorithm on a reweighted sample. This is inspired by boosting algorithms,
where many potentially weak individual predictors are greedily aggregated to
form a strong composite predictor. We prove that such an incremental procedure
leads to convergence to the true distribution in a finite number of steps if
each step is optimal, and convergence at an exponential rate otherwise. We also
illustrate experimentally that this procedure addresses the problem of missing
modes.","['Ilya Tolstikhin', 'Sylvain Gelly', 'Olivier Bousquet', 'Carl-Johann Simon-Gabriel', 'Bernhard Schölkopf']","['stat.ML', 'cs.LG']",2017-01-09 23:19:28+00:00
http://arxiv.org/abs/1701.02349v3,MEBoost: Variable Selection in the Presence of Measurement Error,"We present a novel method for variable selection in regression models when
covariates are measured with error. The iterative algorithm we propose,
MEBoost, follows a path defined by estimating equations that correct for
covariate measurement error. Via simulation, we evaluated our method and
compare its performance to the recently-proposed Convex Conditioned Lasso
(CoCoLasso) and to the ""naive"" Lasso which does not correct for measurement
error. Increasing the degree of measurement error increased prediction error
and decreased the probability of accurate covariate selection, but this loss of
accuracy was least pronounced when using MEBoost. We illustrate the use of
MEBoost in practice by analyzing data from the Box Lunch Study, a clinical
trial in nutrition where several variables are based on self-report and hence
measured with error.","['Benjamin Brown', 'Timothy Weaver', 'Julian Wolfson']","['stat.CO', 'stat.ML']",2017-01-09 21:00:46+00:00
http://arxiv.org/abs/1701.02343v1,Information Pursuit: A Bayesian Framework for Sequential Scene Parsing,"Despite enormous progress in object detection and classification, the problem
of incorporating expected contextual relationships among object instances into
modern recognition systems remains a key challenge. In this work we propose
Information Pursuit, a Bayesian framework for scene parsing that combines prior
models for the geometry of the scene and the spatial arrangement of objects
instances with a data model for the output of high-level image classifiers
trained to answer specific questions about the scene. In the proposed
framework, the scene interpretation is progressively refined as evidence
accumulates from the answers to a sequence of questions. At each step, we
choose the question to maximize the mutual information between the new answer
and the full interpretation given the current evidence obtained from previous
inquiries. We also propose a method for learning the parameters of the model
from synthesized, annotated scenes obtained by top-down sampling from an
easy-to-learn generative scene model. Finally, we introduce a database of
annotated indoor scenes of dining room tables, which we use to evaluate the
proposed approach.","['Ehsan Jahangiri', 'Erdem Yoruk', 'Rene Vidal', 'Laurent Younes', 'Donald Geman']","['cs.CV', 'cs.AI', 'stat.ML']",2017-01-09 20:39:12+00:00
http://arxiv.org/abs/1701.02301v2,A Universal Variance Reduction-Based Catalyst for Nonconvex Low-Rank Matrix Recovery,"We propose a generic framework based on a new stochastic variance-reduced
gradient descent algorithm for accelerating nonconvex low-rank matrix recovery.
Starting from an appropriate initial estimator, our proposed algorithm performs
projected gradient descent based on a novel semi-stochastic gradient
specifically designed for low-rank matrix recovery. Based upon the mild
restricted strong convexity and smoothness conditions, we derive a projected
notion of the restricted Lipschitz continuous gradient property, and prove that
our algorithm enjoys linear convergence rate to the unknown low-rank matrix
with an improved computational complexity. Moreover, our algorithm can be
employed to both noiseless and noisy observations, where the optimal sample
complexity and the minimax optimal statistical rate can be attained
respectively. We further illustrate the superiority of our generic framework
through several specific examples, both theoretically and experimentally.","['Lingxiao Wang', 'Xiao Zhang', 'Quanquan Gu']",['stat.ML'],2017-01-09 18:56:56+00:00
http://arxiv.org/abs/1701.02291v2,QuickNet: Maximizing Efficiency and Efficacy in Deep Architectures,"We present QuickNet, a fast and accurate network architecture that is both
faster and significantly more accurate than other fast deep architectures like
SqueezeNet. Furthermore, it uses less parameters than previous networks, making
it more memory efficient. We do this by making two major modifications to the
reference Darknet model (Redmon et al, 2015): 1) The use of depthwise separable
convolutions and 2) The use of parametric rectified linear units. We make the
observation that parametric rectified linear units are computationally
equivalent to leaky rectified linear units at test time and the observation
that separable convolutions can be interpreted as a compressed Inception
network (Chollet, 2016). Using these observations, we derive a network
architecture, which we call QuickNet, that is both faster and more accurate
than previous models. Our architecture provides at least four major advantages:
(1) A smaller model size, which is more tenable on memory constrained systems;
(2) A significantly faster network which is more tenable on computationally
constrained systems; (3) A high accuracy of 95.7 percent on the CIFAR-10
Dataset which outperforms all but one result published so far, although we note
that our works are orthogonal approaches and can be combined (4) Orthogonality
to previous model compression approaches allowing for further speed gains to be
realized.",['Tapabrata Ghosh'],"['cs.LG', 'stat.ML']",2017-01-09 18:29:07+00:00
http://arxiv.org/abs/1701.02265v1,On Reject and Refine Options in Multicategory Classification,"In many real applications of statistical learning, a decision made from
misclassification can be too costly to afford; in this case, a reject option,
which defers the decision until further investigation is conducted, is often
preferred. In recent years, there has been much development for binary
classification with a reject option. Yet, little progress has been made for the
multicategory case. In this article, we propose margin-based multicategory
classification methods with a reject option. In addition, and more importantly,
we introduce a new and unique refine option for the multicategory problem,
where the class of an observation is predicted to be from a set of class
labels, whose cardinality is not necessarily one. The main advantage of both
options lies in their capacity of identifying error-prone observations.
Moreover, the refine option can provide more constructive information for
classification by effectively ruling out implausible classes. Efficient
implementations have been developed for the proposed methods. On the
theoretical side, we offer a novel statistical learning theory and show a fast
convergence rate of the excess $\ell$-risk of our methods with emphasis on
diverging dimensionality and number of classes. The results can be further
improved under a low noise assumption. A set of comprehensive simulation and
real data studies has shown the usefulness of the new learning tools compared
to regular multicategory classifiers. Detailed proofs of theorems and extended
numerical results are included in the supplemental materials available online.","['Chong Zhang', 'Wenbo Wang', 'Xingye Qiao']","['stat.ML', 'math.ST', 'stat.CO', 'stat.TH', '62H30']",2017-01-09 17:19:45+00:00
http://arxiv.org/abs/1701.02133v1,Deep driven fMRI decoding of visual categories,"Deep neural networks have been developed drawing inspiration from the brain
visual pathway, implementing an end-to-end approach: from image data to video
object classes. However building an fMRI decoder with the typical structure of
Convolutional Neural Network (CNN), i.e. learning multiple level of
representations, seems impractical due to lack of brain data. As a possible
solution, this work presents the first hybrid fMRI and deep features decoding
approach: collected fMRI and deep learnt representations of video object
classes are linked together by means of Kernel Canonical Correlation Analysis.
In decoding, this allows exploiting the discriminatory power of CNN by relating
the fMRI representation to the last layer of CNN (fc7). We show the
effectiveness of embedding fMRI data onto a subspace related to deep features
in distinguishing semantic visual categories based solely on brain imaging
data.","['Michele Svanera', 'Sergio Benini', 'Gal Raz', 'Talma Hendler', 'Rainer Goebel', 'Giancarlo Valente']","['stat.ML', 'cs.LG', 'q-bio.NC']",2017-01-09 11:06:39+00:00
http://arxiv.org/abs/1701.02110v2,Transformation Forests,"Regression models for supervised learning problems with a continuous target
are commonly understood as models for the conditional mean of the target given
predictors. This notion is simple and therefore appealing for interpretation
and visualisation. Information about the whole underlying conditional
distribution is, however, not available from these models. A more general
understanding of regression models as models for conditional distributions
allows much broader inference from such models, for example the computation of
prediction intervals. Several random forest-type algorithms aim at estimating
conditional distributions, most prominently quantile regression forests
(Meinshausen, 2006, JMLR). We propose a novel approach based on a parametric
family of distributions characterised by their transformation function. A
dedicated novel ""transformation tree"" algorithm able to detect distributional
changes is developed. Based on these transformation trees, we introduce
""transformation forests"" as an adaptive local likelihood estimator of
conditional distribution functions. The resulting models are fully parametric
yet very general and allow broad inference procedures, such as the model-based
bootstrap, to be applied in a straightforward way.","['Torsten Hothorn', 'Achim Zeileis']","['stat.ME', 'stat.ML']",2017-01-09 09:52:03+00:00
http://arxiv.org/abs/1701.02071v1,Optimal statistical decision for Gaussian graphical model selection,"Gaussian graphical model is a graphical representation of the dependence
structure for a Gaussian random vector. It is recognized as a powerful tool in
different applied fields such as bioinformatics, error-control codes, speech
language, information retrieval and others. Gaussian graphical model selection
is a statistical problem to identify the Gaussian graphical model from a sample
of a given size. Different approaches for Gaussian graphical model selection
are suggested in the literature. One of them is based on considering the family
of individual conditional independence tests. The application of this approach
leads to the construction of a variety of multiple testing statistical
procedures for Gaussian graphical model selection. An important characteristic
of these procedures is its error rate for a given sample size. In existing
literature great attention is paid to the control of error rates for incorrect
edge inclusion (Type I error). However, in graphical model selection it is also
important to take into account error rates for incorrect edge exclusion (Type
II error). To deal with this issue we consider the graphical model selection
problem in the framework of the multiple decision theory. The quality of
statistical procedures is measured by a risk function with additive losses.
Additive losses allow both types of errors to be taken into account. We
construct the tests of a Neyman structure for individual hypotheses and combine
them to obtain a multiple decision statistical procedure. We show that the
obtained procedure is optimal in the sense that it minimizes the linear
combination of expected numbers of Type I and Type II errors in the class of
unbiased multiple decision procedures.","['Valery A. Kalyagin', 'Alexander P. Koldanov', 'Petr A. Koldanov', 'Panos M. Pardalos']","['stat.ML', '62-09, 62H15, 62C05']",2017-01-09 06:34:00+00:00
http://arxiv.org/abs/1701.02058v1,Coupled Compound Poisson Factorization,"We present a general framework, the coupled compound Poisson factorization
(CCPF), to capture the missing-data mechanism in extremely sparse data sets by
coupling a hierarchical Poisson factorization with an arbitrary data-generating
model. We derive a stochastic variational inference algorithm for the resulting
model and, as examples of our framework, implement three different
data-generating models---a mixture model, linear regression, and factor
analysis---to robustly model non-random missing data in the context of
clustering, prediction, and matrix factorization. In all three cases, we test
our framework against models that ignore the missing-data mechanism on large
scale studies with non-random missing data, and we show that explicitly
modeling the missing-data mechanism substantially improves the quality of the
results, as measured using data log likelihood on a held-out test set.","['Mehmet E. Basbug', 'Barbara E. Engelhardt']","['cs.LG', 'cs.AI', 'stat.ML']",2017-01-09 03:49:26+00:00
http://arxiv.org/abs/1701.02046v2,Tunable GMM Kernels,"The recently proposed ""generalized min-max"" (GMM) kernel can be efficiently
linearized, with direct applications in large-scale statistical learning and
fast near neighbor search. The linearized GMM kernel was extensively compared
in with linearized radial basis function (RBF) kernel. On a large number of
classification tasks, the tuning-free GMM kernel performs (surprisingly) well
compared to the best-tuned RBF kernel. Nevertheless, one would naturally expect
that the GMM kernel ought to be further improved if we introduce tuning
parameters.
  In this paper, we study three simple constructions of tunable GMM kernels:
(i) the exponentiated-GMM (or eGMM) kernel, (ii) the powered-GMM (or pGMM)
kernel, and (iii) the exponentiated-powered-GMM (epGMM) kernel. The pGMM kernel
can still be efficiently linearized by modifying the original hashing procedure
for the GMM kernel. On about 60 publicly available classification datasets, we
verify that the proposed tunable GMM kernels typically improve over the
original GMM kernel. On some datasets, the improvements can be astonishingly
significant.
  For example, on 11 popular datasets which were used for testing deep learning
algorithms and tree methods, our experiments show that the proposed tunable GMM
kernels are strong competitors to trees and deep nets. The previous studies
developed tree methods including ""abc-robust-logitboost"" and demonstrated the
excellent performance on those 11 datasets (and other datasets), by
establishing the second-order tree-split formula and new derivatives for
multi-class logistic loss. Compared to tree methods like
""abc-robust-logitboost"" (which are slow and need substantial model sizes), the
tunable GMM kernels produce largely comparable results.",['Ping Li'],"['stat.ML', 'cs.LG']",2017-01-09 01:20:55+00:00
http://arxiv.org/abs/1701.02804v1,Similarity Function Tracking using Pairwise Comparisons,"Recent work in distance metric learning has focused on learning
transformations of data that best align with specified pairwise similarity and
dissimilarity constraints, often supplied by a human observer. The learned
transformations lead to improved retrieval, classification, and clustering
algorithms due to the better adapted distance or similarity measures. Here, we
address the problem of learning these transformations when the underlying
constraint generation process is nonstationary. This nonstationarity can be due
to changes in either the ground-truth clustering used to generate constraints
or changes in the feature subspaces in which the class structure is apparent.
We propose Online Convex Ensemble StrongLy Adaptive Dynamic Learning (OCELAD),
a general adaptive, online approach for learning and tracking optimal metrics
as they change over time that is highly robust to a variety of nonstationary
behaviors in the changing metric. We apply the OCELAD framework to an ensemble
of online learners. Specifically, we create a retro-initialized composite
objective mirror descent (COMID) ensemble (RICE) consisting of a set of
parallel COMID learners with different learning rates, and demonstrate
parameter-free RICE-OCELAD metric learning on both synthetic data and a highly
nonstationary Twitter dataset. We show significant performance improvements and
increased robustness to nonstationary effects relative to previously proposed
batch and online distance metric learning algorithms.","['Kristjan Greenewald', 'Stephen Kelley', 'Brandon Oselio', 'Alfred O. Hero III']","['stat.ML', 'cs.LG']",2017-01-07 03:44:54+00:00
http://arxiv.org/abs/1701.01772v2,Estimation of Graphlet Statistics,"Graphlets are induced subgraphs of a large network and are important for
understanding and modeling complex networks. Despite their practical
importance, graphlets have been severely limited to applications and domains
with relatively small graphs. Most previous work has focused on exact
algorithms, however, it is often too expensive to compute graphlets exactly in
massive networks with billions of edges, and finding an approximate count is
usually sufficient for many applications. In this work, we propose an unbiased
graphlet estimation framework that is (a) fast with significant speedups
compared to the state-of-the-art, (b) parallel with nearly linear-speedups, (c)
accurate with <1% relative error, (d) scalable and space-efficient for massive
networks with billions of edges, and (e) flexible for a variety of real-world
settings, as well as estimating macro and micro-level graphlet statistics
(e.g., counts) of both connected and disconnected graphlets. In addition, an
adaptive approach is introduced that finds the smallest sample size required to
obtain estimates within a given user-defined error bound. On 300 networks from
20 domains, we obtain <1% relative error for all graphlets. This is
significantly more accurate than existing methods while using less data.
Moreover, it takes a few seconds on billion edge graphs (as opposed to
days/weeks). These are by far the largest graphlet computations to date.","['Ryan A. Rossi', 'Rong Zhou', 'Nesreen K. Ahmed']","['cs.SI', 'cs.DC', 'math.CO', 'stat.ML']",2017-01-06 22:37:59+00:00
http://arxiv.org/abs/1701.01722v3,Follow the Compressed Leader: Faster Online Learning of Eigenvectors and Faster MMWU,"The online problem of computing the top eigenvector is fundamental to machine
learning. In both adversarial and stochastic settings, previous results (such
as matrix multiplicative weight update, follow the regularized leader, follow
the compressed leader, block power method) either achieve optimal regret but
run slow, or run fast at the expense of loosing a $\sqrt{d}$ factor in total
regret where $d$ is the matrix dimension.
  We propose a $\textit{follow-the-compressed-leader (FTCL)}$ framework which
achieves optimal regret without sacrificing the running time. Our idea is to
""compress"" the matrix strategy to dimension 3 in the adversarial setting, or
dimension 1 in the stochastic setting. These respectively resolve two open
questions regarding the design of optimal and efficient algorithms for the
online eigenvector problem.","['Zeyuan Allen-Zhu', 'Yuanzhi Li']","['cs.LG', 'cs.DS', 'math.OC', 'stat.ML']",2017-01-06 18:43:53+00:00
http://arxiv.org/abs/1701.01672v2,Detecting changes in slope with an $L_0$ penalty,"Whilst there are many approaches to detecting changes in mean for a
univariate time-series, the problem of detecting multiple changes in slope has
comparatively been ignored. Part of the reason for this is that detecting
changes in slope is much more challenging. For example, simple binary
segmentation procedures do not work for this problem, whilst efficient dynamic
programming methods that work well for the change in mean problem cannot be
directly used for detecting changes in slope. We present a novel dynamic
programming approach, CPOP, for finding the ""best"" continuous piecewise-linear
fit to data. We define best based on a criterion that measures fit to data
using the residual sum of squares, but penalises complexity based on an $L_0$
penalty on changes in slope. We show that using such a criterion is more
reliable at estimating changepoint locations than approaches that penalise
complexity using an $L_1$ penalty. Empirically CPOP has good computational
properties, and can analyse a time-series with over 10,000 observations and
over 100 changes in a few minutes. Our method is used to analyse data on the
motion of bacteria, and provides fits to the data that both have substantially
smaller residual sum of squares and are more parsimonious than two competing
approaches.","['Robert Maidstone', 'Paul Fearnhead', 'Adam Letchford']","['stat.CO', 'stat.ME', 'stat.ML']",2017-01-06 15:52:45+00:00
http://arxiv.org/abs/1701.01437v2,NIPS 2016 Workshop on Representation Learning in Artificial and Biological Neural Networks (MLINI 2016),"This workshop explores the interface between cognitive neuroscience and
recent advances in AI fields that aim to reproduce human performance such as
natural language processing and computer vision, and specifically deep learning
approaches to such problems.
  When studying the cognitive capabilities of the brain, scientists follow a
system identification approach in which they present different stimuli to the
subjects and try to model the response that different brain areas have of that
stimulus. The goal is to understand the brain by trying to find the function
that expresses the activity of brain areas in terms of different properties of
the stimulus. Experimental stimuli are becoming increasingly complex with more
and more people being interested in studying real life phenomena such as the
perception of natural images or natural sentences. There is therefore a need
for a rich and adequate vector representation of the properties of the
stimulus, that we can obtain using advances in machine learning.
  In parallel, new ML approaches, many of which in deep learning, are inspired
to a certain extent by human behavior or biological principles. Neural networks
for example were originally inspired by biological neurons. More recently,
processes such as attention are being used which have are inspired by human
behavior. However, the large bulk of these methods are independent of findings
about brain function, and it is unclear whether it is at all beneficial for
machine learning to try to emulate brain function in order to achieve the same
tasks that the brain achieves.","['Leila Wehbe', 'Anwar Nunez-Elizalde', 'Marcel van Gerven', 'Irina Rish', 'Brian Murphy', 'Moritz Grosse-Wentrup', 'Georg Langs', 'Guillermo Cecchi']",['stat.ML'],2017-01-06 14:58:34+00:00
http://arxiv.org/abs/1701.01582v2,Learning Sparse Structural Changes in High-dimensional Markov Networks: A Review on Methodologies and Theories,"Recent years have seen an increasing popularity of learning the sparse
\emph{changes} in Markov Networks. Changes in the structure of Markov Networks
reflect alternations of interactions between random variables under different
regimes and provide insights into the underlying system. While each individual
network structure can be complicated and difficult to learn, the overall change
from one network to another can be simple. This intuition gave birth to an
approach that \emph{directly} learns the sparse changes without modelling and
learning the individual (possibly dense) networks. In this paper, we review
such a direct learning method with some latest developments along this line of
research.","['Song Liu', 'Kenji Fukumizu', 'Taiji Suzuki']",['stat.ML'],2017-01-06 09:30:22+00:00
http://arxiv.org/abs/1701.01470v1,Graph Structure Learning from Unlabeled Data for Event Detection,"Processes such as disease propagation and information diffusion often spread
over some latent network structure which must be learned from observation.
Given a set of unlabeled training examples representing occurrences of an event
type of interest (e.g., a disease outbreak), our goal is to learn a graph
structure that can be used to accurately detect future events of that type.
Motivated by new theoretical results on the consistency of constrained and
unconstrained subset scans, we propose a novel framework for learning graph
structure from unlabeled data by comparing the most anomalous subsets detected
with and without the graph constraints. Our framework uses the mean normalized
log-likelihood ratio score to measure the quality of a graph structure, and
efficiently searches for the highest-scoring graph structure. Using simulated
disease outbreaks injected into real-world Emergency Department data from
Allegheny County, we show that our method learns a structure similar to the
true underlying graph, but enables faster and more accurate detection.","['Sriram Somanchi', 'Daniel B. Neill']","['stat.ML', 'cs.SI']",2017-01-05 20:34:57+00:00
