id,title,abstract,authors,categories,date
http://arxiv.org/abs/1511.08768v2,Gradient Estimation with Simultaneous Perturbation and Compressive Sensing,"This paper aims at achieving a ""good"" estimator for the gradient of a
function on a high-dimensional space. Often such functions are not sensitive in
all coordinates and the gradient of the function is almost sparse. We propose a
method for gradient estimation that combines ideas from Spall's Simultaneous
Perturbation Stochastic Approximation with compressive sensing. The aim is to
obtain ""good"" estimator without too many function evaluations. Application to
estimating gradient outer product matrix as well as standard optimization
problems are illustrated via simulations.","['Vivek S. Borkar', 'Vikranth R. Dwaracherla', 'Neeraja Sahasrabudhe']",['stat.ML'],2015-11-27 18:51:29+00:00
http://arxiv.org/abs/1511.08681v1,Algorithms for Differentially Private Multi-Armed Bandits,"We present differentially private algorithms for the stochastic Multi-Armed
Bandit (MAB) problem. This is a problem for applications such as adaptive
clinical trials, experiment design, and user-targeted advertising where private
information is connected to individual rewards. Our major contribution is to
show that there exist $(\epsilon, \delta)$ differentially private variants of
Upper Confidence Bound algorithms which have optimal regret, $O(\epsilon^{-1} +
\log T)$. This is a significant improvement over previous results, which only
achieve poly-log regret $O(\epsilon^{-2} \log^{2} T)$, because of our use of a
novel interval-based mechanism. We also substantially improve the bounds of
previous family of algorithms which use a continual release mechanism.
Experiments clearly validate our theoretical bounds.","['Aristide Tossou', 'Christos Dimitrakakis']","['stat.ML', 'cs.CR', 'cs.LG']",2015-11-27 14:16:00+00:00
http://arxiv.org/abs/1511.08551v2,Regularized EM Algorithms: A Unified Framework and Statistical Guarantees,"Latent variable models are a fundamental modeling tool in machine learning
applications, but they present significant computational and analytical
challenges. The popular EM algorithm and its variants, is a much used
algorithmic tool; yet our rigorous understanding of its performance is highly
incomplete. Recently, work in Balakrishnan et al. (2014) has demonstrated that
for an important class of problems, EM exhibits linear local convergence. In
the high-dimensional setting, however, the M-step may not be well defined. We
address precisely this setting through a unified treatment using
regularization. While regularization for high-dimensional problems is by now
well understood, the iterative EM algorithm requires a careful balancing of
making progress towards the solution while identifying the right structure
(e.g., sparsity or low-rank). In particular, regularizing the M-step using the
state-of-the-art high-dimensional prescriptions (e.g., Wainwright (2014)) is
not guaranteed to provide this balance. Our algorithm and analysis are linked
in a way that reveals the balance between optimization and statistical errors.
We specialize our general framework to sparse gaussian mixture models,
high-dimensional mixed regression, and regression with missing variables,
obtaining statistical guarantees for each of these examples.","['Xinyang Yi', 'Constantine Caramanis']","['cs.LG', 'stat.ML']",2015-11-27 03:46:36+00:00
http://arxiv.org/abs/1511.08405v1,Gains and Losses are Fundamentally Different in Regret Minimization: The Sparse Case,"We demonstrate that, in the classical non-stochastic regret minimization
problem with $d$ decisions, gains and losses to be respectively maximized or
minimized are fundamentally different. Indeed, by considering the additional
sparsity assumption (at each stage, at most $s$ decisions incur a nonzero
outcome), we derive optimal regret bounds of different orders. Specifically,
with gains, we obtain an optimal regret guarantee after $T$ stages of order
$\sqrt{T\log s}$, so the classical dependency in the dimension is replaced by
the sparsity size. With losses, we provide matching upper and lower bounds of
order $\sqrt{Ts\log(d)/d}$, which is decreasing in $d$. Eventually, we also
study the bandit setting, and obtain an upper bound of order $\sqrt{Ts\log
(d/s)}$ when outcomes are losses. This bound is proven to be optimal up to the
logarithmic factor $\sqrt{\log(d/s)}$.","['Joon Kwon', 'Vianney Perchet']","['cs.LG', 'stat.ML']",2015-11-26 14:53:00+00:00
http://arxiv.org/abs/1511.08400v7,Regularizing RNNs by Stabilizing Activations,"We stabilize the activations of Recurrent Neural Networks (RNNs) by
penalizing the squared distance between successive hidden states' norms.
  This penalty term is an effective regularizer for RNNs including LSTMs and
IRNNs, improving performance on character-level language modeling and phoneme
recognition, and outperforming weight noise and dropout.
  We achieve competitive performance (18.6\% PER) on the TIMIT phoneme
recognition task for RNNs evaluated without beam search or an RNN transducer.
  With this penalty term, IRNN can achieve similar performance to LSTM on
language modeling, although adding the penalty term to the LSTM results in
superior performance.
  Our penalty term also prevents the exponential growth of IRNN's activations
outside of their training horizon, allowing them to generalize to much longer
sequences.","['David Krueger', 'Roland Memisevic']","['cs.NE', 'cs.CL', 'cs.LG', 'stat.ML']",2015-11-26 14:35:27+00:00
http://arxiv.org/abs/1511.08343v2,The Automatic Statistician: A Relational Perspective,"Gaussian Processes (GPs) provide a general and analytically tractable way of
modeling complex time-varying, nonparametric functions. The Automatic Bayesian
Covariance Discovery (ABCD) system constructs natural-language description of
time-series data by treating unknown time-series data nonparametrically using
GP with a composite covariance kernel function. Unfortunately, learning a
composite covariance kernel with a single time-series data set often results in
less informative kernel that may not give qualitative, distinctive descriptions
of data. We address this challenge by proposing two relational kernel learning
methods which can model multiple time-series data sets by finding common,
shared causes of changes. We show that the relational kernel learning methods
find more accurate models for regression problems on several real-world data
sets; US stock data, US house price index data and currency exchange rate data.","['Yunseong Hwang', 'Anh Tong', 'Jaesik Choi']","['cs.LG', 'stat.ML']",2015-11-26 10:26:51+00:00
http://arxiv.org/abs/1511.08327v2,Random Forests for Big Data,"Big Data is one of the major challenges of statistical science and has
numerous consequences from algorithmic and theoretical viewpoints. Big Data
always involve massive data but they also often include online data and data
heterogeneity. Recently some statistical methods have been adapted to process
Big Data, like linear regression models, clustering methods and bootstrapping
schemes. Based on decision trees combined with aggregation and bootstrap ideas,
random forests were introduced by Breiman in 2001. They are a powerful
nonparametric statistical method allowing to consider in a single and versatile
framework regression problems, as well as two-class and multi-class
classification problems. Focusing on classification problems, this paper
proposes a selective review of available proposals that deal with scaling
random forests to Big Data problems. These proposals rely on parallel
environments or on online adaptations of random forests. We also describe how
related quantities -- such as out-of-bag error and variable importance -- are
addressed in these methods. Then, we formulate various remarks for random
forests in the Big Data context. Finally, we experiment five variants on two
massive datasets (15 and 120 millions of observations), a simulated one as well
as real world data. One variant relies on subsampling while three others are
related to parallel implementations of random forests and involve either
various adaptations of bootstrap to Big Data or to ""divide-and-conquer""
approaches. The fifth variant relates on online learning of random forests.
These numerical experiments lead to highlight the relative performance of the
different variants, as well as some of their limitations.","['Robin Genuer', 'Jean-Michel Poggi', 'Christine Tuleau-Malot', 'Nathalie Villa-Vialaneix']","['stat.ML', 'cs.LG', 'math.ST', 'stat.TH']",2015-11-26 09:04:47+00:00
http://arxiv.org/abs/1511.08136v5,Unifying Decision Trees Split Criteria Using Tsallis Entropy,"The construction of efficient and effective decision trees remains a key
topic in machine learning because of their simplicity and flexibility. A lot of
heuristic algorithms have been proposed to construct near-optimal decision
trees. ID3, C4.5 and CART are classical decision tree algorithms and the split
criteria they used are Shannon entropy, Gain Ratio and Gini index respectively.
All the split criteria seem to be independent, actually, they can be unified in
a Tsallis entropy framework. Tsallis entropy is a generalization of Shannon
entropy and provides a new approach to enhance decision trees' performance with
an adjustable parameter $q$. In this paper, a Tsallis Entropy Criterion (TEC)
algorithm is proposed to unify Shannon entropy, Gain Ratio and Gini index,
which generalizes the split criteria of decision trees. More importantly, we
reveal the relations between Tsallis entropy with different $q$ and other split
criteria. Experimental results on UCI data sets indicate that the TEC algorithm
achieves statistically significant improvement over the classical algorithms.","['Yisen Wang', 'Chaobing Song', 'Shu-Tao Xia']","['stat.ML', 'cs.AI', 'cs.LG']",2015-11-25 17:49:55+00:00
http://arxiv.org/abs/1511.08102v3,L1-Regularized Least Squares for Support Recovery of High Dimensional Single Index Models with Gaussian Designs,"It is known that for a certain class of single index models (SIMs) $Y =
f(\boldsymbol{X}_{p \times 1}^\intercal\boldsymbol{\beta}_0, \varepsilon)$,
support recovery is impossible when $\boldsymbol{X} \sim \mathcal{N}(0,
\mathbb{I}_{p \times p})$ and a model complexity adjusted sample size is below
a critical threshold. Recently, optimal algorithms based on Sliced Inverse
Regression (SIR) were suggested. These algorithms work provably under the
assumption that the design $\boldsymbol{X}$ comes from an i.i.d. Gaussian
distribution. In the present paper we analyze algorithms based on covariance
screening and least squares with $L_1$ penalization (i.e. LASSO) and
demonstrate that they can also enjoy optimal (up to a scalar) rescaled sample
size in terms of support recovery, albeit under slightly different assumptions
on $f$ and $\varepsilon$ compared to the SIR based algorithms. Furthermore, we
show more generally, that LASSO succeeds in recovering the signed support of
$\boldsymbol{\beta}_0$ if $\boldsymbol{X} \sim \mathcal{N}(0,
\boldsymbol{\Sigma})$, and the covariance $\boldsymbol{\Sigma}$ satisfies the
irrepresentable condition. Our work extends existing results on the support
recovery of LASSO for the linear model, to a more general class of SIMs.","['Matey Neykov', 'Jun S. Liu', 'Tianxi Cai']","['math.ST', 'stat.ML', 'stat.TH']",2015-11-25 16:00:44+00:00
http://arxiv.org/abs/1511.09123v1,A Short Survey on Data Clustering Algorithms,"With rapidly increasing data, clustering algorithms are important tools for
data analytics in modern research. They have been successfully applied to a
wide range of domains; for instance, bioinformatics, speech recognition, and
financial analysis. Formally speaking, given a set of data instances, a
clustering algorithm is expected to divide the set of data instances into the
subsets which maximize the intra-subset similarity and inter-subset
dissimilarity, where a similarity measure is defined beforehand. In this work,
the state-of-the-arts clustering algorithms are reviewed from design concept to
methodology; Different clustering paradigms are discussed. Advanced clustering
algorithms are also discussed. After that, the existing clustering evaluation
metrics are reviewed. A summary with future insights is provided at the end.",['Ka-Chun Wong'],"['cs.DS', 'cs.CV', 'cs.LG', 'stat.CO', 'stat.ML']",2015-11-25 08:02:37+00:00
http://arxiv.org/abs/1511.07944v1,Maximum Likelihood Estimation for Single Linkage Hierarchical Clustering,"We derive a statistical model for estimation of a dendrogram from single
linkage hierarchical clustering (SLHC) that takes account of uncertainty
through noise or corruption in the measurements of separation of data. Our
focus is on just the estimation of the hierarchy of partitions afforded by the
dendrogram, rather than the heights in the latter. The concept of estimating
this ""dendrogram structure'' is introduced, and an approximate maximum
likelihood estimator (MLE) for the dendrogram structure is described. These
ideas are illustrated by a simple Monte Carlo simulation that, at least for
small data sets, suggests the method outperforms SLHC in the presence of noise.","['Dekang Zhu', 'Dan P. Guralnik', 'Xuezhi Wang', 'Xiang Li', 'Bill Moran']",['stat.ML'],2015-11-25 03:35:46+00:00
http://arxiv.org/abs/1511.07916v1,Natural Language Understanding with Distributed Representation,"This is a lecture note for the course DS-GA 3001 <Natural Language
Understanding with Distributed Representation> at the Center for Data Science ,
New York University in Fall, 2015. As the name of the course suggests, this
lecture note introduces readers to a neural network based approach to natural
language understanding/processing. In order to make it as self-contained as
possible, I spend much time on describing basics of machine learning and neural
networks, only after which how they are used for natural languages is
introduced. On the language front, I almost solely focus on language modelling
and machine translation, two of which I personally find most fascinating and
most fundamental to natural language understanding.",['Kyunghyun Cho'],"['cs.CL', 'stat.ML']",2015-11-24 23:23:13+00:00
http://arxiv.org/abs/1511.07902v4,"Performance Limits of Stochastic Sub-Gradient Learning, Part I: Single Agent Case","In this work and the supporting Part II, we examine the performance of
stochastic sub-gradient learning strategies under weaker conditions than
usually considered in the literature. The new conditions are shown to be
automatically satisfied by several important cases of interest including SVM,
LASSO, and Total-Variation denoising formulations. In comparison, these
problems do not satisfy the traditional assumptions used in prior analyses and,
therefore, conclusions derived from these earlier treatments are not directly
applicable to these problems. The results in this article establish that
stochastic sub-gradient strategies can attain linear convergence rates, as
opposed to sub-linear rates, to the steady-state regime. A realizable
exponential-weighting procedure is employed to smooth the intermediate iterates
and guarantee useful performance bounds in terms of convergence rate and
excessive risk performance. Part I of this work focuses on single-agent
scenarios, which are common in stand-alone learning applications, while Part II
extends the analysis to networked learners. The theoretical conclusions are
illustrated by several examples and simulations, including comparisons with the
FISTA procedure.","['Bicheng Ying', 'Ali H. Sayed']","['stat.ML', 'cs.LG', 'cs.MA']",2015-11-24 22:31:19+00:00
http://arxiv.org/abs/1511.07896v1,Private Posterior distributions from Variational approximations,"Privacy preserving mechanisms such as differential privacy inject additional
randomness in the form of noise in the data, beyond the sampling mechanism.
Ignoring this additional noise can lead to inaccurate and invalid inferences.
In this paper, we incorporate the privacy mechanism explicitly into the
likelihood function by treating the original data as missing, with an end goal
of estimating posterior distributions over model parameters. This leads to a
principled way of performing valid statistical inference using private data,
however, the corresponding likelihoods are intractable. In this paper, we
derive fast and accurate variational approximations to tackle such intractable
likelihoods that arise due to privacy. We focus on estimating posterior
distributions of parameters of the naive Bayes log-linear model, where the
sufficient statistics of this model are shared using a differentially private
interface. Using a simulation study, we show that the posterior approximations
outperform the naive method of ignoring the noise addition mechanism.","['Vishesh Karwa', 'Dan Kifer', 'Aleksandra B. Slavković']","['stat.ML', 'cs.CR', 'cs.LG']",2015-11-24 21:49:02+00:00
http://arxiv.org/abs/1511.07837v3,Generalized Conjugate Gradient Methods for $\ell_1$ Regularized Convex Quadratic Programming with Finite Convergence,"The conjugate gradient (CG) method is an efficient iterative method for
solving large-scale strongly convex quadratic programming (QP). In this paper
we propose some generalized CG (GCG) methods for solving the
$\ell_1$-regularized (possibly not strongly) convex QP that terminate at an
optimal solution in a finite number of iterations. At each iteration, our
methods first identify a face of an orthant and then either perform an exact
line search along the direction of the negative projected minimum-norm
subgradient of the objective function or execute a CG subroutine that conducts
a sequence of CG iterations until a CG iterate crosses the boundary of this
face or an approximate minimizer of over this face or a subface is found. We
determine which type of step should be taken by comparing the magnitude of some
components of the minimum-norm subgradient of the objective function to that of
its rest components. Our analysis on finite convergence of these methods makes
use of an error bound result and some key properties of the aforementioned
exact line search and the CG subroutine. We also show that the proposed methods
are capable of finding an approximate solution of the problem by allowing some
inexactness on the execution of the CG subroutine. The overall arithmetic
operation cost of our GCG methods for finding an $\epsilon$-optimal solution
depends on $\epsilon$ in $O(\log(1/\epsilon))$, which is superior to the
accelerated proximal gradient method [2,23] that depends on $\epsilon$ in
$O(1/\sqrt{\epsilon})$. In addition, our GCG methods can be extended
straightforwardly to solve box-constrained convex QP with finite convergence.
Numerical results demonstrate that our methods are very favorable for solving
ill-conditioned problems.","['Zhaosong Lu', 'Xiaojun Chen']","['math.OC', 'cs.LG', 'math.NA', 'stat.CO', 'stat.ML', '65C60, 65K05, 65Y20, 90C06, 90C20, 90C25']",2015-11-24 19:28:09+00:00
http://arxiv.org/abs/1511.07827v2,Stopping criteria for boosting automatic experimental design using real-time fMRI with Bayesian optimization,"Bayesian optimization has been proposed as a practical and efficient tool
through which to tune parameters in many difficult settings. Recently, such
techniques have been combined with real-time fMRI to propose a novel framework
which turns on its head the conventional functional neuroimaging approach. This
closed-loop method automatically designs the optimal experiment to evoke a
desired target brain pattern. One of the challenges associated with extending
such methods to real-time brain imaging is the need for adequate stopping
criteria, an aspect of Bayesian optimization which has received limited
attention. In light of high scanning costs and limited attentional capacities
of subjects an accurate and reliable stopping criteria is essential. In order
to address this issue we propose and empirically study the performance of two
stopping criteria.","['Romy Lorenz', 'Ricardo P Monti', 'Ines R Violante', 'Aldo A Faisal', 'Christoforos Anagnostopoulos', 'Robert Leech', 'Giovanni Montana']","['q-bio.NC', 'stat.ML']",2015-11-24 18:28:54+00:00
http://arxiv.org/abs/1511.07715v2,Statistical Properties of the Single Linkage Hierarchical Clustering Estimator,"Distance-based hierarchical clustering (HC) methods are widely used in
unsupervised data analysis but few authors take account of uncertainty in the
distance data. We incorporate a statistical model of the uncertainty through
corruption or noise in the pairwise distances and investigate the problem of
estimating the HC as unknown parameters from measurements. Specifically, we
focus on single linkage hierarchical clustering (SLHC) and study its geometry.
We prove that under fairly reasonable conditions on the probability
distribution governing measurements, SLHC is equivalent to maximum partial
profile likelihood estimation (MPPLE) with some of the information contained in
the data ignored. At the same time, we show that direct evaluation of SLHC on
maximum likelihood estimation (MLE) of pairwise distances yields a consistent
estimator. Consequently, a full MLE is expected to perform better than SLHC in
getting the correct HC results for the ground truth metric.","['Dekang Zhu', 'Dan P. Guralnik', 'Xuezhi Wang', 'Xiang Li', 'Bill Moran']",['stat.ML'],2015-11-24 14:15:11+00:00
http://arxiv.org/abs/1511.07551v1,Transductive Log Opinion Pool of Gaussian Process Experts,"We introduce a framework for analyzing transductive combination of Gaussian
process (GP) experts, where independently trained GP experts are combined in a
way that depends on test point location, in order to scale GPs to big data. The
framework provides some theoretical justification for the generalized product
of GP experts (gPoE-GP) which was previously shown to work well in practice but
lacks theoretical basis. Based on the proposed framework, an improvement over
gPoE-GP is introduced and empirically validated.","['Yanshuai Cao', 'David J. Fleet']","['cs.LG', 'stat.ML']",2015-11-24 03:08:59+00:00
http://arxiv.org/abs/1511.07528v1,The Limitations of Deep Learning in Adversarial Settings,"Deep learning takes advantage of large datasets and computationally efficient
training algorithms to outperform other approaches at various machine learning
tasks. However, imperfections in the training phase of deep neural networks
make them vulnerable to adversarial samples: inputs crafted by adversaries with
the intent of causing deep neural networks to misclassify. In this work, we
formalize the space of adversaries against deep neural networks (DNNs) and
introduce a novel class of algorithms to craft adversarial samples based on a
precise understanding of the mapping between inputs and outputs of DNNs. In an
application to computer vision, we show that our algorithms can reliably
produce samples correctly classified by human subjects but misclassified in
specific targets by a DNN with a 97% adversarial success rate while only
modifying on average 4.02% of the input features per sample. We then evaluate
the vulnerability of different sample classes to adversarial perturbations by
defining a hardness measure. Finally, we describe preliminary work outlining
defenses against adversarial samples by defining a predictive measure of
distance between a benign input and a target classification.","['Nicolas Papernot', 'Patrick McDaniel', 'Somesh Jha', 'Matt Fredrikson', 'Z. Berkay Celik', 'Ananthram Swami']","['cs.CR', 'cs.LG', 'cs.NE', 'stat.ML']",2015-11-24 01:07:08+00:00
http://arxiv.org/abs/1511.07428v3,Estimating the number of unseen species: A bird in the hand is worth $\log n $ in the bush,"Estimating the number of unseen species is an important problem in many
scientific endeavors. Its most popular formulation, introduced by Fisher, uses
$n$ samples to predict the number $U$ of hitherto unseen species that would be
observed if $t\cdot n$ new samples were collected. Of considerable interest is
the largest ratio $t$ between the number of new and existing samples for which
$U$ can be accurately predicted.
  In seminal works, Good and Toulmin constructed an intriguing estimator that
predicts $U$ for all $t\le 1$, thereby showing that the number of species can
be estimated for a population twice as large as that observed. Subsequently
Efron and Thisted obtained a modified estimator that empirically predicts $U$
even for some $t>1$, but without provable guarantees.
  We derive a class of estimators that $\textit{provably}$ predict $U$ not just
for constant $t>1$, but all the way up to $t$ proportional to $\log n$. This
shows that the number of species can be estimated for a population $\log n$
times larger than that observed, a factor that grows arbitrarily large as $n$
increases. We also show that this range is the best possible and that the
estimators' mean-square error is optimal up to constants for any $t$. Our
approach yields the first provable guarantee for the Efron-Thisted estimator
and, in addition, a variant which achieves stronger theoretical and
experimental performance than existing methodologies on a variety of synthetic
and real datasets.
  The estimators we derive are simple linear estimators that are computable in
time proportional to $n$. The performance guarantees hold uniformly for all
distributions, and apply to all four standard sampling models commonly used
across various scientific disciplines: multinomial, Poisson, hypergeometric,
and Bernoulli product.","['Alon Orlitsky', 'Ananda Theertha Suresh', 'Yihong Wu']","['math.ST', 'stat.ML', 'stat.TH']",2015-11-23 20:58:55+00:00
