id,title,abstract,authors,categories,date
http://arxiv.org/abs/2106.14588v1,The Convergence Rate of SGD's Final Iterate: Analysis on Dimension Dependence,"Stochastic Gradient Descent (SGD) is among the simplest and most popular
methods in optimization. The convergence rate for SGD has been extensively
studied and tight analyses have been established for the running average
scheme, but the sub-optimality of the final iterate is still not
well-understood. shamir2013stochastic gave the best known upper bound for the
final iterate of SGD minimizing non-smooth convex functions, which is $O(\log
T/\sqrt{T})$ for Lipschitz convex functions and $O(\log T/ T)$ with additional
assumption on strongly convexity. The best known lower bounds, however, are
worse than the upper bounds by a factor of $\log T$. harvey2019tight gave
matching lower bounds but their construction requires dimension $d= T$. It was
then asked by koren2020open how to characterize the final-iterate convergence
of SGD in the constant dimension setting.
  In this paper, we answer this question in the more general setting for any
$d\leq T$, proving $\Omega(\log d/\sqrt{T})$ and $\Omega(\log d/T)$ lower
bounds for the sub-optimality of the final iterate of SGD in minimizing
non-smooth Lipschitz convex and strongly convex functions respectively with
standard step size schedules. Our results provide the first general dimension
dependent lower bound on the convergence of SGD's final iterate, partially
resolving a COLT open question raised by koren2020open. We also present further
evidence to show the correct rate in one dimension should be
$\Theta(1/\sqrt{T})$, such as a proof of a tight $O(1/\sqrt{T})$ upper bound
for one-dimensional special cases in settings more general than koren2020open.","['Daogao Liu', 'Zhou Lu']","['math.OC', 'cs.LG', 'stat.ML']",2021-06-28 11:51:04+00:00
http://arxiv.org/abs/2106.14565v3,Variance Reduction for Matrix Computations with Applications to Gaussian Processes,"In addition to recent developments in computing speed and memory,
methodological advances have contributed to significant gains in the
performance of stochastic simulation. In this paper, we focus on variance
reduction for matrix computations via matrix factorization. We provide insights
into existing variance reduction methods for estimating the entries of large
matrices. Popular methods do not exploit the reduction in variance that is
possible when the matrix is factorized. We show how computing the square root
factorization of the matrix can achieve in some important cases arbitrarily
better stochastic performance. In addition, we propose a factorized estimator
for the trace of a product of matrices and numerically demonstrate that the
estimator can be up to 1,000 times more efficient on certain problems of
estimating the log-likelihood of a Gaussian process. Additionally, we provide a
new estimator of the log-determinant of a positive semi-definite matrix where
the log-determinant is treated as a normalizing constant of a probability
density.","['Anant Mathur', 'Sarat Moka', 'Zdravko Botev']","['stat.ML', 'cs.LG', 'stat.CO']",2021-06-28 10:41:22+00:00
http://arxiv.org/abs/2106.14406v1,Poisoning the Search Space in Neural Architecture Search,"Deep learning has proven to be a highly effective problem-solving tool for
object detection and image segmentation across various domains such as
healthcare and autonomous driving. At the heart of this performance lies neural
architecture design which relies heavily on domain knowledge and prior
experience on the researchers' behalf. More recently, this process of finding
the most optimal architectures, given an initial search space of possible
operations, was automated by Neural Architecture Search (NAS). In this paper,
we evaluate the robustness of one such algorithm known as Efficient NAS (ENAS)
against data agnostic poisoning attacks on the original search space with
carefully designed ineffective operations. By evaluating algorithm performance
on the CIFAR-10 dataset, we empirically demonstrate how our novel search space
poisoning (SSP) approach and multiple-instance poisoning attacks exploit design
flaws in the ENAS controller to result in inflated prediction error rates for
child networks. Our results provide insights into the challenges to surmount in
using NAS for more adversarially robust architecture search.","['Robert Wu', 'Nayan Saxena', 'Rohan Jain']","['cs.LG', 'cs.CR', 'cs.NE', 'stat.ML']",2021-06-28 05:45:57+00:00
http://arxiv.org/abs/2106.14384v2,Towards Model-informed Precision Dosing with Expert-in-the-loop Machine Learning,"Machine Learning (ML) and its applications have been transforming our lives
but it is also creating issues related to the development of fair, accountable,
transparent, and ethical Artificial Intelligence. As the ML models are not
fully comprehensible yet, it is obvious that we still need humans to be part of
algorithmic decision-making processes. In this paper, we consider a ML
framework that may accelerate model learning and improve its interpretability
by incorporating human experts into the model learning loop. We propose a novel
human-in-the-loop ML framework aimed at dealing with learning problems that the
cost of data annotation is high and the lack of appropriate data to model the
association between the target tasks and the input features. With an
application to precision dosing, our experimental results show that the
approach can learn interpretable rules from data and may potentially lower
experts' workload by replacing data annotation with rule representation
editing. The approach may also help remove algorithmic bias by introducing
experts' feedback into the iterative model learning process.","['Yihuang Kang', 'Yi-Wen Chiu', 'Ming-Yen Lin', 'Fang-yi Su', 'Sheng-Tai Huang']","['stat.AP', 'cs.LG', 'stat.ML']",2021-06-28 03:45:09+00:00
http://arxiv.org/abs/2106.14352v1,Instance-optimality in optimal value estimation: Adaptivity via variance-reduced Q-learning,"Various algorithms in reinforcement learning exhibit dramatic variability in
their convergence rates and ultimate accuracy as a function of the problem
structure. Such instance-specific behavior is not captured by existing global
minimax bounds, which are worst-case in nature. We analyze the problem of
estimating optimal $Q$-value functions for a discounted Markov decision process
with discrete states and actions and identify an instance-dependent functional
that controls the difficulty of estimation in the $\ell_\infty$-norm. Using a
local minimax framework, we show that this functional arises in lower bounds on
the accuracy on any estimation procedure. In the other direction, we establish
the sharpness of our lower bounds, up to factors logarithmic in the state and
action spaces, by analyzing a variance-reduced version of $Q$-learning. Our
theory provides a precise way of distinguishing ""easy"" problems from ""hard""
ones in the context of $Q$-learning, as illustrated by an ensemble with a
continuum of difficulty.","['Koulik Khamaru', 'Eric Xia', 'Martin J. Wainwright', 'Michael I. Jordan']","['stat.ML', 'cs.LG']",2021-06-28 00:38:54+00:00
http://arxiv.org/abs/2106.14343v2,High-probability Bounds for Non-Convex Stochastic Optimization with Heavy Tails,"We consider non-convex stochastic optimization using first-order algorithms
for which the gradient estimates may have heavy tails. We show that a
combination of gradient clipping, momentum, and normalized gradient descent
yields convergence to critical points in high-probability with best-known rates
for smooth losses when the gradients only have bounded $\mathfrak{p}$th moments
for some $\mathfrak{p}\in(1,2]$. We then consider the case of second-order
smooth losses, which to our knowledge have not been studied in this setting,
and again obtain high-probability bounds for any $\mathfrak{p}$. Moreover, our
results hold for arbitrary smooth norms, in contrast to the typical SGD
analysis which requires a Hilbert space norm. Further, we show that after a
suitable ""burn-in"" period, the objective value will monotonically decrease for
every iteration until a critical point is identified, which provides intuition
behind the popular practice of learning rate ""warm-up"" and also yields a
last-iterate guarantee.","['Ashok Cutkosky', 'Harsh Mehta']","['cs.LG', 'math.OC', 'stat.ML']",2021-06-28 00:17:01+00:00
http://arxiv.org/abs/2106.14342v1,Stabilizing Equilibrium Models by Jacobian Regularization,"Deep equilibrium networks (DEQs) are a new class of models that eschews
traditional depth in favor of finding the fixed point of a single nonlinear
layer. These models have been shown to achieve performance competitive with the
state-of-the-art deep networks while using significantly less memory. Yet they
are also slower, brittle to architectural choices, and introduce potential
instability to the model. In this paper, we propose a regularization scheme for
DEQ models that explicitly regularizes the Jacobian of the fixed-point update
equations to stabilize the learning of equilibrium models. We show that this
regularization adds only minimal computational cost, significantly stabilizes
the fixed-point convergence in both forward and backward passes, and scales
well to high-dimensional, realistic domains (e.g., WikiText-103 language
modeling and ImageNet classification). Using this method, we demonstrate, for
the first time, an implicit-depth model that runs with approximately the same
speed and level of performance as popular conventional deep networks such as
ResNet-101, while still maintaining the constant memory footprint and
architectural simplicity of DEQs. Code is available at
https://github.com/locuslab/deq .","['Shaojie Bai', 'Vladlen Koltun', 'J. Zico Kolter']","['cs.LG', 'stat.ML']",2021-06-28 00:14:11+00:00
http://arxiv.org/abs/2106.14338v1,Regret Analysis in Deterministic Reinforcement Learning,"We consider Markov Decision Processes (MDPs) with deterministic transitions
and study the problem of regret minimization, which is central to the analysis
and design of optimal learning algorithms. We present logarithmic
problem-specific regret lower bounds that explicitly depend on the system
parameter (in contrast to previous minimax approaches) and thus, truly quantify
the fundamental limit of performance achievable by any learning algorithm.
Deterministic MDPs can be interpreted as graphs and analyzed in terms of their
cycles, a fact which we leverage in order to identify a class of deterministic
MDPs whose regret lower bound can be determined numerically. We further
exemplify this result on a deterministic line search problem, and a
deterministic MDP with state-dependent rewards, whose regret lower bounds we
can state explicitly. These bounds share similarities with the known
problem-specific bound of the multi-armed bandit problem and suggest that
navigation on a deterministic MDP need not have an effect on the performance of
a learning algorithm.","['Damianos Tranos', 'Alexandre Proutiere']","['cs.LG', 'stat.ML']",2021-06-27 23:41:57+00:00
http://arxiv.org/abs/2106.14324v2,Learning stochastic object models from medical imaging measurements by use of advanced ambient generative adversarial networks,"Purpose: To objectively assess new medical imaging technologies via
computer-simulations, it is important to account for the variability in the
ensemble of objects to be imaged. This source of variability can be described
by stochastic object models (SOMs). It is generally desirable to establish SOMs
from experimental imaging measurements acquired by use of a well-characterized
imaging system, but this task has remained challenging. Approach: A generative
adversarial network (GAN)-based method that employs AmbientGANs with modern
progressive or multiresolution training approaches is proposed. AmbientGANs
established using the proposed training procedure are systematically validated
in a controlled way using computer-simulated magnetic resonance imaging (MRI)
data corresponding to a stylized imaging system. Emulated single-coil
experimental MRI data are also employed to demonstrate the methods under less
stylized conditions. Results: The proposed AmbientGAN method can generate clean
images when the imaging measurements are contaminated by measurement noise.
When the imaging measurement data are incomplete, the proposed AmbientGAN can
reliably learn the distribution of the measurement components of the objects.
Conclusions: Both visual examinations and quantitative analyses, including
task-specific validations using the Hotelling observer, demonstrated that the
proposed AmbientGAN method holds promise to establish realistic SOMs from
imaging measurements.","['Weimin Zhou', 'Sayantan Bhadra', 'Frank J. Brooks', 'Hua Li', 'Mark A. Anastasio']","['eess.IV', 'cs.CV', 'cs.LG', 'stat.ML']",2021-06-27 21:46:23+00:00
http://arxiv.org/abs/2106.14323v2,Use of Variational Inference in Music Emotion Recognition,"This work was developed aiming to employ Statistical techniques to the field
of Music Emotion Recognition, a well-recognized area within the Signal
Processing world, but hardly explored from the statistical point of view. Here,
we opened several possibilities within the field, applying modern Bayesian
Statistics techniques and developing efficient algorithms, focusing on the
applicability of the results obtained. Although the motivation for this project
was the development of a emotion-based music recommendation system, its main
contribution is a highly adaptable multivariate model that can be useful
interpreting any database where there is an interest in applying regularization
in an efficient manner. Broadly speaking, we will explore what role a sound
theoretical statistical analysis can play in the modeling of an algorithm that
is able to understand a well-known database and what can be gained with this
kind of approach.","['Nathalie Deziderio', 'Hugo Tremonte de Carvalho']","['stat.ML', 'cs.LG', 'cs.SD', 'eess.AS']",2021-06-27 21:41:08+00:00
http://arxiv.org/abs/2106.14289v1,Global Convergence of Gradient Descent for Asymmetric Low-Rank Matrix Factorization,"We study the asymmetric low-rank factorization problem: \[\min_{\mathbf{U}
\in \mathbb{R}^{m \times d}, \mathbf{V} \in \mathbb{R}^{n \times d}}
\frac{1}{2}\|\mathbf{U}\mathbf{V}^\top -\mathbf{\Sigma}\|_F^2\] where
$\mathbf{\Sigma}$ is a given matrix of size $m \times n$ and rank $d$. This is
a canonical problem that admits two difficulties in optimization: 1)
non-convexity and 2) non-smoothness (due to unbalancedness of $\mathbf{U}$ and
$\mathbf{V}$). This is also a prototype for more complex problems such as
asymmetric matrix sensing and matrix completion. Despite being non-convex and
non-smooth, it has been observed empirically that the randomly initialized
gradient descent algorithm can solve this problem in polynomial time. Existing
theories to explain this phenomenon all require artificial modifications of the
algorithm, such as adding noise in each iteration and adding a balancing
regularizer to balance the $\mathbf{U}$ and $\mathbf{V}$.
  This paper presents the first proof that shows randomly initialized gradient
descent converges to a global minimum of the asymmetric low-rank factorization
problem with a polynomial rate. For the proof, we develop 1) a new
symmetrization technique to capture the magnitudes of the symmetry and
asymmetry, and 2) a quantitative perturbation analysis to approximate matrix
derivatives. We believe both are useful for other related non-convex problems.","['Tian Ye', 'Simon S. Du']","['math.OC', 'cs.LG', 'stat.ML']",2021-06-27 17:25:24+00:00
http://arxiv.org/abs/2106.14277v1,How many moments does MMD compare?,"We present a new way of study of Mercer kernels, by corresponding to a
special kernel $K$ a pseudo-differential operator $p({\mathbf x}, D)$ such that
$\mathcal{F} p({\mathbf x}, D)^\dag p({\mathbf x}, D) \mathcal{F}^{-1}$ acts on
smooth functions in the same way as an integral operator associated with $K$
(where $\mathcal{F}$ is the Fourier transform). We show that kernels defined by
pseudo-differential operators are able to approximate uniformly any continuous
Mercer kernel on a compact set.
  The symbol $p({\mathbf x}, {\mathbf y})$ encapsulates a lot of useful
information about the structure of the Maximum Mean Discrepancy distance
defined by the kernel $K$. We approximate $p({\mathbf x}, {\mathbf y})$ with
the sum of the first $r$ terms of the Singular Value Decomposition of $p$,
denoted by $p_r({\mathbf x}, {\mathbf y})$. If ordered singular values of the
integral operator associated with $p({\mathbf x}, {\mathbf y})$ die down
rapidly, the MMD distance defined by the new symbol $p_r$ differs from the
initial one only slightly. Moreover, the new MMD distance can be interpreted as
an aggregated result of comparing $r$ local moments of two probability
distributions.
  The latter results holds under the condition that right singular vectors of
the integral operator associated with $p$ are uniformly bounded. But even if
this is not satisfied we can still hold that the Hilbert-Schmidt distance
between $p$ and $p_r$ vanishes. Thus, we report an interesting phenomenon: the
MMD distance measures the difference of two probability distributions with
respect to a certain number of local moments, $r^\ast$, and this number
$r^\ast$ depends on the speed with which singular values of $p$ die down.",['Rustem Takhanov'],"['cs.LG', 'stat.ML']",2021-06-27 16:44:17+00:00
http://arxiv.org/abs/2106.14238v1,Interpretable Network Representation Learning with Principal Component Analysis,"We consider the problem of interpretable network representation learning for
samples of network-valued data. We propose the Principal Component Analysis for
Networks (PCAN) algorithm to identify statistically meaningful low-dimensional
representations of a network sample via subgraph count statistics. The PCAN
procedure provides an interpretable framework for which one can readily
visualize, explore, and formulate predictive models for network samples. We
furthermore introduce a fast sampling-based algorithm, sPCAN, which is
significantly more computationally efficient than its counterpart, but still
enjoys advantages of interpretability. We investigate the relationship between
these two methods and analyze their large-sample properties under the common
regime where the sample of networks is a collection of kernel-based random
graphs. We show that under this regime, the embeddings of the sPCAN method
enjoy a central limit theorem and moreover that the population level embeddings
of PCAN and sPCAN are equivalent. We assess PCAN's ability to visualize,
cluster, and classify observations in network samples arising in nature,
including functional connectivity network samples and dynamic networks
describing the political co-voting habits of the U.S. Senate. Our analyses
reveal that our proposed algorithm provides informative and discriminatory
features describing the networks in each sample. The PCAN and sPCAN methods
build on the current literature of network representation learning and set the
stage for a new line of research in interpretable learning on network-valued
data. Publicly available software for the PCAN and sPCAN methods are available
at https://www.github.com/jihuilee/.","['James D. Wilson', 'Jihui Lee']","['stat.ML', 'cs.LG', 'stat.ME']",2021-06-27 13:52:49+00:00
http://arxiv.org/abs/2106.14210v2,Nonparametric estimation of continuous DPPs with kernel methods,"Determinantal Point Process (DPPs) are statistical models for repulsive point
patterns. Both sampling and inference are tractable for DPPs, a rare feature
among models with negative dependence that explains their popularity in machine
learning and spatial statistics. Parametric and nonparametric inference methods
have been proposed in the finite case, i.e. when the point patterns live in a
finite ground set. In the continuous case, only parametric methods have been
investigated, while nonparametric maximum likelihood for DPPs -- an
optimization problem over trace-class operators -- has remained an open
question. In this paper, we show that a restricted version of this maximum
likelihood (MLE) problem falls within the scope of a recent representer theorem
for nonnegative functions in an RKHS. This leads to a finite-dimensional
problem, with strong statistical ties to the original MLE. Moreover, we
propose, analyze, and demonstrate a fixed point algorithm to solve this
finite-dimensional problem. Finally, we also provide a controlled estimate of
the correlation kernel of the DPP, thus providing more interpretability.","['Michaël Fanuel', 'Rémi Bardenet']","['cs.LG', 'stat.ML']",2021-06-27 11:57:14+00:00
http://arxiv.org/abs/2106.14177v1,On Hyperspectral Unmixing,"In this article the author reviews Jos\'e Bioucas-Dias' key contributions to
hyperspectral unmixing (HU), in memory of him as an influential scholar and for
his many beautiful ideas introduced to the hyperspectral community. Our story
will start with vertex component analysis (VCA) -- one of the most celebrated
HU algorithms, with more than 2,000 Google Scholar citations. VCA was
pioneering, invented at a time when HU research just began to emerge, and it
shows sharp insights on a then less-understood subject. Then we will turn to
SISAL, another widely-used algorithm. SISAL is not only a highly successful
algorithm, it is also a demonstration of its inventor's ingenuity on applied
optimization and on smart formulation for practical noisy cases. Our tour will
end with dependent component analysis (DECA), perhaps a less well-known
contribution. DECA adopts a statistical inference framework, and the author's
latest research indicates that such framework has great potential for further
development, e.g., there are hidden connections between SISAL and DECA. The
development of DECA shows foresight years ahead, in that regard.",['Wing-Kin Ma'],"['eess.SP', 'stat.ML']",2021-06-27 09:30:57+00:00
http://arxiv.org/abs/2106.15400v1,Online Interaction Detection for Click-Through Rate Prediction,"Click-Through Rate prediction aims to predict the ratio of clicks to
impressions of a specific link. This is a challenging task since (1) there are
usually categorical features, and the inputs will be extremely high-dimensional
if one-hot encoding is applied, (2) not only the original features but also
their interactions are important, (3) an effective prediction may rely on
different features and interactions in different time periods. To overcome
these difficulties, we propose a new interaction detection method, named Online
Random Intersection Chains. The method, which is based on the idea of frequent
itemset mining, detects informative interactions by observing the intersections
of randomly chosen samples. The discovered interactions enjoy high
interpretability as they can be comprehended as logical expressions. ORIC can
be updated every time new data is collected, without being retrained on
historical data. What's more, the importance of the historical and latest data
can be controlled by a tuning parameter. A framework is designed to deal with
the streaming interactions, so almost all existing models for CTR prediction
can be applied after interaction detection. Empirical results demonstrate the
efficiency and effectiveness of ORIC on three benchmark datasets.","['Qiuqiang Lin', 'Chuanhou Gao']","['cs.LG', 'stat.ML']",2021-06-27 06:34:03+00:00
http://arxiv.org/abs/2106.14122v1,Score-Based Change Detection for Gradient-Based Learning Machines,"The widespread use of machine learning algorithms calls for automatic change
detection algorithms to monitor their behavior over time. As a machine learning
algorithm learns from a continuous, possibly evolving, stream of data, it is
desirable and often critical to supplement it with a companion change detection
algorithm to facilitate its monitoring and control. We present a generic
score-based change detection method that can detect a change in any number of
components of a machine learning model trained via empirical risk minimization.
This proposed statistical hypothesis test can be readily implemented for such
models designed within a differentiable programming framework. We establish the
consistency of the hypothesis test and show how to calibrate it to achieve a
prescribed false alarm rate. We illustrate the versatility of the approach on
synthetic and real data.","['Lang Liu', 'Joseph Salmon', 'Zaid Harchaoui']","['stat.ML', 'cs.LG']",2021-06-27 01:38:11+00:00
